Difficulty,Title,Frequency,Acceptance Rate,Link,Topics
MEDIUM,Stone Game VII,100.0,0.582022237768483,https://leetcode.com/problems/stone-game-vii,"Array, Math, Dynamic Programming, Game Theory"
HARD,Build Array Where You Can Find The Maximum Exactly K Comparisons,100.0,0.6736741424144905,https://leetcode.com/problems/build-array-where-you-can-find-the-maximum-exactly-k-comparisons,"Dynamic Programming, Prefix Sum"
MEDIUM,Number of Distinct Substrings in a String,100.0,0.6439265318722025,https://leetcode.com/problems/number-of-distinct-substrings-in-a-string,"String, Trie, Rolling Hash, Suffix Array, Hash Function"
HARD,Number of Ways to Form a Target String Given a Dictionary,100.0,0.5724272424527619,https://leetcode.com/problems/number-of-ways-to-form-a-target-string-given-a-dictionary,"Array, String, Dynamic Programming"
HARD,Find All Good Strings,100.0,0.4318972287669696,https://leetcode.com/problems/find-all-good-strings,"String, Dynamic Programming, String Matching"
MEDIUM,Ways to Make a Fair Array,100.0,0.6426818465649188,https://leetcode.com/problems/ways-to-make-a-fair-array,"Array, Prefix Sum"
HARD,Arithmetic Slices II - Subsequence,63.3,0.5461980563586332,https://leetcode.com/problems/arithmetic-slices-ii-subsequence,"Array, Dynamic Programming"
