Difficulty,Title,Frequency,Acceptance Rate,Link,Topics
MEDIUM,3Sum,100.0,0.36665653173367135,https://leetcode.com/problems/3sum,"Array, Two Pointers, Sorting"
MEDIUM,Longest Happy String,88.5,0.6546501720573569,https://leetcode.com/problems/longest-happy-string,"String, Greedy, Heap (Priority Queue)"
MEDIUM,Best Time to Buy and Sell Stock II,88.5,0.6909063660244936,https://leetcode.com/problems/best-time-to-buy-and-sell-stock-ii,"Array, Dynamic Programming, Greedy"
EASY,Best Time to Buy and Sell Stock,88.5,0.5492508797298064,https://leetcode.com/problems/best-time-to-buy-and-sell-stock,"Array, Dynamic Programming"
EASY,Merge Sorted Array,88.5,0.5249721723190774,https://leetcode.com/problems/merge-sorted-array,"Array, Two Pointers, Sorting"
MEDIUM,LRU Cache,88.5,0.44718147940166036,https://leetcode.com/problems/lru-cache,"Hash Table, Linked List, Design, Doubly-Linked List"
