Difficulty,Title,Frequency,Acceptance Rate,Link,Topics
MEDIUM,Longest String Chain,100.0,0.6201747823811324,https://leetcode.com/problems/longest-string-chain,"Array, Hash Table, Two Pointers, String, Dynamic Programming, Sorting"
MEDIUM,Design a Stack With Increment Operation,92.6,0.8013068356286052,https://leetcode.com/problems/design-a-stack-with-increment-operation,"Array, Stack, Design"
HARD,Trapping Rain Water,92.6,0.6510865148781917,https://leetcode.com/problems/trapping-rain-water,"Array, Two Pointers, Dynamic Programming, Stack, Monotonic Stack"
MEDIUM,Meeting Rooms II,82.2,0.5214228658199016,https://leetcode.com/problems/meeting-rooms-ii,"Array, Two Pointers, Greedy, Sorting, Heap (Priority Queue), Prefix Sum"
MEDIUM,Single Element in a Sorted Array,82.2,0.5920752928191202,https://leetcode.com/problems/single-element-in-a-sorted-array,"Array, Binary Search"
MEDIUM,Longest Continuous Subarray With Absolute Diff Less Than or Equal to Limit,82.2,0.5674974850508926,https://leetcode.com/problems/longest-continuous-subarray-with-absolute-diff-less-than-or-equal-to-limit,"Array, Queue, Sliding Window, Heap (Priority Queue), Ordered Set, Monotonic Queue"
MEDIUM,Number of Islands,82.2,0.623246254585838,https://leetcode.com/problems/number-of-islands,"Array, Depth-First Search, Breadth-First Search, Union Find, Matrix"
