Difficulty,Title,Frequency,Acceptance Rate,Link,Topics
EASY,N-Repeated Element in Size 2N Array,100.0,0.7731220505866577,https://leetcode.com/problems/n-repeated-element-in-size-2n-array,"Array, Hash Table"
EASY,Best Time to Buy and Sell Stock,79.1,0.5482911588885812,https://leetcode.com/problems/best-time-to-buy-and-sell-stock,"Array, Dynamic Programming"
EASY,Two Sum,63.3,0.5518559071860256,https://leetcode.com/problems/two-sum,"Array, Hash Table"
HARD,Median of Two Sorted Arrays,63.3,0.4306451842273739,https://leetcode.com/problems/median-of-two-sorted-arrays,"Array, Binary Search, Divide and Conquer"
EASY,Remove Duplicates from Sorted Array,63.3,0.5959912404293486,https://leetcode.com/problems/remove-duplicates-from-sorted-array,"Array, Two Pointers"
MEDIUM,Add Two Numbers II,63.3,0.6169183157381958,https://leetcode.com/problems/add-two-numbers-ii,"Linked List, Math, Stack"
MEDIUM,Min Stack,63.3,0.5599610589750729,https://leetcode.com/problems/min-stack,"Stack, Design"
MEDIUM,Construct Binary Search Tree from Preorder Traversal,63.3,0.8309216936544429,https://leetcode.com/problems/construct-binary-search-tree-from-preorder-traversal,"Array, Stack, Tree, Binary Search Tree, Monotonic Stack, Binary Tree"
