Difficulty,Title,Frequency,Acceptance Rate,Link,Topics
EASY,N-Repeated Element in Size 2N Array,100.0,0.7747973064210272,https://leetcode.com/problems/n-repeated-element-in-size-2n-array,"Array, Hash Table"
EASY,Best Time to Buy and Sell Stock,72.2,0.5525967873583412,https://leetcode.com/problems/best-time-to-buy-and-sell-stock,"Array, Dynamic Programming"
EASY,Two Sum,62.9,0.5577702792380397,https://leetcode.com/problems/two-sum,"Array, Hash Table"
HARD,Median of Two Sorted Arrays,62.9,0.43814663685718197,https://leetcode.com/problems/median-of-two-sorted-arrays,"Array, Binary Search, Divide and Conquer"
MEDIUM,Construct Binary Search Tree from Preorder Traversal,62.9,0.8328129321513312,https://leetcode.com/problems/construct-binary-search-tree-from-preorder-traversal,"Array, Stack, Tree, Binary Search Tree, Monotonic Stack, Binary Tree"
EASY,Longest Palindrome,62.9,0.5556746201695723,https://leetcode.com/problems/longest-palindrome,"Hash Table, String, Greedy"
MEDIUM,Pairs of Songs With Total Durations Divisible by 60,62.9,0.5324771514259002,https://leetcode.com/problems/pairs-of-songs-with-total-durations-divisible-by-60,"Array, Hash Table, Counting"
