Difficulty,Title,Frequency,Acceptance Rate,Link,Topics
HARD,Longest Path With Different Adjacent Characters,100.0,0.5399312189529997,https://leetcode.com/problems/longest-path-with-different-adjacent-characters,"Array, String, Tree, Depth-First Search, Graph, Topological Sort"
EASY,Detect Pattern of Length M Repeated K or More Times,100.0,0.434368598793113,https://leetcode.com/problems/detect-pattern-of-length-m-repeated-k-or-more-times,"Array, Enumeration"
HARD,Add Edges to Make Degrees of All Nodes Even,97.8,0.3331810726076034,https://leetcode.com/problems/add-edges-to-make-degrees-of-all-nodes-even,"Hash Table, Graph"
MEDIUM,Maximum Total Importance of Roads,97.8,0.6920430286780676,https://leetcode.com/problems/maximum-total-importance-of-roads,"Greedy, Graph, Sorting, Heap (Priority Queue)"
EASY,Convert Integer to the Sum of Two No-Zero Integers,97.8,0.5396202931763404,https://leetcode.com/problems/convert-integer-to-the-sum-of-two-no-zero-integers,Math
EASY,Number of Steps to Reduce a Number to Zero,97.8,0.8552744555165727,https://leetcode.com/problems/number-of-steps-to-reduce-a-number-to-zero,"Math, Bit Manipulation"
EASY,Maximum 69 Number,97.8,0.8264576770422264,https://leetcode.com/problems/maximum-69-number,"Math, Greedy"
HARD,Maximum Score From Grid Operations,97.8,0.24451977401129946,https://leetcode.com/problems/maximum-score-from-grid-operations,"Array, Dynamic Programming, Matrix, Prefix Sum"
MEDIUM,Can I Win,60.9,0.3010230627491901,https://leetcode.com/problems/can-i-win,"Math, Dynamic Programming, Bit Manipulation, Memoization, Game Theory, Bitmask"
