Difficulty,Title,Frequency,Acceptance Rate,Link,Topics
HARD,Largest Rectangle in Histogram,100.0,0.47219059412330283,https://leetcode.com/problems/largest-rectangle-in-histogram,"Array, Stack, Monotonic Stack"
HARD,First Missing Positive,100.0,0.41007638951239206,https://leetcode.com/problems/first-missing-positive,"Array, Hash Table"
MEDIUM,Target Sum,100.0,0.506624814671963,https://leetcode.com/problems/target-sum,"Array, Dynamic Programming, Backtracking"
MEDIUM,Minimum Moves to Equal Array Elements II,100.0,0.6092300812402176,https://leetcode.com/problems/minimum-moves-to-equal-array-elements-ii,"Array, Math, Sorting"
MEDIUM,Rotting Oranges,100.0,0.5647306318979564,https://leetcode.com/problems/rotting-oranges,"Array, Breadth-First Search, Matrix"
MEDIUM,Deepest Leaves Sum,100.0,0.8633234753639821,https://leetcode.com/problems/deepest-leaves-sum,"Tree, Depth-First Search, Breadth-First Search, Binary Tree"
MEDIUM,Container With Most Water,100.0,0.576810429559584,https://leetcode.com/problems/container-with-most-water,"Array, Two Pointers, Greedy"
