Difficulty,Title,Frequency,Acceptance Rate,Link,Topics
MEDIUM,Maximum Earnings From Taxi,100.0,0.44745680270533195,https://leetcode.com/problems/maximum-earnings-from-taxi,"Array, Hash Table, Binary Search, Dynamic Programming, Sorting"
MEDIUM,Asteroid Collision,76.0,0.45406969018038035,https://leetcode.com/problems/asteroid-collision,"Array, Stack, Simulation"
HARD,Trapping Rain Water,69.2,0.6495026022460716,https://leetcode.com/problems/trapping-rain-water,"Array, Two Pointers, Dynamic Programming, Stack, Monotonic Stack"
MEDIUM,Container With Most Water,69.2,0.5768105277435227,https://leetcode.com/problems/container-with-most-water,"Array, Two Pointers, Greedy"
MEDIUM,Rotting Oranges,69.2,0.5647306318979564,https://leetcode.com/problems/rotting-oranges,"Array, Breadth-First Search, Matrix"
MEDIUM,3Sum,69.2,0.3695625018574474,https://leetcode.com/problems/3sum,"Array, Two Pointers, Sorting"
HARD,First Missing Positive,69.2,0.41007638951239206,https://leetcode.com/problems/first-missing-positive,"Array, Hash Table"
HARD,Largest Rectangle in Histogram,69.2,0.47219059412330283,https://leetcode.com/problems/largest-rectangle-in-histogram,"Array, Stack, Monotonic Stack"
MEDIUM,Deepest Leaves Sum,69.2,0.8633234753639821,https://leetcode.com/problems/deepest-leaves-sum,"Tree, Depth-First Search, Breadth-First Search, Binary Tree"
EASY,Repeated Substring Pattern,69.2,0.46828532394654515,https://leetcode.com/problems/repeated-substring-pattern,"String, String Matching"
MEDIUM,Largest Number,69.2,0.41195107608268683,https://leetcode.com/problems/largest-number,"Array, String, Greedy, Sorting"
MEDIUM,LRU Cache,69.2,0.45077590886284297,https://leetcode.com/problems/lru-cache,"Hash Table, Linked List, Design, Doubly-Linked List"
MEDIUM,Lowest Common Ancestor of a Binary Tree,59.7,0.6655738020092667,https://leetcode.com/problems/lowest-common-ancestor-of-a-binary-tree,"Tree, Depth-First Search, Binary Tree"
MEDIUM,Group Anagrams,59.7,0.7083634053291192,https://leetcode.com/problems/group-anagrams,"Array, Hash Table, String, Sorting"
MEDIUM,Minimum Time to Collect All Apples in a Tree,59.7,0.6294029804449841,https://leetcode.com/problems/minimum-time-to-collect-all-apples-in-a-tree,"Hash Table, Tree, Depth-First Search, Breadth-First Search"
MEDIUM,Maximal Square,59.7,0.48649825002780106,https://leetcode.com/problems/maximal-square,"Array, Dynamic Programming, Matrix"
MEDIUM,Wiggle Sort,59.7,0.6819957140108894,https://leetcode.com/problems/wiggle-sort,"Array, Greedy, Sorting"
MEDIUM,Target Sum,59.7,0.5066245243225895,https://leetcode.com/problems/target-sum,"Array, Dynamic Programming, Backtracking"
MEDIUM,Minimum Moves to Equal Array Elements II,59.7,0.6092300812402176,https://leetcode.com/problems/minimum-moves-to-equal-array-elements-ii,"Array, Math, Sorting"
EASY,Two Sum,59.7,0.5568026612636027,https://leetcode.com/problems/two-sum,"Array, Hash Table"
MEDIUM,Flatten Binary Tree to Linked List,59.7,0.6834778884866841,https://leetcode.com/problems/flatten-binary-tree-to-linked-list,"Linked List, Stack, Tree, Depth-First Search, Binary Tree"
EASY,Best Time to Buy and Sell Stock,59.7,0.551573703960526,https://leetcode.com/problems/best-time-to-buy-and-sell-stock,"Array, Dynamic Programming"
