Difficulty,Title,Frequency,Acceptance Rate,Link,Topics
MEDIUM,Longest Univalue Path,100.0,0.423636057775232,https://leetcode.com/problems/longest-univalue-path,"Tree, Depth-First Search, Binary Tree"
MEDIUM,Merge Intervals,78.3,0.4888171936011848,https://leetcode.com/problems/merge-intervals,"Array, Sorting"
MEDIUM,Find Peak Element,78.3,0.4636526656660264,https://leetcode.com/problems/find-peak-element,"Array, Binary Search"
MEDIUM,Maximum Width Ramp,78.3,0.5560931920830476,https://leetcode.com/problems/maximum-width-ramp,"Array, Two Pointers, Stack, Monotonic Stack"
MEDIUM,Number of Islands,78.3,0.6170233951328903,https://leetcode.com/problems/number-of-islands,"Array, Depth-First Search, Breadth-First Search, Union Find, Matrix"
HARD,Sliding Window Maximum,78.3,0.4730002039936077,https://leetcode.com/problems/sliding-window-maximum,"Array, Queue, Sliding Window, Heap (Priority Queue), Monotonic Queue"
