Difficulty,Title,Frequency,Acceptance Rate,Link,Topics
MEDIUM,Minimum Cost to Buy Apples,100.0,0.672016748080949,https://leetcode.com/problems/minimum-cost-to-buy-apples,"Array, Graph, Heap (Priority Queue), Shortest Path"
HARD,Maximum XOR of Two Non-Overlapping Subtrees,100.0,0.4838095238095238,https://leetcode.com/problems/maximum-xor-of-two-non-overlapping-subtrees,"Tree, Depth-First Search, Graph, Trie"
HARD,Difference Between Maximum and Minimum Price Sum,100.0,0.3204413892908828,https://leetcode.com/problems/difference-between-maximum-and-minimum-price-sum,"Array, Dynamic Programming, Tree, Depth-First Search"
MEDIUM,Number of Sub-arrays With Odd Sum,100.0,0.560916047676022,https://leetcode.com/problems/number-of-sub-arrays-with-odd-sum,"Array, Math, Dynamic Programming, Prefix Sum"
MEDIUM,Find the Winner of an Array Game,100.0,0.5677726019583611,https://leetcode.com/problems/find-the-winner-of-an-array-game,"Array, Simulation"
HARD,Find Longest Awesome Substring,100.0,0.45001178041309975,https://leetcode.com/problems/find-longest-awesome-substring,"Hash Table, String, Bit Manipulation"
MEDIUM,Min Cost to Connect All Points,100.0,0.6844252071364234,https://leetcode.com/problems/min-cost-to-connect-all-points,"Array, Union Find, Graph, Minimum Spanning Tree"
MEDIUM,Largest Submatrix With Rearrangements,100.0,0.7517953098461447,https://leetcode.com/problems/largest-submatrix-with-rearrangements,"Array, Greedy, Sorting, Matrix"
HARD,Binary Tree Maximum Path Sum,62.3,0.4095669971575739,https://leetcode.com/problems/binary-tree-maximum-path-sum,"Dynamic Programming, Tree, Depth-First Search, Binary Tree"
