Difficulty,Title,Frequency,Acceptance Rate,Link,Topics
MEDIUM,Rotate Image,100.0,0.774273479666934,https://leetcode.com/problems/rotate-image,"Array, Math, Matrix"
MEDIUM,Spiral Matrix,100.0,0.5330364513410529,https://leetcode.com/problems/spiral-matrix,"Array, Matrix, Simulation"
MEDIUM,Longest Substring Without Repeating Characters,87.7,0.3654407099112616,https://leetcode.com/problems/longest-substring-without-repeating-characters,"Hash Table, String, Sliding Window"
EASY,Valid Parentheses,87.7,0.4202372662350462,https://leetcode.com/problems/valid-parentheses,"String, Stack"
EASY,Number of 1 Bits,87.7,0.7401982993033708,https://leetcode.com/problems/number-of-1-bits,"Divide and Conquer, Bit Manipulation"
EASY,Climbing Stairs,87.7,0.5341041835836834,https://leetcode.com/problems/climbing-stairs,"Math, Dynamic Programming, Memoization"
MEDIUM,Number of Islands,87.7,0.6186221133577146,https://leetcode.com/problems/number-of-islands,"Array, Depth-First Search, Breadth-First Search, Union Find, Matrix"
MEDIUM,Kth Largest Element in an Array,87.7,0.6774073233525805,https://leetcode.com/problems/kth-largest-element-in-an-array,"Array, Divide and Conquer, Sorting, Heap (Priority Queue), Quickselect"
EASY,Two Sum,87.7,0.5533864278174376,https://leetcode.com/problems/two-sum,"Array, Hash Table"
MEDIUM,Subarray Sum Equals K,87.7,0.4511828255069157,https://leetcode.com/problems/subarray-sum-equals-k,"Array, Hash Table, Prefix Sum"
EASY,Roman to Integer,87.7,0.6441573648990725,https://leetcode.com/problems/roman-to-integer,"Hash Table, Math, String"
