Difficulty,Title,Frequency,Acceptance Rate,Link,Topics
EASY,Backspace String Compare,100.0,0.4941531515820884,https://leetcode.com/problems/backspace-string-compare,"Two Pointers, String, Stack, Simulation"
MEDIUM,Second Highest Salary,100.0,0.43097351215176866,https://leetcode.com/problems/second-highest-salary,Database
HARD,Build Array Where You Can Find The Maximum Exactly K Comparisons,100.0,0.6736977402255789,https://leetcode.com/problems/build-array-where-you-can-find-the-maximum-exactly-k-comparisons,"Dynamic Programming, Prefix Sum"
MEDIUM,Generate Parentheses,100.0,0.7661946788329606,https://leetcode.com/problems/generate-parentheses,"String, Dynamic Programming, Backtracking"
MEDIUM,Number of Divisible Substrings,100.0,0.7337837837837838,https://leetcode.com/problems/number-of-divisible-substrings,"Hash Table, String, Counting, Prefix Sum"
