Difficulty,Title,Frequency,Acceptance Rate,Link,Topics
MEDIUM,Number of Divisible Substrings,100.0,0.7340982788725366,https://leetcode.com/problems/number-of-divisible-substrings,"Hash Table, String, Counting, Prefix Sum"
MEDIUM,Design a 3D Binary Matrix with Efficient Layer Tracking,100.0,0.6642512077294686,https://leetcode.com/problems/design-a-3d-binary-matrix-with-efficient-layer-tracking,"Array, Hash Table, Design, Heap (Priority Queue), Matrix, Ordered Set"
EASY,Backspace String Compare,63.5,0.49475499118403915,https://leetcode.com/problems/backspace-string-compare,"Two Pointers, String, Stack, Simulation"
MEDIUM,Second Highest Salary,63.5,0.43706811028195053,https://leetcode.com/problems/second-highest-salary,Database
HARD,Build Array Where You Can Find The Maximum Exactly K Comparisons,63.5,0.6681915933528838,https://leetcode.com/problems/build-array-where-you-can-find-the-maximum-exactly-k-comparisons,"Dynamic Programming, Prefix Sum"
MEDIUM,Generate Parentheses,63.5,0.7702845120753604,https://leetcode.com/problems/generate-parentheses,"String, Dynamic Programming, Backtracking"
EASY,Rotate String,63.5,0.6385435956287003,https://leetcode.com/problems/rotate-string,"String, String Matching"
