Difficulty,Title,Frequency,Acceptance Rate,Link,Topics
MEDIUM,Find the Number of Good Pairs II,100.0,0.2609128849118322,https://leetcode.com/problems/find-the-number-of-good-pairs-ii,"Array, Hash Table"
EASY,Find the Number of Good Pairs I,100.0,0.8565227850351946,https://leetcode.com/problems/find-the-number-of-good-pairs-i,"Array, Hash Table"
MEDIUM,Minimum Array Changes to Make Differences Equal,100.0,0.23368243410929668,https://leetcode.com/problems/minimum-array-changes-to-make-differences-equal,"Array, Hash Table, Prefix Sum"
EASY,Longest Common Prefix,65.7,0.4548726079246024,https://leetcode.com/problems/longest-common-prefix,"String, Trie"
EASY,Two Sum,65.7,0.5578039566314058,https://leetcode.com/problems/two-sum,"Array, Hash Table"
