Difficulty,Title,Frequency,Acceptance Rate,Link,Topics
MEDIUM,Zigzag Conversion,100.0,0.516106229324453,https://leetcode.com/problems/zigzag-conversion,String
HARD,Trapping Rain Water,84.5,0.651086356034693,https://leetcode.com/problems/trapping-rain-water,"Array, Two Pointers, Dynamic Programming, Stack, Monotonic Stack"
MEDIUM,Reverse Nodes in Even Length Groups,82.6,0.6105335755618355,https://leetcode.com/problems/reverse-nodes-in-even-length-groups,Linked List
HARD,Minimum Window Substring,72.5,0.4535435822395003,https://leetcode.com/problems/minimum-window-substring,"Hash Table, String, Sliding Window"
MEDIUM,Bulls and Cows,68.9,0.5138771783652719,https://leetcode.com/problems/bulls-and-cows,"Hash Table, String, Counting"
MEDIUM,Fraction Addition and Subtraction,68.9,0.6614505626107133,https://leetcode.com/problems/fraction-addition-and-subtraction,"Math, String, Simulation"
MEDIUM,Remove K Digits,64.5,0.3494500561948273,https://leetcode.com/problems/remove-k-digits,"String, Stack, Greedy, Monotonic Stack"
MEDIUM,Container With Most Water,58.8,0.5778594130677152,https://leetcode.com/problems/container-with-most-water,"Array, Two Pointers, Greedy"
MEDIUM,Group Anagrams,58.8,0.7093182554988369,https://leetcode.com/problems/group-anagrams,"Array, Hash Table, String, Sorting"
MEDIUM,Reverse Words in a String,58.8,0.5192721628620846,https://leetcode.com/problems/reverse-words-in-a-string,"Two Pointers, String"
MEDIUM,3Sum,50.8,0.3707497596929032,https://leetcode.com/problems/3sum,"Array, Two Pointers, Sorting"
EASY,Best Time to Buy and Sell Stock,50.8,0.5526329995457592,https://leetcode.com/problems/best-time-to-buy-and-sell-stock,"Array, Dynamic Programming"
MEDIUM,Add Two Numbers,50.8,0.4623055426113341,https://leetcode.com/problems/add-two-numbers,"Linked List, Math, Recursion"
MEDIUM,Letter Combinations of a Phone Number,50.8,0.6386139867557035,https://leetcode.com/problems/letter-combinations-of-a-phone-number,"Hash Table, String, Backtracking"
EASY,Reverse Linked List,50.8,0.7921057307459562,https://leetcode.com/problems/reverse-linked-list,"Linked List, Recursion"
HARD,Reverse Nodes in k-Group,50.8,0.6305056992681838,https://leetcode.com/problems/reverse-nodes-in-k-group,"Linked List, Recursion"
MEDIUM,Longest Palindromic Substring,50.8,0.3585054411256428,https://leetcode.com/problems/longest-palindromic-substring,"Two Pointers, String, Dynamic Programming"
MEDIUM,Sort Colors,50.8,0.6758906413159929,https://leetcode.com/problems/sort-colors,"Array, Two Pointers, Sorting"
