Difficulty,Title,Frequency,Acceptance Rate,Link,Topics
HARD,Text Justification,100.0,0.468317126762962,https://leetcode.com/problems/text-justification,"Array, String, Simulation"
MEDIUM,Word Search,95.2,0.44487963502892286,https://leetcode.com/problems/word-search,"Array, String, Backtracking, Depth-First Search, Matrix"
EASY,Find Words That Can Be Formed by Characters,89.1,0.708685385836398,https://leetcode.com/problems/find-words-that-can-be-formed-by-characters,"Array, Hash Table, String, Counting"
EASY,Check if Every Row and Column Contains All Numbers,80.4,0.5249410863331901,https://leetcode.com/problems/check-if-every-row-and-column-contains-all-numbers,"Array, Hash Table, Matrix"
MEDIUM,Alert Using Same Key-Card Three or More Times in a One Hour Period,74.3,0.4610414592196976,https://leetcode.com/problems/alert-using-same-key-card-three-or-more-times-in-a-one-hour-period,"Array, Hash Table, String, Sorting"
EASY,Ransom Note,65.6,0.6375960660024388,https://leetcode.com/problems/ransom-note,"Hash Table, String, Counting"
