Difficulty,Title,Frequency,Acceptance Rate,Link,Topics
HARD,Text Justification,100.0,0.4749333013336125,https://leetcode.com/problems/text-justification,"Array, String, Simulation"
EASY,Find Words That Can Be Formed by Characters,89.8,0.7092721535807647,https://leetcode.com/problems/find-words-that-can-be-formed-by-characters,"Array, Hash Table, String, Counting"
EASY,Check if Every Row and Column Contains All Numbers,83.8,0.5257928177568786,https://leetcode.com/problems/check-if-every-row-and-column-contains-all-numbers,"Array, Hash Table, Matrix"
MEDIUM,Word Search,75.3,0.44838887241492825,https://leetcode.com/problems/word-search,"Array, String, Backtracking, Depth-First Search, Matrix"
MEDIUM,Course Schedule,75.3,0.48714273776203876,https://leetcode.com/problems/course-schedule,"Depth-First Search, Breadth-First Search, Graph, Topological Sort"
MEDIUM,Alert Using Same Key-Card Three or More Times in a One Hour Period,75.3,0.45937955125327146,https://leetcode.com/problems/alert-using-same-key-card-three-or-more-times-in-a-one-hour-period,"Array, Hash Table, String, Sorting"
MEDIUM,Number of Islands,69.3,0.6186229180071112,https://leetcode.com/problems/number-of-islands,"Array, Depth-First Search, Breadth-First Search, Union Find, Matrix"
MEDIUM,Subdomain Visit Count,60.8,0.7676342978431188,https://leetcode.com/problems/subdomain-visit-count,"Array, Hash Table, String, Counting"
HARD,Word Search II,60.8,0.3711772576570318,https://leetcode.com/problems/word-search-ii,"Array, String, Backtracking, Trie, Matrix"
