Difficulty,Title,Frequency,Acceptance Rate,Link,Topics
MEDIUM,Simple Bank System,100.0,0.6142935665806328,https://leetcode.com/problems/simple-bank-system,"Array, Hash Table, Design, Simulation"
MEDIUM,Spiral Matrix,92.8,0.5393976057408939,https://leetcode.com/problems/spiral-matrix,"Array, Matrix, Simulation"
HARD,Block Placement Queries,92.0,0.168902023187088,https://leetcode.com/problems/block-placement-queries,"Array, Binary Search, Binary Indexed Tree, Segment Tree"
HARD,Text Justification,82.9,0.48149935664104093,https://leetcode.com/problems/text-justification,"Array, String, Simulation"
MEDIUM,Minimum Operations to Write the Letter Y on a Grid,81.6,0.6194290206869442,https://leetcode.com/problems/minimum-operations-to-write-the-letter-y-on-a-grid,"Array, Hash Table, Matrix, Counting"
MEDIUM,Candy Crush,75.3,0.7736899161778655,https://leetcode.com/problems/candy-crush,"Array, Two Pointers, Matrix, Simulation"
MEDIUM,Count Alternating Subarrays,75.3,0.5631657997941757,https://leetcode.com/problems/count-alternating-subarrays,"Array, Math"
MEDIUM,Rotate Image,73.4,0.7790165261990751,https://leetcode.com/problems/rotate-image,"Array, Math, Matrix"
MEDIUM,Four Divisors,73.4,0.4481659161589702,https://leetcode.com/problems/four-divisors,"Array, Math"
MEDIUM,Simplify Path,71.2,0.47854346003751436,https://leetcode.com/problems/simplify-path,"String, Stack"
EASY,Count Operations to Obtain Zero,71.2,0.7488952285059014,https://leetcode.com/problems/count-operations-to-obtain-zero,"Math, Simulation"
MEDIUM,Longest Continuous Subarray With Absolute Diff Less Than or Equal to Limit,68.9,0.5675056206933196,https://leetcode.com/problems/longest-continuous-subarray-with-absolute-diff-less-than-or-equal-to-limit,"Array, Queue, Sliding Window, Heap (Priority Queue), Ordered Set, Monotonic Queue"
HARD,Split Message Based on Limit,68.9,0.4261603375527427,https://leetcode.com/problems/split-message-based-on-limit,"String, Binary Search, Enumeration"
MEDIUM,Rotating the Box,66.1,0.7909813050714205,https://leetcode.com/problems/rotating-the-box,"Array, Two Pointers, Matrix"
MEDIUM,Number of Black Blocks,63.0,0.3861547271028601,https://leetcode.com/problems/number-of-black-blocks,"Array, Hash Table, Enumeration"
EASY,Best Time to Buy and Sell Stock,59.3,0.5525965149653493,https://leetcode.com/problems/best-time-to-buy-and-sell-stock,"Array, Dynamic Programming"
HARD,Number of Flowers in Full Bloom,59.3,0.5717535511066795,https://leetcode.com/problems/number-of-flowers-in-full-bloom,"Array, Hash Table, Binary Search, Sorting, Prefix Sum, Ordered Set"
MEDIUM,Find the Length of the Longest Common Prefix,59.3,0.564161205458434,https://leetcode.com/problems/find-the-length-of-the-longest-common-prefix,"Array, Hash Table, String, Trie"
HARD,Count Prefix and Suffix Pairs II,59.3,0.2720387820263219,https://leetcode.com/problems/count-prefix-and-suffix-pairs-ii,"Array, String, Trie, Rolling Hash, String Matching, Hash Function"
HARD,Remove Boxes,59.3,0.48292462220613513,https://leetcode.com/problems/remove-boxes,"Array, Dynamic Programming, Memoization"
HARD,Largest Rectangle in Histogram,59.3,0.4737767587697204,https://leetcode.com/problems/largest-rectangle-in-histogram,"Array, Stack, Monotonic Stack"
MEDIUM,Coin Change,54.8,0.4649545396006711,https://leetcode.com/problems/coin-change,"Array, Dynamic Programming, Breadth-First Search"
MEDIUM,Design File System,54.8,0.6413755041392486,https://leetcode.com/problems/design-file-system,"Hash Table, String, Design, Trie"
MEDIUM,Word Search,54.8,0.4526692829987259,https://leetcode.com/problems/word-search,"Array, String, Backtracking, Depth-First Search, Matrix"
MEDIUM,Number of Subarrays That Match a Pattern I,54.8,0.6684595198334382,https://leetcode.com/problems/number-of-subarrays-that-match-a-pattern-i,"Array, Rolling Hash, String Matching, Hash Function"
EASY,Palindrome Number,54.8,0.5922453846017719,https://leetcode.com/problems/palindrome-number,Math
EASY,Add Strings,49.0,0.5190382397212994,https://leetcode.com/problems/add-strings,"Math, String, Simulation"
MEDIUM,Merge Intervals,49.0,0.4939526057316443,https://leetcode.com/problems/merge-intervals,"Array, Sorting"
MEDIUM,Number of Islands,49.0,0.6231993887316181,https://leetcode.com/problems/number-of-islands,"Array, Depth-First Search, Breadth-First Search, Union Find, Matrix"
MEDIUM,Add Two Numbers,49.0,0.4622508570031808,https://leetcode.com/problems/add-two-numbers,"Linked List, Math, Recursion"
EASY,Binary Tree Paths,49.0,0.6656317661585257,https://leetcode.com/problems/binary-tree-paths,"String, Backtracking, Tree, Depth-First Search, Binary Tree"
MEDIUM,Non-overlapping Intervals,49.0,0.5550284035532288,https://leetcode.com/problems/non-overlapping-intervals,"Array, Dynamic Programming, Greedy, Sorting"
HARD,Word Search II,49.0,0.3732633211647155,https://leetcode.com/problems/word-search-ii,"Array, String, Backtracking, Trie, Matrix"
MEDIUM,Meeting Rooms II,40.8,0.5214162081616772,https://leetcode.com/problems/meeting-rooms-ii,"Array, Two Pointers, Greedy, Sorting, Heap (Priority Queue), Prefix Sum"
MEDIUM,Rotate Array,40.8,0.4302138037383672,https://leetcode.com/problems/rotate-array,"Array, Math, Two Pointers"
MEDIUM,Minimum Absolute Difference Between Elements With Constraint,40.8,0.3406636948984646,https://leetcode.com/problems/minimum-absolute-difference-between-elements-with-constraint,"Array, Binary Search, Ordered Set"
HARD,Reverse Nodes in k-Group,40.8,0.6304370358627922,https://leetcode.com/problems/reverse-nodes-in-k-group,"Linked List, Recursion"
MEDIUM,K-diff Pairs in an Array,40.8,0.4465086848861965,https://leetcode.com/problems/k-diff-pairs-in-an-array,"Array, Hash Table, Two Pointers, Binary Search, Sorting"
MEDIUM,Number of Adjacent Elements With the Same Color,40.8,0.5575544433923982,https://leetcode.com/problems/number-of-adjacent-elements-with-the-same-color,Array
MEDIUM,Best Time to Buy and Sell Stock II,40.8,0.6950027561938028,https://leetcode.com/problems/best-time-to-buy-and-sell-stock-ii,"Array, Dynamic Programming, Greedy"
EASY,Count Prefix and Suffix Pairs I,40.8,0.7768949245817506,https://leetcode.com/problems/count-prefix-and-suffix-pairs-i,"Array, String, Trie, Rolling Hash, String Matching, Hash Function"
EASY,Valid Parentheses,40.8,0.42322837860550094,https://leetcode.com/problems/valid-parentheses,"String, Stack"
EASY,Merge Two Sorted Lists,40.8,0.6684089638470286,https://leetcode.com/problems/merge-two-sorted-lists,"Linked List, Recursion"
MEDIUM,Get Biggest Three Rhombus Sums in a Grid,40.8,0.49266961268520926,https://leetcode.com/problems/get-biggest-three-rhombus-sums-in-a-grid,"Array, Math, Sorting, Heap (Priority Queue), Matrix, Prefix Sum"
EASY,Roman to Integer,40.8,0.6486629287856299,https://leetcode.com/problems/roman-to-integer,"Hash Table, Math, String"
HARD,Find Servers That Handled Most Number of Requests,40.8,0.4407547923322684,https://leetcode.com/problems/find-servers-that-handled-most-number-of-requests,"Array, Greedy, Heap (Priority Queue), Ordered Set"
MEDIUM,LRU Cache,40.8,0.45214576213144547,https://leetcode.com/problems/lru-cache,"Hash Table, Linked List, Design, Doubly-Linked List"
