Difficulty,Title,Frequency,Acceptance Rate,Link,Topics
EASY,Isomorphic Strings,100.0,0.46768790925020753,https://leetcode.com/problems/isomorphic-strings,"Hash Table, String"
MEDIUM,Task Scheduler II,69.7,0.5395777325339423,https://leetcode.com/problems/task-scheduler-ii,"Array, Hash Table, Simulation"
HARD,Design Search Autocomplete System,61.7,0.49384073631486614,https://leetcode.com/problems/design-search-autocomplete-system,"String, Depth-First Search, Design, Trie, Sorting, Heap (Priority Queue), Data Stream"
MEDIUM,Task Scheduler,61.7,0.6142553754461699,https://leetcode.com/problems/task-scheduler,"Array, Hash Table, Greedy, Sorting, Heap (Priority Queue), Counting"
EASY,Best Time to Buy and Sell Stock,61.7,0.5515755588054587,https://leetcode.com/problems/best-time-to-buy-and-sell-stock,"Array, Dynamic Programming"
MEDIUM,Random Pick with Weight,61.7,0.4821658572137647,https://leetcode.com/problems/random-pick-with-weight,"Array, Math, Binary Search, Prefix Sum, Randomized"
MEDIUM,Course Schedule II,61.7,0.5327061888279891,https://leetcode.com/problems/course-schedule-ii,"Depth-First Search, Breadth-First Search, Graph, Topological Sort"
