Difficulty,Title,Frequency,Acceptance Rate,Link,Topics
EASY,Isomorphic Strings,100.0,0.46684575340591733,https://leetcode.com/problems/isomorphic-strings,"Hash Table, String"
MEDIUM,Task Scheduler II,69.8,0.5390729680012718,https://leetcode.com/problems/task-scheduler-ii,"Array, Hash Table, Simulation"
HARD,Design Search Autocomplete System,61.9,0.4934825051680576,https://leetcode.com/problems/design-search-autocomplete-system,"String, Depth-First Search, Design, Trie, Sorting, Heap (Priority Queue), Data Stream"
MEDIUM,Task Scheduler,61.9,0.6133061720508846,https://leetcode.com/problems/task-scheduler,"Array, Hash Table, Greedy, Sorting, Heap (Priority Queue), Counting"
EASY,Best Time to Buy and Sell Stock,61.9,0.5506646277032219,https://leetcode.com/problems/best-time-to-buy-and-sell-stock,"Array, Dynamic Programming"
MEDIUM,Random Pick with Weight,61.9,0.4815827095122897,https://leetcode.com/problems/random-pick-with-weight,"Array, Math, Binary Search, Prefix Sum, Randomized"
