Difficulty,Title,Frequency,Acceptance Rate,Link,Topics
EASY,Reverse Linked List,100.0,0.7884955001254393,https://leetcode.com/problems/reverse-linked-list,"Linked List, Recursion"
MEDIUM,Number of Islands,100.0,0.6186239107481473,https://leetcode.com/problems/number-of-islands,"Array, Depth-First Search, Breadth-First Search, Union Find, Matrix"
MEDIUM,Leftmost Column with at Least a One,88.4,0.5488848365829709,https://leetcode.com/problems/leftmost-column-with-at-least-a-one,"Array, Binary Search, Matrix, Interactive"
MEDIUM,Kth Largest Element in an Array,88.4,0.6774062055647082,https://leetcode.com/problems/kth-largest-element-in-an-array,"Array, Divide and Conquer, Sorting, Heap (Priority Queue), Quickselect"
MEDIUM,Longest Palindromic Substring,88.4,0.3549102756040244,https://leetcode.com/problems/longest-palindromic-substring,"Two Pointers, String, Dynamic Programming"
