Difficulty,Title,Frequency,Acceptance Rate,Link,Topics
MEDIUM,Longest Substring Without Repeating Characters,100.0,0.3641857579307213,https://leetcode.com/problems/longest-substring-without-repeating-characters,"Hash Table, String, Sliding Window"
MEDIUM,Letter Combinations of a Phone Number,90.9,0.6319914381812121,https://leetcode.com/problems/letter-combinations-of-a-phone-number,"Hash Table, String, Backtracking"
MEDIUM,Number of Islands,84.7,0.6170176396279056,https://leetcode.com/problems/number-of-islands,"Array, Depth-First Search, Breadth-First Search, Union Find, Matrix"
EASY,Valid Parentheses,80.9,0.41916980646504487,https://leetcode.com/problems/valid-parentheses,"String, Stack"
MEDIUM,Top K Frequent Elements,76.4,0.6415069249590982,https://leetcode.com/problems/top-k-frequent-elements,"Array, Hash Table, Divide and Conquer, Sorting, Heap (Priority Queue), Bucket Sort, Counting, Quickselect"
MEDIUM,Container With Most Water,76.4,0.5726804784834433,https://leetcode.com/problems/container-with-most-water,"Array, Two Pointers, Greedy"
MEDIUM,LRU Cache,76.4,0.44550551769176105,https://leetcode.com/problems/lru-cache,"Hash Table, Linked List, Design, Doubly-Linked List"
EASY,Find Winner on a Tic Tac Toe Game,76.4,0.5410875690708823,https://leetcode.com/problems/find-winner-on-a-tic-tac-toe-game,"Array, Hash Table, Matrix, Simulation"
HARD,Reverse Nodes in k-Group,76.4,0.6218902665869747,https://leetcode.com/problems/reverse-nodes-in-k-group,"Linked List, Recursion"
EASY,Decode the Message,70.9,0.8518942825171846,https://leetcode.com/problems/decode-the-message,"Hash Table, String"
EASY,Best Time to Buy and Sell Stock,70.9,0.5482910147953711,https://leetcode.com/problems/best-time-to-buy-and-sell-stock,"Array, Dynamic Programming"
MEDIUM,Word Break,70.9,0.47935253737051425,https://leetcode.com/problems/word-break,"Array, Hash Table, String, Dynamic Programming, Trie, Memoization"
MEDIUM,Subarray Sum Equals K,70.9,0.4500236356096835,https://leetcode.com/problems/subarray-sum-equals-k,"Array, Hash Table, Prefix Sum"
EASY,Move Zeroes,70.9,0.6257722863972811,https://leetcode.com/problems/move-zeroes,"Array, Two Pointers"
MEDIUM,3Sum,70.9,0.3653139936990469,https://leetcode.com/problems/3sum,"Array, Two Pointers, Sorting"
MEDIUM,Serialize and Deserialize BST,63.9,0.5837301439678584,https://leetcode.com/problems/serialize-and-deserialize-bst,"String, Tree, Depth-First Search, Breadth-First Search, Design, Binary Search Tree, Binary Tree"
MEDIUM,Basic Calculator II,63.9,0.45337842355282054,https://leetcode.com/problems/basic-calculator-ii,"Math, String, Stack"
MEDIUM,Max Area of Island,63.9,0.7295488290777541,https://leetcode.com/problems/max-area-of-island,"Array, Depth-First Search, Breadth-First Search, Union Find, Matrix"
EASY,Maximum Number of Balloons,63.9,0.5970515469523137,https://leetcode.com/problems/maximum-number-of-balloons,"Hash Table, String, Counting"
HARD,Serialize and Deserialize Binary Tree,63.9,0.5843145404414993,https://leetcode.com/problems/serialize-and-deserialize-binary-tree,"String, Tree, Depth-First Search, Breadth-First Search, Design, Binary Tree"
MEDIUM,Generate Parentheses,63.9,0.7661920729395902,https://leetcode.com/problems/generate-parentheses,"String, Dynamic Programming, Backtracking"
MEDIUM,Design Bounded Blocking Queue,63.9,0.7289177280288505,https://leetcode.com/problems/design-bounded-blocking-queue,Concurrency
MEDIUM,Course Schedule II,63.9,0.5273967058221642,https://leetcode.com/problems/course-schedule-ii,"Depth-First Search, Breadth-First Search, Graph, Topological Sort"
MEDIUM,Meeting Rooms II,53.9,0.5195249088402523,https://leetcode.com/problems/meeting-rooms-ii,"Array, Two Pointers, Greedy, Sorting, Heap (Priority Queue), Prefix Sum"
MEDIUM,Design Tic-Tac-Toe,53.9,0.584584996936857,https://leetcode.com/problems/design-tic-tac-toe,"Array, Hash Table, Design, Matrix, Simulation"
HARD,Trapping Rain Water,53.9,0.6439797821611234,https://leetcode.com/problems/trapping-rain-water,"Array, Two Pointers, Dynamic Programming, Stack, Monotonic Stack"
EASY,Valid Anagram,53.9,0.6622760377679756,https://leetcode.com/problems/valid-anagram,"Hash Table, String, Sorting"
EASY,Is Subsequence,53.9,0.48242758437416955,https://leetcode.com/problems/is-subsequence,"Two Pointers, String, Dynamic Programming"
EASY,Find Followers Count,53.9,0.6948335066274061,https://leetcode.com/problems/find-followers-count,Database
EASY,Minimum Changes To Make Alternating Binary String,53.9,0.6370051438989451,https://leetcode.com/problems/minimum-changes-to-make-alternating-binary-string,String
MEDIUM,Combination Sum II,53.9,0.5727839126178238,https://leetcode.com/problems/combination-sum-ii,"Array, Backtracking"
MEDIUM,Flatten Nested List Iterator,53.9,0.6520611211974853,https://leetcode.com/problems/flatten-nested-list-iterator,"Stack, Tree, Depth-First Search, Design, Queue, Iterator"
MEDIUM,Consecutive Numbers,53.9,0.45497988568636083,https://leetcode.com/problems/consecutive-numbers,Database
EASY,Reverse Linked List,53.9,0.787361523096503,https://leetcode.com/problems/reverse-linked-list,"Linked List, Recursion"
MEDIUM,Find Minimum in Rotated Sorted Array,53.9,0.5222736772990411,https://leetcode.com/problems/find-minimum-in-rotated-sorted-array,"Array, Binary Search"
MEDIUM,House Robber,53.9,0.5202374832436273,https://leetcode.com/problems/house-robber,"Array, Dynamic Programming"
MEDIUM,Design Circular Queue,53.9,0.5240189105927853,https://leetcode.com/problems/design-circular-queue,"Array, Linked List, Design, Queue"
MEDIUM,Reorganize String,53.9,0.5584559174239699,https://leetcode.com/problems/reorganize-string,"Hash Table, String, Greedy, Sorting, Heap (Priority Queue), Counting"
MEDIUM,Maximal Network Rank,53.9,0.6535590351248414,https://leetcode.com/problems/maximal-network-rank,Graph
HARD,Merge k Sorted Lists,53.9,0.5594073578008044,https://leetcode.com/problems/merge-k-sorted-lists,"Linked List, Divide and Conquer, Heap (Priority Queue), Merge Sort"
MEDIUM,Group Anagrams,53.9,0.7043765561947491,https://leetcode.com/problems/group-anagrams,"Array, Hash Table, String, Sorting"
MEDIUM,Simplify Path,53.9,0.46798238968104205,https://leetcode.com/problems/simplify-path,"String, Stack"
MEDIUM,Decode Ways,53.9,0.361680950428896,https://leetcode.com/problems/decode-ways,"String, Dynamic Programming"
MEDIUM,Construct Binary Tree from Preorder and Inorder Traversal,53.9,0.6623372149868421,https://leetcode.com/problems/construct-binary-tree-from-preorder-and-inorder-traversal,"Array, Hash Table, Divide and Conquer, Tree, Binary Tree"
EASY,Intersection of Two Linked Lists,53.9,0.603863683137077,https://leetcode.com/problems/intersection-of-two-linked-lists,"Hash Table, Linked List, Two Pointers"
EASY,Missing Number,53.9,0.6945513323438705,https://leetcode.com/problems/missing-number,"Array, Hash Table, Math, Binary Search, Bit Manipulation, Sorting"
