Difficulty,Title,Frequency,Acceptance Rate,Link,Topics
MEDIUM,Video Stitching,100.0,0.5197097847969224,https://leetcode.com/problems/video-stitching,"Array, Dynamic Programming, Greedy"
MEDIUM,Number of Islands,89.9,0.6219967111972722,https://leetcode.com/problems/number-of-islands,"Array, Depth-First Search, Breadth-First Search, Union Find, Matrix"
MEDIUM,Course Schedule II,77.4,0.5327028661340065,https://leetcode.com/problems/course-schedule-ii,"Depth-First Search, Breadth-First Search, Graph, Topological Sort"
HARD,Making A Large Island,77.4,0.547414810608719,https://leetcode.com/problems/making-a-large-island,"Array, Depth-First Search, Breadth-First Search, Union Find, Matrix"
HARD,Maximum Number of Visible Points,71.0,0.37620204839472904,https://leetcode.com/problems/maximum-number-of-visible-points,"Array, Math, Geometry, Sliding Window, Sorting"
HARD,Merge k Sorted Lists,71.0,0.5660799481364487,https://leetcode.com/problems/merge-k-sorted-lists,"Linked List, Divide and Conquer, Heap (Priority Queue), Merge Sort"
MEDIUM,Course Schedule,71.0,0.49079016703842065,https://leetcode.com/problems/course-schedule,"Depth-First Search, Breadth-First Search, Graph, Topological Sort"
HARD,Race Car,61.9,0.44070047269217,https://leetcode.com/problems/race-car,Dynamic Programming
MEDIUM,Number of Distinct Islands,61.9,0.6220415091026738,https://leetcode.com/problems/number-of-distinct-islands,"Hash Table, Depth-First Search, Breadth-First Search, Union Find, Hash Function"
MEDIUM,Merge Intervals,61.9,0.49292601007927067,https://leetcode.com/problems/merge-intervals,"Array, Sorting"
MEDIUM,Group Anagrams,61.9,0.7083632964053662,https://leetcode.com/problems/group-anagrams,"Array, Hash Table, String, Sorting"
MEDIUM,Minesweeper,61.9,0.6805796424151037,https://leetcode.com/problems/minesweeper,"Array, Depth-First Search, Breadth-First Search, Matrix"
MEDIUM,Spiral Matrix,61.9,0.5375513308667041,https://leetcode.com/problems/spiral-matrix,"Array, Matrix, Simulation"
MEDIUM,Search Suggestions System,61.9,0.650540734433352,https://leetcode.com/problems/search-suggestions-system,"Array, String, Binary Search, Trie, Sorting, Heap (Priority Queue)"
MEDIUM,Time Based Key-Value Store,61.9,0.49332869057407996,https://leetcode.com/problems/time-based-key-value-store,"Hash Table, String, Binary Search, Design"
HARD,Find Median from Data Stream,61.9,0.5319547687959963,https://leetcode.com/problems/find-median-from-data-stream,"Two Pointers, Design, Sorting, Heap (Priority Queue), Data Stream"
EASY,Shortest Word Distance,61.9,0.6594164080325383,https://leetcode.com/problems/shortest-word-distance,"Array, String"
