Difficulty,Title,Frequency,Acceptance Rate,Link,Topics
MEDIUM,Heaters,100.0,0.397792441242537,https://leetcode.com/problems/heaters,"Array, Two Pointers, Binary Search, Sorting"
HARD,Maximum Number of Visible Points,100.0,0.3758608454429624,https://leetcode.com/problems/maximum-number-of-visible-points,"Array, Math, Geometry, Sliding Window, Sorting"
MEDIUM,Number of Islands,96.1,0.6206910933280687,https://leetcode.com/problems/number-of-islands,"Array, Depth-First Search, Breadth-First Search, Union Find, Matrix"
MEDIUM,Daily Temperatures,96.1,0.6721551198956474,https://leetcode.com/problems/daily-temperatures,"Array, Stack, Monotonic Stack"
MEDIUM,Group Anagrams,96.1,0.7072417183010049,https://leetcode.com/problems/group-anagrams,"Array, Hash Table, String, Sorting"
EASY,Shortest Word Distance,91.5,0.6591380908775502,https://leetcode.com/problems/shortest-word-distance,"Array, String"
MEDIUM,Course Schedule,91.5,0.48945588785460686,https://leetcode.com/problems/course-schedule,"Depth-First Search, Breadth-First Search, Graph, Topological Sort"
HARD,Find Median from Data Stream,85.8,0.5311616686484641,https://leetcode.com/problems/find-median-from-data-stream,"Two Pointers, Design, Sorting, Heap (Priority Queue), Data Stream"
MEDIUM,Search Suggestions System,78.5,0.6504536848890701,https://leetcode.com/problems/search-suggestions-system,"Array, String, Binary Search, Trie, Sorting, Heap (Priority Queue)"
MEDIUM,Flip Equivalent Binary Trees,78.5,0.6970742640615232,https://leetcode.com/problems/flip-equivalent-binary-trees,"Tree, Depth-First Search, Binary Tree"
HARD,Basic Calculator,68.3,0.4535250421652075,https://leetcode.com/problems/basic-calculator,"Math, String, Stack, Recursion"
MEDIUM,Flatten Binary Tree to Linked List,68.3,0.6820499699064045,https://leetcode.com/problems/flatten-binary-tree-to-linked-list,"Linked List, Stack, Tree, Depth-First Search, Binary Tree"
MEDIUM,Game of Life,68.3,0.7124012022709563,https://leetcode.com/problems/game-of-life,"Array, Matrix, Simulation"
MEDIUM,Shortest Word Distance II,68.3,0.6207307091301436,https://leetcode.com/problems/shortest-word-distance-ii,"Array, Hash Table, Two Pointers, String, Design"
MEDIUM,Basic Calculator II,68.3,0.45627944361462736,https://leetcode.com/problems/basic-calculator-ii,"Math, String, Stack"
MEDIUM,Merge Intervals,68.3,0.4919339207110484,https://leetcode.com/problems/merge-intervals,"Array, Sorting"
MEDIUM,Search in Rotated Sorted Array,68.3,0.4264871508687405,https://leetcode.com/problems/search-in-rotated-sorted-array,"Array, Binary Search"
EASY,Move Zeroes,68.3,0.6272144478393921,https://leetcode.com/problems/move-zeroes,"Array, Two Pointers"
MEDIUM,Course Schedule II,68.3,0.5312891499617015,https://leetcode.com/problems/course-schedule-ii,"Depth-First Search, Breadth-First Search, Graph, Topological Sort"
