Difficulty,Title,Frequency,Acceptance Rate,Link,Topics
MEDIUM,Design Tic-Tac-Toe,100.0,0.5850248686529532,https://leetcode.com/problems/design-tic-tac-toe,"Array, Hash Table, Design, Matrix, Simulation"
MEDIUM,Robot Bounded In Circle,89.2,0.5616559334408842,https://leetcode.com/problems/robot-bounded-in-circle,"Math, String, Simulation"
EASY,Backspace String Compare,89.2,0.4943129741193532,https://leetcode.com/problems/backspace-string-compare,"Two Pointers, String, Stack, Simulation"
MEDIUM,Top K Frequent Elements,89.2,0.6425178837669879,https://leetcode.com/problems/top-k-frequent-elements,"Array, Hash Table, Divide and Conquer, Sorting, Heap (Priority Queue), Bucket Sort, Counting, Quickselect"
EASY,Two Sum,89.2,0.5533869640659627,https://leetcode.com/problems/two-sum,"Array, Hash Table"
