Difficulty,Title,Frequency,Acceptance Rate,Link,Topics
HARD,Max Stack,100.0,0.4552418979170826,https://leetcode.com/problems/max-stack,"Linked List, Stack, Design, Doubly-Linked List, Ordered Set"
MEDIUM,Nested List Weight Sum II,95.8,0.6551191876002139,https://leetcode.com/problems/nested-list-weight-sum-ii,"Stack, Depth-First Search, Breadth-First Search"
HARD,All O`one Data Structure,94.5,0.4416301355645723,https://leetcode.com/problems/all-oone-data-structure,"Hash Table, Linked List, Design, Doubly-Linked List"
MEDIUM,Find the Celebrity,80.0,0.4840569194823294,https://leetcode.com/problems/find-the-celebrity,"Two Pointers, Graph, Interactive"
MEDIUM,Nested List Weight Sum,78.7,0.8550338509826821,https://leetcode.com/problems/nested-list-weight-sum,"Depth-First Search, Breadth-First Search"
HARD,Word Ladder,78.7,0.4262824499733852,https://leetcode.com/problems/word-ladder,"Hash Table, String, Breadth-First Search"
MEDIUM,Shortest Word Distance II,78.3,0.621062203087886,https://leetcode.com/problems/shortest-word-distance-ii,"Array, Hash Table, Two Pointers, String, Design"
MEDIUM,Find Leaves of Binary Tree,78.3,0.8105717690848994,https://leetcode.com/problems/find-leaves-of-binary-tree,"Tree, Depth-First Search, Binary Tree"
EASY,Valid Parentheses,77.8,0.4224524139702213,https://leetcode.com/problems/valid-parentheses,"String, Stack"
MEDIUM,Maximum Subarray,77.8,0.5203999473351072,https://leetcode.com/problems/maximum-subarray,"Array, Divide and Conquer, Dynamic Programming"
MEDIUM,Number of Islands,75.9,0.6219957869807959,https://leetcode.com/problems/number-of-islands,"Array, Depth-First Search, Breadth-First Search, Union Find, Matrix"
EASY,Can Place Flowers,73.3,0.2888467272725474,https://leetcode.com/problems/can-place-flowers,"Array, Greedy"
MEDIUM,Maximum Product Subarray,73.3,0.34862831633709024,https://leetcode.com/problems/maximum-product-subarray,"Array, Dynamic Programming"
MEDIUM,Search in Rotated Sorted Array,71.4,0.42739839413312153,https://leetcode.com/problems/search-in-rotated-sorted-array,"Array, Binary Search"
MEDIUM,"Pow(x, n)",71.4,0.369407840816865,https://leetcode.com/problems/powx-n,"Math, Recursion"
MEDIUM,Binary Tree Upside Down,70.1,0.6444873585415337,https://leetcode.com/problems/binary-tree-upside-down,"Tree, Depth-First Search, Binary Tree"
MEDIUM,Partition to K Equal Sum Subsets,69.4,0.38111596608630277,https://leetcode.com/problems/partition-to-k-equal-sum-subsets,"Array, Dynamic Programming, Backtracking, Bit Manipulation, Memoization, Bitmask"
MEDIUM,Find First and Last Position of Element in Sorted Array,68.7,0.46696592767995065,https://leetcode.com/problems/find-first-and-last-position-of-element-in-sorted-array,"Array, Binary Search"
MEDIUM,Paint House,68.7,0.6369144258996375,https://leetcode.com/problems/paint-house,"Array, Dynamic Programming"
MEDIUM,Insert Delete GetRandom O(1),68.7,0.5496099777130121,https://leetcode.com/problems/insert-delete-getrandom-o1,"Array, Hash Table, Math, Design, Randomized"
HARD,Serialize and Deserialize Binary Tree,68.0,0.5884785233456278,https://leetcode.com/problems/serialize-and-deserialize-binary-tree,"String, Tree, Depth-First Search, Breadth-First Search, Design, Binary Tree"
HARD,Minimum Window Substring,64.7,0.45221045381876956,https://leetcode.com/problems/minimum-window-substring,"Hash Table, String, Sliding Window"
EASY,Maximum Depth of Binary Tree,64.7,0.7706586944563693,https://leetcode.com/problems/maximum-depth-of-binary-tree,"Tree, Depth-First Search, Breadth-First Search, Binary Tree"
MEDIUM,Factor Combinations,64.7,0.5022966180417614,https://leetcode.com/problems/factor-combinations,Backtracking
EASY,Shortest Word Distance,64.7,0.6594164080325383,https://leetcode.com/problems/shortest-word-distance,"Array, String"
MEDIUM,Exclusive Time of Functions,64.7,0.6471090135540419,https://leetcode.com/problems/exclusive-time-of-functions,"Array, Stack"
MEDIUM,Lowest Common Ancestor of a Binary Tree,63.8,0.6655717228511456,https://leetcode.com/problems/lowest-common-ancestor-of-a-binary-tree,"Tree, Depth-First Search, Binary Tree"
MEDIUM,Kth Largest Element in an Array,63.8,0.6790762692024515,https://leetcode.com/problems/kth-largest-element-in-an-array,"Array, Divide and Conquer, Sorting, Heap (Priority Queue), Quickselect"
MEDIUM,Lowest Common Ancestor of a Binary Search Tree,62.8,0.6814188532555879,https://leetcode.com/problems/lowest-common-ancestor-of-a-binary-search-tree,"Tree, Depth-First Search, Binary Search Tree, Binary Tree"
EASY,Isomorphic Strings,62.8,0.4676869946131596,https://leetcode.com/problems/isomorphic-strings,"Hash Table, String"
EASY,Symmetric Tree,61.8,0.5915663305027974,https://leetcode.com/problems/symmetric-tree,"Tree, Depth-First Search, Breadth-First Search, Binary Tree"
MEDIUM,Sort Transformed Array,61.8,0.5704270845794952,https://leetcode.com/problems/sort-transformed-array,"Array, Math, Two Pointers, Sorting"
MEDIUM,Merge Intervals,61.8,0.49292460339417493,https://leetcode.com/problems/merge-intervals,"Array, Sorting"
MEDIUM,Letter Combinations of a Phone Number,61.8,0.6372997986718351,https://leetcode.com/problems/letter-combinations-of-a-phone-number,"Hash Table, String, Backtracking"
EASY,Valid Perfect Square,60.7,0.4416070634172427,https://leetcode.com/problems/valid-perfect-square,"Math, Binary Search"
HARD,Valid Number,60.7,0.21492420130180484,https://leetcode.com/problems/valid-number,String
HARD,Kth Smallest Product of Two Sorted Arrays,60.7,0.30769386556493916,https://leetcode.com/problems/kth-smallest-product-of-two-sorted-arrays,"Array, Binary Search"
HARD,Count Integers in Intervals,59.5,0.34081447442342877,https://leetcode.com/problems/count-integers-in-intervals,"Design, Segment Tree, Ordered Set"
HARD,Max Points on a Line,59.5,0.28867038203155254,https://leetcode.com/problems/max-points-on-a-line,"Array, Hash Table, Math, Geometry"
MEDIUM,Evaluate Reverse Polish Notation,59.5,0.5478631241731137,https://leetcode.com/problems/evaluate-reverse-polish-notation,"Array, Math, Stack"
EASY,Second Minimum Node In a Binary Tree,59.5,0.4530508645678603,https://leetcode.com/problems/second-minimum-node-in-a-binary-tree,"Tree, Depth-First Search, Binary Tree"
MEDIUM,Repeated DNA Sequences,58.3,0.5120723536128614,https://leetcode.com/problems/repeated-dna-sequences,"Hash Table, String, Bit Manipulation, Sliding Window, Rolling Hash, Hash Function"
MEDIUM,House Robber,58.3,0.5224406953086975,https://leetcode.com/problems/house-robber,"Array, Dynamic Programming"
HARD,Closest Binary Search Tree Value II,58.3,0.6022666097384396,https://leetcode.com/problems/closest-binary-search-tree-value-ii,"Two Pointers, Stack, Tree, Depth-First Search, Binary Search Tree, Heap (Priority Queue), Binary Tree"
MEDIUM,Binary Tree Level Order Traversal,57.0,0.7045073734689781,https://leetcode.com/problems/binary-tree-level-order-traversal,"Tree, Breadth-First Search, Binary Tree"
MEDIUM,Can I Win,57.0,0.30343618241352754,https://leetcode.com/problems/can-i-win,"Math, Dynamic Programming, Bit Manipulation, Memoization, Game Theory, Bitmask"
MEDIUM,Longest Palindromic Subsequence,57.0,0.6400363805854716,https://leetcode.com/problems/longest-palindromic-subsequence,"String, Dynamic Programming"
MEDIUM,LRU Cache,57.0,0.4507741446467329,https://leetcode.com/problems/lru-cache,"Hash Table, Linked List, Design, Doubly-Linked List"
EASY,Merge Two Sorted Lists,55.6,0.6675269446973218,https://leetcode.com/problems/merge-two-sorted-lists,"Linked List, Recursion"
MEDIUM,Permutations II,55.6,0.6148478622378669,https://leetcode.com/problems/permutations-ii,"Array, Backtracking, Sorting"
MEDIUM,Shortest Word Distance III,55.6,0.5907275672864734,https://leetcode.com/problems/shortest-word-distance-iii,"Array, String"
MEDIUM,Permutations,55.6,0.805743007890841,https://leetcode.com/problems/permutations,"Array, Backtracking"
MEDIUM,Sparse Matrix Multiplication,54.1,0.6890446729082332,https://leetcode.com/problems/sparse-matrix-multiplication,"Array, Hash Table, Matrix"
MEDIUM,Palindromic Substrings,54.1,0.7160941493170401,https://leetcode.com/problems/palindromic-substrings,"Two Pointers, String, Dynamic Programming"
MEDIUM,Find K Pairs with Smallest Sums,54.1,0.40644888486590597,https://leetcode.com/problems/find-k-pairs-with-smallest-sums,"Array, Heap (Priority Queue)"
MEDIUM,Flatten Nested List Iterator,54.1,0.6521007279691979,https://leetcode.com/problems/flatten-nested-list-iterator,"Stack, Tree, Depth-First Search, Design, Queue, Iterator"
EASY,Two Sum,54.1,0.5568013960974163,https://leetcode.com/problems/two-sum,"Array, Hash Table"
MEDIUM,Binary Tree Zigzag Level Order Traversal,54.1,0.6154459230963356,https://leetcode.com/problems/binary-tree-zigzag-level-order-traversal,"Tree, Breadth-First Search, Binary Tree"
HARD,Merge k Sorted Lists,54.1,0.5660773786918838,https://leetcode.com/problems/merge-k-sorted-lists,"Linked List, Divide and Conquer, Heap (Priority Queue), Merge Sort"
MEDIUM,Product of Array Except Self,52.4,0.6771204918938551,https://leetcode.com/problems/product-of-array-except-self,"Array, Prefix Sum"
HARD,Text Justification,52.4,0.4797825799928578,https://leetcode.com/problems/text-justification,"Array, String, Simulation"
MEDIUM,Find K Closest Elements,50.6,0.4860282927769991,https://leetcode.com/problems/find-k-closest-elements,"Array, Two Pointers, Binary Search, Sliding Window, Sorting, Heap (Priority Queue)"
MEDIUM,Sum of Square Numbers,50.6,0.3646905624591904,https://leetcode.com/problems/sum-of-square-numbers,"Math, Two Pointers, Binary Search"
HARD,Time to Cross a Bridge,50.6,0.4346385798012401,https://leetcode.com/problems/time-to-cross-a-bridge,"Array, Heap (Priority Queue), Simulation"
MEDIUM,Maximize Total Tastiness of Purchased Fruits,50.6,0.6429618768328446,https://leetcode.com/problems/maximize-total-tastiness-of-purchased-fruits,"Array, Dynamic Programming"
MEDIUM,Find Largest Value in Each Tree Row,50.6,0.6627475170840316,https://leetcode.com/problems/find-largest-value-in-each-tree-row,"Tree, Depth-First Search, Breadth-First Search, Binary Tree"
HARD,Maximum Number of Non-overlapping Palindrome Substrings,50.6,0.4151374690456537,https://leetcode.com/problems/maximum-number-of-non-overlapping-palindrome-substrings,"Two Pointers, String, Dynamic Programming, Greedy"
MEDIUM,Insert Interval,50.6,0.4336824680300781,https://leetcode.com/problems/insert-interval,Array
HARD,Minimum Deletions to Make Array Divisible,50.6,0.5758147349733705,https://leetcode.com/problems/minimum-deletions-to-make-array-divisible,"Array, Math, Sorting, Heap (Priority Queue), Number Theory"
HARD,Insert Delete GetRandom O(1) - Duplicates allowed,50.6,0.357473881625645,https://leetcode.com/problems/insert-delete-getrandom-o1-duplicates-allowed,"Array, Hash Table, Math, Design, Randomized"
EASY,Two Sum III - Data structure design,50.6,0.3867061435973353,https://leetcode.com/problems/two-sum-iii-data-structure-design,"Array, Hash Table, Two Pointers, Design, Data Stream"
MEDIUM,Create Binary Tree From Descriptions,50.6,0.8163182298869275,https://leetcode.com/problems/create-binary-tree-from-descriptions,"Array, Hash Table, Tree, Binary Tree"
MEDIUM,Binary Search Tree Iterator,50.6,0.7473171616441868,https://leetcode.com/problems/binary-search-tree-iterator,"Stack, Tree, Design, Binary Search Tree, Binary Tree, Iterator"
MEDIUM,Max Area of Island,48.6,0.7310916190102749,https://leetcode.com/problems/max-area-of-island,"Array, Depth-First Search, Breadth-First Search, Union Find, Matrix"
MEDIUM,Edit Distance,46.4,0.5868718379009441,https://leetcode.com/problems/edit-distance,"String, Dynamic Programming"
MEDIUM,Rotate List,46.4,0.3984153776936562,https://leetcode.com/problems/rotate-list,"Linked List, Two Pointers"
MEDIUM,Graph Valid Tree,46.4,0.49294877533527404,https://leetcode.com/problems/graph-valid-tree,"Depth-First Search, Breadth-First Search, Union Find, Graph"
MEDIUM,Valid Triangle Number,46.4,0.5226373079783817,https://leetcode.com/problems/valid-triangle-number,"Array, Two Pointers, Binary Search, Greedy, Sorting"
MEDIUM,Number of Connected Components in an Undirected Graph,43.9,0.6415612754718487,https://leetcode.com/problems/number-of-connected-components-in-an-undirected-graph,"Depth-First Search, Breadth-First Search, Union Find, Graph"
MEDIUM,Min Stack,43.9,0.5634162480833085,https://leetcode.com/problems/min-stack,"Stack, Design"
MEDIUM,Longest Palindromic Substring,41.0,0.3574417024276968,https://leetcode.com/problems/longest-palindromic-substring,"Two Pointers, String, Dynamic Programming"
MEDIUM,Shuffle an Array,41.0,0.5900228766593634,https://leetcode.com/problems/shuffle-an-array,"Array, Math, Design, Randomized"
HARD,Word Ladder II,41.0,0.2715385195605024,https://leetcode.com/problems/word-ladder-ii,"Hash Table, String, Backtracking, Breadth-First Search"
EASY,Merge Sorted Array,37.6,0.5280214753120747,https://leetcode.com/problems/merge-sorted-array,"Array, Two Pointers, Sorting"
EASY,Intersection of Two Arrays,33.5,0.7638786826780694,https://leetcode.com/problems/intersection-of-two-arrays,"Array, Hash Table, Two Pointers, Binary Search, Sorting"
MEDIUM,Integer to Roman,33.5,0.684814447704385,https://leetcode.com/problems/integer-to-roman,"Hash Table, Math, String"
MEDIUM,Combination Sum,33.5,0.7453529796741328,https://leetcode.com/problems/combination-sum,"Array, Backtracking"
EASY,Fizz Buzz,33.5,0.7430909650170952,https://leetcode.com/problems/fizz-buzz,"Math, String, Simulation"
EASY,Diameter of Binary Tree,28.2,0.6344143819053418,https://leetcode.com/problems/diameter-of-binary-tree,"Tree, Depth-First Search, Binary Tree"
EASY,Same Tree,28.2,0.6499650632923146,https://leetcode.com/problems/same-tree,"Tree, Depth-First Search, Breadth-First Search, Binary Tree"
MEDIUM,House Robber IV,28.2,0.651660026560425,https://leetcode.com/problems/house-robber-iv,"Array, Binary Search"
MEDIUM,Longest Substring Without Repeating Characters,28.2,0.3682181578038792,https://leetcode.com/problems/longest-substring-without-repeating-characters,"Hash Table, String, Sliding Window"
HARD,Median of Two Sorted Arrays,28.2,0.4365001152534424,https://leetcode.com/problems/median-of-two-sorted-arrays,"Array, Binary Search, Divide and Conquer"
MEDIUM,House Robber II,28.2,0.4347745842092449,https://leetcode.com/problems/house-robber-ii,"Array, Dynamic Programming"
MEDIUM,Next Permutation,21.1,0.42920603580337635,https://leetcode.com/problems/next-permutation,"Array, Two Pointers"
MEDIUM,Reorder List,21.1,0.6233649122807018,https://leetcode.com/problems/reorder-list,"Linked List, Two Pointers, Stack, Recursion"
EASY,Minimum Time to Type Word Using Special Typewriter,21.1,0.7757929178320757,https://leetcode.com/problems/minimum-time-to-type-word-using-special-typewriter,"String, Greedy"
MEDIUM,Design Add and Search Words Data Structure,21.1,0.46975577700865356,https://leetcode.com/problems/design-add-and-search-words-data-structure,"String, Depth-First Search, Design, Trie"
EASY,Best Time to Buy and Sell Stock,21.1,0.5515721614779938,https://leetcode.com/problems/best-time-to-buy-and-sell-stock,"Array, Dynamic Programming"
MEDIUM,Validate Binary Search Tree,21.1,0.34303340415553035,https://leetcode.com/problems/validate-binary-search-tree,"Tree, Depth-First Search, Binary Search Tree, Binary Tree"
