Difficulty,Title,Frequency,Acceptance Rate,Link,Topics
MEDIUM,Longest Substring Without Repeating Characters,100.0,0.3654417295203965,https://leetcode.com/problems/longest-substring-without-repeating-characters,"Hash Table, String, Sliding Window"
MEDIUM,Find Polygon With the Largest Perimeter,92.3,0.6532015873238974,https://leetcode.com/problems/find-polygon-with-the-largest-perimeter,"Array, Greedy, Sorting, Prefix Sum"
MEDIUM,Generate Parentheses,81.6,0.7675075220910523,https://leetcode.com/problems/generate-parentheses,"String, Dynamic Programming, Backtracking"
MEDIUM,XOR Queries of a Subarray,81.6,0.7844198634972934,https://leetcode.com/problems/xor-queries-of-a-subarray,"Array, Bit Manipulation, Prefix Sum"
EASY,Best Time to Buy and Sell Stock,81.6,0.5492517348911965,https://leetcode.com/problems/best-time-to-buy-and-sell-stock,"Array, Dynamic Programming"
