Difficulty,Title,Frequency,Acceptance Rate,Link,Topics
MEDIUM,Find Polygon With the Largest Perimeter,100.0,0.6533759384095039,https://leetcode.com/problems/find-polygon-with-the-largest-perimeter,"Array, Greedy, Sorting, Prefix Sum"
MEDIUM,XOR Queries of a Subarray,97.9,0.7840784373920718,https://leetcode.com/problems/xor-queries-of-a-subarray,"Array, Bit Manipulation, Prefix Sum"
MEDIUM,Longest Substring Without Repeating Characters,77.8,0.3671711297992306,https://leetcode.com/problems/longest-substring-without-repeating-characters,"Hash Table, String, Sliding Window"
MEDIUM,Generate Parentheses,62.5,0.7691655108645399,https://leetcode.com/problems/generate-parentheses,"String, Dynamic Programming, Backtracking"
EASY,Best Time to Buy and Sell Stock,62.5,0.5506669854255387,https://leetcode.com/problems/best-time-to-buy-and-sell-stock,"Array, Dynamic Programming"
MEDIUM,Find First and Last Position of Element in Sorted Array,62.5,0.46568168361652923,https://leetcode.com/problems/find-first-and-last-position-of-element-in-sorted-array,"Array, Binary Search"
