Difficulty,Title,Frequency,Acceptance Rate,Link,Topics
EASY,Valid Parentheses,100.0,0.4224536909693299,https://leetcode.com/problems/valid-parentheses,"String, Stack"
MEDIUM,Group Anagrams,100.0,0.7083632651305937,https://leetcode.com/problems/group-anagrams,"Array, Hash Table, String, Sorting"
MEDIUM,Longest Substring Without Repeating Characters,94.3,0.36822040128440386,https://leetcode.com/problems/longest-substring-without-repeating-characters,"Hash Table, String, Sliding Window"
EASY,Valid Palindrome,87.0,0.5081525900308248,https://leetcode.com/problems/valid-palindrome,"Two Pointers, String"
EASY,Two Sum,82.4,0.5568027218537406,https://leetcode.com/problems/two-sum,"Array, Hash Table"
MEDIUM,Longest Palindromic Substring,82.4,0.35744402659849284,https://leetcode.com/problems/longest-palindromic-substring,"Two Pointers, String, Dynamic Programming"
EASY,Valid Anagram,82.4,0.6657016060184301,https://leetcode.com/problems/valid-anagram,"Hash Table, String, Sorting"
HARD,Trapping Rain Water,76.7,0.6495021866095767,https://leetcode.com/problems/trapping-rain-water,"Array, Two Pointers, Dynamic Programming, Stack, Monotonic Stack"
EASY,Merge Sorted Array,76.7,0.5280224015435507,https://leetcode.com/problems/merge-sorted-array,"Array, Two Pointers, Sorting"
EASY,Longest Common Prefix,76.7,0.45372652291817245,https://leetcode.com/problems/longest-common-prefix,"String, Trie"
EASY,Best Time to Buy and Sell Stock,76.7,0.5515738378517399,https://leetcode.com/problems/best-time-to-buy-and-sell-stock,"Array, Dynamic Programming"
EASY,Merge Two Sorted Lists,69.5,0.6675283380077401,https://leetcode.com/problems/merge-two-sorted-lists,"Linked List, Recursion"
EASY,Isomorphic Strings,69.5,0.4676871779007575,https://leetcode.com/problems/isomorphic-strings,"Hash Table, String"
MEDIUM,Managers with at Least 5 Direct Reports,59.2,0.4894485117184339,https://leetcode.com/problems/managers-with-at-least-5-direct-reports,Database
MEDIUM,House Robber,59.2,0.522440592330472,https://leetcode.com/problems/house-robber,"Array, Dynamic Programming"
MEDIUM,Partition Equal Subset Sum,59.2,0.4834625718733981,https://leetcode.com/problems/partition-equal-subset-sum,"Array, Dynamic Programming"
MEDIUM,Reverse Integer,59.2,0.30224379706677723,https://leetcode.com/problems/reverse-integer,Math
MEDIUM,Kth Largest Element in an Array,59.2,0.6790764332506831,https://leetcode.com/problems/kth-largest-element-in-an-array,"Array, Divide and Conquer, Sorting, Heap (Priority Queue), Quickselect"
MEDIUM,Maximum Difference Between Node and Ancestor,59.2,0.7804891905238456,https://leetcode.com/problems/maximum-difference-between-node-and-ancestor,"Tree, Depth-First Search, Binary Tree"
MEDIUM,Minimum Operations to Make a Uni-Value Grid,59.2,0.6746602089585962,https://leetcode.com/problems/minimum-operations-to-make-a-uni-value-grid,"Array, Math, Sorting, Matrix"
MEDIUM,Longest Consecutive Sequence,59.2,0.47049143511993596,https://leetcode.com/problems/longest-consecutive-sequence,"Array, Hash Table, Union Find"
EASY,Reverse String,59.2,0.7970806882172111,https://leetcode.com/problems/reverse-string,"Two Pointers, String"
MEDIUM,Ugly Number II,59.2,0.4923282463083801,https://leetcode.com/problems/ugly-number-ii,"Hash Table, Math, Dynamic Programming, Heap (Priority Queue)"
EASY,Remove Duplicates from Sorted Array,59.2,0.6020685374930675,https://leetcode.com/problems/remove-duplicates-from-sorted-array,"Array, Two Pointers"
EASY,Binary Search,59.2,0.5948287663172166,https://leetcode.com/problems/binary-search,"Array, Binary Search"
EASY,To Be Or Not To Be,59.2,0.6294898195104981,https://leetcode.com/problems/to-be-or-not-to-be,
MEDIUM,Asteroid Collision,59.2,0.4540697942123948,https://leetcode.com/problems/asteroid-collision,"Array, Stack, Simulation"
MEDIUM,Coin Change,59.2,0.4636548662006719,https://leetcode.com/problems/coin-change,"Array, Dynamic Programming, Breadth-First Search"
MEDIUM,Add Two Numbers,59.2,0.4608967562147254,https://leetcode.com/problems/add-two-numbers,"Linked List, Math, Recursion"
EASY,Palindrome Number,59.2,0.591492003588952,https://leetcode.com/problems/palindrome-number,Math
EASY,Linked List Cycle,59.2,0.5246156403168994,https://leetcode.com/problems/linked-list-cycle,"Hash Table, Linked List, Two Pointers"
MEDIUM,3Sum,59.2,0.369562525715181,https://leetcode.com/problems/3sum,"Array, Two Pointers, Sorting"
MEDIUM,"Pow(x, n)",59.2,0.3694103556323306,https://leetcode.com/problems/powx-n,"Math, Recursion"
