Difficulty,Title,Frequency,Acceptance Rate,Link,Topics
MEDIUM,LRU Cache,100.0,0.44717605905320146,https://leetcode.com/problems/lru-cache,"Hash Table, Linked List, Design, Doubly-Linked List"
MEDIUM,Reorganize String,90.5,0.5593747809789084,https://leetcode.com/problems/reorganize-string,"Hash Table, String, Greedy, Sorting, Heap (Priority Queue), Counting"
EASY,Two Sum,85.8,0.5533844866021747,https://leetcode.com/problems/two-sum,"Array, Hash Table"
MEDIUM,Number of Islands,81.5,0.6186243036618971,https://leetcode.com/problems/number-of-islands,"Array, Depth-First Search, Breadth-First Search, Union Find, Matrix"
MEDIUM,Analyze User Website Visit Pattern,79.9,0.4340048420360463,https://leetcode.com/problems/analyze-user-website-visit-pattern,"Array, Hash Table, Sorting"
MEDIUM,Merge Intervals,78.2,0.4902748729659309,https://leetcode.com/problems/merge-intervals,"Array, Sorting"
HARD,Trapping Rain Water,78.2,0.6456470646252592,https://leetcode.com/problems/trapping-rain-water,"Array, Two Pointers, Dynamic Programming, Stack, Monotonic Stack"
MEDIUM,House Robber,78.2,0.5209524030496945,https://leetcode.com/problems/house-robber,"Array, Dynamic Programming"
MEDIUM,Longest Substring Without Repeating Characters,72.1,0.3654379693279274,https://leetcode.com/problems/longest-substring-without-repeating-characters,"Hash Table, String, Sliding Window"
MEDIUM,3Sum,72.1,0.3666540963158144,https://leetcode.com/problems/3sum,"Array, Two Pointers, Sorting"
EASY,Best Time to Buy and Sell Stock,69.6,0.5492507564790589,https://leetcode.com/problems/best-time-to-buy-and-sell-stock,"Array, Dynamic Programming"
MEDIUM,Add Two Numbers,69.6,0.45719821203534133,https://leetcode.com/problems/add-two-numbers,"Linked List, Math, Recursion"
HARD,Merge k Sorted Lists,69.6,0.5615759022229708,https://leetcode.com/problems/merge-k-sorted-lists,"Linked List, Divide and Conquer, Heap (Priority Queue), Merge Sort"
HARD,Median of Two Sorted Arrays,69.6,0.43234245040428393,https://leetcode.com/problems/median-of-two-sorted-arrays,"Array, Binary Search, Divide and Conquer"
MEDIUM,Top K Frequent Elements,69.6,0.6425176383477934,https://leetcode.com/problems/top-k-frequent-elements,"Array, Hash Table, Divide and Conquer, Sorting, Heap (Priority Queue), Bucket Sort, Counting, Quickselect"
MEDIUM,Koko Eating Bananas,66.9,0.48954749261259495,https://leetcode.com/problems/koko-eating-bananas,"Array, Binary Search"
EASY,Climbing Stairs,66.9,0.5341033471474884,https://leetcode.com/problems/climbing-stairs,"Math, Dynamic Programming, Memoization"
EASY,Valid Parentheses,66.9,0.42023508264043585,https://leetcode.com/problems/valid-parentheses,"String, Stack"
MEDIUM,Copy List with Random Pointer,66.9,0.5987535446409938,https://leetcode.com/problems/copy-list-with-random-pointer,"Hash Table, Linked List"
MEDIUM,Rotting Oranges,66.9,0.561814808648063,https://leetcode.com/problems/rotting-oranges,"Array, Breadth-First Search, Matrix"
MEDIUM,Course Schedule,63.7,0.48714164393370163,https://leetcode.com/problems/course-schedule,"Depth-First Search, Breadth-First Search, Graph, Topological Sort"
MEDIUM,Course Schedule II,63.7,0.5291118922380406,https://leetcode.com/problems/course-schedule-ii,"Depth-First Search, Breadth-First Search, Graph, Topological Sort"
EASY,Merge Sorted Array,63.7,0.5249698324265516,https://leetcode.com/problems/merge-sorted-array,"Array, Two Pointers, Sorting"
HARD,Find Median from Data Stream,63.7,0.5311630738083135,https://leetcode.com/problems/find-median-from-data-stream,"Two Pointers, Design, Sorting, Heap (Priority Queue), Data Stream"
MEDIUM,Longest Consecutive Sequence,63.7,0.47126708107115695,https://leetcode.com/problems/longest-consecutive-sequence,"Array, Hash Table, Union Find"
MEDIUM,Maximum Subarray,63.7,0.5186400749869976,https://leetcode.com/problems/maximum-subarray,"Array, Divide and Conquer, Dynamic Programming"
EASY,Recyclable and Low Fat Products,60.2,0.8934343406539785,https://leetcode.com/problems/recyclable-and-low-fat-products,Database
HARD,Maximum Number of Groups With Increasing Length,60.2,0.21649785564376312,https://leetcode.com/problems/maximum-number-of-groups-with-increasing-length,"Array, Math, Binary Search, Greedy, Sorting"
HARD,Word Ladder,60.2,0.4218677972212565,https://leetcode.com/problems/word-ladder,"Hash Table, String, Breadth-First Search"
EASY,Merge Strings Alternately,60.2,0.8205624001885519,https://leetcode.com/problems/merge-strings-alternately,"Two Pointers, String"
MEDIUM,Longest Increasing Subsequence,60.2,0.5738401616767514,https://leetcode.com/problems/longest-increasing-subsequence,"Array, Binary Search, Dynamic Programming"
MEDIUM,Group Anagrams,60.2,0.7056680606659994,https://leetcode.com/problems/group-anagrams,"Array, Hash Table, String, Sorting"
MEDIUM,House Robber IV,60.2,0.6516908668049531,https://leetcode.com/problems/house-robber-iv,"Array, Binary Search"
MEDIUM,Subarray Sum Equals K,60.2,0.4511789169861394,https://leetcode.com/problems/subarray-sum-equals-k,"Array, Hash Table, Prefix Sum"
MEDIUM,Word Search,60.2,0.44838745717593925,https://leetcode.com/problems/word-search,"Array, String, Backtracking, Depth-First Search, Matrix"
MEDIUM,Reverse Integer,55.9,0.30006850483673925,https://leetcode.com/problems/reverse-integer,Math
HARD,Binary Tree Maximum Path Sum,55.9,0.41022931451074873,https://leetcode.com/problems/binary-tree-maximum-path-sum,"Dynamic Programming, Tree, Depth-First Search, Binary Tree"
HARD,Word Break II,55.9,0.5318035838147775,https://leetcode.com/problems/word-break-ii,"Array, Hash Table, String, Dynamic Programming, Backtracking, Trie, Memoization"
MEDIUM,Search in Rotated Sorted Array,55.9,0.4250772158268278,https://leetcode.com/problems/search-in-rotated-sorted-array,"Array, Binary Search"
MEDIUM,Unique Paths,55.9,0.6553761991320154,https://leetcode.com/problems/unique-paths,"Math, Dynamic Programming, Combinatorics"
MEDIUM,Jump Game,55.9,0.39214264487738343,https://leetcode.com/problems/jump-game,"Array, Dynamic Programming, Greedy"
EASY,Majority Element,55.9,0.6557187613697049,https://leetcode.com/problems/majority-element,"Array, Hash Table, Divide and Conquer, Sorting, Counting"
MEDIUM,Insert Delete GetRandom O(1),55.9,0.5496801832084119,https://leetcode.com/problems/insert-delete-getrandom-o1,"Array, Hash Table, Math, Design, Randomized"
MEDIUM,Coin Change,55.9,0.46046349941115894,https://leetcode.com/problems/coin-change,"Array, Dynamic Programming, Breadth-First Search"
HARD,Concatenated Words,50.7,0.49380046718773996,https://leetcode.com/problems/concatenated-words,"Array, String, Dynamic Programming, Depth-First Search, Trie"
HARD,Integer to English Words,50.7,0.34274242670672167,https://leetcode.com/problems/integer-to-english-words,"Math, String, Recursion"
EASY,Longest Common Prefix,50.7,0.4510198870129216,https://leetcode.com/problems/longest-common-prefix,"String, Trie"
HARD,LFU Cache,50.7,0.46074491702487463,https://leetcode.com/problems/lfu-cache,"Hash Table, Linked List, Design, Doubly-Linked List"
MEDIUM,Sort Colors,50.7,0.6663756772955342,https://leetcode.com/problems/sort-colors,"Array, Two Pointers, Sorting"
MEDIUM,Meeting Rooms II,50.7,0.5200579926786013,https://leetcode.com/problems/meeting-rooms-ii,"Array, Two Pointers, Greedy, Sorting, Heap (Priority Queue), Prefix Sum"
MEDIUM,Valid Sudoku,50.7,0.6189166375736662,https://leetcode.com/problems/valid-sudoku,"Array, Hash Table, Matrix"
HARD,Minimum Window Substring,50.7,0.4490215243606473,https://leetcode.com/problems/minimum-window-substring,"Hash Table, String, Sliding Window"
MEDIUM,Furthest Building You Can Reach,50.7,0.5023498123793216,https://leetcode.com/problems/furthest-building-you-can-reach,"Array, Greedy, Heap (Priority Queue)"
MEDIUM,Lowest Common Ancestor of a Binary Tree,50.7,0.6606725935264646,https://leetcode.com/problems/lowest-common-ancestor-of-a-binary-tree,"Tree, Depth-First Search, Binary Tree"
MEDIUM,Letter Combinations of a Phone Number,50.7,0.6336663230409242,https://leetcode.com/problems/letter-combinations-of-a-phone-number,"Hash Table, String, Backtracking"
MEDIUM,Kth Largest Element in an Array,50.7,0.6774049453176303,https://leetcode.com/problems/kth-largest-element-in-an-array,"Array, Divide and Conquer, Sorting, Heap (Priority Queue), Quickselect"
MEDIUM,Evaluate Reverse Polish Notation,44.1,0.5438043093483161,https://leetcode.com/problems/evaluate-reverse-polish-notation,"Array, Math, Stack"
MEDIUM,4Sum,44.1,0.37806962882895023,https://leetcode.com/problems/4sum,"Array, Two Pointers, Sorting"
EASY,Find the Index of the First Occurrence in a String,44.1,0.44651863754358007,https://leetcode.com/problems/find-the-index-of-the-first-occurrence-in-a-string,"Two Pointers, String, String Matching"
MEDIUM,Evaluate Division,44.1,0.6288191492464597,https://leetcode.com/problems/evaluate-division,"Array, String, Depth-First Search, Breadth-First Search, Union Find, Graph, Shortest Path"
MEDIUM,Container With Most Water,44.1,0.5740098391093632,https://leetcode.com/problems/container-with-most-water,"Array, Two Pointers, Greedy"
MEDIUM,Asteroid Collision,44.1,0.4520790851867343,https://leetcode.com/problems/asteroid-collision,"Array, Stack, Simulation"
MEDIUM,Find Triangular Sum of an Array,44.1,0.787605867564863,https://leetcode.com/problems/find-triangular-sum-of-an-array,"Array, Math, Simulation, Combinatorics"
MEDIUM,Spiral Matrix,44.1,0.5330309481845401,https://leetcode.com/problems/spiral-matrix,"Array, Matrix, Simulation"
EASY,Remove Duplicates from Sorted Array,44.1,0.5980687033878332,https://leetcode.com/problems/remove-duplicates-from-sorted-array,"Array, Two Pointers"
MEDIUM,Reverse Words in a String,44.1,0.5080396851777776,https://leetcode.com/problems/reverse-words-in-a-string,"Two Pointers, String"
EASY,Next Greater Element I,44.1,0.7411542609767122,https://leetcode.com/problems/next-greater-element-i,"Array, Hash Table, Stack, Monotonic Stack"
HARD,First Missing Positive,44.1,0.40800454722312274,https://leetcode.com/problems/first-missing-positive,"Array, Hash Table"
MEDIUM,Partition Labels,44.1,0.814329696101708,https://leetcode.com/problems/partition-labels,"Hash Table, Two Pointers, String, Greedy"
EASY,Maximum Units on a Truck,35.0,0.7412398339280428,https://leetcode.com/problems/maximum-units-on-a-truck,"Array, Greedy, Sorting"
MEDIUM,Surrounded Regions,35.0,0.42342578778185563,https://leetcode.com/problems/surrounded-regions,"Array, Depth-First Search, Breadth-First Search, Union Find, Matrix"
MEDIUM,Min Stack,35.0,0.5611000810791202,https://leetcode.com/problems/min-stack,"Stack, Design"
MEDIUM,The kth Factor of n,35.0,0.6940586134444644,https://leetcode.com/problems/the-kth-factor-of-n,"Math, Number Theory"
MEDIUM,Maximum Candies Allocated to K Children,35.0,0.5019698936485163,https://leetcode.com/problems/maximum-candies-allocated-to-k-children,"Array, Binary Search"
MEDIUM,Design Browser History,35.0,0.7799763448034386,https://leetcode.com/problems/design-browser-history,"Array, Linked List, Stack, Design, Doubly-Linked List, Data Stream"
MEDIUM,Zero Array Transformation II,35.0,0.43816660164732035,https://leetcode.com/problems/zero-array-transformation-ii,"Array, Binary Search, Prefix Sum"
HARD,Sliding Window Maximum,35.0,0.47366750431803645,https://leetcode.com/problems/sliding-window-maximum,"Array, Queue, Sliding Window, Heap (Priority Queue), Monotonic Queue"
EASY,Pascal's Triangle II,35.0,0.6565190824862455,https://leetcode.com/problems/pascals-triangle-ii,"Array, Dynamic Programming"
EASY,Design HashMap,35.0,0.6570211105943075,https://leetcode.com/problems/design-hashmap,"Array, Hash Table, Linked List, Design, Hash Function"
MEDIUM,Integer to Roman,35.0,0.6809699143113179,https://leetcode.com/problems/integer-to-roman,"Hash Table, Math, String"
MEDIUM,Single Element in a Sorted Array,35.0,0.5917985226918491,https://leetcode.com/problems/single-element-in-a-sorted-array,"Array, Binary Search"
MEDIUM,Cheapest Flights Within K Stops,35.0,0.4016457257842351,https://leetcode.com/problems/cheapest-flights-within-k-stops,"Dynamic Programming, Depth-First Search, Breadth-First Search, Graph, Heap (Priority Queue), Shortest Path"
EASY,Contains Duplicate II,35.0,0.48481099081047285,https://leetcode.com/problems/contains-duplicate-ii,"Array, Hash Table, Sliding Window"
MEDIUM,Plates Between Candles,35.0,0.4641763121646348,https://leetcode.com/problems/plates-between-candles,"Array, String, Binary Search, Prefix Sum"
MEDIUM,Jump Game II,35.0,0.41244515663253367,https://leetcode.com/problems/jump-game-ii,"Array, Dynamic Programming, Greedy"
MEDIUM,Sum of Subarray Minimums,35.0,0.3741479775399984,https://leetcode.com/problems/sum-of-subarray-minimums,"Array, Dynamic Programming, Stack, Monotonic Stack"
MEDIUM,Random Pick with Weight,35.0,0.48327177098155405,https://leetcode.com/problems/random-pick-with-weight,"Array, Math, Binary Search, Prefix Sum, Randomized"
MEDIUM,Binary Tree Right Side View,35.0,0.661882195526251,https://leetcode.com/problems/binary-tree-right-side-view,"Tree, Depth-First Search, Breadth-First Search, Binary Tree"
MEDIUM,Binary Tree Zigzag Level Order Traversal,35.0,0.6124387237958213,https://leetcode.com/problems/binary-tree-zigzag-level-order-traversal,"Tree, Breadth-First Search, Binary Tree"
EASY,Diameter of Binary Tree,35.0,0.6304799592645914,https://leetcode.com/problems/diameter-of-binary-tree,"Tree, Depth-First Search, Binary Tree"
EASY,Palindrome Linked List,35.0,0.5539953345403061,https://leetcode.com/problems/palindrome-linked-list,"Linked List, Two Pointers, Stack, Recursion"
MEDIUM,Non-overlapping Intervals,35.0,0.5513604040439468,https://leetcode.com/problems/non-overlapping-intervals,"Array, Dynamic Programming, Greedy, Sorting"
MEDIUM,Lowest Common Ancestor of a Binary Search Tree,35.0,0.6774222278162181,https://leetcode.com/problems/lowest-common-ancestor-of-a-binary-search-tree,"Tree, Depth-First Search, Binary Search Tree, Binary Tree"
MEDIUM,Construct Binary Tree from Preorder and Inorder Traversal,35.0,0.6636935709537028,https://leetcode.com/problems/construct-binary-tree-from-preorder-and-inorder-traversal,"Array, Hash Table, Divide and Conquer, Tree, Binary Tree"
EASY,Flood Fill,35.0,0.6602264959589772,https://leetcode.com/problems/flood-fill,"Array, Depth-First Search, Breadth-First Search, Matrix"
MEDIUM,Rotate Array,35.0,0.4265257089840311,https://leetcode.com/problems/rotate-array,"Array, Math, Two Pointers"
EASY,Happy Number,35.0,0.5773584965622224,https://leetcode.com/problems/happy-number,"Hash Table, Math, Two Pointers"
MEDIUM,Word Break,35.0,0.4802055461467755,https://leetcode.com/problems/word-break,"Array, Hash Table, String, Dynamic Programming, Trie, Memoization"
MEDIUM,Find All Anagrams in a String,35.0,0.5195437286923936,https://leetcode.com/problems/find-all-anagrams-in-a-string,"Hash Table, String, Sliding Window"
MEDIUM,Longest Substring with At Most K Distinct Characters,35.0,0.49387418160362695,https://leetcode.com/problems/longest-substring-with-at-most-k-distinct-characters,"Hash Table, String, Sliding Window"
