Difficulty,Title,Frequency,Acceptance Rate,Link,Topics
EASY,Two Sum,100.0,0.549042723172418,https://leetcode.com/problems/two-sum,"Array, Hash Table"
MEDIUM,LRU Cache,99.1,0.44264990854265895,https://leetcode.com/problems/lru-cache,"Hash Table, Linked List, Design, Doubly-Linked List"
MEDIUM,Number of Islands,95.0,0.6142361520438011,https://leetcode.com/problems/number-of-islands,"Array, Depth-First Search, Breadth-First Search, Union Find, Matrix"
MEDIUM,Reorganize String,90.0,0.5568948107224265,https://leetcode.com/problems/reorganize-string,"Hash Table, String, Greedy, Sorting, Heap (Priority Queue), Counting"
EASY,Make Array Zero by Subtracting Equal Amounts,87.1,0.7288257670741012,https://leetcode.com/problems/make-array-zero-by-subtracting-equal-amounts,"Array, Hash Table, Greedy, Sorting, Heap (Priority Queue), Simulation"
MEDIUM,Course Schedule,85.5,0.48346049080524695,https://leetcode.com/problems/course-schedule,"Depth-First Search, Breadth-First Search, Graph, Topological Sort"
MEDIUM,Longest Substring Without Repeating Characters,82.0,0.36201638879509784,https://leetcode.com/problems/longest-substring-without-repeating-characters,"Hash Table, String, Sliding Window"
MEDIUM,Course Schedule II,80.0,0.5247570948167819,https://leetcode.com/problems/course-schedule-ii,"Depth-First Search, Breadth-First Search, Graph, Topological Sort"
HARD,Merge k Sorted Lists,80.0,0.5556685430549169,https://leetcode.com/problems/merge-k-sorted-lists,"Linked List, Divide and Conquer, Heap (Priority Queue), Merge Sort"
MEDIUM,Group Anagrams,80.0,0.7021294569721956,https://leetcode.com/problems/group-anagrams,"Array, Hash Table, String, Sorting"
HARD,Trapping Rain Water,77.9,0.6412323378070339,https://leetcode.com/problems/trapping-rain-water,"Array, Two Pointers, Dynamic Programming, Stack, Monotonic Stack"
MEDIUM,3Sum,75.5,0.3627882689037001,https://leetcode.com/problems/3sum,"Array, Two Pointers, Sorting"
MEDIUM,Merge Intervals,75.5,0.48695059420116815,https://leetcode.com/problems/merge-intervals,"Array, Sorting"
EASY,Best Time to Buy and Sell Stock,73.0,0.5468400435497901,https://leetcode.com/problems/best-time-to-buy-and-sell-stock,"Array, Dynamic Programming"
MEDIUM,Minimum Health to Beat Game,73.0,0.5801082336070471,https://leetcode.com/problems/minimum-health-to-beat-game,"Array, Greedy"
MEDIUM,Top K Frequent Elements,70.1,0.6397484011326208,https://leetcode.com/problems/top-k-frequent-elements,"Array, Hash Table, Divide and Conquer, Sorting, Heap (Priority Queue), Bucket Sort, Counting, Quickselect"
EASY,Merge Sorted Array,70.1,0.520980673342063,https://leetcode.com/problems/merge-sorted-array,"Array, Two Pointers, Sorting"
EASY,Climbing Stairs,70.1,0.5331671027356765,https://leetcode.com/problems/climbing-stairs,"Math, Dynamic Programming, Memoization"
MEDIUM,Maximum Subarray,70.1,0.5164878799726322,https://leetcode.com/problems/maximum-subarray,"Array, Divide and Conquer, Dynamic Programming"
MEDIUM,Longest Palindromic Substring,66.8,0.3518925482578306,https://leetcode.com/problems/longest-palindromic-substring,"Two Pointers, String, Dynamic Programming"
HARD,Word Ladder,66.8,0.4165543324709498,https://leetcode.com/problems/word-ladder,"Hash Table, String, Breadth-First Search"
MEDIUM,Jump Game,66.8,0.39056410388847373,https://leetcode.com/problems/jump-game,"Array, Dynamic Programming, Greedy"
HARD,Find Median from Data Stream,63.0,0.5287637269926079,https://leetcode.com/problems/find-median-from-data-stream,"Two Pointers, Design, Sorting, Heap (Priority Queue), Data Stream"
MEDIUM,"Pow(x, n)",63.0,0.3635444408426503,https://leetcode.com/problems/powx-n,"Math, Recursion"
MEDIUM,Longest Consecutive Sequence,63.0,0.47255159075257197,https://leetcode.com/problems/longest-consecutive-sequence,"Array, Hash Table, Union Find"
MEDIUM,Sum of Subarray Minimums,63.0,0.3732324865756969,https://leetcode.com/problems/sum-of-subarray-minimums,"Array, Dynamic Programming, Stack, Monotonic Stack"
HARD,Sliding Window Maximum,63.0,0.4719082092315842,https://leetcode.com/problems/sliding-window-maximum,"Array, Queue, Sliding Window, Heap (Priority Queue), Monotonic Queue"
MEDIUM,Basic Calculator II,63.0,0.4512408617235173,https://leetcode.com/problems/basic-calculator-ii,"Math, String, Stack"
MEDIUM,Binary Tree Level Order Traversal,63.0,0.6963931339745539,https://leetcode.com/problems/binary-tree-level-order-traversal,"Tree, Breadth-First Search, Binary Tree"
MEDIUM,Add Two Numbers,63.0,0.4527247357608663,https://leetcode.com/problems/add-two-numbers,"Linked List, Math, Recursion"
EASY,Merge Strings Alternately,63.0,0.8169975024602242,https://leetcode.com/problems/merge-strings-alternately,"Two Pointers, String"
EASY,Create Hello World Function,63.0,0.8180377808772339,https://leetcode.com/problems/create-hello-world-function,
MEDIUM,Analyze User Website Visit Pattern,63.0,0.43142229052779013,https://leetcode.com/problems/analyze-user-website-visit-pattern,"Array, Hash Table, Sorting"
MEDIUM,Copy List with Random Pointer,63.0,0.5927297525122891,https://leetcode.com/problems/copy-list-with-random-pointer,"Hash Table, Linked List"
MEDIUM,Word Search,63.0,0.44488175419280446,https://leetcode.com/problems/word-search,"Array, String, Backtracking, Depth-First Search, Matrix"
EASY,Remove Duplicates from Sorted Array,58.6,0.5922420549690864,https://leetcode.com/problems/remove-duplicates-from-sorted-array,"Array, Two Pointers"
MEDIUM,Koko Eating Bananas,58.6,0.48764614587675387,https://leetcode.com/problems/koko-eating-bananas,"Array, Binary Search"
MEDIUM,Rotate Image,58.6,0.770165839289031,https://leetcode.com/problems/rotate-image,"Array, Math, Matrix"
EASY,Recyclable and Low Fat Products,58.6,0.8939113495108016,https://leetcode.com/problems/recyclable-and-low-fat-products,Database
EASY,Next Greater Element I,58.6,0.7381242568954219,https://leetcode.com/problems/next-greater-element-i,"Array, Hash Table, Stack, Monotonic Stack"
MEDIUM,Rotting Oranges,58.6,0.5584680091233112,https://leetcode.com/problems/rotting-oranges,"Array, Breadth-First Search, Matrix"
HARD,Median of Two Sorted Arrays,58.6,0.42747192689639263,https://leetcode.com/problems/median-of-two-sorted-arrays,"Array, Binary Search, Divide and Conquer"
MEDIUM,Search in Rotated Sorted Array,58.6,0.4221766214044605,https://leetcode.com/problems/search-in-rotated-sorted-array,"Array, Binary Search"
MEDIUM,Subarray Sum Equals K,58.6,0.44790472028926315,https://leetcode.com/problems/subarray-sum-equals-k,"Array, Hash Table, Prefix Sum"
EASY,Longest Common Prefix,58.6,0.44745498508642867,https://leetcode.com/problems/longest-common-prefix,"String, Trie"
MEDIUM,Combination Sum,58.6,0.7376240700504478,https://leetcode.com/problems/combination-sum,"Array, Backtracking"
MEDIUM,Identify the Largest Outlier in an Array,58.6,0.3164743707140386,https://leetcode.com/problems/identify-the-largest-outlier-in-an-array,"Array, Hash Table, Counting, Enumeration"
MEDIUM,House Robber,58.6,0.5192198802108446,https://leetcode.com/problems/house-robber,"Array, Dynamic Programming"
HARD,Trapping Rain Water II,53.1,0.5863626085459817,https://leetcode.com/problems/trapping-rain-water-ii,"Array, Breadth-First Search, Heap (Priority Queue), Matrix"
MEDIUM,Kth Smallest Element in a BST,53.1,0.745770210753856,https://leetcode.com/problems/kth-smallest-element-in-a-bst,"Tree, Depth-First Search, Binary Search Tree, Binary Tree"
MEDIUM,Unique Paths II,53.1,0.42692057186952076,https://leetcode.com/problems/unique-paths-ii,"Array, Dynamic Programming, Matrix"
MEDIUM,Random Pick with Weight,53.1,0.4809111539444359,https://leetcode.com/problems/random-pick-with-weight,"Array, Math, Binary Search, Prefix Sum, Randomized"
MEDIUM,Neighboring Bitwise XOR,53.1,0.8038308671135667,https://leetcode.com/problems/neighboring-bitwise-xor,"Array, Bit Manipulation"
MEDIUM,Amount of Time for Binary Tree to Be Infected,53.1,0.6311200182116783,https://leetcode.com/problems/amount-of-time-for-binary-tree-to-be-infected,"Hash Table, Tree, Depth-First Search, Breadth-First Search, Binary Tree"
MEDIUM,Jump Game II,53.1,0.41075118558543106,https://leetcode.com/problems/jump-game-ii,"Array, Dynamic Programming, Greedy"
MEDIUM,Kth Smallest Element in a Sorted Matrix,53.1,0.6315341180885362,https://leetcode.com/problems/kth-smallest-element-in-a-sorted-matrix,"Array, Binary Search, Sorting, Heap (Priority Queue), Matrix"
EASY,Sqrt(x),53.1,0.39941678114476326,https://leetcode.com/problems/sqrtx,"Math, Binary Search"
MEDIUM,Sort Colors,53.1,0.661819365376968,https://leetcode.com/problems/sort-colors,"Array, Two Pointers, Sorting"
MEDIUM,Max Consecutive Ones III,53.1,0.6507295233679313,https://leetcode.com/problems/max-consecutive-ones-iii,"Array, Binary Search, Sliding Window, Prefix Sum"
MEDIUM,Generate Parentheses,53.1,0.7639655045473931,https://leetcode.com/problems/generate-parentheses,"String, Dynamic Programming, Backtracking"
MEDIUM,Kth Largest Element in an Array,53.1,0.675276197596837,https://leetcode.com/problems/kth-largest-element-in-an-array,"Array, Divide and Conquer, Sorting, Heap (Priority Queue), Quickselect"
MEDIUM,Best Time to Buy and Sell Stock II,53.1,0.6871156712294486,https://leetcode.com/problems/best-time-to-buy-and-sell-stock-ii,"Array, Dynamic Programming, Greedy"
HARD,Minimum Number of Moves to Make Palindrome,53.1,0.5174410901864295,https://leetcode.com/problems/minimum-number-of-moves-to-make-palindrome,"Two Pointers, String, Greedy, Binary Indexed Tree"
EASY,Palindrome Number,53.1,0.5850827539317422,https://leetcode.com/problems/palindrome-number,Math
MEDIUM,The kth Factor of n,46.2,0.6917162590678076,https://leetcode.com/problems/the-kth-factor-of-n,"Math, Number Theory"
HARD,N-Queens,46.2,0.7143366157806651,https://leetcode.com/problems/n-queens,"Array, Backtracking"
MEDIUM,Spiral Matrix,46.2,0.5271677495280578,https://leetcode.com/problems/spiral-matrix,"Array, Matrix, Simulation"
MEDIUM,Rearrange Array Elements by Sign,46.2,0.8414055049545904,https://leetcode.com/problems/rearrange-array-elements-by-sign,"Array, Two Pointers, Simulation"
MEDIUM,Time Based Key-Value Store,46.2,0.4933295237058605,https://leetcode.com/problems/time-based-key-value-store,"Hash Table, String, Binary Search, Design"
MEDIUM,Count Servers that Communicate,46.2,0.734438825325092,https://leetcode.com/problems/count-servers-that-communicate,"Array, Depth-First Search, Breadth-First Search, Union Find, Matrix, Counting"
HARD,Concatenated Words,46.2,0.4932587389573928,https://leetcode.com/problems/concatenated-words,"Array, String, Dynamic Programming, Depth-First Search, Trie"
MEDIUM,Furthest Building You Can Reach,46.2,0.5010455833118722,https://leetcode.com/problems/furthest-building-you-can-reach,"Array, Greedy, Heap (Priority Queue)"
HARD,Longest Valid Parentheses,46.2,0.3553536437883029,https://leetcode.com/problems/longest-valid-parentheses,"String, Dynamic Programming, Stack"
MEDIUM,Sort Characters By Frequency,46.2,0.7356426500811527,https://leetcode.com/problems/sort-characters-by-frequency,"Hash Table, String, Sorting, Heap (Priority Queue), Bucket Sort, Counting"
MEDIUM,Coin Change,46.2,0.45679225396777234,https://leetcode.com/problems/coin-change,"Array, Dynamic Programming, Breadth-First Search"
MEDIUM,Plates Between Candles,46.2,0.4600357802400738,https://leetcode.com/problems/plates-between-candles,"Array, String, Binary Search, Prefix Sum"
MEDIUM,Palindrome Partitioning,46.2,0.7122590015408656,https://leetcode.com/problems/palindrome-partitioning,"String, Dynamic Programming, Backtracking"
HARD,Binary Tree Maximum Path Sum,46.2,0.40840152742971386,https://leetcode.com/problems/binary-tree-maximum-path-sum,"Dynamic Programming, Tree, Depth-First Search, Binary Tree"
HARD,Find K-th Smallest Pair Distance,46.2,0.45568761255756896,https://leetcode.com/problems/find-k-th-smallest-pair-distance,"Array, Two Pointers, Binary Search, Sorting"
MEDIUM,Valid Sudoku,46.2,0.615143403619089,https://leetcode.com/problems/valid-sudoku,"Array, Hash Table, Matrix"
EASY,Fibonacci Number,46.2,0.7243639496980091,https://leetcode.com/problems/fibonacci-number,"Math, Dynamic Programming, Recursion, Memoization"
MEDIUM,Min Stack,46.2,0.5578051022677841,https://leetcode.com/problems/min-stack,"Stack, Design"
MEDIUM,Word Break,46.2,0.4778796648267424,https://leetcode.com/problems/word-break,"Array, Hash Table, String, Dynamic Programming, Trie, Memoization"
HARD,Find Longest Self-Contained Substring,36.5,0.5829801108575154,https://leetcode.com/problems/find-longest-self-contained-substring,"Hash Table, String, Binary Search, Prefix Sum"
HARD,Minimum Number of Refueling Stops,36.5,0.40360648354123074,https://leetcode.com/problems/minimum-number-of-refueling-stops,"Array, Dynamic Programming, Greedy, Heap (Priority Queue)"
MEDIUM,Accounts Merge,36.5,0.5875952376264914,https://leetcode.com/problems/accounts-merge,"Array, Hash Table, String, Depth-First Search, Breadth-First Search, Union Find, Sorting"
MEDIUM,Unique Paths,36.5,0.6532759469559875,https://leetcode.com/problems/unique-paths,"Math, Dynamic Programming, Combinatorics"
EASY,Symmetric Tree,36.5,0.5848943131457678,https://leetcode.com/problems/symmetric-tree,"Tree, Depth-First Search, Breadth-First Search, Binary Tree"
HARD,Reverse Nodes in k-Group,36.5,0.6182052913545877,https://leetcode.com/problems/reverse-nodes-in-k-group,"Linked List, Recursion"
MEDIUM,Regions Cut By Slashes,36.5,0.7778698237837126,https://leetcode.com/problems/regions-cut-by-slashes,"Array, Hash Table, Depth-First Search, Breadth-First Search, Union Find, Matrix"
EASY,Employee Bonus,36.5,0.7696131560552293,https://leetcode.com/problems/employee-bonus,Database
HARD,Word Search II,36.5,0.3696114587898155,https://leetcode.com/problems/word-search-ii,"Array, String, Backtracking, Trie, Matrix"
EASY,Merge Two Sorted Lists,36.5,0.6615281584745043,https://leetcode.com/problems/merge-two-sorted-lists,"Linked List, Recursion"
MEDIUM,Letter Combinations of a Phone Number,36.5,0.6290659677613117,https://leetcode.com/problems/letter-combinations-of-a-phone-number,"Hash Table, String, Backtracking"
EASY,Single Number,36.5,0.7517138697752671,https://leetcode.com/problems/single-number,"Array, Bit Manipulation"
MEDIUM,Contiguous Array,36.5,0.48916370884904453,https://leetcode.com/problems/contiguous-array,"Array, Hash Table, Prefix Sum"
MEDIUM,Insert Delete GetRandom O(1),36.5,0.548643689664519,https://leetcode.com/problems/insert-delete-getrandom-o1,"Array, Hash Table, Math, Design, Randomized"
HARD,Minimum Cost to Make at Least One Valid Path in a Grid,36.5,0.7086068051558608,https://leetcode.com/problems/minimum-cost-to-make-at-least-one-valid-path-in-a-grid,"Array, Breadth-First Search, Graph, Heap (Priority Queue), Matrix, Shortest Path"
MEDIUM,Repeated DNA Sequences,36.5,0.5059124869607758,https://leetcode.com/problems/repeated-dna-sequences,"Hash Table, String, Bit Manipulation, Sliding Window, Rolling Hash, Hash Function"
MEDIUM,Minimum Size Subarray Sum,36.5,0.48611795103035005,https://leetcode.com/problems/minimum-size-subarray-sum,"Array, Binary Search, Sliding Window, Prefix Sum"
