Difficulty,Title,Frequency,Acceptance Rate,Link,Topics
EASY,Two Sum,100.0,0.5490427384996576,https://leetcode.com/problems/two-sum,"Array, Hash Table"
HARD,Trapping Rain Water,88.7,0.6412324260854139,https://leetcode.com/problems/trapping-rain-water,"Array, Two Pointers, Dynamic Programming, Stack, Monotonic Stack"
MEDIUM,Group Anagrams,84.1,0.7021294569721956,https://leetcode.com/problems/group-anagrams,"Array, Hash Table, String, Sorting"
EASY,Best Time to Buy and Sell Stock,83.0,0.5468400768872443,https://leetcode.com/problems/best-time-to-buy-and-sell-stock,"Array, Dynamic Programming"
EASY,Merge Sorted Array,82.7,0.520980673342063,https://leetcode.com/problems/merge-sorted-array,"Array, Two Pointers, Sorting"
MEDIUM,Longest Substring Without Repeating Characters,79.9,0.36201636994637626,https://leetcode.com/problems/longest-substring-without-repeating-characters,"Hash Table, String, Sliding Window"
MEDIUM,Jump Game,75.0,0.39056410388847373,https://leetcode.com/problems/jump-game,"Array, Dynamic Programming, Greedy"
MEDIUM,Merge Intervals,74.5,0.48695059420116815,https://leetcode.com/problems/merge-intervals,"Array, Sorting"
HARD,Word Ladder,73.2,0.4165543324709498,https://leetcode.com/problems/word-ladder,"Hash Table, String, Breadth-First Search"
MEDIUM,Add Two Numbers,72.7,0.4527247357608663,https://leetcode.com/problems/add-two-numbers,"Linked List, Math, Recursion"
HARD,Merge k Sorted Lists,72.2,0.5556685430549169,https://leetcode.com/problems/merge-k-sorted-lists,"Linked List, Divide and Conquer, Heap (Priority Queue), Merge Sort"
MEDIUM,Longest Palindromic Substring,71.2,0.3518925482578306,https://leetcode.com/problems/longest-palindromic-substring,"Two Pointers, String, Dynamic Programming"
MEDIUM,3Sum,71.2,0.3627882689037001,https://leetcode.com/problems/3sum,"Array, Two Pointers, Sorting"
EASY,Valid Parentheses,70.7,0.41739341593221435,https://leetcode.com/problems/valid-parentheses,"String, Stack"
EASY,Longest Common Prefix,70.2,0.44745498508642867,https://leetcode.com/problems/longest-common-prefix,"String, Trie"
MEDIUM,Maximum Subarray,69.0,0.5164878226060033,https://leetcode.com/problems/maximum-subarray,"Array, Divide and Conquer, Dynamic Programming"
MEDIUM,Generate Parentheses,67.9,0.7639655045473931,https://leetcode.com/problems/generate-parentheses,"String, Dynamic Programming, Backtracking"
EASY,Palindrome Number,67.2,0.5850827539317422,https://leetcode.com/problems/palindrome-number,Math
EASY,Climbing Stairs,67.2,0.5331671027356765,https://leetcode.com/problems/climbing-stairs,"Math, Dynamic Programming, Memoization"
MEDIUM,Word Search,66.6,0.4448818799527243,https://leetcode.com/problems/word-search,"Array, String, Backtracking, Depth-First Search, Matrix"
MEDIUM,Longest Consecutive Sequence,64.6,0.4725513985835538,https://leetcode.com/problems/longest-consecutive-sequence,"Array, Hash Table, Union Find"
MEDIUM,Spiral Matrix,64.6,0.5271677495280578,https://leetcode.com/problems/spiral-matrix,"Array, Matrix, Simulation"
MEDIUM,Letter Combinations of a Phone Number,63.1,0.6290660650570409,https://leetcode.com/problems/letter-combinations-of-a-phone-number,"Hash Table, String, Backtracking"
MEDIUM,Container With Most Water,62.3,0.5703986564678482,https://leetcode.com/problems/container-with-most-water,"Array, Two Pointers, Greedy"
MEDIUM,Search in Rotated Sorted Array,61.5,0.4221765679970348,https://leetcode.com/problems/search-in-rotated-sorted-array,"Array, Binary Search"
MEDIUM,Jump Game II,58.8,0.41075118558543106,https://leetcode.com/problems/jump-game-ii,"Array, Dynamic Programming, Greedy"
MEDIUM,Best Time to Buy and Sell Stock II,58.8,0.6871156712294486,https://leetcode.com/problems/best-time-to-buy-and-sell-stock-ii,"Array, Dynamic Programming, Greedy"
HARD,Largest Rectangle in Histogram,56.8,0.4644753801982579,https://leetcode.com/problems/largest-rectangle-in-histogram,"Array, Stack, Monotonic Stack"
MEDIUM,"Pow(x, n)",56.8,0.3635444408426503,https://leetcode.com/problems/powx-n,"Math, Recursion"
MEDIUM,Reverse Integer,56.8,0.29779343516991336,https://leetcode.com/problems/reverse-integer,Math
EASY,Roman to Integer,55.7,0.6397787972259095,https://leetcode.com/problems/roman-to-integer,"Hash Table, Math, String"
EASY,Remove Duplicates from Sorted Array,55.7,0.5922420973488799,https://leetcode.com/problems/remove-duplicates-from-sorted-array,"Array, Two Pointers"
MEDIUM,Gas Station,55.7,0.45917020639981343,https://leetcode.com/problems/gas-station,"Array, Greedy"
EASY,Merge Two Sorted Lists,55.7,0.6615281584745043,https://leetcode.com/problems/merge-two-sorted-lists,"Linked List, Recursion"
MEDIUM,Rotate Image,55.7,0.770165839289031,https://leetcode.com/problems/rotate-image,"Array, Math, Matrix"
MEDIUM,Plates Between Candles,54.5,0.4600357802400738,https://leetcode.com/problems/plates-between-candles,"Array, String, Binary Search, Prefix Sum"
HARD,Binary Tree Maximum Path Sum,54.5,0.408401691106144,https://leetcode.com/problems/binary-tree-maximum-path-sum,"Dynamic Programming, Tree, Depth-First Search, Binary Tree"
MEDIUM,Valid Sudoku,54.5,0.6151435311489218,https://leetcode.com/problems/valid-sudoku,"Array, Hash Table, Matrix"
MEDIUM,Subsets,53.3,0.801252312812163,https://leetcode.com/problems/subsets,"Array, Backtracking, Bit Manipulation"
MEDIUM,Unique Paths,53.3,0.6532757515508406,https://leetcode.com/problems/unique-paths,"Math, Dynamic Programming, Combinatorics"
HARD,First Missing Positive,52.0,0.4052979398682367,https://leetcode.com/problems/first-missing-positive,"Array, Hash Table"
MEDIUM,Sort Colors,52.0,0.661819365376968,https://leetcode.com/problems/sort-colors,"Array, Two Pointers, Sorting"
EASY,Maximum Depth of Binary Tree,52.0,0.766788058374816,https://leetcode.com/problems/maximum-depth-of-binary-tree,"Tree, Depth-First Search, Breadth-First Search, Binary Tree"
MEDIUM,Next Permutation,50.7,0.4217890700635919,https://leetcode.com/problems/next-permutation,"Array, Two Pointers"
MEDIUM,Zigzag Conversion,50.7,0.5060172689090966,https://leetcode.com/problems/zigzag-conversion,String
EASY,Remove Element,50.7,0.5929226328199296,https://leetcode.com/problems/remove-element,"Array, Two Pointers"
MEDIUM,Combination Sum,50.7,0.7376240700504478,https://leetcode.com/problems/combination-sum,"Array, Backtracking"
MEDIUM,Find First and Last Position of Element in Sorted Array,50.7,0.46018500173890575,https://leetcode.com/problems/find-first-and-last-position-of-element-in-sorted-array,"Array, Binary Search"
MEDIUM,Binary Tree Zigzag Level Order Traversal,50.7,0.608707232546393,https://leetcode.com/problems/binary-tree-zigzag-level-order-traversal,"Tree, Breadth-First Search, Binary Tree"
HARD,Longest Valid Parentheses,49.2,0.35535349570077585,https://leetcode.com/problems/longest-valid-parentheses,"String, Dynamic Programming, Stack"
HARD,Candy,49.2,0.4429339821290245,https://leetcode.com/problems/candy,"Array, Greedy"
MEDIUM,Binary Tree Level Order Traversal,49.2,0.6963931339745539,https://leetcode.com/problems/binary-tree-level-order-traversal,"Tree, Breadth-First Search, Binary Tree"
HARD,Regular Expression Matching,49.2,0.2889135143276844,https://leetcode.com/problems/regular-expression-matching,"String, Dynamic Programming, Recursion"
MEDIUM,Integer to Roman,49.2,0.6765151591433145,https://leetcode.com/problems/integer-to-roman,"Hash Table, Math, String"
MEDIUM,Remove Duplicates from Sorted Array II,47.6,0.618901957068219,https://leetcode.com/problems/remove-duplicates-from-sorted-array-ii,"Array, Two Pointers"
HARD,Minimum Window Substring,47.6,0.4453664209231725,https://leetcode.com/problems/minimum-window-substring,"Hash Table, String, Sliding Window"
MEDIUM,Validate Binary Search Tree,45.8,0.3390017723480861,https://leetcode.com/problems/validate-binary-search-tree,"Tree, Depth-First Search, Binary Search Tree, Binary Tree"
EASY,Pascal's Triangle,45.8,0.7629535740965259,https://leetcode.com/problems/pascals-triangle,"Array, Dynamic Programming"
EASY,Plus One,45.8,0.46935083172699005,https://leetcode.com/problems/plus-one,"Array, Math"
HARD,Reverse Nodes in k-Group,45.8,0.6182052913545877,https://leetcode.com/problems/reverse-nodes-in-k-group,"Linked List, Recursion"
EASY,Find the Index of the First Occurrence in a String,45.8,0.44346668720431043,https://leetcode.com/problems/find-the-index-of-the-first-occurrence-in-a-string,"Two Pointers, String, String Matching"
MEDIUM,Search a 2D Matrix,43.9,0.5167892875559169,https://leetcode.com/problems/search-a-2d-matrix,"Array, Binary Search, Matrix"
EASY,Symmetric Tree,43.9,0.5848941656584444,https://leetcode.com/problems/symmetric-tree,"Tree, Depth-First Search, Breadth-First Search, Binary Tree"
MEDIUM,4Sum,43.9,0.374749728929133,https://leetcode.com/problems/4sum,"Array, Two Pointers, Sorting"
EASY,Single Number,43.9,0.7517138697752671,https://leetcode.com/problems/single-number,"Array, Bit Manipulation"
MEDIUM,Palindrome Partitioning,41.9,0.7122590015408656,https://leetcode.com/problems/palindrome-partitioning,"String, Dynamic Programming, Backtracking"
HARD,N-Queens,41.9,0.7143368424728085,https://leetcode.com/problems/n-queens,"Array, Backtracking"
MEDIUM,Minimum Path Sum,41.9,0.6573780452007831,https://leetcode.com/problems/minimum-path-sum,"Array, Dynamic Programming, Matrix"
MEDIUM,Remove Nth Node From End of List,39.5,0.47927322684018575,https://leetcode.com/problems/remove-nth-node-from-end-of-list,"Linked List, Two Pointers"
MEDIUM,Reverse Linked List II,39.5,0.4898357793190765,https://leetcode.com/problems/reverse-linked-list-ii,Linked List
EASY,Valid Palindrome,39.5,0.49966256690617195,https://leetcode.com/problems/valid-palindrome,"Two Pointers, String"
EASY,Same Tree,39.5,0.6430559378386068,https://leetcode.com/problems/same-tree,"Tree, Depth-First Search, Breadth-First Search, Binary Tree"
MEDIUM,Search in Rotated Sorted Array II,36.9,0.38532748681071444,https://leetcode.com/problems/search-in-rotated-sorted-array-ii,"Array, Binary Search"
MEDIUM,Rotate List,36.9,0.3928125945589539,https://leetcode.com/problems/rotate-list,"Linked List, Two Pointers"
HARD,Text Justification,36.9,0.468313682006703,https://leetcode.com/problems/text-justification,"Array, String, Simulation"
MEDIUM,Divide Two Integers,36.9,0.18081207703465754,https://leetcode.com/problems/divide-two-integers,"Math, Bit Manipulation"
MEDIUM,Count Good Numbers,36.9,0.4801676878426314,https://leetcode.com/problems/count-good-numbers,"Math, Recursion"
EASY,Search Insert Position,36.9,0.481973165842968,https://leetcode.com/problems/search-insert-position,"Array, Binary Search"
MEDIUM,Simplify Path,33.9,0.4627515456597685,https://leetcode.com/problems/simplify-path,"String, Stack"
MEDIUM,Clone Graph,33.9,0.6093552242355165,https://leetcode.com/problems/clone-graph,"Hash Table, Depth-First Search, Breadth-First Search, Graph"
HARD,Sudoku Solver,33.9,0.636458356425547,https://leetcode.com/problems/sudoku-solver,"Array, Hash Table, Backtracking, Matrix"
MEDIUM,Decode Ways,33.9,0.3601892117338091,https://leetcode.com/problems/decode-ways,"String, Dynamic Programming"
HARD,Wildcard Matching,30.4,0.2927083817612,https://leetcode.com/problems/wildcard-matching,"String, Dynamic Programming, Greedy, Recursion"
MEDIUM,Path Sum II,30.4,0.5995582694716494,https://leetcode.com/problems/path-sum-ii,"Backtracking, Tree, Depth-First Search, Binary Tree"
MEDIUM,Set Matrix Zeroes,30.4,0.5874359870214113,https://leetcode.com/problems/set-matrix-zeroes,"Array, Hash Table, Matrix"
MEDIUM,Triangle,30.4,0.5849505156813639,https://leetcode.com/problems/triangle,"Array, Dynamic Programming"
MEDIUM,Permutations,30.4,0.8000934616751499,https://leetcode.com/problems/permutations,"Array, Backtracking"
MEDIUM,Swap Nodes in Pairs,26.2,0.6636246479474268,https://leetcode.com/problems/swap-nodes-in-pairs,"Linked List, Recursion"
EASY,Remove Duplicates from Sorted List,26.2,0.5423288321607861,https://leetcode.com/problems/remove-duplicates-from-sorted-list,Linked List
MEDIUM,Partition List,26.2,0.5815805123274632,https://leetcode.com/problems/partition-list,"Linked List, Two Pointers"
MEDIUM,Construct Binary Tree from Preorder and Inorder Traversal,26.2,0.6596416712167091,https://leetcode.com/problems/construct-binary-tree-from-preorder-and-inorder-traversal,"Array, Hash Table, Divide and Conquer, Tree, Binary Tree"
MEDIUM,Combination Sum II,26.2,0.5710435032367822,https://leetcode.com/problems/combination-sum-ii,"Array, Backtracking"
EASY,Path Sum,26.2,0.5226953631954017,https://leetcode.com/problems/path-sum,"Tree, Depth-First Search, Breadth-First Search, Binary Tree"
EASY,Balanced Binary Tree,26.2,0.5447647833093159,https://leetcode.com/problems/balanced-binary-tree,"Tree, Depth-First Search, Binary Tree"
MEDIUM,String to Integer (atoi),26.2,0.18614436711954913,https://leetcode.com/problems/string-to-integer-atoi,String
MEDIUM,Combinations,14.2,0.7214215246912694,https://leetcode.com/problems/combinations,Backtracking
MEDIUM,Restore IP Addresses,14.2,0.5221676377158972,https://leetcode.com/problems/restore-ip-addresses,"String, Backtracking"
MEDIUM,Subsets II,14.2,0.5878266858733951,https://leetcode.com/problems/subsets-ii,"Array, Backtracking, Bit Manipulation"
EASY,Minimum Number of Moves to Seat Everyone,14.2,0.8738256943456338,https://leetcode.com/problems/minimum-number-of-moves-to-seat-everyone,"Array, Greedy, Sorting, Counting Sort"
MEDIUM,3Sum Closest,14.2,0.4653945987885047,https://leetcode.com/problems/3sum-closest,"Array, Two Pointers, Sorting"
