Difficulty,Title,Frequency,Acceptance Rate,Link,Topics
EASY,Two Sum,100.0,0.5568011703258045,https://leetcode.com/problems/two-sum,"Array, Hash Table"
HARD,Trapping Rain Water,87.7,0.6495014314922771,https://leetcode.com/problems/trapping-rain-water,"Array, Two Pointers, Dynamic Programming, Stack, Monotonic Stack"
MEDIUM,Longest Substring Without Repeating Characters,82.3,0.3682180202441125,https://leetcode.com/problems/longest-substring-without-repeating-characters,"Hash Table, String, Sliding Window"
MEDIUM,Group Anagrams,81.7,0.7083641928159685,https://leetcode.com/problems/group-anagrams,"Array, Hash Table, String, Sorting"
EASY,Best Time to Buy and Sell Stock,81.1,0.551571886731386,https://leetcode.com/problems/best-time-to-buy-and-sell-stock,"Array, Dynamic Programming"
MEDIUM,Merge Intervals,79.9,0.49292442696343713,https://leetcode.com/problems/merge-intervals,"Array, Sorting"
HARD,Merge k Sorted Lists,77.7,0.5660771431930968,https://leetcode.com/problems/merge-k-sorted-lists,"Linked List, Divide and Conquer, Heap (Priority Queue), Merge Sort"
MEDIUM,Add Two Numbers,77.0,0.4608946763496157,https://leetcode.com/problems/add-two-numbers,"Linked List, Math, Recursion"
MEDIUM,Copy List with Random Pointer,74.3,0.6034473186479614,https://leetcode.com/problems/copy-list-with-random-pointer,"Hash Table, Linked List"
HARD,Word Ladder,73.0,0.42628163235152045,https://leetcode.com/problems/word-ladder,"Hash Table, String, Breadth-First Search"
MEDIUM,Search in Rotated Sorted Array,72.6,0.42739832476093814,https://leetcode.com/problems/search-in-rotated-sorted-array,"Array, Binary Search"
EASY,Valid Parentheses,72.6,0.42245225793036384,https://leetcode.com/problems/valid-parentheses,"String, Stack"
MEDIUM,Jump Game,71.7,0.3940126166533732,https://leetcode.com/problems/jump-game,"Array, Dynamic Programming, Greedy"
MEDIUM,3Sum,71.7,0.36956108692200174,https://leetcode.com/problems/3sum,"Array, Two Pointers, Sorting"
EASY,Merge Sorted Array,71.2,0.5280212619033489,https://leetcode.com/problems/merge-sorted-array,"Array, Two Pointers, Sorting"
MEDIUM,Maximum Subarray,71.2,0.5203996213315446,https://leetcode.com/problems/maximum-subarray,"Array, Divide and Conquer, Dynamic Programming"
MEDIUM,Word Search,69.7,0.45145606387326426,https://leetcode.com/problems/word-search,"Array, String, Backtracking, Depth-First Search, Matrix"
EASY,Climbing Stairs,69.7,0.535077297701124,https://leetcode.com/problems/climbing-stairs,"Math, Dynamic Programming, Memoization"
EASY,Longest Common Prefix,69.2,0.4537240072120204,https://leetcode.com/problems/longest-common-prefix,"String, Trie"
MEDIUM,Longest Palindromic Substring,68.1,0.3574416099924265,https://leetcode.com/problems/longest-palindromic-substring,"Two Pointers, String, Dynamic Programming"
MEDIUM,Longest Consecutive Sequence,66.4,0.470491628436827,https://leetcode.com/problems/longest-consecutive-sequence,"Array, Hash Table, Union Find"
MEDIUM,Generate Parentheses,65.1,0.7702796667214271,https://leetcode.com/problems/generate-parentheses,"String, Dynamic Programming, Backtracking"
MEDIUM,Spiral Matrix,63.8,0.5375487344600646,https://leetcode.com/problems/spiral-matrix,"Array, Matrix, Simulation"
EASY,Remove Duplicates from Sorted Array,63.1,0.6020663222472546,https://leetcode.com/problems/remove-duplicates-from-sorted-array,"Array, Two Pointers"
MEDIUM,Container With Most Water,61.6,0.576807985174844,https://leetcode.com/problems/container-with-most-water,"Array, Two Pointers, Greedy"
HARD,Word Break II,60.8,0.5352405973749098,https://leetcode.com/problems/word-break-ii,"Array, Hash Table, String, Dynamic Programming, Backtracking, Trie, Memoization"
MEDIUM,Letter Combinations of a Phone Number,59.2,0.6372997078487204,https://leetcode.com/problems/letter-combinations-of-a-phone-number,"Hash Table, String, Backtracking"
HARD,First Missing Positive,59.2,0.41007536933660105,https://leetcode.com/problems/first-missing-positive,"Array, Hash Table"
EASY,Merge Two Sorted Lists,59.2,0.6675269883431951,https://leetcode.com/problems/merge-two-sorted-lists,"Linked List, Recursion"
MEDIUM,Best Time to Buy and Sell Stock II,58.3,0.6938078972424274,https://leetcode.com/problems/best-time-to-buy-and-sell-stock-ii,"Array, Dynamic Programming, Greedy"
MEDIUM,Rotate Image,58.3,0.77761040657931,https://leetcode.com/problems/rotate-image,"Array, Math, Matrix"
MEDIUM,Reverse Integer,58.3,0.30224313830343924,https://leetcode.com/problems/reverse-integer,Math
EASY,Palindrome Number,58.3,0.5914904331761431,https://leetcode.com/problems/palindrome-number,Math
MEDIUM,Valid Sudoku,57.3,0.6216827073541417,https://leetcode.com/problems/valid-sudoku,"Array, Hash Table, Matrix"
HARD,Binary Tree Maximum Path Sum,57.3,0.41163486461292104,https://leetcode.com/problems/binary-tree-maximum-path-sum,"Dynamic Programming, Tree, Depth-First Search, Binary Tree"
MEDIUM,Subsets,56.4,0.8076111005260969,https://leetcode.com/problems/subsets,"Array, Backtracking, Bit Manipulation"
MEDIUM,Binary Tree Zigzag Level Order Traversal,56.4,0.6154454434561499,https://leetcode.com/problems/binary-tree-zigzag-level-order-traversal,"Tree, Breadth-First Search, Binary Tree"
MEDIUM,Jump Game II,56.4,0.41424558524722493,https://leetcode.com/problems/jump-game-ii,"Array, Dynamic Programming, Greedy"
MEDIUM,Find First and Last Position of Element in Sorted Array,55.3,0.46696597475170376,https://leetcode.com/problems/find-first-and-last-position-of-element-in-sorted-array,"Array, Binary Search"
HARD,Minimum Window Substring,55.3,0.45220971769371304,https://leetcode.com/problems/minimum-window-substring,"Hash Table, String, Sliding Window"
MEDIUM,Unique Paths,55.3,0.6570537731586082,https://leetcode.com/problems/unique-paths,"Math, Dynamic Programming, Combinatorics"
MEDIUM,"Pow(x, n)",54.3,0.3694076667821637,https://leetcode.com/problems/powx-n,"Math, Recursion"
MEDIUM,Sort Colors,54.3,0.6745353394316634,https://leetcode.com/problems/sort-colors,"Array, Two Pointers, Sorting"
MEDIUM,Binary Tree Level Order Traversal,54.3,0.7045072260904847,https://leetcode.com/problems/binary-tree-level-order-traversal,"Tree, Breadth-First Search, Binary Tree"
MEDIUM,4Sum,54.3,0.38090668156212115,https://leetcode.com/problems/4sum,"Array, Two Pointers, Sorting"
HARD,Largest Rectangle in Histogram,54.3,0.4721849559834752,https://leetcode.com/problems/largest-rectangle-in-histogram,"Array, Stack, Monotonic Stack"
EASY,Pascal's Triangle,53.1,0.7691350073565829,https://leetcode.com/problems/pascals-triangle,"Array, Dynamic Programming"
MEDIUM,Next Permutation,51.9,0.4292059353396416,https://leetcode.com/problems/next-permutation,"Array, Two Pointers"
MEDIUM,Integer to Roman,51.9,0.6848152838362157,https://leetcode.com/problems/integer-to-roman,"Hash Table, Math, String"
EASY,Roman to Integer,50.6,0.6475820327583631,https://leetcode.com/problems/roman-to-integer,"Hash Table, Math, String"
MEDIUM,Permutations,50.6,0.805743007890841,https://leetcode.com/problems/permutations,"Array, Backtracking"
MEDIUM,Plates Between Candles,49.3,0.4660668243089789,https://leetcode.com/problems/plates-between-candles,"Array, String, Binary Search, Prefix Sum"
EASY,Find the Index of the First Occurrence in a String,49.3,0.44888321352992056,https://leetcode.com/problems/find-the-index-of-the-first-occurrence-in-a-string,"Two Pointers, String, String Matching"
HARD,Candy,49.3,0.44793761365209284,https://leetcode.com/problems/candy,"Array, Greedy"
MEDIUM,Palindrome Partitioning,49.3,0.7196893160150074,https://leetcode.com/problems/palindrome-partitioning,"String, Dynamic Programming, Backtracking"
MEDIUM,Set Matrix Zeroes,49.3,0.6055601005169527,https://leetcode.com/problems/set-matrix-zeroes,"Array, Hash Table, Matrix"
MEDIUM,Simplify Path,47.8,0.47656551791884655,https://leetcode.com/problems/simplify-path,"String, Stack"
MEDIUM,Zigzag Conversion,47.8,0.5146459684822924,https://leetcode.com/problems/zigzag-conversion,String
HARD,Regular Expression Matching,47.8,0.29230081352743403,https://leetcode.com/problems/regular-expression-matching,"String, Dynamic Programming, Recursion"
HARD,Longest Valid Parentheses,47.8,0.3620801368391016,https://leetcode.com/problems/longest-valid-parentheses,"String, Dynamic Programming, Stack"
EASY,Single Number,47.8,0.7585181737050419,https://leetcode.com/problems/single-number,"Array, Bit Manipulation"
MEDIUM,Combination Sum,46.2,0.7453536365022299,https://leetcode.com/problems/combination-sum,"Array, Backtracking"
MEDIUM,Validate Binary Search Tree,44.5,0.343033455920076,https://leetcode.com/problems/validate-binary-search-tree,"Tree, Depth-First Search, Binary Search Tree, Binary Tree"
MEDIUM,Gas Station,44.5,0.46305933517523845,https://leetcode.com/problems/gas-station,"Array, Greedy"
MEDIUM,Minimum Path Sum,44.5,0.6636092425303604,https://leetcode.com/problems/minimum-path-sum,"Array, Dynamic Programming, Matrix"
MEDIUM,Reorder List,44.5,0.6233649122807018,https://leetcode.com/problems/reorder-list,"Linked List, Two Pointers, Stack, Recursion"
HARD,N-Queens,44.5,0.7258154745101002,https://leetcode.com/problems/n-queens,"Array, Backtracking"
MEDIUM,Remove Nth Node From End of List,44.5,0.4879381855257099,https://leetcode.com/problems/remove-nth-node-from-end-of-list,"Linked List, Two Pointers"
HARD,Reverse Nodes in k-Group,44.5,0.6285918489001299,https://leetcode.com/problems/reverse-nodes-in-k-group,"Linked List, Recursion"
MEDIUM,Search a 2D Matrix,42.6,0.5218677504130868,https://leetcode.com/problems/search-a-2d-matrix,"Array, Binary Search, Matrix"
MEDIUM,Count Good Numbers,42.6,0.5656397004506422,https://leetcode.com/problems/count-good-numbers,"Math, Recursion"
EASY,Symmetric Tree,42.6,0.5915660347022756,https://leetcode.com/problems/symmetric-tree,"Tree, Depth-First Search, Breadth-First Search, Binary Tree"
EASY,Plus One,42.6,0.47468633706640545,https://leetcode.com/problems/plus-one,"Array, Math"
MEDIUM,String to Integer (atoi),40.5,0.19126829708583554,https://leetcode.com/problems/string-to-integer-atoi,String
MEDIUM,Remove Duplicates from Sorted Array II,40.5,0.6280928717642069,https://leetcode.com/problems/remove-duplicates-from-sorted-array-ii,"Array, Two Pointers"
EASY,Remove Element,38.2,0.5993706042199488,https://leetcode.com/problems/remove-element,"Array, Two Pointers"
EASY,Maximum Depth of Binary Tree,38.2,0.770658593276859,https://leetcode.com/problems/maximum-depth-of-binary-tree,"Tree, Depth-First Search, Breadth-First Search, Binary Tree"
EASY,Valid Palindrome,38.2,0.5081505898339207,https://leetcode.com/problems/valid-palindrome,"Two Pointers, String"
MEDIUM,Swap Nodes in Pairs,38.2,0.6707554591678574,https://leetcode.com/problems/swap-nodes-in-pairs,"Linked List, Recursion"
MEDIUM,Reverse Linked List II,35.6,0.4950562501987037,https://leetcode.com/problems/reverse-linked-list-ii,Linked List
HARD,Sudoku Solver,35.6,0.6382463027964002,https://leetcode.com/problems/sudoku-solver,"Array, Hash Table, Backtracking, Matrix"
MEDIUM,Rotate List,35.6,0.3984151910312895,https://leetcode.com/problems/rotate-list,"Linked List, Two Pointers"
MEDIUM,Clone Graph,35.6,0.6217409339401505,https://leetcode.com/problems/clone-graph,"Hash Table, Depth-First Search, Breadth-First Search, Graph"
HARD,Text Justification,35.6,0.47978211901398843,https://leetcode.com/problems/text-justification,"Array, String, Simulation"
MEDIUM,Construct Binary Tree from Preorder and Inorder Traversal,35.6,0.6670037925594734,https://leetcode.com/problems/construct-binary-tree-from-preorder-and-inorder-traversal,"Array, Hash Table, Divide and Conquer, Tree, Binary Tree"
MEDIUM,Partition List,32.6,0.5887422129020967,https://leetcode.com/problems/partition-list,"Linked List, Two Pointers"
MEDIUM,Subsets II,32.6,0.5938521599316511,https://leetcode.com/problems/subsets-ii,"Array, Backtracking, Bit Manipulation"
MEDIUM,Divide Two Integers,29.1,0.1835049593051786,https://leetcode.com/problems/divide-two-integers,"Math, Bit Manipulation"
EASY,Same Tree,29.1,0.6499646570105054,https://leetcode.com/problems/same-tree,"Tree, Depth-First Search, Breadth-First Search, Binary Tree"
MEDIUM,Decode Ways,29.1,0.36454641975649105,https://leetcode.com/problems/decode-ways,"String, Dynamic Programming"
EASY,Linked List Cycle,25.0,0.5246154569113358,https://leetcode.com/problems/linked-list-cycle,"Hash Table, Linked List, Two Pointers"
HARD,Wildcard Matching,25.0,0.29785737602877677,https://leetcode.com/problems/wildcard-matching,"String, Dynamic Programming, Greedy, Recursion"
MEDIUM,Linked List Cycle II,25.0,0.5472599139381797,https://leetcode.com/problems/linked-list-cycle-ii,"Hash Table, Linked List, Two Pointers"
EASY,Path Sum,25.0,0.5289084306776918,https://leetcode.com/problems/path-sum,"Tree, Depth-First Search, Breadth-First Search, Binary Tree"
MEDIUM,Search in Rotated Sorted Array II,19.8,0.3882681743660068,https://leetcode.com/problems/search-in-rotated-sorted-array-ii,"Array, Binary Search"
EASY,Search Insert Position,19.8,0.48884741891069483,https://leetcode.com/problems/search-insert-position,"Array, Binary Search"
MEDIUM,Combination Sum II,19.8,0.5757452867070844,https://leetcode.com/problems/combination-sum-ii,"Array, Backtracking"
MEDIUM,3Sum Closest,13.3,0.46843022017346697,https://leetcode.com/problems/3sum-closest,"Array, Two Pointers, Sorting"
MEDIUM,Path Sum II,13.3,0.604100150035948,https://leetcode.com/problems/path-sum-ii,"Backtracking, Tree, Depth-First Search, Binary Tree"
MEDIUM,Triangle,13.3,0.5913302251760738,https://leetcode.com/problems/triangle,"Array, Dynamic Programming"
