Difficulty,Title,Frequency,Acceptance Rate,Link,Topics
EASY,Two Sum,100.0,0.5577698896587009,https://leetcode.com/problems/two-sum,"Array, Hash Table"
HARD,Trapping Rain Water,87.4,0.6510192881379091,https://leetcode.com/problems/trapping-rain-water,"Array, Two Pointers, Dynamic Programming, Stack, Monotonic Stack"
EASY,Best Time to Buy and Sell Stock,83.5,0.5525965868759138,https://leetcode.com/problems/best-time-to-buy-and-sell-stock,"Array, Dynamic Programming"
MEDIUM,Longest Substring Without Repeating Characters,82.5,0.3693616682204484,https://leetcode.com/problems/longest-substring-without-repeating-characters,"Hash Table, String, Sliding Window"
MEDIUM,Merge Intervals,80.5,0.4939526774846352,https://leetcode.com/problems/merge-intervals,"Array, Sorting"
MEDIUM,Group Anagrams,79.9,0.7092881943320976,https://leetcode.com/problems/group-anagrams,"Array, Hash Table, String, Sorting"
MEDIUM,Add Two Numbers,77.7,0.4622507658063209,https://leetcode.com/problems/add-two-numbers,"Linked List, Math, Recursion"
HARD,Merge k Sorted Lists,77.3,0.567741907864408,https://leetcode.com/problems/merge-k-sorted-lists,"Linked List, Divide and Conquer, Heap (Priority Queue), Merge Sort"
MEDIUM,3Sum,74.0,0.3707095392707933,https://leetcode.com/problems/3sum,"Array, Two Pointers, Sorting"
EASY,Valid Parentheses,73.6,0.42322816672162217,https://leetcode.com/problems/valid-parentheses,"String, Stack"
MEDIUM,Search in Rotated Sorted Array,73.1,0.4283722138743466,https://leetcode.com/problems/search-in-rotated-sorted-array,"Array, Binary Search"
MEDIUM,Maximum Subarray,73.1,0.5209978310902755,https://leetcode.com/problems/maximum-subarray,"Array, Divide and Conquer, Dynamic Programming"
MEDIUM,Copy List with Random Pointer,71.8,0.6053669280147949,https://leetcode.com/problems/copy-list-with-random-pointer,"Hash Table, Linked List"
HARD,Word Ladder,71.8,0.4281180881873274,https://leetcode.com/problems/word-ladder,"Hash Table, String, Breadth-First Search"
MEDIUM,Longest Palindromic Substring,70.4,0.3584611475412551,https://leetcode.com/problems/longest-palindromic-substring,"Two Pointers, String, Dynamic Programming"
MEDIUM,Word Search,69.9,0.45266914526852353,https://leetcode.com/problems/word-search,"Array, String, Backtracking, Depth-First Search, Matrix"
EASY,Merge Sorted Array,69.9,0.5291952052651709,https://leetcode.com/problems/merge-sorted-array,"Array, Two Pointers, Sorting"
MEDIUM,Jump Game,69.4,0.39479203759193593,https://leetcode.com/problems/jump-game,"Array, Dynamic Programming, Greedy"
EASY,Climbing Stairs,68.9,0.5354071346208594,https://leetcode.com/problems/climbing-stairs,"Math, Dynamic Programming, Memoization"
MEDIUM,Generate Parentheses,68.4,0.7713286717803378,https://leetcode.com/problems/generate-parentheses,"String, Dynamic Programming, Backtracking"
MEDIUM,Longest Consecutive Sequence,66.1,0.47040828018665215,https://leetcode.com/problems/longest-consecutive-sequence,"Array, Hash Table, Union Find"
EASY,Longest Common Prefix,64.8,0.4548305505260665,https://leetcode.com/problems/longest-common-prefix,"String, Trie"
MEDIUM,Container With Most Water,63.5,0.5778282574410597,https://leetcode.com/problems/container-with-most-water,"Array, Two Pointers, Greedy"
HARD,Word Break II,62.1,0.5364536357075469,https://leetcode.com/problems/word-break-ii,"Array, Hash Table, String, Dynamic Programming, Backtracking, Trie, Memoization"
EASY,Remove Duplicates from Sorted Array,61.3,0.6035551112882038,https://leetcode.com/problems/remove-duplicates-from-sorted-array,"Array, Two Pointers"
EASY,Merge Two Sorted Lists,60.5,0.6684091757223755,https://leetcode.com/problems/merge-two-sorted-lists,"Linked List, Recursion"
MEDIUM,Jump Game II,60.5,0.4150321496760298,https://leetcode.com/problems/jump-game-ii,"Array, Dynamic Programming, Greedy"
MEDIUM,Spiral Matrix,60.5,0.5393973501075863,https://leetcode.com/problems/spiral-matrix,"Array, Matrix, Simulation"
MEDIUM,Find First and Last Position of Element in Sorted Array,60.5,0.4682873183580639,https://leetcode.com/problems/find-first-and-last-position-of-element-in-sorted-array,"Array, Binary Search"
MEDIUM,Unique Paths,59.7,0.6577283527258664,https://leetcode.com/problems/unique-paths,"Math, Dynamic Programming, Combinatorics"
EASY,Palindrome Number,58.9,0.5922455404045137,https://leetcode.com/problems/palindrome-number,Math
MEDIUM,Rotate Image,58.9,0.7790164518819447,https://leetcode.com/problems/rotate-image,"Array, Math, Matrix"
MEDIUM,Reverse Integer,58.9,0.30308916884483594,https://leetcode.com/problems/reverse-integer,Math
HARD,First Missing Positive,58.0,0.4108465766394882,https://leetcode.com/problems/first-missing-positive,"Array, Hash Table"
MEDIUM,Valid Sudoku,58.0,0.6227677721538815,https://leetcode.com/problems/valid-sudoku,"Array, Hash Table, Matrix"
MEDIUM,Best Time to Buy and Sell Stock II,58.0,0.6950023404506479,https://leetcode.com/problems/best-time-to-buy-and-sell-stock-ii,"Array, Dynamic Programming, Greedy"
MEDIUM,Next Permutation,57.0,0.4305773671839413,https://leetcode.com/problems/next-permutation,"Array, Two Pointers"
MEDIUM,Subsets,56.1,0.808795565390318,https://leetcode.com/problems/subsets,"Array, Backtracking, Bit Manipulation"
HARD,Binary Tree Maximum Path Sum,56.1,0.41224270953366093,https://leetcode.com/problems/binary-tree-maximum-path-sum,"Dynamic Programming, Tree, Depth-First Search, Binary Tree"
HARD,Candy,56.1,0.4669973031537662,https://leetcode.com/problems/candy,"Array, Greedy"
HARD,Minimum Window Substring,56.1,0.4535073359144813,https://leetcode.com/problems/minimum-window-substring,"Hash Table, String, Sliding Window"
MEDIUM,Binary Tree Level Order Traversal,55.1,0.7059658947038693,https://leetcode.com/problems/binary-tree-level-order-traversal,"Tree, Breadth-First Search, Binary Tree"
MEDIUM,Letter Combinations of a Phone Number,55.1,0.6385756647080152,https://leetcode.com/problems/letter-combinations-of-a-phone-number,"Hash Table, String, Backtracking"
MEDIUM,Sort Colors,55.1,0.6758312948649591,https://leetcode.com/problems/sort-colors,"Array, Two Pointers, Sorting"
MEDIUM,"Pow(x, n)",54.0,0.37023188235218485,https://leetcode.com/problems/powx-n,"Math, Recursion"
MEDIUM,Binary Tree Zigzag Level Order Traversal,54.0,0.6168283891746636,https://leetcode.com/problems/binary-tree-zigzag-level-order-traversal,"Tree, Breadth-First Search, Binary Tree"
HARD,Largest Rectangle in Histogram,52.8,0.4737765317407914,https://leetcode.com/problems/largest-rectangle-in-histogram,"Array, Stack, Monotonic Stack"
MEDIUM,4Sum,52.8,0.38219020113793045,https://leetcode.com/problems/4sum,"Array, Two Pointers, Sorting"
MEDIUM,Integer to Roman,51.6,0.6861931275088928,https://leetcode.com/problems/integer-to-roman,"Hash Table, Math, String"
HARD,Reverse Nodes in k-Group,50.3,0.6304374335039493,https://leetcode.com/problems/reverse-nodes-in-k-group,"Linked List, Recursion"
MEDIUM,Permutations,50.3,0.8066011364163758,https://leetcode.com/problems/permutations,"Array, Backtracking"
MEDIUM,Set Matrix Zeroes,50.3,0.6070877520170048,https://leetcode.com/problems/set-matrix-zeroes,"Array, Hash Table, Matrix"
MEDIUM,Combination Sum,49.0,0.746747008868086,https://leetcode.com/problems/combination-sum,"Array, Backtracking"
EASY,Pascal's Triangle,49.0,0.770215491719448,https://leetcode.com/problems/pascals-triangle,"Array, Dynamic Programming"
HARD,N-Queens,49.0,0.7281704967757537,https://leetcode.com/problems/n-queens,"Array, Backtracking"
HARD,Longest Valid Parentheses,49.0,0.3631311456770452,https://leetcode.com/problems/longest-valid-parentheses,"String, Dynamic Programming, Stack"
EASY,Single Number,49.0,0.7596882403268375,https://leetcode.com/problems/single-number,"Array, Bit Manipulation"
EASY,Roman to Integer,49.0,0.6486626948713667,https://leetcode.com/problems/roman-to-integer,"Hash Table, Math, String"
MEDIUM,Simplify Path,49.0,0.4785432317744196,https://leetcode.com/problems/simplify-path,"String, Stack"
MEDIUM,Plates Between Candles,49.0,0.4666856756362479,https://leetcode.com/problems/plates-between-candles,"Array, String, Binary Search, Prefix Sum"
MEDIUM,Palindrome Partitioning,47.5,0.7212808256354587,https://leetcode.com/problems/palindrome-partitioning,"String, Dynamic Programming, Backtracking"
MEDIUM,Zigzag Conversion,47.5,0.5160676713980508,https://leetcode.com/problems/zigzag-conversion,String
EASY,Find the Index of the First Occurrence in a String,47.5,0.44971592688817674,https://leetcode.com/problems/find-the-index-of-the-first-occurrence-in-a-string,"Two Pointers, String, String Matching"
MEDIUM,Reorder List,45.9,0.6250474980864169,https://leetcode.com/problems/reorder-list,"Linked List, Two Pointers, Stack, Recursion"
MEDIUM,Validate Binary Search Tree,45.9,0.34380387886661157,https://leetcode.com/problems/validate-binary-search-tree,"Tree, Depth-First Search, Binary Search Tree, Binary Tree"
HARD,Regular Expression Matching,45.9,0.29280131010169236,https://leetcode.com/problems/regular-expression-matching,"String, Dynamic Programming, Recursion"
MEDIUM,String to Integer (atoi),44.2,0.19229423495277723,https://leetcode.com/problems/string-to-integer-atoi,String
MEDIUM,Search a 2D Matrix,44.2,0.5228955161093151,https://leetcode.com/problems/search-a-2d-matrix,"Array, Binary Search, Matrix"
EASY,Plus One,44.2,0.47547604232787566,https://leetcode.com/problems/plus-one,"Array, Math"
MEDIUM,Minimum Path Sum,42.3,0.664814934885504,https://leetcode.com/problems/minimum-path-sum,"Array, Dynamic Programming, Matrix"
MEDIUM,Remove Duplicates from Sorted Array II,42.3,0.6290181029288465,https://leetcode.com/problems/remove-duplicates-from-sorted-array-ii,"Array, Two Pointers"
MEDIUM,Remove Nth Node From End of List,42.3,0.48961030525634286,https://leetcode.com/problems/remove-nth-node-from-end-of-list,"Linked List, Two Pointers"
MEDIUM,Gas Station,42.3,0.46383617781658143,https://leetcode.com/problems/gas-station,"Array, Greedy"
EASY,Remove Element,42.3,0.600316358048653,https://leetcode.com/problems/remove-element,"Array, Two Pointers"
EASY,Symmetric Tree,42.3,0.5927867908424697,https://leetcode.com/problems/symmetric-tree,"Tree, Depth-First Search, Breadth-First Search, Binary Tree"
EASY,Valid Palindrome,40.2,0.5096357249551178,https://leetcode.com/problems/valid-palindrome,"Two Pointers, String"
MEDIUM,Count Good Numbers,40.2,0.5663004270714034,https://leetcode.com/problems/count-good-numbers,"Math, Recursion"
HARD,Sudoku Solver,40.2,0.6390871778033164,https://leetcode.com/problems/sudoku-solver,"Array, Hash Table, Backtracking, Matrix"
MEDIUM,Construct Binary Tree from Preorder and Inorder Traversal,40.2,0.6683774773521286,https://leetcode.com/problems/construct-binary-tree-from-preorder-and-inorder-traversal,"Array, Hash Table, Divide and Conquer, Tree, Binary Tree"
MEDIUM,Rotate List,37.9,0.39944772716128085,https://leetcode.com/problems/rotate-list,"Linked List, Two Pointers"
MEDIUM,Reverse Linked List II,37.9,0.49591713945765414,https://leetcode.com/problems/reverse-linked-list-ii,Linked List
MEDIUM,Clone Graph,37.9,0.6238574692944873,https://leetcode.com/problems/clone-graph,"Hash Table, Depth-First Search, Breadth-First Search, Graph"
MEDIUM,Decode Ways,35.3,0.3653098525409497,https://leetcode.com/problems/decode-ways,"String, Dynamic Programming"
EASY,Maximum Depth of Binary Tree,35.3,0.7713813520613833,https://leetcode.com/problems/maximum-depth-of-binary-tree,"Tree, Depth-First Search, Breadth-First Search, Binary Tree"
MEDIUM,Divide Two Integers,35.3,0.18396975085033054,https://leetcode.com/problems/divide-two-integers,"Math, Bit Manipulation"
MEDIUM,Partition List,32.4,0.5898677373641946,https://leetcode.com/problems/partition-list,"Linked List, Two Pointers"
MEDIUM,Subsets II,32.4,0.595072748658621,https://leetcode.com/problems/subsets-ii,"Array, Backtracking, Bit Manipulation"
HARD,Text Justification,32.4,0.4814988999917213,https://leetcode.com/problems/text-justification,"Array, String, Simulation"
MEDIUM,Swap Nodes in Pairs,32.4,0.6720136828647639,https://leetcode.com/problems/swap-nodes-in-pairs,"Linked List, Recursion"
EASY,Linked List Cycle,28.9,0.5257062260569889,https://leetcode.com/problems/linked-list-cycle,"Hash Table, Linked List, Two Pointers"
EASY,Same Tree,28.9,0.651268811570624,https://leetcode.com/problems/same-tree,"Tree, Depth-First Search, Breadth-First Search, Binary Tree"
MEDIUM,Linked List Cycle II,24.7,0.5493365914602291,https://leetcode.com/problems/linked-list-cycle-ii,"Hash Table, Linked List, Two Pointers"
HARD,Wildcard Matching,24.7,0.2989835093068089,https://leetcode.com/problems/wildcard-matching,"String, Dynamic Programming, Greedy, Recursion"
EASY,Path Sum,24.7,0.5300478045423143,https://leetcode.com/problems/path-sum,"Tree, Depth-First Search, Breadth-First Search, Binary Tree"
EASY,Search Insert Position,24.7,0.49012422604597217,https://leetcode.com/problems/search-insert-position,"Array, Binary Search"
MEDIUM,3Sum Closest,19.6,0.468869600214817,https://leetcode.com/problems/3sum-closest,"Array, Two Pointers, Sorting"
MEDIUM,Triangle,19.6,0.592942154897156,https://leetcode.com/problems/triangle,"Array, Dynamic Programming"
MEDIUM,Combination Sum II,19.6,0.5767453180420465,https://leetcode.com/problems/combination-sum-ii,"Array, Backtracking"
MEDIUM,Search in Rotated Sorted Array II,13.1,0.3887965146188378,https://leetcode.com/problems/search-in-rotated-sorted-array-ii,"Array, Binary Search"
MEDIUM,Path Sum II,13.1,0.6049772910946117,https://leetcode.com/problems/path-sum-ii,"Backtracking, Tree, Depth-First Search, Binary Tree"
