Difficulty,Title,Frequency,Acceptance Rate,Link,Topics
HARD,Integer to English Words,100.0,0.3423252122478103,https://leetcode.com/problems/integer-to-english-words,"Math, String, Recursion"
MEDIUM,Game of Life,85.5,0.7081563196500883,https://leetcode.com/problems/game-of-life,"Array, Matrix, Simulation"
MEDIUM,Product of Array Except Self,85.5,0.6731224221983528,https://leetcode.com/problems/product-of-array-except-self,"Array, Prefix Sum"
EASY,Find the Index of the First Occurrence in a String,81.7,0.4434666424511122,https://leetcode.com/problems/find-the-index-of-the-first-occurrence-in-a-string,"Two Pointers, String, String Matching"
EASY,Missing Number,77.0,0.6916845255371582,https://leetcode.com/problems/missing-number,"Array, Hash Table, Math, Binary Search, Bit Manipulation, Sorting"
HARD,Merge k Sorted Lists,77.0,0.5556712553176504,https://leetcode.com/problems/merge-k-sorted-lists,"Linked List, Divide and Conquer, Heap (Priority Queue), Merge Sort"
MEDIUM,Number of Accounts That Did Not Stream,62.5,0.7231751824817519,https://leetcode.com/problems/number-of-accounts-that-did-not-stream,Database
