Difficulty,Title,Frequency,Acceptance Rate,Link,Topics
HARD,Integer to English Words,100.0,0.3432804583412634,https://leetcode.com/problems/integer-to-english-words,"Math, String, Recursion"
MEDIUM,Number of Accounts That Did Not Stream,96.0,0.7213568708895812,https://leetcode.com/problems/number-of-accounts-that-did-not-stream,Database
MEDIUM,Game of Life,88.2,0.713431148405899,https://leetcode.com/problems/game-of-life,"Array, Matrix, Simulation"
MEDIUM,Product of Array Except Self,88.2,0.677121583502499,https://leetcode.com/problems/product-of-array-except-self,"Array, Prefix Sum"
HARD,Merge k Sorted Lists,84.9,0.566083082490273,https://leetcode.com/problems/merge-k-sorted-lists,"Linked List, Divide and Conquer, Heap (Priority Queue), Merge Sort"
EASY,Missing Number,80.9,0.6993095554316884,https://leetcode.com/problems/missing-number,"Array, Hash Table, Math, Binary Search, Bit Manipulation, Sorting"
EASY,Find the Index of the First Occurrence in a String,80.9,0.4488854684350455,https://leetcode.com/problems/find-the-index-of-the-first-occurrence-in-a-string,"Two Pointers, String, String Matching"
MEDIUM,Flatten Nested List Iterator,60.9,0.6521017546849498,https://leetcode.com/problems/flatten-nested-list-iterator,"Stack, Tree, Depth-First Search, Design, Queue, Iterator"
MEDIUM,3Sum,60.9,0.36956375309764167,https://leetcode.com/problems/3sum,"Array, Two Pointers, Sorting"
EASY,Roman to Integer,60.9,0.6475853511446233,https://leetcode.com/problems/roman-to-integer,"Hash Table, Math, String"
