Difficulty,Title,Frequency,Acceptance Rate,Link,Topics
HARD,Cherry Pickup II,100.0,0.718542487769718,https://leetcode.com/problems/cherry-pickup-ii,"Array, Dynamic Programming, Matrix"
HARD,Trapping Rain Water,100.0,0.6412322607235349,https://leetcode.com/problems/trapping-rain-water,"Array, Two Pointers, Dynamic Programming, Stack, Monotonic Stack"
MEDIUM,Filling Bookcase Shelves,86.8,0.6871332187044443,https://leetcode.com/problems/filling-bookcase-shelves,"Array, Dynamic Programming"
HARD,Dungeon Game,86.8,0.3902708270849069,https://leetcode.com/problems/dungeon-game,"Array, Dynamic Programming, Matrix"
MEDIUM,Product of Array Except Self,86.8,0.6731223687903453,https://leetcode.com/problems/product-of-array-except-self,"Array, Prefix Sum"
MEDIUM,Search in Rotated Sorted Array,86.8,0.422177139005638,https://leetcode.com/problems/search-in-rotated-sorted-array,"Array, Binary Search"
MEDIUM,Path Sum II,86.8,0.5995591340979447,https://leetcode.com/problems/path-sum-ii,"Backtracking, Tree, Depth-First Search, Binary Tree"
HARD,Create Maximum Number,86.8,0.31691758928985037,https://leetcode.com/problems/create-maximum-number,"Array, Two Pointers, Stack, Greedy, Monotonic Stack"
MEDIUM,Rotting Oranges,86.8,0.5584685394747462,https://leetcode.com/problems/rotting-oranges,"Array, Breadth-First Search, Matrix"
MEDIUM,Find Minimum in Rotated Sorted Array,86.8,0.5204973525399431,https://leetcode.com/problems/find-minimum-in-rotated-sorted-array,"Array, Binary Search"
MEDIUM,Delete Node in a BST,86.8,0.5246222040965336,https://leetcode.com/problems/delete-node-in-a-bst,"Tree, Binary Search Tree, Binary Tree"
MEDIUM,Ways to Split Array Into Good Subarrays,86.8,0.3424251235824368,https://leetcode.com/problems/ways-to-split-array-into-good-subarrays,"Array, Math, Dynamic Programming"
MEDIUM,All Nodes Distance K in Binary Tree,86.8,0.6574699039799542,https://leetcode.com/problems/all-nodes-distance-k-in-binary-tree,"Hash Table, Tree, Depth-First Search, Breadth-First Search, Binary Tree"
