Difficulty,Title,Frequency,Acceptance Rate,Link,Topics
EASY,Intersection of Two Arrays,100.0,0.7647454128954905,https://leetcode.com/problems/intersection-of-two-arrays,"Array, Hash Table, Two Pointers, Binary Search, Sorting"
EASY,Flood Fill,81.2,0.6647648139762219,https://leetcode.com/problems/flood-fill,"Array, Depth-First Search, Breadth-First Search, Matrix"
EASY,Two Sum,81.2,0.5577710977790179,https://leetcode.com/problems/two-sum,"Array, Hash Table"
MEDIUM,Random Pick with Weight,81.2,0.4827866554527615,https://leetcode.com/problems/random-pick-with-weight,"Array, Math, Binary Search, Prefix Sum, Randomized"
EASY,Valid Parentheses,72.2,0.42322916304897296,https://leetcode.com/problems/valid-parentheses,"String, Stack"
EASY,Merge Sorted Array,72.2,0.5291971620846039,https://leetcode.com/problems/merge-sorted-array,"Array, Two Pointers, Sorting"
EASY,Ransom Note,72.2,0.6452386002541316,https://leetcode.com/problems/ransom-note,"Hash Table, String, Counting"
MEDIUM,Search in Rotated Sorted Array,72.2,0.42837456271701685,https://leetcode.com/problems/search-in-rotated-sorted-array,"Array, Binary Search"
