Difficulty,Title,Frequency,Acceptance Rate,Link,Topics
EASY,Best Time to Buy and Sell Stock,100.0,0.5482914274626555,https://leetcode.com/problems/best-time-to-buy-and-sell-stock,"Array, Dynamic Programming"
MEDIUM,Minimum Number of Frogs Croaking,77.2,0.5063890458128212,https://leetcode.com/problems/minimum-number-of-frogs-croaking,"String, Counting"
MEDIUM,Basic Calculator II,67.2,0.45337931467984016,https://leetcode.com/problems/basic-calculator-ii,"Math, String, Stack"
MEDIUM,H-Index,59.2,0.39971802047789595,https://leetcode.com/problems/h-index,"Array, Sorting, Counting Sort"
MEDIUM,4Sum,59.2,0.3768235653792179,https://leetcode.com/problems/4sum,"Array, Two Pointers, Sorting"
MEDIUM,Rotting Oranges,59.2,0.5605314539753957,https://leetcode.com/problems/rotting-oranges,"Array, Breadth-First Search, Matrix"
EASY,Fibonacci Number,59.2,0.725963362148873,https://leetcode.com/problems/fibonacci-number,"Math, Dynamic Programming, Recursion, Memoization"
