Difficulty,Title,Frequency,Acceptance Rate,Link,Topics
MEDIUM,Rotting Oranges,100.0,0.5635834358913743,https://leetcode.com/problems/rotting-oranges,"Array, Breadth-First Search, Matrix"
MEDIUM,Convert Sorted List to Binary Search Tree,90.6,0.6426054063634044,https://leetcode.com/problems/convert-sorted-list-to-binary-search-tree,"Linked List, Divide and Conquer, Tree, Binary Search Tree, Binary Tree"
MEDIUM,Check Completeness of a Binary Tree,90.6,0.5824627116880573,https://leetcode.com/problems/check-completeness-of-a-binary-tree,"Tree, Breadth-First Search, Binary Tree"
HARD,Read N Characters Given read4 II - Call Multiple Times,76.6,0.42842554335046523,https://leetcode.com/problems/read-n-characters-given-read4-ii-call-multiple-times,"Array, Simulation, Interactive"
HARD,Minimum Window Substring,66.4,0.4509861774647355,https://leetcode.com/problems/minimum-window-substring,"Hash Table, String, Sliding Window"
HARD,Word Ladder II,66.4,0.27154757193849205,https://leetcode.com/problems/word-ladder-ii,"Hash Table, String, Backtracking, Breadth-First Search"
HARD,Max Stack,58.2,0.45479753885975727,https://leetcode.com/problems/max-stack,"Linked List, Stack, Design, Doubly-Linked List, Ordered Set"
MEDIUM,Sort List,58.2,0.6144023419186813,https://leetcode.com/problems/sort-list,"Linked List, Two Pointers, Divide and Conquer, Sorting, Merge Sort"
MEDIUM,Decode Ways,58.2,0.36380994182473647,https://leetcode.com/problems/decode-ways,"String, Dynamic Programming"
