Difficulty,Title,Frequency,Acceptance Rate,Link,Topics
MEDIUM,Rotting Oranges,100.0,0.5647288398765853,https://leetcode.com/problems/rotting-oranges,"Array, Breadth-First Search, Matrix"
MEDIUM,Check Completeness of a Binary Tree,89.6,0.583137286660053,https://leetcode.com/problems/check-completeness-of-a-binary-tree,"Tree, Breadth-First Search, Binary Tree"
HARD,Read N Characters Given read4 II - Call Multiple Times,85.2,0.42874906350289055,https://leetcode.com/problems/read-n-characters-given-read4-ii-call-multiple-times,"Array, Simulation, Interactive"
HARD,Minimum Window Substring,65.9,0.4522103000780911,https://leetcode.com/problems/minimum-window-substring,"Hash Table, String, Sliding Window"
MEDIUM,Sort List,65.9,0.6161500136573403,https://leetcode.com/problems/sort-list,"Linked List, Two Pointers, Divide and Conquer, Sorting, Merge Sort"
HARD,Word Ladder II,58.0,0.27153906720392756,https://leetcode.com/problems/word-ladder-ii,"Hash Table, String, Backtracking, Breadth-First Search"
HARD,Max Stack,58.0,0.4552418979170826,https://leetcode.com/problems/max-stack,"Linked List, Stack, Design, Doubly-Linked List, Ordered Set"
MEDIUM,Time Based Key-Value Store,58.0,0.4933282654497034,https://leetcode.com/problems/time-based-key-value-store,"Hash Table, String, Binary Search, Design"
