Difficulty,Title,Frequency,Acceptance Rate,Link,Topics
MEDIUM,Most Stones Removed with Same Row or Column,100.0,0.6211287024443249,https://leetcode.com/problems/most-stones-removed-with-same-row-or-column,"Hash Table, Depth-First Search, Union Find, Graph"
EASY,Best Time to Buy and Sell Stock,88.2,0.5492496670805604,https://leetcode.com/problems/best-time-to-buy-and-sell-stock,"Array, Dynamic Programming"
MEDIUM,Longest Palindromic Substring,88.2,0.35491182304645685,https://leetcode.com/problems/longest-palindromic-substring,"Two Pointers, String, Dynamic Programming"
MEDIUM,Product of Array Except Self,88.2,0.67507772566184,https://leetcode.com/problems/product-of-array-except-self,"Array, Prefix Sum"
EASY,Cousins in Binary Tree,88.2,0.5786452501147316,https://leetcode.com/problems/cousins-in-binary-tree,"Tree, Depth-First Search, Breadth-First Search, Binary Tree"
HARD,Trapping Rain Water,88.2,0.6456491727279388,https://leetcode.com/problems/trapping-rain-water,"Array, Two Pointers, Dynamic Programming, Stack, Monotonic Stack"
HARD,Count the Number of Infection Sequences,88.2,0.3298175121379541,https://leetcode.com/problems/count-the-number-of-infection-sequences,"Array, Math, Combinatorics"
MEDIUM,Spiral Matrix,88.2,0.5330363172145935,https://leetcode.com/problems/spiral-matrix,"Array, Matrix, Simulation"
