Difficulty,Title,Frequency,Acceptance Rate,Link,Topics
MEDIUM,Minimum Remove to Make Valid Parentheses,100.0,0.7068792794310538,https://leetcode.com/problems/minimum-remove-to-make-valid-parentheses,"String, Stack"
EASY,Valid Word Abbreviation,97.3,0.36827398250629023,https://leetcode.com/problems/valid-word-abbreviation,"Two Pointers, String"
MEDIUM,Binary Tree Vertical Order Traversal,96.7,0.570726884558326,https://leetcode.com/problems/binary-tree-vertical-order-traversal,"Hash Table, Tree, Depth-First Search, Breadth-First Search, Sorting, Binary Tree"
EASY,Valid Palindrome II,94.2,0.4294433692570947,https://leetcode.com/problems/valid-palindrome-ii,"Two Pointers, String, Greedy"
MEDIUM,Kth Largest Element in an Array,92.1,0.6790763670564222,https://leetcode.com/problems/kth-largest-element-in-an-array,"Array, Divide and Conquer, Sorting, Heap (Priority Queue), Quickselect"
MEDIUM,Basic Calculator II,91.4,0.4572296222061925,https://leetcode.com/problems/basic-calculator-ii,"Math, String, Stack"
MEDIUM,Random Pick with Weight,89.8,0.48216156611914907,https://leetcode.com/problems/random-pick-with-weight,"Array, Math, Binary Search, Prefix Sum, Randomized"
MEDIUM,Lowest Common Ancestor of a Binary Tree,89.8,0.6655719282229484,https://leetcode.com/problems/lowest-common-ancestor-of-a-binary-tree,"Tree, Depth-First Search, Binary Tree"
MEDIUM,Nested List Weight Sum,87.3,0.8550338509826821,https://leetcode.com/problems/nested-list-weight-sum,"Depth-First Search, Breadth-First Search"
MEDIUM,Lowest Common Ancestor of a Binary Tree III,87.3,0.8241108335225982,https://leetcode.com/problems/lowest-common-ancestor-of-a-binary-tree-iii,"Hash Table, Two Pointers, Tree, Binary Tree"
EASY,Diameter of Binary Tree,86.3,0.634413664502496,https://leetcode.com/problems/diameter-of-binary-tree,"Tree, Depth-First Search, Binary Tree"
EASY,Two Sum,86.3,0.5568011348912524,https://leetcode.com/problems/two-sum,"Array, Hash Table"
MEDIUM,Binary Tree Right Side View,86.3,0.6680531335585652,https://leetcode.com/problems/binary-tree-right-side-view,"Tree, Depth-First Search, Breadth-First Search, Binary Tree"
MEDIUM,Find Peak Element,84.4,0.4649172725399085,https://leetcode.com/problems/find-peak-element,"Array, Binary Search"
MEDIUM,Simplify Path,82.2,0.47656551791884655,https://leetcode.com/problems/simplify-path,"String, Stack"
MEDIUM,Buildings With an Ocean View,79.9,0.807637020869556,https://leetcode.com/problems/buildings-with-an-ocean-view,"Array, Stack, Monotonic Stack"
EASY,Valid Palindrome,78.6,0.5081505326286552,https://leetcode.com/problems/valid-palindrome,"Two Pointers, String"
MEDIUM,Subarray Sum Equals K,77.2,0.4538234221320654,https://leetcode.com/problems/subarray-sum-equals-k,"Array, Hash Table, Prefix Sum"
MEDIUM,Top K Frequent Elements,77.2,0.644781841792433,https://leetcode.com/problems/top-k-frequent-elements,"Array, Hash Table, Divide and Conquer, Sorting, Heap (Priority Queue), Bucket Sort, Counting, Quickselect"
MEDIUM,"Pow(x, n)",75.8,0.36940756173664707,https://leetcode.com/problems/powx-n,"Math, Recursion"
MEDIUM,Shortest Path in Binary Matrix,75.8,0.4964825098580398,https://leetcode.com/problems/shortest-path-in-binary-matrix,"Array, Breadth-First Search, Matrix"
EASY,Range Sum of BST,74.2,0.8744392067848605,https://leetcode.com/problems/range-sum-of-bst,"Tree, Depth-First Search, Binary Search Tree, Binary Tree"
MEDIUM,K Closest Points to Origin,74.2,0.6786667353236635,https://leetcode.com/problems/k-closest-points-to-origin,"Array, Math, Divide and Conquer, Geometry, Sorting, Heap (Priority Queue), Quickselect"
MEDIUM,Maximum Swap,74.2,0.5183347861107127,https://leetcode.com/problems/maximum-swap,"Math, Greedy"
MEDIUM,Minimum Add to Make Parentheses Valid,72.5,0.7471303177661559,https://leetcode.com/problems/minimum-add-to-make-parentheses-valid,"String, Stack, Greedy"
MEDIUM,Merge Intervals,72.5,0.49292457933565426,https://leetcode.com/problems/merge-intervals,"Array, Sorting"
MEDIUM,Kth Smallest Element in a Sorted Matrix,72.5,0.6350707773833318,https://leetcode.com/problems/kth-smallest-element-in-a-sorted-matrix,"Array, Binary Search, Sorting, Heap (Priority Queue), Matrix"
EASY,Best Time to Buy and Sell Stock,70.7,0.55157180911871,https://leetcode.com/problems/best-time-to-buy-and-sell-stock,"Array, Dynamic Programming"
HARD,Making A Large Island,70.7,0.5474120743280964,https://leetcode.com/problems/making-a-large-island,"Array, Depth-First Search, Breadth-First Search, Union Find, Matrix"
MEDIUM,Max Consecutive Ones III,70.7,0.6581595540721916,https://leetcode.com/problems/max-consecutive-ones-iii,"Array, Binary Search, Sliding Window, Prefix Sum"
MEDIUM,Sum Root to Leaf Numbers,70.7,0.6843007981638953,https://leetcode.com/problems/sum-root-to-leaf-numbers,"Tree, Depth-First Search, Binary Tree"
MEDIUM,Copy List with Random Pointer,68.8,0.6034473186479614,https://leetcode.com/problems/copy-list-with-random-pointer,"Hash Table, Linked List"
MEDIUM,Clone Graph,68.8,0.6217407859172446,https://leetcode.com/problems/clone-graph,"Hash Table, Depth-First Search, Breadth-First Search, Graph"
MEDIUM,Next Permutation,66.6,0.4292058003372729,https://leetcode.com/problems/next-permutation,"Array, Two Pointers"
MEDIUM,LRU Cache,66.6,0.4507740393643428,https://leetcode.com/problems/lru-cache,"Hash Table, Linked List, Design, Doubly-Linked List"
MEDIUM,Longest Substring with At Most Two Distinct Characters,66.6,0.5641478845393436,https://leetcode.com/problems/longest-substring-with-at-most-two-distinct-characters,"Hash Table, String, Sliding Window"
MEDIUM,Interval List Intersections,66.6,0.726378025357539,https://leetcode.com/problems/interval-list-intersections,"Array, Two Pointers, Line Sweep"
EASY,Moving Average from Data Stream,64.3,0.7990792912775655,https://leetcode.com/problems/moving-average-from-data-stream,"Array, Design, Queue, Data Stream"
HARD,Merge k Sorted Lists,64.3,0.5660771431930968,https://leetcode.com/problems/merge-k-sorted-lists,"Linked List, Divide and Conquer, Heap (Priority Queue), Merge Sort"
EASY,Longest Common Prefix,64.3,0.45372409837168953,https://leetcode.com/problems/longest-common-prefix,"String, Trie"
MEDIUM,Dot Product of Two Sparse Vectors,64.3,0.8994504777223028,https://leetcode.com/problems/dot-product-of-two-sparse-vectors,"Array, Hash Table, Two Pointers, Design"
HARD,Sliding Window Median,61.6,0.38669814290210897,https://leetcode.com/problems/sliding-window-median,"Array, Hash Table, Sliding Window, Heap (Priority Queue)"
HARD,Valid Number,61.6,0.21492382682724748,https://leetcode.com/problems/valid-number,String
MEDIUM,Diagonal Traverse,61.6,0.6307158553596106,https://leetcode.com/problems/diagonal-traverse,"Array, Matrix, Simulation"
MEDIUM,Insert into a Sorted Circular Linked List,58.6,0.38068763199943545,https://leetcode.com/problems/insert-into-a-sorted-circular-linked-list,Linked List
MEDIUM,All Nodes Distance K in Binary Tree,58.6,0.6631663298165649,https://leetcode.com/problems/all-nodes-distance-k-in-binary-tree,"Hash Table, Tree, Depth-First Search, Breadth-First Search, Binary Tree"
MEDIUM,Accounts Merge,58.6,0.5941560639844664,https://leetcode.com/problems/accounts-merge,"Array, Hash Table, String, Depth-First Search, Breadth-First Search, Union Find, Sorting"
MEDIUM,Custom Sort String,58.6,0.7197663961484436,https://leetcode.com/problems/custom-sort-string,"Hash Table, String, Sorting"
HARD,Robot Room Cleaner,58.6,0.7747401735414104,https://leetcode.com/problems/robot-room-cleaner,"Backtracking, Interactive"
MEDIUM,Find First and Last Position of Element in Sorted Array,58.6,0.46696597475170376,https://leetcode.com/problems/find-first-and-last-position-of-element-in-sorted-array,"Array, Binary Search"
MEDIUM,Exclusive Time of Functions,58.6,0.6471090135540419,https://leetcode.com/problems/exclusive-time-of-functions,"Array, Stack"
HARD,Vertical Order Traversal of a Binary Tree,58.6,0.5111474428712637,https://leetcode.com/problems/vertical-order-traversal-of-a-binary-tree,"Hash Table, Tree, Depth-First Search, Breadth-First Search, Sorting, Binary Tree"
MEDIUM,Remove Nth Node From End of List,55.2,0.4879381855257099,https://leetcode.com/problems/remove-nth-node-from-end-of-list,"Linked List, Two Pointers"
EASY,Squares of a Sorted Array,55.2,0.7319604498171838,https://leetcode.com/problems/squares-of-a-sorted-array,"Array, Two Pointers, Sorting"
MEDIUM,Binary Search Tree Iterator,55.2,0.7473169641042319,https://leetcode.com/problems/binary-search-tree-iterator,"Stack, Tree, Design, Binary Search Tree, Binary Tree, Iterator"
HARD,Best Time to Buy and Sell Stock III,55.2,0.509003882387011,https://leetcode.com/problems/best-time-to-buy-and-sell-stock-iii,"Array, Dynamic Programming"
EASY,Strobogrammatic Number,55.2,0.4760023614988229,https://leetcode.com/problems/strobogrammatic-number,"Hash Table, Two Pointers, String"
EASY,Kth Missing Positive Number,55.2,0.6220267216307027,https://leetcode.com/problems/kth-missing-positive-number,"Array, Binary Search"
MEDIUM,Decode String,55.2,0.6107507152124466,https://leetcode.com/problems/decode-string,"String, Stack, Recursion"
EASY,Add Strings,51.1,0.5188387657340583,https://leetcode.com/problems/add-strings,"Math, String, Simulation"
HARD,Find Median from Data Stream,51.1,0.531953057126324,https://leetcode.com/problems/find-median-from-data-stream,"Two Pointers, Design, Sorting, Heap (Priority Queue), Data Stream"
HARD,Minimum Window Substring,51.1,0.45220971769371304,https://leetcode.com/problems/minimum-window-substring,"Hash Table, String, Sliding Window"
EASY,Goat Latin,51.1,0.6931443827778025,https://leetcode.com/problems/goat-latin,String
MEDIUM,Palindromic Substrings,51.1,0.716093741928448,https://leetcode.com/problems/palindromic-substrings,"Two Pointers, String, Dynamic Programming"
MEDIUM,Group Shifted Strings,51.1,0.6732939034447467,https://leetcode.com/problems/group-shifted-strings,"Array, Hash Table, String"
EASY,Merge Sorted Array,51.1,0.5280212683490116,https://leetcode.com/problems/merge-sorted-array,"Array, Two Pointers, Sorting"
EASY,Missing Ranges,51.1,0.3522252885037058,https://leetcode.com/problems/missing-ranges,Array
MEDIUM,Maximum Subarray,46.1,0.5203996801134582,https://leetcode.com/problems/maximum-subarray,"Array, Divide and Conquer, Dynamic Programming"
MEDIUM,Longest Substring Without Repeating Characters,46.1,0.36821795804596763,https://leetcode.com/problems/longest-substring-without-repeating-characters,"Hash Table, String, Sliding Window"
MEDIUM,Subsets,39.8,0.8076109135059837,https://leetcode.com/problems/subsets,"Array, Backtracking, Bit Manipulation"
MEDIUM,Car Pooling,39.8,0.5603156613180311,https://leetcode.com/problems/car-pooling,"Array, Sorting, Heap (Priority Queue), Simulation, Prefix Sum"
MEDIUM,Domino and Tromino Tiling,39.8,0.5201053559366711,https://leetcode.com/problems/domino-and-tromino-tiling,Dynamic Programming
MEDIUM,Single Element in a Sorted Array,39.8,0.5919333428978752,https://leetcode.com/problems/single-element-in-a-sorted-array,"Array, Binary Search"
MEDIUM,Add Two Numbers,39.8,0.460894670098434,https://leetcode.com/problems/add-two-numbers,"Linked List, Math, Recursion"
HARD,Basic Calculator,39.8,0.45474738972051354,https://leetcode.com/problems/basic-calculator,"Math, String, Stack, Recursion"
HARD,Median of Two Sorted Arrays,39.8,0.43650004987242313,https://leetcode.com/problems/median-of-two-sorted-arrays,"Array, Binary Search, Divide and Conquer"
EASY,Closest Binary Search Tree Value,39.8,0.49821394641839256,https://leetcode.com/problems/closest-binary-search-tree-value,"Binary Search, Tree, Depth-First Search, Binary Search Tree, Binary Tree"
MEDIUM,Course Schedule,39.8,0.49079049497953536,https://leetcode.com/problems/course-schedule,"Depth-First Search, Breadth-First Search, Graph, Topological Sort"
EASY,Contains Duplicate II,39.8,0.48905100255880185,https://leetcode.com/problems/contains-duplicate-ii,"Array, Hash Table, Sliding Window"
HARD,Valid Palindrome III,39.8,0.49089164445016,https://leetcode.com/problems/valid-palindrome-iii,"String, Dynamic Programming"
EASY,Add Two Integers,31.1,0.8817626159938011,https://leetcode.com/problems/add-two-integers,Math
EASY,Valid Parentheses,31.1,0.4224522363295953,https://leetcode.com/problems/valid-parentheses,"String, Stack"
EASY,Remove Duplicates from Sorted Array,31.1,0.602066284606203,https://leetcode.com/problems/remove-duplicates-from-sorted-array,"Array, Two Pointers"
MEDIUM,Continuous Subarray Sum,31.1,0.3088508792406733,https://leetcode.com/problems/continuous-subarray-sum,"Array, Hash Table, Math, Prefix Sum"
EASY,Remove All Adjacent Duplicates In String,31.1,0.7150219784890542,https://leetcode.com/problems/remove-all-adjacent-duplicates-in-string,"String, Stack"
MEDIUM,Partition to K Equal Sum Subsets,31.1,0.38111596608630277,https://leetcode.com/problems/partition-to-k-equal-sum-subsets,"Array, Dynamic Programming, Backtracking, Bit Manipulation, Memoization, Bitmask"
MEDIUM,Boundary of Binary Tree,31.1,0.47105265502891613,https://leetcode.com/problems/boundary-of-binary-tree,"Tree, Depth-First Search, Binary Tree"
MEDIUM,Minesweeper,31.1,0.6805834459089417,https://leetcode.com/problems/minesweeper,"Array, Depth-First Search, Breadth-First Search, Matrix"
HARD,Word Ladder,31.1,0.42628163235152045,https://leetcode.com/problems/word-ladder,"Hash Table, String, Breadth-First Search"
HARD,Alien Dictionary,31.1,0.3663648081435701,https://leetcode.com/problems/alien-dictionary,"Array, String, Depth-First Search, Breadth-First Search, Graph, Topological Sort"
MEDIUM,Shortest Bridge,31.1,0.5858000770720289,https://leetcode.com/problems/shortest-bridge,"Array, Depth-First Search, Breadth-First Search, Matrix"
MEDIUM,Remove All Adjacent Duplicates in String II,31.1,0.595187783779079,https://leetcode.com/problems/remove-all-adjacent-duplicates-in-string-ii,"String, Stack"
MEDIUM,Design Tic-Tac-Toe,31.1,0.5857679619518504,https://leetcode.com/problems/design-tic-tac-toe,"Array, Hash Table, Design, Matrix, Simulation"
HARD,Expression Add Operators,31.1,0.41578835679422793,https://leetcode.com/problems/expression-add-operators,"Math, String, Backtracking"
EASY,Palindrome Number,31.1,0.5914905050821663,https://leetcode.com/problems/palindrome-number,Math
MEDIUM,Number of Islands,31.1,0.6219953732484518,https://leetcode.com/problems/number-of-islands,"Array, Depth-First Search, Breadth-First Search, Union Find, Matrix"
HARD,Serialize and Deserialize Binary Tree,31.1,0.5884788589731306,https://leetcode.com/problems/serialize-and-deserialize-binary-tree,"String, Tree, Depth-First Search, Breadth-First Search, Design, Binary Tree"
MEDIUM,String to Integer (atoi),31.1,0.19126831562913002,https://leetcode.com/problems/string-to-integer-atoi,String
EASY,Can Place Flowers,31.1,0.2888469140095653,https://leetcode.com/problems/can-place-flowers,"Array, Greedy"
MEDIUM,Search a 2D Matrix,31.1,0.5218677504130868,https://leetcode.com/problems/search-a-2d-matrix,"Array, Binary Search, Matrix"
