Difficulty,Title,Frequency,Acceptance Rate,Link,Topics
MEDIUM,Minimum Remove to Make Valid Parentheses,100.0,0.7043965233021681,https://leetcode.com/problems/minimum-remove-to-make-valid-parentheses,"String, Stack"
EASY,Valid Word Abbreviation,91.7,0.3671119912144266,https://leetcode.com/problems/valid-word-abbreviation,"Two Pointers, String"
EASY,Valid Palindrome II,89.4,0.426933554337441,https://leetcode.com/problems/valid-palindrome-ii,"Two Pointers, String, Greedy"
MEDIUM,Binary Tree Right Side View,88.9,0.661882195526251,https://leetcode.com/problems/binary-tree-right-side-view,"Tree, Depth-First Search, Breadth-First Search, Binary Tree"
MEDIUM,Kth Largest Element in an Array,88.9,0.6774048703037411,https://leetcode.com/problems/kth-largest-element-in-an-array,"Array, Divide and Conquer, Sorting, Heap (Priority Queue), Quickselect"
MEDIUM,Binary Tree Vertical Order Traversal,86.8,0.5682113231270036,https://leetcode.com/problems/binary-tree-vertical-order-traversal,"Hash Table, Tree, Depth-First Search, Breadth-First Search, Sorting, Binary Tree"
MEDIUM,Subarray Sum Equals K,85.6,0.4511789169861394,https://leetcode.com/problems/subarray-sum-equals-k,"Array, Hash Table, Prefix Sum"
EASY,Diameter of Binary Tree,81.0,0.6304799592645914,https://leetcode.com/problems/diameter-of-binary-tree,"Tree, Depth-First Search, Binary Tree"
EASY,Valid Palindrome,81.0,0.5045352437933681,https://leetcode.com/problems/valid-palindrome,"Two Pointers, String"
MEDIUM,"Pow(x, n)",80.2,0.3669481607250295,https://leetcode.com/problems/powx-n,"Math, Recursion"
MEDIUM,Nested List Weight Sum,79.4,0.8533061673750892,https://leetcode.com/problems/nested-list-weight-sum,"Depth-First Search, Breadth-First Search"
MEDIUM,Lowest Common Ancestor of a Binary Tree III,78.6,0.8215334173903376,https://leetcode.com/problems/lowest-common-ancestor-of-a-binary-tree-iii,"Hash Table, Two Pointers, Tree, Binary Tree"
MEDIUM,Buildings With an Ocean View,78.6,0.8062814824607062,https://leetcode.com/problems/buildings-with-an-ocean-view,"Array, Stack, Monotonic Stack"
EASY,Merge Sorted Array,77.8,0.5249698383334673,https://leetcode.com/problems/merge-sorted-array,"Array, Two Pointers, Sorting"
MEDIUM,Random Pick with Weight,76.9,0.48327177098155405,https://leetcode.com/problems/random-pick-with-weight,"Array, Math, Binary Search, Prefix Sum, Randomized"
MEDIUM,Basic Calculator II,76.9,0.45454401783572507,https://leetcode.com/problems/basic-calculator-ii,"Math, String, Stack"
MEDIUM,Lowest Common Ancestor of a Binary Tree,76.0,0.6606725935264646,https://leetcode.com/problems/lowest-common-ancestor-of-a-binary-tree,"Tree, Depth-First Search, Binary Tree"
EASY,Two Sum,75.0,0.5533844606691267,https://leetcode.com/problems/two-sum,"Array, Hash Table"
MEDIUM,Top K Frequent Elements,75.0,0.6425176383477934,https://leetcode.com/problems/top-k-frequent-elements,"Array, Hash Table, Divide and Conquer, Sorting, Heap (Priority Queue), Bucket Sort, Counting, Quickselect"
MEDIUM,Merge Intervals,75.0,0.49027479184027895,https://leetcode.com/problems/merge-intervals,"Array, Sorting"
MEDIUM,LRU Cache,72.9,0.4471759378798832,https://leetcode.com/problems/lru-cache,"Hash Table, Linked List, Design, Doubly-Linked List"
MEDIUM,Shortest Path in Binary Matrix,70.6,0.4934963667195181,https://leetcode.com/problems/shortest-path-in-binary-matrix,"Array, Breadth-First Search, Matrix"
MEDIUM,Sum Root to Leaf Numbers,69.4,0.681443976297117,https://leetcode.com/problems/sum-root-to-leaf-numbers,"Tree, Depth-First Search, Binary Tree"
EASY,Moving Average from Data Stream,68.0,0.7975370138355629,https://leetcode.com/problems/moving-average-from-data-stream,"Array, Design, Queue, Data Stream"
HARD,Making A Large Island,68.0,0.5437071824942744,https://leetcode.com/problems/making-a-large-island,"Array, Depth-First Search, Breadth-First Search, Union Find, Matrix"
MEDIUM,K Closest Points to Origin,68.0,0.676844666202379,https://leetcode.com/problems/k-closest-points-to-origin,"Array, Math, Divide and Conquer, Geometry, Sorting, Heap (Priority Queue), Quickselect"
MEDIUM,Copy List with Random Pointer,66.6,0.5987535446409938,https://leetcode.com/problems/copy-list-with-random-pointer,"Hash Table, Linked List"
HARD,Minimum Window Substring,66.6,0.4490215243606473,https://leetcode.com/problems/minimum-window-substring,"Hash Table, String, Sliding Window"
MEDIUM,Dot Product of Two Sparse Vectors,65.1,0.8993473050838816,https://leetcode.com/problems/dot-product-of-two-sparse-vectors,"Array, Hash Table, Two Pointers, Design"
MEDIUM,Find Peak Element,65.1,0.46398460893752147,https://leetcode.com/problems/find-peak-element,"Array, Binary Search"
MEDIUM,Find First and Last Position of Element in Sorted Array,65.1,0.4638605023371122,https://leetcode.com/problems/find-first-and-last-position-of-element-in-sorted-array,"Array, Binary Search"
EASY,Kth Missing Positive Number,65.1,0.6197438312528297,https://leetcode.com/problems/kth-missing-positive-number,"Array, Binary Search"
MEDIUM,Group Shifted Strings,63.4,0.6713068175182823,https://leetcode.com/problems/group-shifted-strings,"Array, Hash Table, String"
MEDIUM,Simplify Path,63.4,0.4706228012525612,https://leetcode.com/problems/simplify-path,"String, Stack"
HARD,Merge k Sorted Lists,63.4,0.5615758007904545,https://leetcode.com/problems/merge-k-sorted-lists,"Linked List, Divide and Conquer, Heap (Priority Queue), Merge Sort"
EASY,Best Time to Buy and Sell Stock,63.4,0.5492507652562949,https://leetcode.com/problems/best-time-to-buy-and-sell-stock,"Array, Dynamic Programming"
EASY,Range Sum of BST,63.4,0.8738244469289078,https://leetcode.com/problems/range-sum-of-bst,"Tree, Depth-First Search, Binary Search Tree, Binary Tree"
MEDIUM,Next Permutation,63.4,0.4258646661853549,https://leetcode.com/problems/next-permutation,"Array, Two Pointers"
EASY,Valid Parentheses,61.6,0.4202350598452101,https://leetcode.com/problems/valid-parentheses,"String, Stack"
MEDIUM,Clone Graph,59.6,0.6160817407733599,https://leetcode.com/problems/clone-graph,"Hash Table, Depth-First Search, Breadth-First Search, Graph"
MEDIUM,All Nodes Distance K in Binary Tree,59.6,0.6603292754255938,https://leetcode.com/problems/all-nodes-distance-k-in-binary-tree,"Hash Table, Tree, Depth-First Search, Breadth-First Search, Binary Tree"
MEDIUM,Max Consecutive Ones III,59.6,0.6549364627602641,https://leetcode.com/problems/max-consecutive-ones-iii,"Array, Binary Search, Sliding Window, Prefix Sum"
HARD,Vertical Order Traversal of a Binary Tree,59.6,0.5069535562037245,https://leetcode.com/problems/vertical-order-traversal-of-a-binary-tree,"Hash Table, Tree, Depth-First Search, Breadth-First Search, Sorting, Binary Tree"
MEDIUM,Custom Sort String,59.6,0.7183731808011268,https://leetcode.com/problems/custom-sort-string,"Hash Table, String, Sorting"
MEDIUM,Continuous Subarray Sum,59.6,0.30781202175282013,https://leetcode.com/problems/continuous-subarray-sum,"Array, Hash Table, Math, Prefix Sum"
MEDIUM,Diagonal Traverse,59.6,0.6272073380952935,https://leetcode.com/problems/diagonal-traverse,"Array, Matrix, Simulation"
MEDIUM,Minimum Add to Make Parentheses Valid,57.5,0.7468222308190857,https://leetcode.com/problems/minimum-add-to-make-parentheses-valid,"String, Stack, Greedy"
HARD,Sliding Window Median,57.5,0.3856849877842265,https://leetcode.com/problems/sliding-window-median,"Array, Hash Table, Sliding Window, Heap (Priority Queue)"
MEDIUM,Course Schedule,57.5,0.48714151970574304,https://leetcode.com/problems/course-schedule,"Depth-First Search, Breadth-First Search, Graph, Topological Sort"
MEDIUM,Maximum Swap,57.5,0.5174443460208559,https://leetcode.com/problems/maximum-swap,"Math, Greedy"
MEDIUM,Interval List Intersections,55.0,0.7252957930045354,https://leetcode.com/problems/interval-list-intersections,"Array, Two Pointers, Line Sweep"
MEDIUM,Insert into a Sorted Circular Linked List,55.0,0.37840743829564333,https://leetcode.com/problems/insert-into-a-sorted-circular-linked-list,Linked List
MEDIUM,Remove Nth Node From End of List,52.3,0.4840576539132115,https://leetcode.com/problems/remove-nth-node-from-end-of-list,"Linked List, Two Pointers"
MEDIUM,Exclusive Time of Functions,52.3,0.6433787806805404,https://leetcode.com/problems/exclusive-time-of-functions,"Array, Stack"
MEDIUM,Number of Islands,52.3,0.6186243475018298,https://leetcode.com/problems/number-of-islands,"Array, Depth-First Search, Breadth-First Search, Union Find, Matrix"
MEDIUM,3Sum,49.1,0.36665404535754137,https://leetcode.com/problems/3sum,"Array, Two Pointers, Sorting"
MEDIUM,Construct Binary Tree from String,49.1,0.5815999759070011,https://leetcode.com/problems/construct-binary-tree-from-string,"String, Stack, Tree, Depth-First Search, Binary Tree"
MEDIUM,Design Tic-Tac-Toe,49.1,0.5850248686529532,https://leetcode.com/problems/design-tic-tac-toe,"Array, Hash Table, Design, Matrix, Simulation"
HARD,Expression Add Operators,49.1,0.41302686469854677,https://leetcode.com/problems/expression-add-operators,"Math, String, Backtracking"
EASY,Merge Strings Alternately,49.1,0.8205623053642703,https://leetcode.com/problems/merge-strings-alternately,"Two Pointers, String"
EASY,Add Strings,49.1,0.5178887091400026,https://leetcode.com/problems/add-strings,"Math, String, Simulation"
HARD,Valid Number,49.1,0.2126411704187672,https://leetcode.com/problems/valid-number,String
EASY,Contains Duplicate II,45.4,0.4848107982869827,https://leetcode.com/problems/contains-duplicate-ii,"Array, Hash Table, Sliding Window"
MEDIUM,Random Pick Index,45.4,0.6437799155326138,https://leetcode.com/problems/random-pick-index,"Hash Table, Math, Reservoir Sampling, Randomized"
HARD,Word Ladder II,45.4,0.27130001257818487,https://leetcode.com/problems/word-ladder-ii,"Hash Table, String, Backtracking, Breadth-First Search"
HARD,Median of Two Sorted Arrays,45.4,0.43234245040428393,https://leetcode.com/problems/median-of-two-sorted-arrays,"Array, Binary Search, Divide and Conquer"
MEDIUM,Cutting Ribbons,45.4,0.5202466408982146,https://leetcode.com/problems/cutting-ribbons,"Array, Binary Search"
MEDIUM,Meeting Rooms II,45.4,0.5200579926786013,https://leetcode.com/problems/meeting-rooms-ii,"Array, Two Pointers, Greedy, Sorting, Heap (Priority Queue), Prefix Sum"
MEDIUM,String to Integer (atoi),45.4,0.18892260941561306,https://leetcode.com/problems/string-to-integer-atoi,String
EASY,Remove All Adjacent Duplicates In String,45.4,0.7123397500871694,https://leetcode.com/problems/remove-all-adjacent-duplicates-in-string,"String, Stack"
HARD,Find Median from Data Stream,45.4,0.5311630738083135,https://leetcode.com/problems/find-median-from-data-stream,"Two Pointers, Design, Sorting, Heap (Priority Queue), Data Stream"
HARD,Robot Room Cleaner,45.4,0.7731819219830182,https://leetcode.com/problems/robot-room-cleaner,"Backtracking, Interactive"
MEDIUM,Maximum Subarray,45.4,0.5186400749869976,https://leetcode.com/problems/maximum-subarray,"Array, Divide and Conquer, Dynamic Programming"
MEDIUM,Convert Binary Search Tree to Sorted Doubly Linked List,45.4,0.6540995284268931,https://leetcode.com/problems/convert-binary-search-tree-to-sorted-doubly-linked-list,"Linked List, Stack, Tree, Depth-First Search, Binary Search Tree, Binary Tree, Doubly-Linked List"
HARD,Valid Palindrome III,45.4,0.49043493444399366,https://leetcode.com/problems/valid-palindrome-iii,"String, Dynamic Programming"
MEDIUM,Lowest Common Ancestor of a Binary Search Tree,40.8,0.6774221090991529,https://leetcode.com/problems/lowest-common-ancestor-of-a-binary-search-tree,"Tree, Depth-First Search, Binary Search Tree, Binary Tree"
MEDIUM,Longest Substring Without Repeating Characters,40.8,0.36543800626050243,https://leetcode.com/problems/longest-substring-without-repeating-characters,"Hash Table, String, Sliding Window"
EASY,Strobogrammatic Number,40.8,0.4759702786377709,https://leetcode.com/problems/strobogrammatic-number,"Hash Table, Two Pointers, String"
MEDIUM,Search in Rotated Sorted Array,40.8,0.425077056587231,https://leetcode.com/problems/search-in-rotated-sorted-array,"Array, Binary Search"
EASY,Climbing Stairs,40.8,0.5341033471474884,https://leetcode.com/problems/climbing-stairs,"Math, Dynamic Programming, Memoization"
MEDIUM,Accounts Merge,35.0,0.5908703606838295,https://leetcode.com/problems/accounts-merge,"Array, Hash Table, String, Depth-First Search, Breadth-First Search, Union Find, Sorting"
EASY,Closest Binary Search Tree Value,35.0,0.5000812258383667,https://leetcode.com/problems/closest-binary-search-tree-value,"Binary Search, Tree, Depth-First Search, Binary Search Tree, Binary Tree"
MEDIUM,Longest Palindromic Substring,35.0,0.3549091776198662,https://leetcode.com/problems/longest-palindromic-substring,"Two Pointers, String, Dynamic Programming"
EASY,Longest Common Prefix,35.0,0.4510198870129216,https://leetcode.com/problems/longest-common-prefix,"String, Trie"
MEDIUM,Palindromic Substrings,35.0,0.7141024030766903,https://leetcode.com/problems/palindromic-substrings,"Two Pointers, String, Dynamic Programming"
EASY,Palindrome Number,35.0,0.5886325171535057,https://leetcode.com/problems/palindrome-number,Math
HARD,Alien Dictionary,35.0,0.3652811444333015,https://leetcode.com/problems/alien-dictionary,"Array, String, Depth-First Search, Breadth-First Search, Graph, Topological Sort"
EASY,Remove Duplicates from Sorted Array,35.0,0.5980687827015532,https://leetcode.com/problems/remove-duplicates-from-sorted-array,"Array, Two Pointers"
MEDIUM,Kth Smallest Element in a Sorted Matrix,35.0,0.6335088230567895,https://leetcode.com/problems/kth-smallest-element-in-a-sorted-matrix,"Array, Binary Search, Sorting, Heap (Priority Queue), Matrix"
EASY,Goat Latin,35.0,0.6921413450578082,https://leetcode.com/problems/goat-latin,String
MEDIUM,Max Area of Island,27.0,0.7298589224020341,https://leetcode.com/problems/max-area-of-island,"Array, Depth-First Search, Breadth-First Search, Union Find, Matrix"
MEDIUM,Group Anagrams,27.0,0.7056679474228829,https://leetcode.com/problems/group-anagrams,"Array, Hash Table, String, Sorting"
MEDIUM,Count Nodes Equal to Average of Subtree,27.0,0.8627928313020632,https://leetcode.com/problems/count-nodes-equal-to-average-of-subtree,"Tree, Depth-First Search, Binary Tree"
MEDIUM,Validate Binary Search Tree,27.0,0.3411782665073651,https://leetcode.com/problems/validate-binary-search-tree,"Tree, Depth-First Search, Binary Search Tree, Binary Tree"
EASY,Valid Anagram,27.0,0.6633017029721215,https://leetcode.com/problems/valid-anagram,"Hash Table, String, Sorting"
EASY,Plus One,27.0,0.4722857648242489,https://leetcode.com/problems/plus-one,"Array, Math"
MEDIUM,Capacity To Ship Packages Within D Days,27.0,0.7162235434645479,https://leetcode.com/problems/capacity-to-ship-packages-within-d-days,"Array, Binary Search"
HARD,Shortest Distance from All Buildings,27.0,0.4415278360069728,https://leetcode.com/problems/shortest-distance-from-all-buildings,"Array, Breadth-First Search, Matrix"
MEDIUM,Minesweeper,27.0,0.6787898881678451,https://leetcode.com/problems/minesweeper,"Array, Depth-First Search, Breadth-First Search, Matrix"
EASY,Symmetric Tree,27.0,0.5885981995991727,https://leetcode.com/problems/symmetric-tree,"Tree, Depth-First Search, Breadth-First Search, Binary Tree"
