Difficulty,Title,Frequency,Acceptance Rate,Link,Topics
EASY,Merge Sorted Array,88.3,0.5235335204338104,https://leetcode.com/problems/merge-sorted-array,"Array, Two Pointers, Sorting"
MEDIUM,Find Peak Element,87.0,0.4636552705531736,https://leetcode.com/problems/find-peak-element,"Array, Binary Search"
MEDIUM,Simplify Path,83.9,0.4679831043752962,https://leetcode.com/problems/simplify-path,"String, Stack"
MEDIUM,"Pow(x, n)",83.5,0.36569598302347667,https://leetcode.com/problems/powx-n,"Math, Recursion"
MEDIUM,Binary Tree Right Side View,81.9,0.6588462291750823,https://leetcode.com/problems/binary-tree-right-side-view,"Tree, Depth-First Search, Breadth-First Search, Binary Tree"
EASY,Valid Palindrome,80.8,0.502843074029796,https://leetcode.com/problems/valid-palindrome,"Two Pointers, String"
MEDIUM,Merge Intervals,79.0,0.48881447000372363,https://leetcode.com/problems/merge-intervals,"Array, Sorting"
EASY,Two Sum,77.6,0.5518535727213398,https://leetcode.com/problems/two-sum,"Array, Hash Table"
MEDIUM,Sum Root to Leaf Numbers,77.2,0.6799164224187583,https://leetcode.com/problems/sum-root-to-leaf-numbers,"Tree, Depth-First Search, Binary Tree"
MEDIUM,Copy List with Random Pointer,77.0,0.5965901759777933,https://leetcode.com/problems/copy-list-with-random-pointer,"Hash Table, Linked List"
MEDIUM,LRU Cache,76.6,0.44550529805906364,https://leetcode.com/problems/lru-cache,"Hash Table, Linked List, Design, Doubly-Linked List"
HARD,Merge k Sorted Lists,73.7,0.5594068433997365,https://leetcode.com/problems/merge-k-sorted-lists,"Linked List, Divide and Conquer, Heap (Priority Queue), Merge Sort"
MEDIUM,Next Permutation,71.7,0.42429383841013196,https://leetcode.com/problems/next-permutation,"Array, Two Pointers"
EASY,Best Time to Buy and Sell Stock,68.0,0.5482911367293964,https://leetcode.com/problems/best-time-to-buy-and-sell-stock,"Array, Dynamic Programming"
HARD,Valid Number,68.0,0.2118270894611047,https://leetcode.com/problems/valid-number,String
HARD,Minimum Window Substring,67.0,0.4476579979699149,https://leetcode.com/problems/minimum-window-substring,"Hash Table, String, Sliding Window"
MEDIUM,Clone Graph,67.0,0.6136428744929143,https://leetcode.com/problems/clone-graph,"Hash Table, Depth-First Search, Breadth-First Search, Graph"
MEDIUM,Find First and Last Position of Element in Sorted Array,66.4,0.4624175468488463,https://leetcode.com/problems/find-first-and-last-position-of-element-in-sorted-array,"Array, Binary Search"
EASY,Longest Common Prefix,63.4,0.44980352229236176,https://leetcode.com/problems/longest-common-prefix,"String, Trie"
EASY,Valid Parentheses,61.7,0.419169364964607,https://leetcode.com/problems/valid-parentheses,"String, Stack"
MEDIUM,Remove Nth Node From End of List,60.7,0.48229502186000317,https://leetcode.com/problems/remove-nth-node-from-end-of-list,"Linked List, Two Pointers"
MEDIUM,3Sum,59.3,0.3653142516759403,https://leetcode.com/problems/3sum,"Array, Two Pointers, Sorting"
MEDIUM,Binary Search Tree Iterator,59.3,0.7435182751728179,https://leetcode.com/problems/binary-search-tree-iterator,"Stack, Tree, Design, Binary Search Tree, Binary Tree, Iterator"
MEDIUM,Add Two Numbers,58.8,0.45555741835876473,https://leetcode.com/problems/add-two-numbers,"Linked List, Math, Recursion"
EASY,Missing Ranges,55.9,0.3501448959878097,https://leetcode.com/problems/missing-ranges,Array
MEDIUM,Subsets,55.9,0.8034780020879054,https://leetcode.com/problems/subsets,"Array, Backtracking, Bit Manipulation"
MEDIUM,Word Break,54.7,0.479352236104686,https://leetcode.com/problems/word-break,"Array, Hash Table, String, Dynamic Programming, Trie, Memoization"
EASY,Palindrome Number,54.7,0.5874941773180087,https://leetcode.com/problems/palindrome-number,Math
MEDIUM,Longest Substring Without Repeating Characters,52.6,0.36418530511201047,https://leetcode.com/problems/longest-substring-without-repeating-characters,"Hash Table, String, Sliding Window"
HARD,Median of Two Sorted Arrays,51.9,0.4306419787937774,https://leetcode.com/problems/median-of-two-sorted-arrays,"Array, Binary Search, Divide and Conquer"
MEDIUM,String to Integer (atoi),51.1,0.18788591491164613,https://leetcode.com/problems/string-to-integer-atoi,String
MEDIUM,Longest Palindromic Substring,51.1,0.35378199588544335,https://leetcode.com/problems/longest-palindromic-substring,"Two Pointers, String, Dynamic Programming"
EASY,Majority Element,51.1,0.6552283775103298,https://leetcode.com/problems/majority-element,"Array, Hash Table, Divide and Conquer, Sorting, Counting"
MEDIUM,Populating Next Right Pointers in Each Node,50.3,0.6493781128212724,https://leetcode.com/problems/populating-next-right-pointers-in-each-node,"Linked List, Tree, Depth-First Search, Breadth-First Search, Binary Tree"
EASY,Remove Duplicates from Sorted Array,50.3,0.5959883813742197,https://leetcode.com/problems/remove-duplicates-from-sorted-array,"Array, Two Pointers"
MEDIUM,Letter Combinations of a Phone Number,49.4,0.6319914670431571,https://leetcode.com/problems/letter-combinations-of-a-phone-number,"Hash Table, String, Backtracking"
HARD,Word Ladder,47.6,0.41982231637014295,https://leetcode.com/problems/word-ladder,"Hash Table, String, Breadth-First Search"
MEDIUM,Sort Colors,47.6,0.6647639924807024,https://leetcode.com/problems/sort-colors,"Array, Two Pointers, Sorting"
EASY,Roman to Integer,46.6,0.6427275584530946,https://leetcode.com/problems/roman-to-integer,"Hash Table, Math, String"
HARD,Trapping Rain Water,46.6,0.6439789104129836,https://leetcode.com/problems/trapping-rain-water,"Array, Two Pointers, Dynamic Programming, Stack, Monotonic Stack"
MEDIUM,Generate Parentheses,45.6,0.7661918785115296,https://leetcode.com/problems/generate-parentheses,"String, Dynamic Programming, Backtracking"
MEDIUM,Group Anagrams,44.5,0.7043757799899178,https://leetcode.com/problems/group-anagrams,"Array, Hash Table, String, Sorting"
EASY,Plus One,44.5,0.47123217417810415,https://leetcode.com/problems/plus-one,"Array, Math"
MEDIUM,Longest Consecutive Sequence,43.3,0.47157723993380446,https://leetcode.com/problems/longest-consecutive-sequence,"Array, Hash Table, Union Find"
EASY,Merge Two Sorted Lists,43.3,0.6636950668025112,https://leetcode.com/problems/merge-two-sorted-lists,"Linked List, Recursion"
EASY,Climbing Stairs,43.3,0.5336998829077748,https://leetcode.com/problems/climbing-stairs,"Math, Dynamic Programming, Memoization"
MEDIUM,Maximum Subarray,42.1,0.517905026302093,https://leetcode.com/problems/maximum-subarray,"Array, Divide and Conquer, Dynamic Programming"
HARD,Binary Tree Maximum Path Sum,42.1,0.4095664588133702,https://leetcode.com/problems/binary-tree-maximum-path-sum,"Dynamic Programming, Tree, Depth-First Search, Binary Tree"
MEDIUM,Unique Paths,42.1,0.654615217633634,https://leetcode.com/problems/unique-paths,"Math, Dynamic Programming, Combinatorics"
MEDIUM,Rotate Image,42.1,0.7727233982200226,https://leetcode.com/problems/rotate-image,"Array, Math, Matrix"
MEDIUM,Multiply Strings,42.1,0.41906037904824844,https://leetcode.com/problems/multiply-strings,"Math, String, Simulation"
MEDIUM,Binary Tree Zigzag Level Order Traversal,39.3,0.610961898155097,https://leetcode.com/problems/binary-tree-zigzag-level-order-traversal,"Tree, Breadth-First Search, Binary Tree"
MEDIUM,House Robber,37.7,0.5202375441726034,https://leetcode.com/problems/house-robber,"Array, Dynamic Programming"
MEDIUM,Spiral Matrix,37.7,0.5309625593712854,https://leetcode.com/problems/spiral-matrix,"Array, Matrix, Simulation"
MEDIUM,Search in Rotated Sorted Array,37.7,0.42401126264795885,https://leetcode.com/problems/search-in-rotated-sorted-array,"Array, Binary Search"
MEDIUM,Reverse Integer,37.7,0.2992355227215995,https://leetcode.com/problems/reverse-integer,Math
EASY,Add Binary,37.7,0.5526349064627296,https://leetcode.com/problems/add-binary,"Math, String, Bit Manipulation, Simulation"
MEDIUM,Count and Say,37.7,0.580203767927469,https://leetcode.com/problems/count-and-say,String
EASY,Pascal's Triangle,36.0,0.7651471603747144,https://leetcode.com/problems/pascals-triangle,"Array, Dynamic Programming"
HARD,Word Break II,36.0,0.5303694495412177,https://leetcode.com/problems/word-break-ii,"Array, Hash Table, String, Dynamic Programming, Backtracking, Trie, Memoization"
MEDIUM,3Sum Closest,36.0,0.4663241474735295,https://leetcode.com/problems/3sum-closest,"Array, Two Pointers, Sorting"
EASY,Single Number,34.1,0.7543132461751408,https://leetcode.com/problems/single-number,"Array, Bit Manipulation"
MEDIUM,Two Sum II - Input Array Is Sorted,34.1,0.6296168665936107,https://leetcode.com/problems/two-sum-ii-input-array-is-sorted,"Array, Two Pointers, Binary Search"
MEDIUM,Jump Game,32.0,0.391537332135605,https://leetcode.com/problems/jump-game,"Array, Dynamic Programming, Greedy"
MEDIUM,Find Minimum in Rotated Sorted Array,32.0,0.5222727656069438,https://leetcode.com/problems/find-minimum-in-rotated-sorted-array,"Array, Binary Search"
MEDIUM,Reverse Words in a String,32.0,0.5037792685279355,https://leetcode.com/problems/reverse-words-in-a-string,"Two Pointers, String"
MEDIUM,Combination Sum II,32.0,0.5727835467581852,https://leetcode.com/problems/combination-sum-ii,"Array, Backtracking"
EASY,Find the Index of the First Occurrence in a String,32.0,0.4454255957763795,https://leetcode.com/problems/find-the-index-of-the-first-occurrence-in-a-string,"Two Pointers, String, String Matching"
EASY,Remove Element,32.0,0.5953765068877253,https://leetcode.com/problems/remove-element,"Array, Two Pointers"
MEDIUM,Palindrome Partitioning,29.6,0.7148040187502464,https://leetcode.com/problems/palindrome-partitioning,"String, Dynamic Programming, Backtracking"
HARD,Regular Expression Matching,29.6,0.2900602412757317,https://leetcode.com/problems/regular-expression-matching,"String, Dynamic Programming, Recursion"
MEDIUM,Set Matrix Zeroes,29.6,0.5906011711646963,https://leetcode.com/problems/set-matrix-zeroes,"Array, Hash Table, Matrix"
MEDIUM,Insert Interval,29.6,0.4301021472270776,https://leetcode.com/problems/insert-interval,Array
MEDIUM,4Sum,29.6,0.376822568077218,https://leetcode.com/problems/4sum,"Array, Two Pointers, Sorting"
MEDIUM,Validate Binary Search Tree,29.6,0.3403273685413597,https://leetcode.com/problems/validate-binary-search-tree,"Tree, Depth-First Search, Binary Search Tree, Binary Tree"
MEDIUM,Container With Most Water,29.6,0.5726801897279478,https://leetcode.com/problems/container-with-most-water,"Array, Two Pointers, Greedy"
MEDIUM,Word Search,27.0,0.4471706865184025,https://leetcode.com/problems/word-search,"Array, String, Backtracking, Depth-First Search, Matrix"
MEDIUM,Rotate Array,27.0,0.42538104478627803,https://leetcode.com/problems/rotate-array,"Array, Math, Two Pointers"
MEDIUM,Divide Two Integers,27.0,0.1818179617086443,https://leetcode.com/problems/divide-two-integers,"Math, Bit Manipulation"
MEDIUM,Valid Sudoku,27.0,0.6175410652388653,https://leetcode.com/problems/valid-sudoku,"Array, Hash Table, Matrix"
MEDIUM,Path Sum II,27.0,0.6011372031453363,https://leetcode.com/problems/path-sum-ii,"Backtracking, Tree, Depth-First Search, Binary Tree"
MEDIUM,Flatten Binary Tree to Linked List,27.0,0.6779638335228652,https://leetcode.com/problems/flatten-binary-tree-to-linked-list,"Linked List, Stack, Tree, Depth-First Search, Binary Tree"
MEDIUM,Remove Duplicates from Sorted Array II,27.0,0.6229910804589869,https://leetcode.com/problems/remove-duplicates-from-sorted-array-ii,"Array, Two Pointers"
HARD,Largest Rectangle in Histogram,27.0,0.4669533193395912,https://leetcode.com/problems/largest-rectangle-in-histogram,"Array, Stack, Monotonic Stack"
MEDIUM,Search a 2D Matrix,27.0,0.5184869479954859,https://leetcode.com/problems/search-a-2d-matrix,"Array, Binary Search, Matrix"
MEDIUM,Permutations,23.8,0.8021908982105098,https://leetcode.com/problems/permutations,"Array, Backtracking"
EASY,Sqrt(x),23.8,0.40080540408561893,https://leetcode.com/problems/sqrtx,"Math, Binary Search"
MEDIUM,Unique Paths II,23.8,0.4281786997676805,https://leetcode.com/problems/unique-paths-ii,"Array, Dynamic Programming, Matrix"
HARD,Max Points on a Line,20.1,0.28497241299373016,https://leetcode.com/problems/max-points-on-a-line,"Array, Hash Table, Math, Geometry"
HARD,Reverse Nodes in k-Group,20.1,0.62189177854135,https://leetcode.com/problems/reverse-nodes-in-k-group,"Linked List, Recursion"
MEDIUM,Binary Tree Level Order Traversal,20.1,0.6993445974292273,https://leetcode.com/problems/binary-tree-level-order-traversal,"Tree, Breadth-First Search, Binary Tree"
EASY,Maximum Depth of Binary Tree,20.1,0.7681223247245452,https://leetcode.com/problems/maximum-depth-of-binary-tree,"Tree, Depth-First Search, Breadth-First Search, Binary Tree"
MEDIUM,Evaluate Reverse Polish Notation,15.6,0.5419151482572111,https://leetcode.com/problems/evaluate-reverse-polish-notation,"Array, Math, Stack"
MEDIUM,Maximum Product Subarray,15.6,0.3458339026565616,https://leetcode.com/problems/maximum-product-subarray,"Array, Dynamic Programming"
HARD,Text Justification,15.6,0.47271961104467125,https://leetcode.com/problems/text-justification,"Array, String, Simulation"
HARD,Sudoku Solver,15.6,0.6367769831597847,https://leetcode.com/problems/sudoku-solver,"Array, Hash Table, Backtracking, Matrix"
MEDIUM,Restore IP Addresses,15.6,0.5248424585321884,https://leetcode.com/problems/restore-ip-addresses,"String, Backtracking"
MEDIUM,Swap Nodes in Pairs,15.6,0.6661036612629104,https://leetcode.com/problems/swap-nodes-in-pairs,"Linked List, Recursion"
MEDIUM,Edit Distance,15.6,0.5828409390942927,https://leetcode.com/problems/edit-distance,"String, Dynamic Programming"
EASY,Binary Tree Postorder Traversal,10.1,0.7500463665183418,https://leetcode.com/problems/binary-tree-postorder-traversal,"Stack, Tree, Depth-First Search, Binary Tree"
