Difficulty,Title,Frequency,Acceptance Rate,Link,Topics
EASY,Merge Sorted Array,100.0,0.5280223859354127,https://leetcode.com/problems/merge-sorted-array,"Array, Two Pointers, Sorting"
EASY,Merge Two Sorted Lists,93.0,0.6675283806677621,https://leetcode.com/problems/merge-two-sorted-lists,"Linked List, Recursion"
MEDIUM,Merge Intervals,87.1,0.4929262670603113,https://leetcode.com/problems/merge-intervals,"Array, Sorting"
MEDIUM,Maximum Number of Occurrences of a Substring,84.8,0.5334010763614467,https://leetcode.com/problems/maximum-number-of-occurrences-of-a-substring,"Hash Table, String, Sliding Window"
EASY,Two Sum,82.1,0.5568026232167307,https://leetcode.com/problems/two-sum,"Array, Hash Table"
MEDIUM,Meeting Rooms II,70.8,0.5211648053667508,https://leetcode.com/problems/meeting-rooms-ii,"Array, Two Pointers, Greedy, Sorting, Heap (Priority Queue), Prefix Sum"
MEDIUM,Top K Frequent Elements,56.8,0.644783810794171,https://leetcode.com/problems/top-k-frequent-elements,"Array, Hash Table, Divide and Conquer, Sorting, Heap (Priority Queue), Bucket Sort, Counting, Quickselect"
HARD,Merge k Sorted Lists,56.8,0.5660805776161485,https://leetcode.com/problems/merge-k-sorted-lists,"Linked List, Divide and Conquer, Heap (Priority Queue), Merge Sort"
HARD,Find the K-Sum of an Array,56.8,0.3957415565345081,https://leetcode.com/problems/find-the-k-sum-of-an-array,"Array, Sorting, Heap (Priority Queue)"
MEDIUM,Find the Celebrity,56.8,0.48405702139900597,https://leetcode.com/problems/find-the-celebrity,"Two Pointers, Graph, Interactive"
