Difficulty,Title,Frequency,Acceptance Rate,Link,Topics
MEDIUM,Unique Substrings in Wraparound String,100.0,0.4087631770867864,https://leetcode.com/problems/unique-substrings-in-wraparound-string,"String, Dynamic Programming"
HARD,Trapping Rain Water,65.5,0.6439804689499021,https://leetcode.com/problems/trapping-rain-water,"Array, Two Pointers, Dynamic Programming, Stack, Monotonic Stack"
MEDIUM,Longest Substring Without Repeating Characters,65.5,0.36418927177581234,https://leetcode.com/problems/longest-substring-without-repeating-characters,"Hash Table, String, Sliding Window"
HARD,Largest Rectangle in Histogram,65.5,0.4669545520481148,https://leetcode.com/problems/largest-rectangle-in-histogram,"Array, Stack, Monotonic Stack"
MEDIUM,Longest Palindromic Substring,65.5,0.3537838527804582,https://leetcode.com/problems/longest-palindromic-substring,"Two Pointers, String, Dynamic Programming"
