Difficulty,Title,Frequency,Acceptance Rate,Link,Topics
MEDIUM,Count Zero Request Servers,100.0,0.3315017558355711,https://leetcode.com/problems/count-zero-request-servers,"Array, Hash Table, Sliding Window, Sorting"
MEDIUM,Rotting Oranges,88.1,0.5584673029987052,https://leetcode.com/problems/rotting-oranges,"Array, Breadth-First Search, Matrix"
MEDIUM,Generate Parentheses,88.1,0.7639661108537367,https://leetcode.com/problems/generate-parentheses,"String, Dynamic Programming, Backtracking"
MEDIUM,All Nodes Distance K in Binary Tree,88.1,0.6574708887023653,https://leetcode.com/problems/all-nodes-distance-k-in-binary-tree,"Hash Table, Tree, Depth-First Search, Breadth-First Search, Binary Tree"
MEDIUM,Search in Rotated Sorted Array,88.1,0.42217748530957894,https://leetcode.com/problems/search-in-rotated-sorted-array,"Array, Binary Search"
MEDIUM,Capacity To Ship Packages Within D Days,88.1,0.712637700411953,https://leetcode.com/problems/capacity-to-ship-packages-within-d-days,"Array, Binary Search"
