Difficulty,Title,Frequency,Acceptance Rate,Link,Topics
MEDIUM,Maximal Square,100.0,0.4865039213599628,https://leetcode.com/problems/maximal-square,"Array, Dynamic Programming, Matrix"
MEDIUM,Subarray Product Less Than K,73.5,0.5278844547450234,https://leetcode.com/problems/subarray-product-less-than-k,"Array, Binary Search, Sliding Window, Prefix Sum"
EASY,Two Sum,60.2,0.5568049446443466,https://leetcode.com/problems/two-sum,"Array, Hash Table"
MEDIUM,Max Area of Island,60.2,0.7310930866668968,https://leetcode.com/problems/max-area-of-island,"Array, Depth-First Search, Breadth-First Search, Union Find, Matrix"
EASY,Roman to Integer,60.2,0.6475890906660287,https://leetcode.com/problems/roman-to-integer,"Hash Table, Math, String"
