Difficulty,Title,Frequency,Acceptance Rate,Link,Topics
EASY,Count Common Words With One Occurrence,100.0,0.7210120787903965,https://leetcode.com/problems/count-common-words-with-one-occurrence,"Array, Hash Table, String, Counting"
EASY,Add Two Integers,95.5,0.8812610512150468,https://leetcode.com/problems/add-two-integers,Math
MEDIUM,Walking Robot Simulation,83.0,0.5814776177051334,https://leetcode.com/problems/walking-robot-simulation,"Array, Hash Table, Simulation"
HARD,Stream of Characters,73.1,0.5235256001873118,https://leetcode.com/problems/stream-of-characters,"Array, String, Design, Trie, Data Stream"
MEDIUM,Evaluate Division,73.1,0.6288203521659285,https://leetcode.com/problems/evaluate-division,"Array, String, Depth-First Search, Breadth-First Search, Union Find, Graph, Shortest Path"
HARD,Minimum Time to Make Array Sum At Most x,73.1,0.2496583365872706,https://leetcode.com/problems/minimum-time-to-make-array-sum-at-most-x,"Array, Dynamic Programming, Sorting"
HARD,Design a Text Editor,73.1,0.47745002437835204,https://leetcode.com/problems/design-a-text-editor,"Linked List, String, Stack, Design, Simulation, Doubly-Linked List"
