Difficulty,Title,Frequency,Acceptance Rate,Link,Topics
MEDIUM,Walls and Gates,100.0,0.6296791509568449,https://leetcode.com/problems/walls-and-gates,"Array, Breadth-First Search, Matrix"
HARD,Longest Increasing Path in a Matrix,94.4,0.5534762586302827,https://leetcode.com/problems/longest-increasing-path-in-a-matrix,"Array, Dynamic Programming, Depth-First Search, Breadth-First Search, Graph, Topological Sort, Memoization, Matrix"
MEDIUM,Search Suggestions System,87.6,0.6505026464247127,https://leetcode.com/problems/search-suggestions-system,"Array, String, Binary Search, Trie, Sorting, Heap (Priority Queue)"
HARD,Binary Tree Maximum Path Sum,85.2,0.41224280010589104,https://leetcode.com/problems/binary-tree-maximum-path-sum,"Dynamic Programming, Tree, Depth-First Search, Binary Tree"
HARD,Shortest Distance from All Buildings,77.4,0.4437276667084348,https://leetcode.com/problems/shortest-distance-from-all-buildings,"Array, Breadth-First Search, Matrix"
HARD,Design In-Memory File System,74.3,0.4816948941663167,https://leetcode.com/problems/design-in-memory-file-system,"Hash Table, String, Design, Trie, Sorting"
MEDIUM,Koko Eating Bananas,73.1,0.49067301427387977,https://leetcode.com/problems/koko-eating-bananas,"Array, Binary Search"
HARD,Maximum Profit in Job Scheduling,70.5,0.5441726985180008,https://leetcode.com/problems/maximum-profit-in-job-scheduling,"Array, Binary Search, Dynamic Programming, Sorting"
MEDIUM,Design File System,69.0,0.6413755041392486,https://leetcode.com/problems/design-file-system,"Hash Table, String, Design, Trie"
MEDIUM,Single-Threaded CPU,63.7,0.4648191183347267,https://leetcode.com/problems/single-threaded-cpu,"Array, Sorting, Heap (Priority Queue)"
MEDIUM,Count Nodes With the Highest Score,59.1,0.5126480395538692,https://leetcode.com/problems/count-nodes-with-the-highest-score,"Array, Tree, Depth-First Search, Binary Tree"
MEDIUM,Next Greater Element III,56.3,0.34586631403766466,https://leetcode.com/problems/next-greater-element-iii,"Math, Two Pointers, String"
MEDIUM,Minimum Number of Steps to Make Two Strings Anagram,56.3,0.8215204393310427,https://leetcode.com/problems/minimum-number-of-steps-to-make-two-strings-anagram,"Hash Table, String, Counting"
HARD,Making A Large Island,56.3,0.5489046988177128,https://leetcode.com/problems/making-a-large-island,"Array, Depth-First Search, Breadth-First Search, Union Find, Matrix"
MEDIUM,Minimum Size Subarray Sum,52.9,0.49391032213026165,https://leetcode.com/problems/minimum-size-subarray-sum,"Array, Binary Search, Sliding Window, Prefix Sum"
MEDIUM,01 Matrix,52.9,0.5147651813305447,https://leetcode.com/problems/01-matrix,"Array, Dynamic Programming, Breadth-First Search, Matrix"
MEDIUM,Basic Calculator II,48.9,0.4581138691872612,https://leetcode.com/problems/basic-calculator-ii,"Math, String, Stack"
HARD,Largest Rectangle in Histogram,48.9,0.4737767587697204,https://leetcode.com/problems/largest-rectangle-in-histogram,"Array, Stack, Monotonic Stack"
HARD,Serialize and Deserialize Binary Tree,43.6,0.5896943616903895,https://leetcode.com/problems/serialize-and-deserialize-binary-tree,"String, Tree, Depth-First Search, Breadth-First Search, Design, Binary Tree"
HARD,Word Search II,43.6,0.3732633211647155,https://leetcode.com/problems/word-search-ii,"Array, String, Backtracking, Trie, Matrix"
HARD,Minimize Malware Spread,43.6,0.4244718413272332,https://leetcode.com/problems/minimize-malware-spread,"Array, Hash Table, Depth-First Search, Breadth-First Search, Union Find, Graph"
HARD,Basic Calculator,43.6,0.45589558921827417,https://leetcode.com/problems/basic-calculator,"Math, String, Stack, Recursion"
HARD,Sliding Window Median,43.6,0.38691979014997274,https://leetcode.com/problems/sliding-window-median,"Array, Hash Table, Sliding Window, Heap (Priority Queue)"
MEDIUM,Jump Game,43.6,0.3947921593161437,https://leetcode.com/problems/jump-game,"Array, Dynamic Programming, Greedy"
MEDIUM,Course Schedule,43.6,0.49234347710196147,https://leetcode.com/problems/course-schedule,"Depth-First Search, Breadth-First Search, Graph, Topological Sort"
MEDIUM,Max Area of Island,43.6,0.7316417973813468,https://leetcode.com/problems/max-area-of-island,"Array, Depth-First Search, Breadth-First Search, Union Find, Matrix"
MEDIUM,4Sum,43.6,0.38219027018726465,https://leetcode.com/problems/4sum,"Array, Two Pointers, Sorting"
EASY,Check if One String Swap Can Make Strings Equal,43.6,0.49453245772264176,https://leetcode.com/problems/check-if-one-string-swap-can-make-strings-equal,"Hash Table, String, Counting"
MEDIUM,Most Profit Assigning Work,43.6,0.5593843602581683,https://leetcode.com/problems/most-profit-assigning-work,"Array, Two Pointers, Binary Search, Greedy, Sorting"
MEDIUM,Binary Tree Vertical Order Traversal,36.3,0.571412329907316,https://leetcode.com/problems/binary-tree-vertical-order-traversal,"Hash Table, Tree, Depth-First Search, Breadth-First Search, Sorting, Binary Tree"
MEDIUM,Course Schedule II,36.3,0.5342350291611208,https://leetcode.com/problems/course-schedule-ii,"Depth-First Search, Breadth-First Search, Graph, Topological Sort"
HARD,Sliding Window Maximum,36.3,0.47604171417820246,https://leetcode.com/problems/sliding-window-maximum,"Array, Queue, Sliding Window, Heap (Priority Queue), Monotonic Queue"
HARD,Basic Calculator III,36.3,0.52469160116735,https://leetcode.com/problems/basic-calculator-iii,"Math, String, Stack, Recursion"
MEDIUM,Number of Islands,36.3,0.6231993887316181,https://leetcode.com/problems/number-of-islands,"Array, Depth-First Search, Breadth-First Search, Union Find, Matrix"
MEDIUM,Ways to Make a Fair Array,36.3,0.644989189340971,https://leetcode.com/problems/ways-to-make-a-fair-array,"Array, Prefix Sum"
MEDIUM,Longest Common Subsequence,36.3,0.582494259379739,https://leetcode.com/problems/longest-common-subsequence,"String, Dynamic Programming"
MEDIUM,Find K Closest Elements,36.3,0.486686656754684,https://leetcode.com/problems/find-k-closest-elements,"Array, Two Pointers, Binary Search, Sliding Window, Sorting, Heap (Priority Queue)"
HARD,Vertical Order Traversal of a Binary Tree,36.3,0.5133056725792462,https://leetcode.com/problems/vertical-order-traversal-of-a-binary-tree,"Hash Table, Tree, Depth-First Search, Breadth-First Search, Sorting, Binary Tree"
EASY,Buddy Strings,36.3,0.33643969856328565,https://leetcode.com/problems/buddy-strings,"Hash Table, String"
EASY,Find Nearest Point That Has the Same X or Y Coordinate,36.3,0.6943535233007477,https://leetcode.com/problems/find-nearest-point-that-has-the-same-x-or-y-coordinate,Array
MEDIUM,LRU Cache,36.3,0.4521458782274209,https://leetcode.com/problems/lru-cache,"Hash Table, Linked List, Design, Doubly-Linked List"
