Difficulty,Title,Frequency,Acceptance Rate,Link,Topics
HARD,Binary Tree Maximum Path Sum,100.0,0.41022922529390315,https://leetcode.com/problems/binary-tree-maximum-path-sum,"Dynamic Programming, Tree, Depth-First Search, Binary Tree"
MEDIUM,Walls and Gates,99.0,0.627009478720793,https://leetcode.com/problems/walls-and-gates,"Array, Breadth-First Search, Matrix"
HARD,Maximum Profit in Job Scheduling,93.6,0.5433655468630157,https://leetcode.com/problems/maximum-profit-in-job-scheduling,"Array, Binary Search, Dynamic Programming, Sorting"
HARD,Longest Increasing Path in a Matrix,87.0,0.5504489521461392,https://leetcode.com/problems/longest-increasing-path-in-a-matrix,"Array, Dynamic Programming, Depth-First Search, Breadth-First Search, Graph, Topological Sort, Memoization, Matrix"
MEDIUM,Most Profit Assigning Work,83.9,0.5585708342778568,https://leetcode.com/problems/most-profit-assigning-work,"Array, Two Pointers, Binary Search, Greedy, Sorting"
MEDIUM,Design File System,82.7,0.6389633995694067,https://leetcode.com/problems/design-file-system,"Hash Table, String, Design, Trie"
EASY,Check if One String Swap Can Make Strings Equal,81.4,0.4944267854801886,https://leetcode.com/problems/check-if-one-string-swap-can-make-strings-equal,"Hash Table, String, Counting"
MEDIUM,Koko Eating Bananas,80.7,0.48954615928433787,https://leetcode.com/problems/koko-eating-bananas,"Array, Binary Search"
MEDIUM,Minimum Number of Steps to Make Two Strings Anagram,75.2,0.8210564197318666,https://leetcode.com/problems/minimum-number-of-steps-to-make-two-strings-anagram,"Hash Table, String, Counting"
MEDIUM,Search Suggestions System,72.3,0.6501836385374287,https://leetcode.com/problems/search-suggestions-system,"Array, String, Binary Search, Trie, Sorting, Heap (Priority Queue)"
EASY,Find Nearest Point That Has the Same X or Y Coordinate,72.3,0.6923192061424176,https://leetcode.com/problems/find-nearest-point-that-has-the-same-x-or-y-coordinate,Array
MEDIUM,Count Sub Islands,72.3,0.7281340013866155,https://leetcode.com/problems/count-sub-islands,"Array, Depth-First Search, Breadth-First Search, Union Find, Matrix"
EASY,Buddy Strings,72.3,0.33579273395079456,https://leetcode.com/problems/buddy-strings,"Hash Table, String"
MEDIUM,Single-Threaded CPU,71.2,0.4616022140330625,https://leetcode.com/problems/single-threaded-cpu,"Array, Sorting, Heap (Priority Queue)"
MEDIUM,Asteroid Collision,71.2,0.4520820787520883,https://leetcode.com/problems/asteroid-collision,"Array, Stack, Simulation"
HARD,Making A Large Island,68.8,0.5437071824942744,https://leetcode.com/problems/making-a-large-island,"Array, Depth-First Search, Breadth-First Search, Union Find, Matrix"
MEDIUM,Next Greater Element III,67.5,0.344616927319359,https://leetcode.com/problems/next-greater-element-iii,"Math, Two Pointers, String"
MEDIUM,Find K Closest Elements,67.5,0.4845734127340576,https://leetcode.com/problems/find-k-closest-elements,"Array, Two Pointers, Binary Search, Sliding Window, Sorting, Heap (Priority Queue)"
HARD,Serialize and Deserialize Binary Tree,64.6,0.5854439864682758,https://leetcode.com/problems/serialize-and-deserialize-binary-tree,"String, Tree, Depth-First Search, Breadth-First Search, Design, Binary Tree"
HARD,Shortest Distance from All Buildings,64.6,0.4415290683177733,https://leetcode.com/problems/shortest-distance-from-all-buildings,"Array, Breadth-First Search, Matrix"
HARD,Basic Calculator III,61.1,0.521333722457318,https://leetcode.com/problems/basic-calculator-iii,"Math, String, Stack, Recursion"
MEDIUM,Task Scheduler,61.1,0.6111563566442735,https://leetcode.com/problems/task-scheduler,"Array, Hash Table, Greedy, Sorting, Heap (Priority Queue), Counting"
MEDIUM,Implement Trie (Prefix Tree),61.1,0.6767997567382654,https://leetcode.com/problems/implement-trie-prefix-tree,"Hash Table, String, Design, Trie"
MEDIUM,Basic Calculator II,59.1,0.45454283769459747,https://leetcode.com/problems/basic-calculator-ii,"Math, String, Stack"
MEDIUM,Count Nodes With the Highest Score,56.9,0.5085596177752483,https://leetcode.com/problems/count-nodes-with-the-highest-score,"Array, Tree, Depth-First Search, Binary Tree"
MEDIUM,Course Schedule II,56.9,0.5291120803508438,https://leetcode.com/problems/course-schedule-ii,"Depth-First Search, Breadth-First Search, Graph, Topological Sort"
HARD,Best Meeting Point,56.9,0.6121927565796074,https://leetcode.com/problems/best-meeting-point,"Array, Math, Sorting, Matrix"
EASY,Two Sum,54.3,0.553384887447402,https://leetcode.com/problems/two-sum,"Array, Hash Table"
MEDIUM,Jump Game,54.3,0.3921411381117183,https://leetcode.com/problems/jump-game,"Array, Dynamic Programming, Greedy"
HARD,Number of Visible People in a Queue,51.4,0.7073896282018015,https://leetcode.com/problems/number-of-visible-people-in-a-queue,"Array, Stack, Monotonic Stack"
MEDIUM,Next Permutation,48.0,0.425864603333096,https://leetcode.com/problems/next-permutation,"Array, Two Pointers"
HARD,Swim in Rising Water,48.0,0.6239387715902542,https://leetcode.com/problems/swim-in-rising-water,"Array, Binary Search, Depth-First Search, Breadth-First Search, Union Find, Heap (Priority Queue), Matrix"
HARD,Design In-Memory File System,48.0,0.4810280283349201,https://leetcode.com/problems/design-in-memory-file-system,"Hash Table, String, Design, Trie, Sorting"
HARD,Vertical Order Traversal of a Binary Tree,43.7,0.5069539737313272,https://leetcode.com/problems/vertical-order-traversal-of-a-binary-tree,"Hash Table, Tree, Depth-First Search, Breadth-First Search, Sorting, Binary Tree"
HARD,Largest Rectangle in Histogram,43.7,0.4684090674308197,https://leetcode.com/problems/largest-rectangle-in-histogram,"Array, Stack, Monotonic Stack"
HARD,Count All Valid Pickup and Delivery Options,43.7,0.6486829434658749,https://leetcode.com/problems/count-all-valid-pickup-and-delivery-options,"Math, Dynamic Programming, Combinatorics"
MEDIUM,Maximum Gap,43.7,0.48828609600152684,https://leetcode.com/problems/maximum-gap,"Array, Sorting, Bucket Sort, Radix Sort"
MEDIUM,Design Add and Search Words Data Structure,43.7,0.46873413339846215,https://leetcode.com/problems/design-add-and-search-words-data-structure,"String, Depth-First Search, Design, Trie"
HARD,Basic Calculator,43.7,0.4515333354709494,https://leetcode.com/problems/basic-calculator,"Math, String, Stack, Recursion"
MEDIUM,Capacity To Ship Packages Within D Days,38.3,0.7162262094733974,https://leetcode.com/problems/capacity-to-ship-packages-within-d-days,"Array, Binary Search"
MEDIUM,Shortest Path to Get Food,38.3,0.5653130028908259,https://leetcode.com/problems/shortest-path-to-get-food,"Array, Breadth-First Search, Matrix"
HARD,Word Search II,38.3,0.3711768164361891,https://leetcode.com/problems/word-search-ii,"Array, String, Backtracking, Trie, Matrix"
MEDIUM,Analyze User Website Visit Pattern,38.3,0.4340032205397206,https://leetcode.com/problems/analyze-user-website-visit-pattern,"Array, Hash Table, Sorting"
MEDIUM,Interval List Intersections,38.3,0.7252957930045354,https://leetcode.com/problems/interval-list-intersections,"Array, Two Pointers, Line Sweep"
MEDIUM,Find the Celebrity,38.3,0.48296620052267564,https://leetcode.com/problems/find-the-celebrity,"Two Pointers, Graph, Interactive"
MEDIUM,Immediate Food Delivery II,38.3,0.5393229520522507,https://leetcode.com/problems/immediate-food-delivery-ii,Database
EASY,Immediate Food Delivery I,38.3,0.8088453318443498,https://leetcode.com/problems/immediate-food-delivery-i,Database
HARD,Sudoku Solver,38.3,0.6370823970454567,https://leetcode.com/problems/sudoku-solver,"Array, Hash Table, Backtracking, Matrix"
MEDIUM,Jump Game II,38.3,0.4124450082486079,https://leetcode.com/problems/jump-game-ii,"Array, Dynamic Programming, Greedy"
MEDIUM,Number of Islands,38.3,0.6186238386317104,https://leetcode.com/problems/number-of-islands,"Array, Depth-First Search, Breadth-First Search, Union Find, Matrix"
MEDIUM,Design Browser History,30.8,0.7799763448034386,https://leetcode.com/problems/design-browser-history,"Array, Linked List, Stack, Design, Doubly-Linked List, Data Stream"
MEDIUM,01 Matrix,30.8,0.5094745173839291,https://leetcode.com/problems/01-matrix,"Array, Dynamic Programming, Breadth-First Search, Matrix"
HARD,LFU Cache,30.8,0.46074503916550635,https://leetcode.com/problems/lfu-cache,"Hash Table, Linked List, Design, Doubly-Linked List"
MEDIUM,Top K Frequent Elements,30.8,0.642517588313433,https://leetcode.com/problems/top-k-frequent-elements,"Array, Hash Table, Divide and Conquer, Sorting, Heap (Priority Queue), Bucket Sort, Counting, Quickselect"
MEDIUM,Max Area of Island,30.8,0.7298596841218539,https://leetcode.com/problems/max-area-of-island,"Array, Depth-First Search, Breadth-First Search, Union Find, Matrix"
MEDIUM,Longest Common Subsequence,30.8,0.5807624411912015,https://leetcode.com/problems/longest-common-subsequence,"String, Dynamic Programming"
HARD,Subsequence With the Minimum Score,30.8,0.3247082140497688,https://leetcode.com/problems/subsequence-with-the-minimum-score,"Two Pointers, String, Binary Search"
EASY,Counting Words With a Given Prefix,30.8,0.845264681240003,https://leetcode.com/problems/counting-words-with-a-given-prefix,"Array, String, String Matching"
MEDIUM,Implement Trie II (Prefix Tree),30.8,0.6303311258278146,https://leetcode.com/problems/implement-trie-ii-prefix-tree,"Hash Table, String, Design, Trie"
EASY,Move Zeroes,30.8,0.62641043904403,https://leetcode.com/problems/move-zeroes,"Array, Two Pointers"
MEDIUM,Diameter of N-Ary Tree,30.8,0.749274873524452,https://leetcode.com/problems/diameter-of-n-ary-tree,"Tree, Depth-First Search"
MEDIUM,Mice and Cheese,30.8,0.4693170084083198,https://leetcode.com/problems/mice-and-cheese,"Array, Greedy, Sorting, Heap (Priority Queue)"
MEDIUM,Path With Maximum Minimum Value,30.8,0.5394038784797671,https://leetcode.com/problems/path-with-maximum-minimum-value,"Array, Binary Search, Depth-First Search, Breadth-First Search, Union Find, Heap (Priority Queue), Matrix"
HARD,Maximum Performance of a Team,30.8,0.4751005823931576,https://leetcode.com/problems/maximum-performance-of-a-team,"Array, Greedy, Sorting, Heap (Priority Queue)"
MEDIUM,Valid Sudoku,30.8,0.6189172943418667,https://leetcode.com/problems/valid-sudoku,"Array, Hash Table, Matrix"
HARD,Employee Free Time,30.8,0.7254861912796376,https://leetcode.com/problems/employee-free-time,"Array, Sorting, Heap (Priority Queue)"
HARD,Maximum Path Quality of a Graph,30.8,0.5939080433226336,https://leetcode.com/problems/maximum-path-quality-of-a-graph,"Array, Backtracking, Graph"
MEDIUM,3Sum,30.8,0.366654171432838,https://leetcode.com/problems/3sum,"Array, Two Pointers, Sorting"
MEDIUM,Number of Provinces,30.8,0.6819893467139105,https://leetcode.com/problems/number-of-provinces,"Depth-First Search, Breadth-First Search, Union Find, Graph"
HARD,Sliding Window Maximum,30.8,0.4736673674132046,https://leetcode.com/problems/sliding-window-maximum,"Array, Queue, Sliding Window, Heap (Priority Queue), Monotonic Queue"
MEDIUM,Meeting Rooms II,30.8,0.5200582150944579,https://leetcode.com/problems/meeting-rooms-ii,"Array, Two Pointers, Greedy, Sorting, Heap (Priority Queue), Prefix Sum"
MEDIUM,Group Anagrams,30.8,0.7056682421348905,https://leetcode.com/problems/group-anagrams,"Array, Hash Table, String, Sorting"
