Difficulty,Title,Frequency,Acceptance Rate,Link,Topics
MEDIUM,Walls and Gates,100.0,0.6281722705476096,https://leetcode.com/problems/walls-and-gates,"Array, Breadth-First Search, Matrix"
HARD,Binary Tree Maximum Path Sum,95.2,0.4111833106147164,https://leetcode.com/problems/binary-tree-maximum-path-sum,"Dynamic Programming, Tree, Depth-First Search, Binary Tree"
HARD,Longest Increasing Path in a Matrix,92.2,0.5517859581115996,https://leetcode.com/problems/longest-increasing-path-in-a-matrix,"Array, Dynamic Programming, Depth-First Search, Breadth-First Search, Graph, Topological Sort, Memoization, Matrix"
HARD,Maximum Profit in Job Scheduling,87.7,0.5438722159974303,https://leetcode.com/problems/maximum-profit-in-job-scheduling,"Array, Binary Search, Dynamic Programming, Sorting"
MEDIUM,Search Suggestions System,79.3,0.6504518283779691,https://leetcode.com/problems/search-suggestions-system,"Array, String, Binary Search, Trie, Sorting, Heap (Priority Queue)"
MEDIUM,Koko Eating Bananas,78.2,0.4904249515089255,https://leetcode.com/problems/koko-eating-bananas,"Array, Binary Search"
MEDIUM,Design File System,75.5,0.640070630393574,https://leetcode.com/problems/design-file-system,"Hash Table, String, Design, Trie"
MEDIUM,Most Profit Assigning Work,75.5,0.5589063446349332,https://leetcode.com/problems/most-profit-assigning-work,"Array, Two Pointers, Binary Search, Greedy, Sorting"
EASY,Check if One String Swap Can Make Strings Equal,74.5,0.4944566503295589,https://leetcode.com/problems/check-if-one-string-swap-can-make-strings-equal,"Hash Table, String, Counting"
HARD,Shortest Distance from All Buildings,71.8,0.4424755401882614,https://leetcode.com/problems/shortest-distance-from-all-buildings,"Array, Breadth-First Search, Matrix"
MEDIUM,Minimum Number of Steps to Make Two Strings Anagram,71.8,0.821256554282131,https://leetcode.com/problems/minimum-number-of-steps-to-make-two-strings-anagram,"Hash Table, String, Counting"
MEDIUM,Single-Threaded CPU,69.9,0.4628747039421107,https://leetcode.com/problems/single-threaded-cpu,"Array, Sorting, Heap (Priority Queue)"
MEDIUM,Find K Closest Elements,69.9,0.4853969658543951,https://leetcode.com/problems/find-k-closest-elements,"Array, Two Pointers, Binary Search, Sliding Window, Sorting, Heap (Priority Queue)"
EASY,Buddy Strings,67.1,0.33609954405699105,https://leetcode.com/problems/buddy-strings,"Hash Table, String"
MEDIUM,Next Greater Element III,66.3,0.3451331486272984,https://leetcode.com/problems/next-greater-element-iii,"Math, Two Pointers, String"
EASY,Find Nearest Point That Has the Same X or Y Coordinate,65.5,0.6931773728780874,https://leetcode.com/problems/find-nearest-point-that-has-the-same-x-or-y-coordinate,Array
HARD,Basic Calculator III,64.6,0.52310145116158,https://leetcode.com/problems/basic-calculator-iii,"Math, String, Stack, Recursion"
MEDIUM,Count Sub Islands,63.7,0.7279401584083898,https://leetcode.com/problems/count-sub-islands,"Array, Depth-First Search, Breadth-First Search, Union Find, Matrix"
HARD,Design In-Memory File System,63.7,0.4812214951417807,https://leetcode.com/problems/design-in-memory-file-system,"Hash Table, String, Design, Trie, Sorting"
HARD,Making A Large Island,62.8,0.5455430074883627,https://leetcode.com/problems/making-a-large-island,"Array, Depth-First Search, Breadth-First Search, Union Find, Matrix"
MEDIUM,Asteroid Collision,61.8,0.45327874824731995,https://leetcode.com/problems/asteroid-collision,"Array, Stack, Simulation"
MEDIUM,Count Nodes With the Highest Score,61.8,0.5104588988777249,https://leetcode.com/problems/count-nodes-with-the-highest-score,"Array, Tree, Depth-First Search, Binary Tree"
HARD,Serialize and Deserialize Binary Tree,60.7,0.5872325218087768,https://leetcode.com/problems/serialize-and-deserialize-binary-tree,"String, Tree, Depth-First Search, Breadth-First Search, Design, Binary Tree"
MEDIUM,Basic Calculator II,57.0,0.4562792599225438,https://leetcode.com/problems/basic-calculator-ii,"Math, String, Stack"
HARD,Count All Valid Pickup and Delivery Options,57.0,0.6487613846084596,https://leetcode.com/problems/count-all-valid-pickup-and-delivery-options,"Math, Dynamic Programming, Combinatorics"
HARD,Best Meeting Point,55.6,0.6124298145240693,https://leetcode.com/problems/best-meeting-point,"Array, Math, Sorting, Matrix"
HARD,Vertical Order Traversal of a Binary Tree,55.6,0.5092023131796687,https://leetcode.com/problems/vertical-order-traversal-of-a-binary-tree,"Hash Table, Tree, Depth-First Search, Breadth-First Search, Sorting, Binary Tree"
EASY,Two Sum,54.1,0.5554649194347598,https://leetcode.com/problems/two-sum,"Array, Hash Table"
MEDIUM,Immediate Food Delivery II,54.1,0.54119925457668,https://leetcode.com/problems/immediate-food-delivery-ii,Database
EASY,Immediate Food Delivery I,54.1,0.808520572484897,https://leetcode.com/problems/immediate-food-delivery-i,Database
MEDIUM,Implement Trie (Prefix Tree),54.1,0.6770008824785902,https://leetcode.com/problems/implement-trie-prefix-tree,"Hash Table, String, Design, Trie"
MEDIUM,Course Schedule II,54.1,0.5312866474001375,https://leetcode.com/problems/course-schedule-ii,"Depth-First Search, Breadth-First Search, Graph, Topological Sort"
MEDIUM,Interval List Intersections,52.4,0.7260203540912984,https://leetcode.com/problems/interval-list-intersections,"Array, Two Pointers, Line Sweep"
HARD,Subsequence With the Minimum Score,52.4,0.3255713358806142,https://leetcode.com/problems/subsequence-with-the-minimum-score,"Two Pointers, String, Binary Search"
MEDIUM,Mice and Cheese,52.4,0.4706826605959782,https://leetcode.com/problems/mice-and-cheese,"Array, Greedy, Sorting, Heap (Priority Queue)"
MEDIUM,Task Scheduler,52.4,0.6133028680759834,https://leetcode.com/problems/task-scheduler,"Array, Hash Table, Greedy, Sorting, Heap (Priority Queue), Counting"
MEDIUM,Jump Game,52.4,0.3932838173956417,https://leetcode.com/problems/jump-game,"Array, Dynamic Programming, Greedy"
HARD,Largest Rectangle in Histogram,50.5,0.47068055655423874,https://leetcode.com/problems/largest-rectangle-in-histogram,"Array, Stack, Monotonic Stack"
MEDIUM,01 Matrix,48.5,0.5113034324651791,https://leetcode.com/problems/01-matrix,"Array, Dynamic Programming, Breadth-First Search, Matrix"
HARD,Basic Calculator,46.1,0.45352391357780225,https://leetcode.com/problems/basic-calculator,"Math, String, Stack, Recursion"
HARD,Word Search II,46.1,0.37199983823735816,https://leetcode.com/problems/word-search-ii,"Array, String, Backtracking, Trie, Matrix"
HARD,Swim in Rising Water,43.4,0.6256457548574352,https://leetcode.com/problems/swim-in-rising-water,"Array, Binary Search, Depth-First Search, Breadth-First Search, Union Find, Heap (Priority Queue), Matrix"
HARD,Number of Visible People in a Queue,43.4,0.7106654560991241,https://leetcode.com/problems/number-of-visible-people-in-a-queue,"Array, Stack, Monotonic Stack"
MEDIUM,Max Area of Island,43.4,0.7306262638070706,https://leetcode.com/problems/max-area-of-island,"Array, Depth-First Search, Breadth-First Search, Union Find, Matrix"
MEDIUM,Longest Common Subsequence,43.4,0.5815558846617495,https://leetcode.com/problems/longest-common-subsequence,"String, Dynamic Programming"
MEDIUM,Minimum Size Subarray Sum,43.4,0.4915208268983027,https://leetcode.com/problems/minimum-size-subarray-sum,"Array, Binary Search, Sliding Window, Prefix Sum"
MEDIUM,Next Permutation,43.4,0.4279294293018899,https://leetcode.com/problems/next-permutation,"Array, Two Pointers"
MEDIUM,Jump Game II,40.2,0.4135616691734447,https://leetcode.com/problems/jump-game-ii,"Array, Dynamic Programming, Greedy"
MEDIUM,Design Add and Search Words Data Structure,40.2,0.4687552111432635,https://leetcode.com/problems/design-add-and-search-words-data-structure,"String, Depth-First Search, Design, Trie"
HARD,Sliding Window Median,36.3,0.38636769470166576,https://leetcode.com/problems/sliding-window-median,"Array, Hash Table, Sliding Window, Heap (Priority Queue)"
HARD,Sudoku Solver,36.3,0.6375732569888851,https://leetcode.com/problems/sudoku-solver,"Array, Hash Table, Backtracking, Matrix"
HARD,Minimize Malware Spread,36.3,0.42342210871944547,https://leetcode.com/problems/minimize-malware-spread,"Array, Hash Table, Depth-First Search, Breadth-First Search, Union Find, Graph"
MEDIUM,Maximum Gap,36.3,0.49088295910619373,https://leetcode.com/problems/maximum-gap,"Array, Sorting, Bucket Sort, Radix Sort"
MEDIUM,Binary Tree Vertical Order Traversal,36.3,0.56982345880052,https://leetcode.com/problems/binary-tree-vertical-order-traversal,"Hash Table, Tree, Depth-First Search, Breadth-First Search, Sorting, Binary Tree"
MEDIUM,Shortest Path to Get Food,36.3,0.5660300896611113,https://leetcode.com/problems/shortest-path-to-get-food,"Array, Breadth-First Search, Matrix"
MEDIUM,Number of Provinces,31.3,0.6837599092438864,https://leetcode.com/problems/number-of-provinces,"Depth-First Search, Breadth-First Search, Union Find, Graph"
HARD,Maximum Path Quality of a Graph,31.3,0.5948742438713785,https://leetcode.com/problems/maximum-path-quality-of-a-graph,"Array, Backtracking, Graph"
MEDIUM,Find the Celebrity,31.3,0.4836893350199524,https://leetcode.com/problems/find-the-celebrity,"Two Pointers, Graph, Interactive"
MEDIUM,Ways to Make a Fair Array,31.3,0.6436154295566924,https://leetcode.com/problems/ways-to-make-a-fair-array,"Array, Prefix Sum"
MEDIUM,Analyze User Website Visit Pattern,31.3,0.4357997464960033,https://leetcode.com/problems/analyze-user-website-visit-pattern,"Array, Hash Table, Sorting"
MEDIUM,Capacity To Ship Packages Within D Days,31.3,0.7178978765675434,https://leetcode.com/problems/capacity-to-ship-packages-within-d-days,"Array, Binary Search"
MEDIUM,Number of Islands,31.3,0.6206900885057614,https://leetcode.com/problems/number-of-islands,"Array, Depth-First Search, Breadth-First Search, Union Find, Matrix"
HARD,Sliding Window Maximum,31.3,0.47465366217307575,https://leetcode.com/problems/sliding-window-maximum,"Array, Queue, Sliding Window, Heap (Priority Queue), Monotonic Queue"
HARD,LFU Cache,31.3,0.4627928056428496,https://leetcode.com/problems/lfu-cache,"Hash Table, Linked List, Design, Doubly-Linked List"
MEDIUM,4Sum,31.3,0.3797917852100061,https://leetcode.com/problems/4sum,"Array, Two Pointers, Sorting"
MEDIUM,LRU Cache,31.3,0.4493676665149161,https://leetcode.com/problems/lru-cache,"Hash Table, Linked List, Design, Doubly-Linked List"
EASY,Move Zeroes,24.5,0.6272147793558553,https://leetcode.com/problems/move-zeroes,"Array, Two Pointers"
MEDIUM,Range Sum Query 2D - Immutable,24.5,0.5631234388739932,https://leetcode.com/problems/range-sum-query-2d-immutable,"Array, Design, Matrix, Prefix Sum"
MEDIUM,Insert Delete GetRandom O(1),24.5,0.5492713439134542,https://leetcode.com/problems/insert-delete-getrandom-o1,"Array, Hash Table, Math, Design, Randomized"
HARD,Merge k Sorted Lists,24.5,0.5644299851507728,https://leetcode.com/problems/merge-k-sorted-lists,"Linked List, Divide and Conquer, Heap (Priority Queue), Merge Sort"
HARD,Similar String Groups,24.5,0.553056565485753,https://leetcode.com/problems/similar-string-groups,"Array, Hash Table, String, Depth-First Search, Breadth-First Search, Union Find"
MEDIUM,Longest Palindromic Substring,24.5,0.356484082570195,https://leetcode.com/problems/longest-palindromic-substring,"Two Pointers, String, Dynamic Programming"
HARD,Design Search Autocomplete System,24.5,0.4934711938160577,https://leetcode.com/problems/design-search-autocomplete-system,"String, Depth-First Search, Design, Trie, Sorting, Heap (Priority Queue), Data Stream"
MEDIUM,Brace Expansion,24.5,0.6667840228958216,https://leetcode.com/problems/brace-expansion,"String, Backtracking, Breadth-First Search"
MEDIUM,Top K Frequent Elements,24.5,0.6438794349967089,https://leetcode.com/problems/top-k-frequent-elements,"Array, Hash Table, Divide and Conquer, Sorting, Heap (Priority Queue), Bucket Sort, Counting, Quickselect"
MEDIUM,Path With Maximum Minimum Value,24.5,0.5397159647404506,https://leetcode.com/problems/path-with-maximum-minimum-value,"Array, Binary Search, Depth-First Search, Breadth-First Search, Union Find, Heap (Priority Queue), Matrix"
MEDIUM,Number of Closed Islands,24.5,0.6669113375930718,https://leetcode.com/problems/number-of-closed-islands,"Array, Depth-First Search, Breadth-First Search, Union Find, Matrix"
MEDIUM,Valid Sudoku,24.5,0.6206543928529922,https://leetcode.com/problems/valid-sudoku,"Array, Hash Table, Matrix"
MEDIUM,Task Scheduler II,24.5,0.539073855377907,https://leetcode.com/problems/task-scheduler-ii,"Array, Hash Table, Simulation"
MEDIUM,Group Anagrams,24.5,0.707240357115704,https://leetcode.com/problems/group-anagrams,"Array, Hash Table, String, Sorting"
MEDIUM,Implement Trie II (Prefix Tree),24.5,0.6311539667607401,https://leetcode.com/problems/implement-trie-ii-prefix-tree,"Hash Table, String, Design, Trie"
EASY,Counting Words With a Given Prefix,24.5,0.8451722722553541,https://leetcode.com/problems/counting-words-with-a-given-prefix,"Array, String, String Matching"
HARD,Employee Free Time,24.5,0.7256101053447828,https://leetcode.com/problems/employee-free-time,"Array, Line Sweep, Sorting, Heap (Priority Queue)"
MEDIUM,Design Browser History,24.5,0.776867586068649,https://leetcode.com/problems/design-browser-history,"Array, Linked List, Stack, Design, Doubly-Linked List, Data Stream"
MEDIUM,Diameter of N-Ary Tree,24.5,0.750239923224568,https://leetcode.com/problems/diameter-of-n-ary-tree,"Tree, Depth-First Search"
MEDIUM,Meeting Rooms II,24.5,0.5207959142627572,https://leetcode.com/problems/meeting-rooms-ii,"Array, Two Pointers, Greedy, Sorting, Heap (Priority Queue), Prefix Sum"
HARD,Maximum Performance of a Team,24.5,0.4751663270967471,https://leetcode.com/problems/maximum-performance-of-a-team,"Array, Greedy, Sorting, Heap (Priority Queue)"
MEDIUM,Course Schedule,24.5,0.48945653698517133,https://leetcode.com/problems/course-schedule,"Depth-First Search, Breadth-First Search, Graph, Topological Sort"
