Difficulty,Title,Frequency,Acceptance Rate,Link
EASY,Remove All Adjacent Duplicates In String,100.0,0.7068937637540627,https://leetcode.com/problems/remove-all-adjacent-duplicates-in-string
MEDIUM,Insert Delete GetRandom O(1),100.0,0.5480520197020177,https://leetcode.com/problems/insert-delete-getrandom-o1
MEDIUM,Remove All Adjacent Duplicates in String II,94.5,0.5884346172519825,https://leetcode.com/problems/remove-all-adjacent-duplicates-in-string-ii
EASY,Sum of Left Leaves,77.4,0.6123352786786814,https://leetcode.com/problems/sum-of-left-leaves
MEDIUM,Decode the Slanted Ciphertext,77.4,0.4916367598051782,https://leetcode.com/problems/decode-the-slanted-ciphertext
MEDIUM,Implement Trie (Prefix Tree),77.4,0.6704762242591593,https://leetcode.com/problems/implement-trie-prefix-tree
EASY,Perfect Number,77.4,0.43351065756024076,https://leetcode.com/problems/perfect-number
