Difficulty,Title,Frequency,Acceptance Rate,Link,Topics
EASY,Sqrt(x),100.0,0.400805951087881,https://leetcode.com/problems/sqrtx,"Math, Binary Search"
EASY,Remove All Adjacent Duplicates In String,94.5,0.7114393830629449,https://leetcode.com/problems/remove-all-adjacent-duplicates-in-string,"String, Stack"
MEDIUM,Remove All Adjacent Duplicates in String II,94.5,0.5917521123422019,https://leetcode.com/problems/remove-all-adjacent-duplicates-in-string-ii,"String, Stack"
MEDIUM,Generate Parentheses,94.5,0.7661927663165167,https://leetcode.com/problems/generate-parentheses,"String, Dynamic Programming, Backtracking"
MEDIUM,Search in Rotated Sorted Array,87.4,0.42401237969196237,https://leetcode.com/problems/search-in-rotated-sorted-array,"Array, Binary Search"
MEDIUM,Merge Intervals,87.4,0.48881576651731307,https://leetcode.com/problems/merge-intervals,"Array, Sorting"
MEDIUM,Insert Delete GetRandom O(1),77.3,0.5493258120773469,https://leetcode.com/problems/insert-delete-getrandom-o1,"Array, Hash Table, Math, Design, Randomized"
