Difficulty,Title,Frequency,Acceptance Rate,Link,Topics
EASY,Longest Common Prefix,100.0,0.44980497103020445,https://leetcode.com/problems/longest-common-prefix,"String, Trie"
EASY,Majority Element,88.2,0.6552318640533595,https://leetcode.com/problems/majority-element,"Array, Hash Table, Divide and Conquer, Sorting, Counting"
EASY,Best Time to Buy and Sell Stock,88.2,0.5482912075011509,https://leetcode.com/problems/best-time-to-buy-and-sell-stock,"Array, Dynamic Programming"
HARD,Median of Two Sorted Arrays,88.2,0.43064720802063106,https://leetcode.com/problems/median-of-two-sorted-arrays,"Array, Binary Search, Divide and Conquer"
EASY,Roman to Integer,88.2,0.6427350760745624,https://leetcode.com/problems/roman-to-integer,"Hash Table, Math, String"
EASY,Two Sum,88.2,0.5518582655130876,https://leetcode.com/problems/two-sum,"Array, Hash Table"
