Difficulty,Title,Frequency,Acceptance Rate,Link,Topics
EASY,Climbing Stairs,100.0,0.5341034197481851,https://leetcode.com/problems/climbing-stairs,"Math, Dynamic Programming, Memoization"
MEDIUM,Longest Palindromic Substring,96.2,0.3549099116573772,https://leetcode.com/problems/longest-palindromic-substring,"Two Pointers, String, Dynamic Programming"
EASY,Best Time to Buy and Sell Stock,95.1,0.5492507253761075,https://leetcode.com/problems/best-time-to-buy-and-sell-stock,"Array, Dynamic Programming"
MEDIUM,Spiral Matrix,95.1,0.5330334207583659,https://leetcode.com/problems/spiral-matrix,"Array, Matrix, Simulation"
MEDIUM,Longest Substring Without Repeating Characters,91.7,0.36543896808557735,https://leetcode.com/problems/longest-substring-without-repeating-characters,"Hash Table, String, Sliding Window"
EASY,Valid Parentheses,89.0,0.4202357901282674,https://leetcode.com/problems/valid-parentheses,"String, Stack"
MEDIUM,Group Anagrams,89.0,0.7056675865895179,https://leetcode.com/problems/group-anagrams,"Array, Hash Table, String, Sorting"
EASY,Move Zeroes,86.0,0.6264099951179686,https://leetcode.com/problems/move-zeroes,"Array, Two Pointers"
MEDIUM,Decode String,82.7,0.6084055798690464,https://leetcode.com/problems/decode-string,"String, Stack, Recursion"
MEDIUM,Compare Version Numbers,80.8,0.42083819800764777,https://leetcode.com/problems/compare-version-numbers,"Two Pointers, String"
MEDIUM,Number of Islands,80.8,0.6186237165389135,https://leetcode.com/problems/number-of-islands,"Array, Depth-First Search, Breadth-First Search, Union Find, Matrix"
EASY,Two Sum,80.8,0.5533852658785754,https://leetcode.com/problems/two-sum,"Array, Hash Table"
EASY,Longest Common Prefix,78.7,0.45102094846418117,https://leetcode.com/problems/longest-common-prefix,"String, Trie"
HARD,Trapping Rain Water,78.7,0.645647772319481,https://leetcode.com/problems/trapping-rain-water,"Array, Two Pointers, Dynamic Programming, Stack, Monotonic Stack"
MEDIUM,Merge Intervals,78.7,0.4902749101132054,https://leetcode.com/problems/merge-intervals,"Array, Sorting"
MEDIUM,Rotate Array,76.4,0.42652585384662783,https://leetcode.com/problems/rotate-array,"Array, Math, Two Pointers"
MEDIUM,Generate Parentheses,73.9,0.7675043375868441,https://leetcode.com/problems/generate-parentheses,"String, Dynamic Programming, Backtracking"
MEDIUM,Rotate Image,73.9,0.7742719930680149,https://leetcode.com/problems/rotate-image,"Array, Math, Matrix"
MEDIUM,Zigzag Conversion,73.9,0.5107264888647458,https://leetcode.com/problems/zigzag-conversion,String
MEDIUM,Container With Most Water,73.9,0.5740097530566751,https://leetcode.com/problems/container-with-most-water,"Array, Two Pointers, Greedy"
EASY,Excel Sheet Column Number,71.1,0.65429531274996,https://leetcode.com/problems/excel-sheet-column-number,"Math, String"
HARD,Text Justification,68.0,0.47493079690922935,https://leetcode.com/problems/text-justification,"Array, String, Simulation"
MEDIUM,Largest Number,68.0,0.4099589116382131,https://leetcode.com/problems/largest-number,"Array, String, Greedy, Sorting"
EASY,Merge Sorted Array,68.0,0.5249696374998994,https://leetcode.com/problems/merge-sorted-array,"Array, Two Pointers, Sorting"
EASY,Word Pattern,68.0,0.429070792596536,https://leetcode.com/problems/word-pattern,"Hash Table, String"
EASY,Roman to Integer,68.0,0.6441544547095313,https://leetcode.com/problems/roman-to-integer,"Hash Table, Math, String"
EASY,Happy Number,64.3,0.5773601443048402,https://leetcode.com/problems/happy-number,"Hash Table, Math, Two Pointers"
MEDIUM,Sort Colors,64.3,0.666376809908254,https://leetcode.com/problems/sort-colors,"Array, Two Pointers, Sorting"
HARD,Median of Two Sorted Arrays,64.3,0.43234272504026683,https://leetcode.com/problems/median-of-two-sorted-arrays,"Array, Binary Search, Divide and Conquer"
EASY,Sort Even and Odd Indices Independently,64.3,0.6245770506882166,https://leetcode.com/problems/sort-even-and-odd-indices-independently,"Array, Sorting"
MEDIUM,Spiral Matrix II,60.0,0.7312530289628615,https://leetcode.com/problems/spiral-matrix-ii,"Array, Matrix, Simulation"
EASY,Reverse Vowels of a String,60.0,0.5745459372393847,https://leetcode.com/problems/reverse-vowels-of-a-string,"Two Pointers, String"
MEDIUM,Partition Equal Subset Sum,60.0,0.4818634390442132,https://leetcode.com/problems/partition-equal-subset-sum,"Array, Dynamic Programming"
MEDIUM,Search in Rotated Sorted Array,60.0,0.4250779659339041,https://leetcode.com/problems/search-in-rotated-sorted-array,"Array, Binary Search"
HARD,Largest Rectangle in Histogram,60.0,0.468409144825463,https://leetcode.com/problems/largest-rectangle-in-histogram,"Array, Stack, Monotonic Stack"
MEDIUM,Combination Sum,60.0,0.7418799713305972,https://leetcode.com/problems/combination-sum,"Array, Backtracking"
MEDIUM,Non-overlapping Intervals,60.0,0.5513598510561031,https://leetcode.com/problems/non-overlapping-intervals,"Array, Dynamic Programming, Greedy, Sorting"
HARD,Wildcard Matching,60.0,0.2953224590559176,https://leetcode.com/problems/wildcard-matching,"String, Dynamic Programming, Greedy, Recursion"
HARD,Longest Valid Parentheses,60.0,0.3590146562691919,https://leetcode.com/problems/longest-valid-parentheses,"String, Dynamic Programming, Stack"
MEDIUM,Count and Say,54.8,0.581829851754168,https://leetcode.com/problems/count-and-say,String
MEDIUM,Maximum Subarray,54.8,0.518640862703969,https://leetcode.com/problems/maximum-subarray,"Array, Divide and Conquer, Dynamic Programming"
EASY,Add to Array-Form of Integer,54.8,0.44999383081818584,https://leetcode.com/problems/add-to-array-form-of-integer,"Array, Math"
EASY,Palindrome Number,54.8,0.5886340442887702,https://leetcode.com/problems/palindrome-number,Math
HARD,Integer to English Words,54.8,0.34274242670672167,https://leetcode.com/problems/integer-to-english-words,"Math, String, Recursion"
EASY,Shuffle the Array,54.8,0.8880192021997055,https://leetcode.com/problems/shuffle-the-array,Array
MEDIUM,Valid Sudoku,54.8,0.6189174624333068,https://leetcode.com/problems/valid-sudoku,"Array, Hash Table, Matrix"
MEDIUM,Decode Ways,54.8,0.36248822225213395,https://leetcode.com/problems/decode-ways,"String, Dynamic Programming"
EASY,Single Number,54.8,0.7556538219641789,https://leetcode.com/problems/single-number,"Array, Bit Manipulation"
MEDIUM,Word Break,54.8,0.48020574632819757,https://leetcode.com/problems/word-break,"Array, Hash Table, String, Dynamic Programming, Trie, Memoization"
MEDIUM,Edit Distance,54.8,0.5838340754554718,https://leetcode.com/problems/edit-distance,"String, Dynamic Programming"
MEDIUM,Best Time to Buy and Sell Stock II,54.8,0.6909030549182876,https://leetcode.com/problems/best-time-to-buy-and-sell-stock-ii,"Array, Dynamic Programming, Greedy"
MEDIUM,Integer to Roman,54.8,0.6809705274335391,https://leetcode.com/problems/integer-to-roman,"Hash Table, Math, String"
MEDIUM,Restore IP Addresses,54.8,0.526176094087527,https://leetcode.com/problems/restore-ip-addresses,"String, Backtracking"
EASY,Replace Elements with Greatest Element on Right Side,54.8,0.7135526816517254,https://leetcode.com/problems/replace-elements-with-greatest-element-on-right-side,Array
MEDIUM,Find the Duplicate Number,54.8,0.625091811106188,https://leetcode.com/problems/find-the-duplicate-number,"Array, Two Pointers, Binary Search, Bit Manipulation"
EASY,Find the Index of the First Occurrence in a String,48.0,0.446519595961395,https://leetcode.com/problems/find-the-index-of-the-first-occurrence-in-a-string,"Two Pointers, String, String Matching"
EASY,Maximum Population Year,48.0,0.6235882763624416,https://leetcode.com/problems/maximum-population-year,"Array, Counting, Prefix Sum"
MEDIUM,Find Triangular Sum of an Array,48.0,0.787605867564863,https://leetcode.com/problems/find-triangular-sum-of-an-array,"Array, Math, Simulation, Combinatorics"
MEDIUM,Asteroid Collision,48.0,0.4520835255666228,https://leetcode.com/problems/asteroid-collision,"Array, Stack, Simulation"
MEDIUM,3Sum Closest,48.0,0.46692982906751257,https://leetcode.com/problems/3sum-closest,"Array, Two Pointers, Sorting"
MEDIUM,String Compression,48.0,0.575886003672713,https://leetcode.com/problems/string-compression,"Two Pointers, String"
MEDIUM,Diagonal Traverse,48.0,0.627207111962206,https://leetcode.com/problems/diagonal-traverse,"Array, Matrix, Simulation"
MEDIUM,Word Search,48.0,0.4483878603103723,https://leetcode.com/problems/word-search,"Array, String, Backtracking, Depth-First Search, Matrix"
MEDIUM,House Robber,48.0,0.5209528009767901,https://leetcode.com/problems/house-robber,"Array, Dynamic Programming"
HARD,Regular Expression Matching,48.0,0.2906633628293123,https://leetcode.com/problems/regular-expression-matching,"String, Dynamic Programming, Recursion"
EASY,Merge Strings Alternately,48.0,0.820563713872168,https://leetcode.com/problems/merge-strings-alternately,"Two Pointers, String"
EASY,Find Winner on a Tic Tac Toe Game,48.0,0.54122229401558,https://leetcode.com/problems/find-winner-on-a-tic-tac-toe-game,"Array, Hash Table, Matrix, Simulation"
MEDIUM,Longest Consecutive Sequence,48.0,0.47126604363749824,https://leetcode.com/problems/longest-consecutive-sequence,"Array, Hash Table, Union Find"
MEDIUM,Longest Increasing Subsequence,48.0,0.5738414426043519,https://leetcode.com/problems/longest-increasing-subsequence,"Array, Binary Search, Dynamic Programming"
EASY,Search Insert Position,48.0,0.48576324626882844,https://leetcode.com/problems/search-insert-position,"Array, Binary Search"
EASY,Remove Duplicates from Sorted Array,48.0,0.598069931961077,https://leetcode.com/problems/remove-duplicates-from-sorted-array,"Array, Two Pointers"
MEDIUM,Letter Combinations of a Phone Number,48.0,0.6336682215810526,https://leetcode.com/problems/letter-combinations-of-a-phone-number,"Hash Table, String, Backtracking"
MEDIUM,3Sum,48.0,0.36665450133987565,https://leetcode.com/problems/3sum,"Array, Two Pointers, Sorting"
MEDIUM,Find the Winner of the Circular Game,48.0,0.8200582084508179,https://leetcode.com/problems/find-the-winner-of-the-circular-game,"Array, Math, Recursion, Queue, Simulation"
MEDIUM,Permutations,48.0,0.8033215317423417,https://leetcode.com/problems/permutations,"Array, Backtracking"
MEDIUM,Product of Array Except Self,48.0,0.6750760845384615,https://leetcode.com/problems/product-of-array-except-self,"Array, Prefix Sum"
MEDIUM,Subsets,48.0,0.8047240133017184,https://leetcode.com/problems/subsets,"Array, Backtracking, Bit Manipulation"
EASY,Remove All Adjacent Duplicates In String,38.7,0.7123406248004485,https://leetcode.com/problems/remove-all-adjacent-duplicates-in-string,"String, Stack"
MEDIUM,Set Matrix Zeroes,38.7,0.5925548877405984,https://leetcode.com/problems/set-matrix-zeroes,"Array, Hash Table, Matrix"
EASY,Palindrome Linked List,38.7,0.553998474322969,https://leetcode.com/problems/palindrome-linked-list,"Linked List, Two Pointers, Stack, Recursion"
MEDIUM,Find Peak Element,38.7,0.4639841832717408,https://leetcode.com/problems/find-peak-element,"Array, Binary Search"
MEDIUM,Reverse Linked List II,38.7,0.492684322247397,https://leetcode.com/problems/reverse-linked-list-ii,Linked List
EASY,Minimum Moves to Convert String,38.7,0.5623686175406353,https://leetcode.com/problems/minimum-moves-to-convert-string,"String, Greedy"
MEDIUM,Unique Binary Search Trees,38.7,0.622304276100753,https://leetcode.com/problems/unique-binary-search-trees,"Math, Dynamic Programming, Tree, Binary Search Tree, Binary Tree"
MEDIUM,Jump Game,38.7,0.39214130224270827,https://leetcode.com/problems/jump-game,"Array, Dynamic Programming, Greedy"
EASY,Isomorphic Strings,38.7,0.4656376022431486,https://leetcode.com/problems/isomorphic-strings,"Hash Table, String"
MEDIUM,Next Greater Element III,38.7,0.3446155982197265,https://leetcode.com/problems/next-greater-element-iii,"Math, Two Pointers, String"
MEDIUM,Cinema Seat Allocation,38.7,0.4256417135507492,https://leetcode.com/problems/cinema-seat-allocation,"Array, Hash Table, Greedy, Bit Manipulation"
EASY,First Unique Character in a String,38.7,0.6339023611172179,https://leetcode.com/problems/first-unique-character-in-a-string,"Hash Table, String, Queue, Counting"
MEDIUM,Next Permutation,38.7,0.4258661786515415,https://leetcode.com/problems/next-permutation,"Array, Two Pointers"
MEDIUM,Remove K Digits,38.7,0.3458771507434843,https://leetcode.com/problems/remove-k-digits,"String, Stack, Greedy, Monotonic Stack"
EASY,Pascal's Triangle,38.7,0.7663218716854083,https://leetcode.com/problems/pascals-triangle,"Array, Dynamic Programming"
MEDIUM,Maximum Sum of an Hourglass,38.7,0.7576990598697272,https://leetcode.com/problems/maximum-sum-of-an-hourglass,"Array, Matrix, Prefix Sum"
EASY,Binary Search,38.7,0.592953880347855,https://leetcode.com/problems/binary-search,"Array, Binary Search"
EASY,Reverse Only Letters,38.7,0.6655389561697634,https://leetcode.com/problems/reverse-only-letters,"Two Pointers, String"
EASY,Middle of the Linked List,38.7,0.8027618054291346,https://leetcode.com/problems/middle-of-the-linked-list,"Linked List, Two Pointers"
MEDIUM,Remove Duplicates from Sorted Array II,38.7,0.6248593655743625,https://leetcode.com/problems/remove-duplicates-from-sorted-array-ii,"Array, Two Pointers"
HARD,N-Queens,38.7,0.7205622799531384,https://leetcode.com/problems/n-queens,"Array, Backtracking"
EASY,Largest Substring Between Two Equal Characters,38.7,0.6822597998416597,https://leetcode.com/problems/largest-substring-between-two-equal-characters,"Hash Table, String"
MEDIUM,The Latest Time to Catch a Bus,38.7,0.28068626089027365,https://leetcode.com/problems/the-latest-time-to-catch-a-bus,"Array, Two Pointers, Binary Search, Sorting"
