Difficulty,Title,Frequency,Acceptance Rate,Link,Topics
EASY,Climbing Stairs,100.0,0.5354071307127308,https://leetcode.com/problems/climbing-stairs,"Math, Dynamic Programming, Memoization"
EASY,Best Time to Buy and Sell Stock,96.4,0.5525962946831828,https://leetcode.com/problems/best-time-to-buy-and-sell-stock,"Array, Dynamic Programming"
MEDIUM,Spiral Matrix,96.4,0.539397306376751,https://leetcode.com/problems/spiral-matrix,"Array, Matrix, Simulation"
MEDIUM,Longest Palindromic Substring,94.4,0.35846119792835807,https://leetcode.com/problems/longest-palindromic-substring,"Two Pointers, String, Dynamic Programming"
MEDIUM,Group Anagrams,94.4,0.7092883384085745,https://leetcode.com/problems/group-anagrams,"Array, Hash Table, String, Sorting"
MEDIUM,Longest Substring Without Repeating Characters,92.2,0.3693617406358928,https://leetcode.com/problems/longest-substring-without-repeating-characters,"Hash Table, String, Sliding Window"
MEDIUM,Decode String,88.5,0.6115254553566836,https://leetcode.com/problems/decode-string,"String, Stack, Recursion"
EASY,Valid Parentheses,88.5,0.42322841550192813,https://leetcode.com/problems/valid-parentheses,"String, Stack"
MEDIUM,Number of Islands,87.2,0.6232000863217745,https://leetcode.com/problems/number-of-islands,"Array, Depth-First Search, Breadth-First Search, Union Find, Matrix"
HARD,Trapping Rain Water,85.7,0.6510198658123436,https://leetcode.com/problems/trapping-rain-water,"Array, Two Pointers, Dynamic Programming, Stack, Monotonic Stack"
EASY,Move Zeroes,85.7,0.6280401658078502,https://leetcode.com/problems/move-zeroes,"Array, Two Pointers"
MEDIUM,Merge Intervals,85.7,0.4939524622259912,https://leetcode.com/problems/merge-intervals,"Array, Sorting"
EASY,Two Sum,84.1,0.5577699567836188,https://leetcode.com/problems/two-sum,"Array, Hash Table"
EASY,Sort Even and Odd Indices Independently,82.5,0.6263510609509559,https://leetcode.com/problems/sort-even-and-odd-indices-independently,"Array, Sorting"
MEDIUM,Compare Version Numbers,80.7,0.42347164241032764,https://leetcode.com/problems/compare-version-numbers,"Two Pointers, String"
MEDIUM,Rotate Image,78.8,0.7790166005161556,https://leetcode.com/problems/rotate-image,"Array, Math, Matrix"
MEDIUM,Largest Number,78.8,0.412803811932624,https://leetcode.com/problems/largest-number,"Array, String, Greedy, Sorting"
MEDIUM,Generate Parentheses,78.8,0.7713287456277772,https://leetcode.com/problems/generate-parentheses,"String, Dynamic Programming, Backtracking"
MEDIUM,Rotate Array,76.7,0.43021388103635533,https://leetcode.com/problems/rotate-array,"Array, Math, Two Pointers"
EASY,Excel Sheet Column Number,76.7,0.6575288642721604,https://leetcode.com/problems/excel-sheet-column-number,"Math, String"
MEDIUM,Zigzag Conversion,76.7,0.516068082489165,https://leetcode.com/problems/zigzag-conversion,String
EASY,Find Winner on a Tic Tac Toe Game,76.7,0.5418363660832548,https://leetcode.com/problems/find-winner-on-a-tic-tac-toe-game,"Array, Hash Table, Matrix, Simulation"
MEDIUM,Container With Most Water,74.4,0.5778282666830817,https://leetcode.com/problems/container-with-most-water,"Array, Two Pointers, Greedy"
EASY,Longest Common Prefix,74.4,0.45483092049093565,https://leetcode.com/problems/longest-common-prefix,"String, Trie"
MEDIUM,Remove All Occurrences of a Substring,74.4,0.7806968639516182,https://leetcode.com/problems/remove-all-occurrences-of-a-substring,"String, Stack, Simulation"
HARD,Wildcard Matching,69.1,0.29898326214211846,https://leetcode.com/problems/wildcard-matching,"String, Dynamic Programming, Greedy, Recursion"
HARD,Regular Expression Matching,69.1,0.2928017990801526,https://leetcode.com/problems/regular-expression-matching,"String, Dynamic Programming, Recursion"
EASY,Word Pattern,65.9,0.4306076461166752,https://leetcode.com/problems/word-pattern,"Hash Table, String"
HARD,Text Justification,65.9,0.48149935664104093,https://leetcode.com/problems/text-justification,"Array, String, Simulation"
HARD,Median of Two Sorted Arrays,65.9,0.43814584290173053,https://leetcode.com/problems/median-of-two-sorted-arrays,"Array, Binary Search, Divide and Conquer"
EASY,Roman to Integer,65.9,0.6486630763259216,https://leetcode.com/problems/roman-to-integer,"Hash Table, Math, String"
MEDIUM,Valid Sudoku,65.9,0.6227680464675994,https://leetcode.com/problems/valid-sudoku,"Array, Hash Table, Matrix"
EASY,Merge Sorted Array,62.2,0.5291952521829845,https://leetcode.com/problems/merge-sorted-array,"Array, Two Pointers, Sorting"
MEDIUM,Non-overlapping Intervals,62.2,0.5550284035532288,https://leetcode.com/problems/non-overlapping-intervals,"Array, Dynamic Programming, Greedy, Sorting"
EASY,Replace Elements with Greatest Element on Right Side,62.2,0.715038886093751,https://leetcode.com/problems/replace-elements-with-greatest-element-on-right-side,Array
MEDIUM,Edit Distance,62.2,0.5878978573489683,https://leetcode.com/problems/edit-distance,"String, Dynamic Programming"
EASY,Happy Number,62.2,0.580726470983853,https://leetcode.com/problems/happy-number,"Hash Table, Math, Two Pointers"
HARD,Longest Valid Parentheses,62.2,0.36313111013843186,https://leetcode.com/problems/longest-valid-parentheses,"String, Dynamic Programming, Stack"
MEDIUM,Basic Calculator II,62.2,0.4581138691872612,https://leetcode.com/problems/basic-calculator-ii,"Math, String, Stack"
MEDIUM,Best Time to Buy and Sell Stock II,57.8,0.6950028393422977,https://leetcode.com/problems/best-time-to-buy-and-sell-stock-ii,"Array, Dynamic Programming, Greedy"
HARD,Largest Rectangle in Histogram,57.8,0.4737767587697204,https://leetcode.com/problems/largest-rectangle-in-histogram,"Array, Stack, Monotonic Stack"
MEDIUM,Search in Rotated Sorted Array,57.8,0.4283722142038899,https://leetcode.com/problems/search-in-rotated-sorted-array,"Array, Binary Search"
MEDIUM,Combination Sum,57.8,0.7467470899446323,https://leetcode.com/problems/combination-sum,"Array, Backtracking"
MEDIUM,Count and Say,57.8,0.6050656775612677,https://leetcode.com/problems/count-and-say,String
MEDIUM,Product of Array Except Self,57.8,0.6777997448369232,https://leetcode.com/problems/product-of-array-except-self,"Array, Prefix Sum"
MEDIUM,Find the Duplicate Number,57.8,0.6283574822732809,https://leetcode.com/problems/find-the-duplicate-number,"Array, Two Pointers, Binary Search, Bit Manipulation"
MEDIUM,Sort Colors,57.8,0.675831142046278,https://leetcode.com/problems/sort-colors,"Array, Two Pointers, Sorting"
MEDIUM,Restore IP Addresses,57.8,0.5315838531583853,https://leetcode.com/problems/restore-ip-addresses,"String, Backtracking"
MEDIUM,Decode Ways,57.8,0.36530964641194813,https://leetcode.com/problems/decode-ways,"String, Dynamic Programming"
MEDIUM,3Sum,57.8,0.3707096014078555,https://leetcode.com/problems/3sum,"Array, Two Pointers, Sorting"
MEDIUM,Jump Game,57.8,0.39479233995926627,https://leetcode.com/problems/jump-game,"Array, Dynamic Programming, Greedy"
MEDIUM,Letter Combinations of a Phone Number,57.8,0.6385755479764873,https://leetcode.com/problems/letter-combinations-of-a-phone-number,"Hash Table, String, Backtracking"
MEDIUM,Partition Equal Subset Sum,57.8,0.48443837096843656,https://leetcode.com/problems/partition-equal-subset-sum,"Array, Dynamic Programming"
EASY,Merge Strings Alternately,52.5,0.8222969137255444,https://leetcode.com/problems/merge-strings-alternately,"Two Pointers, String"
EASY,Shuffle the Array,52.5,0.8885454303637532,https://leetcode.com/problems/shuffle-the-array,Array
EASY,Reverse Vowels of a String,52.5,0.5818743809957564,https://leetcode.com/problems/reverse-vowels-of-a-string,"Two Pointers, String"
EASY,Palindrome Number,52.5,0.5922453204915432,https://leetcode.com/problems/palindrome-number,Math
HARD,Integer to English Words,52.5,0.34354789501950295,https://leetcode.com/problems/integer-to-english-words,"Math, String, Recursion"
HARD,Word Search II,52.5,0.37326314604211236,https://leetcode.com/problems/word-search-ii,"Array, String, Backtracking, Trie, Matrix"
MEDIUM,Diagonal Traverse,52.5,0.6317318066223124,https://leetcode.com/problems/diagonal-traverse,"Array, Matrix, Simulation"
EASY,Single Number,52.5,0.7596886320417466,https://leetcode.com/problems/single-number,"Array, Bit Manipulation"
EASY,Find the Index of the First Occurrence in a String,52.5,0.44971593402996185,https://leetcode.com/problems/find-the-index-of-the-first-occurrence-in-a-string,"Two Pointers, String, String Matching"
MEDIUM,Word Search,52.5,0.45266963526412307,https://leetcode.com/problems/word-search,"Array, String, Backtracking, Depth-First Search, Matrix"
MEDIUM,Maximum Subarray,52.5,0.5209981027514663,https://leetcode.com/problems/maximum-subarray,"Array, Divide and Conquer, Dynamic Programming"
MEDIUM,Spiral Matrix II,52.5,0.734312719680276,https://leetcode.com/problems/spiral-matrix-ii,"Array, Matrix, Simulation"
EASY,Add to Array-Form of Integer,52.5,0.4507475217825599,https://leetcode.com/problems/add-to-array-form-of-integer,"Array, Math"
MEDIUM,Longest Consecutive Sequence,52.5,0.47040838765712195,https://leetcode.com/problems/longest-consecutive-sequence,"Array, Hash Table, Union Find"
HARD,N-Queens,52.5,0.728171156310315,https://leetcode.com/problems/n-queens,"Array, Backtracking"
MEDIUM,3Sum Closest,52.5,0.46886930810024124,https://leetcode.com/problems/3sum-closest,"Array, Two Pointers, Sorting"
EASY,Remove Duplicates from Sorted Array,52.5,0.6035554718716519,https://leetcode.com/problems/remove-duplicates-from-sorted-array,"Array, Two Pointers"
EASY,Maximum Population Year,45.7,0.6267903102222048,https://leetcode.com/problems/maximum-population-year,"Array, Counting, Prefix Sum"
MEDIUM,Asteroid Collision,45.7,0.4550058166209298,https://leetcode.com/problems/asteroid-collision,"Array, Stack, Simulation"
MEDIUM,Permutations,45.7,0.8066011857140178,https://leetcode.com/problems/permutations,"Array, Backtracking"
MEDIUM,Subsets,45.7,0.8087960552313721,https://leetcode.com/problems/subsets,"Array, Backtracking, Bit Manipulation"
MEDIUM,Integer to Roman,45.7,0.6861927118001762,https://leetcode.com/problems/integer-to-roman,"Hash Table, Math, String"
EASY,Reverse Only Letters,45.7,0.6683340514041327,https://leetcode.com/problems/reverse-only-letters,"Two Pointers, String"
MEDIUM,Minimum Time Difference,45.7,0.6235324529015283,https://leetcode.com/problems/minimum-time-difference,"Array, Math, String, Sorting"
MEDIUM,Coin Change,45.7,0.4649548561668961,https://leetcode.com/problems/coin-change,"Array, Dynamic Programming, Breadth-First Search"
MEDIUM,Longest Increasing Subsequence,45.7,0.5780836795005291,https://leetcode.com/problems/longest-increasing-subsequence,"Array, Binary Search, Dynamic Programming"
EASY,Search Insert Position,45.7,0.49012455458433435,https://leetcode.com/problems/search-insert-position,"Array, Binary Search"
MEDIUM,Word Break,45.7,0.48273780206490746,https://leetcode.com/problems/word-break,"Array, Hash Table, String, Dynamic Programming, Trie, Memoization"
MEDIUM,Find Triangular Sum of an Array,45.7,0.787754121730507,https://leetcode.com/problems/find-triangular-sum-of-an-array,"Array, Math, Simulation, Combinatorics"
MEDIUM,Reverse Words in a String,45.7,0.5191330387431672,https://leetcode.com/problems/reverse-words-in-a-string,"Two Pointers, String"
MEDIUM,House Robber,45.7,0.5230498170963667,https://leetcode.com/problems/house-robber,"Array, Dynamic Programming"
MEDIUM,Find the Winner of the Circular Game,45.7,0.8206656341049726,https://leetcode.com/problems/find-the-winner-of-the-circular-game,"Array, Math, Recursion, Queue, Simulation"
EASY,Middle of the Linked List,36.3,0.8058169146400064,https://leetcode.com/problems/middle-of-the-linked-list,"Linked List, Two Pointers"
EASY,Remove All Adjacent Duplicates In String,36.3,0.715875534292082,https://leetcode.com/problems/remove-all-adjacent-duplicates-in-string,"String, Stack"
MEDIUM,Next Permutation,36.3,0.4305775328017951,https://leetcode.com/problems/next-permutation,"Array, Two Pointers"
EASY,Isomorphic Strings,36.3,0.46857999480051205,https://leetcode.com/problems/isomorphic-strings,"Hash Table, String"
EASY,Binary Search,36.3,0.5956451391000113,https://leetcode.com/problems/binary-search,"Array, Binary Search"
MEDIUM,Cinema Seat Allocation,36.3,0.428224012806009,https://leetcode.com/problems/cinema-seat-allocation,"Array, Hash Table, Greedy, Bit Manipulation"
EASY,Palindrome Linked List,36.3,0.5585945204707473,https://leetcode.com/problems/palindrome-linked-list,"Linked List, Two Pointers, Stack, Recursion"
MEDIUM,Remove K Digits,36.3,0.3494044611317414,https://leetcode.com/problems/remove-k-digits,"String, Stack, Greedy, Monotonic Stack"
EASY,First Unique Character in a String,36.3,0.6369549089916232,https://leetcode.com/problems/first-unique-character-in-a-string,"Hash Table, String, Queue, Counting"
MEDIUM,Remove Duplicates from Sorted Array II,36.3,0.6290189928963057,https://leetcode.com/problems/remove-duplicates-from-sorted-array-ii,"Array, Two Pointers"
MEDIUM,The Latest Time to Catch a Bus,36.3,0.28690575479566305,https://leetcode.com/problems/the-latest-time-to-catch-a-bus,"Array, Two Pointers, Binary Search, Sorting"
MEDIUM,Reverse Linked List II,36.3,0.4959171468124833,https://leetcode.com/problems/reverse-linked-list-ii,Linked List
MEDIUM,Unique Binary Search Trees,36.3,0.6244520536210353,https://leetcode.com/problems/unique-binary-search-trees,"Math, Dynamic Programming, Tree, Binary Search Tree, Binary Tree"
EASY,Excel Sheet Column Title,36.3,0.43570325767039314,https://leetcode.com/problems/excel-sheet-column-title,"Math, String"
MEDIUM,Maximum Sum of an Hourglass,36.3,0.7589643035085746,https://leetcode.com/problems/maximum-sum-of-an-hourglass,"Array, Matrix, Prefix Sum"
