Difficulty,Title,Frequency,Acceptance Rate,Link,Topics
MEDIUM,LRU Cache,96.0,0.4521454893758596,https://leetcode.com/problems/lru-cache,"Hash Table, Linked List, Design, Doubly-Linked List"
MEDIUM,Merge Intervals,89.6,0.4939527547797844,https://leetcode.com/problems/merge-intervals,"Array, Sorting"
MEDIUM,Longest Substring Without Repeating Characters,84.8,0.36936173184826904,https://leetcode.com/problems/longest-substring-without-repeating-characters,"Hash Table, String, Sliding Window"
HARD,Trapping Rain Water,82.2,0.6510193782985645,https://leetcode.com/problems/trapping-rain-water,"Array, Two Pointers, Dynamic Programming, Stack, Monotonic Stack"
HARD,Merge k Sorted Lists,76.9,0.567741907864408,https://leetcode.com/problems/merge-k-sorted-lists,"Linked List, Divide and Conquer, Heap (Priority Queue), Merge Sort"
HARD,Minimum Window Substring,76.9,0.45350747638232236,https://leetcode.com/problems/minimum-window-substring,"Hash Table, String, Sliding Window"
MEDIUM,Word Search,76.0,0.45266926269047814,https://leetcode.com/problems/word-search,"Array, String, Backtracking, Depth-First Search, Matrix"
MEDIUM,Search in Rotated Sorted Array,75.1,0.4283722138743466,https://leetcode.com/problems/search-in-rotated-sorted-array,"Array, Binary Search"
MEDIUM,Longest Palindromic Substring,73.1,0.35846104860827005,https://leetcode.com/problems/longest-palindromic-substring,"Two Pointers, String, Dynamic Programming"
HARD,N-Queens,73.1,0.7281704967757537,https://leetcode.com/problems/n-queens,"Array, Backtracking"
MEDIUM,Restore IP Addresses,72.1,0.531583393083398,https://leetcode.com/problems/restore-ip-addresses,"String, Backtracking"
MEDIUM,3Sum,71.0,0.3707095131728428,https://leetcode.com/problems/3sum,"Array, Two Pointers, Sorting"
MEDIUM,Combination Sum,71.0,0.7467468656021409,https://leetcode.com/problems/combination-sum,"Array, Backtracking"
HARD,Word Ladder,69.8,0.4281180881873274,https://leetcode.com/problems/word-ladder,"Hash Table, String, Breadth-First Search"
EASY,Sqrt(x),68.6,0.40371796444280217,https://leetcode.com/problems/sqrtx,"Math, Binary Search"
EASY,Best Time to Buy and Sell Stock,67.4,0.5525965688982543,https://leetcode.com/problems/best-time-to-buy-and-sell-stock,"Array, Dynamic Programming"
HARD,Text Justification,67.4,0.48149935664104093,https://leetcode.com/problems/text-justification,"Array, String, Simulation"
EASY,Valid Parentheses,66.0,0.42322822762811346,https://leetcode.com/problems/valid-parentheses,"String, Stack"
HARD,Binary Tree Maximum Path Sum,64.6,0.4122427548197994,https://leetcode.com/problems/binary-tree-maximum-path-sum,"Dynamic Programming, Tree, Depth-First Search, Binary Tree"
MEDIUM,Sort Colors,64.6,0.6758312948649591,https://leetcode.com/problems/sort-colors,"Array, Two Pointers, Sorting"
MEDIUM,Find Peak Element,64.6,0.46509214864540416,https://leetcode.com/problems/find-peak-element,"Array, Binary Search"
MEDIUM,Spiral Matrix,64.6,0.5393974779242756,https://leetcode.com/problems/spiral-matrix,"Array, Matrix, Simulation"
EASY,Two Sum,64.6,0.557769895737655,https://leetcode.com/problems/two-sum,"Array, Hash Table"
HARD,Word Break II,63.0,0.5364536357075469,https://leetcode.com/problems/word-break-ii,"Array, Hash Table, String, Dynamic Programming, Backtracking, Trie, Memoization"
MEDIUM,Construct Binary Tree from Preorder and Inorder Traversal,63.0,0.6683774773521286,https://leetcode.com/problems/construct-binary-tree-from-preorder-and-inorder-traversal,"Array, Hash Table, Divide and Conquer, Tree, Binary Tree"
MEDIUM,Combination Sum II,61.4,0.5767453180420465,https://leetcode.com/problems/combination-sum-ii,"Array, Backtracking"
MEDIUM,Permutations,61.4,0.8066011364163758,https://leetcode.com/problems/permutations,"Array, Backtracking"
MEDIUM,Generate Parentheses,61.4,0.7713286717803378,https://leetcode.com/problems/generate-parentheses,"String, Dynamic Programming, Backtracking"
MEDIUM,Maximum Subarray,61.4,0.5209977684091738,https://leetcode.com/problems/maximum-subarray,"Array, Divide and Conquer, Dynamic Programming"
MEDIUM,Edit Distance,61.4,0.5878976197609908,https://leetcode.com/problems/edit-distance,"String, Dynamic Programming"
MEDIUM,Find First and Last Position of Element in Sorted Array,59.6,0.4682874104872264,https://leetcode.com/problems/find-first-and-last-position-of-element-in-sorted-array,"Array, Binary Search"
MEDIUM,Container With Most Water,57.6,0.5778283165036205,https://leetcode.com/problems/container-with-most-water,"Array, Two Pointers, Greedy"
HARD,Reverse Nodes in k-Group,57.6,0.6304374335039493,https://leetcode.com/problems/reverse-nodes-in-k-group,"Linked List, Recursion"
HARD,Regular Expression Matching,57.6,0.2928012366939696,https://leetcode.com/problems/regular-expression-matching,"String, Dynamic Programming, Recursion"
MEDIUM,Word Break,57.6,0.4827377619034214,https://leetcode.com/problems/word-break,"Array, Hash Table, String, Dynamic Programming, Trie, Memoization"
MEDIUM,Longest Consecutive Sequence,55.5,0.47040829093373415,https://leetcode.com/problems/longest-consecutive-sequence,"Array, Hash Table, Union Find"
MEDIUM,Best Time to Buy and Sell Stock II,55.5,0.6950025067480458,https://leetcode.com/problems/best-time-to-buy-and-sell-stock-ii,"Array, Dynamic Programming, Greedy"
MEDIUM,Jump Game,55.5,0.39479197867291327,https://leetcode.com/problems/jump-game,"Array, Dynamic Programming, Greedy"
MEDIUM,Subsets,53.2,0.808795565390318,https://leetcode.com/problems/subsets,"Array, Backtracking, Bit Manipulation"
MEDIUM,Decode Ways,53.2,0.36530982861754346,https://leetcode.com/problems/decode-ways,"String, Dynamic Programming"
MEDIUM,Group Anagrams,53.2,0.7092882781909262,https://leetcode.com/problems/group-anagrams,"Array, Hash Table, String, Sorting"
EASY,Merge Sorted Array,53.2,0.5291951986224571,https://leetcode.com/problems/merge-sorted-array,"Array, Two Pointers, Sorting"
MEDIUM,Reorder List,50.6,0.6250476843297371,https://leetcode.com/problems/reorder-list,"Linked List, Two Pointers, Stack, Recursion"
MEDIUM,Unique Binary Search Trees,50.6,0.6244520536210353,https://leetcode.com/problems/unique-binary-search-trees,"Math, Dynamic Programming, Tree, Binary Search Tree, Binary Tree"
EASY,Longest Common Prefix,50.6,0.4548305143026601,https://leetcode.com/problems/longest-common-prefix,"String, Trie"
MEDIUM,Validate Binary Search Tree,50.6,0.3438039571887417,https://leetcode.com/problems/validate-binary-search-tree,"Tree, Depth-First Search, Binary Search Tree, Binary Tree"
MEDIUM,Next Permutation,50.6,0.4305773996508374,https://leetcode.com/problems/next-permutation,"Array, Two Pointers"
MEDIUM,Integer to Roman,47.6,0.6861928580376627,https://leetcode.com/problems/integer-to-roman,"Hash Table, Math, String"
MEDIUM,Minimum Path Sum,47.6,0.6648152266005115,https://leetcode.com/problems/minimum-path-sum,"Array, Dynamic Programming, Matrix"
HARD,Parallel Courses III,47.6,0.6674963944974485,https://leetcode.com/problems/parallel-courses-iii,"Array, Dynamic Programming, Graph, Topological Sort"
HARD,Median of Two Sorted Arrays,47.6,0.43814591586025275,https://leetcode.com/problems/median-of-two-sorted-arrays,"Array, Binary Search, Divide and Conquer"
MEDIUM,Surrounded Regions,47.6,0.42886447562449315,https://leetcode.com/problems/surrounded-regions,"Array, Depth-First Search, Breadth-First Search, Union Find, Matrix"
MEDIUM,Sort List,47.6,0.618074922962942,https://leetcode.com/problems/sort-list,"Linked List, Two Pointers, Divide and Conquer, Sorting, Merge Sort"
MEDIUM,Permutations II,47.6,0.615917727605333,https://leetcode.com/problems/permutations-ii,"Array, Backtracking, Sorting"
MEDIUM,Find All Possible Recipes from Given Supplies,47.6,0.5646091593277981,https://leetcode.com/problems/find-all-possible-recipes-from-given-supplies,"Array, Hash Table, String, Graph, Topological Sort"
MEDIUM,Reverse Words in a String,44.2,0.5191327244735617,https://leetcode.com/problems/reverse-words-in-a-string,"Two Pointers, String"
MEDIUM,Maximum Product Subarray,44.2,0.3494162954383182,https://leetcode.com/problems/maximum-product-subarray,"Array, Dynamic Programming"
MEDIUM,Binary Tree Level Order Traversal,44.2,0.7059658947038693,https://leetcode.com/problems/binary-tree-level-order-traversal,"Tree, Breadth-First Search, Binary Tree"
MEDIUM,Find Minimum in Rotated Sorted Array,44.2,0.5264825291581084,https://leetcode.com/problems/find-minimum-in-rotated-sorted-array,"Array, Binary Search"
MEDIUM,Reverse Linked List II,44.2,0.49591736647057,https://leetcode.com/problems/reverse-linked-list-ii,Linked List
MEDIUM,Longest Substring with At Most Two Distinct Characters,44.2,0.5647336891491908,https://leetcode.com/problems/longest-substring-with-at-most-two-distinct-characters,"Hash Table, String, Sliding Window"
MEDIUM,Compare Version Numbers,44.2,0.4234711977763999,https://leetcode.com/problems/compare-version-numbers,"Two Pointers, String"
MEDIUM,Step-By-Step Directions From a Binary Tree Node to Another,44.2,0.5630838477366256,https://leetcode.com/problems/step-by-step-directions-from-a-binary-tree-node-to-another,"String, Tree, Depth-First Search, Binary Tree"
HARD,Longest Valid Parentheses,44.2,0.3631311456770452,https://leetcode.com/problems/longest-valid-parentheses,"String, Dynamic Programming, Stack"
MEDIUM,Add Two Numbers,44.2,0.4622507658063209,https://leetcode.com/problems/add-two-numbers,"Linked List, Math, Recursion"
EASY,Climbing Stairs,44.2,0.5354071840932856,https://leetcode.com/problems/climbing-stairs,"Math, Dynamic Programming, Memoization"
EASY,Intersection of Two Linked Lists,40.2,0.6112533936845744,https://leetcode.com/problems/intersection-of-two-linked-lists,"Hash Table, Linked List, Two Pointers"
EASY,Missing Ranges,40.2,0.3526494595509856,https://leetcode.com/problems/missing-ranges,Array
MEDIUM,Multiply Strings,40.2,0.4228941429852704,https://leetcode.com/problems/multiply-strings,"Math, String, Simulation"
MEDIUM,Jump Game II,40.2,0.41503302482260396,https://leetcode.com/problems/jump-game-ii,"Array, Dynamic Programming, Greedy"
MEDIUM,Fraction to Recurring Decimal,40.2,0.2622353839768554,https://leetcode.com/problems/fraction-to-recurring-decimal,"Hash Table, Math, String"
HARD,Distinct Subsequences,40.2,0.500998941013352,https://leetcode.com/problems/distinct-subsequences,"String, Dynamic Programming"
EASY,Merge Two Sorted Lists,40.2,0.6684090913680062,https://leetcode.com/problems/merge-two-sorted-lists,"Linked List, Recursion"
MEDIUM,Simplify Path,35.4,0.4785432317744196,https://leetcode.com/problems/simplify-path,"String, Stack"
EASY,Find Target Indices After Sorting Array,35.4,0.7728798563584792,https://leetcode.com/problems/find-target-indices-after-sorting-array,"Array, Binary Search, Sorting"
MEDIUM,"Pow(x, n)",35.4,0.3702318641045828,https://leetcode.com/problems/powx-n,"Math, Recursion"
HARD,Best Time to Buy and Sell Stock III,35.4,0.5112087693447603,https://leetcode.com/problems/best-time-to-buy-and-sell-stock-iii,"Array, Dynamic Programming"
HARD,Word Ladder II,35.4,0.2715262860113065,https://leetcode.com/problems/word-ladder-ii,"Hash Table, String, Backtracking, Breadth-First Search"
EASY,Valid Palindrome,35.4,0.5096357226652383,https://leetcode.com/problems/valid-palindrome,"Two Pointers, String"
MEDIUM,Spiral Matrix II,35.4,0.734312719680276,https://leetcode.com/problems/spiral-matrix-ii,"Array, Matrix, Simulation"
MEDIUM,Remove Duplicates from Sorted Array II,35.4,0.6290185479131098,https://leetcode.com/problems/remove-duplicates-from-sorted-array-ii,"Array, Two Pointers"
MEDIUM,Path Sum II,35.4,0.6049772910946117,https://leetcode.com/problems/path-sum-ii,"Backtracking, Tree, Depth-First Search, Binary Tree"
MEDIUM,Binary Tree Zigzag Level Order Traversal,35.4,0.6168283891746636,https://leetcode.com/problems/binary-tree-zigzag-level-order-traversal,"Tree, Breadth-First Search, Binary Tree"
MEDIUM,Insert Interval,35.4,0.43473628714178475,https://leetcode.com/problems/insert-interval,Array
MEDIUM,4Sum,29.3,0.38219020113793045,https://leetcode.com/problems/4sum,"Array, Two Pointers, Sorting"
MEDIUM,Linked List Cycle II,29.3,0.549336741044386,https://leetcode.com/problems/linked-list-cycle-ii,"Hash Table, Linked List, Two Pointers"
EASY,Plus One,29.3,0.47547621095134496,https://leetcode.com/problems/plus-one,"Array, Math"
MEDIUM,Swap Nodes in Pairs,29.3,0.6720136828647639,https://leetcode.com/problems/swap-nodes-in-pairs,"Linked List, Recursion"
EASY,Path Sum,29.3,0.5300477871490744,https://leetcode.com/problems/path-sum,"Tree, Depth-First Search, Breadth-First Search, Binary Tree"
HARD,Maximal Rectangle,29.3,0.5370845822665518,https://leetcode.com/problems/maximal-rectangle,"Array, Dynamic Programming, Stack, Matrix, Monotonic Stack"
MEDIUM,Valid Sudoku,29.3,0.6227675793740958,https://leetcode.com/problems/valid-sudoku,"Array, Hash Table, Matrix"
MEDIUM,Interleaving String,21.2,0.4217918033968859,https://leetcode.com/problems/interleaving-string,"String, Dynamic Programming"
MEDIUM,Clone Graph,21.2,0.623857131048197,https://leetcode.com/problems/clone-graph,"Hash Table, Depth-First Search, Breadth-First Search, Graph"
MEDIUM,Recover Binary Search Tree,21.2,0.5632431226781013,https://leetcode.com/problems/recover-binary-search-tree,"Tree, Depth-First Search, Binary Search Tree, Binary Tree"
MEDIUM,Subsets II,21.2,0.595072748658621,https://leetcode.com/problems/subsets-ii,"Array, Backtracking, Bit Manipulation"
HARD,Valid Number,21.2,0.21563512503115395,https://leetcode.com/problems/valid-number,String
MEDIUM,Unique Paths,21.2,0.6577286392782602,https://leetcode.com/problems/unique-paths,"Math, Dynamic Programming, Combinatorics"
MEDIUM,Divide Two Integers,21.2,0.18396975085033054,https://leetcode.com/problems/divide-two-integers,"Math, Bit Manipulation"
HARD,First Missing Positive,21.2,0.4108465766394882,https://leetcode.com/problems/first-missing-positive,"Array, Hash Table"
MEDIUM,Sum of Subarray Ranges,21.2,0.6013128650832208,https://leetcode.com/problems/sum-of-subarray-ranges,"Array, Stack, Monotonic Stack"
