Difficulty,Title,Frequency,Acceptance Rate,Link,Topics
MEDIUM,Longest Subsequence With Decreasing Adjacent Difference,100.0,0.14463217949421253,https://leetcode.com/problems/longest-subsequence-with-decreasing-adjacent-difference,"Array, Dynamic Programming"
MEDIUM,Operations on Tree,89.0,0.4326452615442767,https://leetcode.com/problems/operations-on-tree,"Array, Hash Table, Tree, Depth-First Search, Breadth-First Search, Design"
HARD,Largest Color Value in a Directed Graph,74.0,0.5774574708790748,https://leetcode.com/problems/largest-color-value-in-a-directed-graph,"Hash Table, Dynamic Programming, Graph, Topological Sort, Memoization, Counting"
HARD,Shortest Path in a Weighted Tree,74.0,0.31296361709643233,https://leetcode.com/problems/shortest-path-in-a-weighted-tree,"Array, Tree, Depth-First Search, Binary Indexed Tree, Segment Tree"
HARD,Sliding Window Maximum,74.0,0.4753694029904636,https://leetcode.com/problems/sliding-window-maximum,"Array, Queue, Sliding Window, Heap (Priority Queue), Monotonic Queue"
