Difficulty,Title,Frequency,Acceptance Rate,Link,Topics
MEDIUM,Operations on Tree,100.0,0.4326452615442767,https://leetcode.com/problems/operations-on-tree,"Array, Hash Table, Tree, Depth-First Search, Breadth-First Search, Design"
HARD,Longest Cycle in a Graph,97.7,0.49789456141325483,https://leetcode.com/problems/longest-cycle-in-a-graph,"Depth-First Search, Breadth-First Search, Graph, Topological Sort"
MEDIUM,Find Closest Node to Given Two Nodes,88.7,0.5286070998389476,https://leetcode.com/problems/find-closest-node-to-given-two-nodes,"Depth-First Search, Graph"
MEDIUM,Set Matrix Zeroes,73.4,0.6055656453287999,https://leetcode.com/problems/set-matrix-zeroes,"Array, Hash Table, Matrix"
MEDIUM,Node With Highest Edge Score,73.4,0.4840437185073392,https://leetcode.com/problems/node-with-highest-edge-score,"Hash Table, Graph"
MEDIUM,Longest Substring Without Repeating Characters,73.4,0.3682219752631985,https://leetcode.com/problems/longest-substring-without-repeating-characters,"Hash Table, String, Sliding Window"
