Difficulty,Title,Frequency,Acceptance Rate,Link,Topics
HARD,Reconstruct Itinerary,100.0,0.4352737764483397,https://leetcode.com/problems/reconstruct-itinerary,"Depth-First Search, Graph, Eulerian Circuit"
EASY,Logger Rate Limiter,80.6,0.7656113023923566,https://leetcode.com/problems/logger-rate-limiter,"Hash Table, Design, Data Stream"
MEDIUM,Merge Intervals,74.5,0.4919338109426709,https://leetcode.com/problems/merge-intervals,"Array, Sorting"
MEDIUM,Word Search,74.5,0.4502654638731183,https://leetcode.com/problems/word-search,"Array, String, Backtracking, Depth-First Search, Matrix"
MEDIUM,Koko Eating Bananas,74.5,0.49042457396173844,https://leetcode.com/problems/koko-eating-bananas,"Array, Binary Search"
MEDIUM,Network Delay Time,65.9,0.5699566005030693,https://leetcode.com/problems/network-delay-time,"Depth-First Search, Breadth-First Search, Graph, Heap (Priority Queue), Shortest Path"
MEDIUM,Longest Substring Without Repeating Characters,65.9,0.3671606918535354,https://leetcode.com/problems/longest-substring-without-repeating-characters,"Hash Table, String, Sliding Window"
MEDIUM,Cache With Time Limit,65.9,0.7570350273052976,https://leetcode.com/problems/cache-with-time-limit,
