Difficulty,Title,Frequency,Acceptance Rate,Link,Topics
MEDIUM,Longest Substring Without Repeating Characters,100.0,0.3694078272294453,https://leetcode.com/problems/longest-substring-without-repeating-characters,"Hash Table, String, Sliding Window"
EASY,Valid Parentheses,100.0,0.42328373530963165,https://leetcode.com/problems/valid-parentheses,"String, Stack"
EASY,Two Sum,100.0,0.5578040766755331,https://leetcode.com/problems/two-sum,"Array, Hash Table"
MEDIUM,Letter Combinations of a Phone Number,87.8,0.638613807305123,https://leetcode.com/problems/letter-combinations-of-a-phone-number,"Hash Table, String, Backtracking"
EASY,Best Time to Buy and Sell Stock,87.8,0.5526329321127535,https://leetcode.com/problems/best-time-to-buy-and-sell-stock,"Array, Dynamic Programming"
MEDIUM,Find Minimum in Rotated Sorted Array,87.8,0.5265208305595915,https://leetcode.com/problems/find-minimum-in-rotated-sorted-array,"Array, Binary Search"
EASY,Maximum Product of Three Numbers,87.8,0.453128811704281,https://leetcode.com/problems/maximum-product-of-three-numbers,"Array, Math, Sorting"
MEDIUM,LRU Cache,87.8,0.4522004147201063,https://leetcode.com/problems/lru-cache,"Hash Table, Linked List, Design, Doubly-Linked List"
MEDIUM,Word Search,87.8,0.4527182664451023,https://leetcode.com/problems/word-search,"Array, String, Backtracking, Depth-First Search, Matrix"
