Difficulty,Title,Frequency,Acceptance Rate,Link,Topics
HARD,Divide an Array Into Subarrays With Minimum Cost II,100.0,0.30406266219978295,https://leetcode.com/problems/divide-an-array-into-subarrays-with-minimum-cost-ii,"Array, Hash Table, Sliding Window, Heap (Priority Queue)"
MEDIUM,Find the Grid of Region Average,100.0,0.42241511165494033,https://leetcode.com/problems/find-the-grid-of-region-average,"Array, Matrix"
MEDIUM,Maximize the Number of Target Nodes After Connecting Trees I,100.0,0.6968516827213042,https://leetcode.com/problems/maximize-the-number-of-target-nodes-after-connecting-trees-i,"Tree, Depth-First Search, Breadth-First Search"
HARD,Maximize the Number of Target Nodes After Connecting Trees II,100.0,0.7315660916406779,https://leetcode.com/problems/maximize-the-number-of-target-nodes-after-connecting-trees-ii,"Tree, Depth-First Search, Breadth-First Search"
EASY,Two Sum,62.8,0.5577709609989225,https://leetcode.com/problems/two-sum,"Array, Hash Table"
HARD,Making A Large Island,62.8,0.5489021109141428,https://leetcode.com/problems/making-a-large-island,"Array, Depth-First Search, Breadth-First Search, Union Find, Matrix"
HARD,Trapping Rain Water,62.8,0.6510222145708986,https://leetcode.com/problems/trapping-rain-water,"Array, Two Pointers, Dynamic Programming, Stack, Monotonic Stack"
