Difficulty,Title,Frequency,Acceptance Rate,Link,Topics
MEDIUM,Partition Equal Subset Sum,100.0,0.4834598288590724,https://leetcode.com/problems/partition-equal-subset-sum,"Array, Dynamic Programming"
MEDIUM,LRU Cache,97.7,0.45077438845074186,https://leetcode.com/problems/lru-cache,"Hash Table, Linked List, Design, Doubly-Linked List"
HARD,Design Skiplist,95.1,0.5807907527672262,https://leetcode.com/problems/design-skiplist,"Linked List, Design"
EASY,Binary Gap,95.1,0.6459132210037137,https://leetcode.com/problems/binary-gap,Bit Manipulation
HARD,Minimum Window Subsequence,95.1,0.43590938710494875,https://leetcode.com/problems/minimum-window-subsequence,"String, Dynamic Programming, Sliding Window"
EASY,Alternating Digit Sum,95.1,0.6842420970547658,https://leetcode.com/problems/alternating-digit-sum,Math
EASY,Subtree of Another Tree,95.1,0.4988406463062075,https://leetcode.com/problems/subtree-of-another-tree,"Tree, Depth-First Search, String Matching, Binary Tree, Hash Function"
MEDIUM,Minimize Maximum Pair Sum in Array,95.1,0.8144200497100249,https://leetcode.com/problems/minimize-maximum-pair-sum-in-array,"Array, Two Pointers, Greedy, Sorting"
EASY,Remove One Element to Make the Array Strictly Increasing,95.1,0.2866908425530031,https://leetcode.com/problems/remove-one-element-to-make-the-array-strictly-increasing,Array
MEDIUM,Number of Islands,89.2,0.6219957032351369,https://leetcode.com/problems/number-of-islands,"Array, Depth-First Search, Breadth-First Search, Union Find, Matrix"
HARD,Word Ladder,81.5,0.42628353675862374,https://leetcode.com/problems/word-ladder,"Hash Table, String, Breadth-First Search"
EASY,Move Zeroes,81.5,0.6276419261952237,https://leetcode.com/problems/move-zeroes,"Array, Two Pointers"
MEDIUM,Course Schedule II,76.7,0.5327023691237658,https://leetcode.com/problems/course-schedule-ii,"Depth-First Search, Breadth-First Search, Graph, Topological Sort"
MEDIUM,Spiral Matrix,76.7,0.5375498381879744,https://leetcode.com/problems/spiral-matrix,"Array, Matrix, Simulation"
MEDIUM,Open the Lock,76.7,0.6070573545410402,https://leetcode.com/problems/open-the-lock,"Array, Hash Table, String, Breadth-First Search"
MEDIUM,Group Anagrams,76.7,0.7083632265069572,https://leetcode.com/problems/group-anagrams,"Array, Hash Table, String, Sorting"
MEDIUM,Binary Tree Zigzag Level Order Traversal,70.8,0.6154471061361281,https://leetcode.com/problems/binary-tree-zigzag-level-order-traversal,"Tree, Breadth-First Search, Binary Tree"
HARD,Word Search II,70.8,0.37263150931851624,https://leetcode.com/problems/word-search-ii,"Array, String, Backtracking, Trie, Matrix"
EASY,Valid Parentheses,70.8,0.4224528683049261,https://leetcode.com/problems/valid-parentheses,"String, Stack"
MEDIUM,Longest Substring Without Repeating Characters,70.8,0.3682189720961292,https://leetcode.com/problems/longest-substring-without-repeating-characters,"Hash Table, String, Sliding Window"
MEDIUM,Longest Continuous Subarray With Absolute Diff Less Than or Equal to Limit,70.8,0.5671393231222696,https://leetcode.com/problems/longest-continuous-subarray-with-absolute-diff-less-than-or-equal-to-limit,"Array, Queue, Sliding Window, Heap (Priority Queue), Ordered Set, Monotonic Queue"
HARD,Reconstruct Itinerary,70.8,0.4356684310598137,https://leetcode.com/problems/reconstruct-itinerary,"Depth-First Search, Graph, Eulerian Circuit"
MEDIUM,Course Schedule,70.8,0.4907903114825887,https://leetcode.com/problems/course-schedule,"Depth-First Search, Breadth-First Search, Graph, Topological Sort"
MEDIUM,Meeting Rooms II,70.8,0.5211676987864738,https://leetcode.com/problems/meeting-rooms-ii,"Array, Two Pointers, Greedy, Sorting, Heap (Priority Queue), Prefix Sum"
MEDIUM,Kth Largest Element in an Array,70.8,0.6790764701331873,https://leetcode.com/problems/kth-largest-element-in-an-array,"Array, Divide and Conquer, Sorting, Heap (Priority Queue), Quickselect"
MEDIUM,Longest ZigZag Path in a Binary Tree,63.2,0.665893123151833,https://leetcode.com/problems/longest-zigzag-path-in-a-binary-tree,"Dynamic Programming, Tree, Depth-First Search, Binary Tree"
MEDIUM,"Pow(x, n)",63.2,0.3694084859913344,https://leetcode.com/problems/powx-n,"Math, Recursion"
MEDIUM,Rotting Oranges,63.2,0.5647295322304309,https://leetcode.com/problems/rotting-oranges,"Array, Breadth-First Search, Matrix"
MEDIUM,Generate Parentheses,63.2,0.7702805360938413,https://leetcode.com/problems/generate-parentheses,"String, Dynamic Programming, Backtracking"
HARD,Concatenated Words,63.2,0.49417281415872866,https://leetcode.com/problems/concatenated-words,"Array, String, Dynamic Programming, Depth-First Search, Trie"
MEDIUM,Decode String,63.2,0.6107515207445541,https://leetcode.com/problems/decode-string,"String, Stack, Recursion"
MEDIUM,Best Time to Buy and Sell Stock II,63.2,0.6938085893418483,https://leetcode.com/problems/best-time-to-buy-and-sell-stock-ii,"Array, Dynamic Programming, Greedy"
MEDIUM,Binary Search Tree to Greater Sum Tree,63.2,0.8826050373029674,https://leetcode.com/problems/binary-search-tree-to-greater-sum-tree,"Tree, Depth-First Search, Binary Search Tree, Binary Tree"
MEDIUM,Search in Rotated Sorted Array,63.2,0.4273987063063059,https://leetcode.com/problems/search-in-rotated-sorted-array,"Array, Binary Search"
MEDIUM,Product of Array Except Self,52.5,0.6771208178317434,https://leetcode.com/problems/product-of-array-except-self,"Array, Prefix Sum"
MEDIUM,Find Peak Element,52.5,0.46491752653949336,https://leetcode.com/problems/find-peak-element,"Array, Binary Search"
MEDIUM,Set Matrix Zeroes,52.5,0.6055614020529563,https://leetcode.com/problems/set-matrix-zeroes,"Array, Hash Table, Matrix"
MEDIUM,Rank Teams by Votes,52.5,0.593354065883437,https://leetcode.com/problems/rank-teams-by-votes,"Array, Hash Table, String, Sorting, Counting"
EASY,Longest Common Prefix,52.5,0.4537244684540172,https://leetcode.com/problems/longest-common-prefix,"String, Trie"
MEDIUM,Time Based Key-Value Store,52.5,0.4933274040014599,https://leetcode.com/problems/time-based-key-value-store,"Hash Table, String, Binary Search, Design"
MEDIUM,Design a Stack With Increment Operation,52.5,0.8013282637931893,https://leetcode.com/problems/design-a-stack-with-increment-operation,"Array, Stack, Design"
EASY,Valid Palindrome II,52.5,0.4294448264788066,https://leetcode.com/problems/valid-palindrome-ii,"Two Pointers, String, Greedy"
HARD,Vertical Order Traversal of a Binary Tree,52.5,0.5111491293654955,https://leetcode.com/problems/vertical-order-traversal-of-a-binary-tree,"Hash Table, Tree, Depth-First Search, Breadth-First Search, Sorting, Binary Tree"
MEDIUM,Nearest Exit from Entrance in Maze,52.5,0.4751334958622609,https://leetcode.com/problems/nearest-exit-from-entrance-in-maze,"Array, Breadth-First Search, Matrix"
MEDIUM,Minimum Path Sum,52.5,0.6636076459230812,https://leetcode.com/problems/minimum-path-sum,"Array, Dynamic Programming, Matrix"
MEDIUM,3Sum,52.5,0.369561799499976,https://leetcode.com/problems/3sum,"Array, Two Pointers, Sorting"
EASY,Isomorphic Strings,52.5,0.4676877810932478,https://leetcode.com/problems/isomorphic-strings,"Hash Table, String"
HARD,Integer to English Words,52.5,0.3432813454381286,https://leetcode.com/problems/integer-to-english-words,"Math, String, Recursion"
MEDIUM,Matchsticks to Square,52.5,0.40879829484718194,https://leetcode.com/problems/matchsticks-to-square,"Array, Dynamic Programming, Backtracking, Bit Manipulation, Bitmask"
HARD,Binary Tree Cameras,52.5,0.4714700964182937,https://leetcode.com/problems/binary-tree-cameras,"Dynamic Programming, Tree, Depth-First Search, Binary Tree"
EASY,Two Sum,52.5,0.5568018735591839,https://leetcode.com/problems/two-sum,"Array, Hash Table"
MEDIUM,Koko Eating Bananas,52.5,0.4905270162885253,https://leetcode.com/problems/koko-eating-bananas,"Array, Binary Search"
MEDIUM,Word Break,52.5,0.4820216767727519,https://leetcode.com/problems/word-break,"Array, Hash Table, String, Dynamic Programming, Trie, Memoization"
HARD,Median of Two Sorted Arrays,52.5,0.4365013410156713,https://leetcode.com/problems/median-of-two-sorted-arrays,"Array, Binary Search, Divide and Conquer"
MEDIUM,Longest Palindromic Substring,52.5,0.35744268952792135,https://leetcode.com/problems/longest-palindromic-substring,"Two Pointers, String, Dynamic Programming"
MEDIUM,Integer to Roman,52.5,0.6848146544614877,https://leetcode.com/problems/integer-to-roman,"Hash Table, Math, String"
EASY,Roman to Integer,52.5,0.6475826631491383,https://leetcode.com/problems/roman-to-integer,"Hash Table, Math, String"
HARD,Merge k Sorted Lists,52.5,0.566078038181479,https://leetcode.com/problems/merge-k-sorted-lists,"Linked List, Divide and Conquer, Heap (Priority Queue), Merge Sort"
EASY,Find the Index of the First Occurrence in a String,52.5,0.4488838374492957,https://leetcode.com/problems/find-the-index-of-the-first-occurrence-in-a-string,"Two Pointers, String, String Matching"
HARD,Longest Valid Parentheses,52.5,0.36207868777141494,https://leetcode.com/problems/longest-valid-parentheses,"String, Dynamic Programming, Stack"
HARD,First Missing Positive,52.5,0.41007601526402837,https://leetcode.com/problems/first-missing-positive,"Array, Hash Table"
MEDIUM,Maximum Subarray,52.5,0.5203999633818343,https://leetcode.com/problems/maximum-subarray,"Array, Divide and Conquer, Dynamic Programming"
MEDIUM,Validate Binary Search Tree,52.5,0.3430335104427005,https://leetcode.com/problems/validate-binary-search-tree,"Tree, Depth-First Search, Binary Search Tree, Binary Tree"
EASY,Best Time to Buy and Sell Stock,52.5,0.5515726993209359,https://leetcode.com/problems/best-time-to-buy-and-sell-stock,"Array, Dynamic Programming"
MEDIUM,Copy List with Random Pointer,52.5,0.6034480624295939,https://leetcode.com/problems/copy-list-with-random-pointer,"Hash Table, Linked List"
MEDIUM,Find Minimum in Rotated Sorted Array,52.5,0.525528967254408,https://leetcode.com/problems/find-minimum-in-rotated-sorted-array,"Array, Binary Search"
MEDIUM,Reorganize String,52.5,0.5613776684633462,https://leetcode.com/problems/reorganize-string,"Hash Table, String, Greedy, Sorting, Heap (Priority Queue), Counting"
MEDIUM,Longest Substring with At Most Two Distinct Characters,52.5,0.5641462618993486,https://leetcode.com/problems/longest-substring-with-at-most-two-distinct-characters,"Hash Table, String, Sliding Window"
MEDIUM,Two Sum II - Input Array Is Sorted,52.5,0.633139313024097,https://leetcode.com/problems/two-sum-ii-input-array-is-sorted,"Array, Two Pointers, Binary Search"
EASY,Majority Element,52.5,0.6570103532094211,https://leetcode.com/problems/majority-element,"Array, Hash Table, Divide and Conquer, Sorting, Counting"
MEDIUM,Rotate Array,52.5,0.42910523615985385,https://leetcode.com/problems/rotate-array,"Array, Math, Two Pointers"
HARD,Shortest Palindrome,52.5,0.40589559299876915,https://leetcode.com/problems/shortest-palindrome,"String, Rolling Hash, String Matching, Hash Function"
MEDIUM,Maximal Square,52.5,0.4864961009595293,https://leetcode.com/problems/maximal-square,"Array, Dynamic Programming, Matrix"
MEDIUM,Permutations,52.5,0.8057438518021567,https://leetcode.com/problems/permutations,"Array, Backtracking"
EASY,Meeting Rooms,52.5,0.589321618995022,https://leetcode.com/problems/meeting-rooms,"Array, Sorting"
MEDIUM,Nested List Weight Sum,52.5,0.8550338509826821,https://leetcode.com/problems/nested-list-weight-sum,"Depth-First Search, Breadth-First Search"
MEDIUM,Top K Frequent Elements,52.5,0.644782806934155,https://leetcode.com/problems/top-k-frequent-elements,"Array, Hash Table, Divide and Conquer, Sorting, Heap (Priority Queue), Bucket Sort, Counting, Quickselect"
MEDIUM,Maximum Tastiness of Candy Basket,52.5,0.6600008897588754,https://leetcode.com/problems/maximum-tastiness-of-candy-basket,"Array, Binary Search, Greedy, Sorting"
EASY,Find Pivot Index,52.5,0.6045858284601912,https://leetcode.com/problems/find-pivot-index,"Array, Prefix Sum"
MEDIUM,Sort Colors,52.5,0.674536355540497,https://leetcode.com/problems/sort-colors,"Array, Two Pointers, Sorting"
