Difficulty,Title,Frequency,Acceptance Rate,Link,Topics
MEDIUM,Restore IP Addresses,100.0,0.531583393083398,https://leetcode.com/problems/restore-ip-addresses,"String, Backtracking"
MEDIUM,Longest Substring Without Repeating Characters,92.1,0.36936173184826904,https://leetcode.com/problems/longest-substring-without-repeating-characters,"Hash Table, String, Sliding Window"
HARD,Find Median from Data Stream,92.1,0.5327816407313548,https://leetcode.com/problems/find-median-from-data-stream,"Two Pointers, Design, Sorting, Heap (Priority Queue), Data Stream"
MEDIUM,LRU Cache,80.9,0.4521454893758596,https://leetcode.com/problems/lru-cache,"Hash Table, Linked List, Design, Doubly-Linked List"
MEDIUM,Number of Islands,80.9,0.6231992979713605,https://leetcode.com/problems/number-of-islands,"Array, Depth-First Search, Breadth-First Search, Union Find, Matrix"
MEDIUM,Koko Eating Bananas,80.9,0.49067279348014564,https://leetcode.com/problems/koko-eating-bananas,"Array, Binary Search"
MEDIUM,Permutation in String,80.9,0.47247849599514163,https://leetcode.com/problems/permutation-in-string,"Hash Table, Two Pointers, String, Sliding Window"
MEDIUM,Simplify Path,80.9,0.4785432317744196,https://leetcode.com/problems/simplify-path,"String, Stack"
