Difficulty,Title,Frequency,Acceptance Rate,Link,Topics
EASY,Number of 1 Bits,100.0,0.7360230194368903,https://leetcode.com/problems/number-of-1-bits,"Divide and Conquer, Bit Manipulation"
MEDIUM,Top K Frequent Words,83.2,0.5884877679481778,https://leetcode.com/problems/top-k-frequent-words,"Array, Hash Table, String, Trie, Sorting, Heap (Priority Queue), Bucket Sort, Counting"
HARD,Word Ladder,75.2,0.4165572201542577,https://leetcode.com/problems/word-ladder,"Hash Table, String, Breadth-First Search"
EASY,Kth Largest Element in a Stream,61.5,0.5962685453112394,https://leetcode.com/problems/kth-largest-element-in-a-stream,"Tree, Design, Binary Search Tree, Heap (Priority Queue), Binary Tree, Data Stream"
HARD,Word Ladder II,61.5,0.271125170691667,https://leetcode.com/problems/word-ladder-ii,"Hash Table, String, Backtracking, Breadth-First Search"
MEDIUM,Event Emitter,61.5,0.7414631978849614,https://leetcode.com/problems/event-emitter,
