Difficulty,Title,Frequency,Acceptance Rate,Link,Topics
MEDIUM,Subrectangle Queries,100.0,0.8595828252176626,https://leetcode.com/problems/subrectangle-queries,"Array, Design, Matrix"
HARD,Maximum Number of Visible Points,95.1,0.3767605072174815,https://leetcode.com/problems/maximum-number-of-visible-points,"Array, Math, Geometry, Sliding Window, Sorting"
HARD,Shortest Path in a Grid with Obstacles Elimination,73.6,0.45606251689037025,https://leetcode.com/problems/shortest-path-in-a-grid-with-obstacles-elimination,"Array, Breadth-First Search, Matrix"
MEDIUM,Evaluate Division,73.6,0.6314713208125032,https://leetcode.com/problems/evaluate-division,"Array, String, Depth-First Search, Breadth-First Search, Union Find, Graph, Shortest Path"
MEDIUM,Interleaving String,64.8,0.4217918336772443,https://leetcode.com/problems/interleaving-string,"String, Dynamic Programming"
EASY,Moving Average from Data Stream,64.8,0.7993788060358533,https://leetcode.com/problems/moving-average-from-data-stream,"Array, Design, Queue, Data Stream"
MEDIUM,Interval List Intersections,64.8,0.7267722226057262,https://leetcode.com/problems/interval-list-intersections,"Array, Two Pointers, Line Sweep"
MEDIUM,Line Reflection,64.8,0.3601319248289713,https://leetcode.com/problems/line-reflection,"Array, Hash Table, Math"
HARD,Sliding Window Maximum,64.8,0.47604117337050583,https://leetcode.com/problems/sliding-window-maximum,"Array, Queue, Sliding Window, Heap (Priority Queue), Monotonic Queue"
