Difficulty,Title,Frequency,Acceptance Rate,Link,Topics
HARD,Minimum Cost to Make Array Equal,100.0,0.4618022344114987,https://leetcode.com/problems/minimum-cost-to-make-array-equal,"Array, Binary Search, Greedy, Sorting, Prefix Sum"
MEDIUM,Next Permutation,100.0,0.4258681280335456,https://leetcode.com/problems/next-permutation,"Array, Two Pointers"
HARD,Chalkboard XOR Game,100.0,0.6237033195020747,https://leetcode.com/problems/chalkboard-xor-game,"Array, Math, Bit Manipulation, Brainteaser, Game Theory"
MEDIUM,Jump Game II,100.0,0.41244774905478976,https://leetcode.com/problems/jump-game-ii,"Array, Dynamic Programming, Greedy"
MEDIUM,Jump Game,100.0,0.3921421652504637,https://leetcode.com/problems/jump-game,"Array, Dynamic Programming, Greedy"
MEDIUM,Beautiful Arrangement,100.0,0.6446624681032275,https://leetcode.com/problems/beautiful-arrangement,"Array, Dynamic Programming, Backtracking, Bit Manipulation, Bitmask"
MEDIUM,Number of Islands,100.0,0.6186222260163989,https://leetcode.com/problems/number-of-islands,"Array, Depth-First Search, Breadth-First Search, Union Find, Matrix"
MEDIUM,Edit Distance,100.0,0.5838365181726686,https://leetcode.com/problems/edit-distance,"String, Dynamic Programming"
EASY,Isomorphic Strings,100.0,0.4656393244905932,https://leetcode.com/problems/isomorphic-strings,"Hash Table, String"
