Difficulty,Title,Frequency,Acceptance Rate,Link,Topics
EASY,Find Candidates for Data Scientist Position,100.0,0.7589920747815485,https://leetcode.com/problems/find-candidates-for-data-scientist-position,Database
HARD,Maximize Items,100.0,0.7473269555430501,https://leetcode.com/problems/maximize-items,Database
HARD,Count the Number of Powerful Integers,84.4,0.26913752913752914,https://leetcode.com/problems/count-the-number-of-powerful-integers,"Math, String, Dynamic Programming"
MEDIUM,Minimize Length of Array Using Operations,84.4,0.34831154684095866,https://leetcode.com/problems/minimize-length-of-array-using-operations,"Array, Math, Greedy, Number Theory"
EASY,Best Time to Buy and Sell Stock,63.8,0.5482909252271032,https://leetcode.com/problems/best-time-to-buy-and-sell-stock,"Array, Dynamic Programming"
MEDIUM,3Sum,63.8,0.3653148598106882,https://leetcode.com/problems/3sum,"Array, Two Pointers, Sorting"
MEDIUM,Maximum Subarray,63.8,0.5179055810155253,https://leetcode.com/problems/maximum-subarray,"Array, Divide and Conquer, Dynamic Programming"
MEDIUM,Maximum Points Inside the Square,63.8,0.39020845444730506,https://leetcode.com/problems/maximum-points-inside-the-square,"Array, Hash Table, String, Binary Search, Sorting"
