Difficulty,Title,Frequency,Acceptance Rate,Link,Topics
MEDIUM,Integer to Roman,100.0,0.6809761249504931,https://leetcode.com/problems/integer-to-roman,"Hash Table, Math, String"
MEDIUM,Number of Islands,100.0,0.6186226537920065,https://leetcode.com/problems/number-of-islands,"Array, Depth-First Search, Breadth-First Search, Union Find, Matrix"
MEDIUM,Longest Substring Without Repeating Characters,100.0,0.36544104772821845,https://leetcode.com/problems/longest-substring-without-repeating-characters,"Hash Table, String, Sliding Window"
EASY,Merge Two Sorted Lists,100.0,0.6648989880919467,https://leetcode.com/problems/merge-two-sorted-lists,"Linked List, Recursion"
MEDIUM,Reverse Words in a String,100.0,0.5080508207212973,https://leetcode.com/problems/reverse-words-in-a-string,"Two Pointers, String"
