Difficulty,Title,Frequency,Acceptance Rate,Link,Topics
EASY,Isomorphic Strings,100.0,0.46768746650195864,https://leetcode.com/problems/isomorphic-strings,"Hash Table, String"
MEDIUM,Find K Closest Elements,100.0,0.4860279727022647,https://leetcode.com/problems/find-k-closest-elements,"Array, Two Pointers, Binary Search, Sliding Window, Sorting, Heap (Priority Queue)"
MEDIUM,Longest Subarray of 1's After Deleting One Element,92.2,0.6916259786314479,https://leetcode.com/problems/longest-subarray-of-1s-after-deleting-one-element,"Array, Dynamic Programming, Sliding Window"
MEDIUM,Interval List Intersections,81.3,0.7263803541741138,https://leetcode.com/problems/interval-list-intersections,"Array, Two Pointers, Line Sweep"
MEDIUM,Longest Substring Without Repeating Characters,81.3,0.3682188345379063,https://leetcode.com/problems/longest-substring-without-repeating-characters,"Hash Table, String, Sliding Window"
MEDIUM,Search in Rotated Sorted Array,81.3,0.4273987737169086,https://leetcode.com/problems/search-in-rotated-sorted-array,"Array, Binary Search"
MEDIUM,Maximize Distance to Closest Person,81.3,0.489201006263359,https://leetcode.com/problems/maximize-distance-to-closest-person,Array
MEDIUM,Subarray Sum Equals K,81.3,0.45382458985593827,https://leetcode.com/problems/subarray-sum-equals-k,"Array, Hash Table, Prefix Sum"
