Difficulty,Title,Frequency,Acceptance Rate,Link,Topics
MEDIUM,Longest Subarray of 1's After Deleting One Element,100.0,0.690962976683878,https://leetcode.com/problems/longest-subarray-of-1s-after-deleting-one-element,"Array, Dynamic Programming, Sliding Window"
EASY,Summary Ranges,93.9,0.5289227347952007,https://leetcode.com/problems/summary-ranges,Array
MEDIUM,String Compression,89.0,0.5782708131779474,https://leetcode.com/problems/string-compression,"Two Pointers, String"
EASY,Move Zeroes,82.2,0.6272146778478701,https://leetcode.com/problems/move-zeroes,"Array, Two Pointers"
EASY,Isomorphic Strings,82.2,0.466840687844123,https://leetcode.com/problems/isomorphic-strings,"Hash Table, String"
EASY,Valid Palindrome,82.2,0.5066481030027615,https://leetcode.com/problems/valid-palindrome,"Two Pointers, String"
MEDIUM,Subarray Sum Equals K,81.0,0.4528272627833325,https://leetcode.com/problems/subarray-sum-equals-k,"Array, Hash Table, Prefix Sum"
MEDIUM,Insert Delete GetRandom O(1),81.0,0.5492715094227012,https://leetcode.com/problems/insert-delete-getrandom-o1,"Array, Hash Table, Math, Design, Randomized"
MEDIUM,Permutation in String,80.5,0.4707479159273028,https://leetcode.com/problems/permutation-in-string,"Hash Table, Two Pointers, String, Sliding Window"
MEDIUM,Line Reflection,80.1,0.35946323046618517,https://leetcode.com/problems/line-reflection,"Array, Hash Table, Math"
MEDIUM,Longest Substring Without Repeating Characters,79.6,0.36716074859064046,https://leetcode.com/problems/longest-substring-without-repeating-characters,"Hash Table, String, Sliding Window"
MEDIUM,Merge Intervals,77.2,0.49193395729044537,https://leetcode.com/problems/merge-intervals,"Array, Sorting"
MEDIUM,Group Anagrams,76.2,0.7072404124842196,https://leetcode.com/problems/group-anagrams,"Array, Hash Table, String, Sorting"
EASY,Two Sum,75.1,0.5554649303009406,https://leetcode.com/problems/two-sum,"Array, Hash Table"
EASY,Valid Parentheses,73.9,0.4215998409168728,https://leetcode.com/problems/valid-parentheses,"String, Stack"
MEDIUM,One Edit Distance,72.0,0.3446337828650009,https://leetcode.com/problems/one-edit-distance,"Two Pointers, String"
MEDIUM,Number of Islands,71.3,0.620690295751795,https://leetcode.com/problems/number-of-islands,"Array, Depth-First Search, Breadth-First Search, Union Find, Matrix"
MEDIUM,Min Stack,67.4,0.5623417556655379,https://leetcode.com/problems/min-stack,"Stack, Design"
HARD,Trapping Rain Water,66.5,0.6481180096586395,https://leetcode.com/problems/trapping-rain-water,"Array, Two Pointers, Dynamic Programming, Stack, Monotonic Stack"
MEDIUM,Interval List Intersections,66.5,0.7260203540912984,https://leetcode.com/problems/interval-list-intersections,"Array, Two Pointers, Line Sweep"
MEDIUM,Longest Palindromic Substring,66.5,0.35648435052537975,https://leetcode.com/problems/longest-palindromic-substring,"Two Pointers, String, Dynamic Programming"
EASY,Merge Sorted Array,64.6,0.5267881090239817,https://leetcode.com/problems/merge-sorted-array,"Array, Two Pointers, Sorting"
MEDIUM,Find All Anagrams in a String,63.6,0.5206880659692115,https://leetcode.com/problems/find-all-anagrams-in-a-string,"Hash Table, String, Sliding Window"
MEDIUM,Generate Parentheses,63.6,0.7691556728057908,https://leetcode.com/problems/generate-parentheses,"String, Dynamic Programming, Backtracking"
MEDIUM,Design Hit Counter,61.4,0.6913357445346242,https://leetcode.com/problems/design-hit-counter,"Array, Binary Search, Design, Queue, Data Stream"
MEDIUM,Design an ATM Machine,61.4,0.41991707616707624,https://leetcode.com/problems/design-an-atm-machine,"Array, Greedy, Design"
MEDIUM,Evaluate Reverse Polish Notation,60.2,0.5462996526807458,https://leetcode.com/problems/evaluate-reverse-polish-notation,"Array, Math, Stack"
EASY,Best Time to Buy and Sell Stock,58.9,0.5506574969399601,https://leetcode.com/problems/best-time-to-buy-and-sell-stock,"Array, Dynamic Programming"
MEDIUM,LRU Cache,57.5,0.4493677320922184,https://leetcode.com/problems/lru-cache,"Hash Table, Linked List, Design, Doubly-Linked List"
MEDIUM,Validate Binary Search Tree,57.5,0.3423932619486754,https://leetcode.com/problems/validate-binary-search-tree,"Tree, Depth-First Search, Binary Search Tree, Binary Tree"
EASY,Merge Two Sorted Lists,55.9,0.6665306714746552,https://leetcode.com/problems/merge-two-sorted-lists,"Linked List, Recursion"
MEDIUM,Longest Substring with At Most K Distinct Characters,55.9,0.49425072745226684,https://leetcode.com/problems/longest-substring-with-at-most-k-distinct-characters,"Hash Table, String, Sliding Window"
HARD,Minimum Window Substring,55.9,0.45098523640323407,https://leetcode.com/problems/minimum-window-substring,"Hash Table, String, Sliding Window"
EASY,Destination City,55.9,0.7943119914358188,https://leetcode.com/problems/destination-city,"Array, Hash Table, String"
EASY,Symmetric Tree,52.5,0.5904355322530244,https://leetcode.com/problems/symmetric-tree,"Tree, Depth-First Search, Breadth-First Search, Binary Tree"
MEDIUM,Lowest Common Ancestor of a Binary Tree,52.5,0.6636592912300773,https://leetcode.com/problems/lowest-common-ancestor-of-a-binary-tree,"Tree, Depth-First Search, Binary Tree"
MEDIUM,Simplify Path,52.5,0.47441914739134944,https://leetcode.com/problems/simplify-path,"String, Stack"
HARD,Reconstruct Itinerary,52.5,0.4352737764483397,https://leetcode.com/problems/reconstruct-itinerary,"Depth-First Search, Graph, Eulerian Circuit"
EASY,Is Subsequence,52.5,0.4831711469166148,https://leetcode.com/problems/is-subsequence,"Two Pointers, String, Dynamic Programming"
HARD,Candy,52.5,0.4466005697238156,https://leetcode.com/problems/candy,"Array, Greedy"
HARD,Binary Tree Maximum Path Sum,52.5,0.41118335747652274,https://leetcode.com/problems/binary-tree-maximum-path-sum,"Dynamic Programming, Tree, Depth-First Search, Binary Tree"
MEDIUM,Binary Tree Right Side View,52.5,0.665725518386552,https://leetcode.com/problems/binary-tree-right-side-view,"Tree, Depth-First Search, Breadth-First Search, Binary Tree"
MEDIUM,Max Consecutive Ones III,50.5,0.6569326422338854,https://leetcode.com/problems/max-consecutive-ones-iii,"Array, Binary Search, Sliding Window, Prefix Sum"
HARD,Median of Two Sorted Arrays,50.5,0.43488102026024855,https://leetcode.com/problems/median-of-two-sorted-arrays,"Array, Binary Search, Divide and Conquer"
HARD,Merge k Sorted Lists,50.5,0.5644302544370446,https://leetcode.com/problems/merge-k-sorted-lists,"Linked List, Divide and Conquer, Heap (Priority Queue), Merge Sort"
EASY,Intersection of Two Arrays II,50.5,0.5899547876597808,https://leetcode.com/problems/intersection-of-two-arrays-ii,"Array, Hash Table, Two Pointers, Binary Search, Sorting"
MEDIUM,Container With Most Water,48.3,0.5757713152259405,https://leetcode.com/problems/container-with-most-water,"Array, Two Pointers, Greedy"
MEDIUM,Perfect Squares,45.8,0.5558374760670688,https://leetcode.com/problems/perfect-squares,"Math, Dynamic Programming, Breadth-First Search"
EASY,Max Consecutive Ones,42.9,0.6219352142078589,https://leetcode.com/problems/max-consecutive-ones,Array
MEDIUM,Continuous Subarray Sum,42.9,0.3085082880997895,https://leetcode.com/problems/continuous-subarray-sum,"Array, Hash Table, Math, Prefix Sum"
MEDIUM,Product of Array Except Self,42.9,0.6762128551926664,https://leetcode.com/problems/product-of-array-except-self,"Array, Prefix Sum"
MEDIUM,Longest Increasing Subsequence,42.9,0.5755249092644729,https://leetcode.com/problems/longest-increasing-subsequence,"Array, Binary Search, Dynamic Programming"
MEDIUM,Longest Substring with At Least K Repeating Characters,42.9,0.45407587918821063,https://leetcode.com/problems/longest-substring-with-at-least-k-repeating-characters,"Hash Table, String, Divide and Conquer, Sliding Window"
EASY,Single Number,42.9,0.75734346501012,https://leetcode.com/problems/single-number,"Array, Bit Manipulation"
MEDIUM,Add Two Numbers,42.9,0.4594135295651193,https://leetcode.com/problems/add-two-numbers,"Linked List, Math, Recursion"
MEDIUM,Max Consecutive Ones II,42.9,0.5147323531898957,https://leetcode.com/problems/max-consecutive-ones-ii,"Array, Dynamic Programming, Sliding Window"
EASY,Remove Element,42.9,0.598371922111323,https://leetcode.com/problems/remove-element,"Array, Two Pointers"
MEDIUM,Longest Repeating Character Replacement,39.5,0.5689675913673219,https://leetcode.com/problems/longest-repeating-character-replacement,"Hash Table, String, Sliding Window"
EASY,Palindrome Number,39.5,0.5903904656260114,https://leetcode.com/problems/palindrome-number,Math
MEDIUM,Two Sum II - Input Array Is Sorted,39.5,0.6320892065932132,https://leetcode.com/problems/two-sum-ii-input-array-is-sorted,"Array, Two Pointers, Binary Search"
EASY,Intersection of Two Arrays,39.5,0.7630315319076998,https://leetcode.com/problems/intersection-of-two-arrays,"Array, Hash Table, Two Pointers, Binary Search, Sorting"
EASY,Palindrome Linked List,39.5,0.5558974088551722,https://leetcode.com/problems/palindrome-linked-list,"Linked List, Two Pointers, Stack, Recursion"
EASY,Reverse Linked List,39.5,0.7900447980593179,https://leetcode.com/problems/reverse-linked-list,"Linked List, Recursion"
MEDIUM,Search in Rotated Sorted Array,39.5,0.4264862810766544,https://leetcode.com/problems/search-in-rotated-sorted-array,"Array, Binary Search"
MEDIUM,Top K Frequent Elements,39.5,0.6438791376872239,https://leetcode.com/problems/top-k-frequent-elements,"Array, Hash Table, Divide and Conquer, Sorting, Heap (Priority Queue), Bucket Sort, Counting, Quickselect"
EASY,Find the Difference of Two Arrays,35.3,0.8072052925545001,https://leetcode.com/problems/find-the-difference-of-two-arrays,"Array, Hash Table"
EASY,First Unique Character in a String,35.3,0.6352007733691782,https://leetcode.com/problems/first-unique-character-in-a-string,"Hash Table, String, Queue, Counting"
MEDIUM,Meeting Rooms II,35.3,0.5207959142627572,https://leetcode.com/problems/meeting-rooms-ii,"Array, Two Pointers, Greedy, Sorting, Heap (Priority Queue), Prefix Sum"
MEDIUM,Best Time to Buy and Sell Stock II,35.3,0.6926504574534599,https://leetcode.com/problems/best-time-to-buy-and-sell-stock-ii,"Array, Dynamic Programming, Greedy"
MEDIUM,Lowest Common Ancestor of a Binary Search Tree,35.3,0.6798323239703081,https://leetcode.com/problems/lowest-common-ancestor-of-a-binary-search-tree,"Tree, Depth-First Search, Binary Search Tree, Binary Tree"
MEDIUM,Binary Tree Zigzag Level Order Traversal,35.3,0.6142369370817229,https://leetcode.com/problems/binary-tree-zigzag-level-order-traversal,"Tree, Breadth-First Search, Binary Tree"
MEDIUM,Find Minimum in Rotated Sorted Array,35.3,0.5245999614166506,https://leetcode.com/problems/find-minimum-in-rotated-sorted-array,"Array, Binary Search"
MEDIUM,Reverse Integer,35.3,0.30138578125707405,https://leetcode.com/problems/reverse-integer,Math
EASY,Valid Anagram,35.3,0.6647077970398308,https://leetcode.com/problems/valid-anagram,"Hash Table, String, Sorting"
EASY,Balanced Binary Tree,35.3,0.5506061703485264,https://leetcode.com/problems/balanced-binary-tree,"Tree, Depth-First Search, Binary Tree"
MEDIUM,Search a 2D Matrix,30.1,0.5208697518040919,https://leetcode.com/problems/search-a-2d-matrix,"Array, Binary Search, Matrix"
MEDIUM,Remove Duplicates from Sorted Array II,30.1,0.6269550092773862,https://leetcode.com/problems/remove-duplicates-from-sorted-array-ii,"Array, Two Pointers"
MEDIUM,Sort the Matrix Diagonally,30.1,0.8296215824732935,https://leetcode.com/problems/sort-the-matrix-diagonally,"Array, Sorting, Matrix"
MEDIUM,Flatten Nested List Iterator,30.1,0.6517017712958427,https://leetcode.com/problems/flatten-nested-list-iterator,"Stack, Tree, Depth-First Search, Design, Queue, Iterator"
MEDIUM,Kth Largest Element in an Array,30.1,0.6783375001543408,https://leetcode.com/problems/kth-largest-element-in-an-array,"Array, Divide and Conquer, Sorting, Heap (Priority Queue), Quickselect"
EASY,Contains Duplicate,30.1,0.6307842452050011,https://leetcode.com/problems/contains-duplicate,"Array, Hash Table, Sorting"
EASY,Reverse Words in a String III,22.9,0.8361843624096097,https://leetcode.com/problems/reverse-words-in-a-string-iii,"Two Pointers, String"
MEDIUM,Non-overlapping Intervals,22.9,0.5528515482063205,https://leetcode.com/problems/non-overlapping-intervals,"Array, Dynamic Programming, Greedy, Sorting"
EASY,Sum of Left Leaves,22.9,0.6155084438481035,https://leetcode.com/problems/sum-of-left-leaves,"Tree, Depth-First Search, Breadth-First Search, Binary Tree"
MEDIUM,Rotate Image,22.9,0.7762107428917453,https://leetcode.com/problems/rotate-image,"Array, Math, Matrix"
MEDIUM,3Sum,22.9,0.36840325168092475,https://leetcode.com/problems/3sum,"Array, Two Pointers, Sorting"
EASY,Reverse String,22.9,0.7965199486707071,https://leetcode.com/problems/reverse-string,"Two Pointers, String"
HARD,Palindrome Pairs,22.9,0.3615058818958064,https://leetcode.com/problems/palindrome-pairs,"Array, Hash Table, String, Trie"
HARD,Sliding Window Maximum,22.9,0.4746533337913403,https://leetcode.com/problems/sliding-window-maximum,"Array, Queue, Sliding Window, Heap (Priority Queue), Monotonic Queue"
HARD,Contains Duplicate III,22.9,0.2354891146296486,https://leetcode.com/problems/contains-duplicate-iii,"Array, Sliding Window, Sorting, Bucket Sort, Ordered Set"
MEDIUM,Minimum Size Subarray Sum,22.9,0.4915213492695919,https://leetcode.com/problems/minimum-size-subarray-sum,"Array, Binary Search, Sliding Window, Prefix Sum"
EASY,Majority Element,22.9,0.6565330323472671,https://leetcode.com/problems/majority-element,"Array, Hash Table, Divide and Conquer, Sorting, Counting"
MEDIUM,Reverse Words in a String,22.9,0.5128454178686641,https://leetcode.com/problems/reverse-words-in-a-string,"Two Pointers, String"
EASY,Linked List Cycle,22.9,0.5235418766522013,https://leetcode.com/problems/linked-list-cycle,"Hash Table, Linked List, Two Pointers"
MEDIUM,Longest Consecutive Sequence,22.9,0.47071150217598257,https://leetcode.com/problems/longest-consecutive-sequence,"Array, Hash Table, Union Find"
EASY,Find the Index of the First Occurrence in a String,22.9,0.44792997024749887,https://leetcode.com/problems/find-the-index-of-the-first-occurrence-in-a-string,"Two Pointers, String, String Matching"
EASY,Maximum Depth of Binary Tree,22.9,0.770014552056497,https://leetcode.com/problems/maximum-depth-of-binary-tree,"Tree, Depth-First Search, Breadth-First Search, Binary Tree"
HARD,Maximal Rectangle,22.9,0.5335164419851868,https://leetcode.com/problems/maximal-rectangle,"Array, Dynamic Programming, Stack, Matrix, Monotonic Stack"
EASY,Climbing Stairs,22.9,0.5347679410296842,https://leetcode.com/problems/climbing-stairs,"Math, Dynamic Programming, Memoization"
EASY,Path Crossing,22.9,0.6251661528157076,https://leetcode.com/problems/path-crossing,"Hash Table, String"
