Difficulty,Title,Frequency,Acceptance Rate,Link,Topics
MEDIUM,3Sum,100.0,0.3666560221110672,https://leetcode.com/problems/3sum,"Array, Two Pointers, Sorting"
HARD,Reaching Points,100.0,0.33544240778456663,https://leetcode.com/problems/reaching-points,Math
HARD,Serialize and Deserialize Binary Tree,100.0,0.5854462381861556,https://leetcode.com/problems/serialize-and-deserialize-binary-tree,"String, Tree, Depth-First Search, Breadth-First Search, Design, Binary Tree"
MEDIUM,Merge Intervals,100.0,0.49027678771364497,https://leetcode.com/problems/merge-intervals,"Array, Sorting"
EASY,Convert Binary Number in a Linked List to Integer,100.0,0.8115260470607417,https://leetcode.com/problems/convert-binary-number-in-a-linked-list-to-integer,"Linked List, Math"
MEDIUM,LRU Cache,100.0,0.44718119615294166,https://leetcode.com/problems/lru-cache,"Hash Table, Linked List, Design, Doubly-Linked List"
MEDIUM,Course Schedule II,100.0,0.5291144580382845,https://leetcode.com/problems/course-schedule-ii,"Depth-First Search, Breadth-First Search, Graph, Topological Sort"
