Difficulty,Title,Frequency,Acceptance Rate,Link,Topics
HARD,Palindrome Pairs,100.0,0.3609388386115098,https://leetcode.com/problems/palindrome-pairs,"Array, Hash Table, String, Trie"
MEDIUM,Combination Sum,98.8,0.7418793478963139,https://leetcode.com/problems/combination-sum,"Array, Backtracking"
HARD,Maximum Profit in Job Scheduling,93.5,0.5433655468630157,https://leetcode.com/problems/maximum-profit-in-job-scheduling,"Array, Binary Search, Dynamic Programming, Sorting"
HARD,Minimum Window Substring,86.5,0.4490218720553853,https://leetcode.com/problems/minimum-window-substring,"Hash Table, String, Sliding Window"
MEDIUM,Flatten 2D Vector,86.5,0.5004768081258335,https://leetcode.com/problems/flatten-2d-vector,"Array, Two Pointers, Design, Iterator"
HARD,Shortest Path to Get All Keys,86.5,0.536204639942514,https://leetcode.com/problems/shortest-path-to-get-all-keys,"Array, Bit Manipulation, Breadth-First Search, Matrix"
HARD,Text Justification,82.0,0.4749298494130809,https://leetcode.com/problems/text-justification,"Array, String, Simulation"
HARD,Sliding Puzzle,79.4,0.7303144633250366,https://leetcode.com/problems/sliding-puzzle,"Array, Dynamic Programming, Backtracking, Breadth-First Search, Memoization, Matrix"
HARD,Alien Dictionary,79.4,0.3652811444333015,https://leetcode.com/problems/alien-dictionary,"Array, String, Depth-First Search, Breadth-First Search, Graph, Topological Sort"
HARD,Trapping Rain Water,79.4,0.6456472084407545,https://leetcode.com/problems/trapping-rain-water,"Array, Two Pointers, Dynamic Programming, Stack, Monotonic Stack"
MEDIUM,Cheapest Flights Within K Stops,79.4,0.40164606236899514,https://leetcode.com/problems/cheapest-flights-within-k-stops,"Dynamic Programming, Depth-First Search, Breadth-First Search, Graph, Heap (Priority Queue), Shortest Path"
MEDIUM,Pour Water,76.4,0.47696899957845806,https://leetcode.com/problems/pour-water,"Array, Simulation"
MEDIUM,Smallest Common Region,72.9,0.6787855619492175,https://leetcode.com/problems/smallest-common-region,"Array, Hash Table, String, Tree, Depth-First Search, Breadth-First Search"
MEDIUM,Simple Bank System,63.8,0.6336026596541905,https://leetcode.com/problems/simple-bank-system,"Array, Hash Table, Design, Simulation"
HARD,Employee Free Time,63.8,0.7254861912796376,https://leetcode.com/problems/employee-free-time,"Array, Sorting, Heap (Priority Queue)"
EASY,Two Sum,57.3,0.5533848278960284,https://leetcode.com/problems/two-sum,"Array, Hash Table"
MEDIUM,Basic Calculator II,57.3,0.45454252982814003,https://leetcode.com/problems/basic-calculator-ii,"Math, String, Stack"
HARD,All O`one Data Structure,57.3,0.4475357261975011,https://leetcode.com/problems/all-oone-data-structure,"Hash Table, Linked List, Design, Doubly-Linked List"
MEDIUM,IP to CIDR,57.3,0.5534149585354404,https://leetcode.com/problems/ip-to-cidr,"String, Bit Manipulation"
MEDIUM,Add Two Numbers,57.3,0.4571985778403671,https://leetcode.com/problems/add-two-numbers,"Linked List, Math, Recursion"
HARD,Word Search II,57.3,0.3711769950207776,https://leetcode.com/problems/word-search-ii,"Array, String, Backtracking, Trie, Matrix"
MEDIUM,Design Tic-Tac-Toe,57.3,0.5850248686529532,https://leetcode.com/problems/design-tic-tac-toe,"Array, Hash Table, Design, Matrix, Simulation"
MEDIUM,Minimum Number of Vertices to Reach All Nodes,48.3,0.8107031492986052,https://leetcode.com/problems/minimum-number-of-vertices-to-reach-all-nodes,Graph
MEDIUM,Pyramid Transition Matrix,48.3,0.5282683486238532,https://leetcode.com/problems/pyramid-transition-matrix,"Bit Manipulation, Depth-First Search, Breadth-First Search"
MEDIUM,Time Based Key-Value Store,48.3,0.4939619344458508,https://leetcode.com/problems/time-based-key-value-store,"Hash Table, String, Binary Search, Design"
MEDIUM,Number of Ways to Build House of Cards,48.3,0.6192669737632686,https://leetcode.com/problems/number-of-ways-to-build-house-of-cards,"Math, Dynamic Programming"
EASY,Happy Number,48.3,0.5773587160222954,https://leetcode.com/problems/happy-number,"Hash Table, Math, Two Pointers"
MEDIUM,Design File System,48.3,0.6389633995694067,https://leetcode.com/problems/design-file-system,"Hash Table, String, Design, Trie"
MEDIUM,Fraction to Recurring Decimal,48.3,0.2600685141852075,https://leetcode.com/problems/fraction-to-recurring-decimal,"Hash Table, Math, String"
MEDIUM,Robot Bounded In Circle,48.3,0.5616571612195245,https://leetcode.com/problems/robot-bounded-in-circle,"Math, String, Simulation"
MEDIUM,Maximal Square,48.3,0.4841208295050091,https://leetcode.com/problems/maximal-square,"Array, Dynamic Programming, Matrix"
HARD,Contains Duplicate III,48.3,0.23486881619061376,https://leetcode.com/problems/contains-duplicate-iii,"Array, Sliding Window, Sorting, Bucket Sort, Ordered Set"
EASY,Contains Duplicate II,48.3,0.4848110475707878,https://leetcode.com/problems/contains-duplicate-ii,"Array, Hash Table, Sliding Window"
EASY,Contains Duplicate,48.3,0.6295529971142738,https://leetcode.com/problems/contains-duplicate,"Array, Hash Table, Sorting"
EASY,Convert Sorted Array to Binary Search Tree,48.3,0.7375161434144338,https://leetcode.com/problems/convert-sorted-array-to-binary-search-tree,"Array, Divide and Conquer, Tree, Binary Search Tree, Binary Tree"
HARD,Maximum Candies You Can Get from Boxes,48.3,0.574965460071843,https://leetcode.com/problems/maximum-candies-you-can-get-from-boxes,"Array, Breadth-First Search, Graph"
MEDIUM,House Robber,48.3,0.5209523797149328,https://leetcode.com/problems/house-robber,"Array, Dynamic Programming"
HARD,Regular Expression Matching,48.3,0.29066289084866764,https://leetcode.com/problems/regular-expression-matching,"String, Dynamic Programming, Recursion"
MEDIUM,Coin Change,48.3,0.4604636257595647,https://leetcode.com/problems/coin-change,"Array, Dynamic Programming, Breadth-First Search"
MEDIUM,Merge Intervals,48.3,0.4902752878802541,https://leetcode.com/problems/merge-intervals,"Array, Sorting"
MEDIUM,Shortest Uncommon Substring in an Array,48.3,0.473576472996486,https://leetcode.com/problems/shortest-uncommon-substring-in-an-array,"Array, Hash Table, String, Trie"
MEDIUM,Mini Parser,48.3,0.39806081144686056,https://leetcode.com/problems/mini-parser,"String, Stack, Depth-First Search"
HARD,Minimum Number of Flips to Convert Binary Matrix to Zero Matrix,48.3,0.7185523054040656,https://leetcode.com/problems/minimum-number-of-flips-to-convert-binary-matrix-to-zero-matrix,"Array, Hash Table, Bit Manipulation, Breadth-First Search, Matrix"
EASY,Single Number,48.3,0.7556538832441817,https://leetcode.com/problems/single-number,"Array, Bit Manipulation"
EASY,Valid Parentheses,48.3,0.42023518632843454,https://leetcode.com/problems/valid-parentheses,"String, Stack"
EASY,Reverse Bits,48.3,0.625320760073713,https://leetcode.com/problems/reverse-bits,"Divide and Conquer, Bit Manipulation"
HARD,Merge k Sorted Lists,48.3,0.5615761939839938,https://leetcode.com/problems/merge-k-sorted-lists,"Linked List, Divide and Conquer, Heap (Priority Queue), Merge Sort"
MEDIUM,Minimize Rounding Error to Meet Target,48.3,0.4534328617307526,https://leetcode.com/problems/minimize-rounding-error-to-meet-target,"Array, Math, String, Greedy, Sorting"
EASY,Add Strings,48.3,0.5178883481218343,https://leetcode.com/problems/add-strings,"Math, String, Simulation"
EASY,Intersection of Two Linked Lists,48.3,0.605575188576455,https://leetcode.com/problems/intersection-of-two-linked-lists,"Hash Table, Linked List, Two Pointers"
MEDIUM,Strings Differ by One Character,48.3,0.4117721021611002,https://leetcode.com/problems/strings-differ-by-one-character,"Hash Table, String, Rolling Hash, Hash Function"
MEDIUM,Convert to Base -2,48.3,0.6111833301471994,https://leetcode.com/problems/convert-to-base-2,Math
MEDIUM,Flatten Nested List Iterator,48.3,0.6524340921911087,https://leetcode.com/problems/flatten-nested-list-iterator,"Stack, Tree, Depth-First Search, Design, Queue, Iterator"
