Difficulty,Title,Frequency,Acceptance Rate,Link,Topics
MEDIUM,Implement Router,100.0,0.21594618328832038,https://leetcode.com/problems/implement-router,"Array, Hash Table, Binary Search, Design, Queue, Ordered Set"
MEDIUM,Longest Palindromic Substring,88.6,0.3574423648411259,https://leetcode.com/problems/longest-palindromic-substring,"Two Pointers, String, Dynamic Programming"
MEDIUM,House Robber,79.5,0.522440740976593,https://leetcode.com/problems/house-robber,"Array, Dynamic Programming"
EASY,Lucky Numbers in a Matrix,73.1,0.7989355740653267,https://leetcode.com/problems/lucky-numbers-in-a-matrix,"Array, Matrix"
MEDIUM,Rotate Image,64.1,0.7776113146248863,https://leetcode.com/problems/rotate-image,"Array, Math, Matrix"
HARD,Max Points on a Line,64.1,0.28867082561118274,https://leetcode.com/problems/max-points-on-a-line,"Array, Hash Table, Math, Geometry"
MEDIUM,LRU Cache,64.1,0.45077422887232066,https://leetcode.com/problems/lru-cache,"Hash Table, Linked List, Design, Doubly-Linked List"
MEDIUM,Meeting Rooms II,64.1,0.5211676987864738,https://leetcode.com/problems/meeting-rooms-ii,"Array, Two Pointers, Greedy, Sorting, Heap (Priority Queue), Prefix Sum"
