Difficulty,Title,Frequency,Acceptance Rate,Link,Topics
MEDIUM,Longest Palindromic Substring,100.0,0.3574425437740726,https://leetcode.com/problems/longest-palindromic-substring,"Two Pointers, String, Dynamic Programming"
MEDIUM,Predict the Winner,98.5,0.5570627615239877,https://leetcode.com/problems/predict-the-winner,"Array, Math, Dynamic Programming, Recursion, Game Theory"
MEDIUM,House Robber,97.8,0.522440740976593,https://leetcode.com/problems/house-robber,"Array, Dynamic Programming"
MEDIUM,Rotate Image,84.6,0.7776113146248863,https://leetcode.com/problems/rotate-image,"Array, Math, Matrix"
MEDIUM,Spiral Matrix,83.9,0.5375497085336066,https://leetcode.com/problems/spiral-matrix,"Array, Matrix, Simulation"
EASY,Lucky Numbers in a Matrix,83.9,0.7989355740653267,https://leetcode.com/problems/lucky-numbers-in-a-matrix,"Array, Matrix"
MEDIUM,Stone Game,68.2,0.7157187427429045,https://leetcode.com/problems/stone-game,"Array, Math, Dynamic Programming, Game Theory"
EASY,Fizz Buzz,68.2,0.743091598218128,https://leetcode.com/problems/fizz-buzz,"Math, String, Simulation"
MEDIUM,LRU Cache,66.6,0.4507743463381655,https://leetcode.com/problems/lru-cache,"Hash Table, Linked List, Design, Doubly-Linked List"
EASY,Number of Valid Words in a Sentence,66.6,0.29950615900559474,https://leetcode.com/problems/number-of-valid-words-in-a-sentence,String
MEDIUM,Merge Intervals,64.9,0.49292510424941965,https://leetcode.com/problems/merge-intervals,"Array, Sorting"
EASY,Maximum Difference Between Increasing Elements,64.9,0.5914989952433037,https://leetcode.com/problems/maximum-difference-between-increasing-elements,Array
MEDIUM,Find Third Transaction,64.9,0.5369401765282772,https://leetcode.com/problems/find-third-transaction,Database
MEDIUM,Snakes and Ladders,64.9,0.4773179633677064,https://leetcode.com/problems/snakes-and-ladders,"Array, Breadth-First Search, Matrix"
HARD,Word Search II,63.1,0.37263138895989245,https://leetcode.com/problems/word-search-ii,"Array, String, Backtracking, Trie, Matrix"
HARD,Minimum Cost to Make Array Equal,63.1,0.4628490145849156,https://leetcode.com/problems/minimum-cost-to-make-array-equal,"Array, Binary Search, Greedy, Sorting, Prefix Sum"
MEDIUM,Find the Largest Area of Square Inside Two Rectangles,63.1,0.45009345009345014,https://leetcode.com/problems/find-the-largest-area-of-square-inside-two-rectangles,"Array, Math, Geometry"
HARD,Sum of k-Mirror Numbers,63.1,0.41486402966625463,https://leetcode.com/problems/sum-of-k-mirror-numbers,"Math, Enumeration"
MEDIUM,Maximum Subarray,63.1,0.5203999719288543,https://leetcode.com/problems/maximum-subarray,"Array, Divide and Conquer, Dynamic Programming"
EASY,Check if Binary String Has at Most One Segment of Ones,63.1,0.39022510135861305,https://leetcode.com/problems/check-if-binary-string-has-at-most-one-segment-of-ones,String
MEDIUM,Implement Router,63.1,0.21594618328832038,https://leetcode.com/problems/implement-router,"Array, Hash Table, Binary Search, Design, Queue, Ordered Set"
MEDIUM,Number of Equal Count Substrings,63.1,0.44763491860017945,https://leetcode.com/problems/number-of-equal-count-substrings,"Hash Table, String, Sliding Window, Counting"
EASY,Happy Number,58.7,0.5798132874972347,https://leetcode.com/problems/happy-number,"Hash Table, Math, Two Pointers"
EASY,Two Sum,58.7,0.5568017705476543,https://leetcode.com/problems/two-sum,"Array, Hash Table"
HARD,Max Points on a Line,58.7,0.28867082561118274,https://leetcode.com/problems/max-points-on-a-line,"Array, Hash Table, Math, Geometry"
HARD,Cherry Pickup,56.1,0.37799711121810303,https://leetcode.com/problems/cherry-pickup,"Array, Dynamic Programming, Matrix"
HARD,Trapping Rain Water,56.1,0.6495017330822875,https://leetcode.com/problems/trapping-rain-water,"Array, Two Pointers, Dynamic Programming, Stack, Monotonic Stack"
EASY,Valid Parentheses,56.1,0.4224527956856413,https://leetcode.com/problems/valid-parentheses,"String, Stack"
EASY,Best Time to Buy and Sell Stock,53.1,0.551572678366905,https://leetcode.com/problems/best-time-to-buy-and-sell-stock,"Array, Dynamic Programming"
MEDIUM,Longest Substring Without Repeating Characters,49.5,0.36821885018191525,https://leetcode.com/problems/longest-substring-without-repeating-characters,"Hash Table, String, Sliding Window"
MEDIUM,Decode String,49.5,0.6107515207445541,https://leetcode.com/problems/decode-string,"String, Stack, Recursion"
HARD,Remove Boxes,49.5,0.4828374244300386,https://leetcode.com/problems/remove-boxes,"Array, Dynamic Programming, Memoization"
HARD,Strange Printer,45.2,0.6077795205375839,https://leetcode.com/problems/strange-printer,"String, Dynamic Programming"
MEDIUM,3Sum,45.2,0.36956184552459187,https://leetcode.com/problems/3sum,"Array, Two Pointers, Sorting"
EASY,Merge Sorted Array,45.2,0.5280217430033771,https://leetcode.com/problems/merge-sorted-array,"Array, Two Pointers, Sorting"
EASY,Move Zeroes,45.2,0.6276421212714102,https://leetcode.com/problems/move-zeroes,"Array, Two Pointers"
EASY,Linked List Cycle,45.2,0.5246155990375158,https://leetcode.com/problems/linked-list-cycle,"Hash Table, Linked List, Two Pointers"
MEDIUM,Letter Combinations of a Phone Number,45.2,0.637300093201779,https://leetcode.com/problems/letter-combinations-of-a-phone-number,"Hash Table, String, Backtracking"
MEDIUM,Number of Islands,45.2,0.6219956790449928,https://leetcode.com/problems/number-of-islands,"Array, Depth-First Search, Breadth-First Search, Union Find, Matrix"
MEDIUM,Longest Consecutive Sequence,45.2,0.47049206387348036,https://leetcode.com/problems/longest-consecutive-sequence,"Array, Hash Table, Union Find"
MEDIUM,Search a 2D Matrix,45.2,0.5218690936258966,https://leetcode.com/problems/search-a-2d-matrix,"Array, Binary Search, Matrix"
MEDIUM,Expressive Words,39.6,0.4637872013794659,https://leetcode.com/problems/expressive-words,"Array, Two Pointers, String"
HARD,Merge k Sorted Lists,39.6,0.566078038181479,https://leetcode.com/problems/merge-k-sorted-lists,"Linked List, Divide and Conquer, Heap (Priority Queue), Merge Sort"
EASY,Reverse Linked List,39.6,0.7910861502009378,https://leetcode.com/problems/reverse-linked-list,"Linked List, Recursion"
MEDIUM,Gas Station,39.6,0.463059624166048,https://leetcode.com/problems/gas-station,"Array, Greedy"
EASY,Single Number,39.6,0.7585179822121912,https://leetcode.com/problems/single-number,"Array, Bit Manipulation"
MEDIUM,Group Anagrams,39.6,0.7083636472423926,https://leetcode.com/problems/group-anagrams,"Array, Hash Table, String, Sorting"
EASY,Remove Duplicates from Sorted Array,39.6,0.6020676895993129,https://leetcode.com/problems/remove-duplicates-from-sorted-array,"Array, Two Pointers"
MEDIUM,Meeting Rooms II,39.6,0.5211676987864738,https://leetcode.com/problems/meeting-rooms-ii,"Array, Two Pointers, Greedy, Sorting, Heap (Priority Queue), Prefix Sum"
MEDIUM,Permutation in String,39.6,0.4716072218174119,https://leetcode.com/problems/permutation-in-string,"Hash Table, Two Pointers, String, Sliding Window"
EASY,Valid Palindrome,39.6,0.5081508010058404,https://leetcode.com/problems/valid-palindrome,"Two Pointers, String"
HARD,Find Servers That Handled Most Number of Requests,39.6,0.4402671132167946,https://leetcode.com/problems/find-servers-that-handled-most-number-of-requests,"Array, Greedy, Heap (Priority Queue), Ordered Set"
MEDIUM,Word Search,39.6,0.451456308579138,https://leetcode.com/problems/word-search,"Array, String, Backtracking, Depth-First Search, Matrix"
MEDIUM,Add Two Numbers,39.6,0.4608950349034295,https://leetcode.com/problems/add-two-numbers,"Linked List, Math, Recursion"
MEDIUM,Insert Delete GetRandom O(1),39.6,0.5496116100503412,https://leetcode.com/problems/insert-delete-getrandom-o1,"Array, Hash Table, Math, Design, Randomized"
MEDIUM,Palindromic Substrings,31.9,0.716094556704463,https://leetcode.com/problems/palindromic-substrings,"Two Pointers, String, Dynamic Programming"
MEDIUM,Permutations,31.9,0.805743610685386,https://leetcode.com/problems/permutations,"Array, Backtracking"
MEDIUM,Top K Frequent Elements,31.9,0.6447826450542548,https://leetcode.com/problems/top-k-frequent-elements,"Array, Hash Table, Divide and Conquer, Sorting, Heap (Priority Queue), Bucket Sort, Counting, Quickselect"
HARD,Burst Balloons,31.9,0.6114119671660954,https://leetcode.com/problems/burst-balloons,"Array, Dynamic Programming"
MEDIUM,Kth Smallest Element in a BST,31.9,0.7520312518292065,https://leetcode.com/problems/kth-smallest-element-in-a-bst,"Tree, Depth-First Search, Binary Search Tree, Binary Tree"
MEDIUM,Subarray Sum Equals K,31.9,0.45382556846323274,https://leetcode.com/problems/subarray-sum-equals-k,"Array, Hash Table, Prefix Sum"
MEDIUM,Product of Array Except Self,31.9,0.6771209440099704,https://leetcode.com/problems/product-of-array-except-self,"Array, Prefix Sum"
MEDIUM,Compare Version Numbers,31.9,0.422732974140766,https://leetcode.com/problems/compare-version-numbers,"Two Pointers, String"
MEDIUM,Unique Paths,31.9,0.6570532653302723,https://leetcode.com/problems/unique-paths,"Math, Dynamic Programming, Combinatorics"
MEDIUM,Find Minimum in Rotated Sorted Array,31.9,0.525528967254408,https://leetcode.com/problems/find-minimum-in-rotated-sorted-array,"Array, Binary Search"
EASY,Missing Number,31.9,0.6993062383040687,https://leetcode.com/problems/missing-number,"Array, Hash Table, Math, Binary Search, Bit Manipulation, Sorting"
EASY,Can Place Flowers,31.9,0.28884568867651533,https://leetcode.com/problems/can-place-flowers,"Array, Greedy"
HARD,Largest Rectangle in Histogram,31.9,0.4721854415101953,https://leetcode.com/problems/largest-rectangle-in-histogram,"Array, Stack, Monotonic Stack"
EASY,Rising Temperature,31.9,0.5013486351376044,https://leetcode.com/problems/rising-temperature,Database
MEDIUM,Edit Distance,31.9,0.5868718713214479,https://leetcode.com/problems/edit-distance,"String, Dynamic Programming"
MEDIUM,Remove K Digits,31.9,0.3481132191707282,https://leetcode.com/problems/remove-k-digits,"String, Stack, Greedy, Monotonic Stack"
MEDIUM,Design Browser History,31.9,0.7771079482261158,https://leetcode.com/problems/design-browser-history,"Array, Linked List, Stack, Design, Doubly-Linked List, Data Stream"
MEDIUM,Min Stack,31.9,0.5634167450126856,https://leetcode.com/problems/min-stack,"Stack, Design"
MEDIUM,Restore IP Addresses,31.9,0.5301517902964746,https://leetcode.com/problems/restore-ip-addresses,"String, Backtracking"
MEDIUM,Validate IP Address,31.9,0.27796853848947534,https://leetcode.com/problems/validate-ip-address,String
MEDIUM,Reverse Words in a String,31.9,0.5159504086773814,https://leetcode.com/problems/reverse-words-in-a-string,"Two Pointers, String"
EASY,Pascal's Triangle,31.9,0.7691355659520922,https://leetcode.com/problems/pascals-triangle,"Array, Dynamic Programming"
MEDIUM,Jump Game,31.9,0.3940123925215379,https://leetcode.com/problems/jump-game,"Array, Dynamic Programming, Greedy"
MEDIUM,Unique Paths II,31.9,0.4307227377597868,https://leetcode.com/problems/unique-paths-ii,"Array, Dynamic Programming, Matrix"
MEDIUM,Longest Palindromic Subsequence,31.9,0.6400372053502283,https://leetcode.com/problems/longest-palindromic-subsequence,"String, Dynamic Programming"
HARD,Count of Integers,31.9,0.3696197429121691,https://leetcode.com/problems/count-of-integers,"Math, String, Dynamic Programming"
MEDIUM,Beautiful Arrangement,31.9,0.6451451090448902,https://leetcode.com/problems/beautiful-arrangement,"Array, Dynamic Programming, Backtracking, Bit Manipulation, Bitmask"
EASY,Climbing Stairs,31.9,0.5350776008043313,https://leetcode.com/problems/climbing-stairs,"Math, Dynamic Programming, Memoization"
EASY,Number of 1 Bits,31.9,0.7436812262745662,https://leetcode.com/problems/number-of-1-bits,"Divide and Conquer, Bit Manipulation"
EASY,Maximum Product of Two Elements in an Array,31.9,0.8320837229402462,https://leetcode.com/problems/maximum-product-of-two-elements-in-an-array,"Array, Sorting, Heap (Priority Queue)"
HARD,Sliding Window Maximum,31.9,0.4753674366542999,https://leetcode.com/problems/sliding-window-maximum,"Array, Queue, Sliding Window, Heap (Priority Queue), Monotonic Queue"
