Difficulty,Title,Frequency,Acceptance Rate,Link,Topics
MEDIUM,Longest Palindromic Substring,100.0,0.35648441079367144,https://leetcode.com/problems/longest-palindromic-substring,"Two Pointers, String, Dynamic Programming"
MEDIUM,Predict the Winner,98.5,0.5565988334965303,https://leetcode.com/problems/predict-the-winner,"Array, Math, Dynamic Programming, Recursion, Game Theory"
MEDIUM,House Robber,97.5,0.5218919174397008,https://leetcode.com/problems/house-robber,"Array, Dynamic Programming"
MEDIUM,Rotate Image,83.9,0.7762107428917453,https://leetcode.com/problems/rotate-image,"Array, Math, Matrix"
MEDIUM,Spiral Matrix,83.9,0.5357354345087073,https://leetcode.com/problems/spiral-matrix,"Array, Matrix, Simulation"
EASY,Lucky Numbers in a Matrix,83.2,0.7988300579669165,https://leetcode.com/problems/lucky-numbers-in-a-matrix,"Array, Matrix"
MEDIUM,Stone Game,68.2,0.7152062543019916,https://leetcode.com/problems/stone-game,"Array, Math, Dynamic Programming, Game Theory"
EASY,Fizz Buzz,68.2,0.7421968632423763,https://leetcode.com/problems/fizz-buzz,"Math, String, Simulation"
MEDIUM,LRU Cache,66.7,0.4493677320922184,https://leetcode.com/problems/lru-cache,"Hash Table, Linked List, Design, Doubly-Linked List"
EASY,Number of Valid Words in a Sentence,66.7,0.2990957326345077,https://leetcode.com/problems/number-of-valid-words-in-a-sentence,String
EASY,Maximum Difference Between Increasing Elements,65.0,0.59058752103067,https://leetcode.com/problems/maximum-difference-between-increasing-elements,Array
MEDIUM,Merge Intervals,65.0,0.49193396233794473,https://leetcode.com/problems/merge-intervals,"Array, Sorting"
MEDIUM,Snakes and Ladders,65.0,0.44130736912161694,https://leetcode.com/problems/snakes-and-ladders,"Array, Breadth-First Search, Matrix"
MEDIUM,Find Third Transaction,65.0,0.536326942482341,https://leetcode.com/problems/find-third-transaction,Database
HARD,Minimum Cost to Make Array Equal,63.1,0.46231802513209547,https://leetcode.com/problems/minimum-cost-to-make-array-equal,"Array, Binary Search, Greedy, Sorting, Prefix Sum"
HARD,Sum of k-Mirror Numbers,63.1,0.41393569730176777,https://leetcode.com/problems/sum-of-k-mirror-numbers,"Math, Enumeration"
MEDIUM,Maximum Subarray,63.1,0.5197310774291893,https://leetcode.com/problems/maximum-subarray,"Array, Divide and Conquer, Dynamic Programming"
MEDIUM,Find the Largest Area of Square Inside Two Rectangles,63.1,0.4494566590851655,https://leetcode.com/problems/find-the-largest-area-of-square-inside-two-rectangles,"Array, Math, Geometry"
EASY,Check if Binary String Has at Most One Segment of Ones,63.1,0.3901479230292486,https://leetcode.com/problems/check-if-binary-string-has-at-most-one-segment-of-ones,String
HARD,Word Search II,63.1,0.3720004358071734,https://leetcode.com/problems/word-search-ii,"Array, String, Backtracking, Trie, Matrix"
MEDIUM,Implement Router,63.1,0.21483579861582305,https://leetcode.com/problems/implement-router,"Array, Hash Table, Binary Search, Design, Queue, Ordered Set"
MEDIUM,Number of Equal Count Substrings,63.1,0.4456846203763789,https://leetcode.com/problems/number-of-equal-count-substrings,"Hash Table, String, Sliding Window, Counting"
EASY,Happy Number,58.7,0.5788713689513336,https://leetcode.com/problems/happy-number,"Hash Table, Math, Two Pointers"
EASY,Two Sum,58.7,0.5554649411406142,https://leetcode.com/problems/two-sum,"Array, Hash Table"
HARD,Max Points on a Line,58.7,0.28776474860230267,https://leetcode.com/problems/max-points-on-a-line,"Array, Hash Table, Math, Geometry"
EASY,Valid Parentheses,58.7,0.4215998146845859,https://leetcode.com/problems/valid-parentheses,"String, Stack"
HARD,Cherry Pickup,56.1,0.3772130418972971,https://leetcode.com/problems/cherry-pickup,"Array, Dynamic Programming, Matrix"
EASY,Best Time to Buy and Sell Stock,53.1,0.5506574880668101,https://leetcode.com/problems/best-time-to-buy-and-sell-stock,"Array, Dynamic Programming"
HARD,Trapping Rain Water,53.1,0.64811809163405,https://leetcode.com/problems/trapping-rain-water,"Array, Two Pointers, Dynamic Programming, Stack, Monotonic Stack"
HARD,Remove Boxes,49.6,0.4823233247894544,https://leetcode.com/problems/remove-boxes,"Array, Dynamic Programming, Memoization"
MEDIUM,Decode String,49.6,0.609751940966381,https://leetcode.com/problems/decode-string,"String, Stack, Recursion"
MEDIUM,Longest Substring Without Repeating Characters,49.6,0.36716065724383706,https://leetcode.com/problems/longest-substring-without-repeating-characters,"Hash Table, String, Sliding Window"
MEDIUM,Search a 2D Matrix,45.3,0.5208696346495337,https://leetcode.com/problems/search-a-2d-matrix,"Array, Binary Search, Matrix"
MEDIUM,Letter Combinations of a Phone Number,45.3,0.6359895750129404,https://leetcode.com/problems/letter-combinations-of-a-phone-number,"Hash Table, String, Backtracking"
EASY,Merge Sorted Array,45.3,0.5267881578106017,https://leetcode.com/problems/merge-sorted-array,"Array, Two Pointers, Sorting"
EASY,Move Zeroes,45.3,0.6272147365216861,https://leetcode.com/problems/move-zeroes,"Array, Two Pointers"
MEDIUM,Number of Islands,45.3,0.6206902517902476,https://leetcode.com/problems/number-of-islands,"Array, Depth-First Search, Breadth-First Search, Union Find, Matrix"
HARD,Strange Printer,45.3,0.6077064923246401,https://leetcode.com/problems/strange-printer,"String, Dynamic Programming"
MEDIUM,3Sum,45.3,0.3684032725426028,https://leetcode.com/problems/3sum,"Array, Two Pointers, Sorting"
MEDIUM,Word Search,45.3,0.4502654421786215,https://leetcode.com/problems/word-search,"Array, String, Backtracking, Depth-First Search, Matrix"
EASY,Linked List Cycle,45.3,0.5235419409925873,https://leetcode.com/problems/linked-list-cycle,"Hash Table, Linked List, Two Pointers"
MEDIUM,Longest Consecutive Sequence,45.3,0.4707114246218683,https://leetcode.com/problems/longest-consecutive-sequence,"Array, Hash Table, Union Find"
MEDIUM,Expressive Words,39.7,0.4633926288490338,https://leetcode.com/problems/expressive-words,"Array, Two Pointers, String"
MEDIUM,Palindromic Substrings,39.7,0.7152152246408093,https://leetcode.com/problems/palindromic-substrings,"Two Pointers, String, Dynamic Programming"
MEDIUM,Gas Station,39.7,0.46224228459539496,https://leetcode.com/problems/gas-station,"Array, Greedy"
MEDIUM,Meeting Rooms II,39.7,0.5207959142627572,https://leetcode.com/problems/meeting-rooms-ii,"Array, Two Pointers, Greedy, Sorting, Heap (Priority Queue), Prefix Sum"
MEDIUM,Permutation in String,39.7,0.4707479159273028,https://leetcode.com/problems/permutation-in-string,"Hash Table, Two Pointers, String, Sliding Window"
HARD,Find Servers That Handled Most Number of Requests,39.7,0.43943201809499877,https://leetcode.com/problems/find-servers-that-handled-most-number-of-requests,"Array, Greedy, Heap (Priority Queue), Ordered Set"
EASY,Remove Duplicates from Sorted Array,39.7,0.6004887328013812,https://leetcode.com/problems/remove-duplicates-from-sorted-array,"Array, Two Pointers"
MEDIUM,Add Two Numbers,39.7,0.4594135731435011,https://leetcode.com/problems/add-two-numbers,"Linked List, Math, Recursion"
EASY,Single Number,39.7,0.7573436167204239,https://leetcode.com/problems/single-number,"Array, Bit Manipulation"
MEDIUM,Group Anagrams,39.7,0.7072405232211885,https://leetcode.com/problems/group-anagrams,"Array, Hash Table, String, Sorting"
EASY,Valid Palindrome,39.7,0.5066479179087902,https://leetcode.com/problems/valid-palindrome,"Two Pointers, String"
HARD,Merge k Sorted Lists,39.7,0.5644305531835702,https://leetcode.com/problems/merge-k-sorted-lists,"Linked List, Divide and Conquer, Heap (Priority Queue), Merge Sort"
MEDIUM,Min Stack,32.0,0.5623418696686977,https://leetcode.com/problems/min-stack,"Stack, Design"
EASY,Reverse Linked List,32.0,0.79004486185193,https://leetcode.com/problems/reverse-linked-list,"Linked List, Recursion"
MEDIUM,Edit Distance,32.0,0.5857221264523311,https://leetcode.com/problems/edit-distance,"String, Dynamic Programming"
MEDIUM,Kth Smallest Element in a BST,32.0,0.7509508618102582,https://leetcode.com/problems/kth-smallest-element-in-a-bst,"Tree, Depth-First Search, Binary Search Tree, Binary Tree"
MEDIUM,Subarray Sum Equals K,32.0,0.45282702714235384,https://leetcode.com/problems/subarray-sum-equals-k,"Array, Hash Table, Prefix Sum"
MEDIUM,Permutations,32.0,0.8048474460147584,https://leetcode.com/problems/permutations,"Array, Backtracking"
MEDIUM,Compare Version Numbers,32.0,0.4219394869151245,https://leetcode.com/problems/compare-version-numbers,"Two Pointers, String"
MEDIUM,Unique Paths,32.0,0.6564003519977242,https://leetcode.com/problems/unique-paths,"Math, Dynamic Programming, Combinatorics"
MEDIUM,Find Minimum in Rotated Sorted Array,32.0,0.5246001703291536,https://leetcode.com/problems/find-minimum-in-rotated-sorted-array,"Array, Binary Search"
EASY,Missing Number,32.0,0.6979096191163022,https://leetcode.com/problems/missing-number,"Array, Hash Table, Math, Binary Search, Bit Manipulation, Sorting"
MEDIUM,Restore IP Addresses,32.0,0.5287275836179032,https://leetcode.com/problems/restore-ip-addresses,"String, Backtracking"
EASY,Climbing Stairs,32.0,0.5347679829179761,https://leetcode.com/problems/climbing-stairs,"Math, Dynamic Programming, Memoization"
MEDIUM,Reverse Words in a String,32.0,0.5128455260716414,https://leetcode.com/problems/reverse-words-in-a-string,"Two Pointers, String"
MEDIUM,Unique Paths II,32.0,0.4300226047505731,https://leetcode.com/problems/unique-paths-ii,"Array, Dynamic Programming, Matrix"
MEDIUM,Product of Array Except Self,32.0,0.6762126611580973,https://leetcode.com/problems/product-of-array-except-self,"Array, Prefix Sum"
HARD,Burst Balloons,32.0,0.6099354518200103,https://leetcode.com/problems/burst-balloons,"Array, Dynamic Programming"
MEDIUM,Top K Frequent Elements,32.0,0.6438792199060991,https://leetcode.com/problems/top-k-frequent-elements,"Array, Hash Table, Divide and Conquer, Sorting, Heap (Priority Queue), Bucket Sort, Counting, Quickselect"
MEDIUM,Insert Delete GetRandom O(1),32.0,0.5492717212417536,https://leetcode.com/problems/insert-delete-getrandom-o1,"Array, Hash Table, Math, Design, Randomized"
MEDIUM,Remove K Digits,32.0,0.3472555437400677,https://leetcode.com/problems/remove-k-digits,"String, Stack, Greedy, Monotonic Stack"
MEDIUM,Validate IP Address,32.0,0.277671821849418,https://leetcode.com/problems/validate-ip-address,String
MEDIUM,Longest Palindromic Subsequence,32.0,0.6391699454669109,https://leetcode.com/problems/longest-palindromic-subsequence,"String, Dynamic Programming"
EASY,Pascal's Triangle,32.0,0.7679879305463672,https://leetcode.com/problems/pascals-triangle,"Array, Dynamic Programming"
MEDIUM,Beautiful Arrangement,32.0,0.6449128870450189,https://leetcode.com/problems/beautiful-arrangement,"Array, Dynamic Programming, Backtracking, Bit Manipulation, Bitmask"
EASY,Maximum Product of Two Elements in an Array,32.0,0.8317605948184296,https://leetcode.com/problems/maximum-product-of-two-elements-in-an-array,"Array, Sorting, Heap (Priority Queue)"
MEDIUM,Design Browser History,32.0,0.776867586068649,https://leetcode.com/problems/design-browser-history,"Array, Linked List, Stack, Design, Doubly-Linked List, Data Stream"
EASY,Number of 1 Bits,32.0,0.7423157160695771,https://leetcode.com/problems/number-of-1-bits,"Divide and Conquer, Bit Manipulation"
HARD,Count of Integers,32.0,0.3693642921550947,https://leetcode.com/problems/count-of-integers,"Math, String, Dynamic Programming"
MEDIUM,Jump Game,32.0,0.393283762577915,https://leetcode.com/problems/jump-game,"Array, Dynamic Programming, Greedy"
EASY,Can Place Flowers,32.0,0.2886827670129644,https://leetcode.com/problems/can-place-flowers,"Array, Greedy"
