Difficulty,Title,Frequency,Acceptance Rate,Link,Topics
MEDIUM,Insert Delete GetRandom O(1),100.0,0.5493249872577459,https://leetcode.com/problems/insert-delete-getrandom-o1,"Array, Hash Table, Math, Design, Randomized"
MEDIUM,Shortest Uncommon Substring in an Array,83.4,0.47420242800677587,https://leetcode.com/problems/shortest-uncommon-substring-in-an-array,"Array, Hash Table, String, Trie"
MEDIUM,Group Anagrams,74.4,0.7043767916939088,https://leetcode.com/problems/group-anagrams,"Array, Hash Table, String, Sorting"
EASY,Valid Anagram,70.1,0.662276495090208,https://leetcode.com/problems/valid-anagram,"Hash Table, String, Sorting"
HARD,Insert Delete GetRandom O(1) - Duplicates allowed,70.1,0.3581994312636042,https://leetcode.com/problems/insert-delete-getrandom-o1-duplicates-allowed,"Array, Hash Table, Math, Design, Randomized"
MEDIUM,String Compression,64.6,0.5738939953917215,https://leetcode.com/problems/string-compression,"Two Pointers, String"
MEDIUM,Coin Change,64.6,0.45914552036371103,https://leetcode.com/problems/coin-change,"Array, Dynamic Programming, Breadth-First Search"
MEDIUM,Design Hit Counter,56.8,0.690321537478178,https://leetcode.com/problems/design-hit-counter,"Array, Binary Search, Design, Queue, Data Stream"
