Difficulty,Title,Frequency,Acceptance Rate,Link,Topics
MEDIUM,Insert Delete GetRandom O(1),100.0,0.5496804711110049,https://leetcode.com/problems/insert-delete-getrandom-o1,"Array, Hash Table, Math, Design, Randomized"
MEDIUM,Shortest Uncommon Substring in an Array,84.0,0.4735854528086246,https://leetcode.com/problems/shortest-uncommon-substring-in-an-array,"Array, Hash Table, String, Trie"
MEDIUM,Group Anagrams,68.8,0.7056683458730363,https://leetcode.com/problems/group-anagrams,"Array, Hash Table, String, Sorting"
EASY,Valid Anagram,68.8,0.6633037547182306,https://leetcode.com/problems/valid-anagram,"Hash Table, String, Sorting"
HARD,Insert Delete GetRandom O(1) - Duplicates allowed,68.8,0.35843130672167756,https://leetcode.com/problems/insert-delete-getrandom-o1-duplicates-allowed,"Array, Hash Table, Math, Design, Randomized"
MEDIUM,Coin Change,55.7,0.46046386801225714,https://leetcode.com/problems/coin-change,"Array, Dynamic Programming, Breadth-First Search"
MEDIUM,Design Hit Counter,55.7,0.6907138240466564,https://leetcode.com/problems/design-hit-counter,"Array, Binary Search, Design, Queue, Data Stream"
MEDIUM,String Compression,55.7,0.5758865950344543,https://leetcode.com/problems/string-compression,"Two Pointers, String"
