Difficulty,Title,Frequency,Acceptance Rate,Link,Topics
MEDIUM,Closest Equal Element Queries,100.0,0.3075836496865896,https://leetcode.com/problems/closest-equal-element-queries,"Array, Hash Table, Binary Search"
EASY,Split a String in Balanced Strings,84.4,0.8674399858938512,https://leetcode.com/problems/split-a-string-in-balanced-strings,"String, Greedy, Counting"
MEDIUM,Minimum Operations to Reduce an Integer to 0,77.4,0.5695584181082431,https://leetcode.com/problems/minimum-operations-to-reduce-an-integer-to-0,"Dynamic Programming, Greedy, Bit Manipulation"
MEDIUM,String Compression,70.8,0.5782713155821992,https://leetcode.com/problems/string-compression,"Two Pointers, String"
MEDIUM,Course Schedule II,60.7,0.5312872731612823,https://leetcode.com/problems/course-schedule-ii,"Depth-First Search, Breadth-First Search, Graph, Topological Sort"
MEDIUM,Zigzag Conversion,60.7,0.5132151761053041,https://leetcode.com/problems/zigzag-conversion,String
EASY,Backspace String Compare,52.7,0.49457029128191204,https://leetcode.com/problems/backspace-string-compare,"Two Pointers, String, Stack, Simulation"
MEDIUM,Longest Palindromic Substring,52.7,0.35648361993621724,https://leetcode.com/problems/longest-palindromic-substring,"Two Pointers, String, Dynamic Programming"
MEDIUM,Longest Common Subsequence,52.7,0.5815553790534619,https://leetcode.com/problems/longest-common-subsequence,"String, Dynamic Programming"
