Difficulty,Title,Frequency,Acceptance Rate,Link,Topics
MEDIUM,Maximum Number of Occurrences of a Substring,100.0,0.5299351032448377,https://leetcode.com/problems/maximum-number-of-occurrences-of-a-substring,"Hash Table, String, Sliding Window"
MEDIUM,Subarray Product Less Than K,96.1,0.5245661312686627,https://leetcode.com/problems/subarray-product-less-than-k,"Array, Binary Search, Sliding Window, Prefix Sum"
HARD,Distinct Subsequences,96.1,0.4953066698042332,https://leetcode.com/problems/distinct-subsequences,"String, Dynamic Programming"
MEDIUM,Closest Equal Element Queries,91.5,0.2957309657017757,https://leetcode.com/problems/closest-equal-element-queries,"Array, Hash Table, Binary Search"
EASY,Split a String in Balanced Strings,91.5,0.8663931073272997,https://leetcode.com/problems/split-a-string-in-balanced-strings,"String, Greedy, Counting"
HARD,Smallest Substring With Identical Characters II,91.5,0.4427357345204371,https://leetcode.com/problems/smallest-substring-with-identical-characters-ii,"String, Binary Search"
HARD,Smallest Substring With Identical Characters I,91.5,0.19227501470492125,https://leetcode.com/problems/smallest-substring-with-identical-characters-i,"Array, Binary Search, Enumeration"
MEDIUM,String Compression,91.5,0.5738929950217527,https://leetcode.com/problems/string-compression,"Two Pointers, String"
HARD,LFU Cache,88.9,0.4595113369513143,https://leetcode.com/problems/lfu-cache,"Hash Table, Linked List, Design, Doubly-Linked List"
MEDIUM,Palindromic Substrings,85.9,0.7133033361311921,https://leetcode.com/problems/palindromic-substrings,"Two Pointers, String, Dynamic Programming"
MEDIUM,Number of Divisible Triplet Sums,82.5,0.6682420749279538,https://leetcode.com/problems/number-of-divisible-triplet-sums,"Array, Hash Table"
MEDIUM,K-diff Pairs in an Array,82.5,0.44313306469447566,https://leetcode.com/problems/k-diff-pairs-in-an-array,"Array, Hash Table, Two Pointers, Binary Search, Sorting"
MEDIUM,Merge Intervals,78.6,0.4888148075512347,https://leetcode.com/problems/merge-intervals,"Array, Sorting"
MEDIUM,Group Anagrams,78.6,0.7043761833851506,https://leetcode.com/problems/group-anagrams,"Array, Hash Table, String, Sorting"
MEDIUM,Course Schedule II,78.6,0.5273972436403376,https://leetcode.com/problems/course-schedule-ii,"Depth-First Search, Breadth-First Search, Graph, Topological Sort"
HARD,Minimize Malware Spread,78.6,0.4220744153615838,https://leetcode.com/problems/minimize-malware-spread,"Array, Hash Table, Depth-First Search, Breadth-First Search, Union Find, Graph"
MEDIUM,Word Search,74.0,0.4471707100583806,https://leetcode.com/problems/word-search,"Array, String, Backtracking, Depth-First Search, Matrix"
HARD,Reverse Nodes in k-Group,68.4,0.6218919797816689,https://leetcode.com/problems/reverse-nodes-in-k-group,"Linked List, Recursion"
HARD,Minimum Window Substring,68.4,0.44765874153739704,https://leetcode.com/problems/minimum-window-substring,"Hash Table, String, Sliding Window"
MEDIUM,Coin Change,68.4,0.45914412884469336,https://leetcode.com/problems/coin-change,"Array, Dynamic Programming, Breadth-First Search"
HARD,Minimum Number of Taps to Open to Water a Garden,68.4,0.5070082165297245,https://leetcode.com/problems/minimum-number-of-taps-to-open-to-water-a-garden,"Array, Dynamic Programming, Greedy"
EASY,Largest Number After Digit Swaps by Parity,68.4,0.6336667093574264,https://leetcode.com/problems/largest-number-after-digit-swaps-by-parity,"Sorting, Heap (Priority Queue)"
MEDIUM,Number of Islands,68.4,0.6170169122196616,https://leetcode.com/problems/number-of-islands,"Array, Depth-First Search, Breadth-First Search, Union Find, Matrix"
HARD,Trapping Rain Water,61.2,0.6439791670320709,https://leetcode.com/problems/trapping-rain-water,"Array, Two Pointers, Dynamic Programming, Stack, Monotonic Stack"
MEDIUM,Verify Preorder Sequence in Binary Search Tree,61.2,0.5069297875334178,https://leetcode.com/problems/verify-preorder-sequence-in-binary-search-tree,"Array, Stack, Tree, Binary Search Tree, Recursion, Monotonic Stack, Binary Tree"
MEDIUM,Zigzag Conversion,61.2,0.5090891602179736,https://leetcode.com/problems/zigzag-conversion,String
HARD,Binary Tree Maximum Path Sum,61.2,0.40956676610012466,https://leetcode.com/problems/binary-tree-maximum-path-sum,"Dynamic Programming, Tree, Depth-First Search, Binary Tree"
MEDIUM,Max Consecutive Ones III,61.2,0.6534581410260571,https://leetcode.com/problems/max-consecutive-ones-iii,"Array, Binary Search, Sliding Window, Prefix Sum"
MEDIUM,Longest Substring Without Repeating Characters,61.2,0.3641853325524446,https://leetcode.com/problems/longest-substring-without-repeating-characters,"Hash Table, String, Sliding Window"
MEDIUM,Min Stack,61.2,0.5599599865692931,https://leetcode.com/problems/min-stack,"Stack, Design"
EASY,Best Time to Buy and Sell Stock,61.2,0.5482913146633764,https://leetcode.com/problems/best-time-to-buy-and-sell-stock,"Array, Dynamic Programming"
MEDIUM,Validate Binary Search Tree,61.2,0.34032740799920724,https://leetcode.com/problems/validate-binary-search-tree,"Tree, Depth-First Search, Binary Search Tree, Binary Tree"
EASY,Maximum Product of Three Numbers,61.2,0.45238474944383955,https://leetcode.com/problems/maximum-product-of-three-numbers,"Array, Math, Sorting"
MEDIUM,Longest Increasing Subsequence,51.1,0.5726201481873965,https://leetcode.com/problems/longest-increasing-subsequence,"Array, Binary Search, Dynamic Programming"
MEDIUM,K Closest Points to Origin,51.1,0.6761086364807396,https://leetcode.com/problems/k-closest-points-to-origin,"Array, Math, Divide and Conquer, Geometry, Sorting, Heap (Priority Queue), Quickselect"
MEDIUM,Longest Palindromic Substring,51.1,0.35378201800605863,https://leetcode.com/problems/longest-palindromic-substring,"Two Pointers, String, Dynamic Programming"
MEDIUM,Least Number of Unique Integers after K Removals,51.1,0.6327883191220495,https://leetcode.com/problems/least-number-of-unique-integers-after-k-removals,"Array, Hash Table, Greedy, Sorting, Counting"
EASY,Minimum Absolute Difference,51.1,0.7037305885175748,https://leetcode.com/problems/minimum-absolute-difference,"Array, Sorting"
MEDIUM,LRU Cache,51.1,0.4455052234366002,https://leetcode.com/problems/lru-cache,"Hash Table, Linked List, Design, Doubly-Linked List"
EASY,Backspace String Compare,51.1,0.49414820667724496,https://leetcode.com/problems/backspace-string-compare,"Two Pointers, String, Stack, Simulation"
EASY,Two Sum,51.1,0.551853538154688,https://leetcode.com/problems/two-sum,"Array, Hash Table"
MEDIUM,Koko Eating Bananas,51.1,0.4890344327448586,https://leetcode.com/problems/koko-eating-bananas,"Array, Binary Search"
MEDIUM,Decode String,51.1,0.6074708471841013,https://leetcode.com/problems/decode-string,"String, Stack, Recursion"
MEDIUM,Find Leaves of Binary Tree,51.1,0.8097669955407408,https://leetcode.com/problems/find-leaves-of-binary-tree,"Tree, Depth-First Search, Binary Tree"
MEDIUM,Maximum Earnings From Taxi,51.1,0.4453496843127731,https://leetcode.com/problems/maximum-earnings-from-taxi,"Array, Hash Table, Binary Search, Dynamic Programming, Sorting"
HARD,Candy,51.1,0.444225702571553,https://leetcode.com/problems/candy,"Array, Greedy"
MEDIUM,Kth Largest Element in an Array,51.1,0.6767053072286557,https://leetcode.com/problems/kth-largest-element-in-an-array,"Array, Divide and Conquer, Sorting, Heap (Priority Queue), Quickselect"
MEDIUM,Asteroid Collision,51.1,0.45150804243859577,https://leetcode.com/problems/asteroid-collision,"Array, Stack, Simulation"
HARD,Word Ladder,51.1,0.41982231637014295,https://leetcode.com/problems/word-ladder,"Hash Table, String, Breadth-First Search"
EASY,Maximum Units on a Truck,51.1,0.7407933680819299,https://leetcode.com/problems/maximum-units-on-a-truck,"Array, Greedy, Sorting"
MEDIUM,Search in Rotated Sorted Array,51.1,0.424011247772154,https://leetcode.com/problems/search-in-rotated-sorted-array,"Array, Binary Search"
HARD,Maximum Number of Non-overlapping Palindrome Substrings,51.1,0.4124740949777327,https://leetcode.com/problems/maximum-number-of-non-overlapping-palindrome-substrings,"Two Pointers, String, Dynamic Programming, Greedy"
MEDIUM,Path Sum III,51.1,0.4604355694433566,https://leetcode.com/problems/path-sum-iii,"Tree, Depth-First Search, Binary Tree"
HARD,Number of Visible People in a Queue,51.1,0.706022767258514,https://leetcode.com/problems/number-of-visible-people-in-a-queue,"Array, Stack, Monotonic Stack"
MEDIUM,Top K Frequent Elements,51.1,0.6415069024263538,https://leetcode.com/problems/top-k-frequent-elements,"Array, Hash Table, Divide and Conquer, Sorting, Heap (Priority Queue), Bucket Sort, Counting, Quickselect"
MEDIUM,Exclusive Time of Functions,51.1,0.6418165304268847,https://leetcode.com/problems/exclusive-time-of-functions,"Array, Stack"
MEDIUM,Gas Station,51.1,0.4601300074919571,https://leetcode.com/problems/gas-station,"Array, Greedy"
EASY,Shortest Distance to Target String in a Circular Array,51.1,0.5045251789274393,https://leetcode.com/problems/shortest-distance-to-target-string-in-a-circular-array,"Array, String"
MEDIUM,Game of Life,51.1,0.7100197420645148,https://leetcode.com/problems/game-of-life,"Array, Matrix, Simulation"
MEDIUM,Meeting Rooms II,51.1,0.5195252135351157,https://leetcode.com/problems/meeting-rooms-ii,"Array, Two Pointers, Greedy, Sorting, Heap (Priority Queue), Prefix Sum"
MEDIUM,Remove Adjacent Almost-Equal Characters,51.1,0.5235468816291896,https://leetcode.com/problems/remove-adjacent-almost-equal-characters,"String, Dynamic Programming, Greedy"
MEDIUM,All Nodes Distance K in Binary Tree,51.1,0.6592843640324192,https://leetcode.com/problems/all-nodes-distance-k-in-binary-tree,"Hash Table, Tree, Depth-First Search, Breadth-First Search, Binary Tree"
MEDIUM,Top K Frequent Words,51.1,0.5897244768610717,https://leetcode.com/problems/top-k-frequent-words,"Array, Hash Table, String, Trie, Sorting, Heap (Priority Queue), Bucket Sort, Counting"
