Difficulty,Title,Frequency,Acceptance Rate,Link,Topics
HARD,Count Subarrays With Median K,100.0,0.44913166646138686,https://leetcode.com/problems/count-subarrays-with-median-k,"Array, Hash Table, Prefix Sum"
MEDIUM,LRU Cache,86.7,0.4455059862234372,https://leetcode.com/problems/lru-cache,"Hash Table, Linked List, Design, Doubly-Linked List"
MEDIUM,Snakes and Ladders,86.7,0.4405277806487811,https://leetcode.com/problems/snakes-and-ladders,"Array, Breadth-First Search, Matrix"
MEDIUM,Number of Islands,76.2,0.6170225564696359,https://leetcode.com/problems/number-of-islands,"Array, Depth-First Search, Breadth-First Search, Union Find, Matrix"
MEDIUM,Subarray Sums Divisible by K,76.2,0.5553504857140434,https://leetcode.com/problems/subarray-sums-divisible-by-k,"Array, Hash Table, Prefix Sum"
MEDIUM,Most Stones Removed with Same Row or Column,76.2,0.6211272603693947,https://leetcode.com/problems/most-stones-removed-with-same-row-or-column,"Hash Table, Depth-First Search, Union Find, Graph"
HARD,Minimum Number of K Consecutive Bit Flips,76.2,0.6224385729664395,https://leetcode.com/problems/minimum-number-of-k-consecutive-bit-flips,"Array, Bit Manipulation, Queue, Sliding Window, Prefix Sum"
MEDIUM,Interleaving String,76.2,0.4145248283914139,https://leetcode.com/problems/interleaving-string,"String, Dynamic Programming"
HARD,Minimum Window Substring,76.2,0.44766256126799336,https://leetcode.com/problems/minimum-window-substring,"Hash Table, String, Sliding Window"
