Difficulty,Title,Frequency,Acceptance Rate,Link,Topics
HARD,Count Subarrays With Median K,100.0,0.45181409295352326,https://leetcode.com/problems/count-subarrays-with-median-k,"Array, Hash Table, Prefix Sum"
HARD,Count Paths That Can Form a Palindrome in a Tree,89.7,0.4529317135408,https://leetcode.com/problems/count-paths-that-can-form-a-palindrome-in-a-tree,"Dynamic Programming, Bit Manipulation, Tree, Depth-First Search, Bitmask"
MEDIUM,LRU Cache,82.4,0.4493775199219526,https://leetcode.com/problems/lru-cache,"Hash Table, Linked List, Design, Doubly-Linked List"
MEDIUM,Snakes and Ladders,82.4,0.44130123020095297,https://leetcode.com/problems/snakes-and-ladders,"Array, Breadth-First Search, Matrix"
MEDIUM,Number of Islands,72.1,0.6207044751765558,https://leetcode.com/problems/number-of-islands,"Array, Depth-First Search, Breadth-First Search, Union Find, Matrix"
MEDIUM,Subarray Sums Divisible by K,72.1,0.5557547033135335,https://leetcode.com/problems/subarray-sums-divisible-by-k,"Array, Hash Table, Prefix Sum"
MEDIUM,Most Stones Removed with Same Row or Column,72.1,0.6213551333960011,https://leetcode.com/problems/most-stones-removed-with-same-row-or-column,"Hash Table, Depth-First Search, Union Find, Graph"
HARD,Minimum Number of K Consecutive Bit Flips,72.1,0.6212780256501204,https://leetcode.com/problems/minimum-number-of-k-consecutive-bit-flips,"Array, Bit Manipulation, Queue, Sliding Window, Prefix Sum"
MEDIUM,Interleaving String,72.1,0.42014422416674657,https://leetcode.com/problems/interleaving-string,"String, Dynamic Programming"
HARD,Minimum Window Substring,72.1,0.4509979369125859,https://leetcode.com/problems/minimum-window-substring,"Hash Table, String, Sliding Window"
