Difficulty,Title,Frequency,Acceptance Rate,Link,Topics
HARD,Expression Add Operators,100.0,0.41578849146507013,https://leetcode.com/problems/expression-add-operators,"Math, String, Backtracking"
HARD,Bus Routes,73.9,0.46960553982665876,https://leetcode.com/problems/bus-routes,"Array, Hash Table, Breadth-First Search"
MEDIUM,Combination Sum,65.7,0.7453537385991453,https://leetcode.com/problems/combination-sum,"Array, Backtracking"
HARD,Split Array Largest Sum,65.7,0.5792477027089626,https://leetcode.com/problems/split-array-largest-sum,"Array, Binary Search, Dynamic Programming, Greedy, Prefix Sum"
HARD,Reconstruct Itinerary,65.7,0.4356684310598137,https://leetcode.com/problems/reconstruct-itinerary,"Depth-First Search, Graph, Eulerian Circuit"
