Difficulty,Title,Frequency,Acceptance Rate,Link,Topics
HARD,Optimal Account Balancing,100.0,0.4970806027711026,https://leetcode.com/problems/optimal-account-balancing,"Array, Dynamic Programming, Backtracking, Bit Manipulation, Bitmask"
HARD,Reconstruct Itinerary,94.7,0.4344605542239939,https://leetcode.com/problems/reconstruct-itinerary,"Depth-First Search, Graph, Eulerian Circuit"
HARD,Meeting Rooms III,87.9,0.43919188511481705,https://leetcode.com/problems/meeting-rooms-iii,"Array, Hash Table, Sorting, Heap (Priority Queue), Simulation"
HARD,Count Subarrays With Score Less Than K,87.9,0.5569364655025312,https://leetcode.com/problems/count-subarrays-with-score-less-than-k,"Array, Binary Search, Sliding Window, Prefix Sum"
MEDIUM,Target Sum,78.3,0.5036135403638625,https://leetcode.com/problems/target-sum,"Array, Dynamic Programming, Backtracking"
