Difficulty,Title,Frequency,Acceptance Rate,Link,Topics
MEDIUM,Count and Say,100.0,0.6023493168660135,https://leetcode.com/problems/count-and-say,String
HARD,Reconstruct Itinerary,93.0,0.4352737764483397,https://leetcode.com/problems/reconstruct-itinerary,"Depth-First Search, Graph, Eulerian Circuit"
HARD,Shortest Path in a Grid with Obstacles Elimination,92.0,0.4553177883846804,https://leetcode.com/problems/shortest-path-in-a-grid-with-obstacles-elimination,"Array, Breadth-First Search, Matrix"
HARD,Optimal Account Balancing,91.0,0.49840544071313303,https://leetcode.com/problems/optimal-account-balancing,"Array, Dynamic Programming, Backtracking, Bit Manipulation, Bitmask"
HARD,Maximum Profit in Job Scheduling,88.8,0.5438705756566298,https://leetcode.com/problems/maximum-profit-in-job-scheduling,"Array, Binary Search, Dynamic Programming, Sorting"
HARD,Count Subarrays With Score Less Than K,88.8,0.6243712199800356,https://leetcode.com/problems/count-subarrays-with-score-less-than-k,"Array, Binary Search, Sliding Window, Prefix Sum"
HARD,Expression Add Operators,81.8,0.414701297834009,https://leetcode.com/problems/expression-add-operators,"Math, String, Backtracking"
HARD,Bus Routes,79.1,0.4697240846148304,https://leetcode.com/problems/bus-routes,"Array, Hash Table, Breadth-First Search"
HARD,Find Median from Data Stream,77.0,0.531162588090869,https://leetcode.com/problems/find-median-from-data-stream,"Two Pointers, Design, Sorting, Heap (Priority Queue), Data Stream"
MEDIUM,Shortest Way to Form String,75.9,0.6128072675454221,https://leetcode.com/problems/shortest-way-to-form-string,"Two Pointers, String, Binary Search, Greedy"
EASY,Is Subsequence,74.8,0.4831711469166148,https://leetcode.com/problems/is-subsequence,"Two Pointers, String, Dynamic Programming"
MEDIUM,Reorganize String,72.2,0.5606359117865866,https://leetcode.com/problems/reorganize-string,"Hash Table, String, Greedy, Sorting, Heap (Priority Queue), Counting"
HARD,Design Search Autocomplete System,70.8,0.4934728097544168,https://leetcode.com/problems/design-search-autocomplete-system,"String, Depth-First Search, Design, Trie, Sorting, Heap (Priority Queue), Data Stream"
MEDIUM,Longest Word in Dictionary,69.2,0.5334940105085371,https://leetcode.com/problems/longest-word-in-dictionary,"Array, Hash Table, String, Trie, Sorting"
HARD,Find Median Given Frequency of Numbers,65.7,0.42557605778083224,https://leetcode.com/problems/find-median-given-frequency-of-numbers,Database
MEDIUM,Jump Game III,63.6,0.6593806337689498,https://leetcode.com/problems/jump-game-iii,"Array, Depth-First Search, Breadth-First Search"
HARD,Find K-th Smallest Pair Distance,61.4,0.4570990949825384,https://leetcode.com/problems/find-k-th-smallest-pair-distance,"Array, Two Pointers, Binary Search, Sorting"
MEDIUM,Sparse Matrix Multiplication,61.4,0.6887479345099768,https://leetcode.com/problems/sparse-matrix-multiplication,"Array, Hash Table, Matrix"
MEDIUM,Coin Change,58.8,0.462335858547735,https://leetcode.com/problems/coin-change,"Array, Dynamic Programming, Breadth-First Search"
MEDIUM,Unique Paths II,55.8,0.4300228106012234,https://leetcode.com/problems/unique-paths-ii,"Array, Dynamic Programming, Matrix"
HARD,Meeting Rooms III,55.8,0.43910549557619466,https://leetcode.com/problems/meeting-rooms-iii,"Array, Hash Table, Sorting, Heap (Priority Queue), Simulation"
MEDIUM,String Compression,55.8,0.5782708131779474,https://leetcode.com/problems/string-compression,"Two Pointers, String"
MEDIUM,Target Sum,52.3,0.5058048033710961,https://leetcode.com/problems/target-sum,"Array, Dynamic Programming, Backtracking"
HARD,Unique Paths III,52.3,0.8227939556172084,https://leetcode.com/problems/unique-paths-iii,"Array, Backtracking, Bit Manipulation, Matrix"
MEDIUM,The Number of Weak Characters in the Game,48.0,0.4418399606017761,https://leetcode.com/problems/the-number-of-weak-characters-in-the-game,"Array, Stack, Greedy, Sorting, Monotonic Stack"
HARD,Employee Free Time,48.0,0.7256101053447828,https://leetcode.com/problems/employee-free-time,"Array, Line Sweep, Sorting, Heap (Priority Queue)"
MEDIUM,Minimize Result by Adding Parentheses to Expression,48.0,0.6744976645200521,https://leetcode.com/problems/minimize-result-by-adding-parentheses-to-expression,"String, Enumeration"
MEDIUM,Is Graph Bipartite?,48.0,0.5749742646610055,https://leetcode.com/problems/is-graph-bipartite,"Depth-First Search, Breadth-First Search, Union Find, Graph"
MEDIUM,Accounts Merge,42.5,0.5928264185177742,https://leetcode.com/problems/accounts-merge,"Array, Hash Table, String, Depth-First Search, Breadth-First Search, Union Find, Sorting"
MEDIUM,Top K Frequent Elements,42.5,0.6438794665624967,https://leetcode.com/problems/top-k-frequent-elements,"Array, Hash Table, Divide and Conquer, Sorting, Heap (Priority Queue), Bucket Sort, Counting, Quickselect"
MEDIUM,Multiply Strings,42.5,0.4214940307686939,https://leetcode.com/problems/multiply-strings,"Math, String, Simulation"
MEDIUM,Letter Combinations of a Phone Number,42.5,0.6359896668789957,https://leetcode.com/problems/letter-combinations-of-a-phone-number,"Hash Table, String, Backtracking"
MEDIUM,Possible Bipartition,42.5,0.5140137251528344,https://leetcode.com/problems/possible-bipartition,"Depth-First Search, Breadth-First Search, Union Find, Graph"
MEDIUM,Single Element in a Sorted Array,42.5,0.5919301194843081,https://leetcode.com/problems/single-element-in-a-sorted-array,"Array, Binary Search"
MEDIUM,Meeting Rooms II,42.5,0.5207959142627572,https://leetcode.com/problems/meeting-rooms-ii,"Array, Two Pointers, Greedy, Sorting, Heap (Priority Queue), Prefix Sum"
MEDIUM,Snakes and Ladders,34.8,0.44130736912161694,https://leetcode.com/problems/snakes-and-ladders,"Array, Breadth-First Search, Matrix"
HARD,Shortest Path to Get All Keys,34.8,0.5365080375616743,https://leetcode.com/problems/shortest-path-to-get-all-keys,"Array, Bit Manipulation, Breadth-First Search, Matrix"
MEDIUM,The Maze,34.8,0.5935210753679029,https://leetcode.com/problems/the-maze,"Array, Depth-First Search, Breadth-First Search, Matrix"
MEDIUM,Find the Celebrity,34.8,0.48368623313992914,https://leetcode.com/problems/find-the-celebrity,"Two Pointers, Graph, Interactive"
MEDIUM,Find First and Last Position of Element in Sorted Array,34.8,0.4656730273227217,https://leetcode.com/problems/find-first-and-last-position-of-element-in-sorted-array,"Array, Binary Search"
MEDIUM,Implement Trie (Prefix Tree),34.8,0.6770010503464688,https://leetcode.com/problems/implement-trie-prefix-tree,"Hash Table, String, Design, Trie"
MEDIUM,Number of Islands,34.8,0.6206903899541099,https://leetcode.com/problems/number-of-islands,"Array, Depth-First Search, Breadth-First Search, Union Find, Matrix"
HARD,Merge k Sorted Lists,34.8,0.5644308519296859,https://leetcode.com/problems/merge-k-sorted-lists,"Linked List, Divide and Conquer, Heap (Priority Queue), Merge Sort"
MEDIUM,Merge Intervals,34.8,0.49193396486169205,https://leetcode.com/problems/merge-intervals,"Array, Sorting"
MEDIUM,Candy Crush,34.8,0.7732019184745978,https://leetcode.com/problems/candy-crush,"Array, Two Pointers, Matrix, Simulation"
MEDIUM,Dot Product of Two Sparse Vectors,34.8,0.8994958226012963,https://leetcode.com/problems/dot-product-of-two-sparse-vectors,"Array, Hash Table, Two Pointers, Design"
HARD,Sudoku Solver,34.8,0.6375730253064579,https://leetcode.com/problems/sudoku-solver,"Array, Hash Table, Backtracking, Matrix"
MEDIUM,Combination Sum,34.8,0.7439598085959535,https://leetcode.com/problems/combination-sum,"Array, Backtracking"
