Difficulty,Title,Frequency,Acceptance Rate,Link,Topics
MEDIUM,Count and Say,100.0,0.5771776324783046,https://leetcode.com/problems/count-and-say,String
HARD,Shortest Path in a Grid with Obstacles Elimination,91.6,0.45462147748430054,https://leetcode.com/problems/shortest-path-in-a-grid-with-obstacles-elimination,"Array, Breadth-First Search, Matrix"
HARD,Maximum Profit in Job Scheduling,88.9,0.5434907675212194,https://leetcode.com/problems/maximum-profit-in-job-scheduling,"Array, Binary Search, Dynamic Programming, Sorting"
HARD,Count Subarrays With Score Less Than K,87.1,0.5554605117616694,https://leetcode.com/problems/count-subarrays-with-score-less-than-k,"Array, Binary Search, Sliding Window, Prefix Sum"
HARD,Optimal Account Balancing,81.2,0.49684325288666437,https://leetcode.com/problems/optimal-account-balancing,"Array, Dynamic Programming, Backtracking, Bit Manipulation, Bitmask"
HARD,Find Median from Data Stream,76.3,0.5287633955775234,https://leetcode.com/problems/find-median-from-data-stream,"Two Pointers, Design, Sorting, Heap (Priority Queue), Data Stream"
MEDIUM,Shortest Way to Form String,76.3,0.6073145518856174,https://leetcode.com/problems/shortest-way-to-form-string,"Two Pointers, String, Binary Search, Greedy"
EASY,Is Subsequence,75.1,0.48182258834019487,https://leetcode.com/problems/is-subsequence,"Two Pointers, String, Dynamic Programming"
HARD,Reconstruct Itinerary,75.1,0.43408538198169067,https://leetcode.com/problems/reconstruct-itinerary,"Depth-First Search, Graph, Eulerian Circuit"
MEDIUM,Reorganize String,73.9,0.5568969138344085,https://leetcode.com/problems/reorganize-string,"Hash Table, String, Greedy, Sorting, Heap (Priority Queue), Counting"
HARD,Expression Add Operators,71.2,0.40963443149630246,https://leetcode.com/problems/expression-add-operators,"Math, String, Backtracking"
MEDIUM,Longest Word in Dictionary,69.6,0.5311859602530627,https://leetcode.com/problems/longest-word-in-dictionary,"Array, Hash Table, String, Trie, Sorting"
MEDIUM,Jump Game III,69.6,0.6570531735210924,https://leetcode.com/problems/jump-game-iii,"Array, Depth-First Search, Breadth-First Search"
HARD,Find K-th Smallest Pair Distance,68.0,0.45568761255756896,https://leetcode.com/problems/find-k-th-smallest-pair-distance,"Array, Two Pointers, Binary Search, Sorting"
HARD,Design Search Autocomplete System,66.2,0.4923760746057881,https://leetcode.com/problems/design-search-autocomplete-system,"String, Depth-First Search, Design, Trie, Sorting, Heap (Priority Queue), Data Stream"
HARD,Find Median Given Frequency of Numbers,66.2,0.424971209727095,https://leetcode.com/problems/find-median-given-frequency-of-numbers,Database
MEDIUM,String Compression,59.4,0.570725602777312,https://leetcode.com/problems/string-compression,"Two Pointers, String"
HARD,Unique Paths III,59.4,0.8215314829618338,https://leetcode.com/problems/unique-paths-iii,"Array, Backtracking, Bit Manipulation, Matrix"
MEDIUM,Sparse Matrix Multiplication,59.4,0.6849518893557328,https://leetcode.com/problems/sparse-matrix-multiplication,"Array, Hash Table, Matrix"
MEDIUM,Unique Paths II,56.5,0.42692052092904975,https://leetcode.com/problems/unique-paths-ii,"Array, Dynamic Programming, Matrix"
MEDIUM,Coin Change,53.0,0.4567927846377717,https://leetcode.com/problems/coin-change,"Array, Dynamic Programming, Breadth-First Search"
HARD,Meeting Rooms III,53.0,0.43990476947325197,https://leetcode.com/problems/meeting-rooms-iii,"Array, Hash Table, Sorting, Heap (Priority Queue), Simulation"
HARD,Employee Free Time,48.8,0.7247389119411948,https://leetcode.com/problems/employee-free-time,"Array, Sorting, Heap (Priority Queue)"
MEDIUM,The Number of Weak Characters in the Game,48.8,0.4413562146355668,https://leetcode.com/problems/the-number-of-weak-characters-in-the-game,"Array, Stack, Greedy, Sorting, Monotonic Stack"
MEDIUM,Minimize Result by Adding Parentheses to Expression,48.8,0.6806345318286531,https://leetcode.com/problems/minimize-result-by-adding-parentheses-to-expression,"String, Enumeration"
MEDIUM,Is Graph Bipartite?,48.8,0.5710832331065312,https://leetcode.com/problems/is-graph-bipartite,"Depth-First Search, Breadth-First Search, Union Find, Graph"
HARD,Bus Routes,43.3,0.4707718571405178,https://leetcode.com/problems/bus-routes,"Array, Hash Table, Breadth-First Search"
MEDIUM,Possible Bipartition,43.3,0.511184167828537,https://leetcode.com/problems/possible-bipartition,"Depth-First Search, Breadth-First Search, Union Find, Graph"
MEDIUM,Top K Frequent Elements,43.3,0.6397485394989442,https://leetcode.com/problems/top-k-frequent-elements,"Array, Hash Table, Divide and Conquer, Sorting, Heap (Priority Queue), Bucket Sort, Counting, Quickselect"
MEDIUM,Letter Combinations of a Phone Number,43.3,0.6290669025952582,https://leetcode.com/problems/letter-combinations-of-a-phone-number,"Hash Table, String, Backtracking"
MEDIUM,Single Element in a Sorted Array,43.3,0.5915262222108703,https://leetcode.com/problems/single-element-in-a-sorted-array,"Array, Binary Search"
MEDIUM,Meeting Rooms II,43.3,0.5187228641488287,https://leetcode.com/problems/meeting-rooms-ii,"Array, Two Pointers, Greedy, Sorting, Heap (Priority Queue), Prefix Sum"
HARD,Smallest Range Covering Elements from K Lists,35.7,0.6980393606084836,https://leetcode.com/problems/smallest-range-covering-elements-from-k-lists,"Array, Hash Table, Greedy, Sliding Window, Sorting, Heap (Priority Queue)"
HARD,Shortest Path to Get All Keys,35.7,0.53636523931116,https://leetcode.com/problems/shortest-path-to-get-all-keys,"Array, Bit Manipulation, Breadth-First Search, Matrix"
MEDIUM,Snakes and Ladders,35.7,0.43946342603767347,https://leetcode.com/problems/snakes-and-ladders,"Array, Breadth-First Search, Matrix"
EASY,Ransom Note,35.7,0.6375929528300226,https://leetcode.com/problems/ransom-note,"Hash Table, String, Counting"
MEDIUM,Implement Trie (Prefix Tree),35.7,0.6731794076570735,https://leetcode.com/problems/implement-trie-prefix-tree,"Hash Table, String, Design, Trie"
MEDIUM,Multiply Strings,35.7,0.41714654633368925,https://leetcode.com/problems/multiply-strings,"Math, String, Simulation"
MEDIUM,The Maze,35.7,0.5904783521534358,https://leetcode.com/problems/the-maze,"Array, Depth-First Search, Breadth-First Search, Matrix"
MEDIUM,Find the Celebrity,35.7,0.48128661101573866,https://leetcode.com/problems/find-the-celebrity,"Two Pointers, Graph, Interactive"
MEDIUM,Find First and Last Position of Element in Sorted Array,35.7,0.46018513807741457,https://leetcode.com/problems/find-first-and-last-position-of-element-in-sorted-array,"Array, Binary Search"
MEDIUM,Merge Intervals,35.7,0.48695116800491095,https://leetcode.com/problems/merge-intervals,"Array, Sorting"
HARD,Sudoku Solver,35.7,0.6364567436738017,https://leetcode.com/problems/sudoku-solver,"Array, Hash Table, Backtracking, Matrix"
MEDIUM,Number of Islands,35.7,0.6142362012419696,https://leetcode.com/problems/number-of-islands,"Array, Depth-First Search, Breadth-First Search, Union Find, Matrix"
HARD,Merge k Sorted Lists,35.7,0.5556694649971542,https://leetcode.com/problems/merge-k-sorted-lists,"Linked List, Divide and Conquer, Heap (Priority Queue), Merge Sort"
