Difficulty,Title,Frequency,Acceptance Rate,Link,Topics
HARD,Reverse Nodes in k-Group,100.0,0.6268035775014723,https://leetcode.com/problems/reverse-nodes-in-k-group,"Linked List, Recursion"
EASY,Maximum Depth of Binary Tree,100.0,0.7700152381980216,https://leetcode.com/problems/maximum-depth-of-binary-tree,"Tree, Depth-First Search, Breadth-First Search, Binary Tree"
MEDIUM,Restore IP Addresses,88.1,0.5287294532809786,https://leetcode.com/problems/restore-ip-addresses,"String, Backtracking"
MEDIUM,LRU Cache,88.1,0.4493692731471758,https://leetcode.com/problems/lru-cache,"Hash Table, Linked List, Design, Doubly-Linked List"
MEDIUM,Path Sum II,88.1,0.6031495591515351,https://leetcode.com/problems/path-sum-ii,"Backtracking, Tree, Depth-First Search, Binary Tree"
MEDIUM,Search in Rotated Sorted Array,88.1,0.42648704966434975,https://leetcode.com/problems/search-in-rotated-sorted-array,"Array, Binary Search"
