Difficulty,Title,Frequency,Acceptance Rate,Link,Topics
HARD,Max Points on a Line,100.0,0.2895514653845652,https://leetcode.com/problems/max-points-on-a-line,"Array, Hash Table, Math, Geometry"
MEDIUM,Meeting Rooms II,78.4,0.5214175430894478,https://leetcode.com/problems/meeting-rooms-ii,"Array, Two Pointers, Greedy, Sorting, Heap (Priority Queue), Prefix Sum"
MEDIUM,Minimum Knight Moves,72.3,0.41329156777804593,https://leetcode.com/problems/minimum-knight-moves,Breadth-First Search
MEDIUM,Divide Array in Sets of K Consecutive Numbers,63.7,0.5870948276310519,https://leetcode.com/problems/divide-array-in-sets-of-k-consecutive-numbers,"Array, Hash Table, Greedy, Sorting"
HARD,Shortest Distance from All Buildings,63.7,0.44372719436396985,https://leetcode.com/problems/shortest-distance-from-all-buildings,"Array, Breadth-First Search, Matrix"
MEDIUM,Find Peak Element,63.7,0.4650924527395896,https://leetcode.com/problems/find-peak-element,"Array, Binary Search"
