Difficulty,Title,Frequency,Acceptance Rate,Link,Topics
HARD,Max Points on a Line,100.0,0.28776474860230267,https://leetcode.com/problems/max-points-on-a-line,"Array, Hash Table, Math, Geometry"
MEDIUM,Minimum Knight Moves,72.6,0.41261960578782236,https://leetcode.com/problems/minimum-knight-moves,Breadth-First Search
MEDIUM,Divide Array in Sets of K Consecutive Numbers,64.1,0.5861106993880619,https://leetcode.com/problems/divide-array-in-sets-of-k-consecutive-numbers,"Array, Hash Table, Greedy, Sorting"
HARD,Shortest Distance from All Buildings,64.1,0.4424767564124379,https://leetcode.com/problems/shortest-distance-from-all-buildings,"Array, Breadth-First Search, Matrix"
MEDIUM,Find Peak Element,64.1,0.46464960285720514,https://leetcode.com/problems/find-peak-element,"Array, Binary Search"
