Difficulty,Title,Frequency,Acceptance Rate,Link,Topics
MEDIUM,Sum of Even Numbers After Queries,100.0,0.6839814711046359,https://leetcode.com/problems/sum-of-even-numbers-after-queries,"Array, Simulation"
EASY,Binary Tree Tilt,100.0,0.6364276921083323,https://leetcode.com/problems/binary-tree-tilt,"Tree, Depth-First Search, Binary Tree"
HARD,Minimum Cost to Split an Array,97.9,0.4174622775050447,https://leetcode.com/problems/minimum-cost-to-split-an-array,"Array, Hash Table, Dynamic Programming, Counting"
MEDIUM,Find Players With Zero or One Losses,97.9,0.7275054507873652,https://leetcode.com/problems/find-players-with-zero-or-one-losses,"Array, Hash Table, Sorting, Counting"
MEDIUM,Minimum Moves to Equal Array Elements,97.9,0.5753190290849056,https://leetcode.com/problems/minimum-moves-to-equal-array-elements,"Array, Math"
HARD,Merge k Sorted Lists,71.3,0.5594078722006711,https://leetcode.com/problems/merge-k-sorted-lists,"Linked List, Divide and Conquer, Heap (Priority Queue), Merge Sort"
EASY,Check if Every Row and Column Contains All Numbers,71.3,0.5254735911301568,https://leetcode.com/problems/check-if-every-row-and-column-contains-all-numbers,"Array, Hash Table, Matrix"
