Difficulty,Title,Frequency,Acceptance Rate,Link,Topics
MEDIUM,LRU Cache,100.0,0.45214558519032444,https://leetcode.com/problems/lru-cache,"Hash Table, Linked List, Design, Doubly-Linked List"
EASY,Best Time to Buy and Sell Stock,92.9,0.5525965778870825,https://leetcode.com/problems/best-time-to-buy-and-sell-stock,"Array, Dynamic Programming"
MEDIUM,Top K Frequent Elements,88.4,0.6456596824026228,https://leetcode.com/problems/top-k-frequent-elements,"Array, Hash Table, Divide and Conquer, Sorting, Heap (Priority Queue), Bucket Sort, Counting, Quickselect"
MEDIUM,Best Time to Buy and Sell Stock II,82.9,0.6950025067480458,https://leetcode.com/problems/best-time-to-buy-and-sell-stock-ii,"Array, Dynamic Programming, Greedy"
EASY,Longest Common Prefix,75.9,0.4548305595040032,https://leetcode.com/problems/longest-common-prefix,"String, Trie"
MEDIUM,Maximum Subarray,65.9,0.520997876367211,https://leetcode.com/problems/maximum-subarray,"Array, Divide and Conquer, Dynamic Programming"
HARD,Best Time to Buy and Sell Stock III,65.9,0.5112087693447603,https://leetcode.com/problems/best-time-to-buy-and-sell-stock-iii,"Array, Dynamic Programming"
MEDIUM,Kth Largest Element in an Array,65.9,0.6797700833982673,https://leetcode.com/problems/kth-largest-element-in-an-array,"Array, Divide and Conquer, Sorting, Heap (Priority Queue), Quickselect"
HARD,Merge k Sorted Lists,65.9,0.567741907864408,https://leetcode.com/problems/merge-k-sorted-lists,"Linked List, Divide and Conquer, Heap (Priority Queue), Merge Sort"
MEDIUM,Number of Islands,65.9,0.623199409488447,https://leetcode.com/problems/number-of-islands,"Array, Depth-First Search, Breadth-First Search, Union Find, Matrix"
MEDIUM,Rotate Image,65.9,0.7790164518819447,https://leetcode.com/problems/rotate-image,"Array, Math, Matrix"
HARD,Best Time to Buy and Sell Stock IV,65.9,0.47086154391046825,https://leetcode.com/problems/best-time-to-buy-and-sell-stock-iv,"Array, Dynamic Programming"
MEDIUM,Merge Intervals,65.9,0.4939527547797844,https://leetcode.com/problems/merge-intervals,"Array, Sorting"
EASY,Valid Parentheses,65.9,0.4232282567926559,https://leetcode.com/problems/valid-parentheses,"String, Stack"
