Difficulty,Title,Frequency,Acceptance Rate,Link,Topics
MEDIUM,LRU Cache,100.0,0.45214558519032444,https://leetcode.com/problems/lru-cache,"Hash Table, Linked List, Design, Doubly-Linked List"
EASY,Best Time to Buy and Sell Stock,88.4,0.552596530667317,https://leetcode.com/problems/best-time-to-buy-and-sell-stock,"Array, Dynamic Programming"
MEDIUM,Top K Frequent Elements,81.7,0.6456597620808515,https://leetcode.com/problems/top-k-frequent-elements,"Array, Hash Table, Divide and Conquer, Sorting, Heap (Priority Queue), Bucket Sort, Counting, Quickselect"
MEDIUM,Word Break,78.3,0.4827377619034214,https://leetcode.com/problems/word-break,"Array, Hash Table, String, Dynamic Programming, Trie, Memoization"
EASY,Two Sum,74.2,0.5577699666639316,https://leetcode.com/problems/two-sum,"Array, Hash Table"
MEDIUM,Merge Intervals,74.2,0.4939527547797844,https://leetcode.com/problems/merge-intervals,"Array, Sorting"
MEDIUM,Calculate Score After Performing Instructions,74.2,0.5556368843981223,https://leetcode.com/problems/calculate-score-after-performing-instructions,"Array, Hash Table, String, Simulation"
MEDIUM,Min Stack,74.2,0.5644508432974008,https://leetcode.com/problems/min-stack,"Stack, Design"
MEDIUM,Valid Sudoku,74.2,0.6227675793740958,https://leetcode.com/problems/valid-sudoku,"Array, Hash Table, Matrix"
HARD,Find Servers That Handled Most Number of Requests,74.2,0.4407547923322684,https://leetcode.com/problems/find-servers-that-handled-most-number-of-requests,"Array, Greedy, Heap (Priority Queue), Ordered Set"
MEDIUM,Group Anagrams,71.9,0.7092882244410338,https://leetcode.com/problems/group-anagrams,"Array, Hash Table, String, Sorting"
MEDIUM,Rotate Array,71.9,0.43021372799993496,https://leetcode.com/problems/rotate-array,"Array, Math, Two Pointers"
MEDIUM,Number of Islands,71.9,0.623199409488447,https://leetcode.com/problems/number-of-islands,"Array, Depth-First Search, Breadth-First Search, Union Find, Matrix"
MEDIUM,Best Time to Buy and Sell Stock II,71.9,0.6950025067480458,https://leetcode.com/problems/best-time-to-buy-and-sell-stock-ii,"Array, Dynamic Programming, Greedy"
EASY,Valid Palindrome,71.9,0.5096357226652383,https://leetcode.com/problems/valid-palindrome,"Two Pointers, String"
EASY,Longest Common Prefix,71.9,0.4548305143026601,https://leetcode.com/problems/longest-common-prefix,"String, Trie"
MEDIUM,Spiral Matrix,69.3,0.5393973501075863,https://leetcode.com/problems/spiral-matrix,"Array, Matrix, Simulation"
MEDIUM,Kth Largest Element in an Array,69.3,0.6797700833982673,https://leetcode.com/problems/kth-largest-element-in-an-array,"Array, Divide and Conquer, Sorting, Heap (Priority Queue), Quickselect"
EASY,First Unique Character in a String,69.3,0.6369545656040947,https://leetcode.com/problems/first-unique-character-in-a-string,"Hash Table, String, Queue, Counting"
MEDIUM,Design Circular Queue,66.3,0.5264418953615425,https://leetcode.com/problems/design-circular-queue,"Array, Linked List, Design, Queue"
EASY,Merge Sorted Array,66.3,0.5291951450619177,https://leetcode.com/problems/merge-sorted-array,"Array, Two Pointers, Sorting"
MEDIUM,Best Time to Buy and Sell Stock with Transaction Fee,66.3,0.7050715532641945,https://leetcode.com/problems/best-time-to-buy-and-sell-stock-with-transaction-fee,"Array, Dynamic Programming, Greedy"
MEDIUM,Subarray Sum Equals K,66.3,0.45476203786382785,https://leetcode.com/problems/subarray-sum-equals-k,"Array, Hash Table, Prefix Sum"
MEDIUM,Design Hit Counter,62.9,0.6920824458148753,https://leetcode.com/problems/design-hit-counter,"Array, Binary Search, Design, Queue, Data Stream"
EASY,Move Zeroes,62.9,0.6280400947352507,https://leetcode.com/problems/move-zeroes,"Array, Two Pointers"
MEDIUM,Find First and Last Position of Element in Sorted Array,58.9,0.4682874104872264,https://leetcode.com/problems/find-first-and-last-position-of-element-in-sorted-array,"Array, Binary Search"
MEDIUM,Longest Substring Without Repeating Characters,58.9,0.3693617011328274,https://leetcode.com/problems/longest-substring-without-repeating-characters,"Hash Table, String, Sliding Window"
MEDIUM,Implement Trie (Prefix Tree),58.9,0.679347462282349,https://leetcode.com/problems/implement-trie-prefix-tree,"Hash Table, String, Design, Trie"
MEDIUM,Design Tic-Tac-Toe,58.9,0.5860139660881724,https://leetcode.com/problems/design-tic-tac-toe,"Array, Hash Table, Design, Matrix, Simulation"
MEDIUM,Reverse Words in a String,58.9,0.5191327244735617,https://leetcode.com/problems/reverse-words-in-a-string,"Two Pointers, String"
MEDIUM,Maximum Subarray,58.9,0.520997876367211,https://leetcode.com/problems/maximum-subarray,"Array, Divide and Conquer, Dynamic Programming"
MEDIUM,Find K Closest Elements,58.9,0.486686656754684,https://leetcode.com/problems/find-k-closest-elements,"Array, Two Pointers, Binary Search, Sliding Window, Sorting, Heap (Priority Queue)"
EASY,Reverse Linked List,58.9,0.7920654119580827,https://leetcode.com/problems/reverse-linked-list,"Linked List, Recursion"
MEDIUM,Course Schedule II,58.9,0.5342350291611208,https://leetcode.com/problems/course-schedule-ii,"Depth-First Search, Breadth-First Search, Graph, Topological Sort"
HARD,Word Ladder,54.0,0.4281180881873274,https://leetcode.com/problems/word-ladder,"Hash Table, String, Breadth-First Search"
MEDIUM,Time Based Key-Value Store,54.0,0.49366301343090024,https://leetcode.com/problems/time-based-key-value-store,"Hash Table, String, Binary Search, Design"
MEDIUM,Kth Smallest Element in a Sorted Matrix,54.0,0.6356660329525441,https://leetcode.com/problems/kth-smallest-element-in-a-sorted-matrix,"Array, Binary Search, Sorting, Heap (Priority Queue), Matrix"
MEDIUM,Flatten Nested List Iterator,54.0,0.6522839525510098,https://leetcode.com/problems/flatten-nested-list-iterator,"Stack, Tree, Depth-First Search, Design, Queue, Iterator"
HARD,Serialize and Deserialize Binary Tree,54.0,0.5896944631957644,https://leetcode.com/problems/serialize-and-deserialize-binary-tree,"String, Tree, Depth-First Search, Breadth-First Search, Design, Binary Tree"
EASY,Valid Parentheses,54.0,0.4232282567926559,https://leetcode.com/problems/valid-parentheses,"String, Stack"
MEDIUM,String Compression,54.0,0.5809154375988881,https://leetcode.com/problems/string-compression,"Two Pointers, String"
HARD,Trapping Rain Water,54.0,0.6510192988277056,https://leetcode.com/problems/trapping-rain-water,"Array, Two Pointers, Dynamic Programming, Stack, Monotonic Stack"
MEDIUM,Task Scheduler,47.7,0.6153909539748507,https://leetcode.com/problems/task-scheduler,"Array, Hash Table, Greedy, Sorting, Heap (Priority Queue), Counting"
MEDIUM,Longest Consecutive Sequence,47.7,0.47040837635488375,https://leetcode.com/problems/longest-consecutive-sequence,"Array, Hash Table, Union Find"
EASY,Flood Fill,47.7,0.6647634560753026,https://leetcode.com/problems/flood-fill,"Array, Depth-First Search, Breadth-First Search, Matrix"
MEDIUM,Compare Version Numbers,47.7,0.4234711977763999,https://leetcode.com/problems/compare-version-numbers,"Two Pointers, String"
MEDIUM,Validate IP Address,47.7,0.27817524620453365,https://leetcode.com/problems/validate-ip-address,String
MEDIUM,Product of Array Except Self,47.7,0.6777994606301018,https://leetcode.com/problems/product-of-array-except-self,"Array, Prefix Sum"
MEDIUM,Permutations,47.7,0.8066011364163758,https://leetcode.com/problems/permutations,"Array, Backtracking"
EASY,Happy Number,47.7,0.5807264910173595,https://leetcode.com/problems/happy-number,"Hash Table, Math, Two Pointers"
EASY,Design HashMap,47.7,0.6589390156242249,https://leetcode.com/problems/design-hashmap,"Array, Hash Table, Linked List, Design, Hash Function"
MEDIUM,Letter Combinations of a Phone Number,47.7,0.6385756647080152,https://leetcode.com/problems/letter-combinations-of-a-phone-number,"Hash Table, String, Backtracking"
MEDIUM,Exam Room,47.7,0.42867179364939967,https://leetcode.com/problems/exam-room,"Design, Heap (Priority Queue), Ordered Set"
MEDIUM,Course Schedule,47.7,0.49234264912256587,https://leetcode.com/problems/course-schedule,"Depth-First Search, Breadth-First Search, Graph, Topological Sort"
MEDIUM,Insert Interval,47.7,0.43473628714178475,https://leetcode.com/problems/insert-interval,Array
HARD,Merge k Sorted Lists,47.7,0.567741907864408,https://leetcode.com/problems/merge-k-sorted-lists,"Linked List, Divide and Conquer, Heap (Priority Queue), Merge Sort"
MEDIUM,Longest Palindromic Substring,47.7,0.35846111456358737,https://leetcode.com/problems/longest-palindromic-substring,"Two Pointers, String, Dynamic Programming"
MEDIUM,String to Integer (atoi),47.7,0.1922942164534482,https://leetcode.com/problems/string-to-integer-atoi,String
MEDIUM,3Sum,47.7,0.37070946435035784,https://leetcode.com/problems/3sum,"Array, Two Pointers, Sorting"
EASY,Intersection of Two Linked Lists,47.7,0.6112533936845744,https://leetcode.com/problems/intersection-of-two-linked-lists,"Hash Table, Linked List, Two Pointers"
MEDIUM,Meeting Rooms II,47.7,0.5214167237275021,https://leetcode.com/problems/meeting-rooms-ii,"Array, Two Pointers, Greedy, Sorting, Heap (Priority Queue), Prefix Sum"
EASY,Fibonacci Number,47.7,0.7294495015845286,https://leetcode.com/problems/fibonacci-number,"Math, Dynamic Programming, Recursion, Memoization"
MEDIUM,Robot Bounded In Circle,47.7,0.5622965278408281,https://leetcode.com/problems/robot-bounded-in-circle,"Math, String, Simulation"
MEDIUM,Lowest Common Ancestor of a Binary Tree,47.7,0.6675499347216417,https://leetcode.com/problems/lowest-common-ancestor-of-a-binary-tree,"Tree, Depth-First Search, Binary Tree"
EASY,Roman to Integer,47.7,0.6486627884371093,https://leetcode.com/problems/roman-to-integer,"Hash Table, Math, String"
HARD,Find Median from Data Stream,47.7,0.5327816407313548,https://leetcode.com/problems/find-median-from-data-stream,"Two Pointers, Design, Sorting, Heap (Priority Queue), Data Stream"
HARD,Best Time to Buy and Sell Stock III,47.7,0.5112087693447603,https://leetcode.com/problems/best-time-to-buy-and-sell-stock-iii,"Array, Dynamic Programming"
HARD,Integer to English Words,47.7,0.34354789501950295,https://leetcode.com/problems/integer-to-english-words,"Math, String, Recursion"
MEDIUM,Decode String,47.7,0.6115249906697672,https://leetcode.com/problems/decode-string,"String, Stack, Recursion"
MEDIUM,Generate Parentheses,47.7,0.7713286717803378,https://leetcode.com/problems/generate-parentheses,"String, Dynamic Programming, Backtracking"
EASY,Find the Index of the First Occurrence in a String,38.9,0.449716000865219,https://leetcode.com/problems/find-the-index-of-the-first-occurrence-in-a-string,"Two Pointers, String, String Matching"
HARD,Best Time to Buy and Sell Stock IV,38.9,0.47086154391046825,https://leetcode.com/problems/best-time-to-buy-and-sell-stock-iv,"Array, Dynamic Programming"
MEDIUM,Rotate Image,38.9,0.7790164518819447,https://leetcode.com/problems/rotate-image,"Array, Math, Matrix"
MEDIUM,Subarray Product Less Than K,38.9,0.5285340562664164,https://leetcode.com/problems/subarray-product-less-than-k,"Array, Binary Search, Sliding Window, Prefix Sum"
EASY,Remove Duplicates from Sorted Array,38.9,0.6035551112882038,https://leetcode.com/problems/remove-duplicates-from-sorted-array,"Array, Two Pointers"
EASY,Implement Queue using Stacks,38.9,0.6806072941218969,https://leetcode.com/problems/implement-queue-using-stacks,"Stack, Design, Queue"
EASY,Missing Number,38.9,0.7006534938999994,https://leetcode.com/problems/missing-number,"Array, Hash Table, Math, Binary Search, Bit Manipulation, Sorting"
MEDIUM,Search in Rotated Sorted Array,38.9,0.4283722138743466,https://leetcode.com/problems/search-in-rotated-sorted-array,"Array, Binary Search"
MEDIUM,Walking Robot Simulation,38.9,0.5823045930701047,https://leetcode.com/problems/walking-robot-simulation,"Array, Hash Table, Simulation"
EASY,Merge Two Sorted Lists,38.9,0.6684091757223755,https://leetcode.com/problems/merge-two-sorted-lists,"Linked List, Recursion"
EASY,Split Strings by Separator,38.9,0.7491123619831133,https://leetcode.com/problems/split-strings-by-separator,"Array, String"
EASY,Same Tree,38.9,0.6512686619125213,https://leetcode.com/problems/same-tree,"Tree, Depth-First Search, Breadth-First Search, Binary Tree"
MEDIUM,House Robber,38.9,0.5230495865734553,https://leetcode.com/problems/house-robber,"Array, Dynamic Programming"
MEDIUM,Add Two Numbers,38.9,0.4622507658063209,https://leetcode.com/problems/add-two-numbers,"Linked List, Math, Recursion"
EASY,Reverse String,38.9,0.7976436563508422,https://leetcode.com/problems/reverse-string,"Two Pointers, String"
MEDIUM,Basic Calculator II,38.9,0.4581129812287864,https://leetcode.com/problems/basic-calculator-ii,"Math, String, Stack"
MEDIUM,Cheapest Flights Within K Stops,38.9,0.40398984415199324,https://leetcode.com/problems/cheapest-flights-within-k-stops,"Dynamic Programming, Depth-First Search, Breadth-First Search, Graph, Heap (Priority Queue), Shortest Path"
HARD,Regular Expression Matching,38.9,0.29280131010169236,https://leetcode.com/problems/regular-expression-matching,"String, Dynamic Programming, Recursion"
HARD,Text Justification,38.9,0.48149935664104093,https://leetcode.com/problems/text-justification,"Array, String, Simulation"
MEDIUM,Two Sum II - Input Array Is Sorted,38.9,0.6340213036141924,https://leetcode.com/problems/two-sum-ii-input-array-is-sorted,"Array, Two Pointers, Binary Search"
EASY,Diameter of Binary Tree,38.9,0.6358636823587297,https://leetcode.com/problems/diameter-of-binary-tree,"Tree, Depth-First Search, Binary Tree"
MEDIUM,Reverse Integer,38.9,0.30308917553888653,https://leetcode.com/problems/reverse-integer,Math
HARD,Guess the Word,38.9,0.37651627943192456,https://leetcode.com/problems/guess-the-word,"Array, Math, String, Interactive, Game Theory"
MEDIUM,Gas Station,38.9,0.46383617781658143,https://leetcode.com/problems/gas-station,"Array, Greedy"
MEDIUM,Evaluate Reverse Polish Notation,38.9,0.5495024017596329,https://leetcode.com/problems/evaluate-reverse-polish-notation,"Array, Math, Stack"
MEDIUM,Find Largest Value in Each Tree Row,38.9,0.6627273661494193,https://leetcode.com/problems/find-largest-value-in-each-tree-row,"Tree, Depth-First Search, Breadth-First Search, Binary Tree"
HARD,Sliding Window Median,38.9,0.3869205915247919,https://leetcode.com/problems/sliding-window-median,"Array, Hash Table, Sliding Window, Heap (Priority Queue)"
EASY,Logger Rate Limiter,38.9,0.7661025675370229,https://leetcode.com/problems/logger-rate-limiter,"Hash Table, Design, Data Stream"
EASY,Distribute Money to Maximum Children,38.9,0.19450187647594877,https://leetcode.com/problems/distribute-money-to-maximum-children,"Math, Greedy"
