Difficulty,Title,Frequency,Acceptance Rate,Link,Topics
EASY,Two Sum,100.0,0.5577699312007911,https://leetcode.com/problems/two-sum,"Array, Hash Table"
MEDIUM,Longest Substring Without Repeating Characters,78.3,0.36936173184826904,https://leetcode.com/problems/longest-substring-without-repeating-characters,"Hash Table, String, Sliding Window"
EASY,Longest Common Prefix,77.6,0.4548305143026601,https://leetcode.com/problems/longest-common-prefix,"String, Trie"
EASY,Valid Parentheses,76.9,0.4232282567926559,https://leetcode.com/problems/valid-parentheses,"String, Stack"
HARD,Median of Two Sorted Arrays,75.8,0.43814591586025275,https://leetcode.com/problems/median-of-two-sorted-arrays,"Array, Binary Search, Divide and Conquer"
MEDIUM,Merge Intervals,74.2,0.4939527547797844,https://leetcode.com/problems/merge-intervals,"Array, Sorting"
MEDIUM,Group Anagrams,74.2,0.7092882244410338,https://leetcode.com/problems/group-anagrams,"Array, Hash Table, String, Sorting"
EASY,Merge Sorted Array,73.8,0.5291951450619177,https://leetcode.com/problems/merge-sorted-array,"Array, Two Pointers, Sorting"
HARD,Trapping Rain Water,73.0,0.6510193782985645,https://leetcode.com/problems/trapping-rain-water,"Array, Two Pointers, Dynamic Programming, Stack, Monotonic Stack"
MEDIUM,Reverse Integer,71.6,0.30308917553888653,https://leetcode.com/problems/reverse-integer,Math
MEDIUM,Valid Sudoku,71.6,0.6227675793740958,https://leetcode.com/problems/valid-sudoku,"Array, Hash Table, Matrix"
EASY,Climbing Stairs,70.1,0.5354071840932856,https://leetcode.com/problems/climbing-stairs,"Math, Dynamic Programming, Memoization"
MEDIUM,Longest Palindromic Substring,68.5,0.35846108158592566,https://leetcode.com/problems/longest-palindromic-substring,"Two Pointers, String, Dynamic Programming"
EASY,Palindrome Number,68.0,0.5922454522673172,https://leetcode.com/problems/palindrome-number,Math
MEDIUM,Rotate Image,67.4,0.7790164518819447,https://leetcode.com/problems/rotate-image,"Array, Math, Matrix"
MEDIUM,Spiral Matrix,67.4,0.5393973501075863,https://leetcode.com/problems/spiral-matrix,"Array, Matrix, Simulation"
MEDIUM,Add Two Numbers,66.8,0.4622507658063209,https://leetcode.com/problems/add-two-numbers,"Linked List, Math, Recursion"
MEDIUM,3Sum,66.8,0.37070946435035784,https://leetcode.com/problems/3sum,"Array, Two Pointers, Sorting"
EASY,Roman to Integer,66.2,0.6486627884371093,https://leetcode.com/problems/roman-to-integer,"Hash Table, Math, String"
EASY,Remove Duplicates from Sorted Array,65.5,0.6035551112882038,https://leetcode.com/problems/remove-duplicates-from-sorted-array,"Array, Two Pointers"
MEDIUM,Search in Rotated Sorted Array,64.2,0.4283722138743466,https://leetcode.com/problems/search-in-rotated-sorted-array,"Array, Binary Search"
EASY,Sqrt(x),63.5,0.4037178718652037,https://leetcode.com/problems/sqrtx,"Math, Binary Search"
MEDIUM,Maximum Subarray,63.5,0.520997876367211,https://leetcode.com/problems/maximum-subarray,"Array, Divide and Conquer, Dynamic Programming"
EASY,Merge Two Sorted Lists,62.7,0.6684090913680062,https://leetcode.com/problems/merge-two-sorted-lists,"Linked List, Recursion"
MEDIUM,Generate Parentheses,61.2,0.7713286717803378,https://leetcode.com/problems/generate-parentheses,"String, Dynamic Programming, Backtracking"
HARD,Merge k Sorted Lists,61.2,0.567741907864408,https://leetcode.com/problems/merge-k-sorted-lists,"Linked List, Divide and Conquer, Heap (Priority Queue), Merge Sort"
MEDIUM,Container With Most Water,60.4,0.5778282574410597,https://leetcode.com/problems/container-with-most-water,"Array, Two Pointers, Greedy"
EASY,Find the Index of the First Occurrence in a String,58.6,0.449716000865219,https://leetcode.com/problems/find-the-index-of-the-first-occurrence-in-a-string,"Two Pointers, String, String Matching"
EASY,Remove Element,56.7,0.600316358048653,https://leetcode.com/problems/remove-element,"Array, Two Pointers"
EASY,Search Insert Position,55.6,0.4901242285525163,https://leetcode.com/problems/search-insert-position,"Array, Binary Search"
MEDIUM,Letter Combinations of a Phone Number,55.6,0.6385756647080152,https://leetcode.com/problems/letter-combinations-of-a-phone-number,"Hash Table, String, Backtracking"
HARD,Regular Expression Matching,53.3,0.2928012366939696,https://leetcode.com/problems/regular-expression-matching,"String, Dynamic Programming, Recursion"
MEDIUM,Remove Nth Node From End of List,53.3,0.4896103765491196,https://leetcode.com/problems/remove-nth-node-from-end-of-list,"Linked List, Two Pointers"
MEDIUM,Insert Interval,52.1,0.43473628714178475,https://leetcode.com/problems/insert-interval,Array
HARD,Largest Rectangle in Histogram,52.1,0.4737765317407914,https://leetcode.com/problems/largest-rectangle-in-histogram,"Array, Stack, Monotonic Stack"
EASY,Add Binary,52.1,0.5567701348180015,https://leetcode.com/problems/add-binary,"Math, String, Bit Manipulation, Simulation"
MEDIUM,Permutations,52.1,0.8066011364163758,https://leetcode.com/problems/permutations,"Array, Backtracking"
EASY,Maximum Depth of Binary Tree,52.1,0.7713813958630182,https://leetcode.com/problems/maximum-depth-of-binary-tree,"Tree, Depth-First Search, Breadth-First Search, Binary Tree"
MEDIUM,Binary Tree Level Order Traversal,52.1,0.7059658947038693,https://leetcode.com/problems/binary-tree-level-order-traversal,"Tree, Breadth-First Search, Binary Tree"
MEDIUM,Find First and Last Position of Element in Sorted Array,52.1,0.4682874104872264,https://leetcode.com/problems/find-first-and-last-position-of-element-in-sorted-array,"Array, Binary Search"
MEDIUM,Next Permutation,50.8,0.4305772664998175,https://leetcode.com/problems/next-permutation,"Array, Two Pointers"
MEDIUM,Combination Sum,47.8,0.7467468656021409,https://leetcode.com/problems/combination-sum,"Array, Backtracking"
MEDIUM,Sort Colors,47.8,0.6758312948649591,https://leetcode.com/problems/sort-colors,"Array, Two Pointers, Sorting"
MEDIUM,Jump Game,47.8,0.39479197867291327,https://leetcode.com/problems/jump-game,"Array, Dynamic Programming, Greedy"
MEDIUM,4Sum,46.1,0.38219020113793045,https://leetcode.com/problems/4sum,"Array, Two Pointers, Sorting"
EASY,Symmetric Tree,46.1,0.5927867908424697,https://leetcode.com/problems/symmetric-tree,"Tree, Depth-First Search, Breadth-First Search, Binary Tree"
MEDIUM,String to Integer (atoi),46.1,0.1922942164534482,https://leetcode.com/problems/string-to-integer-atoi,String
MEDIUM,Validate Binary Search Tree,46.1,0.34380387886661157,https://leetcode.com/problems/validate-binary-search-tree,"Tree, Depth-First Search, Binary Search Tree, Binary Tree"
HARD,First Missing Positive,46.1,0.4108465766394882,https://leetcode.com/problems/first-missing-positive,"Array, Hash Table"
MEDIUM,"Pow(x, n)",44.3,0.3702318641045828,https://leetcode.com/problems/powx-n,"Math, Recursion"
EASY,Plus One,44.3,0.47547621095134496,https://leetcode.com/problems/plus-one,"Array, Math"
MEDIUM,Interleaving String,44.3,0.4217918033968859,https://leetcode.com/problems/interleaving-string,"String, Dynamic Programming"
MEDIUM,Jump Game II,44.3,0.4150331235291809,https://leetcode.com/problems/jump-game-ii,"Array, Dynamic Programming, Greedy"
MEDIUM,Word Search,42.2,0.45266926269047814,https://leetcode.com/problems/word-search,"Array, String, Backtracking, Depth-First Search, Matrix"
MEDIUM,Search a 2D Matrix,42.2,0.5228957258337302,https://leetcode.com/problems/search-a-2d-matrix,"Array, Binary Search, Matrix"
MEDIUM,Reverse Linked List II,42.2,0.49591736647057,https://leetcode.com/problems/reverse-linked-list-ii,Linked List
MEDIUM,Divide Two Integers,42.2,0.18396975085033054,https://leetcode.com/problems/divide-two-integers,"Math, Bit Manipulation"
EASY,Binary Tree Inorder Traversal,42.2,0.7858399541084903,https://leetcode.com/problems/binary-tree-inorder-traversal,"Stack, Tree, Depth-First Search, Binary Tree"
HARD,Wildcard Matching,42.2,0.2989833857244126,https://leetcode.com/problems/wildcard-matching,"String, Dynamic Programming, Greedy, Recursion"
EASY,Balanced Binary Tree,40.0,0.5534204897752865,https://leetcode.com/problems/balanced-binary-tree,"Tree, Depth-First Search, Binary Tree"
MEDIUM,Set Matrix Zeroes,40.0,0.6070884347201074,https://leetcode.com/problems/set-matrix-zeroes,"Array, Hash Table, Matrix"
MEDIUM,Count and Say,40.0,0.6050656775612677,https://leetcode.com/problems/count-and-say,String
EASY,Remove Duplicates from Sorted List,37.4,0.5487080353115535,https://leetcode.com/problems/remove-duplicates-from-sorted-list,Linked List
HARD,N-Queens,37.4,0.7281704967757537,https://leetcode.com/problems/n-queens,"Array, Backtracking"
MEDIUM,Swap Nodes in Pairs,37.4,0.6720136828647639,https://leetcode.com/problems/swap-nodes-in-pairs,"Linked List, Recursion"
HARD,Text Justification,37.4,0.48149935664104093,https://leetcode.com/problems/text-justification,"Array, String, Simulation"
MEDIUM,Simplify Path,37.4,0.4785432317744196,https://leetcode.com/problems/simplify-path,"String, Stack"
MEDIUM,Subsets,37.4,0.808795565390318,https://leetcode.com/problems/subsets,"Array, Backtracking, Bit Manipulation"
HARD,Minimum Window Substring,37.4,0.45350747638232236,https://leetcode.com/problems/minimum-window-substring,"Hash Table, String, Sliding Window"
MEDIUM,Zigzag Conversion,34.5,0.5160676713980508,https://leetcode.com/problems/zigzag-conversion,String
MEDIUM,Decode Ways,34.5,0.36530991972040927,https://leetcode.com/problems/decode-ways,"String, Dynamic Programming"
MEDIUM,Minimum Path Sum,34.5,0.664814934885504,https://leetcode.com/problems/minimum-path-sum,"Array, Dynamic Programming, Matrix"
MEDIUM,Integer to Roman,34.5,0.6861928580376627,https://leetcode.com/problems/integer-to-roman,"Hash Table, Math, String"
HARD,Reverse Nodes in k-Group,34.5,0.6304374335039493,https://leetcode.com/problems/reverse-nodes-in-k-group,"Linked List, Recursion"
MEDIUM,Rotate List,34.5,0.3994476047394924,https://leetcode.com/problems/rotate-list,"Linked List, Two Pointers"
MEDIUM,Partition List,31.1,0.5898677373641946,https://leetcode.com/problems/partition-list,"Linked List, Two Pointers"
EASY,Convert Sorted Array to Binary Search Tree,31.1,0.7407934506434607,https://leetcode.com/problems/convert-sorted-array-to-binary-search-tree,"Array, Divide and Conquer, Tree, Binary Search Tree, Binary Tree"
MEDIUM,Combinations,31.1,0.7289648238875795,https://leetcode.com/problems/combinations,Backtracking
MEDIUM,Edit Distance,27.0,0.5878976197609908,https://leetcode.com/problems/edit-distance,"String, Dynamic Programming"
HARD,Sudoku Solver,27.0,0.6390866531877745,https://leetcode.com/problems/sudoku-solver,"Array, Hash Table, Backtracking, Matrix"
EASY,Same Tree,27.0,0.6512686619125213,https://leetcode.com/problems/same-tree,"Tree, Depth-First Search, Breadth-First Search, Binary Tree"
MEDIUM,Remove Duplicates from Sorted List II,27.0,0.4989080936318432,https://leetcode.com/problems/remove-duplicates-from-sorted-list-ii,"Linked List, Two Pointers"
EASY,Length of Last Word,27.0,0.5631926999044908,https://leetcode.com/problems/length-of-last-word,String
MEDIUM,Restore IP Addresses,27.0,0.531583393083398,https://leetcode.com/problems/restore-ip-addresses,"String, Backtracking"
MEDIUM,Unique Binary Search Trees II,27.0,0.6039807221122715,https://leetcode.com/problems/unique-binary-search-trees-ii,"Dynamic Programming, Backtracking, Tree, Binary Search Tree, Binary Tree"
HARD,Maximal Rectangle,21.9,0.5370845822665518,https://leetcode.com/problems/maximal-rectangle,"Array, Dynamic Programming, Stack, Matrix, Monotonic Stack"
MEDIUM,Construct Binary Tree from Preorder and Inorder Traversal,21.9,0.6683774773521286,https://leetcode.com/problems/construct-binary-tree-from-preorder-and-inorder-traversal,"Array, Hash Table, Divide and Conquer, Tree, Binary Tree"
MEDIUM,Multiply Strings,21.9,0.4228941429852704,https://leetcode.com/problems/multiply-strings,"Math, String, Simulation"
MEDIUM,Permutations II,21.9,0.615917727605333,https://leetcode.com/problems/permutations-ii,"Array, Backtracking, Sorting"
MEDIUM,3Sum Closest,21.9,0.468869600214817,https://leetcode.com/problems/3sum-closest,"Array, Two Pointers, Sorting"
MEDIUM,Unique Paths,21.9,0.6577285437608488,https://leetcode.com/problems/unique-paths,"Math, Dynamic Programming, Combinatorics"
HARD,Valid Number,21.9,0.21563512503115395,https://leetcode.com/problems/valid-number,String
HARD,Substring with Concatenation of All Words,21.9,0.32997499702748073,https://leetcode.com/problems/substring-with-concatenation-of-all-words,"Hash Table, String, Sliding Window"
MEDIUM,Remove Duplicates from Sorted Array II,15.2,0.6290185479131098,https://leetcode.com/problems/remove-duplicates-from-sorted-array-ii,"Array, Two Pointers"
MEDIUM,Search in Rotated Sorted Array II,15.2,0.3887965146188378,https://leetcode.com/problems/search-in-rotated-sorted-array-ii,"Array, Binary Search"
MEDIUM,Unique Paths II,15.2,0.43154364997722033,https://leetcode.com/problems/unique-paths-ii,"Array, Dynamic Programming, Matrix"
MEDIUM,Recover Binary Search Tree,15.2,0.5632431226781013,https://leetcode.com/problems/recover-binary-search-tree,"Tree, Depth-First Search, Binary Search Tree, Binary Tree"
MEDIUM,Unique Binary Search Trees,15.2,0.6244520536210353,https://leetcode.com/problems/unique-binary-search-trees,"Math, Dynamic Programming, Tree, Binary Search Tree, Binary Tree"
MEDIUM,Subsets II,15.2,0.595072748658621,https://leetcode.com/problems/subsets-ii,"Array, Backtracking, Bit Manipulation"
MEDIUM,Flatten Binary Tree to Linked List,15.2,0.6851010744073592,https://leetcode.com/problems/flatten-binary-tree-to-linked-list,"Linked List, Stack, Tree, Depth-First Search, Binary Tree"
