Difficulty,Title,Frequency,Acceptance Rate,Link,Topics
MEDIUM,Longest Repeating Character Replacement,100.0,0.5721160154633452,https://leetcode.com/problems/longest-repeating-character-replacement,"Hash Table, String, Sliding Window"
MEDIUM,Subarray Sum Equals K,100.0,0.45476210621315954,https://leetcode.com/problems/subarray-sum-equals-k,"Array, Hash Table, Prefix Sum"
MEDIUM,LRU Cache,100.0,0.45214622651505193,https://leetcode.com/problems/lru-cache,"Hash Table, Linked List, Design, Doubly-Linked List"
MEDIUM,Merge Intervals,100.0,0.49395246037855745,https://leetcode.com/problems/merge-intervals,"Array, Sorting"
MEDIUM,Remove Zero Sum Consecutive Nodes from Linked List,100.0,0.5286406766600661,https://leetcode.com/problems/remove-zero-sum-consecutive-nodes-from-linked-list,"Hash Table, Linked List"
