Difficulty,Title,Frequency,Acceptance Rate,Link,Topics
MEDIUM,LRU Cache,100.0,0.44717787125436975,https://leetcode.com/problems/lru-cache,"Hash Table, Linked List, Design, Doubly-Linked List"
MEDIUM,Smallest Subsequence of Distinct Characters,88.3,0.61732896511852,https://leetcode.com/problems/smallest-subsequence-of-distinct-characters,"String, Stack, Greedy, Monotonic Stack"
MEDIUM,First Day Where You Have Been in All the Rooms,86.0,0.3943308216720488,https://leetcode.com/problems/first-day-where-you-have-been-in-all-the-rooms,"Array, Dynamic Programming"
MEDIUM,Remove Duplicate Letters,86.0,0.5098754161524992,https://leetcode.com/problems/remove-duplicate-letters,"String, Stack, Greedy, Monotonic Stack"
MEDIUM,Longest Substring Without Repeating Characters,80.7,0.36543872129581223,https://leetcode.com/problems/longest-substring-without-repeating-characters,"Hash Table, String, Sliding Window"
MEDIUM,Number of Islands,80.7,0.6186238042178749,https://leetcode.com/problems/number-of-islands,"Array, Depth-First Search, Breadth-First Search, Union Find, Matrix"
MEDIUM,Course Schedule,77.5,0.48714212251081107,https://leetcode.com/problems/course-schedule,"Depth-First Search, Breadth-First Search, Graph, Topological Sort"
MEDIUM,Kth Largest Element in an Array,73.8,0.6774059204950139,https://leetcode.com/problems/kth-largest-element-in-an-array,"Array, Divide and Conquer, Sorting, Heap (Priority Queue), Quickselect"
MEDIUM,Combination Sum,73.8,0.741879737543094,https://leetcode.com/problems/combination-sum,"Array, Backtracking"
MEDIUM,Basic Calculator II,69.5,0.45454350473941413,https://leetcode.com/problems/basic-calculator-ii,"Math, String, Stack"
MEDIUM,Delete Operation for Two Strings,69.5,0.6328522288464242,https://leetcode.com/problems/delete-operation-for-two-strings,"String, Dynamic Programming"
MEDIUM,Merge Intervals,64.2,0.4902752971666867,https://leetcode.com/problems/merge-intervals,"Array, Sorting"
MEDIUM,House Robber,64.2,0.5209526309165878,https://leetcode.com/problems/house-robber,"Array, Dynamic Programming"
HARD,Regular Expression Matching,64.2,0.290663437495344,https://leetcode.com/problems/regular-expression-matching,"String, Dynamic Programming, Recursion"
MEDIUM,House Robber II,64.2,0.43282346761028534,https://leetcode.com/problems/house-robber-ii,"Array, Dynamic Programming"
HARD,Shortest Distance from All Buildings,64.2,0.4415290683177733,https://leetcode.com/problems/shortest-distance-from-all-buildings,"Array, Breadth-First Search, Matrix"
MEDIUM,Top K Frequent Elements,64.2,0.6425181101817361,https://leetcode.com/problems/top-k-frequent-elements,"Array, Hash Table, Divide and Conquer, Sorting, Heap (Priority Queue), Bucket Sort, Counting, Quickselect"
MEDIUM,Decode String,57.4,0.6084068653908431,https://leetcode.com/problems/decode-string,"String, Stack, Recursion"
MEDIUM,Sum Game,57.4,0.4814002089864159,https://leetcode.com/problems/sum-game,"Math, String, Greedy, Game Theory"
MEDIUM,Number of Good Leaf Nodes Pairs,57.4,0.7177396891422628,https://leetcode.com/problems/number-of-good-leaf-nodes-pairs,"Tree, Depth-First Search, Binary Tree"
EASY,Climbing Stairs,57.4,0.5341032120724493,https://leetcode.com/problems/climbing-stairs,"Math, Dynamic Programming, Memoization"
MEDIUM,Longest Common Subsequence,57.4,0.5807622422579896,https://leetcode.com/problems/longest-common-subsequence,"String, Dynamic Programming"
MEDIUM,Sort List,57.4,0.6119150763201207,https://leetcode.com/problems/sort-list,"Linked List, Two Pointers, Divide and Conquer, Sorting, Merge Sort"
MEDIUM,Longest Consecutive Sequence,57.4,0.4712662719611209,https://leetcode.com/problems/longest-consecutive-sequence,"Array, Hash Table, Union Find"
MEDIUM,Insert Delete GetRandom O(1),57.4,0.5496807812235717,https://leetcode.com/problems/insert-delete-getrandom-o1,"Array, Hash Table, Math, Design, Randomized"
MEDIUM,Add Two Numbers,57.4,0.45719870829185394,https://leetcode.com/problems/add-two-numbers,"Linked List, Math, Recursion"
EASY,Two Sum,57.4,0.5533850920340863,https://leetcode.com/problems/two-sum,"Array, Hash Table"
EASY,Best Time to Buy and Sell Stock,57.4,0.5492506086020509,https://leetcode.com/problems/best-time-to-buy-and-sell-stock,"Array, Dynamic Programming"
MEDIUM,Combination Sum II,57.4,0.5734209491148463,https://leetcode.com/problems/combination-sum-ii,"Array, Backtracking"
MEDIUM,Maximal Square,57.4,0.48412088736235537,https://leetcode.com/problems/maximal-square,"Array, Dynamic Programming, Matrix"
HARD,Trapping Rain Water,57.4,0.6456471842294372,https://leetcode.com/problems/trapping-rain-water,"Array, Two Pointers, Dynamic Programming, Stack, Monotonic Stack"
MEDIUM,Course Schedule II,57.4,0.5291118689785129,https://leetcode.com/problems/course-schedule-ii,"Depth-First Search, Breadth-First Search, Graph, Topological Sort"
MEDIUM,Search in Rotated Sorted Array,57.4,0.4250775065769097,https://leetcode.com/problems/search-in-rotated-sorted-array,"Array, Binary Search"
EASY,Reverse Linked List,57.4,0.7884955949833402,https://leetcode.com/problems/reverse-linked-list,"Linked List, Recursion"
MEDIUM,Rotting Oranges,57.4,0.5618148405710204,https://leetcode.com/problems/rotting-oranges,"Array, Breadth-First Search, Matrix"
MEDIUM,Minimum Area Rectangle,47.8,0.5487252981841276,https://leetcode.com/problems/minimum-area-rectangle,"Array, Hash Table, Math, Geometry, Sorting"
HARD,Basic Calculator,47.8,0.4515326292245549,https://leetcode.com/problems/basic-calculator,"Math, String, Stack, Recursion"
MEDIUM,Coin Change,47.8,0.46046355071621625,https://leetcode.com/problems/coin-change,"Array, Dynamic Programming, Breadth-First Search"
MEDIUM,Subarray Sum Equals K,47.8,0.4511788685175959,https://leetcode.com/problems/subarray-sum-equals-k,"Array, Hash Table, Prefix Sum"
HARD,Trapping Rain Water II,47.8,0.5874070437764938,https://leetcode.com/problems/trapping-rain-water-ii,"Array, Breadth-First Search, Heap (Priority Queue), Matrix"
MEDIUM,Search a 2D Matrix II,47.8,0.5467771818817365,https://leetcode.com/problems/search-a-2d-matrix-ii,"Array, Binary Search, Divide and Conquer, Matrix"
MEDIUM,Compare Version Numbers,47.8,0.42083774631454324,https://leetcode.com/problems/compare-version-numbers,"Two Pointers, String"
MEDIUM,Binary Tree Zigzag Level Order Traversal,47.8,0.6124385324621346,https://leetcode.com/problems/binary-tree-zigzag-level-order-traversal,"Tree, Breadth-First Search, Binary Tree"
EASY,Add to Array-Form of Integer,47.8,0.44999383081818584,https://leetcode.com/problems/add-to-array-form-of-integer,"Array, Math"
HARD,Sum of Distances in Tree,47.8,0.6526746624695862,https://leetcode.com/problems/sum-of-distances-in-tree,"Dynamic Programming, Tree, Depth-First Search, Graph"
EASY,Degree of an Array,47.8,0.5719166802910646,https://leetcode.com/problems/degree-of-an-array,"Array, Hash Table"
EASY,Count Binary Substrings,47.8,0.657933117882692,https://leetcode.com/problems/count-binary-substrings,"Two Pointers, String"
MEDIUM,Maximum Value at a Given Index in a Bounded Array,47.8,0.3881396620160198,https://leetcode.com/problems/maximum-value-at-a-given-index-in-a-bounded-array,"Binary Search, Greedy"
MEDIUM,Open the Lock,47.8,0.606342591320122,https://leetcode.com/problems/open-the-lock,"Array, Hash Table, String, Breadth-First Search"
MEDIUM,Partition to K Equal Sum Subsets,47.8,0.380814873117387,https://leetcode.com/problems/partition-to-k-equal-sum-subsets,"Array, Dynamic Programming, Backtracking, Bit Manipulation, Memoization, Bitmask"
MEDIUM,Longest Palindromic Substring,47.8,0.35490993621594474,https://leetcode.com/problems/longest-palindromic-substring,"Two Pointers, String, Dynamic Programming"
MEDIUM,Find All Good Indices,47.8,0.39565719499850294,https://leetcode.com/problems/find-all-good-indices,"Array, Dynamic Programming, Prefix Sum"
EASY,Move Zeroes,47.8,0.6264103580012553,https://leetcode.com/problems/move-zeroes,"Array, Two Pointers"
MEDIUM,H-Index,47.8,0.40040373238936744,https://leetcode.com/problems/h-index,"Array, Sorting, Counting Sort"
EASY,Intersection of Two Linked Lists,47.8,0.6055756866996896,https://leetcode.com/problems/intersection-of-two-linked-lists,"Hash Table, Linked List, Two Pointers"
HARD,Minimum Window Substring,47.8,0.44902204590233774,https://leetcode.com/problems/minimum-window-substring,"Hash Table, String, Sliding Window"
MEDIUM,Unique Paths,47.8,0.6553762678687339,https://leetcode.com/problems/unique-paths,"Math, Dynamic Programming, Combinatorics"
MEDIUM,"Pow(x, n)",47.8,0.366947999506112,https://leetcode.com/problems/powx-n,"Math, Recursion"
MEDIUM,Next Permutation,47.8,0.4258655485260008,https://leetcode.com/problems/next-permutation,"Array, Two Pointers"
MEDIUM,Container With Most Water,47.8,0.5740099235347772,https://leetcode.com/problems/container-with-most-water,"Array, Two Pointers, Greedy"
MEDIUM,Design Memory Allocator,47.8,0.5302977537872192,https://leetcode.com/problems/design-memory-allocator,"Array, Hash Table, Design, Simulation"
