Difficulty,Title,Frequency,Acceptance Rate,Link,Topics
MEDIUM,LRU Cache,100.0,0.4507742499286726,https://leetcode.com/problems/lru-cache,"Hash Table, Linked List, Design, Doubly-Linked List"
MEDIUM,Smallest Subsequence of Distinct Characters,89.5,0.6187631843579643,https://leetcode.com/problems/smallest-subsequence-of-distinct-characters,"String, Stack, Greedy, Monotonic Stack"
MEDIUM,First Day Where You Have Been in All the Rooms,87.2,0.39649034985260584,https://leetcode.com/problems/first-day-where-you-have-been-in-all-the-rooms,"Array, Dynamic Programming"
MEDIUM,Remove Duplicate Letters,87.2,0.5125825096342279,https://leetcode.com/problems/remove-duplicate-letters,"String, Stack, Greedy, Monotonic Stack"
MEDIUM,Number of Islands,81.8,0.6219955667709992,https://leetcode.com/problems/number-of-islands,"Array, Depth-First Search, Breadth-First Search, Union Find, Matrix"
MEDIUM,Course Schedule,78.6,0.4907901871926195,https://leetcode.com/problems/course-schedule,"Depth-First Search, Breadth-First Search, Graph, Topological Sort"
MEDIUM,Kth Largest Element in an Array,74.8,0.679076397542362,https://leetcode.com/problems/kth-largest-element-in-an-array,"Array, Divide and Conquer, Sorting, Heap (Priority Queue), Quickselect"
MEDIUM,Longest Substring Without Repeating Characters,74.8,0.3682188631555444,https://leetcode.com/problems/longest-substring-without-repeating-characters,"Hash Table, String, Sliding Window"
MEDIUM,Combination Sum,74.8,0.7453537385991453,https://leetcode.com/problems/combination-sum,"Array, Backtracking"
HARD,Regular Expression Matching,70.4,0.2923014738517423,https://leetcode.com/problems/regular-expression-matching,"String, Dynamic Programming, Recursion"
MEDIUM,Basic Calculator II,70.4,0.45723056591825784,https://leetcode.com/problems/basic-calculator-ii,"Math, String, Stack"
MEDIUM,House Robber,65.1,0.522440740976593,https://leetcode.com/problems/house-robber,"Array, Dynamic Programming"
HARD,Shortest Distance from All Buildings,65.1,0.4431179699080052,https://leetcode.com/problems/shortest-distance-from-all-buildings,"Array, Breadth-First Search, Matrix"
MEDIUM,House Robber II,65.1,0.4347756845176024,https://leetcode.com/problems/house-robber-ii,"Array, Dynamic Programming"
MEDIUM,Search in Rotated Sorted Array,65.1,0.4273988084026449,https://leetcode.com/problems/search-in-rotated-sorted-array,"Array, Binary Search"
MEDIUM,Delete Operation for Two Strings,65.1,0.6358282609616692,https://leetcode.com/problems/delete-operation-for-two-strings,"String, Dynamic Programming"
MEDIUM,Merge Intervals,65.1,0.49292510643638343,https://leetcode.com/problems/merge-intervals,"Array, Sorting"
HARD,Trapping Rain Water,65.1,0.649501583435958,https://leetcode.com/problems/trapping-rain-water,"Array, Two Pointers, Dynamic Programming, Stack, Monotonic Stack"
MEDIUM,Insert Delete GetRandom O(1),58.2,0.5496116100503412,https://leetcode.com/problems/insert-delete-getrandom-o1,"Array, Hash Table, Math, Design, Randomized"
EASY,Two Sum,58.2,0.5568018096334361,https://leetcode.com/problems/two-sum,"Array, Hash Table"
MEDIUM,Longest Common Subsequence,58.2,0.5820510793576011,https://leetcode.com/problems/longest-common-subsequence,"String, Dynamic Programming"
MEDIUM,Combination Sum II,58.2,0.5757458045886946,https://leetcode.com/problems/combination-sum-ii,"Array, Backtracking"
MEDIUM,Maximal Square,58.2,0.4864961009595293,https://leetcode.com/problems/maximal-square,"Array, Dynamic Programming, Matrix"
MEDIUM,Sum Game,58.2,0.483617166212534,https://leetcode.com/problems/sum-game,"Math, String, Greedy, Game Theory"
MEDIUM,Number of Good Leaf Nodes Pairs,58.2,0.7177856724863263,https://leetcode.com/problems/number-of-good-leaf-nodes-pairs,"Tree, Depth-First Search, Binary Tree"
MEDIUM,Top K Frequent Elements,58.2,0.6447826450542548,https://leetcode.com/problems/top-k-frequent-elements,"Array, Hash Table, Divide and Conquer, Sorting, Heap (Priority Queue), Bucket Sort, Counting, Quickselect"
EASY,Best Time to Buy and Sell Stock,58.2,0.5515726694409043,https://leetcode.com/problems/best-time-to-buy-and-sell-stock,"Array, Dynamic Programming"
HARD,Basic Calculator,58.2,0.4547490556885931,https://leetcode.com/problems/basic-calculator,"Math, String, Stack, Recursion"
MEDIUM,Add Two Numbers,58.2,0.4608950349034295,https://leetcode.com/problems/add-two-numbers,"Linked List, Math, Recursion"
MEDIUM,Subarray Sum Equals K,58.2,0.45382545230042143,https://leetcode.com/problems/subarray-sum-equals-k,"Array, Hash Table, Prefix Sum"
MEDIUM,Longest Consecutive Sequence,58.2,0.47049197690751193,https://leetcode.com/problems/longest-consecutive-sequence,"Array, Hash Table, Union Find"
MEDIUM,Sort List,58.2,0.6161484111795041,https://leetcode.com/problems/sort-list,"Linked List, Two Pointers, Divide and Conquer, Sorting, Merge Sort"
MEDIUM,Course Schedule II,58.2,0.5327020063823561,https://leetcode.com/problems/course-schedule-ii,"Depth-First Search, Breadth-First Search, Graph, Topological Sort"
MEDIUM,Rotting Oranges,58.2,0.5647293927353025,https://leetcode.com/problems/rotting-oranges,"Array, Breadth-First Search, Matrix"
MEDIUM,Compare Version Numbers,48.5,0.422732974140766,https://leetcode.com/problems/compare-version-numbers,"Two Pointers, String"
HARD,Sum of Distances in Tree,48.5,0.653154546087064,https://leetcode.com/problems/sum-of-distances-in-tree,"Dynamic Programming, Tree, Depth-First Search, Graph"
HARD,Trapping Rain Water II,48.5,0.5879952483645801,https://leetcode.com/problems/trapping-rain-water-ii,"Array, Breadth-First Search, Heap (Priority Queue), Matrix"
MEDIUM,Search a 2D Matrix II,48.5,0.5508168308237174,https://leetcode.com/problems/search-a-2d-matrix-ii,"Array, Binary Search, Divide and Conquer, Matrix"
EASY,Merge Sorted Array,48.5,0.5280217365576415,https://leetcode.com/problems/merge-sorted-array,"Array, Two Pointers, Sorting"
MEDIUM,Peak Index in a Mountain Array,48.5,0.6762620894599702,https://leetcode.com/problems/peak-index-in-a-mountain-array,"Array, Binary Search"
MEDIUM,Minimum Area Rectangle,48.5,0.5497970683268973,https://leetcode.com/problems/minimum-area-rectangle,"Array, Hash Table, Math, Geometry, Sorting"
MEDIUM,Binary Tree Zigzag Level Order Traversal,48.5,0.6154467863784504,https://leetcode.com/problems/binary-tree-zigzag-level-order-traversal,"Tree, Breadth-First Search, Binary Tree"
MEDIUM,Subsets,48.5,0.8076116615842543,https://leetcode.com/problems/subsets,"Array, Backtracking, Bit Manipulation"
MEDIUM,Longest Repeating Character Replacement,48.5,0.570531848324223,https://leetcode.com/problems/longest-repeating-character-replacement,"Hash Table, String, Sliding Window"
MEDIUM,Design Memory Allocator,48.5,0.48459662288930583,https://leetcode.com/problems/design-memory-allocator,"Array, Hash Table, Design, Simulation"
EASY,Count Binary Substrings,48.5,0.6588773995378299,https://leetcode.com/problems/count-binary-substrings,"Two Pointers, String"
EASY,Add to Array-Form of Integer,48.5,0.4504823695683778,https://leetcode.com/problems/add-to-array-form-of-integer,"Array, Math"
EASY,Climbing Stairs,48.5,0.5350776008043313,https://leetcode.com/problems/climbing-stairs,"Math, Dynamic Programming, Memoization"
MEDIUM,"Pow(x, n)",48.5,0.3694083809464792,https://leetcode.com/problems/powx-n,"Math, Recursion"
HARD,Minimum Window Substring,48.5,0.4522097988325003,https://leetcode.com/problems/minimum-window-substring,"Hash Table, String, Sliding Window"
EASY,Intersection of Two Linked Lists,48.5,0.6093992972673158,https://leetcode.com/problems/intersection-of-two-linked-lists,"Hash Table, Linked List, Two Pointers"
EASY,Reverse Linked List,48.5,0.7910861816373921,https://leetcode.com/problems/reverse-linked-list,"Linked List, Recursion"
MEDIUM,Next Permutation,48.5,0.4292065391692644,https://leetcode.com/problems/next-permutation,"Array, Two Pointers"
MEDIUM,H-Index,48.5,0.40225329129607057,https://leetcode.com/problems/h-index,"Array, Sorting, Counting Sort"
MEDIUM,Container With Most Water,48.5,0.5768093322565548,https://leetcode.com/problems/container-with-most-water,"Array, Two Pointers, Greedy"
MEDIUM,Decode String,48.5,0.6107515207445541,https://leetcode.com/problems/decode-string,"String, Stack, Recursion"
MEDIUM,Find All Good Indices,48.5,0.397758671472853,https://leetcode.com/problems/find-all-good-indices,"Array, Dynamic Programming, Prefix Sum"
EASY,Degree of an Array,48.5,0.5736198393358906,https://leetcode.com/problems/degree-of-an-array,"Array, Hash Table"
MEDIUM,Partition to K Equal Sum Subsets,48.5,0.38111596608630277,https://leetcode.com/problems/partition-to-k-equal-sum-subsets,"Array, Dynamic Programming, Backtracking, Bit Manipulation, Memoization, Bitmask"
MEDIUM,Open the Lock,48.5,0.6070573545410402,https://leetcode.com/problems/open-the-lock,"Array, Hash Table, String, Breadth-First Search"
MEDIUM,Longest Palindromic Substring,48.5,0.35744257023937265,https://leetcode.com/problems/longest-palindromic-substring,"Two Pointers, String, Dynamic Programming"
MEDIUM,Maximum Value at a Given Index in a Bounded Array,48.5,0.3886504306336937,https://leetcode.com/problems/maximum-value-at-a-given-index-in-a-bounded-array,"Binary Search, Greedy"
MEDIUM,Unique Paths,48.5,0.6570533621853909,https://leetcode.com/problems/unique-paths,"Math, Dynamic Programming, Combinatorics"
HARD,Merge k Sorted Lists,48.5,0.566078038181479,https://leetcode.com/problems/merge-k-sorted-lists,"Linked List, Divide and Conquer, Heap (Priority Queue), Merge Sort"
