Difficulty,Title,Frequency,Acceptance Rate,Link,Topics
EASY,Two Sum,100.0,0.557769958684312,https://leetcode.com/problems/two-sum,"Array, Hash Table"
EASY,Valid Anagram,100.0,0.6666091043812926,https://leetcode.com/problems/valid-anagram,"Hash Table, String, Sorting"
MEDIUM,Minimum Moves to Equal Array Elements II,86.9,0.6095862132467602,https://leetcode.com/problems/minimum-moves-to-equal-array-elements-ii,"Array, Math, Sorting"
MEDIUM,Spiral Matrix,86.9,0.5393976057408939,https://leetcode.com/problems/spiral-matrix,"Array, Matrix, Simulation"
EASY,Remove Duplicates from Sorted Array,86.9,0.6035551873801481,https://leetcode.com/problems/remove-duplicates-from-sorted-array,"Array, Two Pointers"
EASY,Duplicate Emails,86.9,0.7244932493128983,https://leetcode.com/problems/duplicate-emails,Database
MEDIUM,Subarray Sum Equals K,86.9,0.45476206064696134,https://leetcode.com/problems/subarray-sum-equals-k,"Array, Hash Table, Prefix Sum"
MEDIUM,"Pow(x, n)",86.9,0.37023194967093703,https://leetcode.com/problems/powx-n,"Math, Recursion"
HARD,Trapping Rain Water,86.9,0.6510193095174875,https://leetcode.com/problems/trapping-rain-water,"Array, Two Pointers, Dynamic Programming, Stack, Monotonic Stack"
MEDIUM,Best Time to Buy and Sell Stock II,86.9,0.6950026730452624,https://leetcode.com/problems/best-time-to-buy-and-sell-stock-ii,"Array, Dynamic Programming, Greedy"
MEDIUM,Partition Equal Subset Sum,86.9,0.4844385484671133,https://leetcode.com/problems/partition-equal-subset-sum,"Array, Dynamic Programming"
MEDIUM,Maximum Subarray,86.9,0.5209977597071156,https://leetcode.com/problems/maximum-subarray,"Array, Divide and Conquer, Dynamic Programming"
