Difficulty,Title,Frequency,Acceptance Rate,Link,Topics
MEDIUM,Implement Trie (Prefix Tree),100.0,0.6781136720731421,https://leetcode.com/problems/implement-trie-prefix-tree,"Hash Table, String, Design, Trie"
MEDIUM,Copy List with Random Pointer,92.4,0.603449472372073,https://leetcode.com/problems/copy-list-with-random-pointer,"Hash Table, Linked List"
MEDIUM,Design Authentication Manager,81.8,0.5776455588610285,https://leetcode.com/problems/design-authentication-manager,"Hash Table, Linked List, Design, Doubly-Linked List"
MEDIUM,Rotting Oranges,81.8,0.5647300525430633,https://leetcode.com/problems/rotting-oranges,"Array, Breadth-First Search, Matrix"
MEDIUM,Merge Intervals,81.8,0.4929261711959768,https://leetcode.com/problems/merge-intervals,"Array, Sorting"
MEDIUM,Top K Frequent Elements,81.8,0.6447838318988509,https://leetcode.com/problems/top-k-frequent-elements,"Array, Hash Table, Divide and Conquer, Sorting, Heap (Priority Queue), Bucket Sort, Counting, Quickselect"
MEDIUM,LRU Cache,74.2,0.4507753459141019,https://leetcode.com/problems/lru-cache,"Hash Table, Linked List, Design, Doubly-Linked List"
EASY,Excel Sheet Column Number,74.2,0.6566633188223127,https://leetcode.com/problems/excel-sheet-column-number,"Math, String"
MEDIUM,Longest Substring Without Repeating Characters,74.2,0.36822003802935127,https://leetcode.com/problems/longest-substring-without-repeating-characters,"Hash Table, String, Sliding Window"
HARD,Reaching Points,74.2,0.3360709474629546,https://leetcode.com/problems/reaching-points,Math
MEDIUM,Integer to Roman,74.2,0.6848160074727759,https://leetcode.com/problems/integer-to-roman,"Hash Table, Math, String"
MEDIUM,Sort Colors,74.2,0.6745378931931305,https://leetcode.com/problems/sort-colors,"Array, Two Pointers, Sorting"
HARD,Find Median from Data Stream,74.2,0.5319547687959963,https://leetcode.com/problems/find-median-from-data-stream,"Two Pointers, Design, Sorting, Heap (Priority Queue), Data Stream"
MEDIUM,House Robber II,63.6,0.4347759122523874,https://leetcode.com/problems/house-robber-ii,"Array, Dynamic Programming"
MEDIUM,Shortest Bridge,63.6,0.5858006577404176,https://leetcode.com/problems/shortest-bridge,"Array, Depth-First Search, Breadth-First Search, Matrix"
HARD,Number of Atoms,63.6,0.6499277274484427,https://leetcode.com/problems/number-of-atoms,"Hash Table, String, Stack, Sorting"
MEDIUM,Pairs of Songs With Total Durations Divisible by 60,63.6,0.5323446969103807,https://leetcode.com/problems/pairs-of-songs-with-total-durations-divisible-by-60,"Array, Hash Table, Counting"
MEDIUM,Design Add and Search Words Data Structure,63.6,0.4697580092630656,https://leetcode.com/problems/design-add-and-search-words-data-structure,"String, Depth-First Search, Design, Trie"
MEDIUM,Count Good Nodes in Binary Tree,63.6,0.7345594899714527,https://leetcode.com/problems/count-good-nodes-in-binary-tree,"Tree, Depth-First Search, Breadth-First Search, Binary Tree"
MEDIUM,Search Suggestions System,63.6,0.650540734433352,https://leetcode.com/problems/search-suggestions-system,"Array, String, Binary Search, Trie, Sorting, Heap (Priority Queue)"
MEDIUM,Meeting Rooms II,63.6,0.521166879041716,https://leetcode.com/problems/meeting-rooms-ii,"Array, Two Pointers, Greedy, Sorting, Heap (Priority Queue), Prefix Sum"
MEDIUM,Insert Delete GetRandom O(1),63.6,0.5496097502345598,https://leetcode.com/problems/insert-delete-getrandom-o1,"Array, Hash Table, Math, Design, Randomized"
EASY,Two Sum,63.6,0.5568026794338347,https://leetcode.com/problems/two-sum,"Array, Hash Table"
MEDIUM,Inorder Successor in BST,63.6,0.5063903020701701,https://leetcode.com/problems/inorder-successor-in-bst,"Tree, Depth-First Search, Binary Search Tree, Binary Tree"
MEDIUM,Reorder Routes to Make All Paths Lead to the City Zero,63.6,0.6498808519998533,https://leetcode.com/problems/reorder-routes-to-make-all-paths-lead-to-the-city-zero,"Depth-First Search, Breadth-First Search, Graph"
EASY,Palindrome Permutation,63.6,0.6849375845084026,https://leetcode.com/problems/palindrome-permutation,"Hash Table, String, Bit Manipulation"
HARD,IPO,63.6,0.5300661655312818,https://leetcode.com/problems/ipo,"Array, Greedy, Sorting, Heap (Priority Queue)"
MEDIUM,Optimal Partition of String,63.6,0.7821794801741252,https://leetcode.com/problems/optimal-partition-of-string,"Hash Table, String, Greedy"
MEDIUM,Boats to Save People,63.6,0.6021420823609429,https://leetcode.com/problems/boats-to-save-people,"Array, Two Pointers, Greedy, Sorting"
MEDIUM,Product of Array Except Self,63.6,0.677121974407935,https://leetcode.com/problems/product-of-array-except-self,"Array, Prefix Sum"
MEDIUM,Clone Graph,63.6,0.62174330229089,https://leetcode.com/problems/clone-graph,"Hash Table, Depth-First Search, Breadth-First Search, Graph"
EASY,Valid Parentheses,63.6,0.4224538279851942,https://leetcode.com/problems/valid-parentheses,"String, Stack"
MEDIUM,3Sum,63.6,0.3695623552408602,https://leetcode.com/problems/3sum,"Array, Two Pointers, Sorting"
MEDIUM,Number of Islands,63.6,0.6219967794287773,https://leetcode.com/problems/number-of-islands,"Array, Depth-First Search, Breadth-First Search, Union Find, Matrix"
