Difficulty,Title,Frequency,Acceptance Rate,Link,Topics
MEDIUM,Group Anagrams,100.0,0.7083652980501445,https://leetcode.com/problems/group-anagrams,"Array, Hash Table, String, Sorting"
MEDIUM,LRU Cache,100.0,0.45077789022619813,https://leetcode.com/problems/lru-cache,"Hash Table, Linked List, Design, Doubly-Linked List"
MEDIUM,String Compression,100.0,0.5796003077985311,https://leetcode.com/problems/string-compression,"Two Pointers, String"
EASY,Product Sales Analysis I,88.5,0.8450656836706498,https://leetcode.com/problems/product-sales-analysis-i,Database
MEDIUM,Linked List Cycle II,88.5,0.547263998476712,https://leetcode.com/problems/linked-list-cycle-ii,"Hash Table, Linked List, Two Pointers"
MEDIUM,Product of Array Except Self,88.5,0.6771216553567492,https://leetcode.com/problems/product-of-array-except-self,"Array, Prefix Sum"
MEDIUM,Subarray Sum Equals K,88.5,0.4538268273105527,https://leetcode.com/problems/subarray-sum-equals-k,"Array, Hash Table, Prefix Sum"
MEDIUM,Stock Price Fluctuation ,88.5,0.4808034096595517,https://leetcode.com/problems/stock-price-fluctuation,"Hash Table, Design, Heap (Priority Queue), Data Stream, Ordered Set"
MEDIUM,Maximum Subarray,88.5,0.5203996108673912,https://leetcode.com/problems/maximum-subarray,"Array, Divide and Conquer, Dynamic Programming"
MEDIUM,Koko Eating Bananas,88.5,0.4905285728475214,https://leetcode.com/problems/koko-eating-bananas,"Array, Binary Search"
MEDIUM,Merge Intervals,88.5,0.4929267857294651,https://leetcode.com/problems/merge-intervals,"Array, Sorting"
