Difficulty,Title,Frequency,Acceptance Rate,Link,Topics
EASY,Two Sum,100.0,0.5577699721092808,https://leetcode.com/problems/two-sum,"Array, Hash Table"
EASY,Split the Array,82.4,0.5922734052667847,https://leetcode.com/problems/split-the-array,"Array, Hash Table, Counting"
EASY,Best Time to Buy and Sell Stock,82.4,0.5525961777147723,https://leetcode.com/problems/best-time-to-buy-and-sell-stock,"Array, Dynamic Programming"
EASY,Longest Common Prefix,82.4,0.4548309025352272,https://leetcode.com/problems/longest-common-prefix,"String, Trie"
MEDIUM,Group Anagrams,82.4,0.7092883620495999,https://leetcode.com/problems/group-anagrams,"Array, Hash Table, String, Sorting"
MEDIUM,Search in Rotated Sorted Array,82.4,0.42837221403911835,https://leetcode.com/problems/search-in-rotated-sorted-array,"Array, Binary Search"
HARD,Trapping Rain Water,77.8,0.6510195479297859,https://leetcode.com/problems/trapping-rain-water,"Array, Two Pointers, Dynamic Programming, Stack, Monotonic Stack"
HARD,Text Justification,72.2,0.48149935664104093,https://leetcode.com/problems/text-justification,"Array, String, Simulation"
EASY,Create Target Array in the Given Order,72.2,0.8623489961219972,https://leetcode.com/problems/create-target-array-in-the-given-order,"Array, Simulation"
MEDIUM,Longest Palindromic Substring,72.2,0.35846127081875356,https://leetcode.com/problems/longest-palindromic-substring,"Two Pointers, String, Dynamic Programming"
MEDIUM,3Sum,64.9,0.3707096562666586,https://leetcode.com/problems/3sum,"Array, Two Pointers, Sorting"
EASY,Rotate String,64.9,0.6393953917504719,https://leetcode.com/problems/rotate-string,"String, String Matching"
MEDIUM,Walls and Gates,64.9,0.6296791509568449,https://leetcode.com/problems/walls-and-gates,"Array, Breadth-First Search, Matrix"
MEDIUM,Maximum Subarray,64.9,0.5209980078467712,https://leetcode.com/problems/maximum-subarray,"Array, Divide and Conquer, Dynamic Programming"
MEDIUM,Check If Array Pairs Are Divisible by k,64.9,0.46202161403770453,https://leetcode.com/problems/check-if-array-pairs-are-divisible-by-k,"Array, Hash Table, Counting"
MEDIUM,Maximum Number of Events That Can Be Attended,64.9,0.32921981825520097,https://leetcode.com/problems/maximum-number-of-events-that-can-be-attended,"Array, Greedy, Sorting, Heap (Priority Queue)"
MEDIUM,Longest Substring Without Repeating Characters,64.9,0.36936169499803667,https://leetcode.com/problems/longest-substring-without-repeating-characters,"Hash Table, String, Sliding Window"
MEDIUM,Rotating the Box,64.9,0.7909813050714205,https://leetcode.com/problems/rotating-the-box,"Array, Two Pointers, Matrix"
EASY,Diameter of Binary Tree,64.9,0.6358637109543867,https://leetcode.com/problems/diameter-of-binary-tree,"Tree, Depth-First Search, Binary Tree"
MEDIUM,Daily Temperatures,64.9,0.673649951600241,https://leetcode.com/problems/daily-temperatures,"Array, Stack, Monotonic Stack"
MEDIUM,Reverse Words in a String,64.9,0.5191329339866777,https://leetcode.com/problems/reverse-words-in-a-string,"Two Pointers, String"
MEDIUM,Word Search,64.9,0.4526695178423744,https://leetcode.com/problems/word-search,"Array, String, Backtracking, Depth-First Search, Matrix"
MEDIUM,Course Schedule,64.9,0.492343713667007,https://leetcode.com/problems/course-schedule,"Depth-First Search, Breadth-First Search, Graph, Topological Sort"
EASY,Image Smoother,54.7,0.6837229689163258,https://leetcode.com/problems/image-smoother,"Array, Matrix"
HARD,Binary Tree Cameras,54.7,0.4718257360539049,https://leetcode.com/problems/binary-tree-cameras,"Dynamic Programming, Tree, Depth-First Search, Binary Tree"
MEDIUM,Restore IP Addresses,54.7,0.5315838531583853,https://leetcode.com/problems/restore-ip-addresses,"String, Backtracking"
MEDIUM,Spiral Matrix,54.7,0.5393974560587809,https://leetcode.com/problems/spiral-matrix,"Array, Matrix, Simulation"
EASY,Palindrome Number,54.7,0.5922454050733309,https://leetcode.com/problems/palindrome-number,Math
MEDIUM,Valid Sudoku,54.7,0.6227676961475801,https://leetcode.com/problems/valid-sudoku,"Array, Hash Table, Matrix"
HARD,Reverse Nodes in k-Group,54.7,0.6304369033162786,https://leetcode.com/problems/reverse-nodes-in-k-group,"Linked List, Recursion"
MEDIUM,LRU Cache,54.7,0.45214622651505193,https://leetcode.com/problems/lru-cache,"Hash Table, Linked List, Design, Doubly-Linked List"
MEDIUM,Find the Length of the Longest Common Prefix,54.7,0.564161205458434,https://leetcode.com/problems/find-the-length-of-the-longest-common-prefix,"Array, Hash Table, String, Trie"
MEDIUM,Find Score of an Array After Marking All Elements,54.7,0.6448364336112893,https://leetcode.com/problems/find-score-of-an-array-after-marking-all-elements,"Array, Hash Table, Sorting, Heap (Priority Queue), Simulation"
HARD,Sliding Window Maximum,54.7,0.47604171417820246,https://leetcode.com/problems/sliding-window-maximum,"Array, Queue, Sliding Window, Heap (Priority Queue), Monotonic Queue"
MEDIUM,Match Alphanumerical Pattern in Matrix I,54.7,0.6389402341343191,https://leetcode.com/problems/match-alphanumerical-pattern-in-matrix-i,"Array, Hash Table, String, Matrix"
MEDIUM,Count Nodes With the Highest Score,54.7,0.5126480395538692,https://leetcode.com/problems/count-nodes-with-the-highest-score,"Array, Tree, Depth-First Search, Binary Tree"
EASY,Divisor Game,54.7,0.7039133843993194,https://leetcode.com/problems/divisor-game,"Math, Dynamic Programming, Brainteaser, Game Theory"
EASY,Two Furthest Houses With Different Colors,54.7,0.6557574742483879,https://leetcode.com/problems/two-furthest-houses-with-different-colors,"Array, Greedy"
EASY,Odd String Difference,54.7,0.6106046482233423,https://leetcode.com/problems/odd-string-difference,"Array, Hash Table, String"
HARD,Earliest Possible Day of Full Bloom,54.7,0.7113565236159574,https://leetcode.com/problems/earliest-possible-day-of-full-bloom,"Array, Greedy, Sorting"
HARD,Median of Two Sorted Arrays,54.7,0.43814599472907956,https://leetcode.com/problems/median-of-two-sorted-arrays,"Array, Binary Search, Divide and Conquer"
HARD,Shortest Palindrome,54.7,0.40655864915631257,https://leetcode.com/problems/shortest-palindrome,"String, Rolling Hash, String Matching, Hash Function"
EASY,Valid Parentheses,54.7,0.42322845009246296,https://leetcode.com/problems/valid-parentheses,"String, Stack"
HARD,Split Message Based on Limit,54.7,0.4261603375527427,https://leetcode.com/problems/split-message-based-on-limit,"String, Binary Search, Enumeration"
HARD,Find Servers That Handled Most Number of Requests,54.7,0.4407547923322684,https://leetcode.com/problems/find-servers-that-handled-most-number-of-requests,"Array, Greedy, Heap (Priority Queue), Ordered Set"
MEDIUM,Best Time to Buy and Sell Stock with Cooldown,54.7,0.6039720911326697,https://leetcode.com/problems/best-time-to-buy-and-sell-stock-with-cooldown,"Array, Dynamic Programming"
MEDIUM,Search a 2D Matrix,54.7,0.5228958306958686,https://leetcode.com/problems/search-a-2d-matrix,"Array, Binary Search, Matrix"
EASY,Roman to Integer,54.7,0.6486629755684451,https://leetcode.com/problems/roman-to-integer,"Hash Table, Math, String"
HARD,Block Placement Queries,54.7,0.168902023187088,https://leetcode.com/problems/block-placement-queries,"Array, Binary Search, Binary Indexed Tree, Segment Tree"
