Difficulty,Title,Frequency,Acceptance Rate,Link,Topics
MEDIUM,Find Palindrome With Fixed Length,100.0,0.37353682026966956,https://leetcode.com/problems/find-palindrome-with-fixed-length,"Array, Math"
HARD,Make Array Non-decreasing or Non-increasing,100.0,0.6535100495193709,https://leetcode.com/problems/make-array-non-decreasing-or-non-increasing,"Dynamic Programming, Greedy"
MEDIUM,Break a Palindrome,100.0,0.515233243150124,https://leetcode.com/problems/break-a-palindrome,"String, Greedy"
HARD,Median of Two Sorted Arrays,87.5,0.4348818897740088,https://leetcode.com/problems/median-of-two-sorted-arrays,"Array, Binary Search, Divide and Conquer"
EASY,Best Time to Buy and Sell Stock,83.1,0.5506580887942565,https://leetcode.com/problems/best-time-to-buy-and-sell-stock,"Array, Dynamic Programming"
MEDIUM,Time Based Key-Value Store,77.6,0.4929493069148724,https://leetcode.com/problems/time-based-key-value-store,"Hash Table, String, Binary Search, Design"
EASY,Two Sum,77.6,0.5554657646082751,https://leetcode.com/problems/two-sum,"Array, Hash Table"
MEDIUM,LRU Cache,77.6,0.44936920484949744,https://leetcode.com/problems/lru-cache,"Hash Table, Linked List, Design, Doubly-Linked List"
MEDIUM,Course Schedule,70.6,0.4894560094340342,https://leetcode.com/problems/course-schedule,"Depth-First Search, Breadth-First Search, Graph, Topological Sort"
MEDIUM,Search in Rotated Sorted Array,60.8,0.4264871508687405,https://leetcode.com/problems/search-in-rotated-sorted-array,"Array, Binary Search"
MEDIUM,Next Permutation,60.8,0.4279308002456824,https://leetcode.com/problems/next-permutation,"Array, Two Pointers"
HARD,Reverse Nodes in k-Group,60.8,0.6268016427726403,https://leetcode.com/problems/reverse-nodes-in-k-group,"Linked List, Recursion"
EASY,Longest Common Prefix,60.8,0.45269172845615185,https://leetcode.com/problems/longest-common-prefix,"String, Trie"
MEDIUM,Integer to Roman,60.8,0.6832938458342389,https://leetcode.com/problems/integer-to-roman,"Hash Table, Math, String"
MEDIUM,Koko Eating Bananas,60.8,0.49042441139883475,https://leetcode.com/problems/koko-eating-bananas,"Array, Binary Search"
MEDIUM,Longest Palindromic Substring,60.8,0.35648496794254336,https://leetcode.com/problems/longest-palindromic-substring,"Two Pointers, String, Dynamic Programming"
MEDIUM,Course Schedule II,60.8,0.5312891499617015,https://leetcode.com/problems/course-schedule-ii,"Depth-First Search, Breadth-First Search, Graph, Topological Sort"
MEDIUM,Copy List with Random Pointer,60.8,0.6016390030501881,https://leetcode.com/problems/copy-list-with-random-pointer,"Hash Table, Linked List"
MEDIUM,Rotting Oranges,60.8,0.5635839838317913,https://leetcode.com/problems/rotting-oranges,"Array, Breadth-First Search, Matrix"
EASY,Intersection of Two Linked Lists,60.8,0.6078132548997087,https://leetcode.com/problems/intersection-of-two-linked-lists,"Hash Table, Linked List, Two Pointers"
