Difficulty,Title,Frequency,Acceptance Rate,Link,Topics
MEDIUM,Zigzag Conversion,100.0,0.506014939915557,https://leetcode.com/problems/zigzag-conversion,String
HARD,Trapping Rain Water,100.0,0.6412337594432855,https://leetcode.com/problems/trapping-rain-water,"Array, Two Pointers, Dynamic Programming, Stack, Monotonic Stack"
MEDIUM,LRU Cache,92.3,0.44265640977115533,https://leetcode.com/problems/lru-cache,"Hash Table, Linked List, Design, Doubly-Linked List"
EASY,Best Time to Buy and Sell Stock,92.3,0.5468384157469753,https://leetcode.com/problems/best-time-to-buy-and-sell-stock,"Array, Dynamic Programming"
MEDIUM,Minimum Time Difference,81.4,0.6224443038250889,https://leetcode.com/problems/minimum-time-difference,"Array, Math, String, Sorting"
