Difficulty,Title,Frequency,Acceptance Rate,Link,Topics
MEDIUM,Find Mirror Score of a String,100.0,0.3601410872845962,https://leetcode.com/problems/find-mirror-score-of-a-string,"Hash Table, String, Stack, Simulation"
MEDIUM,Zigzag Conversion,79.8,0.5090973361106518,https://leetcode.com/problems/zigzag-conversion,String
HARD,Trapping Rain Water,79.8,0.6439818098296882,https://leetcode.com/problems/trapping-rain-water,"Array, Two Pointers, Dynamic Programming, Stack, Monotonic Stack"
MEDIUM,LRU Cache,73.4,0.44550607653729507,https://leetcode.com/problems/lru-cache,"Hash Table, Linked List, Design, Doubly-Linked List"
EASY,Best Time to Buy and Sell Stock,73.4,0.5482909025446544,https://leetcode.com/problems/best-time-to-buy-and-sell-stock,"Array, Dynamic Programming"
MEDIUM,Minimum Time Difference,64.5,0.6228017480005182,https://leetcode.com/problems/minimum-time-difference,"Array, Math, String, Sorting"
MEDIUM,Linked List Cycle II,64.5,0.5413197168779216,https://leetcode.com/problems/linked-list-cycle-ii,"Hash Table, Linked List, Two Pointers"
