Difficulty,Title,Frequency,Acceptance Rate,Link,Topics
MEDIUM,Search Suggestions System,100.0,0.6501854438610857,https://leetcode.com/problems/search-suggestions-system,"Array, String, Binary Search, Trie, Sorting, Heap (Priority Queue)"
MEDIUM,Subarray Product Less Than K,88.6,0.5255520484080909,https://leetcode.com/problems/subarray-product-less-than-k,"Array, Binary Search, Sliding Window, Prefix Sum"
MEDIUM,Longest Increasing Subsequence,88.6,0.5738412627281781,https://leetcode.com/problems/longest-increasing-subsequence,"Array, Binary Search, Dynamic Programming"
MEDIUM,Maximum Subarray,88.6,0.5186412638620086,https://leetcode.com/problems/maximum-subarray,"Array, Divide and Conquer, Dynamic Programming"
MEDIUM,Group Anagrams,88.6,0.7056694680759381,https://leetcode.com/problems/group-anagrams,"Array, Hash Table, String, Sorting"
MEDIUM,Number of Islands,88.6,0.6186224890470621,https://leetcode.com/problems/number-of-islands,"Array, Depth-First Search, Breadth-First Search, Union Find, Matrix"
HARD,Frog Jump,88.6,0.4644126400214719,https://leetcode.com/problems/frog-jump,"Array, Dynamic Programming"
