Difficulty,Title,Frequency,Acceptance Rate,Link,Topics
MEDIUM,Search Suggestions System,100.0,0.650502807389667,https://leetcode.com/problems/search-suggestions-system,"Array, String, Binary Search, Trie, Sorting, Heap (Priority Queue)"
EASY,Best Time to Buy and Sell Stock,86.4,0.5525963622704052,https://leetcode.com/problems/best-time-to-buy-and-sell-stock,"Array, Dynamic Programming"
MEDIUM,Subarray Product Less Than K,86.4,0.5285349907277894,https://leetcode.com/problems/subarray-product-less-than-k,"Array, Binary Search, Sliding Window, Prefix Sum"
HARD,Minimum Insertion Steps to Make a String Palindrome,69.5,0.7242938226969341,https://leetcode.com/problems/minimum-insertion-steps-to-make-a-string-palindrome,"String, Dynamic Programming"
MEDIUM,Coin Change,69.5,0.4649557971017352,https://leetcode.com/problems/coin-change,"Array, Dynamic Programming, Breadth-First Search"
MEDIUM,Number of Islands,69.5,0.6232010795178101,https://leetcode.com/problems/number-of-islands,"Array, Depth-First Search, Breadth-First Search, Union Find, Matrix"
HARD,Subarrays with K Different Integers,69.5,0.6586583697096432,https://leetcode.com/problems/subarrays-with-k-different-integers,"Array, Hash Table, Sliding Window, Counting"
MEDIUM,Maximum Subarray,69.5,0.5209981132194718,https://leetcode.com/problems/maximum-subarray,"Array, Divide and Conquer, Dynamic Programming"
MEDIUM,Kth Largest Element in an Array,69.5,0.6797702368478369,https://leetcode.com/problems/kth-largest-element-in-an-array,"Array, Divide and Conquer, Sorting, Heap (Priority Queue), Quickselect"
