Difficulty,Title,Frequency,Acceptance Rate,Link,Topics
MEDIUM,Compare Version Numbers,100.0,0.42194327042814245,https://leetcode.com/problems/compare-version-numbers,"Two Pointers, String"
HARD,All O`one Data Structure,98.0,0.4416912164216676,https://leetcode.com/problems/all-oone-data-structure,"Hash Table, Linked List, Design, Doubly-Linked List"
MEDIUM,Merge Intervals,78.9,0.4919411583794839,https://leetcode.com/problems/merge-intervals,"Array, Sorting"
MEDIUM,Letter Combinations of a Phone Number,64.4,0.6359973199042535,https://leetcode.com/problems/letter-combinations-of-a-phone-number,"Hash Table, String, Backtracking"
HARD,Trapping Rain Water,64.4,0.6481313932273953,https://leetcode.com/problems/trapping-rain-water,"Array, Two Pointers, Dynamic Programming, Stack, Monotonic Stack"
MEDIUM,Nested List Weight Sum,64.4,0.8545119196468662,https://leetcode.com/problems/nested-list-weight-sum,"Depth-First Search, Breadth-First Search"
MEDIUM,Divide Two Integers,64.4,0.18311900268509076,https://leetcode.com/problems/divide-two-integers,"Math, Bit Manipulation"
MEDIUM,Time Based Key-Value Store,64.4,0.4929504444589872,https://leetcode.com/problems/time-based-key-value-store,"Hash Table, String, Binary Search, Design"
