Difficulty,Title,Frequency,Acceptance Rate,Link,Topics
EASY,Best Time to Buy and Sell Stock,100.0,0.5506646226842639,https://leetcode.com/problems/best-time-to-buy-and-sell-stock,"Array, Dynamic Programming"
EASY,Check if All Characters Have Equal Number of Occurrences,96.6,0.785280765150332,https://leetcode.com/problems/check-if-all-characters-have-equal-number-of-occurrences,"Hash Table, String, Counting"
MEDIUM,Find All Anagrams in a String,80.4,0.520693356042431,https://leetcode.com/problems/find-all-anagrams-in-a-string,"Hash Table, String, Sliding Window"
EASY,Two Sum,69.9,0.5554757224174278,https://leetcode.com/problems/two-sum,"Array, Hash Table"
HARD,Best Time to Buy and Sell Stock III,69.9,0.5072705409868865,https://leetcode.com/problems/best-time-to-buy-and-sell-stock-iii,"Array, Dynamic Programming"
EASY,Valid Parentheses,61.6,0.42160389265615356,https://leetcode.com/problems/valid-parentheses,"String, Stack"
EASY,Climbing Stairs,61.6,0.5347711268736087,https://leetcode.com/problems/climbing-stairs,"Math, Dynamic Programming, Memoization"
