Difficulty,Title,Frequency,Acceptance Rate,Link,Topics
MEDIUM,Subsets,100.0,0.8063750899409043,https://leetcode.com/problems/subsets,"Array, Backtracking, Bit Manipulation"
MEDIUM,Word Break,100.0,0.4813164430292737,https://leetcode.com/problems/word-break,"Array, Hash Table, String, Dynamic Programming, Trie, Memoization"
MEDIUM,Decode String,98.0,0.6097527574525168,https://leetcode.com/problems/decode-string,"String, Stack, Recursion"
MEDIUM,Longest Substring with At Most K Distinct Characters,95.8,0.49425072745226684,https://leetcode.com/problems/longest-substring-with-at-most-k-distinct-characters,"Hash Table, String, Sliding Window"
HARD,LFU Cache,95.8,0.4627936295651,https://leetcode.com/problems/lfu-cache,"Hash Table, Linked List, Design, Doubly-Linked List"
MEDIUM,LRU Cache,93.4,0.44936812282453253,https://leetcode.com/problems/lru-cache,"Hash Table, Linked List, Design, Doubly-Linked List"
EASY,Find Pivot Index,93.4,0.6035681471878199,https://leetcode.com/problems/find-pivot-index,"Array, Prefix Sum"
HARD,Range Module,93.4,0.4415058625584941,https://leetcode.com/problems/range-module,"Design, Segment Tree, Ordered Set"
MEDIUM,Split BST,93.4,0.8244290147574289,https://leetcode.com/problems/split-bst,"Tree, Binary Search Tree, Recursion, Binary Tree"
HARD,Design In-Memory File System,87.8,0.48122355255382687,https://leetcode.com/problems/design-in-memory-file-system,"Hash Table, String, Design, Trie, Sorting"
MEDIUM,Course Schedule,87.8,0.4894562124188843,https://leetcode.com/problems/course-schedule,"Depth-First Search, Breadth-First Search, Graph, Topological Sort"
MEDIUM,Unique Paths II,80.6,0.4300226552960411,https://leetcode.com/problems/unique-paths-ii,"Array, Dynamic Programming, Matrix"
MEDIUM,Design Twitter,80.6,0.42370677360358394,https://leetcode.com/problems/design-twitter,"Hash Table, Linked List, Design, Heap (Priority Queue)"
MEDIUM,Possible Bipartition,80.6,0.5140137251528344,https://leetcode.com/problems/possible-bipartition,"Depth-First Search, Breadth-First Search, Union Find, Graph"
MEDIUM,Longest Repeating Substring,76.0,0.6296555831961038,https://leetcode.com/problems/longest-repeating-substring,"String, Binary Search, Dynamic Programming, Rolling Hash, Suffix Array, Hash Function"
MEDIUM,Shopping Offers,76.0,0.5184130924333524,https://leetcode.com/problems/shopping-offers,"Array, Dynamic Programming, Backtracking, Bit Manipulation, Memoization, Bitmask"
MEDIUM,Unique Paths,76.0,0.656400280249414,https://leetcode.com/problems/unique-paths,"Math, Dynamic Programming, Combinatorics"
HARD,Regular Expression Matching,76.0,0.2917983113714329,https://leetcode.com/problems/regular-expression-matching,"String, Dynamic Programming, Recursion"
MEDIUM,Longest Substring Without Repeating Characters,70.4,0.36716074592405384,https://leetcode.com/problems/longest-substring-without-repeating-characters,"Hash Table, String, Sliding Window"
HARD,Longest Duplicate Substring,70.4,0.30732810688545326,https://leetcode.com/problems/longest-duplicate-substring,"String, Binary Search, Sliding Window, Rolling Hash, Suffix Array, Hash Function"
MEDIUM,Find K Closest Elements,70.4,0.4853959589088461,https://leetcode.com/problems/find-k-closest-elements,"Array, Two Pointers, Binary Search, Sliding Window, Sorting, Heap (Priority Queue)"
MEDIUM,Design Hit Counter,63.2,0.691337270675372,https://leetcode.com/problems/design-hit-counter,"Array, Binary Search, Design, Queue, Data Stream"
MEDIUM,Number of Distinct Islands,63.2,0.621458351059304,https://leetcode.com/problems/number-of-distinct-islands,"Hash Table, Depth-First Search, Breadth-First Search, Union Find, Hash Function"
MEDIUM,Search a 2D Matrix,63.2,0.5208703420720815,https://leetcode.com/problems/search-a-2d-matrix,"Array, Binary Search, Matrix"
MEDIUM,Cheapest Flights Within K Stops,63.2,0.4025033893530914,https://leetcode.com/problems/cheapest-flights-within-k-stops,"Dynamic Programming, Depth-First Search, Breadth-First Search, Graph, Heap (Priority Queue), Shortest Path"
MEDIUM,Single Element in a Sorted Array,63.2,0.5919308042472639,https://leetcode.com/problems/single-element-in-a-sorted-array,"Array, Binary Search"
MEDIUM,Group Anagrams,63.2,0.7072409107999192,https://leetcode.com/problems/group-anagrams,"Array, Hash Table, String, Sorting"
MEDIUM,Number of Islands,63.2,0.6206905595169755,https://leetcode.com/problems/number-of-islands,"Array, Depth-First Search, Breadth-First Search, Union Find, Matrix"
MEDIUM,Basic Calculator II,63.2,0.4562803602822933,https://leetcode.com/problems/basic-calculator-ii,"Math, String, Stack"
HARD,Sliding Window Maximum,63.2,0.4746535628187695,https://leetcode.com/problems/sliding-window-maximum,"Array, Queue, Sliding Window, Heap (Priority Queue), Monotonic Queue"
HARD,Wildcard Matching,53.1,0.2968679781297749,https://leetcode.com/problems/wildcard-matching,"String, Dynamic Programming, Greedy, Recursion"
HARD,Distinct Subsequences,53.1,0.4984971986433564,https://leetcode.com/problems/distinct-subsequences,"String, Dynamic Programming"
EASY,Split Strings by Separator,53.1,0.7472404239412463,https://leetcode.com/problems/split-strings-by-separator,"Array, String"
MEDIUM,Kth Largest Element in an Array,53.1,0.6783371579246783,https://leetcode.com/problems/kth-largest-element-in-an-array,"Array, Divide and Conquer, Sorting, Heap (Priority Queue), Quickselect"
MEDIUM,Reorganize String,53.1,0.5606352902045568,https://leetcode.com/problems/reorganize-string,"Hash Table, String, Greedy, Sorting, Heap (Priority Queue), Counting"
HARD,Bus Routes,53.1,0.46972511722827187,https://leetcode.com/problems/bus-routes,"Array, Hash Table, Breadth-First Search"
HARD,Find Median from Data Stream,53.1,0.531161702000137,https://leetcode.com/problems/find-median-from-data-stream,"Two Pointers, Design, Sorting, Heap (Priority Queue), Data Stream"
MEDIUM,Open the Lock,53.1,0.6067186981352081,https://leetcode.com/problems/open-the-lock,"Array, Hash Table, String, Breadth-First Search"
MEDIUM,Pacific Atlantic Water Flow,53.1,0.5728127638512825,https://leetcode.com/problems/pacific-atlantic-water-flow,"Array, Depth-First Search, Breadth-First Search, Matrix"
HARD,Maximum Number of Tasks You Can Assign,53.1,0.5088199044831305,https://leetcode.com/problems/maximum-number-of-tasks-you-can-assign,"Array, Two Pointers, Binary Search, Greedy, Queue, Sorting, Monotonic Queue"
HARD,Basic Calculator III,53.1,0.5231221395570788,https://leetcode.com/problems/basic-calculator-iii,"Math, String, Stack, Recursion"
MEDIUM,Increasing Triplet Subsequence,53.1,0.3913982120428223,https://leetcode.com/problems/increasing-triplet-subsequence,"Array, Greedy"
HARD,Number of Atoms,53.1,0.6500347522062385,https://leetcode.com/problems/number-of-atoms,"Hash Table, String, Stack, Sorting"
MEDIUM,Search a 2D Matrix II,53.1,0.5495730370306958,https://leetcode.com/problems/search-a-2d-matrix-ii,"Array, Binary Search, Divide and Conquer, Matrix"
MEDIUM,Remove K Digits,53.1,0.34725492692140314,https://leetcode.com/problems/remove-k-digits,"String, Stack, Greedy, Monotonic Stack"
