Difficulty,Title,Frequency,Acceptance Rate,Link,Topics
HARD,Substring with Concatenation of All Words,100.0,0.3281267726808607,https://leetcode.com/problems/substring-with-concatenation-of-all-words,"Hash Table, String, Sliding Window"
MEDIUM,Decode String,100.0,0.6074726233313084,https://leetcode.com/problems/decode-string,"String, Stack, Recursion"
HARD,Sliding Window Maximum,100.0,0.47299715795214475,https://leetcode.com/problems/sliding-window-maximum,"Array, Queue, Sliding Window, Heap (Priority Queue), Monotonic Queue"
MEDIUM,Simplify Path,87.7,0.4679834400836009,https://leetcode.com/problems/simplify-path,"String, Stack"
EASY,Last Stone Weight,87.7,0.6580386457590245,https://leetcode.com/problems/last-stone-weight,"Array, Heap (Priority Queue)"
MEDIUM,Asteroid Collision,87.7,0.4515128813805077,https://leetcode.com/problems/asteroid-collision,"Array, Stack, Simulation"
MEDIUM,LRU Cache,87.7,0.44550506572503545,https://leetcode.com/problems/lru-cache,"Hash Table, Linked List, Design, Doubly-Linked List"
EASY,Backspace String Compare,87.7,0.49414987179128356,https://leetcode.com/problems/backspace-string-compare,"Two Pointers, String, Stack, Simulation"
MEDIUM,Multiply Strings,87.7,0.4190606118278174,https://leetcode.com/problems/multiply-strings,"Math, String, Simulation"
EASY,Maximum Product of Three Numbers,87.7,0.45238805456443676,https://leetcode.com/problems/maximum-product-of-three-numbers,"Array, Math, Sorting"
MEDIUM,Max Consecutive Ones III,87.7,0.6534602621422735,https://leetcode.com/problems/max-consecutive-ones-iii,"Array, Binary Search, Sliding Window, Prefix Sum"
HARD,Shortest Path to Get All Keys,87.7,0.5363245792550958,https://leetcode.com/problems/shortest-path-to-get-all-keys,"Array, Bit Manipulation, Breadth-First Search, Matrix"
