Difficulty,Title,Frequency,Acceptance Rate,Link,Topics
MEDIUM,House Robber,100.0,0.5192217489249598,https://leetcode.com/problems/house-robber,"Array, Dynamic Programming"
HARD,Partition Array Into Two Arrays to Minimize Sum Difference,100.0,0.2125436763647218,https://leetcode.com/problems/partition-array-into-two-arrays-to-minimize-sum-difference,"Array, Two Pointers, Binary Search, Dynamic Programming, Bit Manipulation, Ordered Set, Bitmask"
MEDIUM,Stone Game VI,93.4,0.5833104034820021,https://leetcode.com/problems/stone-game-vi,"Array, Math, Greedy, Sorting, Heap (Priority Queue), Game Theory"
MEDIUM,Possible Bipartition,93.4,0.511185261772723,https://leetcode.com/problems/possible-bipartition,"Depth-First Search, Breadth-First Search, Union Find, Graph"
MEDIUM,Search in Rotated Sorted Array,93.4,0.42217758079890294,https://leetcode.com/problems/search-in-rotated-sorted-array,"Array, Binary Search"
MEDIUM,Longest Substring Without Repeating Characters,84.9,0.3620170468168149,https://leetcode.com/problems/longest-substring-without-repeating-characters,"Hash Table, String, Sliding Window"
HARD,Binary Tree Maximum Path Sum,84.9,0.40840211658948666,https://leetcode.com/problems/binary-tree-maximum-path-sum,"Dynamic Programming, Tree, Depth-First Search, Binary Tree"
HARD,Find the Count of Monotonic Pairs I,84.9,0.46077890556045903,https://leetcode.com/problems/find-the-count-of-monotonic-pairs-i,"Array, Math, Dynamic Programming, Combinatorics, Prefix Sum"
MEDIUM,Next Permutation,84.9,0.4217879935254849,https://leetcode.com/problems/next-permutation,"Array, Two Pointers"
MEDIUM,Maximum Length of Subarray With Positive Product,84.9,0.4433440356725172,https://leetcode.com/problems/maximum-length-of-subarray-with-positive-product,"Array, Dynamic Programming, Greedy"
HARD,Cycle Length Queries in a Tree,84.9,0.5755752346351801,https://leetcode.com/problems/cycle-length-queries-in-a-tree,"Array, Tree, Binary Tree"
MEDIUM,Count Collisions on a Road,73.0,0.44082758999423377,https://leetcode.com/problems/count-collisions-on-a-road,"String, Stack, Simulation"
MEDIUM,Edit Distance,73.0,0.5807717832700261,https://leetcode.com/problems/edit-distance,"String, Dynamic Programming"
MEDIUM,Maximize the Confusion of an Exam,73.0,0.6803653752541305,https://leetcode.com/problems/maximize-the-confusion-of-an-exam,"String, Binary Search, Sliding Window, Prefix Sum"
MEDIUM,Diagonal Traverse,73.0,0.6230074407217913,https://leetcode.com/problems/diagonal-traverse,"Array, Matrix, Simulation"
MEDIUM,Number of People Aware of a Secret,73.0,0.46006608570596996,https://leetcode.com/problems/number-of-people-aware-of-a-secret,"Dynamic Programming, Queue, Simulation"
HARD,Trapping Rain Water,73.0,0.6412337031221012,https://leetcode.com/problems/trapping-rain-water,"Array, Two Pointers, Dynamic Programming, Stack, Monotonic Stack"
HARD,Minimum Insertion Steps to Make a String Palindrome,73.0,0.719055014416218,https://leetcode.com/problems/minimum-insertion-steps-to-make-a-string-palindrome,"String, Dynamic Programming"
MEDIUM,Koko Eating Bananas,73.0,0.4876489876277416,https://leetcode.com/problems/koko-eating-bananas,"Array, Binary Search"
HARD,Best Time to Buy and Sell Stock IV,73.0,0.4585060164608368,https://leetcode.com/problems/best-time-to-buy-and-sell-stock-iv,"Array, Dynamic Programming"
MEDIUM,Maximum Product Subarray,73.0,0.3445890995792958,https://leetcode.com/problems/maximum-product-subarray,"Array, Dynamic Programming"
