Difficulty,Title,Frequency,Acceptance Rate,Link,Topics
MEDIUM,LRU Cache,100.0,0.45077544232314876,https://leetcode.com/problems/lru-cache,"Hash Table, Linked List, Design, Doubly-Linked List"
MEDIUM,Find the Longest Equal Subarray,94.6,0.3610874744724303,https://leetcode.com/problems/find-the-longest-equal-subarray,"Array, Hash Table, Binary Search, Sliding Window"
MEDIUM,Longest Substring Without Repeating Characters,80.9,0.3682198565892435,https://leetcode.com/problems/longest-substring-without-repeating-characters,"Hash Table, String, Sliding Window"
HARD,Median of Two Sorted Arrays,76.8,0.4365017639239047,https://leetcode.com/problems/median-of-two-sorted-arrays,"Array, Binary Search, Divide and Conquer"
MEDIUM,String Compression,76.8,0.5795978675263941,https://leetcode.com/problems/string-compression,"Two Pointers, String"
MEDIUM,Maximum Length of a Concatenated String with Unique Characters,71.7,0.542432863784609,https://leetcode.com/problems/maximum-length-of-a-concatenated-string-with-unique-characters,"Array, String, Backtracking, Bit Manipulation"
MEDIUM,Binary Tree Level Order Traversal,65.2,0.704508201116059,https://leetcode.com/problems/binary-tree-level-order-traversal,"Tree, Breadth-First Search, Binary Tree"
MEDIUM,Min Stack,65.2,0.563418010882514,https://leetcode.com/problems/min-stack,"Stack, Design"
EASY,Meeting Rooms,65.2,0.5893204901862905,https://leetcode.com/problems/meeting-rooms,"Array, Sorting"
MEDIUM,Minimum Path Sum,65.2,0.6636083903770387,https://leetcode.com/problems/minimum-path-sum,"Array, Dynamic Programming, Matrix"
MEDIUM,Group Anagrams,65.2,0.7083632418759859,https://leetcode.com/problems/group-anagrams,"Array, Hash Table, String, Sorting"
EASY,Two Sum,65.2,0.5568027017042734,https://leetcode.com/problems/two-sum,"Array, Hash Table"
HARD,Sliding Window Maximum,65.2,0.4753678395407196,https://leetcode.com/problems/sliding-window-maximum,"Array, Queue, Sliding Window, Heap (Priority Queue), Monotonic Queue"
MEDIUM,Shortest Path in Binary Matrix,56.1,0.4964862631428797,https://leetcode.com/problems/shortest-path-in-binary-matrix,"Array, Breadth-First Search, Matrix"
EASY,Valid Parentheses,56.1,0.42245375536678687,https://leetcode.com/problems/valid-parentheses,"String, Stack"
MEDIUM,Longest Palindromic Substring,56.1,0.3574433179776544,https://leetcode.com/problems/longest-palindromic-substring,"Two Pointers, String, Dynamic Programming"
MEDIUM,Top K Frequent Words,56.1,0.5922235462505991,https://leetcode.com/problems/top-k-frequent-words,"Array, Hash Table, String, Trie, Sorting, Heap (Priority Queue), Bucket Sort, Counting"
MEDIUM,Word Break,56.1,0.4820221964987093,https://leetcode.com/problems/word-break,"Array, Hash Table, String, Dynamic Programming, Trie, Memoization"
MEDIUM,Integer to Roman,56.1,0.6848162789858621,https://leetcode.com/problems/integer-to-roman,"Hash Table, Math, String"
EASY,Merge Two Sorted Lists,56.1,0.6675279996893344,https://leetcode.com/problems/merge-two-sorted-lists,"Linked List, Recursion"
EASY,Merge Sorted Array,56.1,0.5280222590440881,https://leetcode.com/problems/merge-sorted-array,"Array, Two Pointers, Sorting"
EASY,Design HashMap,56.1,0.6587354202388773,https://leetcode.com/problems/design-hashmap,"Array, Hash Table, Linked List, Design, Hash Function"
MEDIUM,Insert Delete GetRandom O(1),56.1,0.5496100062751186,https://leetcode.com/problems/insert-delete-getrandom-o1,"Array, Hash Table, Math, Design, Randomized"
