Difficulty,Title,Frequency,Acceptance Rate,Link,Topics
EASY,Maximum Depth of N-ary Tree,100.0,0.7278155977546877,https://leetcode.com/problems/maximum-depth-of-n-ary-tree,"Tree, Depth-First Search, Breadth-First Search"
EASY,Most Common Word,96.5,0.44509952730193125,https://leetcode.com/problems/most-common-word,"Array, Hash Table, String, Counting"
EASY,Valid Word Abbreviation,92.3,0.36711376796200573,https://leetcode.com/problems/valid-word-abbreviation,"Two Pointers, String"
MEDIUM,House Robber,92.3,0.520953481215074,https://leetcode.com/problems/house-robber,"Array, Dynamic Programming"
MEDIUM,Coin Change,87.1,0.46046375781490945,https://leetcode.com/problems/coin-change,"Array, Dynamic Programming, Breadth-First Search"
MEDIUM,House Robber II,80.5,0.4328236484228329,https://leetcode.com/problems/house-robber-ii,"Array, Dynamic Programming"
MEDIUM,People Whose List of Favorite Companies Is Not a Subset of Another List,80.5,0.5899529042386186,https://leetcode.com/problems/people-whose-list-of-favorite-companies-is-not-a-subset-of-another-list,"Array, Hash Table, String"
MEDIUM,Design Circular Queue,80.5,0.5246735412488918,https://leetcode.com/problems/design-circular-queue,"Array, Linked List, Design, Queue"
