Difficulty,Title,Frequency,Acceptance Rate,Link,Topics
HARD,Binary Tree Cameras,100.0,0.47030269603482433,https://leetcode.com/problems/binary-tree-cameras,"Dynamic Programming, Tree, Depth-First Search, Binary Tree"
MEDIUM,Largest Number,100.0,0.40996889844189804,https://leetcode.com/problems/largest-number,"Array, String, Greedy, Sorting"
MEDIUM,Keys and Rooms,100.0,0.7439175252276009,https://leetcode.com/problems/keys-and-rooms,"Depth-First Search, Breadth-First Search, Graph"
MEDIUM,Decode Ways,100.0,0.36249252402786974,https://leetcode.com/problems/decode-ways,"String, Dynamic Programming"
MEDIUM,01 Matrix,100.0,0.5094745686404395,https://leetcode.com/problems/01-matrix,"Array, Dynamic Programming, Breadth-First Search, Matrix"
MEDIUM,Course Schedule,100.0,0.48714768924838353,https://leetcode.com/problems/course-schedule,"Depth-First Search, Breadth-First Search, Graph, Topological Sort"
HARD,Collect Coins in a Tree,89.4,0.35517970401691334,https://leetcode.com/problems/collect-coins-in-a-tree,"Array, Tree, Graph, Topological Sort"
