Difficulty,Title,Frequency,Acceptance Rate,Link,Topics
MEDIUM,LRU Cache,100.0,0.44937371975712886,https://leetcode.com/problems/lru-cache,"Hash Table, Linked List, Design, Doubly-Linked List"
HARD,Maximum Number of Visible Points,82.4,0.3759000782150834,https://leetcode.com/problems/maximum-number-of-visible-points,"Array, Math, Geometry, Sliding Window, Sorting"
MEDIUM,Number of Distinct Islands,82.4,0.6214748980673704,https://leetcode.com/problems/number-of-distinct-islands,"Hash Table, Depth-First Search, Breadth-First Search, Union Find, Hash Function"
EASY,Diameter of Binary Tree,82.4,0.6330017764466755,https://leetcode.com/problems/diameter-of-binary-tree,"Tree, Depth-First Search, Binary Tree"
HARD,Word Search II,82.4,0.3720030523717728,https://leetcode.com/problems/word-search-ii,"Array, String, Backtracking, Trie, Matrix"
