Difficulty,Title,Frequency,Acceptance Rate,Link,Topics
EASY,Reverse Degree of a String,100.0,0.8705975043652314,https://leetcode.com/problems/reverse-degree-of-a-string,"String, Simulation"
EASY,Two Sum,80.3,0.5577700897656149,https://leetcode.com/problems/two-sum,"Array, Hash Table"
EASY,Best Time to Buy and Sell Stock,65.4,0.5525965264574566,https://leetcode.com/problems/best-time-to-buy-and-sell-stock,"Array, Dynamic Programming"
EASY,Remove Duplicates from Sorted Array,65.4,0.603556859688818,https://leetcode.com/problems/remove-duplicates-from-sorted-array,"Array, Two Pointers"
EASY,Valid Anagram,65.4,0.6666099304442351,https://leetcode.com/problems/valid-anagram,"Hash Table, String, Sorting"
HARD,Trapping Rain Water,65.4,0.6510207934299767,https://leetcode.com/problems/trapping-rain-water,"Array, Two Pointers, Dynamic Programming, Stack, Monotonic Stack"
MEDIUM,Add Two Numbers,65.4,0.4622518482012795,https://leetcode.com/problems/add-two-numbers,"Linked List, Math, Recursion"
MEDIUM,Find First and Last Position of Element in Sorted Array,65.4,0.4682882945946236,https://leetcode.com/problems/find-first-and-last-position-of-element-in-sorted-array,"Array, Binary Search"
