Difficulty,Title,Frequency,Acceptance Rate,Link,Topics
MEDIUM,Time Based Key-Value Store,100.0,0.49369911229220853,https://leetcode.com/problems/time-based-key-value-store,"Hash Table, String, Binary Search, Design"
MEDIUM,Online Election,94.6,0.5247809065018006,https://leetcode.com/problems/online-election,"Array, Hash Table, Binary Search, Design"
MEDIUM,Open the Lock,87.7,0.6059452748362464,https://leetcode.com/problems/open-the-lock,"Array, Hash Table, String, Breadth-First Search"
HARD,Longest Increasing Path in a Matrix,77.9,0.5496193695302167,https://leetcode.com/problems/longest-increasing-path-in-a-matrix,"Array, Dynamic Programming, Depth-First Search, Breadth-First Search, Graph, Topological Sort, Memoization, Matrix"
EASY,Counter,77.9,0.8211223461364772,https://leetcode.com/problems/counter,
MEDIUM,Rabbits in Forest,77.9,0.5265275410389889,https://leetcode.com/problems/rabbits-in-forest,"Array, Hash Table, Math, Greedy"
MEDIUM,Bulls and Cows,77.9,0.511273402021088,https://leetcode.com/problems/bulls-and-cows,"Hash Table, String, Counting"
