Difficulty,Title,Frequency,Acceptance Rate,Link,Topics
HARD,Median of Two Sorted Arrays,100.0,0.42747222741031293,https://leetcode.com/problems/median-of-two-sorted-arrays,"Array, Binary Search, Divide and Conquer"
EASY,Two Sum,80.0,0.5490436619075413,https://leetcode.com/problems/two-sum,"Array, Hash Table"
EASY,Longest Common Prefix,80.0,0.4474568332158767,https://leetcode.com/problems/longest-common-prefix,"String, Trie"
MEDIUM,Extra Characters in a String,80.0,0.5742984247782659,https://leetcode.com/problems/extra-characters-in-a-string,"Array, Hash Table, String, Dynamic Programming, Trie"
MEDIUM,Maximum Subarray,80.0,0.5164884389388017,https://leetcode.com/problems/maximum-subarray,"Array, Divide and Conquer, Dynamic Programming"
