Difficulty,Title,Frequency,Acceptance Rate,Link,Topics
EASY,The Number of Rich Customers,100.0,0.7747246540525274,https://leetcode.com/problems/the-number-of-rich-customers,Database
EASY,Best Time to Buy and Sell Stock,79.7,0.5515754811958361,https://leetcode.com/problems/best-time-to-buy-and-sell-stock,"Array, Dynamic Programming"
MEDIUM,Group Anagrams,79.7,0.7083652746605121,https://leetcode.com/problems/group-anagrams,"Array, Hash Table, String, Sorting"
EASY,Two Sum,64.3,0.5568033473836207,https://leetcode.com/problems/two-sum,"Array, Hash Table"
MEDIUM,Unique Paths II,64.3,0.43072681514533867,https://leetcode.com/problems/unique-paths-ii,"Array, Dynamic Programming, Matrix"
EASY,Merge Sorted Array,64.3,0.5280234196896436,https://leetcode.com/problems/merge-sorted-array,"Array, Two Pointers, Sorting"
HARD,First Missing Positive,64.3,0.4100779831614997,https://leetcode.com/problems/first-missing-positive,"Array, Hash Table"
MEDIUM,Longest Substring Without Repeating Characters,64.3,0.36822254055427517,https://leetcode.com/problems/longest-substring-without-repeating-characters,"Hash Table, String, Sliding Window"
MEDIUM,Longest Palindromic Substring,64.3,0.35744647711720856,https://leetcode.com/problems/longest-palindromic-substring,"Two Pointers, String, Dynamic Programming"
MEDIUM,Exclusive Time of Functions,64.3,0.6471147564613134,https://leetcode.com/problems/exclusive-time-of-functions,"Array, Stack"
MEDIUM,Merge Intervals,64.3,0.4929265593654659,https://leetcode.com/problems/merge-intervals,"Array, Sorting"
