Difficulty,Title,Frequency,Acceptance Rate,Link,Topics
EASY,Two Sum,100.0,0.5577699318343485,https://leetcode.com/problems/two-sum,"Array, Hash Table"
EASY,Create Hello World Function,76.8,0.8212977812647828,https://leetcode.com/problems/create-hello-world-function,
MEDIUM,Add Two Numbers,73.8,0.4622507658063209,https://leetcode.com/problems/add-two-numbers,"Linked List, Math, Recursion"
EASY,Recyclable and Low Fat Products,72.4,0.8925494047235137,https://leetcode.com/problems/recyclable-and-low-fat-products,Database
EASY,Palindrome Number,69.2,0.5922454861001272,https://leetcode.com/problems/palindrome-number,Math
MEDIUM,3Sum,69.0,0.37070947304965995,https://leetcode.com/problems/3sum,"Array, Two Pointers, Sorting"
HARD,Median of Two Sorted Arrays,68.5,0.4381459000864632,https://leetcode.com/problems/median-of-two-sorted-arrays,"Array, Binary Search, Divide and Conquer"
EASY,Longest Common Prefix,66.3,0.4548305505260665,https://leetcode.com/problems/longest-common-prefix,"String, Trie"
HARD,Trapping Rain Water,66.0,0.6510193676088248,https://leetcode.com/problems/trapping-rain-water,"Array, Two Pointers, Dynamic Programming, Stack, Monotonic Stack"
MEDIUM,Longest Substring Without Repeating Characters,65.1,0.36936167568169936,https://leetcode.com/problems/longest-substring-without-repeating-characters,"Hash Table, String, Sliding Window"
EASY,Remove Duplicates from Sorted Array,63.7,0.6035551112882038,https://leetcode.com/problems/remove-duplicates-from-sorted-array,"Array, Two Pointers"
EASY,Valid Parentheses,60.8,0.42322820646682113,https://leetcode.com/problems/valid-parentheses,"String, Stack"
MEDIUM,Container With Most Water,60.0,0.5778282574410597,https://leetcode.com/problems/container-with-most-water,"Array, Two Pointers, Greedy"
MEDIUM,Longest Palindromic Substring,59.5,0.35846111456358737,https://leetcode.com/problems/longest-palindromic-substring,"Two Pointers, String, Dynamic Programming"
EASY,Roman to Integer,58.6,0.6486626948713667,https://leetcode.com/problems/roman-to-integer,"Hash Table, Math, String"
MEDIUM,Generate Parentheses,58.6,0.7713286717803378,https://leetcode.com/problems/generate-parentheses,"String, Dynamic Programming, Backtracking"
MEDIUM,Longest Consecutive Sequence,58.6,0.47040828018665215,https://leetcode.com/problems/longest-consecutive-sequence,"Array, Hash Table, Union Find"
EASY,Merge Two Sorted Lists,58.6,0.6684091757223755,https://leetcode.com/problems/merge-two-sorted-lists,"Linked List, Recursion"
MEDIUM,Subarray Sum Equals K,58.2,0.4547621523795086,https://leetcode.com/problems/subarray-sum-equals-k,"Array, Hash Table, Prefix Sum"
EASY,Remove Element,57.2,0.600316358048653,https://leetcode.com/problems/remove-element,"Array, Two Pointers"
MEDIUM,Next Permutation,56.2,0.4305773671839413,https://leetcode.com/problems/next-permutation,"Array, Two Pointers"
MEDIUM,Maximum Subarray,56.2,0.5209977771112393,https://leetcode.com/problems/maximum-subarray,"Array, Divide and Conquer, Dynamic Programming"
MEDIUM,Reverse Integer,56.2,0.3030891979001635,https://leetcode.com/problems/reverse-integer,Math
MEDIUM,Zigzag Conversion,54.0,0.5160676713980508,https://leetcode.com/problems/zigzag-conversion,String
EASY,Pascal's Triangle,53.3,0.770215491719448,https://leetcode.com/problems/pascals-triangle,"Array, Dynamic Programming"
MEDIUM,Decode String,53.3,0.6115249906697672,https://leetcode.com/problems/decode-string,"String, Stack, Recursion"
EASY,Valid Anagram,52.7,0.6666089667345674,https://leetcode.com/problems/valid-anagram,"Hash Table, String, Sorting"
MEDIUM,4Sum,52.7,0.38219020113793045,https://leetcode.com/problems/4sum,"Array, Two Pointers, Sorting"
MEDIUM,"Pow(x, n)",52.7,0.37023188235218485,https://leetcode.com/problems/powx-n,"Math, Recursion"
MEDIUM,Spiral Matrix,52.7,0.5393973501075863,https://leetcode.com/problems/spiral-matrix,"Array, Matrix, Simulation"
MEDIUM,Rotate Image,52.1,0.7790164518819447,https://leetcode.com/problems/rotate-image,"Array, Math, Matrix"
MEDIUM,House Robber,52.1,0.5230496798578786,https://leetcode.com/problems/house-robber,"Array, Dynamic Programming"
MEDIUM,Letter Combinations of a Phone Number,51.4,0.6385756647080152,https://leetcode.com/problems/letter-combinations-of-a-phone-number,"Hash Table, String, Backtracking"
EASY,Search Insert Position,49.9,0.4901241638473952,https://leetcode.com/problems/search-insert-position,"Array, Binary Search"
MEDIUM,Remove Nth Node From End of List,49.9,0.48961030525634286,https://leetcode.com/problems/remove-nth-node-from-end-of-list,"Linked List, Two Pointers"
MEDIUM,Group Anagrams,49.2,0.7092881169411895,https://leetcode.com/problems/group-anagrams,"Array, Hash Table, String, Sorting"
MEDIUM,Find First and Last Position of Element in Sorted Array,47.5,0.4682873183580639,https://leetcode.com/problems/find-first-and-last-position-of-element-in-sorted-array,"Array, Binary Search"
EASY,Reverse Linked List,47.5,0.7920654119580827,https://leetcode.com/problems/reverse-linked-list,"Linked List, Recursion"
EASY,Find the Index of the First Occurrence in a String,46.6,0.449716000865219,https://leetcode.com/problems/find-the-index-of-the-first-occurrence-in-a-string,"Two Pointers, String, String Matching"
HARD,First Missing Positive,45.7,0.4108465766394882,https://leetcode.com/problems/first-missing-positive,"Array, Hash Table"
MEDIUM,Permutations,45.7,0.8066011364163758,https://leetcode.com/problems/permutations,"Array, Backtracking"
MEDIUM,Valid Sudoku,45.7,0.6227675793740958,https://leetcode.com/problems/valid-sudoku,"Array, Hash Table, Matrix"
MEDIUM,Search in Rotated Sorted Array,45.7,0.4283722138743466,https://leetcode.com/problems/search-in-rotated-sorted-array,"Array, Binary Search"
HARD,Merge k Sorted Lists,44.7,0.567741907864408,https://leetcode.com/problems/merge-k-sorted-lists,"Linked List, Divide and Conquer, Heap (Priority Queue), Merge Sort"
HARD,Binary Tree Maximum Path Sum,43.7,0.41224270953366093,https://leetcode.com/problems/binary-tree-maximum-path-sum,"Dynamic Programming, Tree, Depth-First Search, Binary Tree"
MEDIUM,Longest Increasing Subsequence,43.7,0.5780834572811812,https://leetcode.com/problems/longest-increasing-subsequence,"Array, Binary Search, Dynamic Programming"
HARD,Reverse Nodes in k-Group,42.5,0.6304374335039493,https://leetcode.com/problems/reverse-nodes-in-k-group,"Linked List, Recursion"
MEDIUM,Divide Two Integers,42.5,0.18396975085033054,https://leetcode.com/problems/divide-two-integers,"Math, Bit Manipulation"
HARD,Regular Expression Matching,41.4,0.29280131010169236,https://leetcode.com/problems/regular-expression-matching,"String, Dynamic Programming, Recursion"
MEDIUM,3Sum Closest,41.4,0.468869600214817,https://leetcode.com/problems/3sum-closest,"Array, Two Pointers, Sorting"
EASY,Intersection of Two Arrays,41.4,0.764742832671859,https://leetcode.com/problems/intersection-of-two-arrays,"Array, Hash Table, Two Pointers, Binary Search, Sorting"
MEDIUM,Combination Sum,41.4,0.7467467920803577,https://leetcode.com/problems/combination-sum,"Array, Backtracking"
HARD,Sudoku Solver,41.4,0.6390871778033164,https://leetcode.com/problems/sudoku-solver,"Array, Hash Table, Backtracking, Matrix"
MEDIUM,Sum of Subarray Minimums,40.1,0.3762351166424223,https://leetcode.com/problems/sum-of-subarray-minimums,"Array, Dynamic Programming, Stack, Monotonic Stack"
MEDIUM,Swap Nodes in Pairs,37.2,0.6720136828647639,https://leetcode.com/problems/swap-nodes-in-pairs,"Linked List, Recursion"
MEDIUM,String to Integer (atoi),37.2,0.19229423495277723,https://leetcode.com/problems/string-to-integer-atoi,String
MEDIUM,Find the Duplicate Number,37.2,0.6283577384693005,https://leetcode.com/problems/find-the-duplicate-number,"Array, Two Pointers, Binary Search, Bit Manipulation"
EASY,Missing Number,37.2,0.7006534938999994,https://leetcode.com/problems/missing-number,"Array, Hash Table, Math, Binary Search, Bit Manipulation, Sorting"
EASY,Big Countries,37.2,0.6818920862237663,https://leetcode.com/problems/big-countries,Database
MEDIUM,Target Sum,37.2,0.5076651123616494,https://leetcode.com/problems/target-sum,"Array, Dynamic Programming, Backtracking"
HARD,Burst Balloons,37.2,0.6131500044712985,https://leetcode.com/problems/burst-balloons,"Array, Dynamic Programming"
EASY,First Unique Character in a String,37.2,0.6369545656040947,https://leetcode.com/problems/first-unique-character-in-a-string,"Hash Table, String, Queue, Counting"
MEDIUM,Rotate List,37.2,0.39944772716128085,https://leetcode.com/problems/rotate-list,"Linked List, Two Pointers"
HARD,Meeting Rooms III,35.6,0.4393472442856221,https://leetcode.com/problems/meeting-rooms-iii,"Array, Hash Table, Sorting, Heap (Priority Queue), Simulation"
HARD,Odd Even Jump,35.6,0.40720727497638814,https://leetcode.com/problems/odd-even-jump,"Array, Dynamic Programming, Stack, Monotonic Stack, Ordered Set"
MEDIUM,Second Highest Salary,35.6,0.4386508095849322,https://leetcode.com/problems/second-highest-salary,Database
EASY,Isomorphic Strings,35.6,0.4685795790862557,https://leetcode.com/problems/isomorphic-strings,"Hash Table, String"
MEDIUM,Pacific Atlantic Water Flow,33.8,0.5753385838153038,https://leetcode.com/problems/pacific-atlantic-water-flow,"Array, Depth-First Search, Breadth-First Search, Matrix"
HARD,Longest Valid Parentheses,33.8,0.3631311456770452,https://leetcode.com/problems/longest-valid-parentheses,"String, Dynamic Programming, Stack"
MEDIUM,Jump Game II,33.8,0.41503284528575435,https://leetcode.com/problems/jump-game-ii,"Array, Dynamic Programming, Greedy"
HARD,Trapping Rain Water II,33.8,0.588762524838287,https://leetcode.com/problems/trapping-rain-water-ii,"Array, Breadth-First Search, Heap (Priority Queue), Matrix"
MEDIUM,Subsets II,33.8,0.595072748658621,https://leetcode.com/problems/subsets-ii,"Array, Backtracking, Bit Manipulation"
HARD,Time Taken to Cross the Door,33.8,0.4947985404859871,https://leetcode.com/problems/time-taken-to-cross-the-door,"Array, Queue, Simulation"
MEDIUM,Minimum Path Sum,31.8,0.664814934885504,https://leetcode.com/problems/minimum-path-sum,"Array, Dynamic Programming, Matrix"
MEDIUM,Evaluate Division,31.8,0.6314695091079937,https://leetcode.com/problems/evaluate-division,"Array, String, Depth-First Search, Breadth-First Search, Union Find, Graph, Shortest Path"
EASY,Implement Stack using Queues,31.8,0.6733897915056893,https://leetcode.com/problems/implement-stack-using-queues,"Stack, Design, Queue"
MEDIUM,Integer to Roman,31.8,0.6861931275088928,https://leetcode.com/problems/integer-to-roman,"Hash Table, Math, String"
MEDIUM,Find All Possible Recipes from Given Supplies,31.8,0.5646091593277981,https://leetcode.com/problems/find-all-possible-recipes-from-given-supplies,"Array, Hash Table, String, Graph, Topological Sort"
MEDIUM,Minimum Falling Path Sum,31.8,0.6144004812942054,https://leetcode.com/problems/minimum-falling-path-sum,"Array, Dynamic Programming, Matrix"
MEDIUM,Single Number II,31.8,0.6522776346186073,https://leetcode.com/problems/single-number-ii,"Array, Bit Manipulation"
HARD,Wildcard Matching,29.5,0.2989835093068089,https://leetcode.com/problems/wildcard-matching,"String, Dynamic Programming, Greedy, Recursion"
MEDIUM,Surrounded Regions,29.5,0.42886447562449315,https://leetcode.com/problems/surrounded-regions,"Array, Depth-First Search, Breadth-First Search, Union Find, Matrix"
MEDIUM,Fruit Into Baskets,27.0,0.4642784173371472,https://leetcode.com/problems/fruit-into-baskets,"Array, Hash Table, Sliding Window"
MEDIUM,Copy List with Random Pointer,27.0,0.6053669280147949,https://leetcode.com/problems/copy-list-with-random-pointer,"Hash Table, Linked List"
MEDIUM,Detonate the Maximum Bombs,27.0,0.492066898115528,https://leetcode.com/problems/detonate-the-maximum-bombs,"Array, Math, Depth-First Search, Breadth-First Search, Graph, Geometry"
MEDIUM,Delete Node in a Linked List,24.0,0.8231559199073729,https://leetcode.com/problems/delete-node-in-a-linked-list,Linked List
EASY,Moving Average from Data Stream,24.0,0.7993882465731537,https://leetcode.com/problems/moving-average-from-data-stream,"Array, Design, Queue, Data Stream"
MEDIUM,Minimum Remove to Make Valid Parentheses,24.0,0.7074654274676669,https://leetcode.com/problems/minimum-remove-to-make-valid-parentheses,"String, Stack"
MEDIUM,Hand of Straights,20.4,0.5710230469118233,https://leetcode.com/problems/hand-of-straights,"Array, Hash Table, Greedy, Sorting"
MEDIUM,Detect Squares,20.4,0.5130252857014308,https://leetcode.com/problems/detect-squares,"Array, Hash Table, Design, Counting"
EASY,Reverse String,20.4,0.7976436563508422,https://leetcode.com/problems/reverse-string,"Two Pointers, String"
MEDIUM,Graph Valid Tree,16.0,0.4933560205084969,https://leetcode.com/problems/graph-valid-tree,"Depth-First Search, Breadth-First Search, Union Find, Graph"
EASY,Make The String Great,16.0,0.6827752983137568,https://leetcode.com/problems/make-the-string-great,"String, Stack"
EASY,Get the Size of a DataFrame,16.0,0.8518924318016196,https://leetcode.com/problems/get-the-size-of-a-dataframe,
HARD,Robot Room Cleaner,16.0,0.7752279751307165,https://leetcode.com/problems/robot-room-cleaner,"Backtracking, Interactive"
EASY,To Be Or Not To Be,16.0,0.6295807994256238,https://leetcode.com/problems/to-be-or-not-to-be,
MEDIUM,Find the Safest Path in a Grid,16.0,0.48397269180754227,https://leetcode.com/problems/find-the-safest-path-in-a-grid,"Array, Binary Search, Breadth-First Search, Union Find, Heap (Priority Queue), Matrix"
HARD,Word Search II,10.5,0.3732633211647155,https://leetcode.com/problems/word-search-ii,"Array, String, Backtracking, Trie, Matrix"
MEDIUM,Smallest String Starting From Leaf,10.5,0.608103369683369,https://leetcode.com/problems/smallest-string-starting-from-leaf,"String, Backtracking, Tree, Depth-First Search, Binary Tree"
HARD,Shortest Distance from All Buildings,10.5,0.4437276667084348,https://leetcode.com/problems/shortest-distance-from-all-buildings,"Array, Breadth-First Search, Matrix"
