Difficulty,Title,Frequency,Acceptance Rate,Link,Topics
MEDIUM,Replace the Substring for Balanced String,100.0,0.39249187112030737,https://leetcode.com/problems/replace-the-substring-for-balanced-string,"String, Sliding Window"
MEDIUM,Merge Operations to Turn Array Into a Palindrome,91.1,0.6901474557046192,https://leetcode.com/problems/merge-operations-to-turn-array-into-a-palindrome,"Array, Two Pointers, Greedy"
EASY,Climbing Stairs,79.8,0.5341042560232687,https://leetcode.com/problems/climbing-stairs,"Math, Dynamic Programming, Memoization"
EASY,Two Sum,75.8,0.5533888042849439,https://leetcode.com/problems/two-sum,"Array, Hash Table"
MEDIUM,Longest Substring Without Repeating Characters,70.9,0.3654417753337983,https://leetcode.com/problems/longest-substring-without-repeating-characters,"Hash Table, String, Sliding Window"
EASY,Valid Parentheses,64.6,0.4202381293435973,https://leetcode.com/problems/valid-parentheses,"String, Stack"
MEDIUM,Longest Palindromic Substring,64.6,0.3549137957935394,https://leetcode.com/problems/longest-palindromic-substring,"Two Pointers, String, Dynamic Programming"
EASY,Longest Common Prefix,55.7,0.4510244637642178,https://leetcode.com/problems/longest-common-prefix,"String, Trie"
HARD,Trapping Rain Water,55.7,0.6456514616355924,https://leetcode.com/problems/trapping-rain-water,"Array, Two Pointers, Dynamic Programming, Stack, Monotonic Stack"
MEDIUM,Binary Tree Right Side View,55.7,0.6618896276460269,https://leetcode.com/problems/binary-tree-right-side-view,"Tree, Depth-First Search, Breadth-First Search, Binary Tree"
EASY,Reverse Vowels of a String,55.7,0.574555653791043,https://leetcode.com/problems/reverse-vowels-of-a-string,"Two Pointers, String"
MEDIUM,Search in Rotated Sorted Array,55.7,0.42508098086855695,https://leetcode.com/problems/search-in-rotated-sorted-array,"Array, Binary Search"
MEDIUM,Longest Common Subsequence,55.7,0.5807606225410025,https://leetcode.com/problems/longest-common-subsequence,"String, Dynamic Programming"
MEDIUM,Remove Duplicates from Sorted Array II,55.7,0.6248689734573933,https://leetcode.com/problems/remove-duplicates-from-sorted-array-ii,"Array, Two Pointers"
MEDIUM,Container With Most Water,55.7,0.5740140078794871,https://leetcode.com/problems/container-with-most-water,"Array, Two Pointers, Greedy"
MEDIUM,Longest Consecutive Sequence,55.7,0.4712653874472139,https://leetcode.com/problems/longest-consecutive-sequence,"Array, Hash Table, Union Find"
MEDIUM,Asteroid Collision,55.7,0.45208098748645603,https://leetcode.com/problems/asteroid-collision,"Array, Stack, Simulation"
EASY,Best Time to Buy and Sell Stock,55.7,0.5492515553502606,https://leetcode.com/problems/best-time-to-buy-and-sell-stock,"Array, Dynamic Programming"
