Difficulty,Title,Frequency,Acceptance Rate,Link,Topics
MEDIUM,Insert Delete GetRandom O(1),100.0,0.5492714631126066,https://leetcode.com/problems/insert-delete-getrandom-o1,"Array, Hash Table, Math, Design, Randomized"
MEDIUM,Flatten Nested List Iterator,96.3,0.6516991969156504,https://leetcode.com/problems/flatten-nested-list-iterator,"Stack, Tree, Depth-First Search, Design, Queue, Iterator"
MEDIUM,Merge Intervals,96.3,0.4919332722268555,https://leetcode.com/problems/merge-intervals,"Array, Sorting"
MEDIUM,Design Twitter,94.2,0.42370677360358394,https://leetcode.com/problems/design-twitter,"Hash Table, Linked List, Design, Heap (Priority Queue)"
HARD,Trapping Rain Water,94.2,0.6481190753359953,https://leetcode.com/problems/trapping-rain-water,"Array, Two Pointers, Dynamic Programming, Stack, Monotonic Stack"
MEDIUM,Tweet Counts Per Frequency,94.2,0.45202121775856,https://leetcode.com/problems/tweet-counts-per-frequency,"Hash Table, Binary Search, Design, Sorting, Ordered Set"
MEDIUM,Implement Trie (Prefix Tree),94.2,0.6770012182141728,https://leetcode.com/problems/implement-trie-prefix-tree,"Hash Table, String, Design, Trie"
HARD,Best Meeting Point,91.9,0.6124298145240693,https://leetcode.com/problems/best-meeting-point,"Array, Math, Sorting, Matrix"
MEDIUM,LRU Cache,91.9,0.4493678413873448,https://leetcode.com/problems/lru-cache,"Hash Table, Linked List, Design, Doubly-Linked List"
MEDIUM,Investments in 2016,91.9,0.4996269075267139,https://leetcode.com/problems/investments-in-2016,Database
EASY,Customer Placing the Largest Number of Orders,89.4,0.6439268295447246,https://leetcode.com/problems/customer-placing-the-largest-number-of-orders,Database
MEDIUM,Minimum Genetic Mutation,89.4,0.5530613193810553,https://leetcode.com/problems/minimum-genetic-mutation,"Hash Table, String, Breadth-First Search"
MEDIUM,Minimum Number of Steps to Make Two Strings Anagram,89.4,0.821256554282131,https://leetcode.com/problems/minimum-number-of-steps-to-make-two-strings-anagram,"Hash Table, String, Counting"
MEDIUM,Validate IP Address,89.4,0.277671821849418,https://leetcode.com/problems/validate-ip-address,String
MEDIUM,Count Student Number in Departments,89.4,0.5971886864548019,https://leetcode.com/problems/count-student-number-in-departments,Database
MEDIUM,Rectangles Area,89.4,0.6870726029390368,https://leetcode.com/problems/rectangles-area,Database
EASY,Invalid Tweets,89.4,0.8557267849118447,https://leetcode.com/problems/invalid-tweets,Database
MEDIUM,Tree Node,89.4,0.7373133409516774,https://leetcode.com/problems/tree-node,Database
MEDIUM,Number of Black Blocks,89.4,0.38025149585639784,https://leetcode.com/problems/number-of-black-blocks,"Array, Hash Table, Enumeration"
MEDIUM,Masking Personal Information,89.4,0.5039316909538435,https://leetcode.com/problems/masking-personal-information,String
MEDIUM,Design Authentication Manager,89.4,0.5766618911174786,https://leetcode.com/problems/design-authentication-manager,"Hash Table, Linked List, Design, Doubly-Linked List"
MEDIUM,Minimum Elements to Add to Form a Given Sum,89.4,0.4423901922421066,https://leetcode.com/problems/minimum-elements-to-add-to-form-a-given-sum,"Array, Greedy"
EASY,Binary Gap,89.4,0.6452825604233177,https://leetcode.com/problems/binary-gap,Bit Manipulation
MEDIUM,Finding the Users Active Minutes,89.4,0.8044113606274823,https://leetcode.com/problems/finding-the-users-active-minutes,"Array, Hash Table"
MEDIUM,Process Tasks Using Servers,89.4,0.4095165572454671,https://leetcode.com/problems/process-tasks-using-servers,"Array, Heap (Priority Queue)"
MEDIUM,Remove All Occurrences of a Substring,89.4,0.7803061530390467,https://leetcode.com/problems/remove-all-occurrences-of-a-substring,"String, Stack, Simulation"
MEDIUM,Count Sub Islands,89.4,0.7279401584083898,https://leetcode.com/problems/count-sub-islands,"Array, Depth-First Search, Breadth-First Search, Union Find, Matrix"
HARD,Trapping Rain Water II,89.4,0.5876456485491875,https://leetcode.com/problems/trapping-rain-water-ii,"Array, Breadth-First Search, Heap (Priority Queue), Matrix"
HARD,Regular Expression Matching,89.4,0.2917983113714329,https://leetcode.com/problems/regular-expression-matching,"String, Dynamic Programming, Recursion"
MEDIUM,Kth Smallest Element in a Sorted Matrix,89.4,0.6344292856918246,https://leetcode.com/problems/kth-smallest-element-in-a-sorted-matrix,"Array, Binary Search, Sorting, Heap (Priority Queue), Matrix"
MEDIUM,Integer to Roman,89.4,0.6832934854876588,https://leetcode.com/problems/integer-to-roman,"Hash Table, Math, String"
EASY,Valid Parentheses,89.4,0.4216001209163637,https://leetcode.com/problems/valid-parentheses,"String, Stack"
HARD,Merge k Sorted Lists,89.4,0.564431021632472,https://leetcode.com/problems/merge-k-sorted-lists,"Linked List, Divide and Conquer, Heap (Priority Queue), Merge Sort"
MEDIUM,Multiply Strings,89.4,0.4214940307686939,https://leetcode.com/problems/multiply-strings,"Math, String, Simulation"
HARD,Wildcard Matching,89.4,0.296867387498782,https://leetcode.com/problems/wildcard-matching,"String, Dynamic Programming, Greedy, Recursion"
HARD,Permutation Sequence,89.4,0.4967040442778241,https://leetcode.com/problems/permutation-sequence,"Math, Recursion"
EASY,Pascal's Triangle,89.4,0.7679881007126811,https://leetcode.com/problems/pascals-triangle,"Array, Dynamic Programming"
HARD,Word Break II,89.4,0.5339045700377414,https://leetcode.com/problems/word-break-ii,"Array, Hash Table, String, Dynamic Programming, Backtracking, Trie, Memoization"
EASY,Time Needed to Buy Tickets,89.4,0.7056449901384577,https://leetcode.com/problems/time-needed-to-buy-tickets,"Array, Queue, Simulation"
HARD,Max Points on a Line,89.4,0.28776474860230267,https://leetcode.com/problems/max-points-on-a-line,"Array, Hash Table, Math, Geometry"
MEDIUM,One Edit Distance,89.4,0.3446347886943496,https://leetcode.com/problems/one-edit-distance,"Two Pointers, String"
EASY,Happy Number,89.4,0.5788713195201745,https://leetcode.com/problems/happy-number,"Hash Table, Math, Two Pointers"
EASY,Reverse Linked List,89.4,0.790045117021991,https://leetcode.com/problems/reverse-linked-list,"Linked List, Recursion"
HARD,The Skyline Problem,89.4,0.43848070697541375,https://leetcode.com/problems/the-skyline-problem,"Array, Divide and Conquer, Binary Indexed Tree, Segment Tree, Line Sweep, Heap (Priority Queue), Ordered Set"
MEDIUM,Lowest Common Ancestor of a Binary Search Tree,89.4,0.6798330215317399,https://leetcode.com/problems/lowest-common-ancestor-of-a-binary-search-tree,"Tree, Depth-First Search, Binary Search Tree, Binary Tree"
MEDIUM,Flatten 2D Vector,89.4,0.5009147536699046,https://leetcode.com/problems/flatten-2d-vector,"Array, Two Pointers, Design, Iterator"
HARD,Alien Dictionary,89.4,0.36595287601625176,https://leetcode.com/problems/alien-dictionary,"Array, String, Depth-First Search, Breadth-First Search, Graph, Topological Sort"
HARD,Design Skiplist,89.4,0.5798580392963687,https://leetcode.com/problems/design-skiplist,"Linked List, Design"
MEDIUM,Number of Connected Components in an Undirected Graph,89.4,0.6409943179534988,https://leetcode.com/problems/number-of-connected-components-in-an-undirected-graph,"Depth-First Search, Breadth-First Search, Union Find, Graph"
MEDIUM,Random Pick with Weight,47.6,0.48157458186766305,https://leetcode.com/problems/random-pick-with-weight,"Array, Math, Binary Search, Prefix Sum, Randomized"
MEDIUM,Number of Islands,47.6,0.6206906914016898,https://leetcode.com/problems/number-of-islands,"Array, Depth-First Search, Breadth-First Search, Union Find, Matrix"
MEDIUM,Rotting Oranges,47.6,0.5635832925418298,https://leetcode.com/problems/rotting-oranges,"Array, Breadth-First Search, Matrix"
