Difficulty,Title,Frequency,Acceptance Rate,Link,Topics
EASY,Valid Parentheses,100.0,0.4202375833975966,https://leetcode.com/problems/valid-parentheses,"String, Stack"
MEDIUM,Generate Parentheses,100.0,0.7675059839686399,https://leetcode.com/problems/generate-parentheses,"String, Dynamic Programming, Backtracking"
MEDIUM,Gas Station,100.0,0.4609985730946905,https://leetcode.com/problems/gas-station,"Array, Greedy"
EASY,Maximum Number of Balls in a Box,100.0,0.7411456012673895,https://leetcode.com/problems/maximum-number-of-balls-in-a-box,"Hash Table, Math, Counting"
HARD,Collect Coins in a Tree,100.0,0.35517970401691334,https://leetcode.com/problems/collect-coins-in-a-tree,"Array, Tree, Graph, Topological Sort"
MEDIUM,Longest Substring Without Repeating Characters,100.0,0.36544096999973874,https://leetcode.com/problems/longest-substring-without-repeating-characters,"Hash Table, String, Sliding Window"
