Difficulty,Title,Frequency,Acceptance Rate,Link,Topics
MEDIUM,Count Ways to Group Overlapping Ranges,100.0,0.3744733629956294,https://leetcode.com/problems/count-ways-to-group-overlapping-ranges,"Array, Sorting"
EASY,Minimum Operations to Make Columns Strictly Increasing,92.5,0.7315150012397719,https://leetcode.com/problems/minimum-operations-to-make-columns-strictly-increasing,"Array, Greedy, Matrix"
EASY,Minimum Absolute Difference,84.6,0.7022436857342518,https://leetcode.com/problems/minimum-absolute-difference,"Array, Sorting"
MEDIUM,Count Vowel Strings in Ranges,84.6,0.6794097895836443,https://leetcode.com/problems/count-vowel-strings-in-ranges,"Array, String, Prefix Sum"
MEDIUM,Integer to Roman,81.2,0.6765156896169067,https://leetcode.com/problems/integer-to-roman,"Hash Table, Math, String"
MEDIUM,Merge Intervals,77.2,0.48695114210994406,https://leetcode.com/problems/merge-intervals,"Array, Sorting"
EASY,Find Pivot Index,77.2,0.5974560125364898,https://leetcode.com/problems/find-pivot-index,"Array, Prefix Sum"
EASY,Maximum Units on a Truck,72.2,0.739942171923227,https://leetcode.com/problems/maximum-units-on-a-truck,"Array, Greedy, Sorting"
EASY,Largest Number After Digit Swaps by Parity,72.2,0.6315896115660123,https://leetcode.com/problems/largest-number-after-digit-swaps-by-parity,"Sorting, Heap (Priority Queue)"
EASY,Merge Strings Alternately,65.9,0.8169988371622129,https://leetcode.com/problems/merge-strings-alternately,"Two Pointers, String"
MEDIUM,Remove All Occurrences of a Substring,65.9,0.7805567643511668,https://leetcode.com/problems/remove-all-occurrences-of-a-substring,"String, Stack, Simulation"
MEDIUM,Longest Consecutive Sequence,65.9,0.47255052704199924,https://leetcode.com/problems/longest-consecutive-sequence,"Array, Hash Table, Union Find"
MEDIUM,Longest Substring Without Repeating Characters,65.9,0.3620166007695641,https://leetcode.com/problems/longest-substring-without-repeating-characters,"Hash Table, String, Sliding Window"
MEDIUM,Make Lexicographically Smallest Array by Swapping Elements,65.9,0.604216330376169,https://leetcode.com/problems/make-lexicographically-smallest-array-by-swapping-elements,"Array, Union Find, Sorting"
EASY,Two Sum,56.9,0.5490430716737353,https://leetcode.com/problems/two-sum,"Array, Hash Table"
EASY,Valid Parentheses,56.9,0.41739378315769327,https://leetcode.com/problems/valid-parentheses,"String, Stack"
EASY,Best Time to Buy and Sell Stock,56.9,0.5468401566970827,https://leetcode.com/problems/best-time-to-buy-and-sell-stock,"Array, Dynamic Programming"
EASY,Kth Missing Positive Number,56.9,0.6165839852649548,https://leetcode.com/problems/kth-missing-positive-number,"Array, Binary Search"
