Difficulty,Title,Frequency,Acceptance Rate,Link,Topics
MEDIUM,Count Ways to Group Overlapping Ranges,100.0,0.37962875895661324,https://leetcode.com/problems/count-ways-to-group-overlapping-ranges,"Array, Sorting"
EASY,Minimum Operations to Make Columns Strictly Increasing,92.1,0.7197777477842264,https://leetcode.com/problems/minimum-operations-to-make-columns-strictly-increasing,"Array, Greedy, Matrix"
MEDIUM,Count Vowel Strings in Ranges,86.9,0.6789380389535854,https://leetcode.com/problems/count-vowel-strings-in-ranges,"Array, String, Prefix Sum"
MEDIUM,Integer to Roman,86.9,0.6832933587164145,https://leetcode.com/problems/integer-to-roman,"Hash Table, Math, String"
EASY,Minimum Absolute Difference,83.8,0.7052939835308818,https://leetcode.com/problems/minimum-absolute-difference,"Array, Sorting"
MEDIUM,Merge Intervals,83.8,0.4919338752832988,https://leetcode.com/problems/merge-intervals,"Array, Sorting"
EASY,Maximum Units on a Truck,80.2,0.7418706230133775,https://leetcode.com/problems/maximum-units-on-a-truck,"Array, Greedy, Sorting"
EASY,Find Pivot Index,80.2,0.6035680644463337,https://leetcode.com/problems/find-pivot-index,"Array, Prefix Sum"
EASY,Merge Strings Alternately,70.8,0.8219455847294467,https://leetcode.com/problems/merge-strings-alternately,"Two Pointers, String"
EASY,Largest Number After Digit Swaps by Parity,70.8,0.635175007883238,https://leetcode.com/problems/largest-number-after-digit-swaps-by-parity,"Sorting, Heap (Priority Queue)"
MEDIUM,Longest Substring Without Repeating Characters,70.8,0.3671606743216183,https://leetcode.com/problems/longest-substring-without-repeating-characters,"Hash Table, String, Sliding Window"
EASY,Height Checker,70.8,0.8109169935850784,https://leetcode.com/problems/height-checker,"Array, Sorting, Counting Sort"
MEDIUM,Remove All Occurrences of a Substring,64.1,0.7803116356303561,https://leetcode.com/problems/remove-all-occurrences-of-a-substring,"String, Stack, Simulation"
MEDIUM,Longest Consecutive Sequence,64.1,0.47071135848458695,https://leetcode.com/problems/longest-consecutive-sequence,"Array, Hash Table, Union Find"
MEDIUM,Make Lexicographically Smallest Array by Swapping Elements,64.1,0.6026454537045601,https://leetcode.com/problems/make-lexicographically-smallest-array-by-swapping-elements,"Array, Union Find, Sorting"
EASY,Fizz Buzz,64.1,0.7421967351429027,https://leetcode.com/problems/fizz-buzz,"Math, String, Simulation"
EASY,Best Time to Buy and Sell Stock,64.1,0.5506573090462593,https://leetcode.com/problems/best-time-to-buy-and-sell-stock,"Array, Dynamic Programming"
EASY,Minimum Value to Get Positive Step by Step Sum,54.7,0.6476321518766873,https://leetcode.com/problems/minimum-value-to-get-positive-step-by-step-sum,"Array, Prefix Sum"
MEDIUM,Longest Mountain in Array,54.7,0.41007518796992476,https://leetcode.com/problems/longest-mountain-in-array,"Array, Two Pointers, Dynamic Programming, Enumeration"
MEDIUM,Gray Code,54.7,0.6162848233292277,https://leetcode.com/problems/gray-code,"Math, Backtracking, Bit Manipulation"
MEDIUM,3Sum,54.7,0.36840321829685435,https://leetcode.com/problems/3sum,"Array, Two Pointers, Sorting"
MEDIUM,Rotate Image,54.7,0.7762105888983161,https://leetcode.com/problems/rotate-image,"Array, Math, Matrix"
MEDIUM,Group Anagrams,54.7,0.707240357115704,https://leetcode.com/problems/group-anagrams,"Array, Hash Table, String, Sorting"
EASY,Two Sum,54.7,0.5554648833378357,https://leetcode.com/problems/two-sum,"Array, Hash Table"
MEDIUM,Sort Characters By Frequency,54.7,0.7390039764324241,https://leetcode.com/problems/sort-characters-by-frequency,"Hash Table, String, Sorting, Heap (Priority Queue), Bucket Sort, Counting"
EASY,Kth Missing Positive Number,54.7,0.6213265518855493,https://leetcode.com/problems/kth-missing-positive-number,"Array, Binary Search"
MEDIUM,Report Spam Message,54.7,0.4741808868969741,https://leetcode.com/problems/report-spam-message,"Array, Hash Table, String"
MEDIUM,Longest Palindromic Substring,54.7,0.356484082570195,https://leetcode.com/problems/longest-palindromic-substring,"Two Pointers, String, Dynamic Programming"
EASY,Valid Parentheses,54.7,0.42159985611579637,https://leetcode.com/problems/valid-parentheses,"String, Stack"
EASY,Roman to Integer,54.7,0.6462070298393114,https://leetcode.com/problems/roman-to-integer,"Hash Table, Math, String"
MEDIUM,Minimum Swaps to Group All 1's Together II,54.7,0.6549124628379972,https://leetcode.com/problems/minimum-swaps-to-group-all-1s-together-ii,"Array, Sliding Window"
