Difficulty,Title,Frequency,Acceptance Rate,Link
MEDIUM,Maximum Points Tourist Can Earn,100.0,0.48951623362587005,https://leetcode.com/problems/maximum-points-tourist-can-earn
MEDIUM,Minimize Connected Groups by Inserting Interval,97.9,0.5681211041852182,https://leetcode.com/problems/minimize-connected-groups-by-inserting-interval
HARD,Minimum Runes to Add to Cast Spell,97.9,0.5295169946332737,https://leetcode.com/problems/minimum-runes-to-add-to-cast-spell
HARD,Binary Tree Cameras,77.6,0.46903038806631464,https://leetcode.com/problems/binary-tree-cameras
MEDIUM,Shortest Subarray to be Removed to Make Array Sorted,62.2,0.5177429552023122,https://leetcode.com/problems/shortest-subarray-to-be-removed-to-make-array-sorted
HARD,Consecutive Numbers Sum,62.2,0.41930887395545097,https://leetcode.com/problems/consecutive-numbers-sum
