Difficulty,Title,Frequency,Acceptance Rate,Link,Topics
MEDIUM,Capacity To Ship Packages Within D Days,100.0,0.7149725124296384,https://leetcode.com/problems/capacity-to-ship-packages-within-d-days,"Array, Binary Search"
MEDIUM,Longest Substring Without Repeating Characters,97.4,0.3641859288415123,https://leetcode.com/problems/longest-substring-without-repeating-characters,"Hash Table, String, Sliding Window"
MEDIUM,3Sum,97.4,0.3653143288537184,https://leetcode.com/problems/3sum,"Array, Two Pointers, Sorting"
MEDIUM,Brick Wall,91.2,0.5577558703305616,https://leetcode.com/problems/brick-wall,"Array, Hash Table"
EASY,Best Time to Buy and Sell Stock,82.9,0.5482910150645608,https://leetcode.com/problems/best-time-to-buy-and-sell-stock,"Array, Dynamic Programming"
MEDIUM,House Robber,77.5,0.520237482126463,https://leetcode.com/problems/house-robber,"Array, Dynamic Programming"
MEDIUM,Triangle,70.4,0.586925349638028,https://leetcode.com/problems/triangle,"Array, Dynamic Programming"
MEDIUM,Coin Change,70.4,0.45914529688508454,https://leetcode.com/problems/coin-change,"Array, Dynamic Programming, Breadth-First Search"
HARD,Minimum Window Substring,70.4,0.44765900298965255,https://leetcode.com/problems/minimum-window-substring,"Hash Table, String, Sliding Window"
MEDIUM,Longest Palindromic Substring,60.5,0.3537823069408861,https://leetcode.com/problems/longest-palindromic-substring,"Two Pointers, String, Dynamic Programming"
MEDIUM,Lexicographically Smallest String After Substring Operation,60.5,0.325877841335133,https://leetcode.com/problems/lexicographically-smallest-string-after-substring-operation,"String, Greedy"
EASY,Move Zeroes,60.5,0.6257726307657588,https://leetcode.com/problems/move-zeroes,"Array, Two Pointers"
EASY,Last Stone Weight,60.5,0.658037410673775,https://leetcode.com/problems/last-stone-weight,"Array, Heap (Priority Queue)"
EASY,Sort Array by Increasing Frequency,60.5,0.8012740617642986,https://leetcode.com/problems/sort-array-by-increasing-frequency,"Array, Hash Table, Sorting"
EASY,Can Place Flowers,60.5,0.28826169030092036,https://leetcode.com/problems/can-place-flowers,"Array, Greedy"
EASY,Find the Child Who Has the Ball After K Seconds,60.5,0.6196461935056642,https://leetcode.com/problems/find-the-child-who-has-the-ball-after-k-seconds,"Math, Simulation"
MEDIUM,Jump Game II,60.5,0.41183517510099443,https://leetcode.com/problems/jump-game-ii,"Array, Dynamic Programming, Greedy"
MEDIUM,Kth Smallest Element in a BST,60.5,0.7480347647567185,https://leetcode.com/problems/kth-smallest-element-in-a-bst,"Tree, Depth-First Search, Binary Search Tree, Binary Tree"
MEDIUM,Course Schedule,60.5,0.4857208646600391,https://leetcode.com/problems/course-schedule,"Depth-First Search, Breadth-First Search, Graph, Topological Sort"
EASY,Valid Parentheses,60.5,0.4191703129090027,https://leetcode.com/problems/valid-parentheses,"String, Stack"
HARD,Find Median from Data Stream,60.5,0.5303630937097072,https://leetcode.com/problems/find-median-from-data-stream,"Two Pointers, Design, Sorting, Heap (Priority Queue), Data Stream"
EASY,Plus One,60.5,0.4712333467538395,https://leetcode.com/problems/plus-one,"Array, Math"
MEDIUM,Group Anagrams,60.5,0.7043767561196884,https://leetcode.com/problems/group-anagrams,"Array, Hash Table, String, Sorting"
MEDIUM,Reverse Substrings Between Each Pair of Parentheses,60.5,0.7175326707390346,https://leetcode.com/problems/reverse-substrings-between-each-pair-of-parentheses,"String, Stack"
