Difficulty,Title,Frequency,Acceptance Rate,Link,Topics
MEDIUM,String Compression,100.0,0.5795992490056892,https://leetcode.com/problems/string-compression,"Two Pointers, String"
MEDIUM,Merge Intervals,82.8,0.4929266024106366,https://leetcode.com/problems/merge-intervals,"Array, Sorting"
HARD,Trapping Rain Water,82.8,0.6495026022460716,https://leetcode.com/problems/trapping-rain-water,"Array, Two Pointers, Dynamic Programming, Stack, Monotonic Stack"
MEDIUM,Encode and Decode Strings,82.8,0.4958420820246448,https://leetcode.com/problems/encode-and-decode-strings,"Array, String, Design"
MEDIUM,Course Schedule,82.8,0.490790347732273,https://leetcode.com/problems/course-schedule,"Depth-First Search, Breadth-First Search, Graph, Topological Sort"
