Difficulty,Title,Frequency,Acceptance Rate,Link,Topics
HARD,Frog Jump,100.0,0.46372173767543035,https://leetcode.com/problems/frog-jump,"Array, Dynamic Programming"
MEDIUM,Decoded String at Index,92.5,0.36563095173314475,https://leetcode.com/problems/decoded-string-at-index,"String, Stack"
HARD,Burst Balloons,92.5,0.6053181916348715,https://leetcode.com/problems/burst-balloons,"Array, Dynamic Programming"
MEDIUM,Maximum Tastiness of Candy Basket,86.6,0.6524057630684181,https://leetcode.com/problems/maximum-tastiness-of-candy-basket,"Array, Binary Search, Greedy, Sorting"
MEDIUM,Smallest String With Swaps,86.6,0.5914394351907442,https://leetcode.com/problems/smallest-string-with-swaps,"Array, Hash Table, String, Depth-First Search, Breadth-First Search, Union Find, Sorting"
MEDIUM,Simple Bank System,86.6,0.6351038538538538,https://leetcode.com/problems/simple-bank-system,"Array, Hash Table, Design, Simulation"
HARD,Count the Number of Arrays with K Matching Adjacent Elements,84.3,0.3716353582174514,https://leetcode.com/problems/count-the-number-of-arrays-with-k-matching-adjacent-elements,"Math, Combinatorics"
HARD,Frequencies of Shortest Supersequences,84.3,0.2329282902618518,https://leetcode.com/problems/frequencies-of-shortest-supersequences,"Array, String, Bit Manipulation, Graph, Topological Sort, Enumeration"
HARD,Smallest Range Covering Elements from K Lists,84.3,0.6980393606084836,https://leetcode.com/problems/smallest-range-covering-elements-from-k-lists,"Array, Hash Table, Greedy, Sliding Window, Sorting, Heap (Priority Queue)"
HARD,Viewers Turned Streamers,84.3,0.4329896907216495,https://leetcode.com/problems/viewers-turned-streamers,Database
MEDIUM,Maximum Amount of Money Robot Can Earn,84.3,0.2968649542295564,https://leetcode.com/problems/maximum-amount-of-money-robot-can-earn,"Array, Dynamic Programming, Matrix"
HARD,Find Beautiful Indices in the Given Array II,84.3,0.25753440566749897,https://leetcode.com/problems/find-beautiful-indices-in-the-given-array-ii,"Two Pointers, String, Binary Search, Rolling Hash, String Matching, Hash Function"
HARD,Check if Point Is Reachable,84.3,0.43502660861151426,https://leetcode.com/problems/check-if-point-is-reachable,"Math, Number Theory"
HARD,Trapping Rain Water,78.9,0.6412328147598803,https://leetcode.com/problems/trapping-rain-water,"Array, Two Pointers, Dynamic Programming, Stack, Monotonic Stack"
MEDIUM,Remove K Digits,78.9,0.3435624299594843,https://leetcode.com/problems/remove-k-digits,"String, Stack, Greedy, Monotonic Stack"
HARD,Split Array Largest Sum,75.6,0.5728425021296286,https://leetcode.com/problems/split-array-largest-sum,"Array, Binary Search, Dynamic Programming, Greedy, Prefix Sum"
MEDIUM,Most Stones Removed with Same Row or Column,75.6,0.621070246833758,https://leetcode.com/problems/most-stones-removed-with-same-row-or-column,"Hash Table, Depth-First Search, Union Find, Graph"
HARD,Maximum Profit in Job Scheduling,71.8,0.5434881976143041,https://leetcode.com/problems/maximum-profit-in-job-scheduling,"Array, Binary Search, Dynamic Programming, Sorting"
HARD,Bus Routes,71.8,0.4707729404323521,https://leetcode.com/problems/bus-routes,"Array, Hash Table, Breadth-First Search"
MEDIUM,Frequency of the Most Frequent Element,71.8,0.43946243329348034,https://leetcode.com/problems/frequency-of-the-most-frequent-element,"Array, Binary Search, Greedy, Sliding Window, Sorting, Prefix Sum"
MEDIUM,House Robber II,67.4,0.4303359674609947,https://leetcode.com/problems/house-robber-ii,"Array, Dynamic Programming"
EASY,Best Time to Buy and Sell Stock,67.4,0.5468398859667531,https://leetcode.com/problems/best-time-to-buy-and-sell-stock,"Array, Dynamic Programming"
MEDIUM,Queue Reconstruction by Height,67.4,0.7397032337528031,https://leetcode.com/problems/queue-reconstruction-by-height,"Array, Binary Indexed Tree, Segment Tree, Sorting"
MEDIUM,House Robber,67.4,0.5192208961467982,https://leetcode.com/problems/house-robber,"Array, Dynamic Programming"
HARD,Candy,67.4,0.44293628239981314,https://leetcode.com/problems/candy,"Array, Greedy"
MEDIUM,Amount of Time for Binary Tree to Be Infected,61.9,0.6311153206694282,https://leetcode.com/problems/amount-of-time-for-binary-tree-to-be-infected,"Hash Table, Tree, Depth-First Search, Breadth-First Search, Binary Tree"
MEDIUM,Accounts Merge,61.9,0.5875977748493003,https://leetcode.com/problems/accounts-merge,"Array, Hash Table, String, Depth-First Search, Breadth-First Search, Union Find, Sorting"
MEDIUM,Jump Game II,61.9,0.41075034540709976,https://leetcode.com/problems/jump-game-ii,"Array, Dynamic Programming, Greedy"
HARD,Word Ladder,61.9,0.41655686250187224,https://leetcode.com/problems/word-ladder,"Hash Table, String, Breadth-First Search"
MEDIUM,Koko Eating Bananas,61.9,0.48764834431055937,https://leetcode.com/problems/koko-eating-bananas,"Array, Binary Search"
MEDIUM,Gas Station,61.9,0.4591715163315742,https://leetcode.com/problems/gas-station,"Array, Greedy"
MEDIUM,Make Lexicographically Smallest Array by Swapping Elements,61.9,0.604216330376169,https://leetcode.com/problems/make-lexicographically-smallest-array-by-swapping-elements,"Array, Union Find, Sorting"
MEDIUM,Distribute Coins in Binary Tree,61.9,0.7719374634825293,https://leetcode.com/problems/distribute-coins-in-binary-tree,"Tree, Depth-First Search, Binary Tree"
HARD,IPO,61.9,0.5301100018182119,https://leetcode.com/problems/ipo,"Array, Greedy, Sorting, Heap (Priority Queue)"
MEDIUM,Longest Palindromic Substring,61.9,0.35189271725910737,https://leetcode.com/problems/longest-palindromic-substring,"Two Pointers, String, Dynamic Programming"
HARD,Reachable Nodes In Subdivided Graph,61.9,0.5071169184877764,https://leetcode.com/problems/reachable-nodes-in-subdivided-graph,"Graph, Heap (Priority Queue), Shortest Path"
MEDIUM,Longest Continuous Subarray With Absolute Diff Less Than or Equal to Limit,55.0,0.5667552460368368,https://leetcode.com/problems/longest-continuous-subarray-with-absolute-diff-less-than-or-equal-to-limit,"Array, Queue, Sliding Window, Heap (Priority Queue), Ordered Set, Monotonic Queue"
MEDIUM,Complete Binary Tree Inserter,55.0,0.6618129954559023,https://leetcode.com/problems/complete-binary-tree-inserter,"Tree, Breadth-First Search, Design, Binary Tree"
MEDIUM,Kth Smallest Element in a Sorted Matrix,55.0,0.6315358293300043,https://leetcode.com/problems/kth-smallest-element-in-a-sorted-matrix,"Array, Binary Search, Sorting, Heap (Priority Queue), Matrix"
MEDIUM,Rotting Oranges,55.0,0.558468481215474,https://leetcode.com/problems/rotting-oranges,"Array, Breadth-First Search, Matrix"
MEDIUM,Maximal Square,55.0,0.48087141371980074,https://leetcode.com/problems/maximal-square,"Array, Dynamic Programming, Matrix"
HARD,Best Time to Buy and Sell Stock III,55.0,0.5013580861854978,https://leetcode.com/problems/best-time-to-buy-and-sell-stock-iii,"Array, Dynamic Programming"
MEDIUM,Merge Intervals,55.0,0.48695138516574,https://leetcode.com/problems/merge-intervals,"Array, Sorting"
HARD,Cracking the Safe,55.0,0.5754430104802071,https://leetcode.com/problems/cracking-the-safe,"Depth-First Search, Graph, Eulerian Circuit"
HARD,Minimum Cost to Cut a Stick,55.0,0.6181150840634619,https://leetcode.com/problems/minimum-cost-to-cut-a-stick,"Array, Dynamic Programming, Sorting"
MEDIUM,Number of Islands,55.0,0.6142356491509794,https://leetcode.com/problems/number-of-islands,"Array, Depth-First Search, Breadth-First Search, Union Find, Matrix"
MEDIUM,Split Array into Consecutive Subsequences,55.0,0.5138119467694345,https://leetcode.com/problems/split-array-into-consecutive-subsequences,"Array, Hash Table, Greedy, Heap (Priority Queue)"
HARD,Sliding Window Maximum,55.0,0.4719098701459679,https://leetcode.com/problems/sliding-window-maximum,"Array, Queue, Sliding Window, Heap (Priority Queue), Monotonic Queue"
MEDIUM,House Robber III,55.0,0.5468331462849054,https://leetcode.com/problems/house-robber-iii,"Dynamic Programming, Tree, Depth-First Search, Binary Tree"
HARD,Swim in Rising Water,55.0,0.6213682014666982,https://leetcode.com/problems/swim-in-rising-water,"Array, Binary Search, Depth-First Search, Breadth-First Search, Union Find, Heap (Priority Queue), Matrix"
MEDIUM,Sort Colors,55.0,0.6618207446511495,https://leetcode.com/problems/sort-colors,"Array, Two Pointers, Sorting"
HARD,Find Minimum Time to Finish All Jobs,55.0,0.4298007555197949,https://leetcode.com/problems/find-minimum-time-to-finish-all-jobs,"Array, Dynamic Programming, Backtracking, Bit Manipulation, Bitmask"
HARD,Binary Tree Cameras,45.2,0.4696970614965162,https://leetcode.com/problems/binary-tree-cameras,"Dynamic Programming, Tree, Depth-First Search, Binary Tree"
MEDIUM,Maximum Total Damage With Spell Casting,45.2,0.2706510202855598,https://leetcode.com/problems/maximum-total-damage-with-spell-casting,"Array, Hash Table, Two Pointers, Binary Search, Dynamic Programming, Sorting, Counting"
HARD,Partition Array Into Two Arrays to Minimize Sum Difference,45.2,0.2125474083438685,https://leetcode.com/problems/partition-array-into-two-arrays-to-minimize-sum-difference,"Array, Two Pointers, Binary Search, Dynamic Programming, Bit Manipulation, Ordered Set, Bitmask"
MEDIUM,Find the Celebrity,45.2,0.4812858226326144,https://leetcode.com/problems/find-the-celebrity,"Two Pointers, Graph, Interactive"
MEDIUM,Make Sum Divisible by P,45.2,0.39578674081173887,https://leetcode.com/problems/make-sum-divisible-by-p,"Array, Hash Table, Prefix Sum"
HARD,Apply Operations to Maximize Frequency Score,45.2,0.37081054201889607,https://leetcode.com/problems/apply-operations-to-maximize-frequency-score,"Array, Binary Search, Sliding Window, Sorting, Prefix Sum"
MEDIUM,Binary Tree Level Order Traversal,45.2,0.6963933917263634,https://leetcode.com/problems/binary-tree-level-order-traversal,"Tree, Breadth-First Search, Binary Tree"
EASY,Longest Common Prefix,45.2,0.44745641761597954,https://leetcode.com/problems/longest-common-prefix,"String, Trie"
MEDIUM,Longest Substring Without Repeating Characters,45.2,0.362016989800684,https://leetcode.com/problems/longest-substring-without-repeating-characters,"Hash Table, String, Sliding Window"
MEDIUM,Minimum Cost For Tickets,45.2,0.6740114214454933,https://leetcode.com/problems/minimum-cost-for-tickets,"Array, Dynamic Programming"
MEDIUM,LRU Cache,45.2,0.44265352654450163,https://leetcode.com/problems/lru-cache,"Hash Table, Linked List, Design, Doubly-Linked List"
MEDIUM,Minimum Cost Tree From Leaf Values,45.2,0.6766606229399926,https://leetcode.com/problems/minimum-cost-tree-from-leaf-values,"Array, Dynamic Programming, Stack, Greedy, Monotonic Stack"
HARD,Largest Rectangle in Histogram,45.2,0.46447617793934237,https://leetcode.com/problems/largest-rectangle-in-histogram,"Array, Stack, Monotonic Stack"
MEDIUM,Best Time to Buy and Sell Stock II,45.2,0.6871136104711177,https://leetcode.com/problems/best-time-to-buy-and-sell-stock-ii,"Array, Dynamic Programming, Greedy"
MEDIUM,Copy List with Random Pointer,45.2,0.5927313597642262,https://leetcode.com/problems/copy-list-with-random-pointer,"Hash Table, Linked List"
MEDIUM,Magnetic Force Between Two Balls,45.2,0.7112366554975454,https://leetcode.com/problems/magnetic-force-between-two-balls,"Array, Binary Search, Sorting"
MEDIUM,Course Schedule II,45.2,0.5247567466508717,https://leetcode.com/problems/course-schedule-ii,"Depth-First Search, Breadth-First Search, Graph, Topological Sort"
MEDIUM,Daily Temperatures,45.2,0.6687771013871046,https://leetcode.com/problems/daily-temperatures,"Array, Stack, Monotonic Stack"
HARD,Alien Dictionary,45.2,0.3636387834201411,https://leetcode.com/problems/alien-dictionary,"Array, String, Depth-First Search, Breadth-First Search, Graph, Topological Sort"
MEDIUM,Find the Duplicate Number,45.2,0.6224612296970272,https://leetcode.com/problems/find-the-duplicate-number,"Array, Two Pointers, Binary Search, Bit Manipulation"
MEDIUM,Minimum Height Trees,45.2,0.4193206009366827,https://leetcode.com/problems/minimum-height-trees,"Depth-First Search, Breadth-First Search, Graph, Topological Sort"
MEDIUM,Longest Repeating Character Replacement,45.2,0.5628793469457495,https://leetcode.com/problems/longest-repeating-character-replacement,"Hash Table, String, Sliding Window"
MEDIUM,String Compression,45.2,0.5707258135379749,https://leetcode.com/problems/string-compression,"Two Pointers, String"
HARD,Number of Islands II,45.2,0.3997147913775322,https://leetcode.com/problems/number-of-islands-ii,"Array, Hash Table, Union Find"
HARD,Decode Ways II,45.2,0.3106302163637988,https://leetcode.com/problems/decode-ways-ii,"String, Dynamic Programming"
MEDIUM,Search in Rotated Sorted Array,45.2,0.4221771025856082,https://leetcode.com/problems/search-in-rotated-sorted-array,"Array, Binary Search"
MEDIUM,Find All Possible Recipes from Given Supplies,45.2,0.5057686057848554,https://leetcode.com/problems/find-all-possible-recipes-from-given-supplies,"Array, Hash Table, String, Graph, Topological Sort"
HARD,Sum of Distances in Tree,45.2,0.6529640557939913,https://leetcode.com/problems/sum-of-distances-in-tree,"Dynamic Programming, Tree, Depth-First Search, Graph"
MEDIUM,Walking Robot Simulation,45.2,0.5807421900666555,https://leetcode.com/problems/walking-robot-simulation,"Array, Hash Table, Simulation"
MEDIUM,Find Duplicate Subtrees,45.2,0.5991374317958308,https://leetcode.com/problems/find-duplicate-subtrees,"Hash Table, Tree, Depth-First Search, Binary Tree"
