Difficulty,Title,Frequency,Acceptance Rate,Link,Topics
MEDIUM,Asteroid Collision,100.0,0.4515128813805077,https://leetcode.com/problems/asteroid-collision,"Array, Stack, Simulation"
MEDIUM,Subarray Product Less Than K,88.4,0.5245696939212234,https://leetcode.com/problems/subarray-product-less-than-k,"Array, Binary Search, Sliding Window, Prefix Sum"
MEDIUM,Flatten a Multilevel Doubly Linked List,88.4,0.6099638866267039,https://leetcode.com/problems/flatten-a-multilevel-doubly-linked-list,"Linked List, Depth-First Search, Doubly-Linked List"
EASY,Two Sum,88.4,0.5518556475826463,https://leetcode.com/problems/two-sum,"Array, Hash Table"
MEDIUM,Number of Islands,88.4,0.6170194243389343,https://leetcode.com/problems/number-of-islands,"Array, Depth-First Search, Breadth-First Search, Union Find, Matrix"
MEDIUM,Minimum Number of Steps to Make Two Strings Anagram,88.4,0.8218036150147179,https://leetcode.com/problems/minimum-number-of-steps-to-make-two-strings-anagram,"Hash Table, String, Counting"
HARD,Minimum Window Substring,88.4,0.44766038218446896,https://leetcode.com/problems/minimum-window-substring,"Hash Table, String, Sliding Window"
EASY,Roman to Integer,88.4,0.6427324867411448,https://leetcode.com/problems/roman-to-integer,"Hash Table, Math, String"
EASY,Degree of an Array,88.4,0.5716306372706867,https://leetcode.com/problems/degree-of-an-array,"Array, Hash Table"
MEDIUM,Longest Mountain in Array,88.4,0.4090526383101174,https://leetcode.com/problems/longest-mountain-in-array,"Array, Two Pointers, Dynamic Programming, Enumeration"
