Difficulty,Title,Frequency,Acceptance Rate,Link,Topics
MEDIUM,Number of Connected Components in an Undirected Graph,100.0,0.6415574082402187,https://leetcode.com/problems/number-of-connected-components-in-an-undirected-graph,"Depth-First Search, Breadth-First Search, Union Find, Graph"
MEDIUM,Minimum Path Sum,66.7,0.663611096193244,https://leetcode.com/problems/minimum-path-sum,"Array, Dynamic Programming, Matrix"
MEDIUM,LRU Cache,59.0,0.4507783778003529,https://leetcode.com/problems/lru-cache,"Hash Table, Linked List, Design, Doubly-Linked List"
MEDIUM,The Number of Full Rounds You Have Played,59.0,0.43414476286361514,https://leetcode.com/problems/the-number-of-full-rounds-you-have-played,"Math, String"
HARD,First Missing Positive,59.0,0.41007874376934644,https://leetcode.com/problems/first-missing-positive,"Array, Hash Table"
EASY,Last Visited Integers,59.0,0.60943574867549,https://leetcode.com/problems/last-visited-integers,"Array, Simulation"
EASY,Widest Vertical Area Between Two Points Containing No Points,59.0,0.8708000278028776,https://leetcode.com/problems/widest-vertical-area-between-two-points-containing-no-points,"Array, Sorting"
MEDIUM,Dot Product of Two Sparse Vectors,59.0,0.8994320392892857,https://leetcode.com/problems/dot-product-of-two-sparse-vectors,"Array, Hash Table, Two Pointers, Design"
