Difficulty,Title,Frequency,Acceptance Rate,Link,Topics
HARD,Basic Calculator,100.0,0.4498981749110268,https://leetcode.com/problems/basic-calculator,"Math, String, Stack, Recursion"
EASY,Create Hello World Function,97.5,0.819848442964052,https://leetcode.com/problems/create-hello-world-function,
EASY,Longest Common Prefix,83.9,0.44980364768569925,https://leetcode.com/problems/longest-common-prefix,"String, Trie"
EASY,Two Sum,83.9,0.551853625556745,https://leetcode.com/problems/two-sum,"Array, Hash Table"
EASY,Merge Sorted Array,79.0,0.5235337952824305,https://leetcode.com/problems/merge-sorted-array,"Array, Two Pointers, Sorting"
MEDIUM,Longest Substring Without Repeating Characters,73.1,0.364185212101697,https://leetcode.com/problems/longest-substring-without-repeating-characters,"Hash Table, String, Sliding Window"
HARD,Merge k Sorted Lists,73.1,0.5594069462800462,https://leetcode.com/problems/merge-k-sorted-lists,"Linked List, Divide and Conquer, Heap (Priority Queue), Merge Sort"
MEDIUM,Restore IP Addresses,73.1,0.5248424585321884,https://leetcode.com/problems/restore-ip-addresses,"String, Backtracking"
MEDIUM,Min Stack,73.1,0.5599599865692931,https://leetcode.com/problems/min-stack,"Stack, Design"
EASY,Merge Strings Alternately,73.1,0.8193906704760887,https://leetcode.com/problems/merge-strings-alternately,"Two Pointers, String"
HARD,Serialize and Deserialize Binary Tree,65.5,0.5843130804138003,https://leetcode.com/problems/serialize-and-deserialize-binary-tree,"String, Tree, Depth-First Search, Breadth-First Search, Design, Binary Tree"
HARD,N-Queens,65.5,0.7182420191456816,https://leetcode.com/problems/n-queens,"Array, Backtracking"
EASY,Reverse Linked List,65.5,0.7873609934995394,https://leetcode.com/problems/reverse-linked-list,"Linked List, Recursion"
MEDIUM,3Sum,65.5,0.36531419221232875,https://leetcode.com/problems/3sum,"Array, Two Pointers, Sorting"
MEDIUM,Daily Temperatures,65.5,0.6702605323450607,https://leetcode.com/problems/daily-temperatures,"Array, Stack, Monotonic Stack"
MEDIUM,Minimum Sideway Jumps,65.5,0.5055733295294765,https://leetcode.com/problems/minimum-sideway-jumps,"Array, Dynamic Programming, Greedy"
MEDIUM,LRU Cache,65.5,0.44550532222749,https://leetcode.com/problems/lru-cache,"Hash Table, Linked List, Design, Doubly-Linked List"
MEDIUM,Search a 2D Matrix,65.5,0.51848681954275,https://leetcode.com/problems/search-a-2d-matrix,"Array, Binary Search, Matrix"
EASY,Length of Last Word,65.5,0.5558290459538869,https://leetcode.com/problems/length-of-last-word,String
EASY,Divide Array Into Equal Pairs,65.5,0.7919758694407215,https://leetcode.com/problems/divide-array-into-equal-pairs,"Array, Hash Table, Bit Manipulation, Counting"
MEDIUM,Longest Nice Subarray,65.5,0.647152486160497,https://leetcode.com/problems/longest-nice-subarray,"Array, Bit Manipulation, Sliding Window"
EASY,Palindrome Number,65.5,0.587494132515769,https://leetcode.com/problems/palindrome-number,Math
MEDIUM,Add Two Numbers,65.5,0.4555574256707365,https://leetcode.com/problems/add-two-numbers,"Linked List, Math, Recursion"
HARD,Sliding Window Maximum,65.5,0.47299754483785506,https://leetcode.com/problems/sliding-window-maximum,"Array, Queue, Sliding Window, Heap (Priority Queue), Monotonic Queue"
MEDIUM,Reverse Words in a String,65.5,0.5037793818113911,https://leetcode.com/problems/reverse-words-in-a-string,"Two Pointers, String"
MEDIUM,Linked List Cycle II,65.5,0.5413131751966234,https://leetcode.com/problems/linked-list-cycle-ii,"Hash Table, Linked List, Two Pointers"
EASY,Reverse Vowels of a String,65.5,0.5724294198925969,https://leetcode.com/problems/reverse-vowels-of-a-string,"Two Pointers, String"
MEDIUM,Sort Colors,54.8,0.6647644043118711,https://leetcode.com/problems/sort-colors,"Array, Two Pointers, Sorting"
MEDIUM,Binary Tree Zigzag Level Order Traversal,54.8,0.6109622327877806,https://leetcode.com/problems/binary-tree-zigzag-level-order-traversal,"Tree, Breadth-First Search, Binary Tree"
MEDIUM,Maximum Candies Allocated to K Children,54.8,0.5036165704683276,https://leetcode.com/problems/maximum-candies-allocated-to-k-children,"Array, Binary Search"
EASY,Intersection of Two Arrays,54.8,0.7607009667409188,https://leetcode.com/problems/intersection-of-two-arrays,"Array, Hash Table, Two Pointers, Binary Search, Sorting"
EASY,Fruits Into Baskets II,54.8,0.5046072979599686,https://leetcode.com/problems/fruits-into-baskets-ii,"Array, Binary Search, Segment Tree, Simulation"
MEDIUM,Rotate Image,54.8,0.7727233982200226,https://leetcode.com/problems/rotate-image,"Array, Math, Matrix"
MEDIUM,Longest Palindromic Substring,54.8,0.3537820238782848,https://leetcode.com/problems/longest-palindromic-substring,"Two Pointers, String, Dynamic Programming"
EASY,Two Sum IV - Input is a BST,54.8,0.6196838970004119,https://leetcode.com/problems/two-sum-iv-input-is-a-bst,"Hash Table, Two Pointers, Tree, Depth-First Search, Breadth-First Search, Binary Search Tree, Binary Tree"
EASY,Kids With the Greatest Number of Candies,54.8,0.8803087637373695,https://leetcode.com/problems/kids-with-the-greatest-number-of-candies,Array
MEDIUM,House Robber IV,54.8,0.6521053512699073,https://leetcode.com/problems/house-robber-iv,"Array, Binary Search"
MEDIUM,Subarray Sum Equals K,54.8,0.45002435441807587,https://leetcode.com/problems/subarray-sum-equals-k,"Array, Hash Table, Prefix Sum"
MEDIUM,Word Search,54.8,0.4471708096848039,https://leetcode.com/problems/word-search,"Array, String, Backtracking, Depth-First Search, Matrix"
EASY,Recyclable and Low Fat Products,54.8,0.8936076365182217,https://leetcode.com/problems/recyclable-and-low-fat-products,Database
MEDIUM,Find the Duplicate Number,54.8,0.6241182598701737,https://leetcode.com/problems/find-the-duplicate-number,"Array, Two Pointers, Binary Search, Bit Manipulation"
EASY,Move Zeroes,54.8,0.625771353093987,https://leetcode.com/problems/move-zeroes,"Array, Two Pointers"
MEDIUM,Permutations II,54.8,0.6108882861183101,https://leetcode.com/problems/permutations-ii,"Array, Backtracking, Sorting"
MEDIUM,Partition Array According to Given Pivot,54.8,0.8996775981948324,https://leetcode.com/problems/partition-array-according-to-given-pivot,"Array, Two Pointers, Simulation"
HARD,Trapping Rain Water,54.8,0.6439790814924163,https://leetcode.com/problems/trapping-rain-water,"Array, Two Pointers, Dynamic Programming, Stack, Monotonic Stack"
MEDIUM,Number of Islands,54.8,0.6170169122196616,https://leetcode.com/problems/number-of-islands,"Array, Depth-First Search, Breadth-First Search, Union Find, Matrix"
MEDIUM,Longest Consecutive Sequence,54.8,0.47157756271727896,https://leetcode.com/problems/longest-consecutive-sequence,"Array, Hash Table, Union Find"
MEDIUM,Construct Binary Tree from Preorder and Postorder Traversal,54.8,0.7801392849521814,https://leetcode.com/problems/construct-binary-tree-from-preorder-and-postorder-traversal,"Array, Hash Table, Divide and Conquer, Tree, Binary Tree"
MEDIUM,Length of Longest Fibonacci Subsequence,54.8,0.5766483145850866,https://leetcode.com/problems/length-of-longest-fibonacci-subsequence,"Array, Hash Table, Dynamic Programming"
HARD,Shortest Common Supersequence ,54.8,0.612813017384106,https://leetcode.com/problems/shortest-common-supersequence,"String, Dynamic Programming"
EASY,Find Winner on a Tic Tac Toe Game,54.8,0.5410858897277042,https://leetcode.com/problems/find-winner-on-a-tic-tac-toe-game,"Array, Hash Table, Matrix, Simulation"
EASY,Happy Number,54.8,0.5763520610518224,https://leetcode.com/problems/happy-number,"Hash Table, Math, Two Pointers"
MEDIUM,Container With Most Water,54.8,0.5726803785122994,https://leetcode.com/problems/container-with-most-water,"Array, Two Pointers, Greedy"
MEDIUM,Two Sum II - Input Array Is Sorted,54.8,0.6296164957457207,https://leetcode.com/problems/two-sum-ii-input-array-is-sorted,"Array, Two Pointers, Binary Search"
MEDIUM,Edit Distance,54.8,0.582841072959934,https://leetcode.com/problems/edit-distance,"String, Dynamic Programming"
MEDIUM,Word Break,54.8,0.47935236181166585,https://leetcode.com/problems/word-break,"Array, Hash Table, String, Dynamic Programming, Trie, Memoization"
EASY,Ransom Note,54.8,0.6400777835940336,https://leetcode.com/problems/ransom-note,"Hash Table, String, Counting"
MEDIUM,Find Peak Element,54.8,0.46365528902764686,https://leetcode.com/problems/find-peak-element,"Array, Binary Search"
MEDIUM,House Robber,54.8,0.5202375441726034,https://leetcode.com/problems/house-robber,"Array, Dynamic Programming"
EASY,Best Time to Buy and Sell Stock,54.8,0.5482912504728978,https://leetcode.com/problems/best-time-to-buy-and-sell-stock,"Array, Dynamic Programming"
MEDIUM,Combination Sum,54.8,0.7404325009739293,https://leetcode.com/problems/combination-sum,"Array, Backtracking"
