Difficulty,Title,Frequency,Acceptance Rate,Link,Topics
EASY,Two Sum,100.0,0.5490428664434888,https://leetcode.com/problems/two-sum,"Array, Hash Table"
EASY,Merge Sorted Array,82.2,0.5209807118074355,https://leetcode.com/problems/merge-sorted-array,"Array, Two Pointers, Sorting"
MEDIUM,LRU Cache,76.2,0.44265018685351715,https://leetcode.com/problems/lru-cache,"Hash Table, Linked List, Design, Doubly-Linked List"
EASY,Best Time to Buy and Sell Stock,76.2,0.5468401855872215,https://leetcode.com/problems/best-time-to-buy-and-sell-stock,"Array, Dynamic Programming"
MEDIUM,Longest Substring Without Repeating Characters,73.7,0.36201643730857,https://leetcode.com/problems/longest-substring-without-repeating-characters,"Hash Table, String, Sliding Window"
MEDIUM,Add Two Numbers,72.3,0.45272478932944726,https://leetcode.com/problems/add-two-numbers,"Linked List, Math, Recursion"
HARD,Trapping Rain Water,70.8,0.6412326026420436,https://leetcode.com/problems/trapping-rain-water,"Array, Two Pointers, Dynamic Programming, Stack, Monotonic Stack"
MEDIUM,Number of Islands,69.2,0.6142361819993479,https://leetcode.com/problems/number-of-islands,"Array, Depth-First Search, Breadth-First Search, Union Find, Matrix"
EASY,Majority Element,66.6,0.654590553940058,https://leetcode.com/problems/majority-element,"Array, Hash Table, Divide and Conquer, Sorting, Counting"
EASY,Palindrome Number,64.6,0.5850829429550621,https://leetcode.com/problems/palindrome-number,Math
MEDIUM,Group Anagrams,64.6,0.7021296949239332,https://leetcode.com/problems/group-anagrams,"Array, Hash Table, String, Sorting"
EASY,Climbing Stairs,64.6,0.5331670216446867,https://leetcode.com/problems/climbing-stairs,"Math, Dynamic Programming, Memoization"
MEDIUM,Merge Intervals,64.6,0.4869510184230158,https://leetcode.com/problems/merge-intervals,"Array, Sorting"
MEDIUM,Longest Palindromic Substring,63.5,0.3518924743756259,https://leetcode.com/problems/longest-palindromic-substring,"Two Pointers, String, Dynamic Programming"
HARD,Median of Two Sorted Arrays,63.5,0.4274720239458956,https://leetcode.com/problems/median-of-two-sorted-arrays,"Array, Binary Search, Divide and Conquer"
MEDIUM,Maximum Subarray,62.4,0.5164878226060033,https://leetcode.com/problems/maximum-subarray,"Array, Divide and Conquer, Dynamic Programming"
MEDIUM,3Sum,62.4,0.3627881939242188,https://leetcode.com/problems/3sum,"Array, Two Pointers, Sorting"
MEDIUM,House Robber,62.4,0.519219965490317,https://leetcode.com/problems/house-robber,"Array, Dynamic Programming"
EASY,Valid Parentheses,62.4,0.4173934095112961,https://leetcode.com/problems/valid-parentheses,"String, Stack"
MEDIUM,Container With Most Water,58.5,0.570398787194212,https://leetcode.com/problems/container-with-most-water,"Array, Two Pointers, Greedy"
EASY,Longest Common Prefix,58.5,0.4474551957852234,https://leetcode.com/problems/longest-common-prefix,"String, Trie"
MEDIUM,Rotate Image,57.0,0.7701659223402361,https://leetcode.com/problems/rotate-image,"Array, Math, Matrix"
MEDIUM,Search in Rotated Sorted Array,57.0,0.4221766804746715,https://leetcode.com/problems/search-in-rotated-sorted-array,"Array, Binary Search"
EASY,Merge Two Sorted Lists,57.0,0.6615282490536238,https://leetcode.com/problems/merge-two-sorted-lists,"Linked List, Recursion"
EASY,Remove Element,57.0,0.5929223942247036,https://leetcode.com/problems/remove-element,"Array, Two Pointers"
EASY,Roman to Integer,57.0,0.6397786665286721,https://leetcode.com/problems/roman-to-integer,"Hash Table, Math, String"
MEDIUM,Reverse Words in a String,57.0,0.49591702879288874,https://leetcode.com/problems/reverse-words-in-a-string,"Two Pointers, String"
MEDIUM,Jump Game,55.4,0.39056440660621633,https://leetcode.com/problems/jump-game,"Array, Dynamic Programming, Greedy"
MEDIUM,Spiral Matrix,55.4,0.5271677495280578,https://leetcode.com/problems/spiral-matrix,"Array, Matrix, Simulation"
MEDIUM,Next Permutation,55.4,0.4217891093369703,https://leetcode.com/problems/next-permutation,"Array, Two Pointers"
HARD,Merge k Sorted Lists,55.4,0.5556686484268839,https://leetcode.com/problems/merge-k-sorted-lists,"Linked List, Divide and Conquer, Heap (Priority Queue), Merge Sort"
MEDIUM,Sort Colors,55.4,0.66181945043922,https://leetcode.com/problems/sort-colors,"Array, Two Pointers, Sorting"
MEDIUM,Longest Consecutive Sequence,55.4,0.47255083323997055,https://leetcode.com/problems/longest-consecutive-sequence,"Array, Hash Table, Union Find"
HARD,N-Queens,53.7,0.714337295856016,https://leetcode.com/problems/n-queens,"Array, Backtracking"
MEDIUM,Rotting Oranges,51.8,0.5584681708416183,https://leetcode.com/problems/rotting-oranges,"Array, Breadth-First Search, Matrix"
HARD,First Missing Positive,51.8,0.4052979398682367,https://leetcode.com/problems/first-missing-positive,"Array, Hash Table"
MEDIUM,Reverse Integer,51.8,0.29779343516991336,https://leetcode.com/problems/reverse-integer,Math
MEDIUM,Rotate Array,51.8,0.42338051293020734,https://leetcode.com/problems/rotate-array,"Array, Math, Two Pointers"
EASY,Search Insert Position,51.8,0.4819728438762275,https://leetcode.com/problems/search-insert-position,"Array, Binary Search"
MEDIUM,Letter Combinations of a Phone Number,51.8,0.629066162352719,https://leetcode.com/problems/letter-combinations-of-a-phone-number,"Hash Table, String, Backtracking"
HARD,Reverse Nodes in k-Group,49.7,0.6182054986321553,https://leetcode.com/problems/reverse-nodes-in-k-group,"Linked List, Recursion"
MEDIUM,Remove Nth Node From End of List,49.7,0.47927308563701126,https://leetcode.com/problems/remove-nth-node-from-end-of-list,"Linked List, Two Pointers"
MEDIUM,Word Search,49.7,0.4448820057125873,https://leetcode.com/problems/word-search,"Array, String, Backtracking, Depth-First Search, Matrix"
MEDIUM,Min Stack,49.7,0.5578052233967281,https://leetcode.com/problems/min-stack,"Stack, Design"
MEDIUM,Word Break,49.7,0.47787992118542,https://leetcode.com/problems/word-break,"Array, Hash Table, String, Dynamic Programming, Trie, Memoization"
EASY,Single Number,49.7,0.7517138697752671,https://leetcode.com/problems/single-number,"Array, Bit Manipulation"
MEDIUM,Find First and Last Position of Element in Sorted Array,49.7,0.4601852169916862,https://leetcode.com/problems/find-first-and-last-position-of-element-in-sorted-array,"Array, Binary Search"
MEDIUM,"Pow(x, n)",49.7,0.36354442484057214,https://leetcode.com/problems/powx-n,"Math, Recursion"
MEDIUM,Binary Tree Zigzag Level Order Traversal,47.4,0.6087074039612322,https://leetcode.com/problems/binary-tree-zigzag-level-order-traversal,"Tree, Breadth-First Search, Binary Tree"
MEDIUM,Generate Parentheses,47.4,0.7639654031752536,https://leetcode.com/problems/generate-parentheses,"String, Dynamic Programming, Backtracking"
HARD,Minimum Window Substring,44.7,0.4453665108918413,https://leetcode.com/problems/minimum-window-substring,"Hash Table, String, Sliding Window"
MEDIUM,Restore IP Addresses,44.7,0.5221676377158972,https://leetcode.com/problems/restore-ip-addresses,"String, Backtracking"
HARD,Largest Rectangle in Histogram,44.7,0.46447560614409406,https://leetcode.com/problems/largest-rectangle-in-histogram,"Array, Stack, Monotonic Stack"
EASY,Find the Index of the First Occurrence in a String,44.7,0.44346681590928194,https://leetcode.com/problems/find-the-index-of-the-first-occurrence-in-a-string,"Two Pointers, String, String Matching"
MEDIUM,Divide Two Integers,44.7,0.18081203991654732,https://leetcode.com/problems/divide-two-integers,"Math, Bit Manipulation"
MEDIUM,Set Matrix Zeroes,41.7,0.587435604823441,https://leetcode.com/problems/set-matrix-zeroes,"Array, Hash Table, Matrix"
MEDIUM,Search a 2D Matrix,41.7,0.5167895156298196,https://leetcode.com/problems/search-a-2d-matrix,"Array, Binary Search, Matrix"
MEDIUM,Swap Nodes in Pairs,41.7,0.6636247914889511,https://leetcode.com/problems/swap-nodes-in-pairs,"Linked List, Recursion"
HARD,Candy,41.7,0.4429336978635194,https://leetcode.com/problems/candy,"Array, Greedy"
HARD,Regular Expression Matching,41.7,0.288913362701909,https://leetcode.com/problems/regular-expression-matching,"String, Dynamic Programming, Recursion"
MEDIUM,Valid Sudoku,41.7,0.6151433273090333,https://leetcode.com/problems/valid-sudoku,"Array, Hash Table, Matrix"
MEDIUM,Integer to Roman,41.7,0.6765152948609888,https://leetcode.com/problems/integer-to-roman,"Hash Table, Math, String"
MEDIUM,Maximum Product Subarray,41.7,0.3445880480761684,https://leetcode.com/problems/maximum-product-subarray,"Array, Dynamic Programming"
MEDIUM,Copy List with Random Pointer,41.7,0.5927297525122891,https://leetcode.com/problems/copy-list-with-random-pointer,"Hash Table, Linked List"
MEDIUM,Validate Binary Search Tree,41.7,0.33900202088464715,https://leetcode.com/problems/validate-binary-search-tree,"Tree, Depth-First Search, Binary Search Tree, Binary Tree"
MEDIUM,Combination Sum,41.7,0.7376242339369186,https://leetcode.com/problems/combination-sum,"Array, Backtracking"
MEDIUM,Largest Number,38.1,0.4075433002455725,https://leetcode.com/problems/largest-number,"Array, String, Greedy, Sorting"
EASY,Happy Number,38.1,0.574613009797706,https://leetcode.com/problems/happy-number,"Hash Table, Math, Two Pointers"
MEDIUM,String to Integer (atoi),38.1,0.18614453142862508,https://leetcode.com/problems/string-to-integer-atoi,String
MEDIUM,Max Consecutive Ones III,38.1,0.6507295233679313,https://leetcode.com/problems/max-consecutive-ones-iii,"Array, Binary Search, Sliding Window, Prefix Sum"
HARD,Sudoku Solver,38.1,0.636458356425547,https://leetcode.com/problems/sudoku-solver,"Array, Hash Table, Backtracking, Matrix"
MEDIUM,Unique Paths,38.1,0.6532759589721073,https://leetcode.com/problems/unique-paths,"Math, Dynamic Programming, Combinatorics"
MEDIUM,Minimum Path Sum,38.1,0.6573780452007831,https://leetcode.com/problems/minimum-path-sum,"Array, Dynamic Programming, Matrix"
EASY,Binary Tree Inorder Traversal,33.8,0.7788961949413009,https://leetcode.com/problems/binary-tree-inorder-traversal,"Stack, Tree, Depth-First Search, Binary Tree"
MEDIUM,Gas Station,33.8,0.45917020639981343,https://leetcode.com/problems/gas-station,"Array, Greedy"
MEDIUM,Two Sum II - Input Array Is Sorted,33.8,0.6276668731740858,https://leetcode.com/problems/two-sum-ii-input-array-is-sorted,"Array, Two Pointers, Binary Search"
MEDIUM,Find Peak Element,33.8,0.4628547537752471,https://leetcode.com/problems/find-peak-element,"Array, Binary Search"
MEDIUM,Evaluate Reverse Polish Notation,33.8,0.5386419251724266,https://leetcode.com/problems/evaluate-reverse-polish-notation,"Array, Math, Stack"
EASY,Sqrt(x),33.8,0.39941668175764405,https://leetcode.com/problems/sqrtx,"Math, Binary Search"
EASY,Linked List Cycle,33.8,0.5185339869658522,https://leetcode.com/problems/linked-list-cycle,"Hash Table, Linked List, Two Pointers"
HARD,Maximal Rectangle,33.8,0.5274662124411834,https://leetcode.com/problems/maximal-rectangle,"Array, Dynamic Programming, Stack, Matrix, Monotonic Stack"
MEDIUM,Best Time to Buy and Sell Stock II,28.3,0.6871157627007155,https://leetcode.com/problems/best-time-to-buy-and-sell-stock-ii,"Array, Dynamic Programming, Greedy"
HARD,Word Ladder,28.3,0.4165547174392703,https://leetcode.com/problems/word-ladder,"Hash Table, String, Breadth-First Search"
HARD,Binary Tree Maximum Path Sum,28.3,0.408401691106144,https://leetcode.com/problems/binary-tree-maximum-path-sum,"Dynamic Programming, Tree, Depth-First Search, Binary Tree"
MEDIUM,Reverse Linked List II,28.3,0.4898357793190765,https://leetcode.com/problems/reverse-linked-list-ii,Linked List
HARD,Vertical Order Traversal of a Binary Tree,28.3,0.501621269867315,https://leetcode.com/problems/vertical-order-traversal-of-a-binary-tree,"Hash Table, Tree, Depth-First Search, Breadth-First Search, Sorting, Binary Tree"
MEDIUM,Jump Game II,28.3,0.4107513378449263,https://leetcode.com/problems/jump-game-ii,"Array, Dynamic Programming, Greedy"
HARD,Wildcard Matching,28.3,0.2927083817612,https://leetcode.com/problems/wildcard-matching,"String, Dynamic Programming, Greedy, Recursion"
EASY,Path Sum,28.3,0.5226953354869743,https://leetcode.com/problems/path-sum,"Tree, Depth-First Search, Breadth-First Search, Binary Tree"
MEDIUM,Compare Version Numbers,28.3,0.41891079037454376,https://leetcode.com/problems/compare-version-numbers,"Two Pointers, String"
MEDIUM,3Sum Closest,28.3,0.4653945987885047,https://leetcode.com/problems/3sum-closest,"Array, Two Pointers, Sorting"
EASY,Pascal's Triangle,28.3,0.7629532821155557,https://leetcode.com/problems/pascals-triangle,"Array, Dynamic Programming"
EASY,Excel Sheet Column Number,28.3,0.6522493686447706,https://leetcode.com/problems/excel-sheet-column-number,"Math, String"
MEDIUM,Flatten Binary Tree to Linked List,20.9,0.6750822535292924,https://leetcode.com/problems/flatten-binary-tree-to-linked-list,"Linked List, Stack, Tree, Depth-First Search, Binary Tree"
MEDIUM,Zigzag Conversion,20.9,0.506017112386142,https://leetcode.com/problems/zigzag-conversion,String
MEDIUM,Simplify Path,20.9,0.46275179912117403,https://leetcode.com/problems/simplify-path,"String, Stack"
MEDIUM,Decode Ways,20.9,0.3601892117338091,https://leetcode.com/problems/decode-ways,"String, Dynamic Programming"
MEDIUM,Multiply Strings,20.9,0.4171461335644888,https://leetcode.com/problems/multiply-strings,"Math, String, Simulation"
HARD,Best Time to Buy and Sell Stock III,20.9,0.501358431113542,https://leetcode.com/problems/best-time-to-buy-and-sell-stock-iii,"Array, Dynamic Programming"
HARD,Text Justification,20.9,0.46831417411747284,https://leetcode.com/problems/text-justification,"Array, String, Simulation"
