Difficulty,Title,Frequency,Acceptance Rate,Link,Topics
EASY,Two Sum,100.0,0.5577699843955036,https://leetcode.com/problems/two-sum,"Array, Hash Table"
EASY,Merge Sorted Array,83.7,0.5291951450619177,https://leetcode.com/problems/merge-sorted-array,"Array, Two Pointers, Sorting"
MEDIUM,Longest Substring Without Repeating Characters,79.4,0.3693617011328274,https://leetcode.com/problems/longest-substring-without-repeating-characters,"Hash Table, String, Sliding Window"
MEDIUM,Add Two Numbers,78.3,0.4622507658063209,https://leetcode.com/problems/add-two-numbers,"Linked List, Math, Recursion"
MEDIUM,Longest Palindromic Substring,75.8,0.35846111456358737,https://leetcode.com/problems/longest-palindromic-substring,"Two Pointers, String, Dynamic Programming"
HARD,Trapping Rain Water,75.7,0.6510192988277056,https://leetcode.com/problems/trapping-rain-water,"Array, Two Pointers, Dynamic Programming, Stack, Monotonic Stack"
MEDIUM,Merge Intervals,73.8,0.4939527547797844,https://leetcode.com/problems/merge-intervals,"Array, Sorting"
EASY,Valid Parentheses,72.9,0.4232282567926559,https://leetcode.com/problems/valid-parentheses,"String, Stack"
HARD,Median of Two Sorted Arrays,72.9,0.43814591586025275,https://leetcode.com/problems/median-of-two-sorted-arrays,"Array, Binary Search, Divide and Conquer"
MEDIUM,Maximum Subarray,72.9,0.5209978267392302,https://leetcode.com/problems/maximum-subarray,"Array, Divide and Conquer, Dynamic Programming"
MEDIUM,3Sum,72.9,0.37070946435035784,https://leetcode.com/problems/3sum,"Array, Two Pointers, Sorting"
MEDIUM,Group Anagrams,69.8,0.7092882244410338,https://leetcode.com/problems/group-anagrams,"Array, Hash Table, String, Sorting"
MEDIUM,Search in Rotated Sorted Array,68.5,0.4283722138743466,https://leetcode.com/problems/search-in-rotated-sorted-array,"Array, Binary Search"
HARD,Reverse Nodes in k-Group,68.5,0.6304374335039493,https://leetcode.com/problems/reverse-nodes-in-k-group,"Linked List, Recursion"
EASY,Merge Two Sorted Lists,68.5,0.6684091757223755,https://leetcode.com/problems/merge-two-sorted-lists,"Linked List, Recursion"
MEDIUM,Spiral Matrix,68.3,0.5393973501075863,https://leetcode.com/problems/spiral-matrix,"Array, Matrix, Simulation"
EASY,Roman to Integer,68.3,0.6486627884371093,https://leetcode.com/problems/roman-to-integer,"Hash Table, Math, String"
EASY,Climbing Stairs,68.0,0.5354071840932856,https://leetcode.com/problems/climbing-stairs,"Math, Dynamic Programming, Memoization"
MEDIUM,Rotate Image,67.7,0.7790164518819447,https://leetcode.com/problems/rotate-image,"Array, Math, Matrix"
MEDIUM,Container With Most Water,67.7,0.5778282574410597,https://leetcode.com/problems/container-with-most-water,"Array, Two Pointers, Greedy"
HARD,Merge k Sorted Lists,67.5,0.567741907864408,https://leetcode.com/problems/merge-k-sorted-lists,"Linked List, Divide and Conquer, Heap (Priority Queue), Merge Sort"
EASY,Palindrome Number,67.5,0.5922454522673172,https://leetcode.com/problems/palindrome-number,Math
MEDIUM,Sort Colors,65.8,0.6758312948649591,https://leetcode.com/problems/sort-colors,"Array, Two Pointers, Sorting"
EASY,Longest Common Prefix,65.8,0.4548305595040032,https://leetcode.com/problems/longest-common-prefix,"String, Trie"
EASY,Remove Duplicates from Sorted Array,64.5,0.6035551112882038,https://leetcode.com/problems/remove-duplicates-from-sorted-array,"Array, Two Pointers"
MEDIUM,Set Matrix Zeroes,62.9,0.6070884347201074,https://leetcode.com/problems/set-matrix-zeroes,"Array, Hash Table, Matrix"
MEDIUM,Letter Combinations of a Phone Number,62.5,0.6385756647080152,https://leetcode.com/problems/letter-combinations-of-a-phone-number,"Hash Table, String, Backtracking"
MEDIUM,Reverse Integer,62.5,0.3030891979001635,https://leetcode.com/problems/reverse-integer,Math
MEDIUM,Word Search,60.6,0.45266926269047814,https://leetcode.com/problems/word-search,"Array, String, Backtracking, Depth-First Search, Matrix"
MEDIUM,Generate Parentheses,60.2,0.7713286717803378,https://leetcode.com/problems/generate-parentheses,"String, Dynamic Programming, Backtracking"
MEDIUM,Jump Game,59.4,0.39479197867291327,https://leetcode.com/problems/jump-game,"Array, Dynamic Programming, Greedy"
MEDIUM,Next Permutation,59.0,0.4305772664998175,https://leetcode.com/problems/next-permutation,"Array, Two Pointers"
EASY,Remove Element,58.1,0.600316358048653,https://leetcode.com/problems/remove-element,"Array, Two Pointers"
MEDIUM,Minimum Path Sum,58.1,0.664814934885504,https://leetcode.com/problems/minimum-path-sum,"Array, Dynamic Programming, Matrix"
MEDIUM,Binary Tree Zigzag Level Order Traversal,57.6,0.6168283891746636,https://leetcode.com/problems/binary-tree-zigzag-level-order-traversal,"Tree, Breadth-First Search, Binary Tree"
MEDIUM,String to Integer (atoi),55.6,0.19229423495277723,https://leetcode.com/problems/string-to-integer-atoi,String
MEDIUM,Validate Binary Search Tree,55.6,0.34380387886661157,https://leetcode.com/problems/validate-binary-search-tree,"Tree, Depth-First Search, Binary Search Tree, Binary Tree"
HARD,First Missing Positive,54.6,0.4108465766394882,https://leetcode.com/problems/first-missing-positive,"Array, Hash Table"
EASY,Find the Index of the First Occurrence in a String,54.6,0.449716000865219,https://leetcode.com/problems/find-the-index-of-the-first-occurrence-in-a-string,"Two Pointers, String, String Matching"
MEDIUM,Combination Sum,54.6,0.7467468656021409,https://leetcode.com/problems/combination-sum,"Array, Backtracking"
MEDIUM,Find First and Last Position of Element in Sorted Array,54.6,0.4682873183580639,https://leetcode.com/problems/find-first-and-last-position-of-element-in-sorted-array,"Array, Binary Search"
HARD,Largest Rectangle in Histogram,54.6,0.4737765317407914,https://leetcode.com/problems/largest-rectangle-in-histogram,"Array, Stack, Monotonic Stack"
MEDIUM,Jump Game II,54.0,0.4150331235291809,https://leetcode.com/problems/jump-game-ii,"Array, Dynamic Programming, Greedy"
MEDIUM,Permutations,54.0,0.8066011364163758,https://leetcode.com/problems/permutations,"Array, Backtracking"
MEDIUM,Unique Paths,52.8,0.6577285437608488,https://leetcode.com/problems/unique-paths,"Math, Dynamic Programming, Combinatorics"
MEDIUM,Swap Nodes in Pairs,52.8,0.6720136828647639,https://leetcode.com/problems/swap-nodes-in-pairs,"Linked List, Recursion"
MEDIUM,4Sum,52.2,0.38219020113793045,https://leetcode.com/problems/4sum,"Array, Two Pointers, Sorting"
EASY,Search Insert Position,52.2,0.4901241638473952,https://leetcode.com/problems/search-insert-position,"Array, Binary Search"
MEDIUM,"Pow(x, n)",52.2,0.3702318641045828,https://leetcode.com/problems/powx-n,"Math, Recursion"
MEDIUM,Integer to Roman,52.2,0.6861928580376627,https://leetcode.com/problems/integer-to-roman,"Hash Table, Math, String"
MEDIUM,Subsets,52.2,0.808795565390318,https://leetcode.com/problems/subsets,"Array, Backtracking, Bit Manipulation"
HARD,Regular Expression Matching,51.6,0.29280131010169236,https://leetcode.com/problems/regular-expression-matching,"String, Dynamic Programming, Recursion"
MEDIUM,Search a 2D Matrix,50.9,0.5228957258337302,https://leetcode.com/problems/search-a-2d-matrix,"Array, Binary Search, Matrix"
MEDIUM,Binary Tree Level Order Traversal,50.9,0.7059658947038693,https://leetcode.com/problems/binary-tree-level-order-traversal,"Tree, Breadth-First Search, Binary Tree"
HARD,N-Queens,50.9,0.7281704967757537,https://leetcode.com/problems/n-queens,"Array, Backtracking"
MEDIUM,Valid Sudoku,50.2,0.6227675793740958,https://leetcode.com/problems/valid-sudoku,"Array, Hash Table, Matrix"
EASY,Binary Tree Inorder Traversal,49.5,0.7858399541084903,https://leetcode.com/problems/binary-tree-inorder-traversal,"Stack, Tree, Depth-First Search, Binary Tree"
MEDIUM,Divide Two Integers,49.5,0.18396975085033054,https://leetcode.com/problems/divide-two-integers,"Math, Bit Manipulation"
MEDIUM,Remove Nth Node From End of List,49.5,0.4896103765491196,https://leetcode.com/problems/remove-nth-node-from-end-of-list,"Linked List, Two Pointers"
MEDIUM,Edit Distance,49.5,0.5878976197609908,https://leetcode.com/problems/edit-distance,"String, Dynamic Programming"
MEDIUM,Simplify Path,49.5,0.4785432317744196,https://leetcode.com/problems/simplify-path,"String, Stack"
MEDIUM,Restore IP Addresses,48.8,0.531583393083398,https://leetcode.com/problems/restore-ip-addresses,"String, Backtracking"
HARD,Sudoku Solver,48.8,0.6390871778033164,https://leetcode.com/problems/sudoku-solver,"Array, Hash Table, Backtracking, Matrix"
HARD,Longest Valid Parentheses,47.2,0.3631311456770452,https://leetcode.com/problems/longest-valid-parentheses,"String, Dynamic Programming, Stack"
MEDIUM,Decode Ways,45.5,0.36530991972040927,https://leetcode.com/problems/decode-ways,"String, Dynamic Programming"
HARD,Maximal Rectangle,44.5,0.5370845822665518,https://leetcode.com/problems/maximal-rectangle,"Array, Dynamic Programming, Stack, Matrix, Monotonic Stack"
EASY,Sqrt(x),44.5,0.4037178718652037,https://leetcode.com/problems/sqrtx,"Math, Binary Search"
MEDIUM,Reverse Linked List II,43.6,0.49591736647057,https://leetcode.com/problems/reverse-linked-list-ii,Linked List
MEDIUM,Permutations II,43.6,0.615917727605333,https://leetcode.com/problems/permutations-ii,"Array, Backtracking, Sorting"
MEDIUM,Zigzag Conversion,43.6,0.5160676713980508,https://leetcode.com/problems/zigzag-conversion,String
EASY,Plus One,42.5,0.47547621095134496,https://leetcode.com/problems/plus-one,"Array, Math"
EASY,Symmetric Tree,42.5,0.5927867908424697,https://leetcode.com/problems/symmetric-tree,"Tree, Depth-First Search, Breadth-First Search, Binary Tree"
EASY,Add Binary,41.4,0.5567701348180015,https://leetcode.com/problems/add-binary,"Math, String, Bit Manipulation, Simulation"
HARD,Minimum Window Substring,41.4,0.45350747638232236,https://leetcode.com/problems/minimum-window-substring,"Hash Table, String, Sliding Window"
MEDIUM,Search in Rotated Sorted Array II,39.0,0.3887965146188378,https://leetcode.com/problems/search-in-rotated-sorted-array-ii,"Array, Binary Search"
HARD,Wildcard Matching,39.0,0.2989833857244126,https://leetcode.com/problems/wildcard-matching,"String, Dynamic Programming, Greedy, Recursion"
EASY,Remove Duplicates from Sorted List,39.0,0.5487080353115535,https://leetcode.com/problems/remove-duplicates-from-sorted-list,Linked List
MEDIUM,Remove Duplicates from Sorted Array II,37.7,0.6290185479131098,https://leetcode.com/problems/remove-duplicates-from-sorted-array-ii,"Array, Two Pointers"
MEDIUM,Insert Interval,37.7,0.43473628714178475,https://leetcode.com/problems/insert-interval,Array
MEDIUM,Combination Sum II,37.7,0.5767453180420465,https://leetcode.com/problems/combination-sum-ii,"Array, Backtracking"
MEDIUM,Multiply Strings,37.7,0.4228941429852704,https://leetcode.com/problems/multiply-strings,"Math, String, Simulation"
HARD,Text Justification,37.7,0.4814988999917213,https://leetcode.com/problems/text-justification,"Array, String, Simulation"
MEDIUM,Spiral Matrix II,37.7,0.734312719680276,https://leetcode.com/problems/spiral-matrix-ii,"Array, Matrix, Simulation"
EASY,Length of Last Word,37.7,0.5631926999044908,https://leetcode.com/problems/length-of-last-word,String
MEDIUM,Recover Binary Search Tree,36.2,0.5632431226781013,https://leetcode.com/problems/recover-binary-search-tree,"Tree, Depth-First Search, Binary Search Tree, Binary Tree"
MEDIUM,Interleaving String,36.2,0.4217918033968859,https://leetcode.com/problems/interleaving-string,"String, Dynamic Programming"
EASY,Same Tree,36.2,0.651268811570624,https://leetcode.com/problems/same-tree,"Tree, Depth-First Search, Breadth-First Search, Binary Tree"
EASY,Maximum Depth of Binary Tree,36.2,0.7713813520613833,https://leetcode.com/problems/maximum-depth-of-binary-tree,"Tree, Depth-First Search, Breadth-First Search, Binary Tree"
MEDIUM,Subsets II,36.2,0.595072748658621,https://leetcode.com/problems/subsets-ii,"Array, Backtracking, Bit Manipulation"
MEDIUM,Rotate List,36.2,0.3994476047394924,https://leetcode.com/problems/rotate-list,"Linked List, Two Pointers"
MEDIUM,Remove Duplicates from Sorted List II,34.7,0.4989080936318432,https://leetcode.com/problems/remove-duplicates-from-sorted-list-ii,"Linked List, Two Pointers"
MEDIUM,Combinations,31.1,0.7289648238875795,https://leetcode.com/problems/combinations,Backtracking
MEDIUM,Count and Say,31.1,0.6050656775612677,https://leetcode.com/problems/count-and-say,String
MEDIUM,3Sum Closest,31.1,0.468869600214817,https://leetcode.com/problems/3sum-closest,"Array, Two Pointers, Sorting"
HARD,Substring with Concatenation of All Words,26.7,0.32997499702748073,https://leetcode.com/problems/substring-with-concatenation-of-all-words,"Hash Table, String, Sliding Window"
MEDIUM,Partition List,24.1,0.5898677373641946,https://leetcode.com/problems/partition-list,"Linked List, Two Pointers"
MEDIUM,Unique Paths II,24.1,0.43154364997722033,https://leetcode.com/problems/unique-paths-ii,"Array, Dynamic Programming, Matrix"
MEDIUM,Unique Binary Search Trees,21.0,0.6244520536210353,https://leetcode.com/problems/unique-binary-search-trees,"Math, Dynamic Programming, Tree, Binary Search Tree, Binary Tree"
HARD,N-Queens II,21.0,0.7672955295381376,https://leetcode.com/problems/n-queens-ii,Backtracking
MEDIUM,Unique Binary Search Trees II,13.2,0.6039807221122715,https://leetcode.com/problems/unique-binary-search-trees-ii,"Dynamic Programming, Backtracking, Tree, Binary Search Tree, Binary Tree"
