Difficulty,Title,Frequency,Acceptance Rate,Link,Topics
MEDIUM,My Calendar I,100.0,0.5835634761289098,https://leetcode.com/problems/my-calendar-i,"Array, Binary Search, Design, Segment Tree, Ordered Set"
MEDIUM,Letter Combinations of a Phone Number,92.7,0.6319924785744381,https://leetcode.com/problems/letter-combinations-of-a-phone-number,"Hash Table, String, Backtracking"
MEDIUM,Count Zero Request Servers,82.4,0.33399169656173167,https://leetcode.com/problems/count-zero-request-servers,"Array, Hash Table, Sliding Window, Sorting"
MEDIUM,Time Based Key-Value Store,82.4,0.493696305955776,https://leetcode.com/problems/time-based-key-value-store,"Hash Table, String, Binary Search, Design"
MEDIUM,Bag of Tokens,82.4,0.5908008555766301,https://leetcode.com/problems/bag-of-tokens,"Array, Two Pointers, Greedy, Sorting"
MEDIUM,Subarray Product Less Than K,82.4,0.5245673251927595,https://leetcode.com/problems/subarray-product-less-than-k,"Array, Binary Search, Sliding Window, Prefix Sum"
