Difficulty,Title,Frequency,Acceptance Rate,Link,Topics
MEDIUM,Time Based Key-Value Store,100.0,0.4933287497777762,https://leetcode.com/problems/time-based-key-value-store,"Hash Table, String, Binary Search, Design"
MEDIUM,My Calendar I,80.3,0.5836272065184106,https://leetcode.com/problems/my-calendar-i,"Array, Binary Search, Design, Segment Tree, Ordered Set"
MEDIUM,Letter Combinations of a Phone Number,80.3,0.6290684126508663,https://leetcode.com/problems/letter-combinations-of-a-phone-number,"Hash Table, String, Backtracking"
MEDIUM,Count Zero Request Servers,65.5,0.3315017558355711,https://leetcode.com/problems/count-zero-request-servers,"Array, Hash Table, Sliding Window, Sorting"
MEDIUM,Longest Increasing Subsequence,65.5,0.5706169565978847,https://leetcode.com/problems/longest-increasing-subsequence,"Array, Binary Search, Dynamic Programming"
MEDIUM,Subarray Product Less Than K,65.5,0.5229993061014712,https://leetcode.com/problems/subarray-product-less-than-k,"Array, Binary Search, Sliding Window, Prefix Sum"
MEDIUM,Restore IP Addresses,65.5,0.5221695781105175,https://leetcode.com/problems/restore-ip-addresses,"String, Backtracking"
MEDIUM,Validate IP Address,65.5,0.27674036278568565,https://leetcode.com/problems/validate-ip-address,String
