Difficulty,Title,Frequency,Acceptance Rate,Link,Topics
MEDIUM,Merge Intervals,100.0,0.49194145611946555,https://leetcode.com/problems/merge-intervals,"Array, Sorting"
MEDIUM,Daily Temperatures,100.0,0.6721569641071392,https://leetcode.com/problems/daily-temperatures,"Array, Stack, Monotonic Stack"
MEDIUM,Insert Delete GetRandom O(1),100.0,0.5492729929120275,https://leetcode.com/problems/insert-delete-getrandom-o1,"Array, Hash Table, Math, Design, Randomized"
MEDIUM,Strings Differ by One Character,100.0,0.4112433883072506,https://leetcode.com/problems/strings-differ-by-one-character,"Hash Table, String, Rolling Hash, Hash Function"
HARD,Find Median from Data Stream,100.0,0.5311647997414327,https://leetcode.com/problems/find-median-from-data-stream,"Two Pointers, Design, Sorting, Heap (Priority Queue), Data Stream"
