Difficulty,Title,Frequency,Acceptance Rate,Link,Topics
MEDIUM,Snapshot Array,100.0,0.3673636139262724,https://leetcode.com/problems/snapshot-array,"Array, Hash Table, Binary Search, Design"
MEDIUM,Interval List Intersections,82.1,0.7252977909143407,https://leetcode.com/problems/interval-list-intersections,"Array, Two Pointers, Line Sweep"
HARD,Guess the Word,82.1,0.3789968984694936,https://leetcode.com/problems/guess-the-word,"Array, Math, String, Interactive, Game Theory"
HARD,Merge k Sorted Lists,75.7,0.5615802831303978,https://leetcode.com/problems/merge-k-sorted-lists,"Linked List, Divide and Conquer, Heap (Priority Queue), Merge Sort"
MEDIUM,Non-overlapping Intervals,75.7,0.5513607395619153,https://leetcode.com/problems/non-overlapping-intervals,"Array, Dynamic Programming, Greedy, Sorting"
HARD,Maximum Profit in Job Scheduling,75.7,0.5433646155781284,https://leetcode.com/problems/maximum-profit-in-job-scheduling,"Array, Binary Search, Dynamic Programming, Sorting"
MEDIUM,Basic Calculator II,75.7,0.4545440691741545,https://leetcode.com/problems/basic-calculator-ii,"Math, String, Stack"
EASY,Image Smoother,66.8,0.6816657079034463,https://leetcode.com/problems/image-smoother,"Array, Matrix"
