Difficulty,Title,Frequency,Acceptance Rate,Link,Topics
MEDIUM,Maximum Subarray,100.0,0.5209977640581438,https://leetcode.com/problems/maximum-subarray,"Array, Divide and Conquer, Dynamic Programming"
MEDIUM,Add Two Numbers,94.3,0.4622508143957371,https://leetcode.com/problems/add-two-numbers,"Linked List, Math, Recursion"
MEDIUM,Maximize Greatness of an Array,87.0,0.5864617466875623,https://leetcode.com/problems/maximize-greatness-of-an-array,"Array, Two Pointers, Greedy, Sorting"
MEDIUM,Group Anagrams,76.7,0.7092882008000586,https://leetcode.com/problems/group-anagrams,"Array, Hash Table, String, Sorting"
MEDIUM,Asteroid Collision,76.7,0.45500659848234903,https://leetcode.com/problems/asteroid-collision,"Array, Stack, Simulation"
MEDIUM,Product of Array Except Self,76.7,0.6777995792305304,https://leetcode.com/problems/product-of-array-except-self,"Array, Prefix Sum"
MEDIUM,Clone Graph,76.7,0.6238568889371842,https://leetcode.com/problems/clone-graph,"Hash Table, Depth-First Search, Breadth-First Search, Graph"
