Difficulty,Title,Frequency,Acceptance Rate,Link,Topics
MEDIUM,4Sum,100.0,0.3747499671165753,https://leetcode.com/problems/4sum,"Array, Two Pointers, Sorting"
MEDIUM,Group Anagrams,100.0,0.7021299923630706,https://leetcode.com/problems/group-anagrams,"Array, Hash Table, String, Sorting"
MEDIUM,Remove Stones to Minimize the Total,100.0,0.6398876582780616,https://leetcode.com/problems/remove-stones-to-minimize-the-total,"Array, Greedy, Heap (Priority Queue)"
MEDIUM,Longest Substring Without Repeating Characters,100.0,0.36201627755852556,https://leetcode.com/problems/longest-substring-without-repeating-characters,"Hash Table, String, Sliding Window"
EASY,Reverse Bits,91.2,0.6193077581638061,https://leetcode.com/problems/reverse-bits,"Divide and Conquer, Bit Manipulation"
EASY,Two Sum,91.2,0.5490430130481706,https://leetcode.com/problems/two-sum,"Array, Hash Table"
EASY,Valid Parentheses,91.2,0.41739367337672173,https://leetcode.com/problems/valid-parentheses,"String, Stack"
MEDIUM,String to Integer (atoi),78.9,0.18614451263829446,https://leetcode.com/problems/string-to-integer-atoi,String
MEDIUM,Minimum Path Sum,78.9,0.6573782048384925,https://leetcode.com/problems/minimum-path-sum,"Array, Dynamic Programming, Matrix"
MEDIUM,Maximum Subarray,78.9,0.5164879153633932,https://leetcode.com/problems/maximum-subarray,"Array, Divide and Conquer, Dynamic Programming"
MEDIUM,Restore IP Addresses,78.9,0.5221676377158972,https://leetcode.com/problems/restore-ip-addresses,"String, Backtracking"
EASY,Best Time to Buy and Sell Stock,78.9,0.5468402088233368,https://leetcode.com/problems/best-time-to-buy-and-sell-stock,"Array, Dynamic Programming"
HARD,Integer to English Words,78.9,0.34232436212470413,https://leetcode.com/problems/integer-to-english-words,"Math, String, Recursion"
MEDIUM,Maximal Square,78.9,0.480868836067273,https://leetcode.com/problems/maximal-square,"Array, Dynamic Programming, Matrix"
MEDIUM,Dot Product of Two Sparse Vectors,78.9,0.8990777076368175,https://leetcode.com/problems/dot-product-of-two-sparse-vectors,"Array, Hash Table, Two Pointers, Design"
MEDIUM,Rectangle Area,78.9,0.4713229527306979,https://leetcode.com/problems/rectangle-area,"Math, Geometry"
MEDIUM,Unique Paths II,78.9,0.4269206271834233,https://leetcode.com/problems/unique-paths-ii,"Array, Dynamic Programming, Matrix"
