Difficulty,Title,Frequency,Acceptance Rate,Link,Topics
EASY,Last Stone Weight,100.0,0.6590369574666358,https://leetcode.com/problems/last-stone-weight,"Array, Heap (Priority Queue)"
MEDIUM,LRU Cache,90.4,0.4507740482370975,https://leetcode.com/problems/lru-cache,"Hash Table, Linked List, Design, Doubly-Linked List"
MEDIUM,Group Anagrams,87.6,0.7083637564384015,https://leetcode.com/problems/group-anagrams,"Array, Hash Table, String, Sorting"
MEDIUM,Minimum Operations to Reduce an Integer to 0,86.1,0.5713762286333296,https://leetcode.com/problems/minimum-operations-to-reduce-an-integer-to-0,"Dynamic Programming, Greedy, Bit Manipulation"
HARD,Special Binary String,84.5,0.6344780594167349,https://leetcode.com/problems/special-binary-string,"String, Recursion"
EASY,Two Sum,80.8,0.556801423868276,https://leetcode.com/problems/two-sum,"Array, Hash Table"
MEDIUM,Longest Substring Without Repeating Characters,80.8,0.3682183211211165,https://leetcode.com/problems/longest-substring-without-repeating-characters,"Hash Table, String, Sliding Window"
EASY,Best Time to Buy and Sell Stock,80.8,0.551572501808003,https://leetcode.com/problems/best-time-to-buy-and-sell-stock,"Array, Dynamic Programming"
MEDIUM,Number of Islands,78.8,0.6219958552129605,https://leetcode.com/problems/number-of-islands,"Array, Depth-First Search, Breadth-First Search, Union Find, Matrix"
HARD,Maximum Number of Visible Points,76.5,0.37620204839472904,https://leetcode.com/problems/maximum-number-of-visible-points,"Array, Math, Geometry, Sliding Window, Sorting"
MEDIUM,Search in Rotated Sorted Array,76.5,0.42739825833121325,https://leetcode.com/problems/search-in-rotated-sorted-array,"Array, Binary Search"
MEDIUM,Maximum Subarray,76.5,0.5204000435312655,https://leetcode.com/problems/maximum-subarray,"Array, Divide and Conquer, Dynamic Programming"
EASY,Reverse Bits,76.5,0.6302513910844534,https://leetcode.com/problems/reverse-bits,"Divide and Conquer, Bit Manipulation"
EASY,Valid Parentheses,71.2,0.42245252680845197,https://leetcode.com/problems/valid-parentheses,"String, Stack"
MEDIUM,Dot Product of Two Sparse Vectors,71.2,0.8994504777223028,https://leetcode.com/problems/dot-product-of-two-sparse-vectors,"Array, Hash Table, Two Pointers, Design"
MEDIUM,Add Two Numbers,71.2,0.46089483687335814,https://leetcode.com/problems/add-two-numbers,"Linked List, Math, Recursion"
EASY,Missing Number,71.2,0.699306053838404,https://leetcode.com/problems/missing-number,"Array, Hash Table, Math, Binary Search, Bit Manipulation, Sorting"
EASY,Move Zeroes,68.1,0.6276424783222408,https://leetcode.com/problems/move-zeroes,"Array, Two Pointers"
MEDIUM,Task Scheduler II,68.1,0.5395777325339423,https://leetcode.com/problems/task-scheduler-ii,"Array, Hash Table, Simulation"
MEDIUM,Merge Intervals,68.1,0.4929247623272226,https://leetcode.com/problems/merge-intervals,"Array, Sorting"
EASY,Fibonacci Number,64.4,0.7286185212081111,https://leetcode.com/problems/fibonacci-number,"Math, Dynamic Programming, Recursion, Memoization"
HARD,Find Median from Data Stream,64.4,0.5319535527153809,https://leetcode.com/problems/find-median-from-data-stream,"Two Pointers, Design, Sorting, Heap (Priority Queue), Data Stream"
MEDIUM,Rotate Image,64.4,0.7776107849325347,https://leetcode.com/problems/rotate-image,"Array, Math, Matrix"
HARD,Merge k Sorted Lists,64.4,0.5660774471917948,https://leetcode.com/problems/merge-k-sorted-lists,"Linked List, Divide and Conquer, Heap (Priority Queue), Merge Sort"
MEDIUM,String to Integer (atoi),60.1,0.19126863187146756,https://leetcode.com/problems/string-to-integer-atoi,String
MEDIUM,Generate Parentheses,60.1,0.7702796622679987,https://leetcode.com/problems/generate-parentheses,"String, Dynamic Programming, Backtracking"
MEDIUM,Rectangle Area,60.1,0.47299035675264833,https://leetcode.com/problems/rectangle-area,"Math, Geometry"
HARD,Trapping Rain Water,60.1,0.6495012248193184,https://leetcode.com/problems/trapping-rain-water,"Array, Two Pointers, Dynamic Programming, Stack, Monotonic Stack"
MEDIUM,Find the Duplicate Number,60.1,0.6273828980810554,https://leetcode.com/problems/find-the-duplicate-number,"Array, Two Pointers, Binary Search, Bit Manipulation"
EASY,Climbing Stairs,60.1,0.53507764867978,https://leetcode.com/problems/climbing-stairs,"Math, Dynamic Programming, Memoization"
MEDIUM,Kth Largest Element in an Array,60.1,0.6790761155995517,https://leetcode.com/problems/kth-largest-element-in-an-array,"Array, Divide and Conquer, Sorting, Heap (Priority Queue), Quickselect"
MEDIUM,Insert Delete GetRandom O(1),60.1,0.5496103973546339,https://leetcode.com/problems/insert-delete-getrandom-o1,"Array, Hash Table, Math, Design, Randomized"
MEDIUM,Copy List with Random Pointer,60.1,0.6034477649172758,https://leetcode.com/problems/copy-list-with-random-pointer,"Hash Table, Linked List"
EASY,Intersection of Two Linked Lists,54.9,0.6093988813950681,https://leetcode.com/problems/intersection-of-two-linked-lists,"Hash Table, Linked List, Two Pointers"
MEDIUM,H-Index,54.9,0.4022537414996441,https://leetcode.com/problems/h-index,"Array, Sorting, Counting Sort"
MEDIUM,Validate Binary Search Tree,54.9,0.34303348318142424,https://leetcode.com/problems/validate-binary-search-tree,"Tree, Depth-First Search, Binary Search Tree, Binary Tree"
MEDIUM,Reverse Linked List II,54.9,0.49505670886903824,https://leetcode.com/problems/reverse-linked-list-ii,Linked List
HARD,Sliding Puzzle,54.9,0.7310899942272026,https://leetcode.com/problems/sliding-puzzle,"Array, Dynamic Programming, Backtracking, Breadth-First Search, Memoization, Matrix"
MEDIUM,Single Element in a Sorted Array,54.9,0.5919340412771942,https://leetcode.com/problems/single-element-in-a-sorted-array,"Array, Binary Search"
MEDIUM,Spiral Matrix,54.9,0.5375491023703993,https://leetcode.com/problems/spiral-matrix,"Array, Matrix, Simulation"
MEDIUM,Maximal Square,54.9,0.4864960848122282,https://leetcode.com/problems/maximal-square,"Array, Dynamic Programming, Matrix"
MEDIUM,Snapshot Array,54.9,0.3666383300841386,https://leetcode.com/problems/snapshot-array,"Array, Hash Table, Binary Search, Design"
MEDIUM,Break a Palindrome,54.9,0.5152784345515549,https://leetcode.com/problems/break-a-palindrome,"String, Greedy"
HARD,Binary Tree Maximum Path Sum,54.9,0.41163495685614604,https://leetcode.com/problems/binary-tree-maximum-path-sum,"Dynamic Programming, Tree, Depth-First Search, Binary Tree"
HARD,Delete Duplicate Folders in System,54.9,0.5374117147257182,https://leetcode.com/problems/delete-duplicate-folders-in-system,"Array, Hash Table, String, Trie, Hash Function"
MEDIUM,Minimum Size Subarray Sum,48.2,0.49269386672009924,https://leetcode.com/problems/minimum-size-subarray-sum,"Array, Binary Search, Sliding Window, Prefix Sum"
HARD,Serialize and Deserialize Binary Tree,48.2,0.5884789927516766,https://leetcode.com/problems/serialize-and-deserialize-binary-tree,"String, Tree, Depth-First Search, Breadth-First Search, Design, Binary Tree"
MEDIUM,Minimum Add to Make Parentheses Valid,48.2,0.7471306271148702,https://leetcode.com/problems/minimum-add-to-make-parentheses-valid,"String, Stack, Greedy"
MEDIUM,Maximum Sum of Distinct Subarrays With Length K,48.2,0.4262748879455111,https://leetcode.com/problems/maximum-sum-of-distinct-subarrays-with-length-k,"Array, Hash Table, Sliding Window"
EASY,Longest Common Prefix,48.2,0.4537242564285344,https://leetcode.com/problems/longest-common-prefix,"String, Trie"
MEDIUM,Convert Binary Search Tree to Sorted Doubly Linked List,48.2,0.6546893919258143,https://leetcode.com/problems/convert-binary-search-tree-to-sorted-doubly-linked-list,"Linked List, Stack, Tree, Depth-First Search, Binary Search Tree, Binary Tree, Doubly-Linked List"
EASY,Reverse Linked List,48.2,0.7910857976924494,https://leetcode.com/problems/reverse-linked-list,"Linked List, Recursion"
EASY,Find Pivot Index,48.2,0.6045854046581874,https://leetcode.com/problems/find-pivot-index,"Array, Prefix Sum"
MEDIUM,Ways to Make a Fair Array,48.2,0.644578398494432,https://leetcode.com/problems/ways-to-make-a-fair-array,"Array, Prefix Sum"
EASY,Design HashMap,48.2,0.6587347518730582,https://leetcode.com/problems/design-hashmap,"Array, Hash Table, Linked List, Design, Hash Function"
MEDIUM,Double a Number Represented as a Linked List,48.2,0.6123546959167525,https://leetcode.com/problems/double-a-number-represented-as-a-linked-list,"Linked List, Math, Stack"
MEDIUM,Find The Original Array of Prefix Xor,48.2,0.8809502652693202,https://leetcode.com/problems/find-the-original-array-of-prefix-xor,"Array, Bit Manipulation"
MEDIUM,Minimum Knight Moves,48.2,0.41304853930576163,https://leetcode.com/problems/minimum-knight-moves,Breadth-First Search
EASY,Merge Sorted Array,48.2,0.5280215709883824,https://leetcode.com/problems/merge-sorted-array,"Array, Two Pointers, Sorting"
MEDIUM,Implement Trie (Prefix Tree),48.2,0.6781135061433737,https://leetcode.com/problems/implement-trie-prefix-tree,"Hash Table, String, Design, Trie"
HARD,Max Points on a Line,48.2,0.28867038203155254,https://leetcode.com/problems/max-points-on-a-line,"Array, Hash Table, Math, Geometry"
MEDIUM,Keys and Rooms,48.2,0.7459964069328694,https://leetcode.com/problems/keys-and-rooms,"Depth-First Search, Breadth-First Search, Graph"
MEDIUM,Find Peak Element,48.2,0.4649174694077514,https://leetcode.com/problems/find-peak-element,"Array, Binary Search"
EASY,Majority Element,48.2,0.6570097858585374,https://leetcode.com/problems/majority-element,"Array, Hash Table, Divide and Conquer, Sorting, Counting"
HARD,Best Time to Buy and Sell Stock IV,48.2,0.4683187341869201,https://leetcode.com/problems/best-time-to-buy-and-sell-stock-iv,"Array, Dynamic Programming"
MEDIUM,House Robber,48.2,0.5224407733625577,https://leetcode.com/problems/house-robber,"Array, Dynamic Programming"
MEDIUM,Set Matrix Zeroes,48.2,0.6055608400696226,https://leetcode.com/problems/set-matrix-zeroes,"Array, Hash Table, Matrix"
MEDIUM,Course Schedule II,48.2,0.5327015130385709,https://leetcode.com/problems/course-schedule-ii,"Depth-First Search, Breadth-First Search, Graph, Topological Sort"
MEDIUM,Verify Preorder Sequence in Binary Search Tree,48.2,0.5081914813243524,https://leetcode.com/problems/verify-preorder-sequence-in-binary-search-tree,"Array, Stack, Tree, Binary Search Tree, Recursion, Monotonic Stack, Binary Tree"
EASY,Counting Bits,48.2,0.796636536463013,https://leetcode.com/problems/counting-bits,"Dynamic Programming, Bit Manipulation"
EASY,Intersection of Two Arrays,48.2,0.7638785356906872,https://leetcode.com/problems/intersection-of-two-arrays,"Array, Hash Table, Two Pointers, Binary Search, Sorting"
MEDIUM,Shuffle an Array,48.2,0.5900228766593634,https://leetcode.com/problems/shuffle-an-array,"Array, Math, Design, Randomized"
MEDIUM,Linked List Random Node,48.2,0.6393792724432832,https://leetcode.com/problems/linked-list-random-node,"Linked List, Math, Reservoir Sampling, Randomized"
MEDIUM,Reverse Integer,48.2,0.3022434846494795,https://leetcode.com/problems/reverse-integer,Math
EASY,Fizz Buzz,38.8,0.7430909650170952,https://leetcode.com/problems/fizz-buzz,"Math, String, Simulation"
MEDIUM,Coin Change,38.8,0.46365260447834333,https://leetcode.com/problems/coin-change,"Array, Dynamic Programming, Breadth-First Search"
EASY,Print in Order,38.8,0.714943210527472,https://leetcode.com/problems/print-in-order,Concurrency
EASY,Remove Duplicates from Sorted List,38.8,0.5477939148935809,https://leetcode.com/problems/remove-duplicates-from-sorted-list,Linked List
MEDIUM,Maximum Product Subarray,38.8,0.34862830654668236,https://leetcode.com/problems/maximum-product-subarray,"Array, Dynamic Programming"
MEDIUM,Validate IP Address,38.8,0.2779682892238889,https://leetcode.com/problems/validate-ip-address,String
MEDIUM,Beautiful Arrangement,38.8,0.6451472241984715,https://leetcode.com/problems/beautiful-arrangement,"Array, Dynamic Programming, Backtracking, Bit Manipulation, Bitmask"
MEDIUM,3Sum,38.8,0.36956156765208276,https://leetcode.com/problems/3sum,"Array, Two Pointers, Sorting"
HARD,Longest Increasing Path in a Matrix,38.8,0.552695728753853,https://leetcode.com/problems/longest-increasing-path-in-a-matrix,"Array, Dynamic Programming, Depth-First Search, Breadth-First Search, Graph, Topological Sort, Memoization, Matrix"
EASY,Single Number,38.8,0.7585185221834927,https://leetcode.com/problems/single-number,"Array, Bit Manipulation"
MEDIUM,Robot Bounded In Circle,38.8,0.5621098416924875,https://leetcode.com/problems/robot-bounded-in-circle,"Math, String, Simulation"
MEDIUM,Min Stack,38.8,0.563416360537016,https://leetcode.com/problems/min-stack,"Stack, Design"
MEDIUM,Course Schedule,38.8,0.4907905166737925,https://leetcode.com/problems/course-schedule,"Depth-First Search, Breadth-First Search, Graph, Topological Sort"
MEDIUM,Delete Node in a Linked List,38.8,0.8218665469356585,https://leetcode.com/problems/delete-node-in-a-linked-list,Linked List
MEDIUM,Meeting Rooms II,38.8,0.5211672224750508,https://leetcode.com/problems/meeting-rooms-ii,"Array, Two Pointers, Greedy, Sorting, Heap (Priority Queue), Prefix Sum"
MEDIUM,Range Sum Query 2D - Immutable,38.8,0.5641261186113595,https://leetcode.com/problems/range-sum-query-2d-immutable,"Array, Design, Matrix, Prefix Sum"
EASY,Is Subsequence,38.8,0.48352899624632284,https://leetcode.com/problems/is-subsequence,"Two Pointers, String, Dynamic Programming"
MEDIUM,Remove Nth Node From End of List,38.8,0.487938766130139,https://leetcode.com/problems/remove-nth-node-from-end-of-list,"Linked List, Two Pointers"
MEDIUM,Number of Operations to Make Network Connected,38.8,0.6451411389971992,https://leetcode.com/problems/number-of-operations-to-make-network-connected,"Depth-First Search, Breadth-First Search, Union Find, Graph"
MEDIUM,Sort Characters By Frequency,38.8,0.7398620397937105,https://leetcode.com/problems/sort-characters-by-frequency,"Hash Table, String, Sorting, Heap (Priority Queue), Bucket Sort, Counting"
MEDIUM,Swapping Nodes in a Linked List,38.8,0.684170060036097,https://leetcode.com/problems/swapping-nodes-in-a-linked-list,"Linked List, Two Pointers"
MEDIUM,Valid Sudoku,38.8,0.6216820903460034,https://leetcode.com/problems/valid-sudoku,"Array, Hash Table, Matrix"
MEDIUM,Subarray Product Less Than K,38.8,0.5278807046369229,https://leetcode.com/problems/subarray-product-less-than-k,"Array, Binary Search, Sliding Window, Prefix Sum"
EASY,Rectangle Overlap,38.8,0.45691582714923373,https://leetcode.com/problems/rectangle-overlap,"Math, Geometry"
MEDIUM,All Possible Full Binary Trees,38.8,0.8269306146362395,https://leetcode.com/problems/all-possible-full-binary-trees,"Dynamic Programming, Tree, Recursion, Memoization, Binary Tree"
EASY,Greatest Common Divisor of Strings,38.8,0.5266457531444878,https://leetcode.com/problems/greatest-common-divisor-of-strings,"Math, String"
