Difficulty,Title,Frequency,Acceptance Rate,Link,Topics
MEDIUM,Stock Price Fluctuation ,100.0,0.4807760891823798,https://leetcode.com/problems/stock-price-fluctuation,"Hash Table, Design, Heap (Priority Queue), Data Stream, Ordered Set"
HARD,All O`one Data Structure,90.6,0.4416315153492027,https://leetcode.com/problems/all-oone-data-structure,"Hash Table, Linked List, Design, Doubly-Linked List"
MEDIUM,Meeting Rooms II,90.6,0.5211674606308807,https://leetcode.com/problems/meeting-rooms-ii,"Array, Two Pointers, Greedy, Sorting, Heap (Priority Queue), Prefix Sum"
MEDIUM,Design Snake Game,84.0,0.39650578271192866,https://leetcode.com/problems/design-snake-game,"Array, Hash Table, Design, Queue, Simulation"
MEDIUM,Merge Intervals,74.7,0.49292493219520606,https://leetcode.com/problems/merge-intervals,"Array, Sorting"
MEDIUM,Lowest Common Ancestor of a Binary Tree,74.7,0.6655719302597816,https://leetcode.com/problems/lowest-common-ancestor-of-a-binary-tree,"Tree, Depth-First Search, Binary Tree"
MEDIUM,Koko Eating Bananas,74.7,0.49052699941024813,https://leetcode.com/problems/koko-eating-bananas,"Array, Binary Search"
