Difficulty,Title,Frequency,Acceptance Rate,Link,Topics
MEDIUM,Rank Teams by Votes,100.0,0.5887300193219743,https://leetcode.com/problems/rank-teams-by-votes,"Array, Hash Table, String, Sorting, Counting"
MEDIUM,Design Snake Game,90.7,0.38984997364575613,https://leetcode.com/problems/design-snake-game,"Array, Hash Table, Design, Queue, Simulation"
EASY,Logger Rate Limiter,80.3,0.7632108059071362,https://leetcode.com/problems/logger-rate-limiter,"Hash Table, Design, Data Stream"
MEDIUM,Design File System,72.8,0.6370661705106477,https://leetcode.com/problems/design-file-system,"Hash Table, String, Design, Trie"
MEDIUM,Maximum Square Area by Removing Fences From a Field,70.9,0.23880346317702209,https://leetcode.com/problems/maximum-square-area-by-removing-fences-from-a-field,"Array, Hash Table, Enumeration"
HARD,Cherry Pickup,70.9,0.3750405888083126,https://leetcode.com/problems/cherry-pickup,"Array, Dynamic Programming, Matrix"
HARD,All O`one Data Structure,70.9,0.44904876099120705,https://leetcode.com/problems/all-oone-data-structure,"Hash Table, Linked List, Design, Doubly-Linked List"
EASY,Maximum Area of Longest Diagonal Rectangle,70.9,0.3661244631271132,https://leetcode.com/problems/maximum-area-of-longest-diagonal-rectangle,Array
MEDIUM,Stock Price Fluctuation ,68.8,0.4863141914276341,https://leetcode.com/problems/stock-price-fluctuation,"Hash Table, Design, Heap (Priority Queue), Data Stream, Ordered Set"
MEDIUM,Longest String Chain,68.8,0.616434698349428,https://leetcode.com/problems/longest-string-chain,"Array, Hash Table, Two Pointers, String, Dynamic Programming, Sorting"
MEDIUM,Group Anagrams,66.5,0.7021300688440933,https://leetcode.com/problems/group-anagrams,"Array, Hash Table, String, Sorting"
MEDIUM,Merge Intervals,63.8,0.48695114210994406,https://leetcode.com/problems/merge-intervals,"Array, Sorting"
MEDIUM,Online Election,60.7,0.5236168633741112,https://leetcode.com/problems/online-election,"Array, Hash Table, Binary Search, Design"
MEDIUM,Majority Element II,60.7,0.5354833214182498,https://leetcode.com/problems/majority-element-ii,"Array, Hash Table, Sorting, Counting"
MEDIUM,Longest Increasing Subsequence,60.7,0.5706150540836742,https://leetcode.com/problems/longest-increasing-subsequence,"Array, Binary Search, Dynamic Programming"
HARD,String Transformation,57.1,0.30498220640569396,https://leetcode.com/problems/string-transformation,"Math, String, Dynamic Programming, String Matching"
MEDIUM,Design Tic-Tac-Toe,52.7,0.5840260511971237,https://leetcode.com/problems/design-tic-tac-toe,"Array, Hash Table, Design, Matrix, Simulation"
MEDIUM,Integer to Roman,52.7,0.6765158253339598,https://leetcode.com/problems/integer-to-roman,"Hash Table, Math, String"
MEDIUM,Boats to Save People,47.0,0.5988395276516951,https://leetcode.com/problems/boats-to-save-people,"Array, Two Pointers, Greedy, Sorting"
EASY,Crawler Log Folder,47.0,0.716418682671256,https://leetcode.com/problems/crawler-log-folder,"Array, String, Stack"
MEDIUM,High-Access Employees,47.0,0.4517921595254262,https://leetcode.com/problems/high-access-employees,"Array, Hash Table, String, Sorting"
MEDIUM,Maximum Number of Occurrences of a Substring,47.0,0.528664942621626,https://leetcode.com/problems/maximum-number-of-occurrences-of-a-substring,"Hash Table, String, Sliding Window"
HARD,Count Vowels Permutation,47.0,0.6157933250612453,https://leetcode.com/problems/count-vowels-permutation,Dynamic Programming
HARD,Minimum Time to Visit a Cell In a Grid,47.0,0.5721181187443131,https://leetcode.com/problems/minimum-time-to-visit-a-cell-in-a-grid,"Array, Breadth-First Search, Graph, Heap (Priority Queue), Matrix, Shortest Path"
MEDIUM,Koko Eating Bananas,47.0,0.48764643005832164,https://leetcode.com/problems/koko-eating-bananas,"Array, Binary Search"
MEDIUM,Unique Paths II,47.0,0.42692030404695813,https://leetcode.com/problems/unique-paths-ii,"Array, Dynamic Programming, Matrix"
EASY,Best Time to Buy and Sell Stock,47.0,0.5468401726589883,https://leetcode.com/problems/best-time-to-buy-and-sell-stock,"Array, Dynamic Programming"
EASY,Valid Anagram,39.0,0.6604124838932007,https://leetcode.com/problems/valid-anagram,"Hash Table, String, Sorting"
MEDIUM,Single Element in a Sorted Array,39.0,0.5915256425901698,https://leetcode.com/problems/single-element-in-a-sorted-array,"Array, Binary Search"
MEDIUM,Search Suggestions System,39.0,0.6504838917341421,https://leetcode.com/problems/search-suggestions-system,"Array, String, Binary Search, Trie, Sorting, Heap (Priority Queue)"
MEDIUM,Longest Consecutive Sequence,39.0,0.47255033487450776,https://leetcode.com/problems/longest-consecutive-sequence,"Array, Hash Table, Union Find"
MEDIUM,Maximum Good Subarray Sum,39.0,0.19886660143509455,https://leetcode.com/problems/maximum-good-subarray-sum,"Array, Hash Table, Prefix Sum"
MEDIUM,Smallest Missing Non-negative Integer After Operations,39.0,0.39510763209393346,https://leetcode.com/problems/smallest-missing-non-negative-integer-after-operations,"Array, Hash Table, Math, Greedy"
HARD,Tallest Billboard,39.0,0.519899510776147,https://leetcode.com/problems/tallest-billboard,"Array, Dynamic Programming"
HARD,Minimum Cost to Convert String II,39.0,0.2567617636161541,https://leetcode.com/problems/minimum-cost-to-convert-string-ii,"Array, String, Dynamic Programming, Graph, Trie, Shortest Path"
HARD,Verbal Arithmetic Puzzle,39.0,0.3469000992690191,https://leetcode.com/problems/verbal-arithmetic-puzzle,"Array, Math, String, Backtracking"
MEDIUM,Make Lexicographically Smallest Array by Swapping Elements,39.0,0.604216330376169,https://leetcode.com/problems/make-lexicographically-smallest-array-by-swapping-elements,"Array, Union Find, Sorting"
HARD,Number of Possible Sets of Closing Branches,39.0,0.5085548330071343,https://leetcode.com/problems/number-of-possible-sets-of-closing-branches,"Bit Manipulation, Graph, Heap (Priority Queue), Enumeration, Shortest Path"
MEDIUM,Minimum Cost to Convert String I,39.0,0.5799383056075796,https://leetcode.com/problems/minimum-cost-to-convert-string-i,"Array, String, Graph, Shortest Path"
MEDIUM,Longest Substring Without Repeating Characters,39.0,0.3620165541116958,https://leetcode.com/problems/longest-substring-without-repeating-characters,"Hash Table, String, Sliding Window"
MEDIUM,Container With Most Water,39.0,0.5703988986916181,https://leetcode.com/problems/container-with-most-water,"Array, Two Pointers, Greedy"
EASY,Two Sum,39.0,0.5490431603031376,https://leetcode.com/problems/two-sum,"Array, Hash Table"
MEDIUM,Basic Calculator II,39.0,0.45124071171493463,https://leetcode.com/problems/basic-calculator-ii,"Math, String, Stack"
MEDIUM,3Sum,39.0,0.3627880822305748,https://leetcode.com/problems/3sum,"Array, Two Pointers, Sorting"
HARD,Trapping Rain Water,39.0,0.641232009066793,https://leetcode.com/problems/trapping-rain-water,"Array, Two Pointers, Dynamic Programming, Stack, Monotonic Stack"
HARD,Text Justification,39.0,0.4683156504443167,https://leetcode.com/problems/text-justification,"Array, String, Simulation"
MEDIUM,Subsets,39.0,0.8012527910071825,https://leetcode.com/problems/subsets,"Array, Backtracking, Bit Manipulation"
EASY,Merge Sorted Array,39.0,0.5209807524288766,https://leetcode.com/problems/merge-sorted-array,"Array, Two Pointers, Sorting"
EASY,Last Stone Weight,39.0,0.6577187147531035,https://leetcode.com/problems/last-stone-weight,"Array, Heap (Priority Queue)"
HARD,Maximum Path Quality of a Graph,39.0,0.5946177253708634,https://leetcode.com/problems/maximum-path-quality-of-a-graph,"Array, Backtracking, Graph"
HARD,Number of Digit One,39.0,0.35464759091265585,https://leetcode.com/problems/number-of-digit-one,"Math, Dynamic Programming, Recursion"
HARD,Basic Calculator,39.0,0.4466715602766622,https://leetcode.com/problems/basic-calculator,"Math, String, Stack, Recursion"
MEDIUM,Coin Change,39.0,0.4567923085934965,https://leetcode.com/problems/coin-change,"Array, Dynamic Programming, Breadth-First Search"
EASY,Add Two Integers,39.0,0.8811092595434912,https://leetcode.com/problems/add-two-integers,Math
MEDIUM,Find K Pairs with Smallest Sums,39.0,0.4038275845874889,https://leetcode.com/problems/find-k-pairs-with-smallest-sums,"Array, Heap (Priority Queue)"
HARD,Split Array Largest Sum,39.0,0.5728408175177109,https://leetcode.com/problems/split-array-largest-sum,"Array, Binary Search, Dynamic Programming, Greedy, Prefix Sum"
EASY,Kth Largest Element in a Stream,39.0,0.5962668061019435,https://leetcode.com/problems/kth-largest-element-in-a-stream,"Tree, Design, Binary Search Tree, Heap (Priority Queue), Binary Tree, Data Stream"
EASY,Lemonade Change,39.0,0.5828194706475724,https://leetcode.com/problems/lemonade-change,"Array, Greedy"
MEDIUM,Meeting Rooms II,39.0,0.5187228835243075,https://leetcode.com/problems/meeting-rooms-ii,"Array, Two Pointers, Greedy, Sorting, Heap (Priority Queue), Prefix Sum"
EASY,Assign Cookies,39.0,0.5343500421609894,https://leetcode.com/problems/assign-cookies,"Array, Two Pointers, Greedy, Sorting"
