Difficulty,Title,Frequency,Acceptance Rate,Link,Topics
MEDIUM,Rank Teams by Votes,100.0,0.5909234417298662,https://leetcode.com/problems/rank-teams-by-votes,"Array, Hash Table, String, Sorting, Counting"
MEDIUM,Design Snake Game,87.1,0.39040765763861285,https://leetcode.com/problems/design-snake-game,"Array, Hash Table, Design, Queue, Simulation"
MEDIUM,Stock Price Fluctuation ,77.1,0.48775408405038034,https://leetcode.com/problems/stock-price-fluctuation,"Hash Table, Design, Heap (Priority Queue), Data Stream, Ordered Set"
EASY,Logger Rate Limiter,72.0,0.7637278475953447,https://leetcode.com/problems/logger-rate-limiter,"Hash Table, Design, Data Stream"
HARD,All O`one Data Structure,71.1,0.4479560948509063,https://leetcode.com/problems/all-oone-data-structure,"Hash Table, Linked List, Design, Doubly-Linked List"
MEDIUM,High-Access Employees,68.2,0.4551763723648507,https://leetcode.com/problems/high-access-employees,"Array, Hash Table, String, Sorting"
MEDIUM,Design File System,62.0,0.6384438743474283,https://leetcode.com/problems/design-file-system,"Hash Table, String, Design, Trie"
HARD,Minimum Time to Visit a Cell In a Grid,60.5,0.5710250627094707,https://leetcode.com/problems/minimum-time-to-visit-a-cell-in-a-grid,"Array, Breadth-First Search, Graph, Heap (Priority Queue), Matrix, Shortest Path"
HARD,Cherry Pickup,58.8,0.3759097076600469,https://leetcode.com/problems/cherry-pickup,"Array, Dynamic Programming, Matrix"
HARD,Number of Possible Sets of Closing Branches,58.8,0.5096106150793651,https://leetcode.com/problems/number-of-possible-sets-of-closing-branches,"Bit Manipulation, Graph, Heap (Priority Queue), Enumeration, Shortest Path"
EASY,Maximum Area of Longest Diagonal Rectangle,58.8,0.3669994603345926,https://leetcode.com/problems/maximum-area-of-longest-diagonal-rectangle,Array
MEDIUM,Maximum Good Subarray Sum,58.8,0.20083655339999204,https://leetcode.com/problems/maximum-good-subarray-sum,"Array, Hash Table, Prefix Sum"
HARD,Minimum Cost to Convert String II,58.8,0.2591159466472436,https://leetcode.com/problems/minimum-cost-to-convert-string-ii,"Array, String, Dynamic Programming, Graph, Trie, Shortest Path"
MEDIUM,Minimum Cost to Convert String I,58.8,0.5791347012085271,https://leetcode.com/problems/minimum-cost-to-convert-string-i,"Array, String, Graph, Shortest Path"
MEDIUM,Smallest Missing Non-negative Integer After Operations,58.8,0.39569593147751614,https://leetcode.com/problems/smallest-missing-non-negative-integer-after-operations,"Array, Hash Table, Math, Greedy"
HARD,Verbal Arithmetic Puzzle,58.8,0.3464234063855824,https://leetcode.com/problems/verbal-arithmetic-puzzle,"Array, Math, String, Backtracking"
MEDIUM,Maximum Square Area by Removing Fences From a Field,58.8,0.2403755868544601,https://leetcode.com/problems/maximum-square-area-by-removing-fences-from-a-field,"Array, Hash Table, Enumeration"
EASY,Find the Width of Columns of a Grid,58.8,0.6881126017902324,https://leetcode.com/problems/find-the-width-of-columns-of-a-grid,"Array, Matrix"
MEDIUM,Make Lexicographically Smallest Array by Swapping Elements,58.8,0.6044461407548303,https://leetcode.com/problems/make-lexicographically-smallest-array-by-swapping-elements,"Array, Union Find, Sorting"
MEDIUM,Merge Intervals,56.9,0.4888150589044163,https://leetcode.com/problems/merge-intervals,"Array, Sorting"
MEDIUM,Longest String Chain,56.9,0.6173034770158395,https://leetcode.com/problems/longest-string-chain,"Array, Hash Table, Two Pointers, String, Dynamic Programming, Sorting"
MEDIUM,Group Anagrams,56.9,0.7043763918432527,https://leetcode.com/problems/group-anagrams,"Array, Hash Table, String, Sorting"
MEDIUM,Longest Increasing Subsequence,54.8,0.572620540609302,https://leetcode.com/problems/longest-increasing-subsequence,"Array, Binary Search, Dynamic Programming"
MEDIUM,Majority Element II,52.4,0.5377545605208466,https://leetcode.com/problems/majority-element-ii,"Array, Hash Table, Sorting, Counting"
HARD,Text Justification,49.7,0.4727200909406146,https://leetcode.com/problems/text-justification,"Array, String, Simulation"
MEDIUM,Online Election,49.7,0.5247771780065278,https://leetcode.com/problems/online-election,"Array, Hash Table, Binary Search, Design"
HARD,String Transformation,46.5,0.3060878412752247,https://leetcode.com/problems/string-transformation,"Math, String, Dynamic Programming, String Matching"
EASY,Best Time to Buy and Sell Stock,46.5,0.5482911136318221,https://leetcode.com/problems/best-time-to-buy-and-sell-stock,"Array, Dynamic Programming"
MEDIUM,The Time When the Network Becomes Idle,46.5,0.5304794018472365,https://leetcode.com/problems/the-time-when-the-network-becomes-idle,"Array, Breadth-First Search, Graph"
MEDIUM,Design Tic-Tac-Toe,42.5,0.584584996936857,https://leetcode.com/problems/design-tic-tac-toe,"Array, Hash Table, Design, Matrix, Simulation"
HARD,Russian Doll Envelopes,42.5,0.37184111150478927,https://leetcode.com/problems/russian-doll-envelopes,"Array, Binary Search, Dynamic Programming, Sorting"
MEDIUM,Koko Eating Bananas,42.5,0.489033960825752,https://leetcode.com/problems/koko-eating-bananas,"Array, Binary Search"
MEDIUM,Design Hit Counter,37.4,0.690321537478178,https://leetcode.com/problems/design-hit-counter,"Array, Binary Search, Design, Queue, Data Stream"
MEDIUM,Boats to Save People,37.4,0.5997957942978286,https://leetcode.com/problems/boats-to-save-people,"Array, Two Pointers, Greedy, Sorting"
MEDIUM,Jump Game II,37.4,0.4118348795957237,https://leetcode.com/problems/jump-game-ii,"Array, Dynamic Programming, Greedy"
EASY,Crawler Log Folder,37.4,0.7160625616639978,https://leetcode.com/problems/crawler-log-folder,"Array, String, Stack"
MEDIUM,Word Search,37.4,0.4471707335983378,https://leetcode.com/problems/word-search,"Array, String, Backtracking, Depth-First Search, Matrix"
MEDIUM,Longest Consecutive Sequence,37.4,0.47157715510708975,https://leetcode.com/problems/longest-consecutive-sequence,"Array, Hash Table, Union Find"
MEDIUM,Pairs of Songs With Total Durations Divisible by 60,37.4,0.5315761152424555,https://leetcode.com/problems/pairs-of-songs-with-total-durations-divisible-by-60,"Array, Hash Table, Counting"
EASY,Two Sum,37.4,0.5518537815912549,https://leetcode.com/problems/two-sum,"Array, Hash Table"
HARD,Count Vowels Permutation,37.4,0.6153256839626786,https://leetcode.com/problems/count-vowels-permutation,Dynamic Programming
MEDIUM,Maximum Number of Occurrences of a Substring,37.4,0.5299351032448377,https://leetcode.com/problems/maximum-number-of-occurrences-of-a-substring,"Hash Table, String, Sliding Window"
MEDIUM,Longest Substring Without Repeating Characters,37.4,0.3641853782864082,https://leetcode.com/problems/longest-substring-without-repeating-characters,"Hash Table, String, Sliding Window"
EASY,Merge Sorted Array,37.4,0.523533750054052,https://leetcode.com/problems/merge-sorted-array,"Array, Two Pointers, Sorting"
MEDIUM,Integer to Roman,37.4,0.6798522274049649,https://leetcode.com/problems/integer-to-roman,"Hash Table, Math, String"
MEDIUM,Unique Paths II,37.4,0.42817944278340436,https://leetcode.com/problems/unique-paths-ii,"Array, Dynamic Programming, Matrix"
HARD,Trapping Rain Water,30.4,0.6439795947297278,https://leetcode.com/problems/trapping-rain-water,"Array, Two Pointers, Dynamic Programming, Stack, Monotonic Stack"
MEDIUM,Find K Closest Elements,30.4,0.4839130074118919,https://leetcode.com/problems/find-k-closest-elements,"Array, Two Pointers, Binary Search, Sliding Window, Sorting, Heap (Priority Queue)"
MEDIUM,Maximum Subarray,30.4,0.5179055270957716,https://leetcode.com/problems/maximum-subarray,"Array, Divide and Conquer, Dynamic Programming"
MEDIUM,Top K Frequent Elements,30.4,0.6415069564858246,https://leetcode.com/problems/top-k-frequent-elements,"Array, Hash Table, Divide and Conquer, Sorting, Heap (Priority Queue), Bucket Sort, Counting, Quickselect"
EASY,Assign Cookies,30.4,0.5352710400720168,https://leetcode.com/problems/assign-cookies,"Array, Two Pointers, Greedy, Sorting"
EASY,Can Place Flowers,30.4,0.2882622714730366,https://leetcode.com/problems/can-place-flowers,"Array, Greedy"
EASY,Valid Anagram,30.4,0.6622754440300921,https://leetcode.com/problems/valid-anagram,"Hash Table, String, Sorting"
MEDIUM,3Sum,30.4,0.3653139967028588,https://leetcode.com/problems/3sum,"Array, Two Pointers, Sorting"
MEDIUM,Nth Highest Salary,30.4,0.3790001165553994,https://leetcode.com/problems/nth-highest-salary,Database
MEDIUM,Container With Most Water,30.4,0.5726806078040536,https://leetcode.com/problems/container-with-most-water,"Array, Two Pointers, Greedy"
EASY,Last Stone Weight,30.4,0.6580371076355379,https://leetcode.com/problems/last-stone-weight,"Array, Heap (Priority Queue)"
HARD,Maximum Path Quality of a Graph,30.4,0.5943799490785079,https://leetcode.com/problems/maximum-path-quality-of-a-graph,"Array, Backtracking, Graph"
MEDIUM,Single Element in a Sorted Array,30.4,0.5915016200084092,https://leetcode.com/problems/single-element-in-a-sorted-array,"Array, Binary Search"
HARD,Split Array Largest Sum,30.4,0.5748678817185258,https://leetcode.com/problems/split-array-largest-sum,"Array, Binary Search, Dynamic Programming, Greedy, Prefix Sum"
HARD,Basic Calculator,30.4,0.4498982542827066,https://leetcode.com/problems/basic-calculator,"Math, String, Stack, Recursion"
MEDIUM,Search Suggestions System,30.4,0.6501466014794453,https://leetcode.com/problems/search-suggestions-system,"Array, String, Binary Search, Trie, Sorting, Heap (Priority Queue)"
MEDIUM,Basic Calculator II,30.4,0.4533781111926362,https://leetcode.com/problems/basic-calculator-ii,"Math, String, Stack"
HARD,Number of Digit One,30.4,0.3560978904908035,https://leetcode.com/problems/number-of-digit-one,"Math, Dynamic Programming, Recursion"
HARD,Tallest Billboard,30.4,0.519450950844376,https://leetcode.com/problems/tallest-billboard,"Array, Dynamic Programming"
MEDIUM,Meeting Rooms II,30.4,0.5195251737160005,https://leetcode.com/problems/meeting-rooms-ii,"Array, Two Pointers, Greedy, Sorting, Heap (Priority Queue), Prefix Sum"
EASY,Lemonade Change,30.4,0.5831273227578193,https://leetcode.com/problems/lemonade-change,"Array, Greedy"
EASY,Kth Largest Element in a Stream,30.4,0.5971865871613551,https://leetcode.com/problems/kth-largest-element-in-a-stream,"Tree, Design, Binary Search Tree, Heap (Priority Queue), Binary Tree, Data Stream"
MEDIUM,Coin Change,30.4,0.4591444029687317,https://leetcode.com/problems/coin-change,"Array, Dynamic Programming, Breadth-First Search"
EASY,Add Two Integers,30.4,0.8813249633903585,https://leetcode.com/problems/add-two-integers,Math
MEDIUM,Find K Pairs with Smallest Sums,30.4,0.40465742663150217,https://leetcode.com/problems/find-k-pairs-with-smallest-sums,"Array, Heap (Priority Queue)"
