Difficulty,Title,Frequency,Acceptance Rate,Link,Topics
MEDIUM,LRU Cache,100.0,0.44717895101385047,https://leetcode.com/problems/lru-cache,"Hash Table, Linked List, Design, Doubly-Linked List"
MEDIUM,Walking Robot Simulation,97.8,0.5814836606733542,https://leetcode.com/problems/walking-robot-simulation,"Array, Hash Table, Simulation"
HARD,Design In-Memory File System,74.4,0.4810280283349201,https://leetcode.com/problems/design-in-memory-file-system,"Hash Table, String, Design, Trie, Sorting"
HARD,Design a Text Editor,65.8,0.47745002437835204,https://leetcode.com/problems/design-a-text-editor,"Linked List, String, Stack, Design, Simulation, Doubly-Linked List"
EASY,Find Users With Valid E-Mails,65.8,0.4424875256564513,https://leetcode.com/problems/find-users-with-valid-e-mails,Database
MEDIUM,Design Tic-Tac-Toe,65.8,0.5850248686529532,https://leetcode.com/problems/design-tic-tac-toe,"Array, Hash Table, Design, Matrix, Simulation"
MEDIUM,Walls and Gates,65.8,0.6270083975689921,https://leetcode.com/problems/walls-and-gates,"Array, Breadth-First Search, Matrix"
