Difficulty,Title,Frequency,Acceptance Rate,Link,Topics
EASY,Best Time to Buy and Sell Stock,100.0,0.549250665271373,https://leetcode.com/problems/best-time-to-buy-and-sell-stock,"Array, Dynamic Programming"
HARD,Count Subarrays With Fixed Bounds,66.7,0.6768140227683798,https://leetcode.com/problems/count-subarrays-with-fixed-bounds,"Array, Queue, Sliding Window, Monotonic Queue"
MEDIUM,Kth Largest Element in an Array,66.7,0.6774061980728745,https://leetcode.com/problems/kth-largest-element-in-an-array,"Array, Divide and Conquer, Sorting, Heap (Priority Queue), Quickselect"
MEDIUM,Copy List with Random Pointer,66.7,0.5987545487397028,https://leetcode.com/problems/copy-list-with-random-pointer,"Hash Table, Linked List"
HARD,Stamping The Sequence,66.7,0.6187332286972812,https://leetcode.com/problems/stamping-the-sequence,"String, Stack, Greedy, Queue"
MEDIUM,Generate Parentheses,66.7,0.767505094919321,https://leetcode.com/problems/generate-parentheses,"String, Dynamic Programming, Backtracking"
MEDIUM,Group Anagrams,66.7,0.705668085276652,https://leetcode.com/problems/group-anagrams,"Array, Hash Table, String, Sorting"
