Difficulty,Title,Frequency,Acceptance Rate,Link,Topics
EASY,Distribute Candies,100.0,0.6902032441049034,https://leetcode.com/problems/distribute-candies,"Array, Hash Table"
MEDIUM,Shortest Unsorted Continuous Subarray,100.0,0.3723429907878255,https://leetcode.com/problems/shortest-unsorted-continuous-subarray,"Array, Two Pointers, Stack, Greedy, Sorting, Monotonic Stack"
EASY,Longest Harmonious Subsequence,100.0,0.5639449678480634,https://leetcode.com/problems/longest-harmonious-subsequence,"Array, Hash Table, Sliding Window, Sorting, Counting"
MEDIUM,Largest Time for Given Digits,100.0,0.3550252202062787,https://leetcode.com/problems/largest-time-for-given-digits,"Array, String, Enumeration"
MEDIUM,Longest Palindromic Substring,64.9,0.3518933655112113,https://leetcode.com/problems/longest-palindromic-substring,"Two Pointers, String, Dynamic Programming"
MEDIUM,Course Schedule,64.9,0.48346268824579075,https://leetcode.com/problems/course-schedule,"Depth-First Search, Breadth-First Search, Graph, Topological Sort"
