Difficulty,Title,Frequency,Acceptance Rate,Link,Topics
MEDIUM,Group Anagrams,100.0,0.7072404124842196,https://leetcode.com/problems/group-anagrams,"Array, Hash Table, String, Sorting"
EASY,Button with Longest Push Time,97.9,0.4047227503982732,https://leetcode.com/problems/button-with-longest-push-time,Array
EASY,Maximum Product of Two Elements in an Array,82.4,0.83176027108625,https://leetcode.com/problems/maximum-product-of-two-elements-in-an-array,"Array, Sorting, Heap (Priority Queue)"
MEDIUM,Rotate Image,82.4,0.7762106658950572,https://leetcode.com/problems/rotate-image,"Array, Math, Matrix"
MEDIUM,Rearrange Array to Maximize Prefix Score,77.5,0.41330862492884224,https://leetcode.com/problems/rearrange-array-to-maximize-prefix-score,"Array, Greedy, Sorting, Prefix Sum"
EASY,Find Resultant Array After Removing Anagrams,62.0,0.59324940104289,https://leetcode.com/problems/find-resultant-array-after-removing-anagrams,"Array, Hash Table, String, Sorting"
EASY,Count Binary Substrings,62.0,0.6586154872361561,https://leetcode.com/problems/count-binary-substrings,"Two Pointers, String"
MEDIUM,Merge Intervals,62.0,0.4919339547666934,https://leetcode.com/problems/merge-intervals,"Array, Sorting"
