Difficulty,Title,Frequency,Acceptance Rate,Link
MEDIUM,Find the Safest Path in a Grid,100.0,0.4858440066959941,https://leetcode.com/problems/find-the-safest-path-in-a-grid
MEDIUM,Count and Say,87.9,0.5746416268838086,https://leetcode.com/problems/count-and-say
MEDIUM,Best Time to Buy and Sell Stock II,87.9,0.6850421088399579,https://leetcode.com/problems/best-time-to-buy-and-sell-stock-ii
MEDIUM,LRU Cache,87.9,0.44062715294275534,https://leetcode.com/problems/lru-cache
MEDIUM,Minimizing Array After Replacing Pairs With Their Product,87.9,0.4076069730586371,https://leetcode.com/problems/minimizing-array-after-replacing-pairs-with-their-product
