Difficulty,Title,Frequency,Acceptance Rate,Link,Topics
MEDIUM,LRU Cache,100.0,0.44550537056427847,https://leetcode.com/problems/lru-cache,"Hash Table, Linked List, Design, Doubly-Linked List"
MEDIUM,Longest Substring Without Repeating Characters,98.9,0.36418531806113835,https://leetcode.com/problems/longest-substring-without-repeating-characters,"Hash Table, String, Sliding Window"
EASY,Best Time to Buy and Sell Stock,87.3,0.5482911310894257,https://leetcode.com/problems/best-time-to-buy-and-sell-stock,"Array, Dynamic Programming"
HARD,Max Stack,87.3,0.45311660507547763,https://leetcode.com/problems/max-stack,"Linked List, Stack, Design, Doubly-Linked List, Ordered Set"
EASY,Valid Parentheses,80.9,0.41916920911330846,https://leetcode.com/problems/valid-parentheses,"String, Stack"
HARD,Trapping Rain Water,78.4,0.6439795947297278,https://leetcode.com/problems/trapping-rain-water,"Array, Two Pointers, Dynamic Programming, Stack, Monotonic Stack"
MEDIUM,Group Anagrams,78.4,0.704376334215549,https://leetcode.com/problems/group-anagrams,"Array, Hash Table, String, Sorting"
MEDIUM,Sort Colors,75.5,0.6647649808738074,https://leetcode.com/problems/sort-colors,"Array, Two Pointers, Sorting"
MEDIUM,All Nodes Distance K in Binary Tree,72.3,0.6592856222040966,https://leetcode.com/problems/all-nodes-distance-k-in-binary-tree,"Hash Table, Tree, Depth-First Search, Breadth-First Search, Binary Tree"
MEDIUM,Word Break,72.3,0.4793525074593856,https://leetcode.com/problems/word-break,"Array, Hash Table, String, Dynamic Programming, Trie, Memoization"
MEDIUM,Longest Palindromic Substring,72.3,0.3537819385315634,https://leetcode.com/problems/longest-palindromic-substring,"Two Pointers, String, Dynamic Programming"
MEDIUM,Spiral Matrix,72.3,0.530963222783186,https://leetcode.com/problems/spiral-matrix,"Array, Matrix, Simulation"
MEDIUM,Number of Islands,68.6,0.6170171546896198,https://leetcode.com/problems/number-of-islands,"Array, Depth-First Search, Breadth-First Search, Union Find, Matrix"
MEDIUM,Kth Largest Element in an Array,68.6,0.6767053001287677,https://leetcode.com/problems/kth-largest-element-in-an-array,"Array, Divide and Conquer, Sorting, Heap (Priority Queue), Quickselect"
EASY,Move Zeroes,68.6,0.6257717383929489,https://leetcode.com/problems/move-zeroes,"Array, Two Pointers"
MEDIUM,Maximum Subarray,64.2,0.5179056397135898,https://leetcode.com/problems/maximum-subarray,"Array, Divide and Conquer, Dynamic Programming"
MEDIUM,Rotate Array,64.2,0.42538132016189745,https://leetcode.com/problems/rotate-array,"Array, Math, Two Pointers"
MEDIUM,Copy List with Random Pointer,64.2,0.5965903322874199,https://leetcode.com/problems/copy-list-with-random-pointer,"Hash Table, Linked List"
EASY,Degree of an Array,64.2,0.5716306372706867,https://leetcode.com/problems/degree-of-an-array,"Array, Hash Table"
MEDIUM,3Sum,64.2,0.3653140264345906,https://leetcode.com/problems/3sum,"Array, Two Pointers, Sorting"
MEDIUM,Top K Frequent Elements,64.2,0.6415069564858246,https://leetcode.com/problems/top-k-frequent-elements,"Array, Hash Table, Divide and Conquer, Sorting, Heap (Priority Queue), Bucket Sort, Counting, Quickselect"
MEDIUM,Valid Sudoku,64.2,0.6175409889778002,https://leetcode.com/problems/valid-sudoku,"Array, Hash Table, Matrix"
MEDIUM,Decode String,58.8,0.6074709578368355,https://leetcode.com/problems/decode-string,"String, Stack, Recursion"
MEDIUM,Maximal Square,58.8,0.48309899036106413,https://leetcode.com/problems/maximal-square,"Array, Dynamic Programming, Matrix"
MEDIUM,Daily Temperatures,58.8,0.6702608879453841,https://leetcode.com/problems/daily-temperatures,"Array, Stack, Monotonic Stack"
EASY,Squares of a Sorted Array,58.8,0.7311197311422063,https://leetcode.com/problems/squares-of-a-sorted-array,"Array, Two Pointers, Sorting"
MEDIUM,House Robber,58.8,0.5202373407717621,https://leetcode.com/problems/house-robber,"Array, Dynamic Programming"
MEDIUM,"Pow(x, n)",58.8,0.3656961351372228,https://leetcode.com/problems/powx-n,"Math, Recursion"
EASY,Two Sum,58.8,0.5518537701107812,https://leetcode.com/problems/two-sum,"Array, Hash Table"
MEDIUM,Combination Sum,58.8,0.740433135451763,https://leetcode.com/problems/combination-sum,"Array, Backtracking"
MEDIUM,Binary Tree Zigzag Level Order Traversal,58.8,0.6109623046592763,https://leetcode.com/problems/binary-tree-zigzag-level-order-traversal,"Tree, Breadth-First Search, Binary Tree"
MEDIUM,Word Search,58.8,0.4471707335983378,https://leetcode.com/problems/word-search,"Array, String, Backtracking, Depth-First Search, Matrix"
MEDIUM,Search in Rotated Sorted Array,58.8,0.42401127055845395,https://leetcode.com/problems/search-in-rotated-sorted-array,"Array, Binary Search"
HARD,First Missing Positive,58.8,0.4070577639191775,https://leetcode.com/problems/first-missing-positive,"Array, Hash Table"
MEDIUM,Merge Intervals,58.8,0.4888149763246631,https://leetcode.com/problems/merge-intervals,"Array, Sorting"
EASY,Add Binary,58.8,0.5526353945973553,https://leetcode.com/problems/add-binary,"Math, String, Bit Manipulation, Simulation"
MEDIUM,Search a 2D Matrix,58.8,0.5184874876539256,https://leetcode.com/problems/search-a-2d-matrix,"Array, Binary Search, Matrix"
HARD,Reverse Nodes in k-Group,58.8,0.6218919797816689,https://leetcode.com/problems/reverse-nodes-in-k-group,"Linked List, Recursion"
MEDIUM,Rotate Image,51.9,0.7727237679974308,https://leetcode.com/problems/rotate-image,"Array, Math, Matrix"
MEDIUM,Keys and Rooms,51.9,0.7431052032330612,https://leetcode.com/problems/keys-and-rooms,"Depth-First Search, Breadth-First Search, Graph"
HARD,Median of Two Sorted Arrays,51.9,0.4306423183545618,https://leetcode.com/problems/median-of-two-sorted-arrays,"Array, Binary Search, Divide and Conquer"
MEDIUM,Flatten Deeply Nested Array,51.9,0.6399488083971436,https://leetcode.com/problems/flatten-deeply-nested-array,
MEDIUM,Container With Most Water,51.9,0.5726806078040536,https://leetcode.com/problems/container-with-most-water,"Array, Two Pointers, Greedy"
MEDIUM,Longest Common Subsequence,51.9,0.5802384142390101,https://leetcode.com/problems/longest-common-subsequence,"String, Dynamic Programming"
MEDIUM,Course Schedule,51.9,0.48572031059634724,https://leetcode.com/problems/course-schedule,"Depth-First Search, Breadth-First Search, Graph, Topological Sort"
HARD,Wildcard Matching,51.9,0.29443164686624035,https://leetcode.com/problems/wildcard-matching,"String, Dynamic Programming, Greedy, Recursion"
EASY,Longest Common Prefix,51.9,0.4498042016754071,https://leetcode.com/problems/longest-common-prefix,"String, Trie"
MEDIUM,Max Consecutive Ones III,51.9,0.653458390974385,https://leetcode.com/problems/max-consecutive-ones-iii,"Array, Binary Search, Sliding Window, Prefix Sum"
MEDIUM,Longest Consecutive Sequence,51.9,0.4715772478027931,https://leetcode.com/problems/longest-consecutive-sequence,"Array, Hash Table, Union Find"
MEDIUM,Grumpy Bookstore Owner,51.9,0.6408186204206732,https://leetcode.com/problems/grumpy-bookstore-owner,"Array, Sliding Window"
MEDIUM,Flatten Nested List Iterator,51.9,0.6520611211974853,https://leetcode.com/problems/flatten-nested-list-iterator,"Stack, Tree, Depth-First Search, Design, Queue, Iterator"
MEDIUM,Minimum Add to Make Parentheses Valid,51.9,0.7468974302255513,https://leetcode.com/problems/minimum-add-to-make-parentheses-valid,"String, Stack, Greedy"
HARD,Minimum Window Substring,51.9,0.44765876972228,https://leetcode.com/problems/minimum-window-substring,"Hash Table, String, Sliding Window"
MEDIUM,Generate Parentheses,51.9,0.766192174448135,https://leetcode.com/problems/generate-parentheses,"String, Dynamic Programming, Backtracking"
MEDIUM,Koko Eating Bananas,51.9,0.489033960825752,https://leetcode.com/problems/koko-eating-bananas,"Array, Binary Search"
MEDIUM,Maximum Sum of Distinct Subarrays With Length K,51.9,0.42656841960411623,https://leetcode.com/problems/maximum-sum-of-distinct-subarrays-with-length-k,"Array, Hash Table, Sliding Window"
MEDIUM,Coin Change,51.9,0.45914429122897993,https://leetcode.com/problems/coin-change,"Array, Dynamic Programming, Breadth-First Search"
MEDIUM,Best Time to Buy and Sell Stock II,51.9,0.6895507277622167,https://leetcode.com/problems/best-time-to-buy-and-sell-stock-ii,"Array, Dynamic Programming, Greedy"
MEDIUM,Subarray Sum Equals K,51.9,0.4500240424840049,https://leetcode.com/problems/subarray-sum-equals-k,"Array, Hash Table, Prefix Sum"
MEDIUM,Interleaving String,51.9,0.4145221828820293,https://leetcode.com/problems/interleaving-string,"String, Dynamic Programming"
HARD,LFU Cache,51.9,0.45951061517099245,https://leetcode.com/problems/lfu-cache,"Hash Table, Linked List, Design, Doubly-Linked List"
MEDIUM,Partition Equal Subset Sum,51.9,0.4725331198905568,https://leetcode.com/problems/partition-equal-subset-sum,"Array, Dynamic Programming"
MEDIUM,Course Schedule II,51.9,0.5273974349270698,https://leetcode.com/problems/course-schedule-ii,"Depth-First Search, Breadth-First Search, Graph, Topological Sort"
MEDIUM,Jump Game II,51.9,0.4118345837889056,https://leetcode.com/problems/jump-game-ii,"Array, Dynamic Programming, Greedy"
MEDIUM,Maximum Profit From Trading Stocks,51.9,0.4636665159053219,https://leetcode.com/problems/maximum-profit-from-trading-stocks,"Array, Dynamic Programming"
MEDIUM,Add Two Numbers,42.3,0.4555577985947168,https://leetcode.com/problems/add-two-numbers,"Linked List, Math, Recursion"
MEDIUM,Fruit Into Baskets,42.3,0.4569826667560901,https://leetcode.com/problems/fruit-into-baskets,"Array, Hash Table, Sliding Window"
MEDIUM,Combination Sum II,42.3,0.572783235713998,https://leetcode.com/problems/combination-sum-ii,"Array, Backtracking"
EASY,Valid Palindrome II,42.3,0.42574206276173593,https://leetcode.com/problems/valid-palindrome-ii,"Two Pointers, String, Greedy"
MEDIUM,Boundary of Binary Tree,42.3,0.46851197821369306,https://leetcode.com/problems/boundary-of-binary-tree,"Tree, Depth-First Search, Binary Tree"
MEDIUM,Second Highest Salary,42.3,0.4309673866705973,https://leetcode.com/problems/second-highest-salary,Database
MEDIUM,Reorganize String,42.3,0.5584555443177639,https://leetcode.com/problems/reorganize-string,"Hash Table, String, Greedy, Sorting, Heap (Priority Queue), Counting"
HARD,Binary Tree Maximum Path Sum,42.3,0.40956598856051835,https://leetcode.com/problems/binary-tree-maximum-path-sum,"Dynamic Programming, Tree, Depth-First Search, Binary Tree"
MEDIUM,Perfect Squares,42.3,0.5547785809713115,https://leetcode.com/problems/perfect-squares,"Math, Dynamic Programming, Breadth-First Search"
MEDIUM,Count Number of Nice Subarrays,42.3,0.7248274052465277,https://leetcode.com/problems/count-number-of-nice-subarrays,"Array, Hash Table, Math, Sliding Window, Prefix Sum"
MEDIUM,Boats to Save People,42.3,0.5997957942978286,https://leetcode.com/problems/boats-to-save-people,"Array, Two Pointers, Greedy, Sorting"
EASY,Add Strings,42.3,0.5176585056079556,https://leetcode.com/problems/add-strings,"Math, String, Simulation"
MEDIUM,Removing Stars From a String,42.3,0.7749465322334249,https://leetcode.com/problems/removing-stars-from-a-string,"String, Stack, Simulation"
EASY,Palindrome Number,42.3,0.5874944425589971,https://leetcode.com/problems/palindrome-number,Math
MEDIUM,Populating Next Right Pointers in Each Node II,42.3,0.549668919179128,https://leetcode.com/problems/populating-next-right-pointers-in-each-node-ii,"Linked List, Tree, Depth-First Search, Breadth-First Search, Binary Tree"
MEDIUM,Path Sum II,42.3,0.6011374460693674,https://leetcode.com/problems/path-sum-ii,"Backtracking, Tree, Depth-First Search, Binary Tree"
MEDIUM,Min Stack,42.3,0.5599598043813224,https://leetcode.com/problems/min-stack,"Stack, Design"
MEDIUM,Palindrome Partitioning,42.3,0.7148050659850704,https://leetcode.com/problems/palindrome-partitioning,"String, Dynamic Programming, Backtracking"
MEDIUM,Decode Ways,42.3,0.36168087977293084,https://leetcode.com/problems/decode-ways,"String, Dynamic Programming"
EASY,Merge Sorted Array,42.3,0.5235337557075898,https://leetcode.com/problems/merge-sorted-array,"Array, Two Pointers, Sorting"
MEDIUM,Reverse Words in a String,42.3,0.5037801747941318,https://leetcode.com/problems/reverse-words-in-a-string,"Two Pointers, String"
HARD,Largest Rectangle in Histogram,42.3,0.46695318098673444,https://leetcode.com/problems/largest-rectangle-in-histogram,"Array, Stack, Monotonic Stack"
EASY,Valid Anagram,42.3,0.6622753947121321,https://leetcode.com/problems/valid-anagram,"Hash Table, String, Sorting"
EASY,Longest Palindrome,42.3,0.554670808902167,https://leetcode.com/problems/longest-palindrome,"Hash Table, String, Greedy"
EASY,Reverse Words in a String III,42.3,0.8353684535660209,https://leetcode.com/problems/reverse-words-in-a-string-iii,"Two Pointers, String"
HARD,Merge k Sorted Lists,42.3,0.5594070491603078,https://leetcode.com/problems/merge-k-sorted-lists,"Linked List, Divide and Conquer, Heap (Priority Queue), Merge Sort"
EASY,Merge Two Sorted Lists,42.3,0.663695069145828,https://leetcode.com/problems/merge-two-sorted-lists,"Linked List, Recursion"
MEDIUM,Break a Palindrome,42.3,0.5152600418255068,https://leetcode.com/problems/break-a-palindrome,"String, Greedy"
HARD,Maximum Profit in Job Scheduling,42.3,0.5433786486025639,https://leetcode.com/problems/maximum-profit-in-job-scheduling,"Array, Binary Search, Dynamic Programming, Sorting"
EASY,Merge Strings Alternately,42.3,0.8193922379171784,https://leetcode.com/problems/merge-strings-alternately,"Two Pointers, String"
MEDIUM,Populating Next Right Pointers in Each Node,42.3,0.6493783066151094,https://leetcode.com/problems/populating-next-right-pointers-in-each-node,"Linked List, Tree, Depth-First Search, Breadth-First Search, Binary Tree"
MEDIUM,Binary Tree Longest Consecutive Sequence,42.3,0.5401188992567924,https://leetcode.com/problems/binary-tree-longest-consecutive-sequence,"Tree, Depth-First Search, Binary Tree"
MEDIUM,Count Primes,42.3,0.34485674267026,https://leetcode.com/problems/count-primes,"Array, Math, Enumeration, Number Theory"
MEDIUM,Product of Array Except Self,42.3,0.6743169543845744,https://leetcode.com/problems/product-of-array-except-self,"Array, Prefix Sum"
HARD,Maximum Number of Non-overlapping Palindrome Substrings,42.3,0.4124740949777327,https://leetcode.com/problems/maximum-number-of-non-overlapping-palindrome-substrings,"Two Pointers, String, Dynamic Programming, Greedy"
