Difficulty,Title,Frequency,Acceptance Rate,Link,Topics
MEDIUM,Maximum Area Rectangle With Point Constraints I,100.0,0.49693704332423055,https://leetcode.com/problems/maximum-area-rectangle-with-point-constraints-i,"Array, Math, Binary Indexed Tree, Segment Tree, Geometry, Sorting, Enumeration"
HARD,Maximum Area Rectangle With Point Constraints II,100.0,0.20597264861847614,https://leetcode.com/problems/maximum-area-rectangle-with-point-constraints-ii,"Array, Math, Binary Indexed Tree, Segment Tree, Geometry, Sorting"
HARD,Special Binary String,84.2,0.6351450158420667,https://leetcode.com/problems/special-binary-string,"String, Recursion"
MEDIUM,Minimum Length of Anagram Concatenation,79.1,0.3972463749502319,https://leetcode.com/problems/minimum-length-of-anagram-concatenation,"Hash Table, String, Counting"
MEDIUM,Count the Number of Good Subsequences,79.1,0.5057235104197241,https://leetcode.com/problems/count-the-number-of-good-subsequences,"Hash Table, Math, String, Combinatorics, Counting"
MEDIUM,Longest Consecutive Sequence,72.5,0.4703938693880114,https://leetcode.com/problems/longest-consecutive-sequence,"Array, Hash Table, Union Find"
EASY,Two Sum,72.5,0.5578041456499886,https://leetcode.com/problems/two-sum,"Array, Hash Table"
EASY,Valid Word,72.5,0.38720022411772076,https://leetcode.com/problems/valid-word,String
EASY,Best Time to Buy and Sell Stock,63.3,0.5526331434030223,https://leetcode.com/problems/best-time-to-buy-and-sell-stock,"Array, Dynamic Programming"
MEDIUM,Angle Between Hands of a Clock,63.3,0.6421431484309058,https://leetcode.com/problems/angle-between-hands-of-a-clock,Math
MEDIUM,Make a Positive Array,63.3,0.3808630393996248,https://leetcode.com/problems/make-a-positive-array,"Array, Greedy, Prefix Sum"
