Difficulty,Title,Frequency,Acceptance Rate,Link,Topics
EASY,Two Sum,100.0,0.557769945892896,https://leetcode.com/problems/two-sum,"Array, Hash Table"
MEDIUM,Longest Substring Without Repeating Characters,96.3,0.3693616884072647,https://leetcode.com/problems/longest-substring-without-repeating-characters,"Hash Table, String, Sliding Window"
MEDIUM,Container With Most Water,86.9,0.5778282574410597,https://leetcode.com/problems/container-with-most-water,"Array, Two Pointers, Greedy"
MEDIUM,Decode String,86.9,0.6115249906697672,https://leetcode.com/problems/decode-string,"String, Stack, Recursion"
EASY,Valid Anagram,86.9,0.6666089667345674,https://leetcode.com/problems/valid-anagram,"Hash Table, String, Sorting"
EASY,Contains Duplicate,80.7,0.6323636777340309,https://leetcode.com/problems/contains-duplicate,"Array, Hash Table, Sorting"
MEDIUM,Flatten a Multilevel Doubly Linked List,80.7,0.6131216910613428,https://leetcode.com/problems/flatten-a-multilevel-doubly-linked-list,"Linked List, Depth-First Search, Doubly-Linked List"
MEDIUM,Word Search,72.7,0.45266926269047814,https://leetcode.com/problems/word-search,"Array, String, Backtracking, Depth-First Search, Matrix"
MEDIUM,Rotate Image,72.7,0.7790164518819447,https://leetcode.com/problems/rotate-image,"Array, Math, Matrix"
EASY,Valid Parentheses,72.7,0.42322820646682113,https://leetcode.com/problems/valid-parentheses,"String, Stack"
EASY,Longest Common Prefix,72.7,0.4548305595040032,https://leetcode.com/problems/longest-common-prefix,"String, Trie"
HARD,Trapping Rain Water,72.7,0.6510193676088248,https://leetcode.com/problems/trapping-rain-water,"Array, Two Pointers, Dynamic Programming, Stack, Monotonic Stack"
MEDIUM,Subsets,72.7,0.808795565390318,https://leetcode.com/problems/subsets,"Array, Backtracking, Bit Manipulation"
MEDIUM,Merge Intervals,61.5,0.4939526774846352,https://leetcode.com/problems/merge-intervals,"Array, Sorting"
MEDIUM,Divide Array Into Arrays With Max Difference,61.5,0.785050854640486,https://leetcode.com/problems/divide-array-into-arrays-with-max-difference,"Array, Greedy, Sorting"
EASY,Generate Tag for Video Caption,61.5,0.31350555752931025,https://leetcode.com/problems/generate-tag-for-video-caption,"String, Simulation"
EASY,Maximum Difference Between Increasing Elements,61.5,0.6610053682139234,https://leetcode.com/problems/maximum-difference-between-increasing-elements,Array
MEDIUM,4Sum,61.5,0.38219020113793045,https://leetcode.com/problems/4sum,"Array, Two Pointers, Sorting"
EASY,Fibonacci Number,61.5,0.7294495015845286,https://leetcode.com/problems/fibonacci-number,"Math, Dynamic Programming, Recursion, Memoization"
MEDIUM,Longest Palindromic Substring,61.5,0.35846111456358737,https://leetcode.com/problems/longest-palindromic-substring,"Two Pointers, String, Dynamic Programming"
EASY,Max Consecutive Ones,61.5,0.6248232110227296,https://leetcode.com/problems/max-consecutive-ones,Array
HARD,Maximum Difference Between Even and Odd Frequency II,61.5,0.4928720842342105,https://leetcode.com/problems/maximum-difference-between-even-and-odd-frequency-ii,"String, Sliding Window, Enumeration, Prefix Sum"
MEDIUM,Invalid Transactions,61.5,0.3127080304862309,https://leetcode.com/problems/invalid-transactions,"Array, Hash Table, String, Sorting"
MEDIUM,Insert Delete GetRandom O(1),61.5,0.549918579117808,https://leetcode.com/problems/insert-delete-getrandom-o1,"Array, Hash Table, Math, Design, Randomized"
EASY,Add Binary,61.5,0.5567701348180015,https://leetcode.com/problems/add-binary,"Math, String, Bit Manipulation, Simulation"
EASY,Students and Examinations,61.5,0.604974385676898,https://leetcode.com/problems/students-and-examinations,Database
MEDIUM,Palindrome Partitioning,61.5,0.7212808256354587,https://leetcode.com/problems/palindrome-partitioning,"String, Dynamic Programming, Backtracking"
EASY,Best Time to Buy and Sell Stock,61.5,0.5525965868759138,https://leetcode.com/problems/best-time-to-buy-and-sell-stock,"Array, Dynamic Programming"
MEDIUM,Search a 2D Matrix,61.5,0.5228957258337302,https://leetcode.com/problems/search-a-2d-matrix,"Array, Binary Search, Matrix"
EASY,Merge Sorted Array,61.5,0.5291951450619177,https://leetcode.com/problems/merge-sorted-array,"Array, Two Pointers, Sorting"
MEDIUM,Generate Parentheses,61.5,0.7713286717803378,https://leetcode.com/problems/generate-parentheses,"String, Dynamic Programming, Backtracking"
MEDIUM,Product of Array Except Self,61.5,0.6777994606301018,https://leetcode.com/problems/product-of-array-except-self,"Array, Prefix Sum"
MEDIUM,Max Area of Island,61.5,0.7316416136206765,https://leetcode.com/problems/max-area-of-island,"Array, Depth-First Search, Breadth-First Search, Union Find, Matrix"
