Difficulty,Title,Frequency,Acceptance Rate,Link,Topics
MEDIUM,Merge Intervals,100.0,0.4888144736176791,https://leetcode.com/problems/merge-intervals,"Array, Sorting"
MEDIUM,Binary Tree Vertical Order Traversal,98.1,0.5668076600725638,https://leetcode.com/problems/binary-tree-vertical-order-traversal,"Hash Table, Tree, Depth-First Search, Breadth-First Search, Sorting, Binary Tree"
MEDIUM,Sort Integers by The Power Value,96.1,0.7066042862254973,https://leetcode.com/problems/sort-integers-by-the-power-value,"Dynamic Programming, Memoization, Sorting"
EASY,Two Sum,91.5,0.551853625556745,https://leetcode.com/problems/two-sum,"Array, Hash Table"
MEDIUM,Number of Islands,82.5,0.6170169122196616,https://leetcode.com/problems/number-of-islands,"Array, Depth-First Search, Breadth-First Search, Union Find, Matrix"
HARD,Trapping Rain Water,78.6,0.6439790814924163,https://leetcode.com/problems/trapping-rain-water,"Array, Two Pointers, Dynamic Programming, Stack, Monotonic Stack"
MEDIUM,Evaluate Division,78.6,0.6279811240187008,https://leetcode.com/problems/evaluate-division,"Array, String, Depth-First Search, Breadth-First Search, Union Find, Graph, Shortest Path"
MEDIUM,Binary Tree Level Order Traversal,74.1,0.6993448297175351,https://leetcode.com/problems/binary-tree-level-order-traversal,"Tree, Breadth-First Search, Binary Tree"
HARD,Word Break II,74.1,0.5303694495412177,https://leetcode.com/problems/word-break-ii,"Array, Hash Table, String, Dynamic Programming, Backtracking, Trie, Memoization"
MEDIUM,Lexicographical Numbers,74.1,0.7300684946664896,https://leetcode.com/problems/lexicographical-numbers,"Depth-First Search, Trie"
EASY,Contains Duplicate,68.4,0.6287397125931667,https://leetcode.com/problems/contains-duplicate,"Array, Hash Table, Sorting"
MEDIUM,Design A Leaderboard,68.4,0.678650321231641,https://leetcode.com/problems/design-a-leaderboard,"Hash Table, Design, Sorting"
MEDIUM,Subsets,61.2,0.8034781344062147,https://leetcode.com/problems/subsets,"Array, Backtracking, Bit Manipulation"
EASY,Roman to Integer,61.2,0.6427277077750511,https://leetcode.com/problems/roman-to-integer,"Hash Table, Math, String"
EASY,Climbing Stairs,61.2,0.5336999973156737,https://leetcode.com/problems/climbing-stairs,"Math, Dynamic Programming, Memoization"
MEDIUM,Dot Product of Two Sparse Vectors,61.2,0.8991611492800753,https://leetcode.com/problems/dot-product-of-two-sparse-vectors,"Array, Hash Table, Two Pointers, Design"
MEDIUM,Search in Rotated Sorted Array,61.2,0.42401122894108895,https://leetcode.com/problems/search-in-rotated-sorted-array,"Array, Binary Search"
MEDIUM,Coin Change,61.2,0.45914357014426577,https://leetcode.com/problems/coin-change,"Array, Dynamic Programming, Breadth-First Search"
EASY,Valid Anagram,61.2,0.6622752371389469,https://leetcode.com/problems/valid-anagram,"Hash Table, String, Sorting"
EASY,Merge Strings Alternately,61.2,0.8193906704760887,https://leetcode.com/problems/merge-strings-alternately,"Two Pointers, String"
MEDIUM,Two City Scheduling,61.2,0.6748485814472426,https://leetcode.com/problems/two-city-scheduling,"Array, Greedy, Sorting"
MEDIUM,Populating Next Right Pointers in Each Node,61.2,0.6493781128212724,https://leetcode.com/problems/populating-next-right-pointers-in-each-node,"Linked List, Tree, Depth-First Search, Breadth-First Search, Binary Tree"
EASY,Remove Letter To Equalize Frequency,61.2,0.179755488917315,https://leetcode.com/problems/remove-letter-to-equalize-frequency,"Hash Table, String, Counting"
MEDIUM,All Paths From Source to Target,61.2,0.829526810154665,https://leetcode.com/problems/all-paths-from-source-to-target,"Backtracking, Depth-First Search, Breadth-First Search, Graph"
EASY,Best Time to Buy and Sell Stock,61.2,0.5482912096487975,https://leetcode.com/problems/best-time-to-buy-and-sell-stock,"Array, Dynamic Programming"
EASY,Merge Sorted Array,61.2,0.5235336864737608,https://leetcode.com/problems/merge-sorted-array,"Array, Two Pointers, Sorting"
MEDIUM,Subsets II,51.1,0.5898183901272354,https://leetcode.com/problems/subsets-ii,"Array, Backtracking, Bit Manipulation"
MEDIUM,LRU Cache,51.1,0.44550532222749,https://leetcode.com/problems/lru-cache,"Hash Table, Linked List, Design, Doubly-Linked List"
MEDIUM,Number of Substrings Containing All Three Characters,51.1,0.7301136092869873,https://leetcode.com/problems/number-of-substrings-containing-all-three-characters,"Hash Table, String, Sliding Window"
EASY,Valid Parentheses,51.1,0.41916931604736374,https://leetcode.com/problems/valid-parentheses,"String, Stack"
MEDIUM,Longest Substring Without Repeating Characters,51.1,0.3641852493058167,https://leetcode.com/problems/longest-substring-without-repeating-characters,"Hash Table, String, Sliding Window"
MEDIUM,House Robber IV,51.1,0.6521053512699073,https://leetcode.com/problems/house-robber-iv,"Array, Binary Search"
MEDIUM,Insert Delete GetRandom O(1),51.1,0.5493279533459056,https://leetcode.com/problems/insert-delete-getrandom-o1,"Array, Hash Table, Math, Design, Randomized"
MEDIUM,Longest Palindromic Substring,51.1,0.3537820238782848,https://leetcode.com/problems/longest-palindromic-substring,"Two Pointers, String, Dynamic Programming"
MEDIUM,Gas Station,51.1,0.4601297695693313,https://leetcode.com/problems/gas-station,"Array, Greedy"
MEDIUM,Count Unhappy Friends,51.1,0.6190758762560329,https://leetcode.com/problems/count-unhappy-friends,"Array, Simulation"
MEDIUM,3Sum,51.1,0.36531419221232875,https://leetcode.com/problems/3sum,"Array, Two Pointers, Sorting"
MEDIUM,Find Peak Element,51.1,0.46365528902764686,https://leetcode.com/problems/find-peak-element,"Array, Binary Search"
MEDIUM,Immediate Food Delivery II,51.1,0.5382206301520494,https://leetcode.com/problems/immediate-food-delivery-ii,Database
MEDIUM,Closest Prime Numbers in Range,51.1,0.5156055263960307,https://leetcode.com/problems/closest-prime-numbers-in-range,"Math, Number Theory"
MEDIUM,Set Matrix Zeroes,51.1,0.590601431549811,https://leetcode.com/problems/set-matrix-zeroes,"Array, Hash Table, Matrix"
MEDIUM,Remove K Digits,51.1,0.3450085624940959,https://leetcode.com/problems/remove-k-digits,"String, Stack, Greedy, Monotonic Stack"
EASY,Create Hello World Function,51.1,0.819848442964052,https://leetcode.com/problems/create-hello-world-function,
MEDIUM,Word Search,51.1,0.4471708096848039,https://leetcode.com/problems/word-search,"Array, String, Backtracking, Depth-First Search, Matrix"
MEDIUM,Construct Binary Tree from Preorder and Inorder Traversal,51.1,0.6623369052797534,https://leetcode.com/problems/construct-binary-tree-from-preorder-and-inorder-traversal,"Array, Hash Table, Divide and Conquer, Tree, Binary Tree"
MEDIUM,Check if Number is a Sum of Powers of Three,51.1,0.7925436564684083,https://leetcode.com/problems/check-if-number-is-a-sum-of-powers-of-three,Math
MEDIUM,Last Person to Fit in the Bus,51.1,0.6820553628211701,https://leetcode.com/problems/last-person-to-fit-in-the-bus,Database
EASY,Longest Common Prefix,51.1,0.44980364768569925,https://leetcode.com/problems/longest-common-prefix,"String, Trie"
MEDIUM,Partition Array According to Given Pivot,51.1,0.8996775981948324,https://leetcode.com/problems/partition-array-according-to-given-pivot,"Array, Two Pointers, Simulation"
EASY,Binary Search,51.1,0.5920634548463551,https://leetcode.com/problems/binary-search,"Array, Binary Search"
MEDIUM,Subarray Sum Equals K,51.1,0.45002435441807587,https://leetcode.com/problems/subarray-sum-equals-k,"Array, Hash Table, Prefix Sum"
HARD,Number of Ships in a Rectangle,51.1,0.6875444998220007,https://leetcode.com/problems/number-of-ships-in-a-rectangle,"Array, Divide and Conquer, Interactive"
MEDIUM,Odd Even Linked List,51.1,0.6184000165332437,https://leetcode.com/problems/odd-even-linked-list,Linked List
MEDIUM,Add Two Numbers,51.1,0.455557380883182,https://leetcode.com/problems/add-two-numbers,"Linked List, Math, Recursion"
MEDIUM,Letter Combinations of a Phone Number,51.1,0.6319914670431571,https://leetcode.com/problems/letter-combinations-of-a-phone-number,"Hash Table, String, Backtracking"
MEDIUM,Swap Nodes in Pairs,51.1,0.6661039426780071,https://leetcode.com/problems/swap-nodes-in-pairs,"Linked List, Recursion"
MEDIUM,Reorder List,51.1,0.6170737466357971,https://leetcode.com/problems/reorder-list,"Linked List, Two Pointers, Stack, Recursion"
