Difficulty,Title,Frequency,Acceptance Rate,Link,Topics
EASY,Two Sum,100.0,0.553384615623045,https://leetcode.com/problems/two-sum,"Array, Hash Table"
MEDIUM,Merge Intervals,98.0,0.4902747949359224,https://leetcode.com/problems/merge-intervals,"Array, Sorting"
MEDIUM,Number of Islands,93.4,0.618624259821997,https://leetcode.com/problems/number-of-islands,"Array, Depth-First Search, Breadth-First Search, Union Find, Matrix"
MEDIUM,Binary Tree Vertical Order Traversal,89.3,0.5682113231270036,https://leetcode.com/problems/binary-tree-vertical-order-traversal,"Hash Table, Tree, Depth-First Search, Breadth-First Search, Sorting, Binary Tree"
MEDIUM,Sort Integers by The Power Value,87.8,0.706359457882279,https://leetcode.com/problems/sort-integers-by-the-power-value,"Dynamic Programming, Memoization, Sorting"
MEDIUM,Insert Delete GetRandom O(1),87.8,0.5496803983720336,https://leetcode.com/problems/insert-delete-getrandom-o1,"Array, Hash Table, Math, Design, Randomized"
MEDIUM,Word Search,86.2,0.4483875789716796,https://leetcode.com/problems/word-search,"Array, String, Backtracking, Depth-First Search, Matrix"
MEDIUM,Flatten a Multilevel Doubly Linked List,86.2,0.6106854915588065,https://leetcode.com/problems/flatten-a-multilevel-doubly-linked-list,"Linked List, Depth-First Search, Doubly-Linked List"
MEDIUM,Add Two Numbers,80.6,0.4571982632957345,https://leetcode.com/problems/add-two-numbers,"Linked List, Math, Recursion"
EASY,Valid Parentheses,78.4,0.4202351054356486,https://leetcode.com/problems/valid-parentheses,"String, Stack"
MEDIUM,Longest Substring Without Repeating Characters,78.4,0.3654380606579033,https://leetcode.com/problems/longest-substring-without-repeating-characters,"Hash Table, String, Sliding Window"
EASY,Best Time to Buy and Sell Stock,76.0,0.5492506812049801,https://leetcode.com/problems/best-time-to-buy-and-sell-stock,"Array, Dynamic Programming"
HARD,Trapping Rain Water,76.0,0.6456470795758559,https://leetcode.com/problems/trapping-rain-water,"Array, Two Pointers, Dynamic Programming, Stack, Monotonic Stack"
MEDIUM,LRU Cache,76.0,0.4471760822101147,https://leetcode.com/problems/lru-cache,"Hash Table, Linked List, Design, Doubly-Linked List"
MEDIUM,Invalid Transactions,73.4,0.3120857997404634,https://leetcode.com/problems/invalid-transactions,"Array, Hash Table, String, Sorting"
EASY,Longest Common Prefix,73.4,0.45102000025165073,https://leetcode.com/problems/longest-common-prefix,"String, Trie"
EASY,Valid Anagram,70.4,0.663301802820543,https://leetcode.com/problems/valid-anagram,"Hash Table, String, Sorting"
EASY,Create Hello World Function,70.4,0.8205600043383163,https://leetcode.com/problems/create-hello-world-function,
MEDIUM,Design A Leaderboard,70.4,0.6788620256010927,https://leetcode.com/problems/design-a-leaderboard,"Hash Table, Design, Sorting"
HARD,Median of Two Sorted Arrays,70.4,0.4323424112955606,https://leetcode.com/problems/median-of-two-sorted-arrays,"Array, Binary Search, Divide and Conquer"
MEDIUM,Binary Tree Level Order Traversal,70.4,0.7009535961421658,https://leetcode.com/problems/binary-tree-level-order-traversal,"Tree, Breadth-First Search, Binary Tree"
EASY,Merge Sorted Array,70.4,0.5249698827066709,https://leetcode.com/problems/merge-sorted-array,"Array, Two Pointers, Sorting"
MEDIUM,Meeting Rooms II,67.1,0.5200579926786013,https://leetcode.com/problems/meeting-rooms-ii,"Array, Two Pointers, Greedy, Sorting, Heap (Priority Queue), Prefix Sum"
EASY,Merge Two Sorted Lists,67.1,0.664896604710378,https://leetcode.com/problems/merge-two-sorted-lists,"Linked List, Recursion"
EASY,Roman to Integer,67.1,0.6441534488406969,https://leetcode.com/problems/roman-to-integer,"Hash Table, Math, String"
MEDIUM,Min Stack,67.1,0.5611001972960041,https://leetcode.com/problems/min-stack,"Stack, Design"
EASY,Merge Strings Alternately,67.1,0.820562495012733,https://leetcode.com/problems/merge-strings-alternately,"Two Pointers, String"
MEDIUM,All Paths From Source to Target,67.1,0.8299341606069086,https://leetcode.com/problems/all-paths-from-source-to-target,"Backtracking, Depth-First Search, Breadth-First Search, Graph"
EASY,Contains Duplicate,63.2,0.6295530998414546,https://leetcode.com/problems/contains-duplicate,"Array, Hash Table, Sorting"
MEDIUM,Two City Scheduling,63.2,0.6751855749558948,https://leetcode.com/problems/two-city-scheduling,"Array, Greedy, Sorting"
MEDIUM,Next Permutation,63.2,0.42586480570303253,https://leetcode.com/problems/next-permutation,"Array, Two Pointers"
MEDIUM,Longest Palindromic Substring,63.2,0.3549093887056216,https://leetcode.com/problems/longest-palindromic-substring,"Two Pointers, String, Dynamic Programming"
MEDIUM,Reverse Integer,63.2,0.30006854279298323,https://leetcode.com/problems/reverse-integer,Math
MEDIUM,Populating Next Right Pointers in Each Node,63.2,0.6506488179867894,https://leetcode.com/problems/populating-next-right-pointers-in-each-node,"Linked List, Tree, Depth-First Search, Breadth-First Search, Binary Tree"
MEDIUM,Subarray Sum Equals K,63.2,0.4511789169861394,https://leetcode.com/problems/subarray-sum-equals-k,"Array, Hash Table, Prefix Sum"
MEDIUM,Longest Consecutive Sequence,63.2,0.47126700126801374,https://leetcode.com/problems/longest-consecutive-sequence,"Array, Hash Table, Union Find"
HARD,Word Break II,63.2,0.5318035838147775,https://leetcode.com/problems/word-break-ii,"Array, Hash Table, String, Dynamic Programming, Backtracking, Trie, Memoization"
MEDIUM,3Sum,63.2,0.3666539783136173,https://leetcode.com/problems/3sum,"Array, Two Pointers, Sorting"
MEDIUM,Subsets,63.2,0.8047232985560582,https://leetcode.com/problems/subsets,"Array, Backtracking, Bit Manipulation"
MEDIUM,Coin Change,58.7,0.46046349941115894,https://leetcode.com/problems/coin-change,"Array, Dynamic Programming, Breadth-First Search"
EASY,Reverse Linked List,58.7,0.7884951538099737,https://leetcode.com/problems/reverse-linked-list,"Linked List, Recursion"
HARD,Number of Ships in a Rectangle,58.7,0.6878243512974052,https://leetcode.com/problems/number-of-ships-in-a-rectangle,"Array, Divide and Conquer, Interactive"
EASY,Remove Letter To Equalize Frequency,58.7,0.1804025185518327,https://leetcode.com/problems/remove-letter-to-equalize-frequency,"Hash Table, String, Counting"
MEDIUM,Single Element in a Sorted Array,58.7,0.5917990723578391,https://leetcode.com/problems/single-element-in-a-sorted-array,"Array, Binary Search"
MEDIUM,Product of Array Except Self,58.7,0.6750768535626972,https://leetcode.com/problems/product-of-array-except-self,"Array, Prefix Sum"
HARD,Reverse Nodes in k-Group,58.7,0.624016354891895,https://leetcode.com/problems/reverse-nodes-in-k-group,"Linked List, Recursion"
EASY,Valid Palindrome,58.7,0.5045354894332628,https://leetcode.com/problems/valid-palindrome,"Two Pointers, String"
MEDIUM,Find First and Last Position of Element in Sorted Array,58.7,0.4638606950794118,https://leetcode.com/problems/find-first-and-last-position-of-element-in-sorted-array,"Array, Binary Search"
EASY,Palindrome Number,58.7,0.5886327138034815,https://leetcode.com/problems/palindrome-number,Math
MEDIUM,Generate Parentheses,58.7,0.7675031663032121,https://leetcode.com/problems/generate-parentheses,"String, Dynamic Programming, Backtracking"
MEDIUM,Valid Triangle Number,53.1,0.5205073303146244,https://leetcode.com/problems/valid-triangle-number,"Array, Two Pointers, Binary Search, Greedy, Sorting"
MEDIUM,Decode String,53.1,0.608408150928499,https://leetcode.com/problems/decode-string,"String, Stack, Recursion"
MEDIUM,Count Unhappy Friends,53.1,0.6189412202818447,https://leetcode.com/problems/count-unhappy-friends,"Array, Simulation"
MEDIUM,Rotate Image,53.1,0.774271621623038,https://leetcode.com/problems/rotate-image,"Array, Math, Matrix"
MEDIUM,Design Underground System,53.1,0.7484736596397412,https://leetcode.com/problems/design-underground-system,"Hash Table, String, Design"
EASY,Single Number,53.1,0.7556537798274754,https://leetcode.com/problems/single-number,"Array, Bit Manipulation"
MEDIUM,Sort Characters By Frequency,53.1,0.7378842102020955,https://leetcode.com/problems/sort-characters-by-frequency,"Hash Table, String, Sorting, Heap (Priority Queue), Bucket Sort, Counting"
MEDIUM,4Sum,53.1,0.37806981926947164,https://leetcode.com/problems/4sum,"Array, Two Pointers, Sorting"
HARD,Word Ladder,53.1,0.4218679833288319,https://leetcode.com/problems/word-ladder,"Hash Table, String, Breadth-First Search"
MEDIUM,Search in Rotated Sorted Array,53.1,0.42507730462617244,https://leetcode.com/problems/search-in-rotated-sorted-array,"Array, Binary Search"
EASY,Recyclable and Low Fat Products,53.1,0.8934344473187827,https://leetcode.com/problems/recyclable-and-low-fat-products,Database
EASY,Majority Element,53.1,0.6557187169716062,https://leetcode.com/problems/majority-element,"Array, Hash Table, Divide and Conquer, Sorting, Counting"
EASY,Climbing Stairs,53.1,0.5341032596101638,https://leetcode.com/problems/climbing-stairs,"Math, Dynamic Programming, Memoization"
MEDIUM,Daily Temperatures,46.0,0.671009291056389,https://leetcode.com/problems/daily-temperatures,"Array, Stack, Monotonic Stack"
MEDIUM,Rotate List,46.0,0.39598067770891743,https://leetcode.com/problems/rotate-list,"Linked List, Two Pointers"
EASY,Reverse Vowels of a String,46.0,0.5745450093739725,https://leetcode.com/problems/reverse-vowels-of-a-string,"Two Pointers, String"
EASY,Remove Duplicates from Sorted Array,46.0,0.5980689442218224,https://leetcode.com/problems/remove-duplicates-from-sorted-array,"Array, Two Pointers"
EASY,Remove Element,46.0,0.596806642338894,https://leetcode.com/problems/remove-element,"Array, Two Pointers"
MEDIUM,Sort Colors,46.0,0.6663760007193134,https://leetcode.com/problems/sort-colors,"Array, Two Pointers, Sorting"
MEDIUM,Best Time to Buy and Sell Stock II,46.0,0.6909030034699688,https://leetcode.com/problems/best-time-to-buy-and-sell-stock-ii,"Array, Dynamic Programming, Greedy"
MEDIUM,Letter Combinations of a Phone Number,46.0,0.6336664167028658,https://leetcode.com/problems/letter-combinations-of-a-phone-number,"Hash Table, String, Backtracking"
MEDIUM,Find Peak Element,46.0,0.463984796879412,https://leetcode.com/problems/find-peak-element,"Array, Binary Search"
MEDIUM,Remove Duplicate Letters,46.0,0.5098747493217742,https://leetcode.com/problems/remove-duplicate-letters,"String, Stack, Greedy, Monotonic Stack"
MEDIUM,Copy List with Random Pointer,46.0,0.5987535446409938,https://leetcode.com/problems/copy-list-with-random-pointer,"Hash Table, Linked List"
MEDIUM,String to Integer (atoi),46.0,0.18892261488660864,https://leetcode.com/problems/string-to-integer-atoi,String
MEDIUM,Minimum Number of Steps to Make Two Strings Anagram,46.0,0.8210564197318666,https://leetcode.com/problems/minimum-number-of-steps-to-make-two-strings-anagram,"Hash Table, String, Counting"
MEDIUM,Frequency of the Most Frequent Element,46.0,0.44007267169022024,https://leetcode.com/problems/frequency-of-the-most-frequent-element,"Array, Binary Search, Greedy, Sliding Window, Sorting, Prefix Sum"
MEDIUM,Validate Binary Search Tree,46.0,0.34117854468542214,https://leetcode.com/problems/validate-binary-search-tree,"Tree, Depth-First Search, Binary Search Tree, Binary Tree"
EASY,Number of Recent Calls,46.0,0.7729378405582203,https://leetcode.com/problems/number-of-recent-calls,"Design, Queue, Data Stream"
MEDIUM,Combination Sum,46.0,0.7418789582483578,https://leetcode.com/problems/combination-sum,"Array, Backtracking"
MEDIUM,Design Browser History,46.0,0.7799763448034386,https://leetcode.com/problems/design-browser-history,"Array, Linked List, Stack, Design, Doubly-Linked List, Data Stream"
MEDIUM,Remove All Adjacent Duplicates in String II,46.0,0.592798500014725,https://leetcode.com/problems/remove-all-adjacent-duplicates-in-string-ii,"String, Stack"
MEDIUM,Valid Sudoku,36.3,0.6189169278353688,https://leetcode.com/problems/valid-sudoku,"Array, Hash Table, Matrix"
EASY,Merge Two Binary Trees,36.3,0.7923521891308448,https://leetcode.com/problems/merge-two-binary-trees,"Tree, Depth-First Search, Breadth-First Search, Binary Tree"
MEDIUM,Container With Most Water,36.3,0.5740096496314211,https://leetcode.com/problems/container-with-most-water,"Array, Two Pointers, Greedy"
HARD,Vertical Order Traversal of a Binary Tree,36.3,0.5069535562037245,https://leetcode.com/problems/vertical-order-traversal-of-a-binary-tree,"Hash Table, Tree, Depth-First Search, Breadth-First Search, Sorting, Binary Tree"
MEDIUM,Koko Eating Bananas,36.3,0.4895475122919223,https://leetcode.com/problems/koko-eating-bananas,"Array, Binary Search"
EASY,Check if Array Is Sorted and Rotated,36.3,0.5496637853657065,https://leetcode.com/problems/check-if-array-is-sorted-and-rotated,Array
MEDIUM,Maximum Subarray,36.3,0.5186402779272055,https://leetcode.com/problems/maximum-subarray,"Array, Divide and Conquer, Dynamic Programming"
EASY,Same Tree,36.3,0.6464973325712109,https://leetcode.com/problems/same-tree,"Tree, Depth-First Search, Breadth-First Search, Binary Tree"
MEDIUM,Redundant Connection,36.3,0.6616218124676772,https://leetcode.com/problems/redundant-connection,"Depth-First Search, Breadth-First Search, Union Find, Graph"
HARD,Regular Expression Matching,36.3,0.29066293263091536,https://leetcode.com/problems/regular-expression-matching,"String, Dynamic Programming, Recursion"
MEDIUM,Repeated DNA Sequences,36.3,0.5092861214777477,https://leetcode.com/problems/repeated-dna-sequences,"Hash Table, String, Bit Manipulation, Sliding Window, Rolling Hash, Hash Function"
EASY,First Unique Character in a String,36.3,0.6339017375426109,https://leetcode.com/problems/first-unique-character-in-a-string,"Hash Table, String, Queue, Counting"
MEDIUM,House Robber,36.3,0.5209523063518645,https://leetcode.com/problems/house-robber,"Array, Dynamic Programming"
MEDIUM,"Pow(x, n)",36.3,0.36694831428130326,https://leetcode.com/problems/powx-n,"Math, Recursion"
EASY,Pascal's Triangle,36.3,0.7663212878280913,https://leetcode.com/problems/pascals-triangle,"Array, Dynamic Programming"
MEDIUM,Binary Tree Zigzag Level Order Traversal,36.3,0.6124387237958213,https://leetcode.com/problems/binary-tree-zigzag-level-order-traversal,"Tree, Breadth-First Search, Binary Tree"
EASY,Design an Ordered Stream,36.3,0.8446012386357755,https://leetcode.com/problems/design-an-ordered-stream,"Array, Hash Table, Design, Data Stream"
MEDIUM,H-Index,36.3,0.4004029265556416,https://leetcode.com/problems/h-index,"Array, Sorting, Counting Sort"
