Difficulty,Title,Frequency,Acceptance Rate,Link,Topics
MEDIUM,Number of Islands,100.0,0.6206899691824863,https://leetcode.com/problems/number-of-islands,"Array, Depth-First Search, Breadth-First Search, Union Find, Matrix"
EASY,Two Sum,98.3,0.5554645979807873,https://leetcode.com/problems/two-sum,"Array, Hash Table"
MEDIUM,Merge Intervals,94.4,0.49193339333454633,https://leetcode.com/problems/merge-intervals,"Array, Sorting"
MEDIUM,Binary Tree Vertical Order Traversal,84.2,0.5698231509891339,https://leetcode.com/problems/binary-tree-vertical-order-traversal,"Hash Table, Tree, Depth-First Search, Breadth-First Search, Sorting, Binary Tree"
MEDIUM,Sort Integers by The Power Value,78.8,0.7069574436256496,https://leetcode.com/problems/sort-integers-by-the-power-value,"Dynamic Programming, Memoization, Sorting"
MEDIUM,Word Search,76.7,0.45026543191028096,https://leetcode.com/problems/word-search,"Array, String, Backtracking, Depth-First Search, Matrix"
EASY,Valid Parentheses,76.7,0.42159976098058755,https://leetcode.com/problems/valid-parentheses,"String, Stack"
HARD,Trapping Rain Water,74.4,0.6481176169379649,https://leetcode.com/problems/trapping-rain-water,"Array, Two Pointers, Dynamic Programming, Stack, Monotonic Stack"
MEDIUM,Longest Substring Without Repeating Characters,74.4,0.36716052578324143,https://leetcode.com/problems/longest-substring-without-repeating-characters,"Hash Table, String, Sliding Window"
MEDIUM,Design A Leaderboard,74.4,0.6792274501746456,https://leetcode.com/problems/design-a-leaderboard,"Hash Table, Design, Sorting"
EASY,Best Time to Buy and Sell Stock,71.9,0.5506565929612338,https://leetcode.com/problems/best-time-to-buy-and-sell-stock,"Array, Dynamic Programming"
MEDIUM,Add Two Numbers,71.9,0.45941313081569063,https://leetcode.com/problems/add-two-numbers,"Linked List, Math, Recursion"
MEDIUM,Decode String,71.9,0.6097512283984168,https://leetcode.com/problems/decode-string,"String, Stack, Recursion"
MEDIUM,Evaluate Division,69.1,0.6298761961582804,https://leetcode.com/problems/evaluate-division,"Array, String, Depth-First Search, Breadth-First Search, Union Find, Graph, Shortest Path"
MEDIUM,LRU Cache,69.1,0.449367794939985,https://leetcode.com/problems/lru-cache,"Hash Table, Linked List, Design, Doubly-Linked List"
MEDIUM,Flatten a Multilevel Doubly Linked List,69.1,0.6117278959857493,https://leetcode.com/problems/flatten-a-multilevel-doubly-linked-list,"Linked List, Depth-First Search, Doubly-Linked List"
MEDIUM,Two City Scheduling,65.9,0.675772380100461,https://leetcode.com/problems/two-city-scheduling,"Array, Greedy, Sorting"
HARD,Word Break II,65.9,0.5339042342014533,https://leetcode.com/problems/word-break-ii,"Array, Hash Table, String, Dynamic Programming, Backtracking, Trie, Memoization"
MEDIUM,Insert Delete GetRandom O(1),65.9,0.5492713902235457,https://leetcode.com/problems/insert-delete-getrandom-o1,"Array, Hash Table, Math, Design, Randomized"
MEDIUM,Subsets,65.9,0.8063759139131045,https://leetcode.com/problems/subsets,"Array, Backtracking, Bit Manipulation"
EASY,Longest Common Prefix,65.9,0.4526901965482355,https://leetcode.com/problems/longest-common-prefix,"String, Trie"
EASY,Valid Anagram,65.9,0.6647078361230815,https://leetcode.com/problems/valid-anagram,"Hash Table, String, Sorting"
EASY,Merge Sorted Array,65.9,0.5267876824002001,https://leetcode.com/problems/merge-sorted-array,"Array, Two Pointers, Sorting"
EASY,Merge Two Sorted Lists,62.2,0.6665304144801787,https://leetcode.com/problems/merge-two-sorted-lists,"Linked List, Recursion"
EASY,Contains Duplicate,62.2,0.6307839623775975,https://leetcode.com/problems/contains-duplicate,"Array, Hash Table, Sorting"
MEDIUM,Binary Tree Level Order Traversal,62.2,0.7030861533855094,https://leetcode.com/problems/binary-tree-level-order-traversal,"Tree, Breadth-First Search, Binary Tree"
MEDIUM,4Sum,62.2,0.3797904057760794,https://leetcode.com/problems/4sum,"Array, Two Pointers, Sorting"
HARD,Median of Two Sorted Arrays,62.2,0.43488080574972815,https://leetcode.com/problems/median-of-two-sorted-arrays,"Array, Binary Search, Divide and Conquer"
MEDIUM,Subarray Sum Equals K,62.2,0.4528264772972974,https://leetcode.com/problems/subarray-sum-equals-k,"Array, Hash Table, Prefix Sum"
MEDIUM,Populating Next Right Pointers in Each Node,57.9,0.6523646565039652,https://leetcode.com/problems/populating-next-right-pointers-in-each-node,"Linked List, Tree, Depth-First Search, Breadth-First Search, Binary Tree"
MEDIUM,3Sum,57.9,0.3684032266093177,https://leetcode.com/problems/3sum,"Array, Two Pointers, Sorting"
EASY,Merge Strings Alternately,57.9,0.821945970517832,https://leetcode.com/problems/merge-strings-alternately,"Two Pointers, String"
EASY,Majority Element,57.9,0.6565326037448603,https://leetcode.com/problems/majority-element,"Array, Hash Table, Divide and Conquer, Sorting, Counting"
EASY,Reverse Linked List,57.9,0.790044415302831,https://leetcode.com/problems/reverse-linked-list,"Linked List, Recursion"
MEDIUM,Lexicographical Numbers,57.9,0.7308905459139352,https://leetcode.com/problems/lexicographical-numbers,"Depth-First Search, Trie"
MEDIUM,String to Integer (atoi),57.9,0.1902804486466948,https://leetcode.com/problems/string-to-integer-atoi,String
MEDIUM,Count Unhappy Friends,57.9,0.6197589047498491,https://leetcode.com/problems/count-unhappy-friends,"Array, Simulation"
EASY,Create Hello World Function,57.9,0.8213019341290763,https://leetcode.com/problems/create-hello-world-function,
MEDIUM,Coin Change,57.9,0.46233610741627024,https://leetcode.com/problems/coin-change,"Array, Dynamic Programming, Breadth-First Search"
MEDIUM,Min Stack,57.9,0.5623406481083035,https://leetcode.com/problems/min-stack,"Stack, Design"
EASY,Remove Letter To Equalize Frequency,57.9,0.18120956317273007,https://leetcode.com/problems/remove-letter-to-equalize-frequency,"Hash Table, String, Counting"
MEDIUM,Longest Consecutive Sequence,57.9,0.47071089394568366,https://leetcode.com/problems/longest-consecutive-sequence,"Array, Hash Table, Union Find"
MEDIUM,Meeting Rooms II,57.9,0.5207954555688193,https://leetcode.com/problems/meeting-rooms-ii,"Array, Two Pointers, Greedy, Sorting, Heap (Priority Queue), Prefix Sum"
MEDIUM,All Paths From Source to Target,57.9,0.8305603913704577,https://leetcode.com/problems/all-paths-from-source-to-target,"Backtracking, Depth-First Search, Breadth-First Search, Graph"
MEDIUM,Find First and Last Position of Element in Sorted Array,52.6,0.4656721517228316,https://leetcode.com/problems/find-first-and-last-position-of-element-in-sorted-array,"Array, Binary Search"
MEDIUM,Next Permutation,52.6,0.4279287449005228,https://leetcode.com/problems/next-permutation,"Array, Two Pointers"
MEDIUM,Odd Even Linked List,52.6,0.6194557763748719,https://leetcode.com/problems/odd-even-linked-list,Linked List
MEDIUM,Longest Palindromic Substring,52.6,0.35648323144291294,https://leetcode.com/problems/longest-palindromic-substring,"Two Pointers, String, Dynamic Programming"
MEDIUM,Search in Rotated Sorted Array,52.6,0.4264861408520957,https://leetcode.com/problems/search-in-rotated-sorted-array,"Array, Binary Search"
MEDIUM,Valid Triangle Number,52.6,0.5218423386807287,https://leetcode.com/problems/valid-triangle-number,"Array, Two Pointers, Binary Search, Greedy, Sorting"
EASY,Valid Palindrome,52.6,0.5066476401811998,https://leetcode.com/problems/valid-palindrome,"Two Pointers, String"
MEDIUM,The k-th Lexicographical String of All Happy Strings of Length n,52.6,0.8510217043954627,https://leetcode.com/problems/the-k-th-lexicographical-string-of-all-happy-strings-of-length-n,"String, Backtracking"
MEDIUM,Rotate List,52.6,0.3976325767080527,https://leetcode.com/problems/rotate-list,"Linked List, Two Pointers"
EASY,Reverse String,52.6,0.7965197431917048,https://leetcode.com/problems/reverse-string,"Two Pointers, String"
MEDIUM,Unique Paths,52.6,0.6564002362650921,https://leetcode.com/problems/unique-paths,"Math, Dynamic Programming, Combinatorics"
MEDIUM,Generate Parentheses,52.6,0.7691553678492472,https://leetcode.com/problems/generate-parentheses,"String, Dynamic Programming, Backtracking"
MEDIUM,Reverse Integer,52.6,0.30138552722931117,https://leetcode.com/problems/reverse-integer,Math
MEDIUM,Find Peak Element,52.6,0.4646475948074154,https://leetcode.com/problems/find-peak-element,"Array, Binary Search"
MEDIUM,Top K Frequent Elements,45.8,0.6438793876478635,https://leetcode.com/problems/top-k-frequent-elements,"Array, Hash Table, Divide and Conquer, Sorting, Heap (Priority Queue), Bucket Sort, Counting, Quickselect"
MEDIUM,Remove K Digits,45.8,0.34725477077202727,https://leetcode.com/problems/remove-k-digits,"String, Stack, Greedy, Monotonic Stack"
MEDIUM,Best Time to Buy and Sell Stock II,45.8,0.692650115219496,https://leetcode.com/problems/best-time-to-buy-and-sell-stock-ii,"Array, Dynamic Programming, Greedy"
MEDIUM,Find the Punishment Number of an Integer,45.8,0.8181128805113205,https://leetcode.com/problems/find-the-punishment-number-of-an-integer,"Math, Backtracking"
EASY,Remove Duplicates from Sorted Array,45.8,0.6004881841269436,https://leetcode.com/problems/remove-duplicates-from-sorted-array,"Array, Two Pointers"
EASY,Reverse Vowels of a String,45.8,0.577883832969531,https://leetcode.com/problems/reverse-vowels-of-a-string,"Two Pointers, String"
EASY,Roman to Integer,45.8,0.6462068209626666,https://leetcode.com/problems/roman-to-integer,"Hash Table, Math, String"
MEDIUM,Design Underground System,45.8,0.7399053637171891,https://leetcode.com/problems/design-underground-system,"Hash Table, String, Design"
MEDIUM,Invalid Transactions,45.8,0.31244860816283,https://leetcode.com/problems/invalid-transactions,"Array, Hash Table, String, Sorting"
MEDIUM,Dot Product of Two Sparse Vectors,45.8,0.8994958226012963,https://leetcode.com/problems/dot-product-of-two-sparse-vectors,"Array, Hash Table, Two Pointers, Design"
MEDIUM,Sort Colors,45.8,0.6683255233730256,https://leetcode.com/problems/sort-colors,"Array, Two Pointers, Sorting"
EASY,Remove Element,45.8,0.5983714539542893,https://leetcode.com/problems/remove-element,"Array, Two Pointers"
EASY,Counter,45.8,0.8222167652257341,https://leetcode.com/problems/counter,
EASY,Climbing Stairs,45.8,0.534767866183329,https://leetcode.com/problems/climbing-stairs,"Math, Dynamic Programming, Memoization"
EASY,Binary Search,45.8,0.5939927581493657,https://leetcode.com/problems/binary-search,"Array, Binary Search"
HARD,Number of Ships in a Rectangle,45.8,0.6881855701957669,https://leetcode.com/problems/number-of-ships-in-a-rectangle,"Array, Divide and Conquer, Interactive"
HARD,Largest Rectangle in Histogram,36.3,0.4706801312933666,https://leetcode.com/problems/largest-rectangle-in-histogram,"Array, Stack, Monotonic Stack"
MEDIUM,Find Unique Binary String,36.3,0.7935512628389538,https://leetcode.com/problems/find-unique-binary-string,"Array, Hash Table, String, Backtracking"
MEDIUM,Last Person to Fit in the Bus,36.3,0.6826898118578274,https://leetcode.com/problems/last-person-to-fit-in-the-bus,Database
MEDIUM,Swap Nodes in Pairs,36.3,0.6695236319953605,https://leetcode.com/problems/swap-nodes-in-pairs,"Linked List, Recursion"
MEDIUM,Partition Array According to Given Pivot,36.3,0.899329660395381,https://leetcode.com/problems/partition-array-according-to-given-pivot,"Array, Two Pointers, Simulation"
MEDIUM,Product of the Last K Numbers,36.3,0.6272711528568009,https://leetcode.com/problems/product-of-the-last-k-numbers,"Array, Math, Design, Data Stream, Prefix Sum"
MEDIUM,Find Minimum in Rotated Sorted Array,36.3,0.5246000262789338,https://leetcode.com/problems/find-minimum-in-rotated-sorted-array,"Array, Binary Search"
HARD,Sudoku Solver,36.3,0.6375732569888851,https://leetcode.com/problems/sudoku-solver,"Array, Hash Table, Backtracking, Matrix"
MEDIUM,Minimum Number of Steps to Make Two Strings Anagram,36.3,0.821256554282131,https://leetcode.com/problems/minimum-number-of-steps-to-make-two-strings-anagram,"Hash Table, String, Counting"
HARD,Serialize and Deserialize N-ary Tree,36.3,0.6819800901604683,https://leetcode.com/problems/serialize-and-deserialize-n-ary-tree,"String, Tree, Depth-First Search, Breadth-First Search"
EASY,Check if Array Is Sorted and Rotated,36.3,0.5504317212314335,https://leetcode.com/problems/check-if-array-is-sorted-and-rotated,Array
EASY,Palindrome Number,36.3,0.5903901316652552,https://leetcode.com/problems/palindrome-number,Math
EASY,Single Number,36.3,0.7573432749722616,https://leetcode.com/problems/single-number,"Array, Bit Manipulation"
HARD,Word Ladder,36.3,0.4245616859563875,https://leetcode.com/problems/word-ladder,"Hash Table, String, Breadth-First Search"
MEDIUM,Remove All Adjacent Duplicates in String II,36.3,0.594249905580707,https://leetcode.com/problems/remove-all-adjacent-duplicates-in-string-ii,"String, Stack"
MEDIUM,Frequency of the Most Frequent Element,36.3,0.4406163185737275,https://leetcode.com/problems/frequency-of-the-most-frequent-element,"Array, Binary Search, Greedy, Sliding Window, Sorting, Prefix Sum"
MEDIUM,Letter Combinations of a Phone Number,36.3,0.6359892297352785,https://leetcode.com/problems/letter-combinations-of-a-phone-number,"Hash Table, String, Backtracking"
MEDIUM,Product of Array Except Self,36.3,0.6762122049538886,https://leetcode.com/problems/product-of-array-except-self,"Array, Prefix Sum"
MEDIUM,Spiral Matrix,36.3,0.5357353637510847,https://leetcode.com/problems/spiral-matrix,"Array, Matrix, Simulation"
MEDIUM,Remove Duplicate Letters,36.3,0.51183090044837,https://leetcode.com/problems/remove-duplicate-letters,"String, Stack, Greedy, Monotonic Stack"
HARD,Reverse Nodes in k-Group,36.3,0.6268017346629305,https://leetcode.com/problems/reverse-nodes-in-k-group,"Linked List, Recursion"
EASY,Number of Recent Calls,36.3,0.7716567377703756,https://leetcode.com/problems/number-of-recent-calls,"Design, Queue, Data Stream"
EASY,Plus One,36.3,0.4738352922667471,https://leetcode.com/problems/plus-one,"Array, Math"
EASY,Max Consecutive Ones,36.3,0.6219349137522929,https://leetcode.com/problems/max-consecutive-ones,Array
EASY,Unique Number of Occurrences,36.3,0.7821065402957185,https://leetcode.com/problems/unique-number-of-occurrences,"Array, Hash Table"
MEDIUM,Construct Binary Tree from Preorder and Inorder Traversal,36.3,0.6657191318954605,https://leetcode.com/problems/construct-binary-tree-from-preorder-and-inorder-traversal,"Array, Hash Table, Divide and Conquer, Tree, Binary Tree"
