Difficulty,Title,Frequency,Acceptance Rate,Link,Topics
MEDIUM,Insert Delete GetRandom O(1),100.0,0.5493279533459056,https://leetcode.com/problems/insert-delete-getrandom-o1,"Array, Hash Table, Math, Design, Randomized"
EASY,Two Sum,98.8,0.551853625556745,https://leetcode.com/problems/two-sum,"Array, Hash Table"
MEDIUM,Merge Intervals,94.3,0.4888144772316322,https://leetcode.com/problems/merge-intervals,"Array, Sorting"
MEDIUM,Invalid Transactions,90.6,0.3122220512963947,https://leetcode.com/problems/invalid-transactions,"Array, Hash Table, String, Sorting"
MEDIUM,Add Two Numbers,89.4,0.455557380883182,https://leetcode.com/problems/add-two-numbers,"Linked List, Math, Recursion"
MEDIUM,Flatten a Multilevel Doubly Linked List,86.1,0.6099639697673138,https://leetcode.com/problems/flatten-a-multilevel-doubly-linked-list,"Linked List, Depth-First Search, Doubly-Linked List"
EASY,Valid Parentheses,82.2,0.41916931604736374,https://leetcode.com/problems/valid-parentheses,"String, Stack"
EASY,Valid Anagram,81.4,0.6622752371389469,https://leetcode.com/problems/valid-anagram,"Hash Table, String, Sorting"
MEDIUM,Longest Substring Without Repeating Characters,80.5,0.364185212101697,https://leetcode.com/problems/longest-substring-without-repeating-characters,"Hash Table, String, Sliding Window"
MEDIUM,LRU Cache,79.6,0.44550532222749,https://leetcode.com/problems/lru-cache,"Hash Table, Linked List, Design, Doubly-Linked List"
EASY,Merge Sorted Array,79.6,0.5235338009359901,https://leetcode.com/problems/merge-sorted-array,"Array, Two Pointers, Sorting"
EASY,Best Time to Buy and Sell Stock,78.6,0.5482912504728978,https://leetcode.com/problems/best-time-to-buy-and-sell-stock,"Array, Dynamic Programming"
MEDIUM,Longest Consecutive Sequence,77.6,0.47157745884745955,https://leetcode.com/problems/longest-consecutive-sequence,"Array, Hash Table, Union Find"
MEDIUM,Word Search,77.6,0.4471708096848039,https://leetcode.com/problems/word-search,"Array, String, Backtracking, Depth-First Search, Matrix"
HARD,Trapping Rain Water,76.5,0.6439790814924163,https://leetcode.com/problems/trapping-rain-water,"Array, Two Pointers, Dynamic Programming, Stack, Monotonic Stack"
MEDIUM,Design Underground System,75.4,0.7484534076710979,https://leetcode.com/problems/design-underground-system,"Hash Table, String, Design"
MEDIUM,Decode String,75.4,0.6074706026030218,https://leetcode.com/problems/decode-string,"String, Stack, Recursion"
EASY,First Unique Character in a String,73.0,0.6329357199475988,https://leetcode.com/problems/first-unique-character-in-a-string,"Hash Table, String, Queue, Counting"
HARD,Median of Two Sorted Arrays,73.0,0.430641921558146,https://leetcode.com/problems/median-of-two-sorted-arrays,"Array, Binary Search, Divide and Conquer"
MEDIUM,Meeting Rooms II,70.3,0.5195254784116946,https://leetcode.com/problems/meeting-rooms-ii,"Array, Two Pointers, Greedy, Sorting, Heap (Priority Queue), Prefix Sum"
EASY,Create Hello World Function,70.3,0.819848442964052,https://leetcode.com/problems/create-hello-world-function,
EASY,Longest Common Prefix,68.9,0.44980364768569925,https://leetcode.com/problems/longest-common-prefix,"String, Trie"
MEDIUM,3Sum,68.9,0.36531419221232875,https://leetcode.com/problems/3sum,"Array, Two Pointers, Sorting"
MEDIUM,Find Peak Element,68.9,0.46365528902764686,https://leetcode.com/problems/find-peak-element,"Array, Binary Search"
MEDIUM,Subsets,68.9,0.8034781344062147,https://leetcode.com/problems/subsets,"Array, Backtracking, Bit Manipulation"
MEDIUM,Container With Most Water,68.9,0.5726803151511701,https://leetcode.com/problems/container-with-most-water,"Array, Two Pointers, Greedy"
EASY,Palindrome Number,68.9,0.5874941494691821,https://leetcode.com/problems/palindrome-number,Math
MEDIUM,Reverse Integer,67.3,0.2992354768538094,https://leetcode.com/problems/reverse-integer,Math
MEDIUM,Search in Rotated Sorted Array,65.6,0.42401122894108895,https://leetcode.com/problems/search-in-rotated-sorted-array,"Array, Binary Search"
EASY,Merge Two Sorted Lists,63.8,0.6636950668025112,https://leetcode.com/problems/merge-two-sorted-lists,"Linked List, Recursion"
EASY,Contains Duplicate,63.8,0.6287398074341244,https://leetcode.com/problems/contains-duplicate,"Array, Hash Table, Sorting"
EASY,Roman to Integer,63.8,0.6427277077750511,https://leetcode.com/problems/roman-to-integer,"Hash Table, Math, String"
MEDIUM,Subarray Sum Equals K,63.8,0.45002435441807587,https://leetcode.com/problems/subarray-sum-equals-k,"Array, Hash Table, Prefix Sum"
EASY,Reverse Linked List,61.9,0.7873609934995394,https://leetcode.com/problems/reverse-linked-list,"Linked List, Recursion"
MEDIUM,Longest Palindromic Substring,61.9,0.3537820238782848,https://leetcode.com/problems/longest-palindromic-substring,"Two Pointers, String, Dynamic Programming"
EASY,Remove Duplicates from Sorted Array,61.9,0.595988465252378,https://leetcode.com/problems/remove-duplicates-from-sorted-array,"Array, Two Pointers"
MEDIUM,Binary Tree Level Order Traversal,59.7,0.6993448297175351,https://leetcode.com/problems/binary-tree-level-order-traversal,"Tree, Breadth-First Search, Binary Tree"
MEDIUM,Rotate Image,57.3,0.7727233982200226,https://leetcode.com/problems/rotate-image,"Array, Math, Matrix"
EASY,Merge Strings Alternately,57.3,0.8193906704760887,https://leetcode.com/problems/merge-strings-alternately,"Two Pointers, String"
MEDIUM,Generate Parentheses,57.3,0.7661918785115296,https://leetcode.com/problems/generate-parentheses,"String, Dynamic Programming, Backtracking"
EASY,Majority Element,57.3,0.6552282206278677,https://leetcode.com/problems/majority-element,"Array, Hash Table, Divide and Conquer, Sorting, Counting"
MEDIUM,Find First and Last Position of Element in Sorted Array,57.3,0.4624175468488463,https://leetcode.com/problems/find-first-and-last-position-of-element-in-sorted-array,"Array, Binary Search"
MEDIUM,Two City Scheduling,54.7,0.6748485814472426,https://leetcode.com/problems/two-city-scheduling,"Array, Greedy, Sorting"
MEDIUM,Next Permutation,54.7,0.4242937340183971,https://leetcode.com/problems/next-permutation,"Array, Two Pointers"
EASY,Pascal's Triangle,54.7,0.7651472486103572,https://leetcode.com/problems/pascals-triangle,"Array, Dynamic Programming"
MEDIUM,All Paths From Source to Target,54.7,0.829526810154665,https://leetcode.com/problems/all-paths-from-source-to-target,"Backtracking, Depth-First Search, Breadth-First Search, Graph"
EASY,Climbing Stairs,54.7,0.5336999973156737,https://leetcode.com/problems/climbing-stairs,"Math, Dynamic Programming, Memoization"
EASY,Recyclable and Low Fat Products,54.7,0.8936076365182217,https://leetcode.com/problems/recyclable-and-low-fat-products,Database
MEDIUM,Maximum Subarray,54.7,0.5179050787176336,https://leetcode.com/problems/maximum-subarray,"Array, Divide and Conquer, Dynamic Programming"
EASY,Palindrome Linked List,51.6,0.5525667240829804,https://leetcode.com/problems/palindrome-linked-list,"Linked List, Two Pointers, Stack, Recursion"
MEDIUM,Copy List with Random Pointer,51.6,0.5965903322874199,https://leetcode.com/problems/copy-list-with-random-pointer,"Hash Table, Linked List"
MEDIUM,Best Time to Buy and Sell Stock II,51.6,0.6895501055634548,https://leetcode.com/problems/best-time-to-buy-and-sell-stock-ii,"Array, Dynamic Programming, Greedy"
MEDIUM,Design A Leaderboard,51.6,0.678650321231641,https://leetcode.com/problems/design-a-leaderboard,"Hash Table, Design, Sorting"
MEDIUM,String to Integer (atoi),51.6,0.18788592094283899,https://leetcode.com/problems/string-to-integer-atoi,String
HARD,Reverse Nodes in k-Group,51.6,0.62189177854135,https://leetcode.com/problems/reverse-nodes-in-k-group,"Linked List, Recursion"
EASY,Remove Element,51.6,0.5953765705988044,https://leetcode.com/problems/remove-element,"Array, Two Pointers"
MEDIUM,"Pow(x, n)",51.6,0.365695966246044,https://leetcode.com/problems/powx-n,"Math, Recursion"
MEDIUM,Jump Game,51.6,0.3915374278253198,https://leetcode.com/problems/jump-game,"Array, Dynamic Programming, Greedy"
MEDIUM,Gas Station,48.2,0.4601297695693313,https://leetcode.com/problems/gas-station,"Array, Greedy"
MEDIUM,4Sum,48.2,0.376822568077218,https://leetcode.com/problems/4sum,"Array, Two Pointers, Sorting"
EASY,Find the Index of the First Occurrence in a String,48.2,0.4454256265017118,https://leetcode.com/problems/find-the-index-of-the-first-occurrence-in-a-string,"Two Pointers, String, String Matching"
EASY,Check if Array Is Sorted and Rotated,48.2,0.5495928504342606,https://leetcode.com/problems/check-if-array-is-sorted-and-rotated,Array
EASY,Isomorphic Strings,48.2,0.4648259256410979,https://leetcode.com/problems/isomorphic-strings,"Hash Table, String"
MEDIUM,Daily Temperatures,48.2,0.6702605323450607,https://leetcode.com/problems/daily-temperatures,"Array, Stack, Monotonic Stack"
MEDIUM,Group Anagrams,48.2,0.7043760105016141,https://leetcode.com/problems/group-anagrams,"Array, Hash Table, String, Sorting"
EASY,Add Binary,48.2,0.5526349064627296,https://leetcode.com/problems/add-binary,"Math, String, Bit Manipulation, Simulation"
MEDIUM,Product of Array Except Self,48.2,0.6743163916800148,https://leetcode.com/problems/product-of-array-except-self,"Array, Prefix Sum"
MEDIUM,Minimum Remove to Make Valid Parentheses,48.2,0.7030449819405282,https://leetcode.com/problems/minimum-remove-to-make-valid-parentheses,"String, Stack"
MEDIUM,Spiral Matrix,48.2,0.5309626776597093,https://leetcode.com/problems/spiral-matrix,"Array, Matrix, Simulation"
EASY,Move Zeroes,48.2,0.625771353093987,https://leetcode.com/problems/move-zeroes,"Array, Two Pointers"
MEDIUM,Top K Frequent Elements,44.1,0.6415071231458012,https://leetcode.com/problems/top-k-frequent-elements,"Array, Hash Table, Divide and Conquer, Sorting, Heap (Priority Queue), Bucket Sort, Counting, Quickselect"
MEDIUM,Permutations,44.1,0.8021909616814337,https://leetcode.com/problems/permutations,"Array, Backtracking"
MEDIUM,Unique Paths,44.1,0.6546153189509587,https://leetcode.com/problems/unique-paths,"Math, Dynamic Programming, Combinatorics"
MEDIUM,Set Matrix Zeroes,44.1,0.590601431549811,https://leetcode.com/problems/set-matrix-zeroes,"Array, Hash Table, Matrix"
MEDIUM,Peak Index in a Mountain Array,39.2,0.6773542684178915,https://leetcode.com/problems/peak-index-in-a-mountain-array,"Array, Binary Search"
MEDIUM,Zigzag Conversion,39.2,0.5090893202080576,https://leetcode.com/problems/zigzag-conversion,String
EASY,Same Tree,39.2,0.6453418391766443,https://leetcode.com/problems/same-tree,"Tree, Depth-First Search, Breadth-First Search, Binary Tree"
EASY,Article Views I,39.2,0.7714771456370516,https://leetcode.com/problems/article-views-i,Database
EASY,Search Insert Position,39.2,0.4844042698305283,https://leetcode.com/problems/search-insert-position,"Array, Binary Search"
MEDIUM,Valid Sudoku,39.2,0.6175410652388653,https://leetcode.com/problems/valid-sudoku,"Array, Hash Table, Matrix"
MEDIUM,Combination Sum II,39.2,0.5727835467581852,https://leetcode.com/problems/combination-sum-ii,"Array, Backtracking"
HARD,Merge k Sorted Lists,39.2,0.5594069462800462,https://leetcode.com/problems/merge-k-sorted-lists,"Linked List, Divide and Conquer, Heap (Priority Queue), Merge Sort"
MEDIUM,Binary Tree Right Side View,39.2,0.6588462291750823,https://leetcode.com/problems/binary-tree-right-side-view,"Tree, Depth-First Search, Breadth-First Search, Binary Tree"
HARD,Wildcard Matching,39.2,0.29443159686848547,https://leetcode.com/problems/wildcard-matching,"String, Dynamic Programming, Greedy, Recursion"
EASY,Sqrt(x),39.2,0.4008055339111904,https://leetcode.com/problems/sqrtx,"Math, Binary Search"
EASY,Diameter of Binary Tree,39.2,0.6287205951378891,https://leetcode.com/problems/diameter-of-binary-tree,"Tree, Depth-First Search, Binary Tree"
MEDIUM,Palindrome Partitioning,39.2,0.7148037315961818,https://leetcode.com/problems/palindrome-partitioning,"String, Dynamic Programming, Backtracking"
MEDIUM,Max Consecutive Ones III,32.9,0.6534583623943435,https://leetcode.com/problems/max-consecutive-ones-iii,"Array, Binary Search, Sliding Window, Prefix Sum"
MEDIUM,Kth Largest Element in an Array,32.9,0.6767052381110672,https://leetcode.com/problems/kth-largest-element-in-an-array,"Array, Divide and Conquer, Sorting, Heap (Priority Queue), Quickselect"
MEDIUM,Reverse Words in a String,32.9,0.5037793818113911,https://leetcode.com/problems/reverse-words-in-a-string,"Two Pointers, String"
HARD,Largest Rectangle in Histogram,32.9,0.46695375993685045,https://leetcode.com/problems/largest-rectangle-in-histogram,"Array, Stack, Monotonic Stack"
MEDIUM,Monthly Transactions I,32.9,0.5832141287619474,https://leetcode.com/problems/monthly-transactions-i,Database
EASY,Happy Number,32.9,0.5763520610518224,https://leetcode.com/problems/happy-number,"Hash Table, Math, Two Pointers"
MEDIUM,Find the Winner of the Circular Game,32.9,0.8196828327285617,https://leetcode.com/problems/find-the-winner-of-the-circular-game,"Array, Math, Recursion, Queue, Simulation"
MEDIUM,Permutation in String,24.4,0.46891336585664156,https://leetcode.com/problems/permutation-in-string,"Hash Table, Two Pointers, String, Sliding Window"
MEDIUM,Confirmation Rate,24.4,0.6067498987057991,https://leetcode.com/problems/confirmation-rate,Database
EASY,Greatest Common Divisor of Strings,24.4,0.5259400908983746,https://leetcode.com/problems/greatest-common-divisor-of-strings,"Math, String"
MEDIUM,Reverse Substrings Between Each Pair of Parentheses,24.4,0.7175326707390346,https://leetcode.com/problems/reverse-substrings-between-each-pair-of-parentheses,"String, Stack"
MEDIUM,Managers with at Least 5 Direct Reports,24.4,0.4908840228611492,https://leetcode.com/problems/managers-with-at-least-5-direct-reports,Database
MEDIUM,Add Two Numbers II,24.4,0.6169174009599542,https://leetcode.com/problems/add-two-numbers-ii,"Linked List, Math, Stack"
