Difficulty,Title,Frequency,Acceptance Rate,Link,Topics
MEDIUM,Design SQL,100.0,0.698193359375,https://leetcode.com/problems/design-sql,"Array, Hash Table, String, Design"
MEDIUM,Flatten Nested List Iterator,80.0,0.6522839525510098,https://leetcode.com/problems/flatten-nested-list-iterator,"Stack, Tree, Depth-First Search, Design, Queue, Iterator"
MEDIUM,Time Based Key-Value Store,66.7,0.49366346423788904,https://leetcode.com/problems/time-based-key-value-store,"Hash Table, String, Binary Search, Design"
MEDIUM,Design Memory Allocator,66.7,0.484441262323071,https://leetcode.com/problems/design-memory-allocator,"Array, Hash Table, Design, Simulation"
MEDIUM,Asteroid Collision,59.0,0.45500586816476224,https://leetcode.com/problems/asteroid-collision,"Array, Stack, Simulation"
