Difficulty,Title,Frequency,Acceptance Rate,Link,Topics
HARD,Design Excel Sum Formula,100.0,0.4286713764035357,https://leetcode.com/problems/design-excel-sum-formula,"Array, Hash Table, String, Graph, Design, Topological Sort, Matrix"
MEDIUM,Web Crawler Multithreaded,90.4,0.5006749881960192,https://leetcode.com/problems/web-crawler-multithreaded,"Depth-First Search, Breadth-First Search, Concurrency"
MEDIUM,Design SQL,90.4,0.7033649959579629,https://leetcode.com/problems/design-sql,"Array, Hash Table, String, Design"
MEDIUM,Flatten Nested List Iterator,90.4,0.6521016401222325,https://leetcode.com/problems/flatten-nested-list-iterator,"Stack, Tree, Depth-First Search, Design, Queue, Iterator"
MEDIUM,Simplify Path,73.9,0.47656827303017296,https://leetcode.com/problems/simplify-path,"String, Stack"
MEDIUM,Time Based Key-Value Store,73.9,0.4933282654497034,https://leetcode.com/problems/time-based-key-value-store,"Hash Table, String, Binary Search, Design"
EASY,Flood Fill,73.9,0.6633105695710273,https://leetcode.com/problems/flood-fill,"Array, Depth-First Search, Breadth-First Search, Matrix"
