Difficulty,Title,Frequency,Acceptance Rate,Link,Topics
MEDIUM,Design SQL,100.0,0.7556154537286612,https://leetcode.com/problems/design-sql,"Array, Hash Table, String, Design"
HARD,Design Excel Sum Formula,96.4,0.43978304399385676,https://leetcode.com/problems/design-excel-sum-formula,"Array, Graph, Design, Topological Sort, Matrix"
MEDIUM,Web Crawler Multithreaded,86.8,0.4961533582562886,https://leetcode.com/problems/web-crawler-multithreaded,"Depth-First Search, Breadth-First Search, Concurrency"
MEDIUM,Time Based Key-Value Store,86.8,0.49333051545419254,https://leetcode.com/problems/time-based-key-value-store,"Hash Table, String, Binary Search, Design"
MEDIUM,Flatten Nested List Iterator,86.8,0.6509353522830934,https://leetcode.com/problems/flatten-nested-list-iterator,"Stack, Tree, Depth-First Search, Design, Queue, Iterator"
MEDIUM,Simplify Path,70.5,0.462753643631965,https://leetcode.com/problems/simplify-path,"String, Stack"
EASY,Flood Fill,70.5,0.6570543727419313,https://leetcode.com/problems/flood-fill,"Array, Depth-First Search, Breadth-First Search, Matrix"
MEDIUM,Encode and Decode Strings,70.5,0.4880098306005831,https://leetcode.com/problems/encode-and-decode-strings,"Array, String, Design"
