Difficulty,Title,Frequency,Acceptance Rate,Link,Topics
EASY,Best Time to Buy and Sell Stock,100.0,0.5492511271029624,https://leetcode.com/problems/best-time-to-buy-and-sell-stock,"Array, Dynamic Programming"
MEDIUM,Container With Most Water,89.6,0.5740128784917259,https://leetcode.com/problems/container-with-most-water,"Array, Two Pointers, Greedy"
EASY,Roman to Integer,89.6,0.6441583707215682,https://leetcode.com/problems/roman-to-integer,"Hash Table, Math, String"
MEDIUM,Longest Palindromic Substring,89.6,0.35491322396277836,https://leetcode.com/problems/longest-palindromic-substring,"Two Pointers, String, Dynamic Programming"
EASY,Valid Palindrome,89.6,0.5045398946675526,https://leetcode.com/problems/valid-palindrome,"Two Pointers, String"
