Difficulty,Title,Frequency,Acceptance Rate,Link,Topics
MEDIUM,Container With Most Water,100.0,0.5768095886075546,https://leetcode.com/problems/container-with-most-water,"Array, Two Pointers, Greedy"
MEDIUM,LRU Cache,87.4,0.4507745480288218,https://leetcode.com/problems/lru-cache,"Hash Table, Linked List, Design, Doubly-Linked List"
MEDIUM,Binary Tree Right Side View,87.4,0.6680527536621926,https://leetcode.com/problems/binary-tree-right-side-view,"Tree, Depth-First Search, Breadth-First Search, Binary Tree"
HARD,First Missing Positive,87.4,0.4100761802683148,https://leetcode.com/problems/first-missing-positive,"Array, Hash Table"
MEDIUM,Number of Distinct Islands,87.4,0.6220402801532129,https://leetcode.com/problems/number-of-distinct-islands,"Hash Table, Depth-First Search, Breadth-First Search, Union Find, Hash Function"
MEDIUM,Next Permutation,87.4,0.4292067066060874,https://leetcode.com/problems/next-permutation,"Array, Two Pointers"
HARD,Trapping Rain Water,87.4,0.649501837566537,https://leetcode.com/problems/trapping-rain-water,"Array, Two Pointers, Dynamic Programming, Stack, Monotonic Stack"
EASY,Reverse Linked List,87.4,0.7910863702559198,https://leetcode.com/problems/reverse-linked-list,"Linked List, Recursion"
