Difficulty,Title,Frequency,Acceptance Rate,Link,Topics
MEDIUM,Valid Square,100.0,0.44244633665128835,https://leetcode.com/problems/valid-square,"Math, Geometry"
MEDIUM,Palindromic Substrings,86.0,0.7160957606786588,https://leetcode.com/problems/palindromic-substrings,"Two Pointers, String, Dynamic Programming"
HARD,Design Skiplist,84.2,0.5807907527672262,https://leetcode.com/problems/design-skiplist,"Linked List, Design"
MEDIUM,Longest Palindromic Substring,66.8,0.3574445626071691,https://leetcode.com/problems/longest-palindromic-substring,"Two Pointers, String, Dynamic Programming"
MEDIUM,Longest Increasing Subsequence,61.3,0.576771070091834,https://leetcode.com/problems/longest-increasing-subsequence,"Array, Binary Search, Dynamic Programming"
EASY,Maximum Repeating Substring,61.3,0.39543087602126514,https://leetcode.com/problems/maximum-repeating-substring,"String, Dynamic Programming, String Matching"
MEDIUM,Insert Delete GetRandom O(1),61.3,0.5496092168637935,https://leetcode.com/problems/insert-delete-getrandom-o1,"Array, Hash Table, Math, Design, Randomized"
