Difficulty,Title,Frequency,Acceptance Rate,Link
MEDIUM,Number of Divisible Substrings,100.0,0.7365250475586557,https://leetcode.com/problems/number-of-divisible-substrings
MEDIUM,Find Indices With Index and Value Difference II,77.0,0.31972360768198316,https://leetcode.com/problems/find-indices-with-index-and-value-difference-ii
MEDIUM,Minimize Maximum of Array,77.0,0.46406619007255534,https://leetcode.com/problems/minimize-maximum-of-array
EASY,Number of Unequal Triplets in Array,77.0,0.718416033423148,https://leetcode.com/problems/number-of-unequal-triplets-in-array
EASY,Remove All Adjacent Duplicates In String,77.0,0.7068937637540627,https://leetcode.com/problems/remove-all-adjacent-duplicates-in-string
EASY,Find Indices With Index and Value Difference I,77.0,0.6116252979946711,https://leetcode.com/problems/find-indices-with-index-and-value-difference-i
MEDIUM,Longest Nice Subarray,77.0,0.5215291694500112,https://leetcode.com/problems/longest-nice-subarray
EASY,Valid Parentheses,77.0,0.4153888284745555,https://leetcode.com/problems/valid-parentheses
MEDIUM,Min Stack,77.0,0.5555556492435165,https://leetcode.com/problems/min-stack
