Difficulty,Title,Frequency,Acceptance Rate,Link,Topics
MEDIUM,Min Stack,100.0,0.5599611981413696,https://leetcode.com/problems/min-stack,"Stack, Design"
MEDIUM,Number of Divisible Substrings,90.9,0.7337837837837838,https://leetcode.com/problems/number-of-divisible-substrings,"Hash Table, String, Counting, Prefix Sum"
MEDIUM,Linked List Cycle II,84.9,0.5413143568356971,https://leetcode.com/problems/linked-list-cycle-ii,"Hash Table, Linked List, Two Pointers"
MEDIUM,3Sum,77.1,0.36531433996400287,https://leetcode.com/problems/3sum,"Array, Two Pointers, Sorting"
MEDIUM,Next Permutation,77.1,0.4242963355888943,https://leetcode.com/problems/next-permutation,"Array, Two Pointers"
HARD,Trapping Rain Water,77.1,0.6439786915361517,https://leetcode.com/problems/trapping-rain-water,"Array, Two Pointers, Dynamic Programming, Stack, Monotonic Stack"
EASY,Valid Parentheses,77.1,0.4191706773560874,https://leetcode.com/problems/valid-parentheses,"String, Stack"
EASY,Remove All Adjacent Duplicates In String,77.1,0.7114393830629449,https://leetcode.com/problems/remove-all-adjacent-duplicates-in-string,"String, Stack"
MEDIUM,Find Minimum in Rotated Sorted Array,77.1,0.52227338799004,https://leetcode.com/problems/find-minimum-in-rotated-sorted-array,"Array, Binary Search"
EASY,Find Indices With Index and Value Difference I,66.2,0.6073978711544077,https://leetcode.com/problems/find-indices-with-index-and-value-difference-i,"Array, Two Pointers"
EASY,Number of Unequal Triplets in Array,66.2,0.7192317742356937,https://leetcode.com/problems/number-of-unequal-triplets-in-array,"Array, Hash Table, Sorting"
MEDIUM,Longest Nice Subarray,66.2,0.647155880047849,https://leetcode.com/problems/longest-nice-subarray,"Array, Bit Manipulation, Sliding Window"
EASY,Palindrome Number,66.2,0.5874950880888771,https://leetcode.com/problems/palindrome-number,Math
MEDIUM,Minimize Maximum of Array,66.2,0.46425972513878205,https://leetcode.com/problems/minimize-maximum-of-array,"Array, Binary Search, Dynamic Programming, Greedy, Prefix Sum"
EASY,Two Sum,66.2,0.5518548897621316,https://leetcode.com/problems/two-sum,"Array, Hash Table"
MEDIUM,Longest Palindromic Substring,66.2,0.35378249701681325,https://leetcode.com/problems/longest-palindromic-substring,"Two Pointers, String, Dynamic Programming"
MEDIUM,Find Indices With Index and Value Difference II,66.2,0.3200070901414806,https://leetcode.com/problems/find-indices-with-index-and-value-difference-ii,"Array, Two Pointers"
MEDIUM,Number of Operations to Make Network Connected,66.2,0.6411895378000717,https://leetcode.com/problems/number-of-operations-to-make-network-connected,"Depth-First Search, Breadth-First Search, Union Find, Graph"
MEDIUM,Reverse Words in a String,66.2,0.5037827664738681,https://leetcode.com/problems/reverse-words-in-a-string,"Two Pointers, String"
EASY,Reverse Linked List,66.2,0.787362469556587,https://leetcode.com/problems/reverse-linked-list,"Linked List, Recursion"
MEDIUM,Largest Number,66.2,0.40922592075028213,https://leetcode.com/problems/largest-number,"Array, String, Greedy, Sorting"
MEDIUM,Container With Most Water,66.2,0.5726811055903752,https://leetcode.com/problems/container-with-most-water,"Array, Two Pointers, Greedy"
EASY,Unique Number of Occurrences,66.2,0.7807999273653821,https://leetcode.com/problems/unique-number-of-occurrences,"Array, Hash Table"
EASY,Move Zeroes,66.2,0.6257733604270829,https://leetcode.com/problems/move-zeroes,"Array, Two Pointers"
MEDIUM,Product of Array Except Self,66.2,0.6743180708304535,https://leetcode.com/problems/product-of-array-except-self,"Array, Prefix Sum"
MEDIUM,Longest Consecutive Sequence,66.2,0.4715758060733863,https://leetcode.com/problems/longest-consecutive-sequence,"Array, Hash Table, Union Find"
MEDIUM,Word Search,66.2,0.4471712443352368,https://leetcode.com/problems/word-search,"Array, String, Backtracking, Depth-First Search, Matrix"
MEDIUM,Permutations,66.2,0.8021920971173657,https://leetcode.com/problems/permutations,"Array, Backtracking"
MEDIUM,Execute Asynchronous Functions in Parallel,66.2,0.7709772568501125,https://leetcode.com/problems/execute-asynchronous-functions-in-parallel,
