Difficulty,Title,Frequency,Acceptance Rate,Link,Topics
MEDIUM,Min Stack,100.0,0.5623420333767211,https://leetcode.com/problems/min-stack,"Stack, Design"
MEDIUM,Number of Divisible Substrings,87.8,0.7330788804071247,https://leetcode.com/problems/number-of-divisible-substrings,"Hash Table, String, Counting, Prefix Sum"
MEDIUM,Linked List Cycle II,82.0,0.5454021198219964,https://leetcode.com/problems/linked-list-cycle-ii,"Hash Table, Linked List, Two Pointers"
MEDIUM,Find Minimum in Rotated Sorted Array,74.6,0.5246009194913355,https://leetcode.com/problems/find-minimum-in-rotated-sorted-array,"Array, Binary Search"
MEDIUM,Longest Consecutive Sequence,74.6,0.4707112573103542,https://leetcode.com/problems/longest-consecutive-sequence,"Array, Hash Table, Union Find"
MEDIUM,Container With Most Water,74.6,0.5757716804889772,https://leetcode.com/problems/container-with-most-water,"Array, Two Pointers, Greedy"
EASY,Remove All Adjacent Duplicates In String,74.6,0.7139835414936434,https://leetcode.com/problems/remove-all-adjacent-duplicates-in-string,"String, Stack"
EASY,Valid Parentheses,74.6,0.421600197922935,https://leetcode.com/problems/valid-parentheses,"String, Stack"
MEDIUM,Next Permutation,74.6,0.4279305275609994,https://leetcode.com/problems/next-permutation,"Array, Two Pointers"
MEDIUM,3Sum,74.6,0.3684040402631282,https://leetcode.com/problems/3sum,"Array, Two Pointers, Sorting"
EASY,Number of Unequal Triplets in Array,64.1,0.7250701422193966,https://leetcode.com/problems/number-of-unequal-triplets-in-array,"Array, Hash Table, Sorting"
MEDIUM,Execute Asynchronous Functions in Parallel,64.1,0.7749380195420738,https://leetcode.com/problems/execute-asynchronous-functions-in-parallel,
MEDIUM,Longest Palindromic Substring,64.1,0.35648519600504125,https://leetcode.com/problems/longest-palindromic-substring,"Two Pointers, String, Dynamic Programming"
EASY,Two Sum,64.1,0.5554659416452932,https://leetcode.com/problems/two-sum,"Array, Hash Table"
EASY,Find Indices With Index and Value Difference I,64.1,0.6027904,https://leetcode.com/problems/find-indices-with-index-and-value-difference-i,"Array, Two Pointers"
MEDIUM,Longest Nice Subarray,64.1,0.6480068902543572,https://leetcode.com/problems/longest-nice-subarray,"Array, Bit Manipulation, Sliding Window"
EASY,Palindrome Number,64.1,0.5903908877435836,https://leetcode.com/problems/palindrome-number,Math
EASY,Reverse Linked List,64.1,0.7900458262975952,https://leetcode.com/problems/reverse-linked-list,"Linked List, Recursion"
MEDIUM,Find Indices With Index and Value Difference II,64.1,0.316504004004004,https://leetcode.com/problems/find-indices-with-index-and-value-difference-ii,"Array, Two Pointers"
MEDIUM,Minimize Maximum of Array,64.1,0.464174854416254,https://leetcode.com/problems/minimize-maximum-of-array,"Array, Binary Search, Dynamic Programming, Greedy, Prefix Sum"
MEDIUM,Reverse Words in a String,64.1,0.5128465966852522,https://leetcode.com/problems/reverse-words-in-a-string,"Two Pointers, String"
MEDIUM,Largest Number,64.1,0.4111627482773768,https://leetcode.com/problems/largest-number,"Array, String, Greedy, Sorting"
MEDIUM,Number of Operations to Make Network Connected,64.1,0.6436064881127875,https://leetcode.com/problems/number-of-operations-to-make-network-connected,"Depth-First Search, Breadth-First Search, Union Find, Graph"
EASY,Unique Number of Occurrences,64.1,0.7821071522522868,https://leetcode.com/problems/unique-number-of-occurrences,"Array, Hash Table"
MEDIUM,Product of Array Except Self,64.1,0.6762120715682784,https://leetcode.com/problems/product-of-array-except-self,"Array, Prefix Sum"
MEDIUM,Word Search,64.1,0.4502653530854698,https://leetcode.com/problems/word-search,"Array, String, Backtracking, Depth-First Search, Matrix"
HARD,Trapping Rain Water,64.1,0.6481247444739395,https://leetcode.com/problems/trapping-rain-water,"Array, Two Pointers, Dynamic Programming, Stack, Monotonic Stack"
MEDIUM,Second Highest Salary,64.1,0.4352420817098106,https://leetcode.com/problems/second-highest-salary,Database
